index,종류별,상황별,재료별,방법별,글 제목,레시피이름,조회수,조리시간,난이도,인분,재료,소개글,조리순서
6278,밑반찬,일상,해물류,조림,반건조오징어 피데기요리 오징어간장조림/오징어장조림,오징어장조림,"2,036",20분 이내,초급,3인분,"[('반건조오징어', '1마리'), ('꽈리고추', '10여개'), ('다시마', '1장'), ('진간장', '4스푼'), ('물', '1200ml'), ('황설탕', '1스푼'), ('식초', '1스푼'), ('식용유', '1스푼'), ('맛술', '3스푼'), ('후추', '1꼬집'), ('물엿', '1.5스푼'), ('통깨', '1스푼')]",짭조름하게 조린 우리집 스테디셀러밥도둑 반찬 오징어간장조림입니다,"[{'step_number': 1, 'description': '재료 준비해 주세요~', 'image_url': 'https://recipe1.ezmember.co.kr/cache/recipe/2023/06/15/5f2ec21d73f4638003a2b7af30648bb01.jpg'}, {'step_number': 2, 'description': '오징어는 껍질 벗기기 않고 물에 한번 헹궈 주고 몸통 안쪽 부분에 사선으로 칼집 내고 반대편에 사선으로 칼집 한번 더 내 주었어요~칼집 내 주면 양념이 잘 배는데 얇은 오징어는 칼집 안내고 바로 사용하시면 됩니다', 'image_url': 'https://recipe1.ezmember.co.kr/cache/recipe/2023/06/15/fd77f45cc77300d0de0c2710fb09d6661.jpg'}, {'step_number': 3, 'description': '칼집낸 오징어는 먹기 좋게 한입 크기로 썰어 주었어요~', 'image_url': 'https://recipe1.ezmember.co.kr/cache/recipe/2023/06/15/2731df7ff3149b0159d87eeb6251aa631.jpg'}, {'step_number': 4, 'description': '꽈리고추는 1Cm 정도 길이로 썰어 주세요~', 'image_url': 'https://recipe1.ezmember.co.kr/cache/recipe/2023/06/15/2fcb5175cf69940177af2b706568aac81.jpg'}, {'step_number': 5, 'description': '적힌 분량의 물, 진간장, 황설탕, 식초, 식용유, 맛술, 다시마를 넣고 바글 바글 끓여 주세요~', 'image_url': 'https://recipe1.ezmember.co.kr/cache/recipe/2023/06/15/c67552a836365617783ca686da4d4eb41.jpg'}, {'step_number': 6, 'description': '썰어 둔 오징어 넣어 주세요~', 'image_url': 'https://recipe1.ezmember.co.kr/cache/recipe/2023/06/15/0542acefd912d901cf344a760f4d54321.jpg'}, {'step_number': 7, 'description': '오징어에 양념이 잘 배이도록 저어가며 조려 주세요~ 5분 정도 조려 주면 양념국물이 반정도 줄어 들어요~', 'image_url': 'https://recipe1.ezmember.co.kr/cache/recipe/2023/06/15/7e68643abb58f3d7e920132080603d5b1.jpg'}, {'step_number': 8, 'description': '꽈리고추를 넣어 주세요~꽈리고추 대신 청양고추도 좋습니다', 'image_url': 'https://recipe1.ezmember.co.kr/cache/recipe/2023/06/15/55e9b7f71cdda14bd8bd4e3348a9a3631.jpg'}, {'step_number': 9, 'description': '꽈리고추에도 간이 배이도록 1분 정도 더 조려 주고 후추 약간 넣어 주세요~', 'image_url': 'https://recipe1.ezmember.co.kr/cache/recipe/2023/06/15/b1f0fed160b7fedfe64722200a4235fc1.jpg'}, {'step_number': 10, 'description': '물엿 넣고 30초 정도 더 조려 주세요~', 'image_url': 'https://recipe1.ezmember.co.kr/cache/recipe/2023/06/15/931662cba772c25b6cbf4aa106ca895f1.jpg'}, {'step_number': 11, 'description': '불끄고 통깨 넣어 한번 뒤적거려 주면 오징어장조림 완성입니다', 'image_url': 'https://recipe1.ezmember.co.kr/cache/recipe/2023/06/15/8518131297c46e9a55a9c04e088ea6241.jpg'}, {'step_number': 12, 'description': '바로 다 먹을거면 참기름도 약간 넣어 주면 좋고 두고 먹을거면 참기름 넣지 않는게 좋답니다', 'image_url': 'https://recipe1.ezmember.co.kr/cache/recipe/2023/06/15/59be535bc9edcd0c8a3c587f6c07b7f51.jpg'}]"
6279,밑반찬,일상,해물류,조림,고등어찜 찌개/ 고등어무간장조림 양념장 레시피 알려드립니다~,고등어무간장조림,"1,045",None,None,None,"[('무', ''), ('고등어', ''), ('대파', ''), ('진간장', ''), ('고춧가루', ''), ('다진마늘', ''), ('설탕', ''), ('맛술', ''), ('된장', '')]",고등어무조림 레시피 이 방법을 알고 난 후 항상 이렇게 하고 있는데요 늘~ 성공해서 맛있게 먹은 거 같아요,"[{'step_number': 1, 'description': '무를 먼저 썰어주세요. 껍질을 벗기고 너무 얇지 않게 자를게요. 얇으면 쉽게 부서지니 어느정도 두께가 있는게 낫습니다도마 , 조리용나이프무 손질법', 'image_url': 'https://recipe1.ezmember.co.kr/cache/recipe/2024/06/18/8b31a4bed0fd2751d270f221d787ffd71.jpg'}, {'step_number': 2, 'description': '냄비에 무를 깔아주시고요. 물을 넣을게요냄비 , 계량컵', 'image_url': 'https://recipe1.ezmember.co.kr/cache/recipe/2024/06/18/c5ef9b81d1249117c6911559487b97131.jpg'}, {'step_number': 3, 'description': '물은 300ml 정도면 되고요. 고등어찜 고등어찌개 할 때 밑간을 먼저해서 한답니다', 'image_url': 'https://recipe1.ezmember.co.kr/cache/recipe/2024/06/18/d61fb5b3e81dfad370c4055f1d598be51.jpg'}, {'step_number': 4, 'description': '고등어무조림 양념장 레시피 .밑간은 설탕 반스푼, 고춧가루 1T, 진간장 2T 넣고 먼저 끓여주세요 보글보글 끓어 오를 때까지 끓이면 되고요', 'image_url': 'https://recipe1.ezmember.co.kr/cache/recipe/2024/06/18/6edfbc3cf1deecb14e0cbf7373216af21.jpg'}, {'step_number': 5, 'description': '고등어찜 고등어 무 간장조림 양념장 레시피 .밑간을 졸이는 동안 만들어주세요 고춧가루 1T, 간장 5T, 설탕 1T ,고추장 반스푼, 된장 반스푼, 맛술 2T 잘~ 섞어줍니다 나중에 부족한 간은 추가를 해서 입맛에 맞추세요', 'image_url': 'https://recipe1.ezmember.co.kr/cache/recipe/2024/06/18/820a4180396fc0dbb9df60434d773ab51.jpg'}, {'step_number': 6, 'description': '무가 어느정도 졸여지면 만들어둔 양념장을 반 정도 미리 넣어주세요 그리고 위에 고등어를 올려줍니다', 'image_url': 'https://recipe1.ezmember.co.kr/cache/recipe/2024/06/18/f8abb7e7c323c0389fda39e562133d661.jpg'}, {'step_number': 7, 'description': '저는 순살로 했어요 가시가 없는게 먹기는 편하거든요 가시 있는 생물도 맛있고요 있는 걸로 준비를 해서 올려주세요', 'image_url': 'https://recipe1.ezmember.co.kr/cache/recipe/2024/06/18/0cd3509c0d76b4357c6eddd7a57a58c31.jpg'}, {'step_number': 8, 'description': '위에 남은 고등어무조림 양념장을 올려주세요 불은 중약불로 줄인 후 끓일게요', 'image_url': 'https://recipe1.ezmember.co.kr/cache/recipe/2024/06/18/d6561079605b3dae4a2aa5b9869809ee1.jpg'}, {'step_number': 9, 'description': '아~ 대파도 올려줍니다', 'image_url': 'https://recipe1.ezmember.co.kr/cache/recipe/2024/06/18/017d2446bc824707053980d78d11289b1.jpg'}, {'step_number': 10, 'description': '뚜껑을 닫고 푹~ 졸여주세요. 고등어무조림 끓이는 동안 잘~ 졸여지고 있나 확인은 해 주시고요. 양념이라 너무 오래 졸이면 탈수도 있으니까요', 'image_url': 'https://recipe1.ezmember.co.kr/cache/recipe/2024/06/18/9cf2e50eee1447836c084835cbc0e7c01.jpg'}, {'step_number': 11, 'description': '간을 더 추가 하지 않아도 될 만큼 간이 쏙~ 잘 들었네요. 적당히 짠맛과 단맛 ㅎㅎ 가시가 없는 순살이라 밥에 바로 올려서 먹기 좋은 고등어조림 레시피 입니다', 'image_url': 'https://recipe1.ezmember.co.kr/cache/recipe/2024/06/18/b79a2b7c40da86c88789d9c3112279c51.jpg'}, {'step_number': 12, 'description': '요건 먹고 남은 무를 다음에 한 번 끓여서 먹을 때가 더 간이 속까지 배겨서 맛있는 거 같아요. 저는 무만 있어도 밥 두공기 가능합니다 ㅎ 반찬 없을 때 요거 해서 드셔보세요접시', 'image_url': 'https://recipe1.ezmember.co.kr/cache/recipe/2024/06/18/d9bdb926d112bad7a749c79479fe100f1.jpg'}]"
6280,밑반찬,일상,해물류,조림,오징어 계란장조림 쫄깃쫄깃 밑반찬으로 최고네요~,오징어계란장조림,"5,582",30분 이내,아무나,6인분 이상,"[('오징어', '1마리'), ('계란', '9개'), ('통마늘', '10개'), ('꽈리고추', '10개'), ('새송이버섯', '2개'), ('식초', '1큰술'), ('소금', '1큰술'), ('간장', '1/2컵'), ('다시물', '1컵'), ('생강술', '1큰술'), ('맛술', '1큰술'), ('설탕', '1큰술'), ('올리고당', '2큰술')]","우리네 식탁에 자주 오르는 계란과 오징어로 만든 장조림입니다~~~

고기로 만든 장조림보다 쫄깃하고 더 맛있게 먹을 수 있는 맛있는 장조림을 만들었어요~~~
오징어와 새송이버섯은 쫄깃쫄깃 씹는 식감이 좋아서

자꾸만 손이 가는 중독된 맛이네요~~~




어른 아이 누구나 좋아할 수 있는 밑반찬으로 만들어놓고 나면 밥도둑이 따로 없네요~~~","[{'step_number': 1, 'description': '계란은 13분 완숙으로 삶아놓았어요~~~\n냉장고에 있던 계란은 실온에서 30분 미리 꺼내 놓았다가 \n소금 1 큰 술 식초 1 큰 술을 넣고 13분 삶으면 완숙이 되지요~~~', 'image_url': 'https://recipe1.ezmember.co.kr/cache/recipe/2016/09/26/b51d2d4e65231e118db3fdf84e74598e1.jpg'}, {'step_number': 2, 'description': '계란에 물과 간장을 넣어 끓여주면서 계란에 색깔이 나기 시작하면\n손질한 오징어를 통으로 넣고 통마늘을 넣어서 끓여주었어요~~~\n오징어는 너무 오래 삶으면 질겨지기에 오징어도 색깔이 들기 시작하면 \n꽈리고추와 올리고당을 넣어준 다음 불을 꺼주면 됩니다~~~', 'image_url': 'https://recipe1.ezmember.co.kr/cache/recipe/2016/09/26/f0a53a8bfa8e3f7855e8628db0358c461.jpg'}, {'step_number': 3, 'description': '완성된 통오징어와 계란 마늘 꽈리고추 새송이버섯을 조금씩 올려놓았어요~~~\n오징어가 질기지도 않고 부드럽고 쫄깃해서 한 마리가 너무 양이 적은 것 같더라고요~~~~', 'image_url': 'https://recipe1.ezmember.co.kr/cache/recipe/2016/09/26/a1f444b70d8124e1f3a60cf9bdc0b05d1.jpg'}, {'step_number': 4, 'description': '새송이버섯은 여러 번 장조림에 넣어봐서 알지요~~~\n쫄깃쫄깃 고기보다 못하지 않은 아주 맛있는 새송이버섯 조림입니다~~', 'image_url': 'https://recipe1.ezmember.co.kr/cache/recipe/2016/09/26/5d28a2ea29d532e149baff8cf36db2581.jpg'}, {'step_number': 5, 'description': '계란도 겉에만 색깔이 예쁘게 들고 속은 짜지 않고 포슬포슬 맛있네요~~~', 'image_url': 'https://recipe1.ezmember.co.kr/cache/recipe/2016/09/26/5de0e3920a46469431c872631fcdd7b01.jpg'}, {'step_number': 6, 'description': '한 개 집어먹으면 자꾸만 손이 가는 은근 중독된 맛이랍니다~~~\n맛있다고 자꾸 먹게 되니 다른 반찬 필요 없더라고요~~~', 'image_url': 'https://recipe1.ezmember.co.kr/cache/recipe/2016/09/26/149dacfea1b4d33d4ff6af7c9dea2be91.jpg'}, {'step_number': 7, 'description': '남편도 요런 반찬 은근 좋아하거든요~~~\n남편도 저도 너무 맛있게 먹었지요~~~\n고기로 장조림 하는 것보다 더 맛있게 먹은 오징어 장조림입니다~~~', 'image_url': 'https://recipe1.ezmember.co.kr/cache/recipe/2016/09/26/aaa62f8add06631bc86bb2930825c90f1.jpg'}, {'step_number': 8, 'description': '콜레스테롤 때문에 오징어 드시기 꺼리신다고요~~~\n걱정하지 마세요~~~~\n오징어는 콜레스테롤 흡수를 억제하는 타우린 성분이 다른 어패류보다 2~3배 많이 들어있답니다~~~\n오징어의 타우린 성분은 콜레 롤 수치를 낮추는 것 외에도 \n혈압조절, 피로 시력개선 담석 제거와 심장병 동맥경화 암 예방에 도움을 주는 물질이지요~~~\n오징어의 단백질 함량이 15%~20%나 되고\n말린 오징어는 단백질함량이 60%로 소고기보다 높다고 하네요~~~', 'image_url': 'https://recipe1.ezmember.co.kr/cache/recipe/2016/09/26/1ca4544020c6b4381bd2d1282c2d8ee01.jpg'}]"
6281,밑반찬,일상,해물류,조림,오징어랑 마늘쫑이랑~/오징어 마늘쫑말이 조림,오징어마늘쫑말이조림,"3,648",30분 이내,초급,2인분,"[('오징어', '1마리'), ('마늘쫑', '1줌'), ('굴소스', '1스푼'), ('물', '1/2컵'), ('간장', '1스푼'), ('올리고당', '1스푼'), ('생강술                                                                                또는 맛술', '1티스푼'), ('소금', '약간'), ('후추', '약간'), ('참기름', '약간'), ('깨', '약간')]",오징어속에 마늘쫑 넣어 조린 반찬인데 아삭하게 씹히는 마늘쫑과 쫄깃 쫄깃하게 씹히는 오징어맛이 서로 어우러져 은근 잘 어울리는 맛이네요~,"[{'step_number': 1, 'description': '오징어 배 안쪽에 칼을 눕혀 사선이 아닌 직선으로 칼집을 내 주세요~\n사선으로 내도 상관은 없답니다^^', 'image_url': 'https://recipe1.ezmember.co.kr/cache/recipe/2015/12/29/48cb85ee21e1cd9e8dbbfdd197757c941.jpg'}, {'step_number': 2, 'description': '오징어를 뒤집어 껍질 있는 쪽에 마늘쫑을 오징어 길이 만큼 썰어 한움큼 올려 주세요~마늘쫑은 좋아하시는 양만큼 넣어 주면 되요~', 'image_url': 'https://recipe1.ezmember.co.kr/cache/recipe/2015/12/29/9a2d596ac8f4cd7628d66aa80c9cabc61.jpg'}, {'step_number': 3, 'description': '오징어롤 돌돌 말아 풀리지 않도록 이쑤시개를 꽂아 고정해 주세요~\n이쑤시개 대신 실로 묶어 줘도 되요~', 'image_url': 'https://recipe1.ezmember.co.kr/cache/recipe/2015/12/29/9e3e7bd9bac651d6d20a7d03b1671f971.jpg'}, {'step_number': 4, 'description': '위에 적힌 양념을 넣고 팔팔 끓으면 오징어 말아둔 걸 올려 주세요~', 'image_url': 'https://recipe1.ezmember.co.kr/cache/recipe/2015/12/29/d4abb417e60a79033ed6fef687c1e6e81.jpg'}, {'step_number': 5, 'description': '양념장을 끼얹어 가며 오징어에 양념장이 골고루 배이도록 굴러가며 조려 주세요~\n간을 보고 모자란간은 소금약간 넣어 맞춰 주세요~\n다 조려지면 마지막에 참기름과 깨를 뿌려주면 되요~', 'image_url': 'https://recipe1.ezmember.co.kr/cache/recipe/2015/12/29/879e3ecb7812d32ed3d0bd89db80a7261.jpg'}, {'step_number': 6, 'description': '이쑤시개는 빼고 먹기좋게 한입 크기로 썰어 주면 되요~', 'image_url': 'https://recipe1.ezmember.co.kr/cache/recipe/2015/12/29/be4ba17cd0cba121b5e1cfcb3c7cca0b1.jpg'}]"
6282,밑반찬,일상,해물류,조림,소라 장조림~*,소라장조림,"6,470",30분 이내,아무나,6인분 이상,"[('소라(대)', '7마리'), ('파프리카(주황)', '1/3'), ('파프리카(빨강)', '1/3'), ('땡초', '2'), ('통마늘', '7'), ('물', '1컵'), ('맛간장', '7'), ('굴소스', '1'), ('올리고당', '3'), ('원당', '1'), ('후추', '톡톡'), ('맛술', '3'), ('다진생강', '1티스푼')]",소라 장조림 요런것이 밥도둑이겠쥬~,"[{'step_number': 1, 'description': '소라는 삶아 내장과 살을 분리해 반을 자른후 젓가락 부분 골을 제거해 줍니다', 'image_url': 'https://recipe1.ezmember.co.kr/cache/recipe/2017/04/03/e2bda33519cfc1dcd48314bf9c33b1331.jpg'}, {'step_number': 2, 'description': '먹기좋게 썰어 궁중팬에 담아주세요', 'image_url': 'https://recipe1.ezmember.co.kr/cache/recipe/2017/04/03/5fad84f87b34c1234157725dce84f0381.jpg'}, {'step_number': 3, 'description': '통마늘 슬라이스 해주시고\n땡초 파프리카 썰어 준비합니다', 'image_url': 'https://recipe1.ezmember.co.kr/cache/recipe/2017/04/03/fb4c37d6a4e6c2e5a450e3c126aab0401.jpg'}, {'step_number': 4, 'description': '물 종이컵 반컵 붓고 \n다진생강 빼고 위 양념을 모두 넣어 줍니다', 'image_url': 'https://recipe1.ezmember.co.kr/cache/recipe/2017/04/03/c2e5af4f519b08ec1fe080f093e030dc1.jpg'}, {'step_number': 5, 'description': '센불로 바글 바글 끊이시다가', 'image_url': 'https://recipe1.ezmember.co.kr/cache/recipe/2017/04/03/f44784a2c49fbb8fe605f2754b93814a1.jpg'}, {'step_number': 6, 'description': '중불로 약불로 서서히 조려 주시다가 준비한 마늘ᆞ고추ᆞ파프리카 넣어 주세요\n슥슥~ 저어 주시다가', 'image_url': 'https://recipe1.ezmember.co.kr/cache/recipe/2017/04/03/4a274f70c095bd1b6e4a36948db9337b1.jpg'}, {'step_number': 7, 'description': '다진생강 티스푼1 정도 넣고', 'image_url': 'https://recipe1.ezmember.co.kr/cache/recipe/2017/04/03/6caaa8486999d5b50f45f89fd5241bce1.jpg'}, {'step_number': 8, 'description': '짜작하게 조려', 'image_url': 'https://recipe1.ezmember.co.kr/cache/recipe/2017/04/03/af4006b8e6f535d51f2d185da60bc3ac1.jpg'}, {'step_number': 9, 'description': '접시에 담아 내시면 끝이예욤', 'image_url': 'https://recipe1.ezmember.co.kr/cache/recipe/2017/04/03/6a7667d2bdbbbf91d4baa315aa7dcf151.jpg'}]"
6283,밑반찬,일상,해물류,조림,오징어무조림,오징어무조림,"5,192",30분 이내,초급,2인분,"[('오징어                                                                                작은크기', '2마리'), ('꽈리고추', '1줌'), ('무', '1/4토막'), ('건고추', '1개'), ('깨', '약간'), ('물', '4컵'), ('다시마                                                                                사방10센티', '1장'), ('멸치', '10마리'), ('진간장', '3큰술'), ('설탕', '1큰술'), ('올리고당', '2큰술'), ('맛술', '2큰술'), ('다진마늘', '1/2큰술'), ('생강', '약간'), ('후추', '약간')]",오늘은 타우린 성분이 많아 피로회복에 좋은 오징어를 이용해서 반찬 만드는 방법을 알려드릴게요. 부드럽게 익은 무와 쫄깃한 오징어가 매콤 짭조름한 조림장에 어우러져 더욱 맛있는 반찬을 만들 수 있답니다~^^,"[{'step_number': 1, 'description': '재료를 준비한 다음, 오징어는 내장과 껍질을 제거하고 두툼한 링으로 썰어주세요.', 'image_url': 'https://recipe1.ezmember.co.kr/cache/recipe/2015/10/29/761940385de8431fca03ac1c625f2c6a1.jpg'}, {'step_number': 2, 'description': '무는 2센티 두께로 4등분해서 썰어주시고, 꽈리고추는 크게 반으로 어슷하게 썰어주세요. 생강은 편으로, 건고추는 어슷하게 썰어주세요.', 'image_url': 'https://recipe1.ezmember.co.kr/cache/recipe/2015/10/29/4841a0833a10deed21a365f3448589cd1.jpg'}, {'step_number': 3, 'description': '냄비에 다시물재료를 넣고 끓이다가 물이 끓어오르면 다시마를 건져주세요. 불을 중불로 줄여 3분정도 끓인 후 체에 걸러주시고, 다시물 2컵에 무를 넣고 10분정도 끓이다가 조림양념과 건고추, 생강을 넣습니다.', 'image_url': 'https://recipe1.ezmember.co.kr/cache/recipe/2015/10/29/36c9ac988ec15d3fad6257f4c024fa451.jpg'}, {'step_number': 4, 'description': '10분이상 더 끓여주세요.', 'image_url': 'https://recipe1.ezmember.co.kr/cache/recipe/2015/10/29/1dca3c124ad3f29097bc47e5bae9c6f31.jpg'}, {'step_number': 5, 'description': '오징어를 넣고 5분간 조린 후에 꽈리고추를 넣고 1분정도 더 조려주세요.', 'image_url': 'https://recipe1.ezmember.co.kr/cache/recipe/2015/10/29/023881fe5631e5ca040fe740a9529c851.jpg'}, {'step_number': 6, 'description': '접시에 담은 후 깨를 뿌려 마무리해주세요.', 'image_url': 'https://recipe1.ezmember.co.kr/cache/recipe/2015/10/29/74808ed2cb013411e738794c6a53daf11.jpg'}]"
6284,밑반찬,일상,해물류,조림,매콤하고 시원한 오징어 무조림,오징어무조림,"14,812",30분 이내,초급,2인분,"[('오징어', '1마리'), ('대파', ''), ('홍고추', '1개'), ('양파', '1/4개'), ('무', '1토막'), ('고춧가루', '2스푼'), ('진간장', '5스푼'), ('마늘다진것', '1스푼'), ('부순깨', '1/2스푼'), ('설탕', '1/2스푼'), ('후춧가루', '약간')]",쫄깃쫄깃한 오징어와 양념이 베여 부드러운 무까지 매콤하고 시원한 오징어무조림 이만한 밥도둑은 없을거에요.,"[{'step_number': 1, 'description': '오징어는 손가락 두께와 길이로 썰어주시고 고추와 대파는 어슷어슷 무는 0.5cm 두께로 잘라서 4등분 해서 썰어주세요.', 'image_url': 'https://recipe1.ezmember.co.kr/cache/recipe/2015/11/30/260620f77ca91412ca9dc7ad301611041.jpg'}, {'step_number': 2, 'description': '조림용 그릇에 종이컵으로 물 2컵 넣으시고 멸치가루 한스푼 넣습니다.', 'image_url': 'https://recipe1.ezmember.co.kr/cache/recipe/2015/11/30/ca4315bfb3d7d80273b35b58143aa4281.jpg'}, {'step_number': 3, 'description': '그리고 무를 넣어주세요.', 'image_url': 'https://recipe1.ezmember.co.kr/cache/recipe/2015/11/30/11faf44aac001b1c9be25fb32045cef81.jpg'}, {'step_number': 4, 'description': '무가 반 정도 익으면 고춧가루 2스푼, 진간장 5스푼, 마늘다진것 한스푼, 부순깨 반스푼, 설탕 반스푼, 후춧가루 약간 넣으셔서 양념을 만들어주세요.', 'image_url': 'https://recipe1.ezmember.co.kr/cache/recipe/2015/11/30/78992e6180569ee0be2441c6463e9b561.jpg'}, {'step_number': 5, 'description': '오징어와 양파 넣고 양념 얹으시고 약불로 줄입니다.', 'image_url': 'https://recipe1.ezmember.co.kr/cache/recipe/2015/11/30/3720b99c3c09c73e6230c8be7e18d82c1.jpg'}, {'step_number': 6, 'description': '양념을 수저로 섞어주시고 뚜껑을 닫아주세요. 양념이 쫄여지면서 색이 진해집니다. 마지막으로 대파와 고추 넣으시고 한번 바르르 끓여서 마무리합니다.', 'image_url': 'https://recipe1.ezmember.co.kr/cache/recipe/2015/11/30/4ef8b2338d5f890dbe6e17cb02f589351.jpg'}]"
6285,밑반찬,일상,해물류,조림,쫄깃한 매력이 물씬~ 오징어 장조림,오징어장조림,"16,105",None,None,None,"[('오징어', '1마리'), ('감자', '1개'), ('물', '1.5컵'), ('간장', '5큰술'), ('설탕', '1큰술'), ('다진마늘', '1작은술'), ('후추', '조금'), ('올리고당                                                                                또는 물엿', '1큰술'), ('참기름', '1큰술'), ('깨', '1작은술')]",쫄깃쫄깃한 식감에 양념이 어우러져 아이들도 정말 좋아하는 오징어 장조림,"[{'step_number': 1, 'description': '오징어는 다리를 잡아당겨 빼준후 오징어 몸통으로 손가락을 넣어 내장과 뼈를 빼냅니다. 그리고 굵은 소금을 살짝 끝부분에 묻히어 살살 잡아 당기며 껍질을 벗겨줍니다.', 'image_url': 'https://recipe1.ezmember.co.kr/cache/recipe/2015/04/22/beff770eda581fc5e7fce6cb2c482c961.jpg'}, {'step_number': 2, 'description': '감자는 1cm 두께로 썰어 주세요, 너무 얇게 써시면 감자가 조림을 하는동안 부숴질수 있거든요~..', 'image_url': 'https://recipe1.ezmember.co.kr/cache/recipe/2015/04/22/c6d56dbf8ffa634c709c15bcc6b807fc1.jpg'}, {'step_number': 3, 'description': '후라이팬 혹은 냄비에 감자를 넣고 감자가 잠기도록 물을 부어 줍니다. 저는 물 1컵 반을 넣었습니다. 그리고 나서 간장 5큰술, 설탕 1큰술, 다진 마늘 1작은술, 후추 조금을 넣고 끓여 줍니다.', 'image_url': 'https://recipe1.ezmember.co.kr/cache/recipe/2015/04/22/12e2177cb6f563f7d3427546f74502ee1.jpg'}, {'step_number': 4, 'description': '감자가 익는 동안 오징어는 0.5cm 두께로 썰어줍니다.', 'image_url': 'https://recipe1.ezmember.co.kr/cache/recipe/2015/04/22/419d49bdffdec54c7bf1d58c0cf610101.jpg'}, {'step_number': 5, 'description': '감자가 익으면서 조림장이 반쯤 줄어들면 오징어를 넣고 졸여 줍니다.', 'image_url': 'https://recipe1.ezmember.co.kr/cache/recipe/2015/04/22/c8b010493aa562f5cbabfe5b2a99dbb31.jpg'}, {'step_number': 6, 'description': '중간에 간을 보시고 싱거우시면 간장을 기호에 맞게 더 넣어 주세요. 조림장이 졸아 들며 오징어에 색이 들기 시작하면 올리고당 혹은 물엿을 1큰술 넣어 줍니다.', 'image_url': 'https://recipe1.ezmember.co.kr/cache/recipe/2015/04/22/b3b8c1be2beb280410bb6881665157851.jpg'}, {'step_number': 7, 'description': '조림장이 자글자글 해질때쯤.. 불을 끄기 전에 참기름 1큰술과 깨 1작은술을 넣고 마무리 해줍니다.', 'image_url': 'https://recipe1.ezmember.co.kr/cache/recipe/2015/04/22/7e70273418f16f2e29ca9b21adc76bde1.jpg'}, {'step_number': 8, 'description': '포슬거리는 감자와 쫄깃한 오징어의 만남~..오징어 장조림 완성', 'image_url': 'https://recipe1.ezmember.co.kr/cache/recipe/2015/04/22/8d0940055ebf24c89c9cedf6f318ea651.jpg'}]"
