index,종류별,상황별,재료별,방법별,글 제목,레시피이름,조회수,조리시간,난이도,인분,재료,소개글,조리순서
27867,메인반찬,일상,해물류,부침,오징어 야채전 레시피,오징어야채전,90,20분 이내,초급,4인분,"[('햄', '소량'), ('손질된 오징어', '2마리'), ('감자', '1개'), ('양파', '1/2개'), ('애호박', '1/2개'), ('고추', '2개'), ('부침가루                                                                                밥그릇', '1그릇'), ('물', '1컵')]","이번 여름은 엄청 덥고 비가 많이 내린다고 하는데, 여러분들은 비가 오면 가장 먼저 떠오르는 음식이 있나요 ? 저는 전이 가장 먼저 떠오르는데요 ! 파전, 김치전도 아닌 감자의 단맛, 오징어의 짭잘한 맛이 합쳐진 오늘은 오징어 야채전 레시피를 알려드릴게요! 감자가 들어가서 쫀듯하니 더 맛있고, 오징어는 말해뭐해요~ 완전 맛있더라고요 :)","[{'step_number': 1, 'description': '손질된 오징어 2마리를 깨끗이 씻어 부침개 반죽을 한 그릇에 넣어주세요.도마 , 조리용나이프 , 믹싱볼오징어 손질법', 'image_url': 'https://recipe1.ezmember.co.kr/cache/recipe/2024/07/10/186fdbf15d231b82aa815bc9666eed311.jpg'}, {'step_number': 2, 'description': '양파 1/2개, 감자 1개, 애호박 1/2개, 햄 소량을 채썰고, 고추 2개를 쫑쫑 작게 썰어서 넣어주세요.햄은 안 넣으셔도 무방하지만 넣으면 더 맛있어요감자 손질법', 'image_url': 'https://recipe1.ezmember.co.kr/cache/recipe/2024/07/10/bfd95e05006bda1c3092c56209223b9e1.jpg'}, {'step_number': 3, 'description': '부침가루를 밥 그릇으로 1그릇, 물 1컵을 넣어주세요.스푼재료가 골고루 섞이게 조금씩 물을 넣으며 조절해주세요.', 'image_url': 'https://recipe1.ezmember.co.kr/cache/recipe/2024/07/10/b76585178f57885daef052f99f9ed63c1.jpg'}, {'step_number': 4, 'description': '후라이팬에 기름을 두르고 반죽을 골고루 펴주세요.프라이팬', 'image_url': 'https://recipe1.ezmember.co.kr/cache/recipe/2024/07/10/3905f2e3b53617a977dea116f9bf8dc71.jpg'}, {'step_number': 5, 'description': '앞•뒤로 뒤집어 가며 반죽을 노릇하고, 바삭하게 구워주세요.뒤집개 , 접시', 'image_url': 'https://recipe1.ezmember.co.kr/cache/recipe/2024/07/10/4f15f6b82153d5f0343afc22bdd4fe591.jpg'}]"
27868,메인반찬,일상,해물류,부침,동태전 만들기 명태전 부서지지 않고 쫀득하게!,동태전,"1,489",60분 이내,아무나,4인분,"[('동태포', '400g'), ('부침가루', '1컵'), ('전분가루', '1컵'), ('계란', '2개'), ('맛술', '3큰술'), ('소금', '조금'), ('후추', '조금')]","동태전 만들기, 반찬으로 먹기 좋은데요, 부서지지 않게 만드는법과 비린내 제거하는 팁까지 알려드려요:)","[{'step_number': 1, 'description': '동태포는 자연해동 후 한번 씻어서 물기를 빼 줍니다.\n\n\n                        \n                            청정한상 동태포 명태포 슬라이스 300g', 'image_url': 'https://recipe1.ezmember.co.kr/cache/recipe/2023/06/08/a35c253ce412e7916cf520b1f77279631.jpg'}, {'step_number': 2, 'description': '맛술 3큰술 정도 뿌려서 비린내를 제거해 주어요.', 'image_url': 'https://recipe1.ezmember.co.kr/cache/recipe/2023/06/08/4bf47b2907af1ed29fbe32bec4fa0a391.jpg'}, {'step_number': 3, 'description': '소금과 후추도 적당량 뿌려서 밑간을 해 줍니다. 그리고 물기가 빠지도록 그대로 둡니다.', 'image_url': 'https://recipe1.ezmember.co.kr/cache/recipe/2023/06/08/b6d76daf90ee059b6dbfe39c828efd801.jpg'}, {'step_number': 4, 'description': '남은 물기는 키친타올의 힘을 빌립니다. 톡톡 눌러주면서 물기를 꼼꼼하게 제거합니다. 동태포의 수분을 꼼꼼하게 제거해야 동태전 만들기 할 때 부서지지 않고 모양이 온전하게 붙어있어요~ 수분 제거가 제대로 되지 않으면 흐물흐물.. 나중에 동태전을 부쳐놓으면 살이 다 부서지고 흐물거리게 돼요.', 'image_url': 'https://recipe1.ezmember.co.kr/cache/recipe/2023/06/08/e0f3cf985e12768bc94f5d64a56dbdeb1.jpg'}, {'step_number': 5, 'description': '부침가루와 전분가루를 반반씩, 1:1 비율로 섞어서 사용합니다.', 'image_url': 'https://recipe1.ezmember.co.kr/cache/recipe/2023/06/08/d40ded29f9cc6b930df9969f19c8b0871.jpg'}, {'step_number': 6, 'description': '계란 2개를 깨뜨려 잘 풀어주고, 좀 더 매끈한 계란옷을 위해서 체에 한번 내려도 좋아요.', 'image_url': 'https://recipe1.ezmember.co.kr/cache/recipe/2023/06/08/aecf46a4908a8547c8177e560b2213191.jpg'}, {'step_number': 7, 'description': '가루에 동태포를 올려 잘 묻혀줍니다.', 'image_url': 'https://recipe1.ezmember.co.kr/cache/recipe/2023/06/08/a2fa23f2b6911f398f605d557a8e625f1.jpg'}, {'step_number': 8, 'description': '계란물을 앞뒤로 잘 입혀 준 다음,', 'image_url': 'https://recipe1.ezmember.co.kr/cache/recipe/2023/06/08/dcc5295de6f964944b3ff34aeec67b661.jpg'}, {'step_number': 9, 'description': '예열한 팬에 기름을 두른 후 동태포를 올려줍니다.', 'image_url': 'https://recipe1.ezmember.co.kr/cache/recipe/2023/06/08/8c8ac54883fda959783061e29972fb0d1.jpg'}, {'step_number': 10, 'description': '앞뒤로 노릇노릇하게 구워줍니다. 하나도 부서지지 않고 모양이 잘 유지되었어요.동태전이 앞뒤로 노릇하게 잘 익었으면 들기름 1큰술을 넣어 골고루 발라보세요.\n그러면 동태전의 향과 맛이 더욱 좋아요.', 'image_url': 'https://recipe1.ezmember.co.kr/cache/recipe/2023/06/08/1a6f763b8b0debe048d8c197e0ac0cb91.jpg'}, {'step_number': 11, 'description': '동태전 살이 하나도 부서지지 않고, 튀김옷도 전혀 벗겨짐 없이 아주 잘 만들어졌는데요, 전분가루를 섞어서 튀김옷도 더 쫀득하고 맛있어요.', 'image_url': 'https://recipe1.ezmember.co.kr/cache/recipe/2023/06/08/e528e250133bd58e31351e897d86642b1.jpg'}, {'step_number': 12, 'description': '동태전 만들기 할 때 기억할 꿀팁은요, 1. 맛술로 비린내 제거 2. 소금과 후추로 밑간하기 3. 물기 충분히 제거하기 4. 튀김옷은 밀가루(또는 부침가루)+전분가루 1:1 5. 익힌 후에 들기름 한큰술 둘러 굽기 이것만 기억하시면 맛있는 동태전 만들기 성공입니다!', 'image_url': 'https://recipe1.ezmember.co.kr/cache/recipe/2023/06/08/bc69e28dd9b0debb4873e31d531c6a4e1.jpg'}]"
27869,메인반찬,일상,해물류,부침,동태전 생선전 만들기,동태전,457,30분 이내,아무나,3인분,"[('동태포', '400g'), ('홍고추', '1개'), ('청양고추', '2개'), ('소금', '약간'), ('후추', '약간'), ('부침가루', '3~4스푼'), ('계란', '2개'), ('식용유', '넉넉하게')]",담백하면서도 고소한 맛을 자랑하는 동태전 만들기 알려드릴게요 : ),"[{'step_number': 1, 'description': '냉동 동태포는 미리 하루 전날 냉장실로 옮겨 천천히 해동한 뒤 사용하는 것이 가장 좋은 방법이에요. 해동이 덜 된 동태포를 억지로 떼어내면 부서지게 되므로 시간이 부족하다면 어느정도 녹여서 물에 10분간 담가 살살 떼어내시면 돼요.채반', 'image_url': 'https://recipe1.ezmember.co.kr/cache/recipe/2024/02/22/5120b6c019e3be5f909f3a91cc6f328a1.jpg'}, {'step_number': 2, 'description': '해동된 것은 체에 밭쳐 흐르는 물에 가볍게 헹구어준 뒤 키친타월로 물기를 꼼꼼하게 제거하고 사용하세요.쟁반 , 키친타올', 'image_url': 'https://recipe1.ezmember.co.kr/cache/recipe/2024/02/22/6440886952680f76241c98da2aabe35a1.jpg'}, {'step_number': 3, 'description': '소금, 후추를 골고루 뿌려 밑간을 해주면 생선 살이 단단해져서 쉽게 부서지지 않는답니다.', 'image_url': 'https://recipe1.ezmember.co.kr/cache/recipe/2024/02/22/5ec3099638eaa7612cfc87287c4581d11.jpg'}, {'step_number': 4, 'description': '홍고추와 청양고추는 길쭉하게 반으로 갈라 씨를 제거한 뒤 잘게 썰어 계란과 함께 섞어주세요.도마 , 조리용나이프', 'image_url': 'https://recipe1.ezmember.co.kr/cache/recipe/2024/02/22/7c79895f8ee849f5274181d5853e298d1.jpg'}, {'step_number': 5, 'description': '홍고추와 청양고추는 생략해도 된답니다 : )볼 , 요리스푼', 'image_url': 'https://recipe1.ezmember.co.kr/cache/recipe/2024/02/22/b5bee8c2b30a92b581fc65f00a1d74811.jpg'}, {'step_number': 6, 'description': '부침가루를 앞뒤로 골고루 입혀주세요.', 'image_url': 'https://recipe1.ezmember.co.kr/cache/recipe/2024/02/22/b2894f1cc2a956e019cfc274db036c311.jpg'}, {'step_number': 7, 'description': '계란물도 골고루 묻혀주세요.', 'image_url': 'https://recipe1.ezmember.co.kr/cache/recipe/2024/02/22/57c3d2397f3990f22394e17a406fa3a41.jpg'}, {'step_number': 8, 'description': '팬에 식용유를 넉넉하게 두르고 중약불에 예열한 뒤 앞뒤로 노릇노릇하게 구워주세요. 계란물에 있는 고추가 부족하면 숟가락으로 떠서 얹어주세요.프라이팬', 'image_url': 'https://recipe1.ezmember.co.kr/cache/recipe/2024/02/22/f57542c6f371dbdce1dbbbf9399a4aaa1.jpg'}, {'step_number': 9, 'description': '바닥면이 노릇노릇하게 구워지면 뒤집어서 5초 정도 구워주세요. 접시에 담았을 때 보이는 부분은 살짝만 익혀야 비주얼이 좋답니다.뒤집개', 'image_url': 'https://recipe1.ezmember.co.kr/cache/recipe/2024/02/22/257238792349da5b1495adbe837120dc1.jpg'}, {'step_number': 10, 'description': '생선 살은 금세 익기 때문에 오래 굽지 않아도 돼요. 전체적으로 노릇노릇하게 구워졌다면 완성이에요.', 'image_url': 'https://recipe1.ezmember.co.kr/cache/recipe/2024/02/22/575047b0c268c2073740f7b65a4eae9c1.jpg'}, {'step_number': 11, 'description': '완성된 것은 키친타월 위에 올려 기름을 빼고 드시면 돼요.', 'image_url': 'https://recipe1.ezmember.co.kr/cache/recipe/2024/02/22/d03ac5efa3baddef8652dc7b2499801c1.jpg'}]"
27870,메인반찬,일상,해물류,부침,동글동글 애호박굴전,애호박굴전,146,30분 이내,초급,2인분,"[('애호박', '1/2개'), ('굴', '150g'), ('달걀', '1개'), ('부침가루', '1T'), ('아보카도유', '약간')]","제철 굴을 가족들에게 먹이고 싶은데, 가족들이 전부 굴을 별로 좋아하지 않아요. 평소에 애호박전을 맛있게 먹는 편이라 애호박전 가운데에 굴을 쏙 넣어서 부쳐보았어요.","[{'step_number': 1, 'description': '애호박 씻기 식초나 베이킹소다를 넣은 물에 애호박을 잠시 담갔다가 흐르는 물에 깨끗하게 씻어주세요도마 , 조리용나이프', 'image_url': 'https://recipe1.ezmember.co.kr/cache/recipe/2024/02/22/0f6dc743766e1b24d3b24528dc6fecaa1.jpg'}, {'step_number': 2, 'description': '애호박 손질 가운데를 동그랗게 파 줍니다. 저는 쿠키틀 이용했어요.쿠키틀애호박 손질법 레시피', 'image_url': 'https://recipe1.ezmember.co.kr/cache/recipe/2024/02/22/e66b41a135b8c7b1fcc0cf35cd44a4ed1.jpg'}, {'step_number': 3, 'description': '애호박을 달걀물에 적셔 아보카도 오일 두른 팬에 부쳐주세요.볼 , 프라이팬 , 요리스푼', 'image_url': 'https://recipe1.ezmember.co.kr/cache/recipe/2024/02/22/ae36f0f31708bbc0a1aa733328fd972d1.jpg'}, {'step_number': 4, 'description': '쌀가루 살짝 묻힌 굴을 달걀물에 적셔 주세요. 부침가루 이용하셔도 좋아요.요리젓가락', 'image_url': 'https://recipe1.ezmember.co.kr/cache/recipe/2024/02/22/50d256521c0c0bb83054f2e9ee3af4d61.jpg'}, {'step_number': 5, 'description': '달걀물 입힌 굴을 애호박 가운데에 넣어주세요.', 'image_url': 'https://recipe1.ezmember.co.kr/cache/recipe/2024/02/22/ab025345e270b8ccdc4741c7cae9335e1.jpg'}, {'step_number': 6, 'description': '중불에 앞뒤로 노릇하게 익혀주세요.', 'image_url': 'https://recipe1.ezmember.co.kr/cache/recipe/2024/02/22/859f25e94f74e8f0dfd49b8e7d34e5a61.jpg'}]"
27871,메인반찬,일상,해물류,부침,홍합 파전 만드는 법,홍합파전,504,20분 이내,초급,2인분,"[('홍합', '20개'), ('쪽파', '20-30개'), ('청양고추', '1개'), ('홍고추', '1개'), ('부침가루', '1컵'), ('물', '1/2컵'), ('홍합 국물', '1/3컵'), ('오일', '넉넉하게')]","싱싱하고 통통하게 살오른 홍합을 칼로 껍질을 까서 알맹이만 발라내 홍합파전을 만들었어요. 시중에서 알맹이를 까서 파는 걸 사용하면 훠얼씬 편하고요. 홍합이 껍질이 얇아 칼로 알맹이를 깔 때 조심해야 하긴 하지만 알맹이가 굵어서 금방 양을 채울 수 있어요. 방금 알맹이를 빼서 하면 번거롭긴 하지만 확실히 신선도는 더 좋아요. 홍합을 까다 보면 홍합 국물도 많이 나오는데 버리지 말고 윗물만 따라 반죽에 넣어서 홍합 맛을 더해요. 홍합이 감칠맛을 내주는 재료라 다른 해물 안넣고 전를 부쳐도 해물파전맛을 낼 수 있어요. 오징어나 낙지나 조갯살, 새우등 다른 해물 재료가 있으면 추가해도 더 맛나겠죠. 냉파 채소 활용해서 만들기도 좋은 전요리고 명절에 남은 재료 쓸어 넣고 부쳐도 맛있어요. ​","[{'step_number': 1, 'description': '홍합은 깨끗이 2-3번 씻어 주고 족사는 떼어 내요.', 'image_url': 'https://recipe1.ezmember.co.kr/cache/recipe/2024/02/08/44914e845dcd4119cd6d688fbccaa3841.jpg'}, {'step_number': 2, 'description': '홍합의 안쪽 면에 칼을 조심해서 집어넣고 벌려주세요. 칼을 조심해서 집어넣어야 해요.과도', 'image_url': 'https://recipe1.ezmember.co.kr/cache/recipe/2024/02/08/a24e5f38ca028c7ed85efc9a367a1cd11.jpg'}, {'step_number': 3, 'description': '양쪽 윗면과 아래 부분을 살살 긁어 껍질에서 살을 분리해 주세요 .', 'image_url': 'https://recipe1.ezmember.co.kr/cache/recipe/2024/02/08/e066cd81d12e0e2026c69d2a12f240b71.jpg'}, {'step_number': 4, 'description': '알맹이와 나오는 국물도 모아 놓아요.', 'image_url': 'https://recipe1.ezmember.co.kr/cache/recipe/2024/02/08/1631f3eb1d46ef5e97d86ba47d33d6541.jpg'}, {'step_number': 5, 'description': '파를 다듬어 씻어 체에 건져 물기를 빼주세요.', 'image_url': 'https://recipe1.ezmember.co.kr/cache/recipe/2024/02/08/0e9927257cc8817d4eca984094155a3d1.jpg'}, {'step_number': 6, 'description': '파를 5cm 정도 길이로 잘라 주세요.도마 , 조리용나이프 , 믹싱볼', 'image_url': 'https://recipe1.ezmember.co.kr/cache/recipe/2024/02/08/42993802cfb414a077e84887640ebc7e1.jpg'}, {'step_number': 7, 'description': '홍합 국물도 같이 넣어 주세요.', 'image_url': 'https://recipe1.ezmember.co.kr/cache/recipe/2024/02/08/0e05ca021234e7b174387a8924c3ea8c1.jpg'}, {'step_number': 8, 'description': '고추도 썰어 넣고 부침가루 넣고 물 넣고 반죽해요. 밀가루 최대 조금 넣고 재료가 접착될 만큼 반죽했어요.요리스푼', 'image_url': 'https://recipe1.ezmember.co.kr/cache/recipe/2024/02/08/646c18a3d0d890ecf88b38c498023f1a1.jpg'}, {'step_number': 9, 'description': '달군 후라이팬에 기름을 넉넉히 두르고 반죽을 얇게 펴주세요. 윗면에도 오일을 한바퀴 둘러 주세요.프라이팬', 'image_url': 'https://recipe1.ezmember.co.kr/cache/recipe/2024/02/08/5b25df00ef0b5cdbb5e7b5d8e6503cb41.jpg'}, {'step_number': 10, 'description': '노릇노릇 구워주고 스냅으로 살살 앞뒤로 흔들다 위로 던져 올려 과감하게 뒤집어 주세요.뒤집개', 'image_url': 'https://recipe1.ezmember.co.kr/cache/recipe/2024/02/08/90e8dd3d2c115391854c6b57a01533921.jpg'}, {'step_number': 11, 'description': '막걸리 안주로 넘 잘 어울리죠.접시', 'image_url': 'https://recipe1.ezmember.co.kr/cache/recipe/2024/02/08/324ab63596c065b64e70fe30807e76591.jpg'}]"
27872,메인반찬,일상,해물류,부침,두돌 아기 명절 메뉴 동태전 생선반찬 유아식 만들기,동태전,246,None,None,None,"[('동태포', '400g'), ('밀가루', '3-4컵'), ('계란', '2개'), ('청주', '2T')]",친정엄마가 명절이 되면 늘 만들어 주던 음식 중 하나 동태전! 둥이들에게 추석 기념 생선반찬으로 두돌아기 유아식 만들어봤어요.,"[{'step_number': 1, 'description': '* 소금간 따로 하지 않았어요. 간을 하려면 포에 미리 밑간해 놓고 일정시간 재워 놓으면 됩니다. 얼어있는 재료 사용하실 예정이라면 전날에 냉동실에서 냉장실로 옮겨놔주세요. 굽기 좋을 정도로 자동 해동된답니다. 해동된 살을 청주 2숟갈을 넣고 재워두며 잡내를 제거하고요. (약 20분) 간을 하실 예정이라면 이 과정에서 해주시면 됩니다.', 'image_url': 'https://recipe1.ezmember.co.kr/cache/recipe/2023/10/26/1f9a970190a82be5632fa3410e6af1761.jpg'}, {'step_number': 2, 'description': '밀가루를 준비해 살 겉면에 얇게 한장한장 발라줍니다. 가루가 잘 발려있지 않으면 나중에 달걀옷 입히기 힘들어요~ 꼼꼼하게 밀가루옷 입혀주세요!볼', 'image_url': 'https://recipe1.ezmember.co.kr/cache/recipe/2023/10/26/f7b8c584a5ea994eef0beb76f2a3d3fd1.jpg'}, {'step_number': 3, 'description': '이 정도 양이 나옵니다.', 'image_url': 'https://recipe1.ezmember.co.kr/cache/recipe/2023/10/26/fac177516543c279c97b38f92c62fb4e1.jpg'}, {'step_number': 4, 'description': '계란 2개 풀어서 계란물 준비해 놓고요.', 'image_url': 'https://recipe1.ezmember.co.kr/cache/recipe/2023/10/26/25beefe743309816d62aec1fd62ff4d51.jpg'}, {'step_number': 5, 'description': '프라이팬에 기름 살짝 두른 후 계란물 발라서 팬에 올려줍니다.프라이팬 , 뒤집개', 'image_url': 'https://recipe1.ezmember.co.kr/cache/recipe/2023/10/26/043fe29b2b2dd2b6eb1d45f3b4c5c2151.jpg'}, {'step_number': 6, 'description': '중간불에서 약한불로 조절해가며 은근하게 서서히 익혀주시면 됩니다.', 'image_url': 'https://recipe1.ezmember.co.kr/cache/recipe/2023/10/26/ba464caa42c17f2330deea1e97bdb49b1.jpg'}, {'step_number': 7, 'description': '전 하나 굽는 것만으로도 온 집안이 명절 분위기로 가득했어요. 고소한 냄새에 리리 남매도 엄마 옆에 와서 빨리 밥 달라고 난리였답니다. 굽자마자 바로 먹는 전은 언제 먹어도 맛있잖아요.완성접시', 'image_url': 'https://recipe1.ezmember.co.kr/cache/recipe/2023/10/26/b7cc042a961cb62897ee4e9bac8c6ce01.jpg'}]"
27873,메인반찬,일상,해물류,부침,대하전/새우전 만드는 법/새우 내장 빼내는 법/꼬리가 반듯하고 쭉 뻗은 예쁜 새우 전 만들기,새우전,"2,096",60분 이내,중급,3인분,"[('새우', '25마리'), ('소주', '2큰술'), ('후추', '톡톡'), ('계란', '6개'), ('부침가루', '2컵'), ('식용유', '약간'), ('소금', '1꼬집')]","새우는 찜, 구이, 전으로 요리에 많이 활용해서 먹고 있습니다. 타우린, 키토산, 등의 단백질, 무기질 함량이 높아 뇌건강, 어린이 성장 발육 등 건강에 다방면으로 도움을 주는 식 재료 입니다. 내장을 빼는 법과 꼬리가 반듯하고 쭉 뻗어 예쁜 새우 전 만드는 법을 소개하겠습니다.","[{'step_number': 1, 'description': '구입할 때 새우를 껍질을 벗겨 손질해 왔습니다. 손질하고 세척하고 왔지만 한 번 더 헹구어 주었답니다.새우 손질법 레시피', 'image_url': 'https://recipe1.ezmember.co.kr/cache/recipe/2023/11/03/2b434ff76d4481fb7b26024f6473b4351.jpg'}, {'step_number': 2, 'description': '새우 배 쪽에 붙어있는 검은 줄 같은 것은 새우의 내장인데 내장을 빼내기 위해서 배 쪽에 있는 검은 줄을 꼬챙이로 빼내어 버립니다.이쑤시개', 'image_url': 'https://recipe1.ezmember.co.kr/cache/recipe/2023/11/03/f3ab65e4f7dbf6dc558dd25e296cd9701.jpg'}, {'step_number': 3, 'description': '내장을 빼내고 등 쪽을 칼로 가른 후 펴놓고 두드리면서 칼집을 내어 줍니다. 그래야 구웠을 때 오그라들지 않고 예쁘게 전이 부쳐진답니다.도마 , 조리용나이프', 'image_url': 'https://recipe1.ezmember.co.kr/cache/recipe/2023/11/03/52ac4d7eb53c92969300f9b7e5c3b72e1.jpg'}, {'step_number': 4, 'description': '새우 꼬리는 중간에 있는 것을 떼어 버리고 나머지 꼬리는 칼로 긁어 정리해 주면 구웠을 때 꼬리가 반듯하고 예쁘게 됩니다.', 'image_url': 'https://recipe1.ezmember.co.kr/cache/recipe/2023/11/03/43f58af0285135b68bcf2a770fca35581.jpg'}, {'step_number': 5, 'description': '다 정리되면 소금 한 꼬집과 소주와 후춧가루를 뿌려 밑 간을 해 줍니다.정종이나 소주를 뿌리면 안 좋은 냄새 없애준답니다.', 'image_url': 'https://recipe1.ezmember.co.kr/cache/recipe/2023/11/03/e48a3f4220bd49a545a4d1fe44ef04481.jpg'}, {'step_number': 6, 'description': '계란을 골고루 잘 풀어 준비합니다. 부침 가루에 간이 되어 있어 소금은 넣지 않았습니다.볼 , 요리스푼', 'image_url': 'https://recipe1.ezmember.co.kr/cache/recipe/2023/11/03/88b3142a3eb192445e1c37a90577d7da1.jpg'}, {'step_number': 7, 'description': '꼬리 쪽을 남기고 부침 가루를 새우의 앞, 뒷면에 골고루 묻혀 줍니다.쟁반 , 트레이', 'image_url': 'https://recipe1.ezmember.co.kr/cache/recipe/2023/11/03/5b250783f9def13628d3281da7eb9fc31.jpg'}, {'step_number': 8, 'description': '부침 가루 묻힌 새우를 계란 물을 꼬리만 남기고 적신 후, 달구어진 팬에 새우를 사이를 띄워 주면서 놓고 중 불에서 구워 줍니다.프라이팬 , 요리젓가락 , 뒤집개', 'image_url': 'https://recipe1.ezmember.co.kr/cache/recipe/2023/11/03/cfda957d8d8b4752e54e302e985ee24e1.jpg'}, {'step_number': 9, 'description': '한 쪽 면이 익으면 뒤집어 노릇하게 구워 줍니다. 꼬리가 오그라들지 않고 꽃이 활짝 핀 것 같이 반듯하게 되었지요', 'image_url': 'https://recipe1.ezmember.co.kr/cache/recipe/2023/11/03/8cde2d7fa1146e3906b05e17d9360cba1.jpg'}, {'step_number': 10, 'description': '노릇노릇하게 알맞게 구워진 새우를 그릇에 옮겨 담아 줍니다.완성접시', 'image_url': 'https://recipe1.ezmember.co.kr/cache/recipe/2023/11/03/62ac51262939f6e3b39ffe9aee2eb13c1.jpg'}, {'step_number': 11, 'description': '고소하면서 바삭바삭하고 속살이 탱글한 식 감이 느껴졌습니다.', 'image_url': 'https://recipe1.ezmember.co.kr/cache/recipe/2023/11/03/72f1197c965d2b2dd24d05cd44d9d15c1.jpg'}, {'step_number': 12, 'description': '콜레스테롤을 낮추고 뇌 건강과 피로 회복, 면역력 증진에 도움이 되는 등 우리 몸에 좋은 영양소가 많이 함유된 새우로 반듯하고 쭉 뻗은 예쁜 전을 만들어 보세요!', 'image_url': 'https://recipe1.ezmember.co.kr/cache/recipe/2023/11/03/c431d4b5536fd7c31124b8c711adf1c31.jpg'}]"
