index,종류별,상황별,재료별,방법별,글 제목,레시피이름,조회수,조리시간,난이도,인분,재료,소개글,조리순서
59968,면/만두,일상,소고기,끓이기,차돌박이 즉석떡볶이 이젠 사먹지 마세요:),차돌박이즉석떡볶이,"2,508",30분 이내,아무나,4인분,"[('냉동만두', ''), ('양파', ''), ('양배추', ''), ('어묵', ''), ('쌀떡', ''), ('깻잎', ''), ('대파', ''), ('차돌박이', ''), ('옥수수캔', ''), ('김가루', ''), ('밥', ''), ('참기름', ''), ('설탕', ''), ('고춧가루', ''), ('고추장', ''), ('간장', ''), ('물', ''), ('춘장', '')]",차돌박이 즉석떡볶이가 유행하던때 호기심에 집에서 만들다가 주변지인들에게도 대접하는 하나의 요리가 되었어요:),"[{'step_number': 1, 'description': '궁중팬에 냉동만두 고기만두를 \n몇개 넣습니다.\n푸~욱 익으면 고기육수가 됩니다.', 'image_url': 'https://recipe1.ezmember.co.kr/cache/recipe/2019/08/01/d61e2f143cecabb457520d74fa91bb8a1.jpg'}, {'step_number': 2, 'description': '양파 한개를 썰어서 넣습니다.', 'image_url': 'https://recipe1.ezmember.co.kr/cache/recipe/2019/08/01/19271f4b406fce26e80cd58efcb179ee1.jpg'}, {'step_number': 3, 'description': '그 위에 양배추도 썰어 넣습니다.', 'image_url': 'https://recipe1.ezmember.co.kr/cache/recipe/2019/08/01/9b51a165be4b90a39c5d529faa0c4b0e1.jpg'}, {'step_number': 4, 'description': '사각어묵도 썰어 넣습니다.', 'image_url': 'https://recipe1.ezmember.co.kr/cache/recipe/2019/08/01/0d535ba25a2223d4131d4b31b2d4cd6e1.jpg'}, {'step_number': 5, 'description': '쌀떡은 눌러 붙을 수 있으니 오뎅 위에 넣습니다.', 'image_url': 'https://recipe1.ezmember.co.kr/cache/recipe/2019/08/01/ac0a443036f74e3d6f92dd489350d1731.jpg'}, {'step_number': 6, 'description': '깻잎도 넣어줍니다.', 'image_url': 'https://recipe1.ezmember.co.kr/cache/recipe/2019/08/01/d142d567dd6df6a315fc6b2621ac70b91.jpg'}, {'step_number': 7, 'description': '대파도 썰어 넣어줍니다.', 'image_url': 'https://recipe1.ezmember.co.kr/cache/recipe/2019/08/01/b2003e876795983f3fe4e7dcf26816f21.jpg'}, {'step_number': 8, 'description': '양념장을 넣어줍니다.\n양념장은 종이컵으로 계량\n설탕1컵 \n고춧가루1컵 \n고추장3분의2컵\n간장2분의1컵\n물1컵\n춘장1스푼\n이렇게 만들면 8인분 양념장이 됩니다.\n인원수에 맞게 넣어주세요.', 'image_url': 'https://recipe1.ezmember.co.kr/cache/recipe/2019/08/01/409357fe1ba0e5474e0a535af4a9b7af1.jpg'}, {'step_number': 9, 'description': '물을 자작하게 부어줍니다.', 'image_url': 'https://recipe1.ezmember.co.kr/cache/recipe/2019/08/01/ef24dcae18498a72b35c0fa7978b37f41.jpg'}, {'step_number': 10, 'description': '물은 이렇게 살짝 잠길 정도만', 'image_url': 'https://recipe1.ezmember.co.kr/cache/recipe/2019/08/01/128b1f90de40dbcd3e93c5cdb23f0e7c1.jpg'}, {'step_number': 11, 'description': '차돌박이를 위에 얹어 줍니다.', 'image_url': 'https://recipe1.ezmember.co.kr/cache/recipe/2019/08/01/46de88a4fdb89ea1ded92168158af28c1.jpg'}, {'step_number': 12, 'description': '가스불을 켜고 익혀 줍니다.\n인덕션이나 휴대용 가스렌지가 있다면 식탁에서 익혀서 드세요.', 'image_url': 'https://recipe1.ezmember.co.kr/cache/recipe/2019/08/01/0bc5328800eb1a0c1ba6fd0e879013a51.jpg'}, {'step_number': 13, 'description': '이렇게 양념장이 골고루 베어가며 \n끓어 오르면 불을 줄이세요.', 'image_url': 'https://recipe1.ezmember.co.kr/cache/recipe/2019/08/01/1b34e7b9141ecb94bd1081943e5f888b1.jpg'}, {'step_number': 14, 'description': '떡은 나중에 드시고 고기먼저 \n먹습니다.', 'image_url': 'https://recipe1.ezmember.co.kr/cache/recipe/2019/08/01/19f25ff5401e3fb55e2d7b746603c8831.jpg'}, {'step_number': 15, 'description': '차돌박이는 오래 익으면 \n질겨집니다.', 'image_url': 'https://recipe1.ezmember.co.kr/cache/recipe/2019/08/01/1568e256e3557f7bfb43064e3628744c1.jpg'}, {'step_number': 16, 'description': '오뎅도 드시고요.', 'image_url': 'https://recipe1.ezmember.co.kr/cache/recipe/2019/08/01/38e1f16f7dcc8b2eaa40ed6621a9ab611.jpg'}, {'step_number': 17, 'description': '떡볶이 떡도 드시고요.', 'image_url': 'https://recipe1.ezmember.co.kr/cache/recipe/2019/08/01/d5e62c1a45b786cd4c3121102cea9cdd1.jpg'}, {'step_number': 18, 'description': '남은 국물을 이용해서 볶음밥도 \n만들어 줍니다.\n밥두공기에\n캔 국물버리고 옥수수만 넣어줍니다.', 'image_url': 'https://recipe1.ezmember.co.kr/cache/recipe/2019/08/01/70b9f8e3ba6ff2daf1704c9b0d8392631.jpg'}, {'step_number': 19, 'description': '김가루도 듬뿍 넣어줍니다.', 'image_url': 'https://recipe1.ezmember.co.kr/cache/recipe/2019/08/01/91e9490cc83923c64d9549868c5a67781.jpg'}, {'step_number': 20, 'description': '잘 비벼주다가 참기름도 넣어줍니다.', 'image_url': None}, {'step_number': 21, 'description': '살짝 수분을 날려주며 누룽지를 만들어 불을 끄고 볶음밥 완성!!!', 'image_url': None}]"
59969,면/만두,일상,소고기,끓이기,소고기 잔치국수,소고기잔치국수,947,15분 이내,초급,1인분,"[('소면', '1인분'), ('중멸치', '10마리'), ('소고기', '50g'), ('양파', '1/4개'), ('당근', '조금'), ('느타리버섯', '2~3가닥'), ('달걀', '1개'), ('우유', '1T'), ('김치', '1줌'), ('조미김', '2장'), ('식용유', ''), ('꽃소금', '2꼬집'), ('양조간장', '1t'), ('원당                                                                                또는 설탕', '1t'), ('미향', '1t'), ('고추가루', '1t'), ('참기름', '1t'), ('깨소금', '1t'), ('양조간장', '1T'), ('고추가루', '1/2t'), ('참기름', '1/2t'), ('깨소금', '1/2t')]",후루룩 냠냠 맛있게 푸짐하게 먹어요,"[{'step_number': 1, 'description': '남비에 2/3 분량의 물을 넣고 끓으면 마른 소면 1인분(100원짜리 동전크기의양)을 넓게 펼쳐서 넣고 요리젓가락으로 골고루 저어주세요 물이 끓어오르면 찬물 1컵을 넣고 좀더 끓여주세요 의외로 빨리 익지 않으니 속까지 익었는지 한가닥 찬물에 담갔다가 먹어보고 다 익었으면 재빨리 찬물에 면을 건져서 넣고 채망에 건져서 서너번 손끝과 손바닥으로 찬물에 비벼서 탱글탱글한 면을 준비합니다', 'image_url': 'https://recipe1.ezmember.co.kr/cache/recipe/2022/10/03/68ab7f5c9799e799c3177854098ddc271.jpg'}, {'step_number': 2, 'description': '당근 양파를 채썰고 느타리버섯을 길이로 찢어 주세요 샤브샤브 소고기를 얇게 펴주세요 소고기는 간장 1t 설탕 1t 미향1t 로 밑간해 둡니다', 'image_url': 'https://recipe1.ezmember.co.kr/cache/recipe/2022/10/03/9b31792c7d39ac09f33f00c851e82bc61.jpg'}, {'step_number': 3, 'description': '야채에 꽃소금 두꼬집 뿌리고 식용유 1T 두르고 볶아주세요', 'image_url': 'https://recipe1.ezmember.co.kr/cache/recipe/2022/10/03/7dbfc1b5ec4f7930d8baf5f6ab078a081.jpg'}, {'step_number': 4, 'description': '야채를 썰기 전에 내장을 제거한 멸치에 물 600ml 넣고 센불에 끓여주세요 멸치 냄새가 나면 불을 줄이고 좀더 끓여주세요', 'image_url': 'https://recipe1.ezmember.co.kr/cache/recipe/2022/10/03/6507b3a6d22ab134203e9d11cc190c991.jpg'}, {'step_number': 5, 'description': '익은 고기와 야채를 한쪽으로 밀고 팬에 식용유 두르고 달걀에 우유 1T 넣고 풀어 놓은 달걀물을 부어주세요', 'image_url': 'https://recipe1.ezmember.co.kr/cache/recipe/2022/10/03/07357dff53ae3f2efa9271dead9da4861.jpg'}, {'step_number': 6, 'description': '달걀이 70~80% 익으면 불을 끄고 접어주세요 한김 식으면 채썰어 주세요', 'image_url': 'https://recipe1.ezmember.co.kr/cache/recipe/2022/10/03/59e3b1acc6c64ad97afa403f78a5081d1.jpg'}, {'step_number': 7, 'description': '물기를 꼭 짠 김치를 채썬 다음 고추가루 1t 참기름과 깨소금 조금씩 넣고 조물조물 무쳐주세요', 'image_url': 'https://recipe1.ezmember.co.kr/cache/recipe/2022/10/03/25a90692e495e7df4691149a7886c8b61.jpg'}, {'step_number': 8, 'description': '양조간장 1T 다진마늘 1t 고추가루 1/2t 통깨 넣고 섞어주세요', 'image_url': 'https://recipe1.ezmember.co.kr/cache/recipe/2022/10/03/68d997fcae2180b3975b9c5740c4de681.jpg'}, {'step_number': 9, 'description': '소면을 넣고 준비한 고기와 야채와 달걀지단을 넣고 멸치국물을 부어주세요', 'image_url': 'https://recipe1.ezmember.co.kr/cache/recipe/2022/10/03/3046616ecf705e8a635ba779b59978771.jpg'}, {'step_number': 10, 'description': '조미김을 길게 잘라서 올리고 양념간장을 기호대로 넣고 후루룩 냠냠 맛있게 먹어요', 'image_url': 'https://recipe1.ezmember.co.kr/cache/recipe/2022/10/03/223e7bbecf5f2a7bec1a1fc6f14c1d8e1.jpg'}]"
59970,면/만두,일상,소고기,끓이기,베트남 쌀국수 만들기 쌀국수 양파초절임 레시피,베트남쌀국수,"1,796",20분 이내,초급,1인분,"[('쌀국수 건면', '100g'), ('육수                                                                                시판 맑은 곰탕', '500ml'), ('숙주', '1줌'), ('소고기                                                                                불고기용', '80g'), ('양파', '1/2개'), ('고수', '1줌'), ('레몬', '1조각'), ('쪽파', '약간'), ('피시소스', '1T'), ('홍고추', '약간'), ('식초', '1T'), ('황설탕', '1T'), ('소금', '약간')]","시판용 맑은 곰탕 육수와 소고기, 숙주, 양파, 고수를 곁들여 집에서 간단한 한 그릇을 만들었어요. 국물 맛을 내고 취향에 맞게 고명을 곁들이면 밖에서 먹는 것과 같이 푸짐하게 맛볼 수 있답니다.","[{'step_number': 1, 'description': '양파는 동그란 모양 그대로 얇게 슬라이스하여 줍니다.도마 , 조리용나이프', 'image_url': 'https://recipe1.ezmember.co.kr/cache/recipe/2024/03/14/59047874af945cf00a3944a7ad7430451.png'}, {'step_number': 2, 'description': '식초 1 큰 술, 황설탕 1 큰 술 ,소금 약간 넣고 잘 섞어줍니다. 볼', 'image_url': 'https://recipe1.ezmember.co.kr/cache/recipe/2024/03/14/c74f207b77016dedcfa8e2b0a66444f01.png'}, {'step_number': 3, 'description': '슬라이스 한 재료를 넣고 10분 정도 재워둡니다.', 'image_url': 'https://recipe1.ezmember.co.kr/cache/recipe/2024/03/14/4bedc3889396eab18a12eabd0076882c1.png'}, {'step_number': 4, 'description': '숙주는 씻은 뒤 손질하여 물기를 털어주고, 홍고추와 쪽파는 송송 썰어주며 고수는 취향껏 준비합니다.숙주 손질법 레시피', 'image_url': 'https://recipe1.ezmember.co.kr/cache/recipe/2024/03/14/fd0af43d1bffb69f3ff0943da3b21e631.png'}, {'step_number': 5, 'description': '쌀국수는 중간중간 면을 저어가며 중불에서 4분 정도 삶아주고 찬물에 헹구어 물기를 털어줍니다.냄비 , 요리젓가락', 'image_url': 'https://recipe1.ezmember.co.kr/cache/recipe/2024/03/14/c42e7867f505d28be55d1c6ecb07deb01.png'}, {'step_number': 6, 'description': '맑은 곰탕 육수와 얇게 썬 소고기 불고기용을 준비해요.', 'image_url': 'https://recipe1.ezmember.co.kr/cache/recipe/2024/03/14/c17ebb87423fd6ab679444976f407c891.png'}, {'step_number': 7, 'description': '냄비에 곰탕을 담아 끓이다가 피시소스 1 큰 술 듬뿍 넣어줍니다.', 'image_url': 'https://recipe1.ezmember.co.kr/cache/recipe/2024/03/14/44f7f6641e1901abf236872615ac1abe1.png'}, {'step_number': 8, 'description': '육수가 바글바글 끓으면 소고기를 넣고 데쳐줍니다. 고기가 익으면 건져내고 체로 불순물을 가볍게 제거해 줍니다.요리집게', 'image_url': 'https://recipe1.ezmember.co.kr/cache/recipe/2024/03/14/de52dc256f528c094e125ef5fad60b291.png'}, {'step_number': 9, 'description': '그릇에 삶은 면과 숙주와 고기, 양파를 먹기 좋게 담아줍니다.면기숙주의 아삭함을 위해 따로 데치지 않고 뜨거운 육수를 부어주었습니다', 'image_url': 'https://recipe1.ezmember.co.kr/cache/recipe/2024/03/14/14824ae37c35a209a2384bd6bd12c1c81.png'}, {'step_number': 10, 'description': '뜨거운 육수 국물을 부어줍니다.', 'image_url': 'https://recipe1.ezmember.co.kr/cache/recipe/2024/03/14/c3cdb0d96a1608a4cbb4b005d4fd18d21.png'}, {'step_number': 11, 'description': '레몬과 고수, 홍고추, 쪽파를 고명으로 같이 곁들여 주면 베트남 쌀국수 완성이에요 :)', 'image_url': 'https://recipe1.ezmember.co.kr/cache/recipe/2024/03/14/7693ce91b624dbad35799fe21fcd27c51.png'}]"
59971,면/만두,일상,소고기,끓이기,매운 소고기 짜장라면 레시피,매운소고기짜장라면,118,20분 이내,아무나,2인분,"[('짜장라면', '2봉지'), ('대파', '70g'), ('물', '600ml'), ('소고기다짐육', '100g'), ('식용유', '5T'), ('고춧가루', '3T'), ('청양고추', '2개')]",매운 소고기 짜장라면 레시피 입니다.,"[{'step_number': 1, 'description': '달군 프라이팬에 식용유 두르고, 대파와 청양고추를 썰어서 넣어줍니다.도마 , 조리용나이프 , 프라이팬대파 손질법 레시피', 'image_url': 'https://recipe1.ezmember.co.kr/cache/recipe/2024/03/24/a98efb5301e2833b91fbf6834aee21121.jpg'}, {'step_number': 2, 'description': '대파향이 올라오면 가스레인지 불을 약불로 줄이고 고춧가루 넣어서 살짝 볶아 줍니다. 약 10초 정도 볶아 줍니다.', 'image_url': 'https://recipe1.ezmember.co.kr/cache/recipe/2024/03/24/b3defed1cffe5fc40bf10b94fa6eb1511.jpg'}, {'step_number': 3, 'description': '소고기 다짐육을 넣고서 약 30초 정도 볶아 주세요.조리용스푼', 'image_url': 'https://recipe1.ezmember.co.kr/cache/recipe/2024/03/24/78ce883925179e4c769e041b301de4311.jpg'}, {'step_number': 4, 'description': '물 600ml 부어서 끓여줍니다.계량컵', 'image_url': 'https://recipe1.ezmember.co.kr/cache/recipe/2024/03/24/d409fc468d22517a17ddbbd65e2bd0101.jpg'}, {'step_number': 5, 'description': '물이 끓기 시작하면 라면사리와 스프 모두 넣어주세요.', 'image_url': 'https://recipe1.ezmember.co.kr/cache/recipe/2024/03/24/e75360883ae3b2c6c34bec67df3fdb341.jpg'}, {'step_number': 6, 'description': '국물이 자작~해질때까지 끓여 주시면 완성입니다.', 'image_url': 'https://recipe1.ezmember.co.kr/cache/recipe/2024/03/24/ddc296cb83835cf2bb243317706c54cc1.jpg'}]"
59972,면/만두,일상,소고기,끓이기,집에서 쌀국수 만드는 법,쌀국수,"5,360",30분 이내,초급,3인분,"[('사골육수', '600cc'), ('소고기', '100g'), ('소금', '약간'), ('후춧가루', '약간'), ('피쉬소스', '2큰술'), ('다진 마늘', '1큰술'), ('숙주', '50g'), ('대파', '1큰술'), ('쌀국수', '3개')]",사골육수랑 피쉬소스를 이용해 간단하게 집에서 만들 수 있는 쌀국수에요.,"[{'step_number': 1, 'description': '쌀국수면은 30분 이상 물에 불려놓습니다.쌀국수면 3개', 'image_url': 'https://recipe1.ezmember.co.kr/cache/recipe/2021/07/25/26e8a82db5ccb16e462fe5d23b0fdda31.jpg'}, {'step_number': 2, 'description': '냄비에 사골육수를 넣어 끓여줍니다.\n전 시판 사골육수를 사용했어요.사골육수 600cc', 'image_url': 'https://recipe1.ezmember.co.kr/cache/recipe/2021/07/25/2a80ea12efd7b713d6a8896b4f6ce2331.jpg'}, {'step_number': 3, 'description': '먼저 국물을 만들어줄게요.\n다진 마늘 1큰술, 피쉬소스 2큰술, 후춧가루, 소금을 넣어 간합니다.\n굴소스 1작은술, 생강가루 약간 넣으셔도 되요.(선택)다진 마늘 1큰술, 피쉬소스 2큰술, 후춧가루 약간, 소금 약간', 'image_url': 'https://recipe1.ezmember.co.kr/cache/recipe/2021/07/25/12220db8b78503e2e03dbb2567b9d9a31.jpg'}, {'step_number': 4, 'description': '불린 쌀국수를 넣어 익혀줍니다.\n쌀국수는 금방 익기 때문에 1분 정도 끓이고 건져냅니다.', 'image_url': 'https://recipe1.ezmember.co.kr/cache/recipe/2021/07/25/edbab5fb2e6bc3bd0b247651c5df6a8e1.jpg'}, {'step_number': 5, 'description': '소고기를 넣어 익혀줍니다.\n샤브샤브 하듯이 익혀서 건져냅니다.소고기 100g', 'image_url': 'https://recipe1.ezmember.co.kr/cache/recipe/2021/07/25/0ab60f9d81d4155430879ee79d0b10221.jpg'}, {'step_number': 6, 'description': '숙주를 넣어 익혀준 후 건져냅니다.\n숙주는 생으로 드시는 분도 계시니 취향껏 익혀주세요~^^숙주50g', 'image_url': 'https://recipe1.ezmember.co.kr/cache/recipe/2021/07/25/5756112291c8227ba37992f8d49cc0d81.jpg'}, {'step_number': 7, 'description': '국물을 부어줍니다.\n간단하죠? ㅋ', 'image_url': 'https://recipe1.ezmember.co.kr/cache/recipe/2021/07/25/2f3c91f4f7a8602a4e4e9b4ed6cd37ea1.jpg'}, {'step_number': 8, 'description': '아이는 대파 없이 그냥 주고 전 대파를 얹어 먹었어요.\n역쉬 어른은 대퐈~', 'image_url': 'https://recipe1.ezmember.co.kr/cache/recipe/2021/07/25/d7bccd1736422276b4da7dd736d2eef31.jpg'}]"
59973,면/만두,일상,소고기,끓이기,차돌된장국수!! 꼭 한번 먹어봐야할 메뉴~,차돌된장국수,"1,060",15분 이내,아무나,1인분,"[('차돌박이', '100g'), ('양파', '1/4개'), ('감자', '조금'), ('호박', '조금'), ('대파', '조금'), ('청양고추', '1개'), ('물', '500ml'), ('소면', '1인분'), ('된장', '2.5~3T'), ('고추장', '0.5T'), ('다진마늘', '1t'), ('굵은 고춧가루', '조금'), ('멸치액젓', '1/2t')]",고깃집에서도 파는곳을 찾기 힘든 된장국수,"[{'step_number': 1, 'description': '차돌박이 100g 먹기 편하게 썰어주세요', 'image_url': 'https://recipe1.ezmember.co.kr/cache/recipe/2022/02/10/31f6c5e6c1f8c27214418b55872444ab1.jpg'}, {'step_number': 2, 'description': '감자도 있으면 채 썰어 준비해주고', 'image_url': 'https://recipe1.ezmember.co.kr/cache/recipe/2022/02/10/184259fd5244c12702c6d835cdc521bf1.jpg'}, {'step_number': 3, 'description': '호박도 채 썰어 준비해주시고', 'image_url': 'https://recipe1.ezmember.co.kr/cache/recipe/2022/02/10/ff3889b9da81b8412a14e8bfbaa5857e1.jpg'}, {'step_number': 4, 'description': '양파도 채 썰어주세요', 'image_url': 'https://recipe1.ezmember.co.kr/cache/recipe/2022/02/10/9902504916b7474d31f4b256ec2ada931.jpg'}, {'step_number': 5, 'description': '대파는 국수와 어울리게 길게 채 썰어 준비해주세요파채칼 사용하시거나\n영상 참고해 주세요~!', 'image_url': 'https://recipe1.ezmember.co.kr/cache/recipe/2022/02/10/b8438867f55d181c824a1cc9383aa19f1.jpg'}, {'step_number': 6, 'description': '기호에 따라 청양고추 추가', 'image_url': 'https://recipe1.ezmember.co.kr/cache/recipe/2022/02/10/9a99533f496e6c922b175457ccce3b261.jpg'}, {'step_number': 7, 'description': '차돌박이 반정도 먼저 볶아서 기름을 내주시고 된장 고추장 다진마늘 넣고 볶아주시다 고소한 냄새가 올라오면 물 500ml 또는 멸치육수500ml중불로 고기가 너무 바싹익거나 바닥에 양념이 타지않게 해주세요', 'image_url': 'https://recipe1.ezmember.co.kr/cache/recipe/2022/02/10/b39a6fe804b422cb749e923e6a02c3911.jpg'}, {'step_number': 8, 'description': '준비한 야채는 익는 시간이 오래 걸리는 감자, 양파/호박, 대파/청양고추 순서로 넣고 멸치육수가 없으면 멸치액젓 1/2t 넣어주세요', 'image_url': 'https://recipe1.ezmember.co.kr/cache/recipe/2022/02/10/fc55def19c917a151a7336c424cb3e421.jpg'}, {'step_number': 9, 'description': '소면도 중간에 삶아서 찬물에 헹궈 물기를 빼주시고', 'image_url': 'https://recipe1.ezmember.co.kr/cache/recipe/2022/02/10/c375c77aaf87a1c40abd833a62deb40e1.jpg'}, {'step_number': 10, 'description': '굵은 고춧가루 살짝 남은 차돌박이 넣어주시고간은 살짝 간간하게 맞춰주셔야 소면이 들어가도 간이 맞아요.\n입맛에 맞게 된장, 고추장, 다시다등으로 모자란 간 맞춰주세요', 'image_url': 'https://recipe1.ezmember.co.kr/cache/recipe/2022/02/10/0dc52fab3d4699cd11bd857515d1a6851.jpg'}, {'step_number': 11, 'description': '삶아놓은 소면 넣고 간을 봐주세요', 'image_url': 'https://recipe1.ezmember.co.kr/cache/recipe/2022/02/10/325c5e272853ecc1cbb120aa5488db5f1.jpg'}, {'step_number': 12, 'description': '한번 보글보글 끓여주면 완성~!', 'image_url': 'https://recipe1.ezmember.co.kr/cache/recipe/2022/02/10/187d011343a93e5e35a46c7d59027b721.jpg'}]"
59974,면/만두,일상,소고기,끓이기,짝퉁 명동 칼국수 (1인분),칼국수,"4,424",30분 이내,아무나,1인분,"[('칼국수면', '1인분'), ('사골 국물', '600ml'), ('다진 마늘', '1작은술'), ('맛 소금', '1작은술'), ('후추', '톡톡'), ('양파', '30g'), ('당근', '15g'), ('간장', '1/2작은술'), ('부추', '20g'), ('다진 소고기', '50g'), ('간장', '1작은술'), ('설탕', '1/4작은술')]","우리 집 식구들은 모두 국수를 무척 좋아한다.

칭구 집사님들도 나한테 무얼 사 먹이고 싶거나 내가 아플 때면 칼국수를 사 주거나 사서 넣어 주고 가시는 정도다.

애들도 국수나 수제비를 좋아해 전혀 딴판인 식성을 가진 두 아이의 입맛을 한번에 맞추기는 국수가 최고다.

심지어 나에게 있는 두 마리 냥이 중 어린 녀석은 희한하게 국수를 좋아해서 소면이나 칼국수 면을 삶으면 한 종지 씩 옆에서 얻어 먹곤 한다.

그걸 보며 저것도 내가 낳았나 싶은게 우리 식구가 맞긴 하구나 하며 웃는다.


여기 저기 토론토 내에 명동 칼국수라 이름 붙여진 가게는 왠만하면 다 가 보았지만 내 입맛에는 미시사가에 있는 집이 맛에 기복도 적고 제일 맛이 있다.

요새 때가 그래 자주 외식을 할 수도 없고 곰국을 잔뜩 우린 어느 날 명동 칼국수를 따라해 보았다.

옆에서 기대가 가득한 얼굴로 나를 내려다 보며 아들랭이가 묻는다.

감칠맛은 어쩌실 거냐고…

나야 그 흔한 다시다 한 숟가락도 없는 자라 그 부분은 포기하라고 말해 주었다.

그리고 어찌 어찌 만들어 낸 짝퉁 명동 칼국수를 아들랭이 3그릇이나 먹고 무척 만족 스러워 하며 깍아 놓은 망고 접시를 들고 퇴장하셨으므로 오늘의 엄마 놀이도 성공인걸로~


PS: 나도 나름 입맛 꽤 까다로운 녀자인데 내 입에는 명동 칼국수만큼 맛있었음","[{'step_number': 1, 'description': '양파와 당근은 얇게 채 치고 부추는 손가락 한 마디만하게 잘라 주고 소 고기는 다져 준비해요.', 'image_url': 'https://recipe1.ezmember.co.kr/cache/recipe/2022/04/11/3c6cccf1931c0316f84503e34b1417ef1.jpg'}, {'step_number': 2, 'description': '소고기는 뭉치지 않게 볶다가 분량의 양념을 넣고', 'image_url': 'https://recipe1.ezmember.co.kr/cache/recipe/2022/04/11/2ae6060639cd348911efbce9a842ac6b1.jpg'}, {'step_number': 3, 'description': '물기가 없도록 볶아 줘요.', 'image_url': 'https://recipe1.ezmember.co.kr/cache/recipe/2022/04/15/24e0f04592d6ff56ae1e075e58520d7e1.jpg'}, {'step_number': 4, 'description': '양파와 당근은 간장 1/2작은 술로 숨이 죽도록 볶아 줘요.', 'image_url': 'https://recipe1.ezmember.co.kr/cache/recipe/2022/04/15/47ac5d1cc6c481ec561636a56a7235b11.jpg'}, {'step_number': 5, 'description': '불을 끄고 잔열을 이용해 부추를 살짝만 볶아줘요.', 'image_url': 'https://recipe1.ezmember.co.kr/cache/recipe/2022/04/15/9ea8b7fc107cc705589662e562cef8721.jpg'}, {'step_number': 6, 'description': '사골 국물을 끓이다 국물이 끓어 오르면 소금과 다진 마늘을 넣어 줘요.\n국물을 끓이며 한 쪽에서 칼국수 면을 따로 삶아 줘요.', 'image_url': 'https://recipe1.ezmember.co.kr/cache/recipe/2022/04/15/9f88c574c52016ad5e1facfc5342e9f41.jpg'}, {'step_number': 7, 'description': '볶은 재료 중 토핑할 것 약간을 남기고', 'image_url': 'https://recipe1.ezmember.co.kr/cache/recipe/2022/04/15/c2cc08eb3dffe58923ecbb4fbd6754741.jpg'}, {'step_number': 8, 'description': '국물에 넣고 함께 끓여요.', 'image_url': 'https://recipe1.ezmember.co.kr/cache/recipe/2022/04/15/0d3d819ff2b391bf09be421949e5d09b1.jpg'}, {'step_number': 9, 'description': '따로 삶은 면을 국물에 넣고 후추를 4-5번 톡톡 해 줘요.', 'image_url': 'https://recipe1.ezmember.co.kr/cache/recipe/2022/04/15/2fc880d433290e60d4f97bcc1193d9611.jpg'}, {'step_number': 10, 'description': '남겨 둔 재료로 토핑해 줘요.', 'image_url': 'https://recipe1.ezmember.co.kr/cache/recipe/2022/04/15/ea4096f450cca282bb7ef291806a67a21.jpg'}]"
