index,종류별,상황별,재료별,방법별,글 제목,레시피이름,조회수,조리시간,난이도,인분,재료,소개글,조리순서
45995,국/탕,일상,닭고기,끓이기,닭가슴살 닭개장 끓이는 법,닭가슴살닭개장,"3,768",60분 이내,아무나,3인분,"[('닭가슴살', '3개'), ('대파', '1대'), ('양파 大', '1/2개'), ('느타리버섯', '200g'), ('숙주', '300g'), ('부추', '1/2줌'), ('홍고추', '1개'), ('청양고추', '1개'), ('월계수잎', '2장'), ('통후추', '1/2스푼'), ('참기름', '2스푼'), ('고춧가루', '4스푼'), ('국간장', '2스푼'), ('멸치 액젓', '2스푼'), ('다진 마늘', '1스푼'), ('소금', '약간')]",추운 날씨에 먹기 좋은 뜨끈한 국물 요리 닭개장 끓이는 법 알려드릴게요 ^^~,"[{'step_number': 1, 'description': '냄비에 물 1.5L, 닭가슴살 3개, 월계수잎 2장, 통후추 1/2스푼을 넣고 15분 동안 끓여주세요.냄비', 'image_url': 'https://recipe1.ezmember.co.kr/cache/recipe/2024/01/27/cdbeba7e1c865627d7145188b01a80341.jpg'}, {'step_number': 2, 'description': '닭가슴살이 삶아지는 동안에 부재료를 손질하시면 돼요. 대파는 큼직하게 썰어주세요.도마 , 조리용나이프', 'image_url': 'https://recipe1.ezmember.co.kr/cache/recipe/2024/01/27/5df18fee5b90eb56c18823b0df79a4331.jpg'}, {'step_number': 3, 'description': '양파는 채 썰어주세요.', 'image_url': 'https://recipe1.ezmember.co.kr/cache/recipe/2024/01/27/9d90c87c359f9e75628a34cd1a16b5001.jpg'}, {'step_number': 4, 'description': '부추도 먹기 좋은 크기로 4~5등분 해서 썰어주세요.', 'image_url': 'https://recipe1.ezmember.co.kr/cache/recipe/2024/01/27/e4a9bfef1a05bc1a7aa261a2c6c2d8c41.jpg'}, {'step_number': 5, 'description': '홍고추, 청양고추는 어슷 썰어주시고요.', 'image_url': 'https://recipe1.ezmember.co.kr/cache/recipe/2024/01/27/605e6beefc8a8d9a757feff30faf6af81.jpg'}, {'step_number': 6, 'description': '느타리버섯은 밑동을 살짝 잘라내고 결대로 찢어주세요.', 'image_url': 'https://recipe1.ezmember.co.kr/cache/recipe/2024/01/27/d1e6a2ad7b52f8d8b944aa691d20d96e1.jpg'}, {'step_number': 7, 'description': '숙주는 물에 담가 살살 흔들어서 세척하세요.볼', 'image_url': 'https://recipe1.ezmember.co.kr/cache/recipe/2024/01/27/a860dfe66a8986d13e42ed8e15e6f1341.jpg'}, {'step_number': 8, 'description': '삶은 닭가슴살은 흐르는 물에 씻어서 한 김 식힌 뒤 결대로 찢어주세요.', 'image_url': 'https://recipe1.ezmember.co.kr/cache/recipe/2024/01/27/5efc4ae5bf5f4b832492eb1f7ca030971.jpg'}, {'step_number': 9, 'description': '참기름 2스푼을 두른 뒤 대파를 넣고 달달 볶아주세요.냄비 , 요리스푼', 'image_url': 'https://recipe1.ezmember.co.kr/cache/recipe/2024/01/27/e9ad7cea3560e85f0e033e4bdc62993b1.jpg'}, {'step_number': 10, 'description': '노릇노릇해지면 고춧가루 4스푼을 넣어 가볍게 볶아주세요.', 'image_url': 'https://recipe1.ezmember.co.kr/cache/recipe/2024/01/27/9504cd6c38c7239ee7bb86d31961764d1.jpg'}, {'step_number': 11, 'description': '닭가슴살 삶은 물을 부어준 뒤 국간장 2스푼, 멸치 액젓 2스푼, 다진 마늘 1스푼을 넣어주세요.', 'image_url': 'https://recipe1.ezmember.co.kr/cache/recipe/2024/01/27/2013d54d50fcb54874cdb67043221c221.jpg'}, {'step_number': 12, 'description': '닭가슴살도 넣어 센 불에 끓여주세요.', 'image_url': 'https://recipe1.ezmember.co.kr/cache/recipe/2024/01/27/454797487fcefef4cb281df85c285e381.jpg'}, {'step_number': 13, 'description': '센 불에 끓으면 중불로 줄이고 양파, 버섯을 넣어 10분 동안 푹 끓여주세요.', 'image_url': 'https://recipe1.ezmember.co.kr/cache/recipe/2024/01/27/17c859b674d1ce0fda4cfe36713ca1d31.jpg'}, {'step_number': 14, 'description': '숙주를 넣어 2~3분 정도 더 끓여준 뒤 부족한 간을 소금을 넣어 맞춰주세요.', 'image_url': 'https://recipe1.ezmember.co.kr/cache/recipe/2024/01/27/261cf042309b399ffb16f46573ae46771.jpg'}, {'step_number': 15, 'description': '마지막으로 부추, 홍고추, 청양고추를 넣고 한소끔 더 끓여서 마무리하면 완성이에요 : )', 'image_url': 'https://recipe1.ezmember.co.kr/cache/recipe/2024/01/27/41e8251822d48c0688bd798bebac23ae1.jpg'}]"
45996,국/탕,일상,닭고기,끓이기,치킨스톡 하나로 닭한마리 뚝딱 만들기,닭한마리,"3,243",30분 이내,아무나,2인분,"[('토막닭', '800g'), ('감자', '2개'), ('파', '1개'), ('소주', '약간'), ('월계수잎', '3장'), ('치킨스톡', '1개'), ('물', '1200ml'), ('간장', '4T'), ('식초', '2T'), ('설탕', '1T'), ('겨자', '1t'), ('마늘', '1T')]","비싼 물가.....ㅠㅠ최애음식닭한마리 
닭도 감자도 집에서 푸짐하게 즐기고자
닭한마리를 만들어봤습니다!!","[{'step_number': 1, 'description': '냉동닭이나 토막닭을\n소주와 월계수잎 넣고 끓여줍니다.소주쪼르륵, 월계수잎 3장', 'image_url': 'https://recipe1.ezmember.co.kr/cache/recipe/2022/09/14/b0e47566dbd79aaeca90cc34e0e296be1.jpg'}, {'step_number': 2, 'description': '반정도 익었을때 불을 꺼주세요\n육수에 깊은 맛을 위해서\n닭은 다 익히지 않습니다\n핏기가 살짝 돌고 겉에만 익으면 된거에요.\n반정도 익은 닭을 깨끗이 씻어줍니다', 'image_url': 'https://recipe1.ezmember.co.kr/cache/recipe/2022/09/14/44be35bdd449ea7208d3dc11519d6b8d1.jpg'}, {'step_number': 3, 'description': '냄비도 깨끗이 씻어준 후\n깨끗이 씻은 닭과 1200ml 물을 넣어줍니다', 'image_url': 'https://recipe1.ezmember.co.kr/cache/recipe/2022/09/14/e7f4771af2cffd6dcc10686eb99cdcec1.jpg'}, {'step_number': 4, 'description': '감자 2개를 준비하여 썰어주시고\n바로 냄비에 투척!!', 'image_url': 'https://recipe1.ezmember.co.kr/cache/recipe/2022/09/14/ad0a3ef095576d59743bbb8e096832311.jpg'}, {'step_number': 5, 'description': '파도 잘 씻어서\n큼지막하게 썰어서 투척!!\n중강불로 끓여줍니다.', 'image_url': 'https://recipe1.ezmember.co.kr/cache/recipe/2022/09/14/70b34e2a2ae12c0846f4a3c682e8b31d1.jpg'}, {'step_number': 6, 'description': '치킨스톡을 하나 끄내줍니다.\n(만약, 치킨스톡이 없으시다면\n소금으로 간을 해주세요)', 'image_url': 'https://recipe1.ezmember.co.kr/cache/recipe/2022/09/14/60480caae332438b60dccad5c40cf61d1.jpg'}, {'step_number': 7, 'description': '닭이 다 익으면 간을 봐준후,\n모자른 간은 맛소금을 넣어줍니다\n치킨스톡 넣으셨으면\n소금은 안넣어도 될것같아요\n충분히 간이 다 베이더라구요\n입맛에 따라 소금은 추가해주세요!!', 'image_url': 'https://recipe1.ezmember.co.kr/cache/recipe/2022/09/14/9ed975c0218f11f50304ec4bfd0ee4c01.jpg'}, {'step_number': 8, 'description': '다시 본론, 부추를 물에 담가서 다시\n살아나게 해주고 손질을 해줍니다.\n뭉탱이씩 나눠서 흔들어서 씻어주시고\n대가리에 묻은 흙이나 이물질들을 제거해주세요.\n그리고 부추잎파리는 짓무르거나\n시든부분은 떼어버려주세요.부추 손질법 레시피', 'image_url': 'https://recipe1.ezmember.co.kr/cache/recipe/2022/09/14/d226dd4cdf706ebf3f9dfdab56e3b79f1.jpg'}, {'step_number': 9, 'description': '부추는 한입크기로 썰어주신후,\n닭한마리 양념장을 준비해줍니다.\n(간장 4, 식초 2, 설탕 1, 겨자1, 마늘1)', 'image_url': 'https://recipe1.ezmember.co.kr/cache/recipe/2022/09/14/f0f473f50b09c9dad2f2da8acb4dc28c1.jpg'}]"
45997,국/탕,일상,닭고기,끓이기,몸보신에 딱좋은 닭백숙,닭백숙,"1,954",20분 이내,초급,4인분,"[('백숙용 닭', '1마리'), ('통마늘', '10알'), ('대파', '적당량'), ('소금', '약간'), ('후춧가루', '약간')]",마늘듬뿍 넣어서 몸보신에 딱 좋은 닭백숙을 소개합니다.,"[{'step_number': 1, 'description': '닭백숙을 소개합니다.', 'image_url': 'https://recipe1.ezmember.co.kr/cache/recipe/2023/03/21/7648a16271553f9f87fb6af226d2b3da1.jpg'}, {'step_number': 2, 'description': '닭은 가위를 이용해서 손질해주세요.', 'image_url': 'https://recipe1.ezmember.co.kr/cache/recipe/2023/03/21/dcf5fcb48d39d810bb9e9b2ee852cdf41.jpg'}, {'step_number': 3, 'description': '대파를 넉넉하게 넣어주세요.', 'image_url': 'https://recipe1.ezmember.co.kr/cache/recipe/2023/03/21/e7e4529274e1754d1b4e7cd7538d2cde1.jpg'}, {'step_number': 4, 'description': '통마늘을 넣어주세요.', 'image_url': 'https://recipe1.ezmember.co.kr/cache/recipe/2023/03/21/ca85b63712b1304079d43cea11cef0c51.jpg'}, {'step_number': 5, 'description': '강불로 끊여주세요.', 'image_url': 'https://recipe1.ezmember.co.kr/cache/recipe/2023/03/21/70f87678b928e83405413faaad2b1b9b1.jpg'}, {'step_number': 6, 'description': '숟가락을 이용해서 거품을 제거해주세요.', 'image_url': 'https://recipe1.ezmember.co.kr/cache/recipe/2023/03/21/e40de5054c24a335107d95b9e80d7be11.jpg'}, {'step_number': 7, 'description': '굵은소금을 넣어서 한소큼 더 끊여주세요.', 'image_url': 'https://recipe1.ezmember.co.kr/cache/recipe/2023/03/21/6202b85ba6517f36b783160057d24a4a1.jpg'}, {'step_number': 8, 'description': '대파는 반을 잘라서 넣어서 숨을 죽여주세요.', 'image_url': 'https://recipe1.ezmember.co.kr/cache/recipe/2023/03/21/5ee6ecfa3297434eb61faf2db7b014a51.jpg'}, {'step_number': 9, 'description': '후추를 넣어서 닭백숙을 마무리 해주세요.', 'image_url': 'https://recipe1.ezmember.co.kr/cache/recipe/2023/03/21/eef2effa63cafb7f71cc5d230298d75a1.jpg'}]"
45998,국/탕,일상,닭고기,끓이기,[살 빠지는 레시피] 물미역으로 미역국 끊이기 / 닭가슴살로 깔끔하게,닭가슴살미역국,685,60분 이내,초급,4인분,"[('물미역', '300g'), ('닭가슴살', '400g'), ('국간장', '3숟갈'), ('참치액', '2숟갈'), ('들기름', '1숟갈')]",생일이면 챙겨 먹고 출산 후에도 먹고 평소에도 부담 없이 먹을 수 있는 건미역으로 만든 우리에게 친근한 미역국. 시중에 파는 가공된 말린 미역 말고 싱싱한 물미역으로 좀 더 건강하게 닭가슴살을 넣어서 좀 더 깔끔하게 미역국 끊이는 방법을 알려드릴게요. 물미역 데치기 방법은 어떻게 하는지도 포함되어 있으니 관심 있게 봐주시고 물미역의 효능도 알려드릴게요.,"[{'step_number': 1, 'description': '물 1리터를 센 불에 올리고 물이 끊어 오르면 두툼한 부분을 먼저 넣어주고 색이 초록색으로 변하면 모두 넣어주세요. 물미역으로 다 넣어주고 집게로 휘익~~~ 뒤 저어주면 바로 색이 변하는데요. 색이 변하면 다 익은 거니 바로 가스불을 끊고 채반에 쏟아주고 열기가 없어지도록 헹궈주고 물기 제거를 위해 채반에 놓고 기울여 주세요! 물기를 꾹 짜준 후에는 먹기 좋은 크기로 잘라주세요!', 'image_url': 'https://recipe1.ezmember.co.kr/cache/recipe/2023/03/22/84b6a472f1f620e1a2e14264538a4b421.jpg'}, {'step_number': 2, 'description': '잡내 없이 삶아주기 위해 월계수잎 생강가루를 준비했어요. 냄비에 물 1리터를 넣고 물이 팔팔 끊으면 닭가슴살과 월계수잎, 생강가루를 넣고 센 불에 불을 올리고 10분간 삶아주었어요. 닭가슴살 삶는 시간은 10분 정도면 부드럽게 삶을 수 있어요. 닭가슴살을 채반에 담고 식힌 후 닭가슴살을 찢어줍니다.', 'image_url': 'https://recipe1.ezmember.co.kr/cache/recipe/2023/03/22/8a24113018cbb999dec98dae6ed355b11.jpg'}, {'step_number': 3, 'description': '냄비에 들기름을 두른 뒤 데쳐놓은 물미역을 넣어 볶아요. 어느 정도 미역이 볶아지면 이제 물을 넣어줄 차례인데요. 물은 미역이 충분히 잠기게끔 부어주고 이때 불 세기는 중강 불로 올려줘도 괜찮아요. 물이 끊기 시작하면 삶아서 결대로 찢어놓은 닭가슴살을 넣어주세요.', 'image_url': 'https://recipe1.ezmember.co.kr/cache/recipe/2023/03/22/0b4fa480dbf64165ee2e94cebc857dc11.jpg'}, {'step_number': 4, 'description': '전 마늘을 넣지 않았어요! 마늘 넣으셔도 됩니다. 국간장 넣고 참치 액 넣고 간을 조절해요. 간이 조절되었다면 좀 더 끓여주면 물미역국 완성!', 'image_url': 'https://recipe1.ezmember.co.kr/cache/recipe/2023/03/22/1ea557aef158f387815685cd5425d77d1.jpg'}]"
45999,국/탕,일상,닭고기,끓이기,닭한마리 요리 진하고 깔끔한 닭곰탕 만들기 백종원 닭곰탕 재료,닭곰탕,"2,863",60분 이내,초급,4인분,"[('닭', '1마리'), ('양파', '1개'), ('대파', '1대'), ('월계수잎', '3장'), ('다진 마늘', '1T'), ('물', '3L'), ('소금', '1큰술'), ('후춧가루', '조금'), ('미원', '1/4숟가락'), ('치킨스톡', '1/2숟가락')]",요즘 날씨가 너무너무 추워져 계속 따뜻한 국물 요리가 생각나서 무엇을 해먹을까 생각하다가 닭 베이스의 국물이 먹고 싶다는 생각이 들어서 닭 한 마리를 사와서 닭개장이냐.. 닭곰탕이냐.. 고민을 하다가! 오늘은 닭곰탕을 해먹었습니다.,"[{'step_number': 1, 'description': '먼저 육수를 끓이기 전에! 닭을 깨끗하게 씻어주어야 합니다. 닭의 배가 갈라져 있지 않다면 칼이나 가위를 이용해 닭의 배를 갈라 펼치고 내장, 불순물들을 손으로 잘 제거해 주세요. 잘 제거하지 않으면 자칫 누린내나 잡내가 날 수 있으니 신경 써서 세척해 주세요!주방가위', 'image_url': None}, {'step_number': 2, 'description': '그리고 곰솥 같은 큰 냄비에 닭을 넣고 닭이 잠길 만큼 물을 부어주세요.(대략 3L) 양파 1개, 대파 1단도 같이 넣어주세요.양파와 대파는 흙을 씻어 껍질째로 큼직하게 넣으시면 됩니다. 다진 마늘 1T와 월계수잎 3장도 같이 넣어주세요.\n냄비백종원 님 유튜브 레시피에는 다진 마늘과 월계수잎은 들어가지 않는답니다. 그대로 따라 하고 싶으신 분들은 해당 재료를 생략해 주세요', 'image_url': 'https://recipe1.ezmember.co.kr/cache/recipe/2023/11/14/5ac614f7e804b0f3b7f47f0bcad28afa1.jpg'}, {'step_number': 3, 'description': '강불로 끓이다 보면 금방 끓어오르면서 거품이 생길 텐데, 깔끔한 국물을 위해서 거품을 걷어내주세요. 거품을 걷어낸 뒤에 중불에서 대략 30분 정도 푹 삶아주시면 됩니다.국자', 'image_url': 'https://recipe1.ezmember.co.kr/cache/recipe/2023/11/14/3337ca1de36d706d28328178881227cb1.jpg'}, {'step_number': 4, 'description': '닭가슴 쪽 살을 찢어보고 익은 것 같으면 닭은 우선 따로 꺼내주세요. 앞서 30분을 말씀드렸지만, 닭의 크기에 따라서 닭이 익는 시간이 더 걸릴 수도 있으니 닭가슴 쪽을 찢었을 때 덜 익은 것 같다면 조금 더 시간을 두고 끓여주세요.믹싱볼 , 요리집게', 'image_url': 'https://recipe1.ezmember.co.kr/cache/recipe/2023/11/14/3fd78c3e0bb59151575a281b2ca9ac201.jpg'}, {'step_number': 5, 'description': '닭은 살만 발라내고 먹기 좋게 살은 찢어주세요. 여기서 잠깐! 발라낸 뼈도 버리시면 안 됩니다.\n저는 껍질을 좋아해서 같이 살과 발라서 먹었지만, 느끼한 것을 싫어하거나 건강을 생각하신다면 닭 껍질도 뼈와 같이 육수로 들어가거나, 제거하셔도 됩니다.', 'image_url': 'https://recipe1.ezmember.co.kr/cache/recipe/2023/11/14/5eb2926d76050fb690382c09f7d92fac1.jpg'}, {'step_number': 6, 'description': '뼈는 버리시지 말고 다시 육수에 넣어 30분 정도 더 끓여주세요. 훨씬 깊은 맛이 난답니다. 30분 정도 끓이신 뒤에 소금 1 큰 술, 그리고 미원 1/4 숟가락을 넣어주세요. 조금 더 깊은 맛을 원하시면 치킨스톡 1/2 숟가락도 넣어주시면 좋은데, 깔끔한 게 좋으시면 생략 가능합니다!', 'image_url': 'https://recipe1.ezmember.co.kr/cache/recipe/2023/11/14/8cba09648a93b28e42de7fd432ae087b1.jpg'}, {'step_number': 7, 'description': '대파는 따로 조금 고명용을 송송 썰어 준비해 주세요.도마 , 조리용나이프', 'image_url': 'https://recipe1.ezmember.co.kr/cache/recipe/2023/11/14/d5aae261528369658e76da63ee005d061.jpg'}, {'step_number': 8, 'description': '넓은 대접에 밥을 그릇에 먹기 좋게 담아주세요.면기', 'image_url': 'https://recipe1.ezmember.co.kr/cache/recipe/2023/11/14/9ce69600445a35a489e7018b9dcf8b9e1.jpg'}, {'step_number': 9, 'description': '그 위로 국물을 부어주세요. (조금 더 깔끔한 국물을 원하시면 체에 한번 거르면서 국물을 부어주시면 좋습니다)', 'image_url': 'https://recipe1.ezmember.co.kr/cache/recipe/2023/11/14/0c98c1a94ea9aebd481407ba54ee3b731.jpg'}, {'step_number': 10, 'description': '그다음 그 위로 찢어둔 닭을 올리고 대파 고명을 올린 뒤에 따뜻한 육수를 그 위로 1~2국자 더 부어주고 취향껏 후추와 소금 간을 추가로 하면 완성!', 'image_url': 'https://recipe1.ezmember.co.kr/cache/recipe/2023/11/14/558ff37881b5f5de6b51f50f72fb76851.jpg'}]"
46000,국/탕,일상,닭고기,끓이기,간단한 닭가슴살 닭곰탕 만들기 레시피 닭가슴살 요리,닭가슴살닭곰탕,"1,289",30분 이내,초급,2인분,"[('닭가슴살', '4개'), ('대추', '4개'), ('양파', '1/2개'), ('마늘', '10쪽'), ('대파', '1대'), ('코인육수', '1개'), ('청주                                                                                or 미림', '2큰술'), ('다진마늘', '1/2큰술'), ('참기름', '1/2큰술'), ('소금', '1작은술'), ('후춧가루', '톡톡')]","닭 한 마리를 다 넣고 끓이면 바쁜 현대인들 먹기 힘들죠. 닭가슴살, 닭안심으로 간단하고, 영양가 높은 닭곰탕을 만들어 볼까 해요.","[{'step_number': 1, 'description': '대추는 주름진부분에 먼지와 이물질이 있을 수 있기때문에 약간 물에 불려 흐르는 물에 씻어 주세요.', 'image_url': 'https://recipe1.ezmember.co.kr/cache/recipe/2023/12/07/b363f483f178b16b2e4ee7a48bfb795a1.jpg'}, {'step_number': 2, 'description': '모든 재료를 넣고 냄비에 센 불로 끓이다가 끓었으면 약불로 20~25분 끓여줬어요.냄비강불->약불', 'image_url': 'https://recipe1.ezmember.co.kr/cache/recipe/2023/12/07/9134781cbc8f8bd7beb6df72377ec8921.jpg'}, {'step_number': 3, 'description': '닭가슴살은 건져두고, 코인육수를 넣고 한 번 더 끓여주신 후 육수 재료를 건져주세요.거름망', 'image_url': 'https://recipe1.ezmember.co.kr/cache/recipe/2023/12/07/f899b3cd6b2db351b5472bdde3c299fc1.jpg'}, {'step_number': 4, 'description': '플레이팅하 기 위해 계란을 노른지, 흰자로 나누어 구워 채를 썰어주세요. 건대추를 깨끗하게 씻어 씨를 빼고 돌돌 말아 잘라두었어요. 볼 , 요리젓가락 , 프라이팬 , 뒤집개 , 도마 , 조리용나이프', 'image_url': 'https://recipe1.ezmember.co.kr/cache/recipe/2023/12/07/fd8d54fd2c5d36f276b90234a4f283391.jpg'}, {'step_number': 5, 'description': '식혀둔 닭가슴살을 먹기 좋게 찢고 밑간을 해 주시면 뜨근한 닭곰탕 완성입니다. 그릇에 적당히 밥을 넣고, 그위에 곰탕을 플레팅하면 됩니다. 면기 , 국자', 'image_url': 'https://recipe1.ezmember.co.kr/cache/recipe/2023/12/07/340178401598e2c78cb57e01bdd0fb041.jpg'}]"
46001,국/탕,일상,닭고기,끓이기,닭백숙,닭백숙,420,60분 이내,초급,4인분,"[('생닭', '1마리'), ('양파', '1개'), ('통마늘', '20알'), ('대파', '넉넉히'), ('쪽파', '넉넉히'), ('강황가루', '약간만'), ('소금', '약간만')]",몸보신이 하고 싶을때 딱 떠오르는 생닭으로 우리집만의 비법으로 닭 냄새를 잡으려고 더 노력하는 요리 닭백숙을 소개합니다.,"[{'step_number': 1, 'description': '닭백숙을 소개합니다.', 'image_url': 'https://recipe1.ezmember.co.kr/cache/recipe/2024/05/16/423bedf7cbcc67dc73e3998bb2e634a21.jpg'}, {'step_number': 2, 'description': '생닭을 깨끗하게 씻어서 준비합니다.닭고기 손질법', 'image_url': 'https://recipe1.ezmember.co.kr/cache/recipe/2024/05/16/0eab353bafb117cacbfe8cd23cbd8c7b1.jpg'}, {'step_number': 3, 'description': '가위를 이용해서 생닭을 손질해주세요.니트릴장갑 , 주방가위', 'image_url': 'https://recipe1.ezmember.co.kr/cache/recipe/2024/05/16/386099a8fb660a1b80fa8aebb5cf16a01.jpg'}, {'step_number': 4, 'description': '대파,양파를 넉넉하게 넣어주세요.냄비 , 도마 , 조리용나이프양파 손질법', 'image_url': 'https://recipe1.ezmember.co.kr/cache/recipe/2024/05/16/7de2e5d9e30d1304eed602c7127eff0a1.jpg'}, {'step_number': 5, 'description': '통마늘과 강황가루를 넣어주세요.', 'image_url': 'https://recipe1.ezmember.co.kr/cache/recipe/2024/05/16/75b2642502070f001213390ced5497fe1.jpg'}, {'step_number': 6, 'description': '강불로 끓여주세요. 숟가락을 이용해서 중간에 거품을 걷어주세요.스푼', 'image_url': 'https://recipe1.ezmember.co.kr/cache/recipe/2024/05/16/50e59643f8d3f93ff227d6581ef1cc2c1.jpg'}, {'step_number': 7, 'description': '부족한 간은 소금으로 맞추어주세요.국자 , 완성그릇', 'image_url': 'https://recipe1.ezmember.co.kr/cache/recipe/2024/05/16/f9481cbaeab672ae9e0a1fd953be76c71.jpg'}, {'step_number': 8, 'description': '쪽파를 닭국물에 잠시 담궈준후 닭백숙 위에 살포시 올려주세요.', 'image_url': 'https://recipe1.ezmember.co.kr/cache/recipe/2024/05/16/830df01cc0b281064da5a364b8397ca41.jpg'}, {'step_number': 9, 'description': '닭백숙이 완성이 되었습니다.', 'image_url': 'https://recipe1.ezmember.co.kr/cache/recipe/2024/05/16/459304980dc43b172aa6aa24934321af1.jpg'}]"
46002,국/탕,일상,닭고기,끓이기,닭백숙,닭백숙,"1,117",30분 이내,초급,4인분,"[('생닭', '1마리'), ('양파', '1개'), ('무', '1/4개'), ('통마늘', '10알'), ('대파', '약간'), ('부추', '1묶음')]","닭백숙은 우리집 만의 비법으로 통마늘과 무,대파를 넣어서 단백하게 만들었습니다.","[{'step_number': 1, 'description': '닭백숙을 소개합니다.', 'image_url': 'https://recipe1.ezmember.co.kr/cache/recipe/2023/10/19/271492e8bc796e6240826d2056f0cfd31.jpg'}, {'step_number': 2, 'description': '생닭을 손질한후 깨끗하게 씻어서 준비합니다.주방가위', 'image_url': 'https://recipe1.ezmember.co.kr/cache/recipe/2023/10/19/f70d6aa787590ffae7d47f0668cd9fba1.jpg'}, {'step_number': 3, 'description': '대파,양파,통마늘을 넉넉하게 넣어주세요. 중간에 숟가락을 이용해서 거품을 걷어주면 국물이 더 깔끔해진답니다.도마 , 조리용나이프 , 냄비 , 요리스푼', 'image_url': 'https://recipe1.ezmember.co.kr/cache/recipe/2023/10/19/25e2eb4f679b811f83e3b6e72cf2cf641.jpg'}, {'step_number': 4, 'description': '물을 넉넉하게 넣어준후 보글보글 오래도록 끊여주세요.', 'image_url': 'https://recipe1.ezmember.co.kr/cache/recipe/2023/10/19/748f3c02f9769cc50870da8c556a116a1.jpg'}, {'step_number': 5, 'description': '부추를 닭국물에 잠시 담궈준후 닭백숙 위에 살포시 올려주세요.국자 , 뚝배기', 'image_url': 'https://recipe1.ezmember.co.kr/cache/recipe/2023/10/19/281a3f3c7c2b6bbe62ffab72bcee9eb91.jpg'}, {'step_number': 6, 'description': '닭백숙이 완성이 되었습니다.', 'image_url': 'https://recipe1.ezmember.co.kr/cache/recipe/2023/10/19/d89fcf397c00c7b429e1fe4b8ec7add51.jpg'}]"
