index,종류별,상황별,재료별,방법별,글 제목,레시피이름,조회수,조리시간,난이도,인분,재료,소개글,조리순서
38790,메인반찬,술안주,닭고기,튀김,치토스치킨,치토스치킨,"3,228",30분 이내,아무나,1인분,"[('치토스(스모키바베큐맛)', '1봉'), ('닭안심', '8덩이'), ('밀가루', ''), ('카레가루', '2T'), ('달걀물 달걀', '2개'), ('소금', '1꼬집'), ('후추', '톡톡'), ('드라이오레가노', '톡톡')]","밑간은 카레가루로, 튀김옷은 과자로~이국적인 향 가득한 이색치킨","[{'step_number': 1, 'description': '닭안심에 오레가노, 소금, 후추로 밑간합니다.\n튀김옷은 과자라서 짭짤하고 카레가루도 들어가기때문에 소금은 살짝 아쉽게 넣어주세요.', 'image_url': 'https://recipe1.ezmember.co.kr/cache/recipe/2018/06/02/0e4b9ad590d94c6ebd564bc99b247a841.jpg'}, {'step_number': 2, 'description': '밀계빵(밀가루-계란물-빵가루)을 시작합니다. 밀가루를 묻혀줍니다.', 'image_url': 'https://recipe1.ezmember.co.kr/cache/recipe/2018/06/02/fd5e470f522c788d32f815e4c5235ee71.jpg'}, {'step_number': 3, 'description': '카레가루도 묻혀주세요.', 'image_url': 'https://recipe1.ezmember.co.kr/cache/recipe/2018/06/02/cd9191933603bcf7e7248a091ab157c01.jpg'}, {'step_number': 4, 'description': '이제 빵가루도 준비해야죠. 빵가루대신 치토스를 믹서기에 갈아서 튀김옷으로 이용합니다. 치토스도 꼭 스모키바베큐맛으로 해주세요. 다른 맛으로 하면 제가 의도한 결과가 안날테니까요.', 'image_url': 'https://recipe1.ezmember.co.kr/cache/recipe/2018/06/02/84ef16a6473e054a11db5e9452254ec01.jpg'}, {'step_number': 5, 'description': '카레가루까지 묻힌 닭안심에 달걀물-빵가루순으로 튀김옷 완성해주고요. 냉동실에 보관했다가 튀기고싶을때 튀겨드시면 좋아요. 바로 먹으면 더 부드럽고 맛있고요.', 'image_url': 'https://recipe1.ezmember.co.kr/cache/recipe/2018/06/02/b1eb2651ef56a37e2f33d5f5cc4692681.jpg'}, {'step_number': 6, 'description': '기름 넉넉히두르고 팬에다가 튀겨줍니다.', 'image_url': 'https://recipe1.ezmember.co.kr/cache/recipe/2018/06/02/8bef1f34c0e5925b9cfdafa34c51effc1.jpg'}, {'step_number': 7, 'description': '튀긴 치킨 한입먹어보면 신기한 맛이 나요. 뭔가 안먹어본듯한 치킨맛이랄까요? 외국의 치킨인데 어느나라인지는 모를 외국치킨 ㅋㅋ 하지만 너무 맛있고, 중독성이 강해서 이틀전에 먹었는데 아직도 생각나네요.', 'image_url': 'https://recipe1.ezmember.co.kr/cache/recipe/2018/06/02/e3af65c38f5027fe8685bd1c817780b91.jpg'}]"
38791,메인반찬,술안주,닭고기,튀김,"치킨가라아게 만들기,일본식닭튀김",치킨가라아게,"6,199",60분 이내,초급,3인분,"[('닭다리살', '500g'), ('달걀', '1개'), ('다진마늘', '1숟가락'), ('다진생강', '약간'), ('간장', '1.5숟가락'), ('케이준가루                                                                                생략가능', '약간'), ('소주', '1숟가락'), ('소금', '약간'), ('후춧가루', '약간'), ('전분가루', '8숟가락'), ('튀김기름', '적당량')]","어제는 아이들에게 일본식닭튀김을 해줬어요.
지난번부터 굽는거 말고 튀기는거라고 말하는 애들에게 피곤이 가시면 해주겠노라며 해서 어제 급하게 만들었답니다.","[{'step_number': 1, 'description': '닭다리살은 한번 차가운물에 헹구고 물기를 빼주세요.', 'image_url': 'https://recipe1.ezmember.co.kr/cache/recipe/2018/06/05/ef798a72bee78dff7089bbac07271e651.jpg'}, {'step_number': 2, 'description': '치킨타월로 한번 더 핏물을 빼주고 한입크기로 썰어주세요.', 'image_url': 'https://recipe1.ezmember.co.kr/cache/recipe/2018/06/05/ecfef56c0b9d6e22a84448de841550a91.jpg'}, {'step_number': 3, 'description': '닭다리살에 밑간을 해주세요.\n다진마늘(1)/다진생강이나 생강가루 약간/간장(1.5)/소주(1)/소금약간/후춧가루약간\n케이준가루가 있으면 살짝만 넣어주심 향이 좋아요. \n없으면 카레가루와 고춧가루를 살짝 섞어서 넣어주심되요.\n밑간이 얼추되면 달걀1개를 넣고 잘 섞어주세요.', 'image_url': 'https://recipe1.ezmember.co.kr/cache/recipe/2018/06/05/24aca548c45f835ac16ad71c65910e571.jpg'}, {'step_number': 4, 'description': '여기에 전분가루(8)스푼을 넣고 잘 섞어주세요.이때 양념국물은 따라내서 버려주세요.', 'image_url': 'https://recipe1.ezmember.co.kr/cache/recipe/2018/06/05/601bbf862677cbc1d91bc0fc58e37a691.jpg'}, {'step_number': 5, 'description': '튀김기름이 180도 정도 되면 한번 튀겨주고 드시기전에 한번더 바삭하게 튀기면', 'image_url': 'https://recipe1.ezmember.co.kr/cache/recipe/2018/06/05/d7057e5a5defdabf13902f4f7a2488761.jpg'}, {'step_number': 6, 'description': '겉은 바삭 속은 촉촉한 가라아게 완성이에요.', 'image_url': None}]"
38792,메인반찬,술안주,닭고기,튀김,[치킨 가라아게] 감칠맛과 바삭함이 남다른 가라아게 황금 레시피,치킨가라아게,"1,755",2시간 이상,중급,5인분,"[('닭다리살', '1.5kg'), ('감자전분', '300g'), ('튀김가루', '150g'), ('튀김유', '1.8L'), ('간장', '5큰술'), ('미림', '5큰술'), ('청주', '5큰술'), ('다진마늘', '5큰술'), ('다진생강', '5작은술'), ('후추', '약간'), ('양파', '1/2개'), ('통생강', '1개'), ('간장', '100ml'), ('설탕', '100ml'), ('가쓰오부시', '10g'), ('물', '400ml'), ('대파', '3개')]","겉은 바삭하고 속은 촉촉한 눈꽃 가라아게 황금 레시피를 공유합니다!
순살 닭다리살로 만들어 속까지 부드러운데다 감칠맛이 풍부해서 여느 치킨과도 겨룰 법한 음식이에요.
평소 튀긴 것을 별로 좋아하지 않는 아내도, 튀김옷이 두껍지 않으면서 바삭한데다 정말 맛있어서 질리지 않는다고 합니다.
생각보다 재료값이 많이 들지 않아서, 저희 집에서는 자주 해먹는 음식입니다.
순살 닭다리살 1.5kg면 5명이 먹을 만한 양이 나오니, 치킨 사드실 돈으로 한번쯤은 꼭 만들어보세요!","[{'step_number': 1, 'description': '닭다리살 한 덩이를 반으로 잘라주세요.\n보통 가라아게 1개가 40~60g정도 되는데, 시판용 닭다리살을 반으로 자르면 딱 이정도가 되더라고요.닭다리살 1.5kg껍질은 제거하지 말고, 붙인 채로 반으로 잘라주세요. \n껍질은 튀겼을 때 바삭한 식감을 더해줍니다.', 'image_url': 'https://recipe1.ezmember.co.kr/cache/recipe/2022/12/31/217d19d06fc6e30bf98a71aad40009431.png'}, {'step_number': 2, 'description': '자른 닭다리살에 간장 5큰술, 미림 5큰술, 청주 5큰술, 다진마늘 5큰술, 다진생강 5작은술, 후추 약간을 넣어주세요.간장 5큰술, 미림 5큰술, 청주 5큰술, 다진마늘 5큰술, 다진생강 5작은술, 후추 약간', 'image_url': 'https://recipe1.ezmember.co.kr/cache/recipe/2022/12/31/d8317372cc318eff196796766daa651d1.png'}, {'step_number': 3, 'description': '간이 잘 배도록 주물러주세요. 많이 주무를수록 양념이 고기에 스며들어 훨씬 맛있습니다.', 'image_url': 'https://recipe1.ezmember.co.kr/cache/recipe/2022/12/31/e1824bcf5272990282be3a6840b02aed1.png'}, {'step_number': 4, 'description': '공기를 최소화시키기 위해 비닐 랩을 꾹꾹 눌러가며 덮어주세요.비닐 랩', 'image_url': 'https://recipe1.ezmember.co.kr/cache/recipe/2022/12/31/2ebedfc34f0fcd4fbcceee686158a5bb1.png'}, {'step_number': 5, 'description': '뚜껑이 있다면 덮은 다음, 냉장고에서 1시간 가량 숙성시켜주세요. (숙성 시간은 최소 1시간~최대 반나절 정도로 잡아주시면 돼요. 숙성 시간이 길수록 양념이 고기에 배어 훨씬 맛있습니다.)', 'image_url': 'https://recipe1.ezmember.co.kr/cache/recipe/2022/12/31/88d3ac9161d4ce04cebc31a89fea45341.png'}, {'step_number': 6, 'description': '양파 1/2개를 큼직하게 썰어주세요.양파 1/2개', 'image_url': 'https://recipe1.ezmember.co.kr/cache/recipe/2022/12/31/c47ad6c9150fcd4c59aa4fffb45109a71.png'}, {'step_number': 7, 'description': '생강 1개를 최대한 얇게 썰어주세요.생강 1개최대한 얇게 썰어야 소스에 생강 향이 잘 우러나와요.\n소스 용이니 껍질은 굳이 제거하지 않고 잘 씻어서 사용하시면 됩니다.', 'image_url': 'https://recipe1.ezmember.co.kr/cache/recipe/2022/12/31/7422cccc5365a854b6551258904252b01.png'}, {'step_number': 8, 'description': '대파 흰색 부분 1개를 얇게 썰어주세요.\n(저민 대파는 소스에 동동 띄워 먹을 예정입니다.)대파 흰색 부분 1개', 'image_url': 'https://recipe1.ezmember.co.kr/cache/recipe/2022/12/31/36d8f9c4c7e00eda1b198f98244b39081.png'}, {'step_number': 9, 'description': '물 400ml, 간장 100ml에 설탕 100ml, 가쓰오부시 10g과 썰어놓은 양파와 생강을 넣고 끓여주세요.\n(저민 대파는 나중에 사용할 예정이니 여기에 넣지 마세요~)물 400ml, 간장 100ml, 설탕 100ml, 가쓰오부시 10g가쓰오부시 10g은 혼다시 5g으로 대체 가능합니다.', 'image_url': 'https://recipe1.ezmember.co.kr/cache/recipe/2022/12/31/63f5b68aeab8bde1ccdd073c5cdbce6a1.png'}, {'step_number': 10, 'description': '소스가 끓어 양파 색이 투명해졌을 즈음, 불을 끄고 체에 걸러주세요. 걸러낸 소스는 충분히 식혀주세요.', 'image_url': 'https://recipe1.ezmember.co.kr/cache/recipe/2022/12/31/19291bf7373200e34b30b4e657adf7841.png'}, {'step_number': 11, 'description': '감자전분 300g, 튀김가루 150g을 한데 섞어주세요.감자전분 300g, 튀김가루 150g감자전분과 튀김가루는 2:1의 비율로 섞어주시면 됩니다.', 'image_url': 'https://recipe1.ezmember.co.kr/cache/recipe/2022/12/31/39edca44a228bbd4511a6fe826bd73541.png'}, {'step_number': 12, 'description': '숙성시킨 닭다리살에 가루를 묻혀주세요.\n★이때 껍질을 최대한 잘 펴서, 껍질이 살을 감싸는 모양으로 말아주세요!\n★반대로 껍질이 안쪽으로 가고 속살이 바깥에 위치하면 튀기면서 육즙이 빠져나가고 퍼석해져요. 꼭 껍질이 바깥쪽에 오도록 살을 감싸주세요!', 'image_url': 'https://recipe1.ezmember.co.kr/cache/recipe/2022/12/31/9ac852e456d00fe1fcdf226b6f8d6ae11.png'}, {'step_number': 13, 'description': '닭다리살에 가루를 묻히면, 사진처럼 수분때문에 가루가 없어진 것처럼 보여요. 하지만 겉면에 미세하게 가루가 남아있으니 너무 걱정마세요!', 'image_url': 'https://recipe1.ezmember.co.kr/cache/recipe/2022/12/31/331b2de2720f7d505766e7fcff289d041.png'}, {'step_number': 14, 'description': '감자전분 50g에 물 20ml 정도를 붓고, 작은 알갱이를 만들듯 섞어주세요. 이 알갱이들이 2차 튀김옷이 되어 눈꽃튀김의 모양과 식감을 냅니다.감자전분 50g, 물 20ml알갱이가 너무 크게 뭉치지 않게 작은 알갱이로 쪼개주세요.', 'image_url': 'https://recipe1.ezmember.co.kr/cache/recipe/2022/12/31/c38d87be9fe2ed95743630c55dbd77311.png'}, {'step_number': 15, 'description': '[1차 튀김]\n튀김전용유를 끓여 온도를 170도로 맞춰주세요.\n온도측정기가 없다면, 전분 알갱이를 넣었을 때 보글거리며 위로 금방 떠오르면 적정한 온도입니다!튀김전용유 1.8L', 'image_url': 'https://recipe1.ezmember.co.kr/cache/recipe/2022/12/31/cd60db27240c362667ff7cb16f69a26c1.png'}, {'step_number': 16, 'description': '[1차 튀김]\n튀김옷을 입혀놓았던 닭다리살을 굴려가며 전분가루와 전분 알갱이를 묻혀주세요.꼭 두껍게 묻히지 않아도 됩니다.', 'image_url': 'https://recipe1.ezmember.co.kr/cache/recipe/2022/12/31/3ff31140773295597c67c16c2d982c711.png'}, {'step_number': 17, 'description': '[1차 튀김]\n기름에 닭다리살을 넣고 4분 동안 튀겨주세요.\n한 번에 너무 많은 양을 튀기면 기름 온도가 갑자기 낮아질 수 있으니 4~5개씩 나눠가며 튀겨주세요.튀긴 다음에는 5분 정도 래스팅(휴식) 해주세요. 래스팅하는 동안에도 겉면의 열이 속살까지 전달됩니다.', 'image_url': 'https://recipe1.ezmember.co.kr/cache/recipe/2022/12/31/dc30b71c8de91c71eba542d5c95126781.jpg'}, {'step_number': 18, 'description': '[2차 튀김]\n한번 튀겼던 닭다리살을 다시 한번 튀겨주세요.\n2차 튀김은 180도에서 2분 동안 튀겨줄건데요, 온도측정기가 없다면 Step15처럼 전분 알갱이를 넣어 적정한 온도만 맞춰주세요!', 'image_url': 'https://recipe1.ezmember.co.kr/cache/recipe/2022/12/31/5fc3113f2059701916c01a3bf85307991.jpg'}, {'step_number': 19, 'description': '[생략 가능한 곁들임]\n대파 3개를 잘게 썰어주세요.\n저는 대파를 잘게 썰어 파닭처럼 가라아게에 곁들여 먹으면 더 맛있더라고요~ 파 좋아하시는 분들은 꼭 한번 같이 드셔보세요.대파 3개 (생략 가능)', 'image_url': 'https://recipe1.ezmember.co.kr/cache/recipe/2022/12/31/4bea386eedfda627148368645753c6191.png'}, {'step_number': 20, 'description': '식혀둔 소스에 Step8에서 썰어둔 대파 흰 부분을 넣어주세요. 파 향이 소스에 스며들거예요~', 'image_url': 'https://recipe1.ezmember.co.kr/cache/recipe/2022/12/31/57ba902575ead52e8b0a13fa0785cc201.png'}, {'step_number': 21, 'description': ""곁들임과 함께 가라아게를 플레이팅하고, 소스까지 같이 놓으면 '치킨 가라아게' 완성입니다!맥주가 있다면 꼭 곁들여보세요! 맥주랑 정말 잘 어울립니다."", 'image_url': 'https://recipe1.ezmember.co.kr/cache/recipe/2022/12/31/9a7856f29d81cb7f3011b0fe8d3c3d081.jpg'}]"
38793,메인반찬,술안주,닭고기,튀김,집에서 깐풍기 만드는법 깐풍기 소스 레시피,깐풍기,"4,094",30분 이내,초급,2인분,"[('닭다리살', '500g'), ('전분가루', '2/3컵'), ('달걀', '1개'), ('생강술', '1T'), ('생강가루', '약간'), ('소금', '1/4t'), ('후추', '약간'), ('대파 흰부분', '1대'), ('홍고추', '1개'), ('청양고추', '1개'), ('피망', '1/2개'), ('고추기름', '3T'), ('건고추', '1/2개'), ('다진마', '1T'), ('간장', '2T'), ('굴소스', '1T'), ('황설탕', '2T'), ('식초', '3T'), ('맛술', '1T'), ('참기름', '1T')]",닭다리살을 바삭하게 튀긴 뒤 매콤하면서 짭짤한 양념에 볶아내어 특별한 손님초대요리 준비해 보았어요. 밖에서 사 먹어야 할 것 같이 만들기 어려울 것 같은 요리지만 튀기는 과정 이외에 소스 팁만 알면 의외로 어렵지 않아요.,"[{'step_number': 1, 'description': '닭다리살은 키친타월로 핏물을 닦은 뒤 한입에 먹기 좋게 잘라줍니다.도마 , 조리용나이프 , 키친타올', 'image_url': None}, {'step_number': 2, 'description': '생강술(청주) 1 큰 술, 소금 1/4 작은 술 생강가루 약간, 후추 약간 넣고 버무려서 밑간을 해줍니다.볼', 'image_url': 'https://recipe1.ezmember.co.kr/cache/recipe/2024/02/10/202e1e4b6fa69e14454313d70366d6c61.png'}, {'step_number': 3, 'description': '전분가루 2/3종이 컵, 달걀 1개를 풀어 넣고 반죽을 만들어 줍니다.', 'image_url': 'https://recipe1.ezmember.co.kr/cache/recipe/2024/02/10/8d29272051b3cfb8da28e8cfd0f21e0e1.png'}, {'step_number': 4, 'description': '피망과 고추는 가운데 씨를 제거하고 대파와 같이 잘게 썰어줍니다.', 'image_url': 'https://recipe1.ezmember.co.kr/cache/recipe/2024/02/10/82def153cc7d940d307f371ec93f87e11.png'}, {'step_number': 5, 'description': '팬에 식용유를 넉넉히 두르고 170도 정도로 달구어지면 닭고기 반죽을 하나씩 넣고 튀겨요.튀김팬 , 요리젓가락', 'image_url': 'https://recipe1.ezmember.co.kr/cache/recipe/2024/02/10/dd2e4f5e6f630188611c0f6add8994431.png'}, {'step_number': 6, 'description': '서로 붙지 않도록 젓가락으로 톡톡 저어가며 튀겨줍니다. 한번 건져내어 다시 튀겨주면 더 바삭해요.건지개', 'image_url': 'https://recipe1.ezmember.co.kr/cache/recipe/2024/02/10/700e33445c4351751139026cfba631521.png'}, {'step_number': 7, 'description': '팬에 고추기름 3T, 다진 마늘 1T와 건고1/2개를 넣고 재료의 향이 올라오도록 볶아줍니다.프라이팬 , 요리스푼', 'image_url': 'https://recipe1.ezmember.co.kr/cache/recipe/2024/02/10/805e6692d00c2e8a6680cb226a4a72961.png'}, {'step_number': 8, 'description': '마늘 향이 풍부해지면 대파, 피망, 고추를 넣고 같이 가볍게 볶아줍니다.', 'image_url': 'https://recipe1.ezmember.co.kr/cache/recipe/2024/02/10/f375e8df9805670620caaf2086b305541.png'}, {'step_number': 9, 'description': '아래 재료를 넣고 소스를 만들어 바글바글 끓여줍니다.간장 2T, 굴소스 1T, 황설탕 2T, 식초3T, 맛술 1T, 소금 약간, 참기름 1T', 'image_url': 'https://recipe1.ezmember.co.kr/cache/recipe/2024/02/10/9abf06c4175a06507a3667bbdddcafe51.png'}, {'step_number': 10, 'description': '소스가 바글바글 끓으면 튀긴 닭을 넣고 버무려줍니다.', 'image_url': 'https://recipe1.ezmember.co.kr/cache/recipe/2024/02/10/8e98f0c7aa56f69302431d23bcf3e8cc1.png'}, {'step_number': 11, 'description': '먹기 좋게 그릇에 담아주면 맛있는 깐풍기 완성이에요 :)접시', 'image_url': 'https://recipe1.ezmember.co.kr/cache/recipe/2024/02/10/e1a83fb639fec05387ad36a6a72c972b1.png'}]"
