index,종류별,상황별,재료별,방법별,글 제목,레시피이름,조회수,조리시간,난이도,인분,재료,소개글,조리순서
59975,면/만두,일상,소고기,끓이기,라면만큼 쉬운 홈메이드 쌀국수 (with. 시판양념),쌀국수,"1,652",15분 이내,아무나,1인분,"[('시판쌀국수소스', ''), ('쌀국수면', ''), ('차돌양지                                                                                or 샤브샤브용 고기', '2장'), ('숙주', '1줌'), ('레몬', '1쪽'), ('고수                                                                                or 미나리 참나물', '약간'), ('홍고추', '약간'), ('쪽파', '약간'), ('양파', '1개'), ('소금', '2작은술'), ('설탕', '2큰술'), ('식초', '4큰술'), ('물', '6큰술')]",시판양념을 이용해서 10분만에 만드는 홈메이드 쌀국수 레시피.,"[{'step_number': 1, 'description': '양파절임 소스를 만들어 채칼을 이용해 링 모양으로 썰은 양파에 절인다.', 'image_url': 'https://recipe1.ezmember.co.kr/cache/recipe/2020/11/25/89e03d624005cc79a546a4d8744efc6e1.jpg'}, {'step_number': 2, 'description': '쌀국수면은 끓는물에 30초 데치거나 찬물에 10분간 불린다.불지 않은 면을 좋아해서 찬물에 불리는 방법을 선택했어요.', 'image_url': 'https://recipe1.ezmember.co.kr/cache/recipe/2020/11/25/8bad19b0c4392b4c9ab590a9f491fe551.jpg'}, {'step_number': 3, 'description': '시판 소스에 있는 상품안내대로 쌀국수 소스에 물을 섞어 끓인 뒤 쌀국수용 고기를 넣어 데치고 숙주는 담궜다 건졌다 토렴해요.', 'image_url': 'https://recipe1.ezmember.co.kr/cache/recipe/2020/11/25/c1e19b4fa9dad27e7b6d82ce8a2476a81.png'}, {'step_number': 4, 'description': '찬물에 불린 면을 그릇에 담고 양파절임 올리고 고기고명과 숙주, 레몬을 올린 뒤 육수를 담고 홍고추, 쪽파, 미나리를 얹어 마무리해요.', 'image_url': 'https://recipe1.ezmember.co.kr/cache/recipe/2020/11/25/ac7304696d4d9896b302c4e7b715aa501.jpg'}]"
59976,면/만두,일상,소고기,끓이기,차돌박이를 넣은 달래 크림소스 파스타!!! 겨울이지만 봄을 향을~~~,달래크림소스파스타,"1,422",20분 이내,초급,1인분,"[('우유', '150g'), ('달래', '10g'), ('휘핑크림', '100g'), ('차돌박이', '100g'), ('참기름', '1작은스푼'), ('소금', '조금'), ('후추', '조금'), ('링귀니', ''), ('달래', ''), ('마늘', ''), ('치즈가루', ''), ('후추', ''), ('소금', '')]","아직 날씨가 추운데도 시장에 달래가 많이 나와 있습니다. 요즘은 하우스에서 재배해서 
봄이 아직이지만 이렇게 봄의 맛을 맛볼 수 있겠 되었네요. 

달래를 보니 예전에 현직에 있을 때 개발한 봄 시즌 메뉴가 있어 한 번 만들어 봤습니다. 
달래 넣은 크림소스에 부드럽고 고소한 차돌박이를 넣은 파스타!!! 

달래의 톡 쏘는 매운맛과 향은 마늘과 같은 ‘알리신’ 성분이라고 합니다. 그래서인지 
마늘과 같이 사용하면 파스타와 무척 잘 어울립니다. 

한번 만들어 보면 크림소스에서 은근히 나는 달래 향과 고소한 차돌박이가 파스타와 너무 잘 어울려 마음에 드실 겁니다.","[{'step_number': 1, 'description': '소스는 달래를 잘게 자른 후 우유와 갈아 버립니다.\n휘핑크림을 넣어 섞으면 완성입니다.', 'image_url': 'https://recipe1.ezmember.co.kr/cache/recipe/2020/01/02/895f9db42583163fe1c7f5d1c08a6c981.jpg'}, {'step_number': 2, 'description': '차돌박이 마리네이드\n먹기 좋은 크기로 자른 후 참기름, 소금, 후추로 밑간을 해 둡니다.', 'image_url': 'https://recipe1.ezmember.co.kr/cache/recipe/2020/01/02/09fe9e85b1fd5b6c0ef9eb7006b8d9081.jpg'}, {'step_number': 3, 'description': '달래는 머리 부분을 다져 놓습니다.\n나머지 달래는 1cm 크기로 자릅니다.\n마늘은 슬라이스합니다.', 'image_url': 'https://recipe1.ezmember.co.kr/cache/recipe/2020/01/02/ae7f557d5aa313a53970c646e4d553c51.jpg'}, {'step_number': 4, 'description': '면은 1L의 물에 소금 10g에 6~7분 간 삶습니다.(나중에 소스에 익히는 시간을 감안)', 'image_url': 'https://recipe1.ezmember.co.kr/cache/recipe/2020/01/02/dfbd7782f2122a7db8e157ee7db55d561.jpg'}, {'step_number': 5, 'description': '식용유 2 스푼 정도의 양에 마늘과 다진 달래 머리를 중불에 천천히 볶습니다.', 'image_url': 'https://recipe1.ezmember.co.kr/cache/recipe/2020/01/02/e7201caa21e60cde82194b05f8f448861.jpg'}, {'step_number': 6, 'description': '마늘과 달래가 갈색이 되면 만들어 놓은 소스를 넣습니다.', 'image_url': 'https://recipe1.ezmember.co.kr/cache/recipe/2020/01/02/91cd10cdee54692a61733db0ca23a3da1.jpg'}, {'step_number': 7, 'description': '삶은 파스타와 후추와 1cm 크기로 자른 달래와 땡초를 부셔서 넣고 끓입니다.', 'image_url': 'https://recipe1.ezmember.co.kr/cache/recipe/2020/01/02/b08536e45f1284586beb2b938fc528dd1.jpg'}, {'step_number': 8, 'description': '어느 정도 농도가 나오면 치즈가루를 넣고 간을 보고 간이 부족하면 소금으로 간을 합니다', 'image_url': 'https://recipe1.ezmember.co.kr/cache/recipe/2020/01/02/bd049e10ffec1032f6883572282f58401.jpg'}, {'step_number': 9, 'description': '마지막으로 차돌박이를 넣어 반 정도만 익힌 후 마무리한 후 그릇에 담습니다.차돌박이는 잔열로 익혀 부드럽게 먹을 수 있도록 합니다.', 'image_url': 'https://recipe1.ezmember.co.kr/cache/recipe/2020/01/02/125b8115e3e7d506c015fad38e5322c61.jpg'}]"
59977,면/만두,일상,소고기,끓이기,등촌칼국수 만들기~,칼국수,"4,115",15분 이내,아무나,1인분,"[('소고기 샤브샤브용', '먹고싶은만큼'), ('양파', '1/2개'), ('파', '1/2개'), ('참타리버섯', '1팩'), ('미나리', ''), ('홍고추', '1개'), ('청양고추가루', '1개'), ('칼국수면', '1개'), ('물', '650ml'), ('쯔유', '50ml'), ('고추장', '1스푼'), ('고추가루', '2스푼'), ('다진마늘', '1스푼'), ('후추', '조금')]","여러분 제가 등촌칼국수를 진짜좋아합니다.
너무 맛있는대.. 집에서 만들어먹어볼까하고 한번만들어봤는대
웬걸..넘나맛있엉...간단하게 만들어서 드셔보세요~
맛이 100프로 같진않지만 맛있는 얼큰샤브샤브라고 보시면됩니다! 고고!!

♬ 레시피는 영상에서 만나보시구요~ 
재밋게 보셨다면~ 여러분들께 도움이 되셨다면~?
구독 알람설정 부탁드릴께요'ㅅ'//♥","[{'step_number': 1, 'description': '준비한 야채들을 모두 손질해주세요~\n양파와 파, 미나리, 고추들~ 다 썰어주시구요~\n느타리나 참타리버섯같은경우에는 찢어서 준비해주세요!\n=ㅅ=////', 'image_url': None}, {'step_number': 2, 'description': ""준비한 육수(물650ml+쯔유50ml)를 냄비에 넣고\n끓여줄껀대요~ 끓기전에~ 양념재료들을 다 넣고 \n끓여주시면 됩니다 ㅎ'ㅅ'//"", 'image_url': None}, {'step_number': 3, 'description': '육수가 끓기시작하면~\n손질한 야채들을 다 같이넣고 끓여주세요~', 'image_url': None}, {'step_number': 4, 'description': '따로 소금간은 안해두되요 ㅎ 쯔유물이 이미 간이\n다되있기때문에 간은 딱맞을거에요 ㅎ=ㅅ=///\n벌써요리가..끝났는대요..?...', 'image_url': None}, {'step_number': 5, 'description': '하튼~ 그렇게 끓여놓은 국물에다가\n샤브샤브용 소고기를 샤브샤브처럼 드시면되요~\n미나리도 리필해가면서요 ㅎ-_-///\n그이후에 다드신다음에 칼국수 면을 넣고 끓여드시면\n완전 배부른 1끼입니다!!', 'image_url': None}]"
59978,면/만두,일상,소고기,끓이기,육즙 가득 고소함과 풍미 가득한 차돌박이카레우동 만들기,차돌박이카레우동,"1,339",30분 이내,초급,1인분,"[('차돌박이', '200g'), ('우동 사리', '1봉지'), ('양파', '1개'), ('느타리버섯', '150g'), ('페퍼론치노', '5개'), ('매운맛 카레가루', '100g')]","저는 집밥을 자주 만들어 먹기 때문에 냉장고 또는 찬장에 떨어지지 않게 쟁여 두는 식재료들이 있는데요. 우동 사리, 차돌박이, 카레 가루도 그중 하나랍니다!
오늘은 제가 애정하는 이 세 가지 재료를 활용해서 차돌박이카레우동을 만들어 보려고 해요! 확실히 제가 좋아하는 재료들로만 요리를 하니 절로 신이 나더라고요!","[{'step_number': 1, 'description': '양파 한 개는 얇게 채 썰어요.', 'image_url': 'https://recipe1.ezmember.co.kr/cache/recipe/2021/01/13/9da622e474444e890a3909efaf6d77f81.jpg'}, {'step_number': 2, 'description': '느타리버섯은 가닥가닥 찢어서 준비합니다.버섯은 꼭 느타리버섯이 아니라, 새송이버섯, 미니새송이버섯 등 취향에 따라 선택하셔도 돼요.\n단 표고버섯의 경우 향이 너무 세므로 추천하지 않는답니다!', 'image_url': 'https://recipe1.ezmember.co.kr/cache/recipe/2021/01/13/cdd4e0a0da7d3445452464a7babbb2541.jpg'}, {'step_number': 3, 'description': '페퍼론치노홀 다섯 개는 잘게 다져 준비해요.', 'image_url': 'https://recipe1.ezmember.co.kr/cache/recipe/2021/01/13/29db461ff05cec29c805fae64f185ac71.jpg'}, {'step_number': 4, 'description': '냄비를 중불로 달군 뒤 냉동 상태의 차돌박이를 넣고 볶아요.', 'image_url': 'https://recipe1.ezmember.co.kr/cache/recipe/2021/01/13/9289f64737d470a7a8697664370ebd371.jpg'}, {'step_number': 5, 'description': '차돌박이는 기름이 많은 부위여서 굽다 보면 이렇게 기름이 나온답니다. 그러니 냄비에 따로 기름을 두르지 말고, 차돌박이를 볶아 주세요!', 'image_url': 'https://recipe1.ezmember.co.kr/cache/recipe/2021/01/13/83a6d1f9395353cdc7ff325414af35911.jpg'}, {'step_number': 6, 'description': '차돌박이에서 기름이 적당히 나오면 양파, 느타리버섯, 페퍼론치노를 넣고 센 불로 볶아요.', 'image_url': 'https://recipe1.ezmember.co.kr/cache/recipe/2021/01/13/2515e1727c09e8e479985c2e44f238b51.jpg'}, {'step_number': 7, 'description': '양파가 투명하게 익으면, 물을 500ml를 붓고 한소끔 더 끓입니다.', 'image_url': 'https://recipe1.ezmember.co.kr/cache/recipe/2021/01/13/51cbd666887cce8058554515a25b400b1.jpg'}, {'step_number': 8, 'description': '재료들이 다 익으면 카레가루 100g을 넣고, 잘 저어 주면서 적당한 농도가 될 때까지 끓이면 차돌박이카레는 완성이에요!', 'image_url': 'https://recipe1.ezmember.co.kr/cache/recipe/2021/01/13/7f41ccad9e22eeaedacc15b25819a3171.jpg'}, {'step_number': 9, 'description': '이제 우동 사리를 삶아 줍니다. 끓는 물에 우동 사리를 넣고 잘 풀어 주며 2분간 끓여요.', 'image_url': 'https://recipe1.ezmember.co.kr/cache/recipe/2021/01/13/acb79a6d43c3e3816f5ff5a85de4f2331.jpg'}, {'step_number': 10, 'description': '그리고 체에 걸러 건진 다음 얼음 몇 조각을 넣고 찬물에 헹굽니다! 얼음을 넣으면 우동 면발이 더 탱탱해진답니다! 이제 요리는 끝이에요!', 'image_url': 'https://recipe1.ezmember.co.kr/cache/recipe/2021/01/13/9796d87133d44b12a4060935d8816b561.jpg'}, {'step_number': 11, 'description': '준비한 접시 한 켠에 우동 면을 담고, 그 옆에 차돌박이카레를 붓습니다.', 'image_url': 'https://recipe1.ezmember.co.kr/cache/recipe/2021/01/13/ff1a8ccfe50488b118c550aeec059c261.jpg'}, {'step_number': 12, 'description': '그리고 취향에 따라 토핑을 올리면 되는데, 저는 쫑쫑 썬 쪽파와 반숙 계란이 잘 어울릴 거 같아 둘을 올려 보았어요!', 'image_url': 'https://recipe1.ezmember.co.kr/cache/recipe/2021/01/13/2ef4ba6bc85ab4216128acd130c821921.jpg'}]"
59979,면/만두,일상,소고기,끓이기,베트남 쌀국수 만드는 법 양파 초절임 쌀국수 레시피 쌀국수 요리,쌀국수,"3,755",30분 이내,초급,2인분,"[('쌀국수', '140g'), ('소고기', '100g'), ('숙주', '140g'), ('고수', '조금'), ('대파', '조금'), ('양파', '1/2개'), ('사골국물', '6컵'), ('참치액', '1T'), ('국간장', '1T'), ('청양고추', '1개'), ('식초', '2T'), ('설탕', '1T'), ('소금', '0.5T')]","베트남 쌀국수 좋아하시죠?
요즘은 집에서도 즐겨 먹는 쌀국수
쌀국수 집에서 쉽고 맛있게 만드는법 소개 합니다.","[{'step_number': 1, 'description': '소고기는 샤브 용으로 준비 하시면 됩니다.', 'image_url': 'https://recipe1.ezmember.co.kr/cache/recipe/2023/02/22/f0e20114528e46ccaf189a8a4c8531f21.jpg'}, {'step_number': 2, 'description': '쌀국수는 물에 불려서 사용해도 되고\n삶아서 준비 하시면 됩니다.', 'image_url': 'https://recipe1.ezmember.co.kr/cache/recipe/2023/02/22/5a6d1da8052ad30b209a2c1c9deedf6e1.jpg'}, {'step_number': 3, 'description': '오늘은 쌀국수 1시간 정도 불려 주었어요.\n쌀국수는 최소 한 시간 이상은 불려 주셔야 부드러워요.', 'image_url': 'https://recipe1.ezmember.co.kr/cache/recipe/2023/02/22/03f484bf32c5f77ae81e5cd186758aa21.jpg'}, {'step_number': 4, 'description': '양파 반 개는 채 썰어서\n양파 초 절임 양념에 30분 정도 절여 줍니다.', 'image_url': 'https://recipe1.ezmember.co.kr/cache/recipe/2023/02/22/414c6d387b4e04d2e99e22155186b6621.jpg'}, {'step_number': 5, 'description': '30분 정도 절여 둔 양파는 \n물에 가볍게 행구어 물기를 빼 줍니다.', 'image_url': 'https://recipe1.ezmember.co.kr/cache/recipe/2023/02/22/e82a2b12ca25b4b49a1251e3f51c05f31.jpg'}, {'step_number': 6, 'description': '소고기는 맛술, 국 간장을 넣어 밑 간을 해 줍니다.', 'image_url': 'https://recipe1.ezmember.co.kr/cache/recipe/2023/02/22/9eb4edcaf66d94eadc994343f1e351771.jpg'}, {'step_number': 7, 'description': '사골 국물에 참치 액과 국 간장으로 기본 간을 해 해 줍니다.\n팔팔 끓는 사골 국물에 \n소고기를 넣어 부드럽게 익혀 줍니다.', 'image_url': 'https://recipe1.ezmember.co.kr/cache/recipe/2023/02/22/c76eebf349cc1eb68dfb52f092e8dcc61.jpg'}, {'step_number': 8, 'description': '익힌 소고기는 쌀국수 고명으로 올려 주려 구요.', 'image_url': 'https://recipe1.ezmember.co.kr/cache/recipe/2023/02/22/ed7151b1851e7db9fbe01a12ee800b0e1.jpg'}, {'step_number': 9, 'description': '소고기를 1차로 익혀서 건져 놓고\n쌀국수를 넣어 익혀 줍니다.\n불린 쌀국수는 서너 번 넣었다 빼는 정도로 토렴 하여 줍니다.', 'image_url': 'https://recipe1.ezmember.co.kr/cache/recipe/2023/02/22/7127aedfd9a619e33ef936fce9af7da61.jpg'}, {'step_number': 10, 'description': '익힌 쌀국수는 그릇에 담고', 'image_url': 'https://recipe1.ezmember.co.kr/cache/recipe/2023/02/22/398f372c866d22e0543b2b15e643e16b1.jpg'}, {'step_number': 11, 'description': '고명으로 \n숙주, 양파초절임, 익힌 소고기, 대파, 후추, 고수를 넣고', 'image_url': 'https://recipe1.ezmember.co.kr/cache/recipe/2023/02/22/4347e8de5bc6c90d0c467c42ec0dba1a1.jpg'}, {'step_number': 12, 'description': '뜨겁게 끓여 놓은 사골국물을 가지런히 부어 줍니다.\n마른청양고추를 한개 부셔 넣었어요.', 'image_url': 'https://recipe1.ezmember.co.kr/cache/recipe/2023/02/22/beec81cbdf3bbf9ea2614f96dd6c746d1.jpg'}]"
59980,면/만두,일상,소고기,끓이기,[식약처] 삼색소고기만두,소고기만두,369,60분 이내,중급,1인분,"[('애호박', '30g'), ('소금', '0.5g'), ('부추', '30g'), ('숙주', '30g'), ('두부', '30g'), ('달걀', '50g'), ('소고기', '50g'), ('다진 파', '20g'), ('다진 마늘', '10g'), ('참기름', '5g'), ('후춧가루', '0.03g'), ('시금치', '30g'), ('소금', '0.5g'), ('당근', '30g'), ('들깨가루', '30g'), ('밀가루', '200g'), ('녹말가루', '20g'), ('양파', '20g'), ('다시마', '10g'), ('건새우', '10g'), ('건멸치', '20g')]",삼삼한 밥상 조리법을 소개합니다.,"[{'step_number': 1, 'description': '시금치는 끓는 물에 소금을 넣고 데쳐 \n찬물에 식힌 후 곱게 갈아 준비한다', 'image_url': 'https://recipe1.ezmember.co.kr/cache/recipe/2022/11/10/561d72f1a514a00c54fb9e055101143f1.png'}, {'step_number': 2, 'description': '당근즙, 시금치즙, 들깨가루를 각각 \n준비한 뒤, 밀가루와 녹말가루를 \n세 개로 나눠 각각의 즙을 넣어 반죽 후 \n숙성시킨다.', 'image_url': 'https://recipe1.ezmember.co.kr/cache/recipe/2022/11/10/7554b4777a4c82b808de5ea11d702aee1.png'}, {'step_number': 3, 'description': '호박은 채를 썰어 소금에 살짝 절여 \n물기를 제거하고, 부추는 송송 썰고, \n숙주는 데쳐 물기를 제거하고 다지고, \n두부는 면포에 물기를 꼭 짜서 준비한다.', 'image_url': 'https://recipe1.ezmember.co.kr/cache/recipe/2022/11/10/3e3f420fe0d4ec31efe72338c2908a2d1.png'}, {'step_number': 4, 'description': '달걀은 노란자와 흰자를 나눠 각각 \n지단을 붙여 준비한다. 냄비에 멸치와 \n다시마, 건새우, 양파를 넣고 약30분 \n정도 끓여 체에 걸러 육수를 만들어 \n놓는다.', 'image_url': 'https://recipe1.ezmember.co.kr/cache/recipe/2022/11/10/92f8e422e31d59da3f3aa2ad76b036941.png'}, {'step_number': 5, 'description': '소고기는 곱게 다져, 파 , 마늘, 참기름, \n후춧가루를 넣어 양념을 해 놓는다.', 'image_url': 'https://recipe1.ezmember.co.kr/cache/recipe/2022/11/10/4b34cd7f44b0ccbda01b298d5b5fd8db1.png'}, {'step_number': 6, 'description': '❻ 준비한 채소(❸)와 고기(❺)를 섞어 \n만두속을 만들고, 숙성된 밀가루 \n반죽(❷)을 밀어 만든 만두피에 만두\n속을 넣어 만두를 만든다. 준비한 육수\n(❹)에 삼색 만두를 넣어 끓여 담고 그 \n위에 달걀지단을 올려 완성한다.', 'image_url': 'https://recipe1.ezmember.co.kr/cache/recipe/2022/11/10/75a7d2cae5878a629b7530fe9eda9d241.png'}]"
59981,면/만두,일상,소고기,끓이기,"고깃집 된장국수, 차돌박이국수 만들기",차돌박이국수,"3,336",30분 이내,아무나,2인분,"[('차돌박이', '200g'), ('애호박', '1/2개'), ('대파', '1/2대'), ('느타리버섯                                                                                150g', '1.5뿌리'), ('청양고추', '2개'), ('물', '500ml'), ('시판 사골육수', '500ml'), ('된장', '2.5숟가락'), ('다진마늘', '1숟가락'), ('고추장', '0.7숟가락'), ('후추', '약간')]","기름지고 고소한 차돌박이 달달 볶아 사골육수 부어 보글보글 끓여낸 된장 육수에 소면을 넣어 보세요~
​구수하고 눅진하고 칼칼한 것이 세상에 이런 별미가 없답니다.","[{'step_number': 1, 'description': '된장육수 베이스 음식은\n재료가 단순할수록 맛이 깊고 좋으니\n대파와 고추는 필수로\n버섯, 호박, 양파, 감자 등의 채소는\n두어가지만 준비하세요', 'image_url': 'https://recipe1.ezmember.co.kr/cache/recipe/2020/11/18/05af1e5b473b045391a70a9e96c72ea21.jpg'}, {'step_number': 2, 'description': '호박은 어슷 썰어 조금 두껍게 채 썰고 버섯은 밑동 제거 후 가닥가닥 뜯기 대파와 청양고추는 송송 썰어 준비합니다.', 'image_url': 'https://recipe1.ezmember.co.kr/cache/recipe/2020/11/18/727d891f2f90965a1ef64776bfaa31551.jpg'}, {'step_number': 3, 'description': '그리고 차돌박이는 키친타월로 눌러\n핏물을 가볍게 제거했어요', 'image_url': 'https://recipe1.ezmember.co.kr/cache/recipe/2020/11/18/c0b10db02ab9a4d106ca931c1210b9991.jpg'}, {'step_number': 4, 'description': '넉넉한 냄비를 중강불로 달구고\n차돌박이를 넣어 볶아주고\n기름이 너무 많이 나와\n물을 붓기 전에\n기름을 2/3정도 걷어냈어요중강불', 'image_url': 'https://recipe1.ezmember.co.kr/cache/recipe/2020/11/18/d2a54e6b1c8184d90dcc26652684b6201.jpg'}, {'step_number': 5, 'description': '고기가 노릇하게 익으면\n물 500ml, 사골육수 500ml를 붓고\n끓어오르면 거품을 걷어냅니다.', 'image_url': 'https://recipe1.ezmember.co.kr/cache/recipe/2020/11/18/a7289ccd550d14fab4c2caac9d9542d81.jpg'}, {'step_number': 6, 'description': '이어 된장 2.5스푼을 볼록 떠서 풀어줬는데요\n된장의 염도는 집집마다 다르기 때문에\n처음부터 정량을 넣지 말고 조절하세요', 'image_url': 'https://recipe1.ezmember.co.kr/cache/recipe/2020/11/18/3b991e540f72e538022148174da2f1431.jpg'}, {'step_number': 7, 'description': '된장을 푼 육수에\n버섯과 호박, 다진마늘 1을 넣고\n2분 정도 끓이다가', 'image_url': 'https://recipe1.ezmember.co.kr/cache/recipe/2020/11/18/f31e12d8a0197e2b3ea6e710687ca1cd1.jpg'}, {'step_number': 8, 'description': '고추장 0.7스푼을 넣어 한소끔 끓인 후\n삶은 소면과 대파, 고추를 넣어주면 완성이에요~\n육수의 간은\n\n소면이 들어가며 싱거워지기 때문에\n\n국보다는 짜고 찌개보다는 싱겁게 만들어요.', 'image_url': 'https://recipe1.ezmember.co.kr/cache/recipe/2020/11/18/6e1e72b13e904ae1cf9d8a49ab17be2a1.jpg'}, {'step_number': 9, 'description': '소면을 넣는 타이밍은 기호에 맞게 ^^\n눅진한걸 원하면 고추장을 푼 육수에 소면을 처음부터 넣어 익히고\n깔끔한 것을 원하면 소면을 따로 익혀 그릇에 담은 후 육수를 부어요.\n중간맛을 좋아하면 소면을 2분 정도 익힌 후 육수에 담가 마저 익혀주면 됩니다', 'image_url': 'https://recipe1.ezmember.co.kr/cache/recipe/2020/11/18/e32b854419a0f96657482fcd37c26f9f1.jpg'}, {'step_number': 10, 'description': '저는 호박을 넣음과 동시에 다른 냄비에\n소면을 삶아줬구요\n2분 정도 삶은 후 헹구지 않고\n육수에 퐁당 담가 1분 정도 더 익혀줬어요~된장 국수에 들어가는 소면은 삶은 후 찬물에 바락바락 헹구지 않고 그대로 넣어야 제맛을 즐길 수 있답니다~', 'image_url': 'https://recipe1.ezmember.co.kr/cache/recipe/2020/11/18/362b727aafee69108a6eec9dc83e0ecb1.jpg'}, {'step_number': 11, 'description': '매운맛과 육수의 간은 입맛에 맞게 가감하시고\n마지막에 후추 톡톡 뿌려서 완성하세요 :)', 'image_url': 'https://recipe1.ezmember.co.kr/cache/recipe/2020/11/18/e78a0a5abcd24f69396934be50476df51.jpg'}, {'step_number': 12, 'description': '칼칼하고 구수하고 풍미 깊은\n차돌박이국수\n사골육수와 된장, 차돌박이에게\n배신이란 없습니다.', 'image_url': 'https://recipe1.ezmember.co.kr/cache/recipe/2020/11/18/6d1f467b2df9bebaf8fac672a95fec7d1.jpg'}, {'step_number': 13, 'description': '야들야들한 차돌박이와\n굵게 썰어 부서지지 않은 호박\n탱글한 면발에\n구수칼칼한 국물까지\n오감을 만족시키는 차돌박이된장국수\n정말정말 맛있으니까 꼭 한번 끓여보세요', 'image_url': 'https://recipe1.ezmember.co.kr/cache/recipe/2020/11/18/83ca42cad2757f1e16db5c1740b6d8411.jpg'}]"
