index,종류별,상황별,재료별,방법별,글 제목,레시피이름,조회수,조리시간,난이도,인분,재료,소개글,조리순서
53820,찌개,일상,해물류,끓이기,얼큰하고 시원한 임영웅오징어찌개 속이 확~풀리는 맛!,오징어찌개,"4,254",30분 이내,초급,2인분,"[('오징어', '1마리'), ('멸치육수', '500ml'), ('애호박', '적당량'), ('감자', '적당량'), ('양파', '적당량'), ('고추장', '1T'), ('다진마늘', '0.5T'), ('간장', '1T'), ('새우젓', '약간'), ('밀가루', '1스푼'), ('소금', '0.5스푼')]",TV에서 임영웅씨가 어머님이 해주신 오징어찌개를 제일 좋아한다고 너무 맛있게 드셔서 더욱 유명해진 임영웅오징어찌개! 만드는 레시피도 정말 간단해서 쉽게 만드실 수 있어요. 국으로 좋은 임영웅 오징어찌개 간단하게 만들어보겠습니다.,"[{'step_number': 1, 'description': '임영웅오징어찌개를 끓여주기위해서 멸치육수를 먼저 만들어줍니다. 물 500ml에 멸치육수팩을 넣고 끓여주었어요.멸치육수', 'image_url': 'https://recipe1.ezmember.co.kr/cache/recipe/2022/04/18/1fd39628fbc78082e4da19001136efb91.jpg'}, {'step_number': 2, 'description': '이제 멸치육수가 만들어지는동안 오징어찌개에 들어갈 재료를 준비해줄거예요. 애호박과 감자, 양파는 먹기 좋은 크기로 썰어주세요. 저는 빨리 익혀서 먹을 것이라 조금 얇게 썰어주었습니다. \n그리고 오징어손질은 내장, 오징어눈, 오징어입을 제거해주고 흐르는 물에 오징어를 씻어줍니다. 그런 후 밀가루 1스푼, 굵은소금 0.5스푼을 넣고 바락바락 문질러준 후 깨끗하게 물에 씻어주세요. 그리고 먹기좋게 오징어를 썰어주시면 됩니다. 저는 미리 손질해서 냉동실에 소분해둔 오징어를 해동 후 사용했어요. 저는 오징어 1마리를 임영웅오징어찌개에 사용했습니다. :)애호박, 감자, 양파, 오징어애호박 손질법 레시피', 'image_url': 'https://recipe1.ezmember.co.kr/cache/recipe/2022/04/18/b023e3824b304ce445f1bb760499efe41.jpg'}, {'step_number': 3, 'description': '멸치육수가 끓어오르면 멸치육수팩을 건져주고 고추장 1스푼, 다진마늘 0.5스푼을 넣고 다시한번 끓여줍니다.고추장, 다진마늘', 'image_url': 'https://recipe1.ezmember.co.kr/cache/recipe/2022/04/18/ffc9275897cd17483d8d170e816ddd3f1.jpg'}, {'step_number': 4, 'description': '이제 간장 1스푼을 넣고 애호박과 양파, 감자도 모두 넣어주세요. 그리고 감자가 약간 익어간다싶을때 오징어도 넣어 보글보글 맛있게 끓여주셔요.간장, 애호박, 양파, 감자, 오징어', 'image_url': 'https://recipe1.ezmember.co.kr/cache/recipe/2022/04/18/03b09632e22d3655417278cd0a6330901.jpg'}, {'step_number': 5, 'description': '감자가 다 익었다면 간을 보신 후 새우젓으로 입맛에 맞게 간을 맞춰주세요. 그리고 한소끔 한번 더 끓여주면 임영웅오징어찌개 만들기 끝입니다.새우젓', 'image_url': 'https://recipe1.ezmember.co.kr/cache/recipe/2022/04/18/65d8e122876d0b4b554831a183a3b68e1.jpg'}, {'step_number': 6, 'description': '임영웅오징어찌개 완성입니다!\n바쁜 아침에도 후다닥 만들 수 있는 레시피에요.\n뜨끈한 국물에 쫄깃하고 오동통한 오징어와 푸짐하게 들어간 애호박, 양파에 포슬포슬 감자까지 함께 먹으니 든든하더라구요. 해장에도 좋은 오징어찌개이자 오징어국이예요.', 'image_url': 'https://recipe1.ezmember.co.kr/cache/recipe/2022/04/18/9188817f4890d7c221b210798d3084b81.jpg'}, {'step_number': 7, 'description': '임영웅씨가 어릴적부터 좋아했다는 오징어찌개!\n그 이유를 알 것 같아요. 국물이 깊고 진해서 자꾸만 손이 갑니다. 이런게 진짜 밥도둑이겠죠?\n얼큰하고 시원해서 속풀기에도 좋습니다.\n오징어찌개를 파는 식당은 많이 찾아보기 어렵다던데 이렇게 쉽고 간단하게 집에서 임영웅 오징어찌개 만들어 든든하게 드셔보셔요! 맛있는 임영웅오징어찌개 레시피였습니다!', 'image_url': 'https://recipe1.ezmember.co.kr/cache/recipe/2022/04/18/508365d093038ba005a50d583c49231e1.jpg'}]"
53821,찌개,일상,해물류,끓이기,냉동꽃게 된장찌개,꽃게된장찌개,"1,494",60분 이내,초급,2인분,"[('꽃게', '1마리'), ('쪽파', '25g'), ('배춧잎', '1장'), ('양파', '1/6개'), ('무', '70g'), ('버섯', '25g'), ('청양고추', '2개'), ('오징어', '60g'), ('두부', '1/4모'), ('집된장', '1.5T'), ('육수', '3C'), ('설탕', '1/3T'), ('고춧가루', '1T'), ('바지락', '150g')]","냉동 꽃게를 가지고 손질하여 집된장을 넣고 보글보글
된장찌개를 끓였어요. 열반찬이 부럽지 않게 맛있네요.
바지락을 넣어 더욱 시원한 맛을 내준 해물 된장 요리 입니다.","[{'step_number': 1, 'description': '바지락이 요즘 제철인듯~~\n살이 꽉차고 알찬것이 국물도 뽀얗게 \n올라오네요. 먼저 해감을 시켜주는데요,\n숟가락을 넣고, 검은 비닐로 덮어 놓으면\n두시간정도 지나 검은 해감을 토해 냅니다.', 'image_url': 'https://recipe1.ezmember.co.kr/cache/recipe/2022/04/28/761b1d363772b1566a328bf488eb6e501.jpg'}, {'step_number': 2, 'description': '꽃게도 아주 실해요.\n냉동 꽃게는 해동을 시킨뒤에 껍데기를 제거하고,\n속에 들어 있는 알을 파서 준비해요.\n알이 꽉 찼어요. 허파도 떼어내고 먹기좋은\n크기로 잘라 준비 합니다.', 'image_url': 'https://recipe1.ezmember.co.kr/cache/recipe/2022/04/28/4f65892bf27ea4e5259bc1ee5cea4a3b1.jpg'}, {'step_number': 3, 'description': '재료가 맛있고 좋아서인지 꽃게 된장찌개에\n들어가는 재료도 푸짐 하네요.', 'image_url': 'https://recipe1.ezmember.co.kr/cache/recipe/2022/04/28/98dcc46be28460bc381f5fdd5bc7d5121.jpg'}, {'step_number': 4, 'description': '대파를 이용하면 좋지만, 냉장고에 쪽파가 몇개 \n있어서 이용했어요. (25g), 배춧잎 1장 (25g),\n양파 1/6 크기(40g), 무 70g, 꼬마새송이버섯 (25g),\n청양고추 2개 (25g), 두부 1/4모 (85g), 오징어 60g\n모두 먹기좋은 크기로 썰어 준비했어요.', 'image_url': 'https://recipe1.ezmember.co.kr/cache/recipe/2022/04/28/1f898c99585f7fb64495836fb6061a421.jpg'}, {'step_number': 5, 'description': '해물 된장 찌개 끓일 뚝배기에 재료들을 \n차곡차곡 올려줍니다. 그리고 집돤장 \n1+1/2T와 청양고추도 같이 올려 줍니다.', 'image_url': 'https://recipe1.ezmember.co.kr/cache/recipe/2022/04/28/4b6a9991d735a224de9638c07fcbc81f1.jpg'}, {'step_number': 6, 'description': '제가 항상 만들어 놓고 사용하는 육수인데요,\n대파, 양파, 무, 다시마, 표고버섯, 멸치, 황태\n를 넣어 푹 끓인 육수 랍니다.\n3C을 부어 주었어요.', 'image_url': 'https://recipe1.ezmember.co.kr/cache/recipe/2022/04/28/64ffd7df4aee4d5a7b1c3e3bbda71bca1.jpg'}, {'step_number': 7, 'description': '그리고 조미료 대신에 설탕을 1/3T 넣었는데\n생략해도 좋아요.', 'image_url': 'https://recipe1.ezmember.co.kr/cache/recipe/2022/04/28/2d84ff0488d8e6b5df011e6fa9a101661.jpg'}, {'step_number': 8, 'description': '육수가 끓기 시작하면 손질한 \n꽃게 넣어줘요.', 'image_url': 'https://recipe1.ezmember.co.kr/cache/recipe/2022/04/28/4d6a6975c90b8b3b3952ed8fd5e1fe9e1.jpg'}, {'step_number': 9, 'description': '거품이 생기면 살짝 걷어냅니다.\n깔끔한 국물이 되거든요.', 'image_url': 'https://recipe1.ezmember.co.kr/cache/recipe/2022/04/28/e2a69df82913f3e621aca2185e5affc91.jpg'}, {'step_number': 10, 'description': '색감을 위해 고춧가루 1T를 넣어 줍니다.\n보글보글 잘 끓고 있어요.', 'image_url': 'https://recipe1.ezmember.co.kr/cache/recipe/2022/04/28/a083817d49611bcf8d27ff8a68788ed31.jpg'}, {'step_number': 11, 'description': '마지막으로 해감한 바지락을 넣어\n한소끔 끓여준 뒤에 바지락이 입을 \n벌리기 시작하면 불을 끄고 식탁으로 옮겨요.\n남은 여열로 바지락이 익는 답니다.', 'image_url': 'https://recipe1.ezmember.co.kr/cache/recipe/2022/04/28/8a94823bd7e840f2c2978970094493541.jpg'}]"
53822,찌개,일상,해물류,끓이기,"바쁜 아침, 담백한 맛! 우렁된장찌개",우렁된장찌개,860,30분 이내,아무나,2인분,"[('우렁이', '100g'), ('두부', '1/2모'), ('표고버섯', '2개'), ('호박', '1/3개'), ('당근', '1/5개'), ('양파', '1/2개'), ('홍초', '1개'), ('대파', '1/2대'), ('된장', '2숟가락'), ('육수', '4컵'), ('마늘', '약간')]","바쁜 아침, 담백한 맛! 우렁된장찌개 우렁이 쌈장을 만들고 남은 게 있어 우렁이 된장찌개를 만들어 보았습니다.","[{'step_number': 1, 'description': '준비한 재료는 잘게 썰어 준비한다.', 'image_url': 'https://recipe1.ezmember.co.kr/cache/recipe/2022/05/02/8f521d59c3edee76159160f28d9e46481.jpg'}, {'step_number': 2, 'description': '멸치와 다시마로 육수를 내주고, 끓으면 준비한 재료를 넣어준다.', 'image_url': 'https://recipe1.ezmember.co.kr/cache/recipe/2022/05/02/27d0834bd1736965fdaca0f378dbdbd71.jpg'}, {'step_number': 3, 'description': '재료가 익으면 된장을 풀어주고, 마늘과 대파를 넣고 마무리한다.', 'image_url': 'https://recipe1.ezmember.co.kr/cache/recipe/2022/05/02/56be0a631325f2a470b17d2e307cd4e61.jpg'}]"
53823,찌개,일상,해물류,끓이기,오징어 찌개 시원한맛,오징어찌개,"1,542",20분 이내,초급,4인분,"[('오징어', '250g'), ('무', '200g'), ('양파', '1/2개'), ('두부', '1/2모'), ('고춧가루', '2Ts'), ('간 마늘', '1/2Ts'), ('참치 액젓', '2Ts'), ('국 간장', '2Ts'), ('들기름', '2Ts'), ('파', '1대'), ('청량고추', '1개'), ('물', '4종이컵')]","반찬이 필요없는 얼큰 하고 시원한 오징어 찌개,김치만 
있으면 밥 한그릇 뚝딱…
냉장고에 있는 무와 함께 오징어 찌개를 만들어 봐요.","[{'step_number': 1, 'description': '무는 껍질을 벗기고,\n납작 썰기를 해 주세요.\n(4등분 후에 썰어 주세요)무 한조각 200g칼 , 도마 , 접시너무 크지 않고 두껍지 않게 썰어 주세요', 'image_url': 'https://recipe1.ezmember.co.kr/cache/recipe/2021/09/23/fe84c2b0c339f7c9a0da3606daea990d1.jpg'}, {'step_number': 2, 'description': '양파와 두부도 무의 크기에 마추어\n썰어 주세요.양파1/2,두부 반모도마 , 칼 , 접시무 크기와 비슷하게 썰어 주세요.', 'image_url': 'https://recipe1.ezmember.co.kr/cache/recipe/2021/09/23/d0f0958787ae9d6dbbdaa8e28e5def8d1.jpg'}, {'step_number': 3, 'description': '오징어를 깨끗이 씻은 후에 다리를 \n떼어 내고 지그재그로 칼집을 넣은 후에\n세로로 길게 반을 잘라 주세요.\n(오그라 들어 말리지 않게 칼집을 내어\n주세요)오징어1칼 , 도마칼집을 내어 주세요', 'image_url': 'https://recipe1.ezmember.co.kr/cache/recipe/2021/09/23/03869e53dcfc12a75346d31e949576731.jpg'}, {'step_number': 4, 'description': '먹기 좋게 썰어 주세요. 다리도 함께오징어1칼 , 도마 , 접시', 'image_url': 'https://recipe1.ezmember.co.kr/cache/recipe/2021/09/23/7fa251cbbc826418c50734994772f7541.jpg'}, {'step_number': 5, 'description': '냄비에 들기름 2Ts두른 후에,간마늘1/2Ts,고춧가루 2Ts을 넣어 10초간\n뒤적인 후에,무와 참치액2Ts을 넣고\n2분정도 볶아 주세요.들기름2Ts,무,간마늘1/2Ts,고춧가루2Ts,참치액2Ts냄비 , 스푼중불고춧가루 타지 않도록 바로 이어서 참치액을 넣어 주세요.', 'image_url': 'https://recipe1.ezmember.co.kr/cache/recipe/2021/09/23/a745da8e02c99225e093a6513e01e5951.jpg'}, {'step_number': 6, 'description': '양파를 넣고 30초 볶다가 물을 종이컵\n두컵(240ml)을 부은 후에,팔팔 끓여주고\n다시 물 2컵을 부어 끓여 주세요.,무,양파,고춧가루,들기름,액젓,물4컵중불팔팔 끓여 주세요.', 'image_url': 'https://recipe1.ezmember.co.kr/cache/recipe/2021/09/23/d1c53405b4e66e6c2e1a74d708a7d5201.jpg'}, {'step_number': 7, 'description': '국물이 끓어 오른 후에 오징어와 두부를 넣고, 국간장2Ts을\n넣어 후루룩 끓여 주세요(1분정도)오징어,두부,국간장2Ts냄비 , 스푼중불후루룩 끓여 잠시 끓여 주세요. 미리 오징어를 넣으면\n질겨 지겠죠.', 'image_url': 'https://recipe1.ezmember.co.kr/cache/recipe/2021/09/23/825a45de25cf8ba7fcb617cff65416571.jpg'}, {'step_number': 8, 'description': '청량고추 썰은 것과 대파 썰은 것을 넣고\n기호에 맞게 소금은 첨가 해도 좋겠죠.불을 \n끈 후에,\n국 대접에 담으면,밥도둑인 얼큰 시원한\n오징어 찌개가 완성 되었네요.대파,청량고추1구그릇불끄기 직전에 파와 청량고추를 넣어 주세요.', 'image_url': 'https://recipe1.ezmember.co.kr/cache/recipe/2021/09/23/05d99270a52ea89084a441e638f3ab601.jpg'}]"
53824,찌개,일상,해물류,끓이기,동태매운탕/동태찌개:급 쌀쌀해진 날씨에 딱이야!,동태매운탕,"3,774",20분 이내,초급,4인분,"[('동태', ''), ('멸치다시국물', ''), ('무', ''), ('두부', ''), ('표고버섯', ''), ('참타리버섯', ''), ('호박', ''), ('양파', ''), ('파', ''), ('미나리', ''), ('소금', ''), ('고춧가루', ''), ('어간장', ''), ('맛술', ''), ('다진마늘', ''), ('생강가루', ''), ('후추', '')]",급 추워진 날씨에 알맞은 찌개요리,"[{'step_number': 1, 'description': '쌀뜨물에 다시마와 멸치, 무를 넣고 끓이다 무가 투명하게 익으면 다시마와 멸치는 꺼낸다.', 'image_url': 'https://recipe1.ezmember.co.kr/cache/recipe/2021/10/18/584bb7833b456768f4571224acf6476f1.jpg'}, {'step_number': 2, 'description': '손질한 동태를 넣고 끓인다.', 'image_url': 'https://recipe1.ezmember.co.kr/cache/recipe/2021/10/18/855e49e6d0f0d5dee33439ef1b030a531.jpg'}, {'step_number': 3, 'description': '버섯, 호박, 양파 등을 넣고 양념다데기를 넣어 팔팔 끓인다.고추장이나 된장을 조금 넣어도 구수하니 좋다.', 'image_url': 'https://recipe1.ezmember.co.kr/cache/recipe/2021/10/18/d91db63303630b10cb5f699e25f9451b1.jpg'}, {'step_number': 4, 'description': '한소끔 끓어오르면 두부를 넣어 끓인다.', 'image_url': 'https://recipe1.ezmember.co.kr/cache/recipe/2021/10/18/2f7aabd36d4ea9bb931e9dc579dde7ce1.jpg'}, {'step_number': 5, 'description': '대파와 미나리를 넣고 불을 끈다.', 'image_url': 'https://recipe1.ezmember.co.kr/cache/recipe/2021/10/18/321929edc18b5fc60881102b8380f1be1.jpg'}, {'step_number': 6, 'description': '간을 보고 싱거우면 소금이나 국간장으로 간을 더한다.', 'image_url': 'https://recipe1.ezmember.co.kr/cache/recipe/2021/10/18/8a995ff47275d277ea78aa95517833ca1.jpg'}]"
53825,찌개,일상,해물류,끓이기,"1월 겨울생선 양미리요리 양미리된장찌개/무된장찌개, 양미리손질법",양미리된장찌개,499,30분 이내,초급,3인분,"[('양미리', '6마리'), ('멸치육수', '700ml'), ('무', '120g'), ('대파', '1/2개'), ('청양고추', '2개'), ('양파', '적당량'), ('표고버섯', '적당량'), ('애호박', '적당량'), ('두부', '적당량'), ('된장', '1.5스푼'), ('고추장', '0.5스푼'), ('다진마늘', '0.5스푼'), ('황설탕', '2티스푼'), ('생강즙', '0.5스푼'), ('소금', '약간')]","겨울제철 영양만점 양미리 넣고 된장찌개 보글보글 끓였어요~
생선 넣은 된장찌개가 좀 낯설수 있겠지만
한번 맛을 보면 비린맛 1도 없어 생선 들어 갔는지도 모르고
입맛을 단숨에 사로잡게 되는 된장찌개입니다ㅎㅎ","[{'step_number': 1, 'description': '재료 준비해 주세요~', 'image_url': 'https://recipe1.ezmember.co.kr/cache/recipe/2023/02/14/7c37e17fb9a583c09ae6762a8bd141da1.jpg'}, {'step_number': 2, 'description': '양미리손질은 정말 간단합니다\n양미리는 비늘이 없는데 긁어야 한다는 사람도 있는데ㅋ\n우리집은 머리와 꼬리만 가위로 잘라 주고\n물에 몇번 씻어 준 다음 한입에 먹기 좋게 작게 썰어 줘요~\n머리 자르면 내장이 자동으로 쑥 따라 나와\n따로 내장 빼거나 할 필요도 없어요~', 'image_url': 'https://recipe1.ezmember.co.kr/cache/recipe/2023/02/14/c070422a29032e4a7a730c8ffb0dd7451.jpg'}, {'step_number': 3, 'description': '된장찌개 재료는 무, 표고버섯, 양파,\n애호박, 두부, 청양고추, 대파 준비했는데\n먹기 좋은 사이즈로 썰어 주세요~', 'image_url': 'https://recipe1.ezmember.co.kr/cache/recipe/2023/02/14/2577e66591f533b3a0ba0accd41955df1.jpg'}, {'step_number': 4, 'description': '멸치육수 붓고 무를 먼저 넣어 주세요~멸치육수 대신 다시마나 표고육수도 좋고\n육수 없으면 쌀뜨물로 만드시면 되는데\n그것도 없으면 맹물 부어 끓여도 됩니다', 'image_url': 'https://recipe1.ezmember.co.kr/cache/recipe/2023/02/14/f8363cccd1bfa9589cddc1b9a681559e1.jpg'}, {'step_number': 5, 'description': '적힌 분량의 된장과 고추장을 넣어 주세요~콩덩어리 씹히는거 안 좋아하면 체에\n된장 곱게 풀어 넣으면 되고 집집마다 된장 간이 다르니\n입맛에 맞게 가감해 넣어 주세요~', 'image_url': 'https://recipe1.ezmember.co.kr/cache/recipe/2023/02/14/c9632fceb347fa78060ede8151e4cd9f1.jpg'}, {'step_number': 6, 'description': '5분 정도 끓인 후 양미리, 애호박, 양파, 두부를\n차례대로 넣어 주고 황설탕 약간 넣고 5분 더 끓여 주세요~\n설탕 약간 넣어 주면 된장 특유의 쓴맛을\n잡을 수 있고 국물 감칠맛도 낼 수 있어 좋답니다', 'image_url': 'https://recipe1.ezmember.co.kr/cache/recipe/2023/02/14/5cdf6d1a132bd0f773c82b52a2d17aa51.jpg'}, {'step_number': 7, 'description': '다진마늘과 생강즙을 넣고 3분 정도 더 끓인 다음\n파와 청양고추 넣고 간을 본 후 부족한 간은 소금으로 맞춰 주세요~\n생강즙 대신 생강술이나 생강가루, 다진생강 다 좋습니다', 'image_url': 'https://recipe1.ezmember.co.kr/cache/recipe/2023/02/14/911c782b9e532e19c46707a01a3891371.jpg'}, {'step_number': 8, 'description': '한번 후루룩 끓여 주면 양미리된장찌개 완성입니다', 'image_url': 'https://recipe1.ezmember.co.kr/cache/recipe/2023/02/14/eb64125e80ffa077712befb0ad99f3ed1.jpg'}]"
53826,찌개,일상,해물류,끓이기,오징어고추장찌개 만드는 법 시원하고 칼칼한 오징어찌개,오징어고추장찌개,"5,018",30분 이내,아무나,4인분,"[('오징어', '2마리'), ('무', '150g'), ('대파', '1/2대'), ('청양고추', '2개'), ('콩나물', '2줌'), ('물', '800ml'), ('국물 멸치', '1/2줌'), ('다시마', '5장'), ('고추장', '1숟가락'), ('고춧가루', '2숟가락'), ('소주', '1숟가락'), ('다진마늘', '1숟가락'), ('국간장', '1숟가락'), ('소금', '약간'), ('후추', '톡톡')]","콩나물의 시원한 맛이 목젓을 치고, 고추장의 묵직한 깊은맛이 식도를 때리는 오징어고추장찌개. 갓 지은 밥과 소주 한 병이면 하루의 피로가 싹 가신답니다~비리지 않고 시원하게 끓여내는 고추장오징어찌개 레시피 보고가세요.","[{'step_number': 1, 'description': '손질 된 오징어 두 마리는 흐르는 물에 깨끗하게 씻어서 물기를 빼두어요. 특히, 다리에 붙어 있는 빨판을 손으로 훑으며 꼼꼼하게 씻어주세요~믹싱볼 , 채반', 'image_url': 'https://recipe1.ezmember.co.kr/cache/recipe/2023/02/24/64311eecadcecc1fe9e21ca6873053e61.jpg'}, {'step_number': 2, 'description': '오징어 껍질은 익으면 질겨지고 국물을 탁하게 만드므로 벗겨줄게요. 껍질의 아래쪽에 길게 칼집을 넣고 키친타월로 슥슥 밀어주면 아주 쉽게 벗길 수 있어요.도마 , 조리용나이프 , 키친타월', 'image_url': 'https://recipe1.ezmember.co.kr/cache/recipe/2023/02/24/7ab8a8f41aeb70386681238c305118bf1.jpg'}, {'step_number': 3, 'description': '몸통 안쪽에 격자무늬로 칼집을 넣은 다음 먹기 좋은 크기로 큼직큼직하게 잘라주면 오징어 준비 끝. 익으면서 크기가 줄어드니 큼직하게 잘라주세요.칼집은 생략하셔도 됩니다.', 'image_url': 'https://recipe1.ezmember.co.kr/cache/recipe/2023/02/24/fd734f33d9f3c3b8b9662b71680052ee1.jpg'}, {'step_number': 4, 'description': '뚝배기에 물 800ml를 붓고 국물 멸치와 다시마를 넣은 다음 센 불을 켜고, 끓어오르면 다시마는 건져내고 중불로 줄여 10분간 더 끓인 후 멸치를 건져내어 육수를 만들어요.뚝배기 , 건지개멸치는 물에 넣기 전, 전자레인지에 30초 돌린 후 식혀서 사용하면 비린내과 잡내 제거에 좋습니다.', 'image_url': 'https://recipe1.ezmember.co.kr/cache/recipe/2023/02/24/c0eca009837c9211ae6e23c70e4f9d981.jpg'}, {'step_number': 5, 'description': '육수가 끓는 동안 채소를 준비해요. 레시피에 들어가는 야채는 모두 넣어주면 가장 좋고, 애호박을 추가해도 좋습니다.양파는 추천하지 않아요', 'image_url': 'https://recipe1.ezmember.co.kr/cache/recipe/2023/02/24/94cd2d741646204466b43078364126fc1.jpg'}, {'step_number': 6, 'description': '콩나물은 씻어서 물기를 빼두고 무는 얇게 나박나박 썰고 고추와 대파는 송송 썰어줍니다.', 'image_url': 'https://recipe1.ezmember.co.kr/cache/recipe/2023/02/24/eec0fae9bf83cc12d95112354a80b4e61.jpg'}, {'step_number': 7, 'description': '준비 된 육수에 고추장 1스푼을 풀어넣고 고춧가루 2숟가락과 무를 넣은 다음 중불로 5분 정도 끓여줍니다. 중불고추장의 양은 봉긋하게 1스푼입니다!\n\n\u200b', 'image_url': 'https://recipe1.ezmember.co.kr/cache/recipe/2023/02/24/2295801ded7de116e4c51e14086c3cc11.jpg'}, {'step_number': 8, 'description': '무가 반 정도 익으면 오징어, 콩나물 다진마늘 1, 소주 1, 국간장 1숟가락을 넣고 센불로 3분 정도 끓여주세요.조리용스푼센불', 'image_url': 'https://recipe1.ezmember.co.kr/cache/recipe/2023/02/24/1fbad089491aad584c2821efb4967f5b1.jpg'}, {'step_number': 9, 'description': '비린내 증발을 위해 뚜껑은 연 채로 끓이고 뜨는 거품은 걷어내어 줍니다.', 'image_url': 'https://recipe1.ezmember.co.kr/cache/recipe/2023/02/24/4382f27c66b0dd32c8195c90779276fa1.jpg'}, {'step_number': 10, 'description': '마지막으로 고추와 파를 넣고 한소끔만 더 끓여주면 완성!! 후추 톡톡 뿌려 마무리하고 싱거우면 소금을 추가하세요~', 'image_url': 'https://recipe1.ezmember.co.kr/cache/recipe/2023/02/24/4012f726018624f29fdfacb4bd1fb80a1.jpg'}, {'step_number': 11, 'description': '김이 펄펄 나는 찌개 한 그릇 역시 뚝배기에 끓인 찌개가 가장 맛있습니다.', 'image_url': 'https://recipe1.ezmember.co.kr/cache/recipe/2023/02/24/5c3c71a52b041d0a8d08c6d6d53f30d41.jpg'}, {'step_number': 12, 'description': '소주를 넣고 뚜껑을 연 채로 끓여서 콩나물과 오징어 모두 비리지 않아요. 센불로 재빠르게 끓여서 부드러운 오징어와 아삭한 콩나물의 식감도 그대로 살아있답니다.', 'image_url': 'https://recipe1.ezmember.co.kr/cache/recipe/2023/02/24/fb14a675d426c2b3d9dfd68bbac30f981.jpg'}, {'step_number': 13, 'description': '쫄면 퐁당 담가서 함께 끓여먹어도 참 맛있을 것 같다는 생각이 드는 오징어찌개입니다~', 'image_url': 'https://recipe1.ezmember.co.kr/cache/recipe/2023/02/24/1174605e6c0c52a7fa408c59ccb7e4c71.jpg'}]"
53827,찌개,일상,해물류,끓이기,꽃게 된장 찌개 만드는 법,꽃게된장찌개,"1,722",30분 이내,중급,6인분 이상,"[('꽃게', '2마리'), ('꽃게 등딱지 내장', '6개'), ('멸치 다시마 육수', '1200ml'), ('감자', '1개'), ('양파', '1개'), ('애호박', '1개'), ('두부', '1모'), ('청양고추', '4개'), ('포고 버섯', '2개'), ('된장', '5큰술')]","꽃게철이라 꽃게찜, 간장게장 만들어 먹고 오늘은 꽃게 된장찌개를 끓였어요. 보통 된장찌개와 똑같이 끓이면서 꽃게를 넣었을 뿐인데도 맛은 천지차이예요. 꽃게 맛성분이 된장찌개의 맛을 한층 맛있게 끌어 올려 해물탕같은 된장찌개 맛이예요. 꽃게 양이 많다 보니된장찌개 양이 저절로 대용량이 되어버렸네요.","[{'step_number': 1, 'description': '육수를 끓여 주고 물이 끓으면 다시마를 건지고 멸치는 5분 정도 더 끓여 주고 건져내 주세요.냄비', 'image_url': 'https://recipe1.ezmember.co.kr/cache/recipe/2023/03/17/413ee5be1da5ff044dae294ea718d4b21.jpg'}, {'step_number': 2, 'description': '야채를 먹기 좋게 깍뚝썰기해 주세요.도마 , 조리용나이프', 'image_url': 'https://recipe1.ezmember.co.kr/cache/recipe/2023/03/17/64efe8f1d82d4e6a079be1f79d50a40a1.jpg'}, {'step_number': 3, 'description': '감자를 넣고 3분 정도 끓이다가 다른 야채와 꽃게를 넣고 된장을 풀어 넣어요.', 'image_url': 'https://recipe1.ezmember.co.kr/cache/recipe/2023/03/17/164d6a34d24900bb29b4e9d5d278029e1.jpg'}, {'step_number': 4, 'description': '거품이 많이 생겨서 걷어내면서 10분 정도 더 끓여 주세요.', 'image_url': 'https://recipe1.ezmember.co.kr/cache/recipe/2023/03/17/d2f4c51f3dab9f00ce908d88efd573dc1.jpg'}, {'step_number': 5, 'description': '먹기 직전에 두부를 넣고 한소끔 끓여 주고 마무리 해주세요.', 'image_url': 'https://recipe1.ezmember.co.kr/cache/recipe/2023/03/17/a6ce6c5569e142481e2ec7348a5edb4c1.jpg'}]"
