index,종류별,상황별,재료별,방법별,글 제목,레시피이름,조회수,조리시간,난이도,인분,재료,소개글,조리순서
22368,메인반찬,일상,닭고기,볶음,바싹불고기,바싹불고기,"1,833",60분 이내,고급,2인분,"[('쇠고기불고기용', '300 g'), ('오이', '1/2 개'), ('깻잎', '4 장'), ('붉은양파', '1/2 개'), ('배즙', '1 큰술'), ('후추', '약간'), ('흑설탕', '1 큰술'), ('간장', '2 큰술'), ('설탕', '3 작은술'), ('꿀', '1 큰술'), ('청주', '1 큰술'), ('다진마늘', '1/2 큰술'), ('다진파', '1 큰술'), ('참기름', '1 작은술'), ('고춧가루', '1 작은술')]",마포의 명물 바싹 불고기를 집에서도 손쉽게 즐겨보자. 일반 불고기에서는 느낄 수 없는 불맛과 달달한 양념 맛이 매력. 깻잎 무침을 듬뿍 곁들이거나 쌈으로 즐겨도 맛있다.,"[{'step_number': 1, 'description': '쇠고기에 배즙 1큰술과 후추 약간을 넣고 버무려 10분 정도 재워둔다. 여기에 간장 2큰술, 설탕 2작은술, 꿀 1큰술, 청주 1큰술, 다진 마늘 1/2큰술, 다진 파 1큰술, 참기름 1/2작은술, 후추 약간을 넣고 다시 한 번 버무려 30분~1시간 정도 재운다.', 'image_url': 'https://recipe1.ezmember.co.kr/cache/recipe/2018/08/06/02b584a001ddca89c8a27e602e1deb4e.jpg'}, {'step_number': 2, 'description': '오이와 깻잎, 붉은 양파는 가늘게 채 썬다. 고춧가루 1작은술과 설탕 1작은술, 깨소금 1작은술, 식초 1작은술, 참기름 1/2작은술을 넣고 섞어 무침 양념을 만들어 둔다.', 'image_url': 'https://recipe1.ezmember.co.kr/cache/recipe/2018/08/06/796d262ce69976144b214839c30da2bb.jpg'}, {'step_number': 3, 'description': '달군 팬에 흑설탕 1큰술을 녹인 후 양념해 둔 불고기를 넣어 젓가락으로 수분을 날려가며 볶는다.', 'image_url': 'https://recipe1.ezmember.co.kr/cache/recipe/2018/08/06/686b6a41532cfcc3d5224680603c248a.jpg'}, {'step_number': 4, 'description': '오이와 깻잎, 붉은 양파에 무침 양념을 넣어 가볍게 버무린다. 접시에 불고기를 담은 뒤 양념한 채소를 곁들인다.', 'image_url': 'https://recipe1.ezmember.co.kr/cache/recipe/2018/08/06/c45fa617bca375c02e61a036cdda974f.jpg'}]"
22369,메인반찬,일상,닭고기,볶음,고추장 닭 불고기와 얼갈이 배추 무침,고추장닭불고기,"1,928",60분 이내,중급,2인분,"[('쌀', '적당량'), ('닭다리살', '200g'), ('레몬', '1/2개'), ('로즈마리', '1작은술'), ('소금', '약간'), ('후추', '약간'), ('고추장', '1큰술'), ('고춧가루', '1작은술'), ('간장', '1작은술'), ('설탕', '1큰술'), ('파', '1작은술'), ('마늘', '1작은술'), ('얼갈이배추', '1포기'), ('까나리액젓', '1/4큰술'), ('간장', ''), ('다진파', '1/2큰술'), ('다진마늘', '1/4큰술'), ('참깨', '1/4큰술'), ('식초', '1큰술'), ('소금', '약간'), ('설탕', '1/4큰술')]","해찬들 고추장을 활용한 정영옥 참가자의 닭불고기 요리. 상큼한 레몬과 허브의 향이 가득베인 매콤한 닭다리구이에 얼갈이 배추를 재빠르게 무쳐 한 젓가락 푸짐이 들어올리면 진수성찬 부럽지않다. 기름이 쏙 빠진 매콤한 닭다리살은 무더운 여름날 술안주로도, 아이들 간식으로도 딱이다.","[{'step_number': 1, 'description': '닭다리살을 레몬, 로즈마리, 소금, 후추로 15~20분 재워둔다.', 'image_url': 'https://recipe1.ezmember.co.kr/cache/recipe/2018/08/06/a52ae4e62dab4bfa811109ac03dcf157.jpg'}, {'step_number': 2, 'description': '분량의 재료로 양념장을 만들어 레몬 등에 재워둔 닭다리살과 섞어 20분간 숙성시킨다.', 'image_url': 'https://recipe1.ezmember.co.kr/cache/recipe/2018/08/06/63113a13d81eb1dc85b3311826db054b.jpg'}, {'step_number': 3, 'description': '달궈진 팬에 기름을 두르고 양념에 재워진 닭다리 살을 앞뒤로 굽는다.', 'image_url': 'https://recipe1.ezmember.co.kr/cache/recipe/2018/08/06/baf3f34a0a3b632090b660d1d4c61391.jpg'}, {'step_number': 4, 'description': '팬에 구운 닭다리살을 그릴에 5분간 구워 기름을 뺀다.', 'image_url': 'https://recipe1.ezmember.co.kr/cache/recipe/2018/08/06/fcd5d6589813aadb27accb3e1d454848.jpg'}, {'step_number': 5, 'description': '끓는 물에 소금을 약간 넣고 얼갈이 배추를 넣어 파랗게 데친다.', 'image_url': 'https://recipe1.ezmember.co.kr/cache/recipe/2018/08/06/f2cf8a904e05d58e8dbf3dc95218a376.jpg'}, {'step_number': 6, 'description': '데친 배추는 물기를 제거한 후 송송 썬다.', 'image_url': 'https://recipe1.ezmember.co.kr/cache/recipe/2018/08/06/6da55495b674e44604aeaea317cef030.jpg'}, {'step_number': 7, 'description': '분량의 재료로 양념장을 만들어 얼갈이 배추를 무쳐낸다.', 'image_url': 'https://recipe1.ezmember.co.kr/cache/recipe/2018/08/06/f7f52e81e4c3fdd56efb39527047ae04.jpg'}]"
22370,메인반찬,일상,닭고기,볶음,쌈장 닭갈비,쌈장닭갈비,"2,947",30분 이내,중급,2인분,"[('닭고기', '600 g'), ('양파', '1/2 개'), ('당근', '5 cm'), ('숙주', '1 줌'), ('소금', '약간'), ('후춧가루', '약간'), ('백설건강을생각한요리유', '약간'), ('해찬들사계절쌈장', '5 큰술'), ('올리고당                                                                                백설', '3큰술'), ('맛술', '1 큰술')]",춘천에서 시작돼 국민요리가 된 닭갈비는 양념이 맛의 핵심이다. 다양한 재료와 함께 철판에 볶아 먹는 조리 형태인 만큼 양념구성과 비율로 맛이 달라지기 때문이다. 실패 없이 닭갈비를 만드는 가장 쉬운 방법은 바로 쌈장을 활용하는 것. 냉장고에 한 두 개쯤 있는 시판 쌈장으로 만든 닭갈비에 올리고당과 맛술만 살짝 넣으면 제대로 된 닭갈비 맛을 낼 수 있다.,"[{'step_number': 1, 'description': '닭고기는 뼈를 발라내고 먹기 좋은 크기로 잘라 소금?후춧가루로 간하여 재운다.', 'image_url': 'https://recipe1.ezmember.co.kr/cache/recipe/2018/08/06/6f47bc76d67e43bc271e0431aa2269b5.jpg'}, {'step_number': 2, 'description': '양파, 당근은 0.5cm 두께로 채 썬다. 숙주는 깨끗이 씻어 물기를 뺀다.', 'image_url': 'https://recipe1.ezmember.co.kr/cache/recipe/2018/08/06/af111ea6d7da5cf0fd4aaae73f0fdf5a.jpg'}, {'step_number': 3, 'description': '쌈장, 올리고당, 맛술을 고루 섞어 양념을 만든 다음 닭고기, 양파, 당근과 함께 버무린다.', 'image_url': 'https://recipe1.ezmember.co.kr/cache/recipe/2018/08/06/e3c22ac4e4988c54d17a5308180714c6.jpg'}, {'step_number': 4, 'description': '달군 팬에 요리유를 두르고 3을 올려 볶는다.', 'image_url': 'https://recipe1.ezmember.co.kr/cache/recipe/2018/08/06/58c3e6ca9b09ac36cd0f2a8332fa0cd1.jpg'}, {'step_number': 5, 'description': '숙주를 넣고 한 번 더 바싹 볶아 접시에 담는다.', 'image_url': 'https://recipe1.ezmember.co.kr/cache/recipe/2018/08/06/0c6cf82641764d3f4bb3a6542f0fead4.jpg'}]"
22371,메인반찬,일상,닭고기,볶음,"최고의 요리 비결, 이혜정의 치즈 닭갈비",None,"1,318",None,None,None,"[('닭다리살', '500g'), ('모차렐라 치즈', '200g'), ('감자', ''), ('양배추', '550g'), ('표고버섯', '3개'), ('물', ''), ('', ''), ('청주', ''), ('간장', '3T'), ('고추장', ''), ('다진 마늘', '1T'), ('생강가루', '1t'), ('설탕', '')]",,[]
22372,메인반찬,일상,닭고기,볶음,기념일에 좋은 경장육사(닭가슴살로 만들어봤어요),경장육사,"1,438",30분 이내,아무나,2인분,"[('닭가슴살                                                                                240g', '1쪽'), ('춘장                                                                                20g', '1큰술'), ('양배추', '60g'), ('대파 흰부분', '2개'), ('춘장', '20g'), ('설탕', '1/2큰술'), ('다진마늘', '1/2큰술'), ('맛술', '1큰술'), ('생강가루', '1/2티스푼'), ('식용유', '2큰술'), ('간장', '1큰술'), ('생강술                                                                                또는 청주', '1큰술')]",돼지고기를 춘장에 볶아 파채와 곁들여 먹는 중식요리 경장육사를 닭가슴살로 만들어봤어요. 간단하면서 보기에도 좋은 음식이라 기념일에 좋아요.,"[{'step_number': 1, 'description': '재료준비', 'image_url': 'https://recipe1.ezmember.co.kr/cache/recipe/2018/09/29/2a9e230a63cd7a4fc83c8b52179960351.jpg'}, {'step_number': 2, 'description': '- 닭가슴살 반으로 저민 후 0.3cm 두께로 채썰어 밑간 양념 넣어 조물조물 밑간해놓기\n- 대파 흰 부분 중 1/4개는 송송 썰고 나머지는 최대한 가늘게 채썰기\n- 양배추 0.3cm 두께로 채썰기', 'image_url': 'https://recipe1.ezmember.co.kr/cache/recipe/2018/09/29/7f393267f198932c40a22134511a97b91.jpg'}, {'step_number': 3, 'description': '- 파채 아린맛 제거위해 찬물에 담가놓기', 'image_url': 'https://recipe1.ezmember.co.kr/cache/recipe/2018/09/29/093a0ee86359ddb1f9913894a5111c131.jpg'}, {'step_number': 4, 'description': '- 팬에 식용유, 다진마늘, 생강가루, 송송썬파 넣어 중불에서 볶기', 'image_url': 'https://recipe1.ezmember.co.kr/cache/recipe/2018/09/29/001768b2308eae908aed42841452672d1.jpg'}, {'step_number': 5, 'description': '- 재료들이 노릇해지면 춘장 넣어 약 1분정도 볶기', 'image_url': 'https://recipe1.ezmember.co.kr/cache/recipe/2018/09/29/a882968cd6edd56dce6766bceb1e28fe1.jpg'}, {'step_number': 6, 'description': '- 밑간한 닭가슴살과 맛술', 'image_url': 'https://recipe1.ezmember.co.kr/cache/recipe/2018/09/29/6de94ea8bba5eb517b9e79a4d6a1835f1.jpg'}, {'step_number': 7, 'description': '- 설탕 넣어 센불에서 볶기', 'image_url': 'https://recipe1.ezmember.co.kr/cache/recipe/2018/09/29/5c76907e3d2999943df50c471d0eb37d1.jpg'}, {'step_number': 8, 'description': '- 닭가슴살이 80% 익으면 양배추 넣어 볶기', 'image_url': 'https://recipe1.ezmember.co.kr/cache/recipe/2018/09/29/7c4dd9a4aef01ea2baaddab024773f9f1.jpg'}, {'step_number': 9, 'description': '- 수분기가 없어질때까지 볶은 후 참기름 몇방을 넣어 마무리하기', 'image_url': 'https://recipe1.ezmember.co.kr/cache/recipe/2018/09/29/73f772acc46848135245700f8e6cc4b91.jpg'}, {'step_number': 10, 'description': '- 찬물에 담가놓은 파채 키친타올에 올려 물기제거하기', 'image_url': 'https://recipe1.ezmember.co.kr/cache/recipe/2018/09/29/7a227b8c0bf276dbe398d215d241e3ea1.jpg'}, {'step_number': 11, 'description': '그릇에 파채 동그랗게 올린 후 가운데 볶은 닭가슴살 올리면 경장육사 완성~!', 'image_url': 'https://recipe1.ezmember.co.kr/cache/recipe/2018/09/29/1af4b36873b0ba530612b3a60bb2e7941.jpg'}]"
22373,메인반찬,일상,닭고기,볶음,묵은지로 맛을 더한 닭갈비 황금레시피,닭갈비,"4,348",30분 이내,초급,1인분,"[('닭다리살', '300g'), ('묵은김치', '200g'), ('양파', '1/2개'), ('파', '1/2뿌리'), ('식용유', '1T'), ('깨', '1t'), ('고추장', '1T'), ('간장', '1T'), ('고춧가루', '1T'), ('맛술', '1T'), ('후추', '1/3t'), ('다진마늘', '1T'), ('참기름', '1T'), ('물', '4T')]",막상 만들어 보고 나면 생각했던 것 보다 어렵지 않은 요리라는게 깨달아 지는 메뉴가 몇 가지 있는 것 같습니다. 저는 닭갈비를 늘 사먹기만 했었지 만들어먹기 시작한게 그렇게 오래되지 않았는데요. 들어가는 재료가 많아 손질하는 시간이 걸리고 조금 번거로울 뿐 사실 떡볶이를 만드는 것과 큰 차이가 없을 만큼 간단한 요리더라구요. 오늘은 묵은 김치를 사용해 누구나 맛내기 쉬우면서 조리과정은 더욱 간단하게 완성할 수 있는 묵은지 닭갈비 황금레시피로 여러분과 함께합니다.,"[{'step_number': 1, 'description': '**만개의 레시피를 통해 제공되는 메이플대니얼의 컨텐츠는 사진형으로 보실 때 더욱 좋습니다**', 'image_url': 'https://recipe1.ezmember.co.kr/cache/recipe/2018/07/29/68f1351f37af9608b21121a95fc44ae21.png'}, {'step_number': 2, 'description': '먼저 양파는 0.5cm 두께로 채썰어 주시고, 파는 크기에 따라 세로 방향으로 2등분 후 5cm 간격으로 잘라주세요.', 'image_url': 'https://recipe1.ezmember.co.kr/cache/recipe/2018/07/29/7f5b9e571f4bb2fbc06ad39d2d64a9f81.jpg'}, {'step_number': 3, 'description': '이제 양념장을 만들어 둘게요. 고추장1T,간장1T,고춧가루1T,맛술1T,후추1/3t,다진마늘1T,참기름1T,물4T 이렇게 넣고 잘 섞어서 준비 해 주세요.', 'image_url': 'https://recipe1.ezmember.co.kr/cache/recipe/2018/07/29/333a57a8daa9548493c521e994bd6b5f1.jpg'}, {'step_number': 4, 'description': '저는 뼈가 발라진 닭다리살을 구입해서 사용했어요. 1.5cm 간격으로 잘라 손질 해 봤습니다. 담백하게 즐기시고 싶으시다면 닭가슴살을 활용해 주셔도 좋습니다.', 'image_url': 'https://recipe1.ezmember.co.kr/cache/recipe/2018/07/29/9b10c2d072e06f3d643cff38149ae0101.jpg'}, {'step_number': 5, 'description': '채소와 닭고기, 그리고 김치와 양념장을 한 데 넣고 잘 버무려서 냉장고에 30분 정도 숙성 해 주세요. 숙성 후 채소에서 나온 수분이 고일텐데 조리 전 한번 가볍게 전체적으로 잘 섞어주세요. 김치는 국물을 제거 후 넣어주시는 것 보다 국물도 조금 같이 넣어주시면 개운한 맛도 더해지고 좋습니다.', 'image_url': 'https://recipe1.ezmember.co.kr/cache/recipe/2018/07/29/b04817aad562b1855e81c05097106b191.jpg'}, {'step_number': 6, 'description': '팬을 강불에서 3분간 예열 후 식용유1T를 두르고 재워 둔 닭갈비를 넣고 조리를 시작해주세요. 적어도 10분 정도 충분히 잘 저어가며 익혀 주시는게 좋습니다.', 'image_url': 'https://recipe1.ezmember.co.kr/cache/recipe/2018/07/29/c0153986a2d7bf5fad9ee484ac26b24d1.jpg'}, {'step_number': 7, 'description': '뒤적뒤적 잘 섞어가며 타지 않게 익혀주시고 국물이 너무 없다싶으시면 물을 조금 넣어 선호하는 농도로 맞추어주세요. 완성 된 닭갈비에 깨를 살짝 뿌려 접시에 담아주시면 더욱 먹음직스럽겠죠?', 'image_url': 'https://recipe1.ezmember.co.kr/cache/recipe/2018/07/29/9bcd6ba6daa70e30226b3b884718df221.jpg'}, {'step_number': 8, 'description': '김치는 여전히 아삭함이 살아있어서 식감 돋우워 주고 좋더라구요. 간이 잘 배어 그냥 먹어도 좋고 상추쌈 곁들여서 더 푸짐하게 즐기셔도 좋아요. 역시 다리 부위가 부드럽고 촉촉해서 더 맛있게 즐길 수 있겠더라구요. 아삭한 상추에 쌈으로 즐기면 입맛돋우는데 정말 좋겠죠?', 'image_url': 'https://recipe1.ezmember.co.kr/cache/recipe/2018/07/29/7d4da4ade03a3ed7d5bd16fa03d914c81.jpg'}, {'step_number': 9, 'description': '오늘은 누구나 간단히 완성할 수 있는 묵은지 닭갈비 황금레시피로 함께했습니다. 입맛떨어져 별미메뉴가 필요하실 때 꼭 추천 해 드리고 싶은 레시피에요. 오늘도 맛있게 즐기세요! :)', 'image_url': 'https://recipe1.ezmember.co.kr/cache/recipe/2018/07/29/0abdcebf009dbbea233f92bd6aaf44d01.jpg'}]"
22374,메인반찬,일상,닭고기,볶음,국물없이 매콤하게 순살닭볶음,순살닭볶음,"5,031",15분 이내,아무나,3인분,"[('순살 닭고기', '300g'), ('양파', '1/2개'), ('당근', '1/4개'), ('피망', '1개'), ('간장', '1T'), ('매실액', '1T'), ('맛술', '1T'), ('고운고추가루', '1/2T'), ('고춧가루', '1T'), ('고추장', '1/2T'), ('대파', '1/3컵'), ('다진마늘', '1T'), ('생강술', '1t')]","요즘 자꾸 요령만 늘어나요 

사진 찍는 것도 귀찮고

포스팅하는 것도 게으름이 늘어나서.. ㅜ

일명 불태기~~




매콤 닭볶음 만들면서도

사진 찍는 것 절반만 했네요 ㅎ","[{'step_number': 1, 'description': '손질된 닭은\n우유에 담궜다가 사용해요\n간장, 매실액, 맛술, 고운고추가루, 고춧가루, 고추장으로\n밑간했어요\n대파, 다진마늘, 생강술도 넣고..', 'image_url': 'https://recipe1.ezmember.co.kr/cache/recipe/2019/07/28/46dd4b4d3867553090a01a5977cf98771.jpg'}, {'step_number': 2, 'description': '달군팬에 양념한 닭고기넣고\n센불로 볶아요', 'image_url': 'https://recipe1.ezmember.co.kr/cache/recipe/2019/07/28/b1bc91d0d6c2caf59a0010237a106c071.jpg'}, {'step_number': 3, 'description': '고기 절반쯤 익으면\n양파, 당근넣고 볶아 줍니다', 'image_url': 'https://recipe1.ezmember.co.kr/cache/recipe/2019/07/28/b1dff1e7a671cc0755a12470956873151.jpg'}, {'step_number': 4, 'description': '쉐킷쉐킷~~\n볶아 줍니다', 'image_url': 'https://recipe1.ezmember.co.kr/cache/recipe/2019/07/28/708e9b3273932b5cc2cbbc91f03fd7921.jpg'}, {'step_number': 5, 'description': '국물 없이 볶는 것이 포인트..', 'image_url': 'https://recipe1.ezmember.co.kr/cache/recipe/2019/07/28/1a08e55e168dd3f863ac03d384cd3b791.jpg'}, {'step_number': 6, 'description': '국물 자작해지면\n피망넣고 잘 섞은 후 마무리해요', 'image_url': 'https://recipe1.ezmember.co.kr/cache/recipe/2019/07/28/ef84161f5f661111f728fb4ed54f19451.jpg'}, {'step_number': 7, 'description': '참기름 살짝 둘렀어요', 'image_url': 'https://recipe1.ezmember.co.kr/cache/recipe/2019/07/28/010fb7ac2c28a5ef2fae219610dac2211.jpg'}]"
22375,메인반찬,일상,닭고기,볶음,간단한 닭 볶음,닭볶음,"1,213",60분 이내,초급,4인분,"[('닭고기', '1kg'), ('감자', '1개'), ('양파', '1개'), ('매운고추', '1개'), ('통깨', '2스푼'), ('소금', '1/2스푼'), ('오일', '3스푼'), ('매실청', '3스푼'), ('물엿', '2스푼'), ('고추가루', '2스푼'), ('고추장', '1스푼'), ('진간장', '2스푼'), ('참기름', '1스푼'), ('다진마늘', '1스푼')]","닭도리 탕은 참 잘 해 먹는데, 닭 볶음은 처음 해봐서 많이 설레였어요","[{'step_number': 1, 'description': '1. 닭은 적당한 크기로 잘라 있는 것을 구입해서 물에 30분 정도 담갔다가 깨끗이 씻으면서 기름 제거를 합니다.\n오늘은 미리 손질 해 둔 것을 꺼내서 사용했어요.\n냄비에 기름을 넣고 뜨겁게 달군 후에 고기를 넣어서 익혀줍니다. 이때에 소금 1/2 스푼을 뿌려줘요.\n오일은 아보카도를 썼어요.센불.중불', 'image_url': 'https://recipe1.ezmember.co.kr/cache/recipe/2020/05/18/7fabf2b45f3c2bda9938b7f42b0202c81.jpg'}, {'step_number': 2, 'description': '2. 고기를 앞뒤로 움직여주면서 익혀줍니다. 거의 익을 때에 감자를 적당한 크기로 썰어서 넣어줘요.중불', 'image_url': 'https://recipe1.ezmember.co.kr/cache/recipe/2020/05/18/57c9c187e13efa8bef240a5eea7fdf741.jpg'}, {'step_number': 3, 'description': '3. 고기에서 나오는 육즙을 거의 없어질 정도로 졸여주세요.\n양념장을 준비해서', 'image_url': 'https://recipe1.ezmember.co.kr/cache/recipe/2020/05/18/b6819f6780a359d5ce464f5a1a2910f31.jpg'}, {'step_number': 4, 'description': '4. 양념장과 양파와 매운 고추를 넣어요\n매콤 한 것을 좋아하시면 추가하셔도 돼요. 저는 달콤한 맛에 맵지 않게 했어요.', 'image_url': 'https://recipe1.ezmember.co.kr/cache/recipe/2020/05/18/5c8d7db5c04f4edf1ae79d75f66990a61.jpg'}, {'step_number': 5, 'description': '5. 이제 신나게 졸여 주시면 됩니다.중약', 'image_url': 'https://recipe1.ezmember.co.kr/cache/recipe/2020/05/18/3e60b7ecfa49612d2822c163c92837ef1.jpg'}, {'step_number': 6, 'description': '6. 국물이 거의 줄었다 싶을 때에 야채를 마지막으로 넣고 골고루 섞은 후에 불을 꺼주면 되요.\n파는 없어서 못 넣었어요.', 'image_url': 'https://recipe1.ezmember.co.kr/cache/recipe/2020/05/18/8a2a2e0da730222233c0c98aaf3ed0f71.jpg'}, {'step_number': 7, 'description': '7. 생각보다 어렵지 않고 간단했어요.', 'image_url': 'https://recipe1.ezmember.co.kr/cache/recipe/2020/05/18/7c4c3364704b78c958f43929429576201.jpg'}]"
