index,종류별,상황별,재료별,방법별,글 제목,레시피이름,조회수,조리시간,난이도,인분,재료,소개글,조리순서
57413,디저트,간식,채소류,굽기,에어프라이어 요리 단호박 찌는법 맛있게 굽기,단호박찌는법,"40,828",30분 이내,아무나,4인분,"[('단호박', '1개')]","간단하게 질척하지 않게 단호박 구어 볼께요,","[{'step_number': 1, 'description': '에어프라이어 요리 단호박 구이 찌는법 단호박 맛있게 굽기 \n해볼께요.', 'image_url': 'https://recipe1.ezmember.co.kr/cache/recipe/2019/09/27/493d7bdf0a9549b5aa503a81f0c201531.jpg'}, {'step_number': 2, 'description': '단호박을 씻어서\n에어프라이기에 종이호일을 깔고 세척한 단호박을 넣어 주세요.에어프라이어', 'image_url': 'https://recipe1.ezmember.co.kr/cache/recipe/2019/09/27/795d76fb88d5b793144a08f2449b8e9b1.jpg'}, {'step_number': 3, 'description': '그리고 에어프라이어 180도에서 10분 돌려 주세요.\n그리고 뒤집어서 180도에 10분 돌려 주세요.\n저처럼 단호박이 미니사이즈가 아니고 \n약간 큰것은 시간을 15분으로 위.아래 돌려 주심 되세요', 'image_url': 'https://recipe1.ezmember.co.kr/cache/recipe/2019/09/27/89ed5b1d07d43a874434b041ee9e5f3e1.jpg'}, {'step_number': 4, 'description': '그런다음 씨를 수저로 다 파내주세요.', 'image_url': 'https://recipe1.ezmember.co.kr/cache/recipe/2019/09/27/e50eb4203094cdec464a986991bb16cf1.jpg'}, {'step_number': 5, 'description': '그리고 들기 좋은 크기로 잘라서\n맛있게 드심 되세요.\n요렇게 자를때도 뜨거우니 조심하세요.', 'image_url': 'https://recipe1.ezmember.co.kr/cache/recipe/2019/09/27/897c11e7a51922fbb85bc02cf9a96a381.jpg'}, {'step_number': 6, 'description': '그럼 밤처럼 포실포실한 단호박 굽기\n완성이네요,', 'image_url': 'https://recipe1.ezmember.co.kr/cache/recipe/2019/09/27/73c7cd15ca9ed95a8d1695e97489f4c21.jpg'}]"
57414,디저트,간식,채소류,굽기,달콤달콤 군고구마,군고구마,718,20분 이내,초급,2인분,"[('고구마', '3~4개')]","직화냄비로 군고구마 맛 재연!
약불에서 뒤집어 주기만 하면 끝
김치 올려 호호~ 우유랑 냠냠
이젠 집에서 군고구마를 즐겨보세요.","[{'step_number': 1, 'description': '군고구마 맞춤 꿀팁!\n뚱뚱 고구마 1개, 꼬마 고구마 2개 준비', 'image_url': 'https://recipe1.ezmember.co.kr/cache/recipe/2019/10/14/a4428d3ccdd623cf3912c296730ecf351.jpg'}, {'step_number': 2, 'description': '뚱뚱 고구마는 먹기 좋은 크기로 잘라 직화냄비에 담아주세요.', 'image_url': 'https://recipe1.ezmember.co.kr/cache/recipe/2019/10/14/1a4452dff163e94da349e40ee0d1c12b1.jpg'}, {'step_number': 3, 'description': '뚜껑을 덮고 약불에서 3분 간격으로 뒤집어 주세요.꼬마 고구마는 2분 간격!', 'image_url': 'https://recipe1.ezmember.co.kr/cache/recipe/2019/10/14/39db02dce3049a01684b4d6cf41f55701.jpg'}, {'step_number': 4, 'description': '타지 않도록 위 아래 옆 굴려가면서 구워주세요.\n젓가락으로 꼭 찔러 잘 들어가면 익었다는 증거!', 'image_url': 'https://recipe1.ezmember.co.kr/cache/recipe/2019/10/14/e99010619114b21d1b6c9746a08400f31.jpg'}, {'step_number': 5, 'description': '군고구마&우유 한잔이면\n다이어트 혹은 변비해소 도움직화냄비는 밤고구마 보다 호박고구마가 더 꿀맛!', 'image_url': 'https://recipe1.ezmember.co.kr/cache/recipe/2019/10/14/1d7cc42654bdc5361b5b6acd6271c5e71.jpg'}]"
57415,디저트,간식,채소류,굽기,구황작물 고구마 에어프라이어요리/고구마맛탕,고구마맛탕,"1,765",30분 이내,아무나,2인분,"[('고구마', '2개'), ('올리고당', '3스푼'), ('검은깨', '약간'), ('슬라이스 아몬드', '약간')]","오늘은 지친 나를 일으키는 행복한 추억의 소울푸드인 레전드 간식 고구마맛탕 간단하게 만들어 봤어요^^*
아이, 어른 모두 좋아하는 고구마맛탕 기름없이 에어프라이어로 만들었는데 맛과 식감 모두 굿입니다:)","[{'step_number': 1, 'description': '재료 준비해 주세요~', 'image_url': 'https://recipe1.ezmember.co.kr/cache/recipe/2019/10/21/62bcda7f7fa9a31af92b5659d4d5bc0e1.jpg'}, {'step_number': 2, 'description': '고구마 껍질은 필러로 밀어 벗겨 주세요~고구마껍질에도 영양이 풍부하다고 하니 껍질째 만들어도 좋아요~', 'image_url': 'https://recipe1.ezmember.co.kr/cache/recipe/2019/10/21/43cc50846f261184d8f0cb2f6e548c921.jpg'}, {'step_number': 3, 'description': '먹기 좋게 한입 크기로 썰어 주세요~', 'image_url': 'https://recipe1.ezmember.co.kr/cache/recipe/2019/10/21/37a44e69e0e654cabf811ee5f865f2651.jpg'}, {'step_number': 4, 'description': '썰은 고구마 에어프라이어 바스켓에 담아 주시구요~에어프라이어', 'image_url': 'https://recipe1.ezmember.co.kr/cache/recipe/2019/10/21/1defecdc21033000736602ebc5460ec01.jpg'}, {'step_number': 5, 'description': '180도에서 15분 맞춰 돌린 후 \n뒤집어 다시 15분 맞춰 돌려 주세요~', 'image_url': 'https://recipe1.ezmember.co.kr/cache/recipe/2019/10/21/ca781f869e5fcb3fda9448d6eb29a6df1.jpg'}, {'step_number': 6, 'description': '속까지 잘 익은 고구마인데\n하얀고구마라 노릇한 색은 안나더라구요~', 'image_url': 'https://recipe1.ezmember.co.kr/cache/recipe/2019/10/21/9aa638997fcb925178e2ccdb3687758f1.jpg'}, {'step_number': 7, 'description': '올리고당, 고구마, 검정깨, 아몬드 넣고\n골고루 섞어 주면 고구마맛탕 완성!올리고당 대신 꿀 넣어도 좋아요~', 'image_url': 'https://recipe1.ezmember.co.kr/cache/recipe/2019/10/21/e3b646341824f2c9664d03d5bffe68fc1.jpg'}, {'step_number': 8, 'description': '설탕 시럽 만들 필요도 없고 기름에 튀길 필요 없이 \n에어프라이어로 초스피드로 만든 고구마맛탕입니다\n기름에 튀기지 않아도 식감이 좋더라구요~', 'image_url': 'https://recipe1.ezmember.co.kr/cache/recipe/2019/10/21/9b95e0c0958eb1faf2644e631948c26c1.jpg'}]"
57416,디저트,간식,채소류,굽기,#맛남의광장 #대파요리 #파바게트만들기 #어린이날간식 #대파를 이용해서 달고 파향 가득한 파바게트!!,파바게트,"2,763",20분 이내,아무나,3인분,"[('대파', '2대'), ('버터', '2큰술'), ('연유', '2큰술'), ('마요네즈', '3큰술'), ('소금', '1작은술'), ('설탕', '1큰술'), ('바게트', '1개'), ('파슬리가루', '1작은술')]","맛남의광장 대파요리 파바게트만들기

마늘바게트가 아닌 대파농가를 위한 파바게트입니다.

​

맛남의 광장에서 대파를 이용한 디저트를 만들었는데 바로 대파바게트이지요.

이름은 파게트였나,,,아니면 파바게트였나요. ㅎㅎ

마늘바게트가 있으니까 아마도 파바게트겠지요.

​

마요네즈와 연유, 기타등등이 들어가는데 간단하게

팬을 두개 사용하지 않고 하나의 원팬으로 사용한 파바게트입니다.

굳이 소스를 만든다고 팬을 또 하나를 사용할 필요가 있나 싶기도 했습니다.","[{'step_number': 1, 'description': '녹인 버터에 대파 듬뿍 넣어 주고는 달달 볶아 줍니다.', 'image_url': 'https://recipe1.ezmember.co.kr/cache/recipe/2020/04/28/952735e82a38a7bdd6f4e116f926a1d11.jpg'}, {'step_number': 2, 'description': '대파가 완전하게 숨이 죽을때까지 기다리면서 볶아 줍니다.', 'image_url': 'https://recipe1.ezmember.co.kr/cache/recipe/2020/04/28/f1b92fba38a8752bf7972df7c5beb4e31.jpg'}, {'step_number': 3, 'description': '여기에 바로 소스를 넣어 줍니다. 마요네즈, 연유, 소금, 후추, 설탕을 넣어서 잘 섞어가면서 볶아 줍니다.', 'image_url': 'https://recipe1.ezmember.co.kr/cache/recipe/2020/04/28/20dec0a5573e3f06414498e97edef35e1.jpg'}, {'step_number': 4, 'description': '파도 잘 익고 엉겨 붙었다면 간을 보고 조금더 단맛이 필요하시다면 설탕 추가!! 간이 약하다고 생각이 드시면 소금을 추가하시면 됩니다. 이제 이 재료를 이용해서 바로 바게트에 발라서는 구워 주기만 하면 됩니다.', 'image_url': 'https://recipe1.ezmember.co.kr/cache/recipe/2020/04/28/8bcfd5b1f2a756730b9e0c4123654b951.jpg'}, {'step_number': 5, 'description': '바게트에 파소스를 발라 주었습니다. 에어프라이어로 180도 온도에서 10분 정도 구우면 된다고 하는데 제 에어프라이어가 용량이 적어서는 그냥 오븐에 구워 주려고 합니다. 180도에 맞춰 오븐을 예열해주시고요.에어프라이어', 'image_url': 'https://recipe1.ezmember.co.kr/cache/recipe/2020/04/28/a9d499ba51dd8eb6147f18c89c40ac711.jpg'}, {'step_number': 6, 'description': '180도 온도에 예열된 오븐에 넣고는 15분 구워 주었습니다. 노릇노릇하게 잘 구워졌습니다. 바게트는 바삭하면서도 파소스는 부드럽고요.오븐', 'image_url': 'https://recipe1.ezmember.co.kr/cache/recipe/2020/04/28/13ede6c64b161ff9ca98f4cc74c8bd861.jpg'}, {'step_number': 7, 'description': '맛남의광장 대파요리 파바게트완성입니다. 촉촉하면서도 달달하기도 하고요. 연유때문인가요. 부드럽기도 하고요. 파슬리가루를 솔솔 뿌려서 마무리해 줍니다.', 'image_url': 'https://recipe1.ezmember.co.kr/cache/recipe/2020/04/28/f1f751b1c8e1deb5873a87d0a4b089e81.jpg'}]"
57417,디저트,간식,채소류,굽기,버터구이 감자,버터구이감자,"2,258",60분 이내,아무나,2인분,"[('감자', '10개'), ('버터', '5스푼'), ('소금', '1꼬집'), ('설탕', '')]","문득 버터구이 감자가 먹고 싶을때?
여행갈 일도 없고 고속도로 휴게소 갈 수 없다면
아주 쉬우니까 이렇게 해보세요!
냉장고에서 자고 있는 감자를 깨우세요 :-)","[{'step_number': 1, 'description': '씻은 감자를 30분 삶아주세요.', 'image_url': 'https://recipe1.ezmember.co.kr/cache/recipe/2020/06/17/36b513e8e20f15f65f20da2aee05d9471.jpg'}, {'step_number': 2, 'description': '조금 식혀둔 뒤 감자껍질을 벗깁니다.\n(사실 기다리기 귀찮아서 냉동실에 잠깐 넣어놨어요.)', 'image_url': 'https://recipe1.ezmember.co.kr/cache/recipe/2020/06/17/2b601a4145e9ad20cf869867e65944e11.jpg'}, {'step_number': 3, 'description': '알감자는 그냥 껍질만 벗기시면 되고,\n통감자는 한입 크기로 미리 자를게요.', 'image_url': 'https://recipe1.ezmember.co.kr/cache/recipe/2020/06/17/de528a46ef01104712d237c5c6b99f541.jpg'}, {'step_number': 4, 'description': '달궈진 팬에 버터를 넣습니다. 1센치 두께로 잘라 총 3조각 넣었네요.', 'image_url': 'https://recipe1.ezmember.co.kr/cache/recipe/2020/06/17/48fe415b6fd695636eda5592edb92d011.jpg'}, {'step_number': 5, 'description': '버터와 함께 자른 감자를 넣습니다.', 'image_url': 'https://recipe1.ezmember.co.kr/cache/recipe/2020/06/17/04389d68cfcb8333af274005bb1918821.jpg'}, {'step_number': 6, 'description': '노릇노릇하게 뒤집기도 해주시구요.', 'image_url': 'https://recipe1.ezmember.co.kr/cache/recipe/2020/06/17/76359e9c86bab4038eb3af7c5f8f8dc11.jpg'}, {'step_number': 7, 'description': '소금이나 설탕 등 취향에 맞게 뿌려주세요.', 'image_url': 'https://recipe1.ezmember.co.kr/cache/recipe/2020/06/17/af6b4e71edc4d69a7f4635745050c81c1.jpg'}, {'step_number': 8, 'description': '마무리로 파슬리를 살짝 뿌리고(없으면 생략가능) \n버터구이 감자 완성!', 'image_url': 'https://recipe1.ezmember.co.kr/cache/recipe/2020/06/17/1bf55dfce20f2c520faebfa171114e241.jpg'}]"
57418,디저트,간식,채소류,굽기,간식으로 좋은 웨지감자 에어프라이어로 만들기,웨지감자,"1,376",30분 이내,아무나,2인분,"[('감자', '4개'), ('소금', '1t'), ('파슬리가루', '1t'), ('올리브유', '2t'), ('설탕', '1꼬집'), ('후추', '1/2t')]",아이들 간식으로 술안주로도 좋은 웨지감자 만들어 볼께요.,"[{'step_number': 1, 'description': '웨지감자 만들기 간단하고 쉬운 감자튀김 에어프라이어 요리 레시피\n한번 해볼께요.', 'image_url': 'https://recipe1.ezmember.co.kr/cache/recipe/2020/06/18/be020af1ce41676864c8192853a7da8c1.jpg'}, {'step_number': 2, 'description': '우선 감자를 껍질 째 에어프라이어 요리 감자튀김 웨지감자 만들기\n할 때\n저는 감자 껍질까지 함께 해서 우선 수세미로 감자 겉을\n깨끗하게 문질러서 세척해 주세요.\n그리고 감자를 반을 갈라서 그 반에서 3-4 등분 해주세요.\n감자의 크기에 따라서 잘라 주심 되시구요.\n그다음 10-15분 물에 담가서 전분을 제거해 주세요.', 'image_url': 'https://recipe1.ezmember.co.kr/cache/recipe/2020/06/18/35c007969421a7bb98914319cf4c24bf1.jpg'}, {'step_number': 3, 'description': '그리고 위에 적힌대로 소금.식용류.후추.파슬리가루.\n설탕 한꼬집 넣어 주세요.\n설탕은 기호에 따라서 빼셔도 되시구요.\n버터도 기호에 따라서 무염 버터를 첨가하셔도 되세요.', 'image_url': 'https://recipe1.ezmember.co.kr/cache/recipe/2020/06/18/d16ebb74286d6240ae34f76d19d399bd1.jpg'}, {'step_number': 4, 'description': '잘 썰어둔 웨지모양의 감자에 \n양념을 넣고 버무려 주세요.', 'image_url': 'https://recipe1.ezmember.co.kr/cache/recipe/2020/06/18/c1ee8e356f9fa19a0835ef1c2c2e999e1.jpg'}, {'step_number': 5, 'description': '그다음 에어프라이어에 종이호일을 깔고\n양념한 웨지감자를 넣고 \n에어프라이어에 180도 15분 돌려 주세요.\n그리고 꺼내서 뒤집어서 180도에 15분 더 돌려 주세요.\n에어프라이어 크기나 감자크기 \n에어프라이어 성능에 따라서 시간은 줄이거나 늘리시면 \n되세용^^에어프라이어', 'image_url': 'https://recipe1.ezmember.co.kr/cache/recipe/2020/06/18/9d72a37ece69f0a119476240cd25aaba1.jpg'}, {'step_number': 6, 'description': '저는 딱 요정도 돌리니 노릇 노릇 \n에어프라이어 요리 웨지감자 만들기 완성', 'image_url': 'https://recipe1.ezmember.co.kr/cache/recipe/2020/06/18/dbfa60588c327aa2df4427e8f2566ba11.jpg'}]"
57419,디저트,간식,채소류,굽기,고구마 버터구이 초간단 레시피,고구마버터구이,"1,026",15분 이내,아무나,3인분,"[('고구마', ''), ('버터', '2조각'), ('올리고당                                                                                벌꿀또는설탕또는물엿', '취향껏')]",군고구마를 만들고나니 두가지가 섞여있어서 먼저 말랑한 호박고구마를 먹고 남은건 단단한 밤고구마?만 남아 손이 안가더라구요. 그래서 남아있던 단단한 고구마를 #고구마버터구이만들기 를 해봤는데 버터향 가득 맛있게 간식으로 즐기니 굿이랍니다. ​ 그럼 간단레시피 고구마버터구이 만들기 시작할게요~,"[{'step_number': 1, 'description': '단단한 군고구마는 껍질을 벗겨 준비합니다.', 'image_url': 'https://recipe1.ezmember.co.kr/cache/recipe/2020/12/10/a54778bab3668d64ae9f7fd06d5639be1.jpg'}, {'step_number': 2, 'description': '다음은 맛탕만들때처럼 멋대로 썰어주세요', 'image_url': 'https://recipe1.ezmember.co.kr/cache/recipe/2020/12/10/702e934b645105acbeeaf3c6e92ae8721.jpg'}, {'step_number': 3, 'description': '버터 1조각만 하려다가 고구마가 은근 양이 많아 2조각 녹였어요.', 'image_url': 'https://recipe1.ezmember.co.kr/cache/recipe/2020/12/10/1b9113e46d91c3b654eb2dbcd3653fef1.jpg'}, {'step_number': 4, 'description': '버터가 거의 녹으면 준비한 고구마를 모두 넣어주고~', 'image_url': 'https://recipe1.ezmember.co.kr/cache/recipe/2020/12/10/12ba1ee83cdd7a8cfd67017e901f4ef91.jpg'}, {'step_number': 5, 'description': '뒹굴뒹굴 굴려가면서 노릇하게 버터를 입혀줍니다.', 'image_url': 'https://recipe1.ezmember.co.kr/cache/recipe/2020/12/10/fcff953870afcf8820e78d70ae34245b1.jpg'}, {'step_number': 6, 'description': '준비한 요리당을 넣어서 뒹굴려주고 마무리하면 끝 정말 간단하죠~ㅎㅎ', 'image_url': 'https://recipe1.ezmember.co.kr/cache/recipe/2020/12/10/899411499354c6c38c850255d4b9d1ce1.jpg'}, {'step_number': 7, 'description': '보글보글 끓입니다', 'image_url': 'https://recipe1.ezmember.co.kr/cache/recipe/2020/12/10/cd72f0493a7a5331e16621a5da8116e81.jpg'}]"
57420,디저트,간식,채소류,굽기,고구마치즈구이,None,176,None,None,None,"[('군 고구마', '1개'), ('모짜렐라치즈', '조금'), ('체다치즈', '1개'), ('파마산치즈', '')]",,[]
57421,디저트,간식,채소류,굽기,간식만들기 옥수수 버터구이 만들기,옥수수버터구이,"1,126",30분 이내,아무나,4인분,"[('옥수수', '4개'), ('버터', '1조각'), ('설탕', '적당히'), ('파슬리가루', ''), ('슈가파우더', ''), ('파마산치즈', '')]",몇달전만해도 길거리 지나다보면 옥수수 판매하는곳이 많았지요~ 오늘은 냉동실에서 잠자고있는 옥수수로 #옥수수버터구이 만들기해봤답니다.,"[{'step_number': 1, 'description': '냉동실에있는 옥수수와 버터도 준비합니다.', 'image_url': 'https://recipe1.ezmember.co.kr/cache/recipe/2020/12/24/e6c36c148e79a5926a1eada11523d5841.jpg'}, {'step_number': 2, 'description': '버터는 랩을씌워 전자레인지에 살짝 돌려서 녹여주구요~전자레인지', 'image_url': 'https://recipe1.ezmember.co.kr/cache/recipe/2020/12/24/94bc94add395809b36a8e219ee0105061.jpg'}, {'step_number': 3, 'description': '녹인버터에 설탕과 파슬리가루를 넣어 함께 섞어주었어요~ 설탕은 취향껏 조절하세요~ 달콤한맛 좋아하면 더 넣어주고 담백한맛 좋아하면 빼셔도 된답니다.', 'image_url': 'https://recipe1.ezmember.co.kr/cache/recipe/2020/12/24/487498b918b7544cda35f76b4937b0401.jpg'}, {'step_number': 4, 'description': '다음은 중약불에서 살살 굴려가면서 구워주었답니다.', 'image_url': 'https://recipe1.ezmember.co.kr/cache/recipe/2020/12/24/5176e366515362e68c58fb46d1470aea1.jpg'}, {'step_number': 5, 'description': '살살 돌려가면서 버터녹인걸 골고루 발라주었구요~', 'image_url': 'https://recipe1.ezmember.co.kr/cache/recipe/2020/12/24/384cffa8f2be4803a46da9bd537f7a421.jpg'}, {'step_number': 6, 'description': '너무 쎈불에서 구우면 탈수있으니 중약불에서 시간을 가지고 뒹굴리면서 구워주었어요.', 'image_url': 'https://recipe1.ezmember.co.kr/cache/recipe/2020/12/24/6c75e1d3bc369a889242e29fd26d73ad1.jpg'}, {'step_number': 7, 'description': '어느새 굽다보니 옥수수에 윤기가 흐르면서 점점 색깔이 노릇노릇 변하고 있네요.', 'image_url': 'https://recipe1.ezmember.co.kr/cache/recipe/2020/12/24/b95a0ae1594323125c424c6c56d3d1461.jpg'}, {'step_number': 8, 'description': '좀 더 노릇할때까지 기다렸더니 제법 때깔이 예뻐졌죠~ 이제 옥수수버터구이 만들기 다 된 거 같네요.', 'image_url': 'https://recipe1.ezmember.co.kr/cache/recipe/2020/12/24/56f91393fcd172712a551ad4ef77952c1.jpg'}, {'step_number': 9, 'description': '다음은 먹기좋게 옥수수 꼭지에 손잡이도 꽂아 주었는데요~ 요렇게 꽂아주면 먹기도 편하고 좋더라구요.', 'image_url': 'https://recipe1.ezmember.co.kr/cache/recipe/2020/12/24/450ebaa2af526c05ababc237701d08bd1.jpg'}, {'step_number': 10, 'description': '그리고 파마산 치즈를 솔솔 뿌려주고 슈가파우더가 있으면 슈가파우더도 뿌려주세요~ 요기에 고운고추가루 살짝 뿌려주면 마약옥수수가 되는데 없으면 없는대로 마무리하면 되네요.', 'image_url': 'https://recipe1.ezmember.co.kr/cache/recipe/2020/12/24/f9d53cc5b438e12ae5cd516d0d1097a81.jpg'}]"
57422,디저트,간식,채소류,굽기,웨지감자 에어프라이어 간단한 간식,웨지감자,995,30분 이내,초급,2인분,"[('감자', '2개'), ('올리브오일', '1큰술'), ('소금', '약간'), ('파슬리가루', ''), ('케첩', '')]",에어프라이어로 웨지감자 간식만들어요,"[{'step_number': 1, 'description': '재료준비해주세요', 'image_url': 'https://recipe1.ezmember.co.kr/cache/recipe/2020/09/05/d9895e44a46efeba91cbb5b126e7d19a1.jpg'}, {'step_number': 2, 'description': '감자는 깨끗하게 씻어주시고 껍질에 이물질이 묻어있지 않도록 꼼꼼하게 세척해주시면 좋을거 같아요 감자를 반으로 잘라주시고 삼각형 모양으로 썰어주어 모양을 내어주세요 감자두개를 썰어 찬물에 담가 전분을 제거해주시면 됩니다 감자 전분을 제거하지 않고 조리해도 상관없지만 습관처럼 전분을 제거하게 되네요', 'image_url': 'https://recipe1.ezmember.co.kr/cache/recipe/2020/09/05/9f2115ece26a294c9ffa9b47a0a2421e1.jpg'}, {'step_number': 3, 'description': '여러번 헹궈 주시고 키친타올로 감자 물기를 제거해주세요 소금 약간 넣어 감자에 간을 해주시고 올리브오일 1큰술를 넣고 살짝 섞어주세요 파슬리가루를 넣고 감자에 간이 베일수 있게 5분정도 방치해주시면 될거 같아요', 'image_url': 'https://recipe1.ezmember.co.kr/cache/recipe/2020/09/05/6a0b86f5801d7338dd990c65e83cda1b1.jpg'}, {'step_number': 4, 'description': '이렇게 숙성시킨 감자는 종이호일을 깔고 감자가 겹치지 않게 골고루 올려주세요 180도에 20분 돌려주세요 에어프라이어에 조리할때는 감자의 두께를 일정하게 해주시는것이 좋아요 크기가 들쑥날쑥이라면 감자 익는 부분이 달라 조리하기 힘들때가 있어요에어프라이어', 'image_url': 'https://recipe1.ezmember.co.kr/cache/recipe/2020/09/05/e49a36144f6bcfd0ec8d578b452e55521.jpg'}, {'step_number': 5, 'description': '180도에 20분 조리한 감자는 전체적으로 한번 뒤집어주시고 180도에 10분정도 조리했어요 중간중간 감자가 익었는지 확인하는 과정이 필요한거 같아요 감자의 두께에 다라 감자 상태에 따라 조리시간이 달라질수 있다는점 유의하셔야할거 같아요', 'image_url': 'https://recipe1.ezmember.co.kr/cache/recipe/2020/09/05/cc290ee15a03454a39ba3f53ff50fdc51.jpg'}, {'step_number': 6, 'description': '처음 만든 웨지감자 만들어봤어요 에어프라이어를 조리할때는 온도와 시간이 적당해야 맛있는 음식이 만들어지는거같아요 온도 조절과 시간이 중요한거같아요', 'image_url': 'https://recipe1.ezmember.co.kr/cache/recipe/2020/09/05/ebdba4ee0ad97bdcb0281dac9d187fc81.jpg'}]"
