index,종류별,상황별,재료별,방법별,글 제목,레시피이름,조회수,조리시간,난이도,인분,재료,소개글,조리순서
6286,밑반찬,일상,해물류,조림,두뇌발달에 좋은 삼치무조림,삼치무조림,"22,789",30분 이내,중급,1인분,"[('삼치', '1마리'), ('대파', '1/2뿌리'), ('풋고추', '2개'), ('고추장', '1큰술'), ('고춧가루', '2큰술'), ('진간장', '2.5큰술'), ('맛술', '2큰술'), ('올리고당', '2큰술'), ('다진 마늘', '1큰술'), ('다진 파', '1큰술'), ('물', '적당량')]","싱싱한 삼치와 무, 양념장으로 만들어 두뇌발달에 좋은 조림반찬! 삼치무조림입니다.","[{'step_number': 1, 'description': '대파는 껍질을 벗겨 씻은 후 어슷 썰고 풋고추는 꼭지를 제거하고 씻은 후 어슷 썰어 줍니다.', 'image_url': 'https://recipe1.ezmember.co.kr/cache/recipe/2015/06/07/bbbbc14743f15bc08ea5a00b7ddd048f1.jpg'}, {'step_number': 2, 'description': '무는 흐르는 물에 씻은 후 도톰하게 반달 썰어 줍니다.', 'image_url': 'https://recipe1.ezmember.co.kr/cache/recipe/2015/06/07/ee8745e6fccd60612a2d566089f66a481.jpg'}, {'step_number': 3, 'description': '삼치는 내장과 지느러미를 제거하고 흐르는 물에 깨끗하게 씻어 줍니다.', 'image_url': 'https://recipe1.ezmember.co.kr/cache/recipe/2015/06/07/adcb726da150ebd13d27e467a2547fd21.jpg'}, {'step_number': 4, 'description': '분량의 양념장 재료 고추장, 고춧가루, 진간장, 맛술, 올리고당, 다진 마늘, 다진 파, 물을 고루 섞어 줍니다.', 'image_url': 'https://recipe1.ezmember.co.kr/cache/recipe/2015/06/07/382015ba82d1f6dabe387bdaa7c6bbcf1.jpg'}, {'step_number': 5, 'description': '냄비 바닥에 무를 깔고 삼치를 올린 후 대파와 풋고추를 얹어 줍니다.', 'image_url': 'https://recipe1.ezmember.co.kr/cache/recipe/2015/06/07/207a42d7362331d7a58c9a162d3a9ca91.jpg'}, {'step_number': 6, 'description': '양념장을 끼얹어 주고 물을 적당량 부은 후 가스 불에 올려서 조려 줍니다. 센 불에서 조려 주다가 한소끔 끓으면 약 불로 줄여서 간이 고루 배도록 중간 중간 양념장을 끼얹어 주면서 조려 주면 좋아요', 'image_url': 'https://recipe1.ezmember.co.kr/cache/recipe/2015/06/07/56fb42ea59aaf3cf4efc99b47023737f1.jpg'}, {'step_number': 7, 'description': '삼치무조림을 그릇에 담아냅니다.', 'image_url': 'https://recipe1.ezmember.co.kr/cache/recipe/2015/06/07/f5626d887b38a430da05f11df48ef8a91.jpg'}]"
6287,밑반찬,일상,해물류,조림,홍합조림,홍합조림,"23,628",60분 이내,초급,6인분 이상,"[('홍합', '80개'), ('청량고추', '5개'), ('간장', '60cc'), ('물엿', '100cc'), ('물', '200cc'), ('미림', '20cc'), ('후추', '')]",쫀득쫀득한 홍합에 매콤칼칼한 조림장이 더해져 밥도둑이 따로 없는 밑반찬입니다.,"[{'step_number': 1, 'description': '깨끗하게 씻어 이물질을 제거한 홍합을 냄비에 넣어줍니다.', 'image_url': 'https://recipe1.ezmember.co.kr/cache/recipe/2015/06/03/12aa6fa5b0981351bdf98a2a7f913ea31.jpg'}, {'step_number': 2, 'description': '분량의 재료를 섞어 준비한 조림장을 넣어주세요.', 'image_url': 'https://recipe1.ezmember.co.kr/cache/recipe/2015/06/03/de599fe561152cbf230bd3b5b978c95c1.jpg'}, {'step_number': 3, 'description': '청양고추 3개는 가운데 칼집을 넣어 냄비에 넣어주세요. 조림장에 매콤한 맛이 스며들어 더욱 칼칼한 맛이 납니다.', 'image_url': 'https://recipe1.ezmember.co.kr/cache/recipe/2015/06/03/a4ecee81df2235c61362e40e76e12f1b1.jpg'}, {'step_number': 4, 'description': '이제 은근한 불에서 졸여주세요.', 'image_url': 'https://recipe1.ezmember.co.kr/cache/recipe/2015/06/03/a7d6f63d253cc09c5649a1a308a7edd21.jpg'}, {'step_number': 5, 'description': '조림장이 걸죽한 상태가 되어 자작하게 남았을때까지 졸여주셔야 합니다.', 'image_url': 'https://recipe1.ezmember.co.kr/cache/recipe/2015/06/03/7121343c4fe4552e250c4db10ad14db51.jpg'}, {'step_number': 6, 'description': '채썬 청량고추를 넣고 살짝 저어준 후에 마무리 하시면 됩니다.', 'image_url': 'https://recipe1.ezmember.co.kr/cache/recipe/2015/06/03/a4c25ffdf53c77c90cf98c303ca4f3991.jpg'}]"
6288,밑반찬,일상,해물류,조림,아이반찬 오징어무조림,오징어무조림,"6,856",None,None,None,"[('오징어몸통', ''), ('무', ''), ('곤약', ''), ('다시마', ''), ('물', ''), ('간장', ''), ('올리고당', ''), ('맛술', ''), ('매실액', ''), ('다진마늘', '')]",달큰 짭조름하고 곤약이 들어가 쫄깃해 아이 반찬으로 좋은 오징어무조림입니다.,"[{'step_number': 1, 'description': '주재료 오징어 먼저 손질해 두세요. 몸통만 썼는데 다리도 함께 쓰셔도 무방해요. 깨끗이 씻은 오징어는 껍질을 벗겨주어요. 잘 벗겨진답니다.\n모서리쪽부터 쭉 잡아 당기시면 돼요. 그리고 안쪽에 칼집을 넣고 아이가 먹기 편하게 3~4cm로 썰었어요\n.오징어 손질법 레시피', 'image_url': 'https://recipe1.ezmember.co.kr/cache/recipe/2015/05/11/4d95f40e6e97b04a42cea12c87f3e52f1.jpg'}, {'step_number': 2, 'description': '무는 큼직하게 썰어주고 곤약은 끓는 물에 식초를 살짝 넣고 데쳐 큐브모양으로 썰었어요.', 'image_url': 'https://recipe1.ezmember.co.kr/cache/recipe/2015/05/11/e98b9dfb7ef6934d80f9f09c3253ace81.jpg'}, {'step_number': 3, 'description': '냄비에 무와 곤약를 깔아주세요. 다시마 우린물을 사용하셔도 되고 다시마와 함께 물을 자작하게 부었어요. 이대로 무를 익혀주세요. 오징어는 금방 익어서 나중에 조림장을 붓고 익혀줄거예요.', 'image_url': 'https://recipe1.ezmember.co.kr/cache/recipe/2015/05/11/9158ff5affc9ac755ab1c6653789f9e01.jpg'}, {'step_number': 4, 'description': '조림장은 간장 5큰술과 매실액 한큰술, 올리고당2큰술, 맛술2큰술, 다진마늘 1큰술을 넣었어요.', 'image_url': 'https://recipe1.ezmember.co.kr/cache/recipe/2015/05/11/1a1b40eb1a8f6dea6a3d49f72c8bd3731.jpg'}, {'step_number': 5, 'description': '무가 어느정도(투명할 때) 익으면 다시마는 건져내고 오징어를 넣고 분량의 조림장도 부어 주세요.', 'image_url': 'https://recipe1.ezmember.co.kr/cache/recipe/2015/05/11/b0dd365fa606256b30f36a40612c8b321.jpg'}, {'step_number': 6, 'description': '중불에서 조림장에 베이도록 졸여주세요.', 'image_url': 'https://recipe1.ezmember.co.kr/cache/recipe/2015/05/11/081f1bcbd49d0d0089140fc86a9013911.jpg'}, {'step_number': 7, 'description': '완성되면 그릇에 담고 깨를 뿌려 내어주면 되세요.', 'image_url': 'https://recipe1.ezmember.co.kr/cache/recipe/2015/05/11/bd3635f649e565e742841f9bc7a84edd1.jpg'}]"
6289,밑반찬,일상,해물류,조림,칼슘과 철분이 풍부한 양미리 조림,양미리조림,"19,183",60분 이내,중급,5인분,"[('양미리', '20마리'), ('무', '450g'), ('풋고추', '2개'), ('대파', '1뿌리'), ('통깨', ''), ('물', ''), ('양조간장', '3큰술'), ('고춧가루', '2.5큰술'), ('올리고당', '1큰술'), ('맛술', '1큰술'), ('다진생강', '1작은술'), ('다진마늘', '1/2큰술'), ('물', '')]","양미리는 소금구이나 조림으로 만들어 먹는데요. 오늘은 단백질이 풍부한 양미리와 무, 갖은 양념으로 조림반찬을 만들어 보려고 준비했습니다. 겨울이 제철인 고소하고 담백한 양미리조림 소개합니다.","[{'step_number': 1, 'description': '양미리는 머리와 꼬리를 자르고 흐르는 물에 깨끗하게 씻은 후 반으로 썰어주세요.', 'image_url': 'https://recipe1.ezmember.co.kr/cache/recipe/2015/05/26/d789a5faf14d9d3a63d0e732467aff4d1.jpg'}, {'step_number': 2, 'description': '무는 흐르는 물에 씻은 후 껍질을 제거하고 도톰하게 썰어주세요.', 'image_url': 'https://recipe1.ezmember.co.kr/cache/recipe/2015/05/26/f431600051e07024c412ebe3d5cb19e11.jpg'}, {'step_number': 3, 'description': '대파는 껍질을 벗겨 씻은 후 어슷 썰고 풋고추는 꼭지를 제거하고 흐르는 물에 씻은 후 어슷 썰어주세요.', 'image_url': 'https://recipe1.ezmember.co.kr/cache/recipe/2015/05/26/96863afed15de34cd2e96011c308bbc51.jpg'}, {'step_number': 4, 'description': '분량의 양념재료로 양념장을 만들어주세요.', 'image_url': 'https://recipe1.ezmember.co.kr/cache/recipe/2015/05/26/8c2bfa220f82b64be3f1b2eda7de38f51.jpg'}, {'step_number': 5, 'description': '냄비에 무를 깔고 풋고추를 조금 올린 후 물을 붓고 양념장을 조금 끼얹어서 냄비 뚜껑을 덮고 익혀주세요.', 'image_url': 'https://recipe1.ezmember.co.kr/cache/recipe/2015/05/26/660019bf8afb80f59a962342b4eff21a1.jpg'}, {'step_number': 6, 'description': '무가 투명하게 익으면 양미리와 풋고추를 올려 양념장을 끼얹어서 조려주세요. \n한소끔 끓으면 불을 줄이고 간이 골고루 배도록 중간중간 양념장을 끼얹어 주면서 조려주세요.', 'image_url': 'https://recipe1.ezmember.co.kr/cache/recipe/2015/05/26/9b908c560a87196c83b2d26a36f3746e1.jpg'}, {'step_number': 7, 'description': '양념장 국물이 자작자작해지면 대파를 얹고 냄비뚜껑을 덮은 후 한소끔 끓으면 불에서 내려요.', 'image_url': 'https://recipe1.ezmember.co.kr/cache/recipe/2015/05/26/e34ddab553309307c01f5f14fad629d61.jpg'}]"
6290,밑반찬,일상,해물류,조림,민어조림 - 딸에게# / 민어조림만드는법,None,"11,981",None,None,None,[],,[]
6291,밑반찬,일상,해물류,조림,가자미조림 만드는 법♬,None,"72,253",None,None,None,[],,[]
6292,밑반찬,일상,해물류,조림,쫄깃하니 맛있는 전복장조림,전복장조림,"8,923",10분 이내,아무나,1인분,"[('전복', '4마리'), ('간장', '2T'), ('매실액', '1T'), ('참기름', '1t')]","환절기 되면서 감기로 고생하는 아들..
입맛 없어 하네요
잃었던 입맛 돌아오라고 만든 전복장조림 입니다","[{'step_number': 1, 'description': '전복부터 손질합니다\n칫솔이나 솔을 이용해 구석구석 잘 닦아 줍니다전복 손질법 레시피\u200b', 'image_url': 'https://recipe1.ezmember.co.kr/cache/recipe/2015/10/01/5dd5b288ec9ca8d4263dd89673bc367b1.jpg'}, {'step_number': 2, 'description': '칼을 이용해 내용물과 껍질을 분리해요', 'image_url': 'https://recipe1.ezmember.co.kr/cache/recipe/2015/10/01/d547e6a198d5cc31298101af870ec8241.jpg'}, {'step_number': 3, 'description': '이빨과 모래집도 제거하고..', 'image_url': 'https://recipe1.ezmember.co.kr/cache/recipe/2015/10/01/a3c94229a89278816d2d556d578702371.jpg'}, {'step_number': 4, 'description': '손질된 전복은 칼집넣어 놓아요', 'image_url': 'https://recipe1.ezmember.co.kr/cache/recipe/2015/10/01/5ce40413eef2393b902ca0f52a32f15e1.jpg'}, {'step_number': 5, 'description': '끓는 물에 소금넣고 아주 잠시만 데쳐서 식힙니다\n오래 데치면 질겨지므로 잠시 넣었다 건진다는 생각으로 데치면 됩니다', 'image_url': 'https://recipe1.ezmember.co.kr/cache/recipe/2015/10/01/dccd3a4ce3364f5156731b0aba5a11fa1.jpg'}, {'step_number': 6, 'description': '간장, 매실청을 넣고 바글바글 끓여요', 'image_url': 'https://recipe1.ezmember.co.kr/cache/recipe/2015/10/01/291a7c61c601c73e36f425bed86d6a591.jpg'}, {'step_number': 7, 'description': '끓는 간장에 데친 전복을 넣고 간이 베도록 잠시 조려요\n참기름 둘러 마무리 합니다', 'image_url': 'https://recipe1.ezmember.co.kr/cache/recipe/2015/10/01/dc9d439ee99bac5f11fe6edc53330ad51.jpg'}]"
6293,밑반찬,일상,해물류,조림,오징어 야채말이조림,오징어야채말이조림,"4,854",60분 이내,초급,2인분,"[('오징어', '1마리'), ('당근', '1/2개'), ('두릅', '60g'), ('죽순', '60g'), ('물', '1/3컵'), ('고추장', '2큰술'), ('간장', '1큰술'), ('청주', '1큰술'), ('물엿', '3큰술'), ('다진파', '1큰술'), ('다진 마늘', '1큰술'), ('깨소금', '약간'), ('참기름', '약간')]",멋진 칼 솜씨로 예쁘게 담아서 놓으면 아이들에겐 멋진 간식이고 어른들에겐 맥주 안주 하나 탄생됩니다. 이 오징어 야채말이조림은 맥주안주로도 탁월하지만 밥 반찬으로도 훌륭함을 자랑합니다.,"[{'step_number': 1, 'description': '당근은 채를 썰어서 간략한 양념과 함께 볶았구요. 죽순은 가느다란 통조림용으로 준비를 했습니다. 그리고 두릅은 한번 데쳐서 간단한 양념을 했습니다. 두릅이 준비가 안된다면 시금치로 준비하셔도 좋습니다. 시금치는 한번 데쳐서 기본 양념(참기름, 소금, 다진마늘)으로 무침을 하면 좋을 듯 합니다. 오징어는 껍질을 벗겨내고 반으로 자른 다음 안쪽면에 칼집을 만들어 줍니다.', 'image_url': 'https://recipe1.ezmember.co.kr/cache/recipe/2015/08/26/93563ca53bab73457b18fb1be28a97dd1.jpg'}, {'step_number': 2, 'description': '사진은 오징어 껍질을 벗긴 바깥부분에 당근과 죽순. 두릅을 올려놓은 모습입니다.', 'image_url': 'https://recipe1.ezmember.co.kr/cache/recipe/2015/08/26/208325937bee1d0e00abdcdd22b4fac5.jpg'}, {'step_number': 3, 'description': '야채를 돌돌 말은 후 꼬치로 고정을 시켜주었습니다. 칼집을 넣을때에는 칼을 옆으로 기울여 깊게 칼집을 넣어야 모양이 예쁘게 만들어 집니다.', 'image_url': 'https://recipe1.ezmember.co.kr/cache/recipe/2015/08/26/a4558ced817db3a8a185eb915095fe8e1.jpg'}, {'step_number': 4, 'description': '양념장을 만듭니다. 냄비에 물 ⅓컵, 고추장 2큰술, 간장 1큰술, 청주 1큰술, 물엿 3큰술, 다진파 1큰술, 다진 마늘 1큰술, 깨소금 약간, 참기름 약간을 넣어서 끓입니다.', 'image_url': 'https://recipe1.ezmember.co.kr/cache/recipe/2015/08/26/0887adfb17a2449b71e97fd8555e37041.jpg'}, {'step_number': 5, 'description': '양념장이 끓으면 준비된 오징어야채말이를 넣어서 중간불에 은근히 조려 줍니다. 잘 조려진 오징어야채말이조림을 도마에 올려 놓고 꼬치를 빼어 냅니다.', 'image_url': 'https://recipe1.ezmember.co.kr/cache/recipe/2015/08/26/123c36dd69259caaf7652064623fcb241.jpg'}]"
6294,밑반찬,일상,해물류,조림,색다른 물오징어조림,오징어조림,"3,161",30분 이내,초급,4인분,"[('오징어', '2마리'), ('소금', '약간'), ('간장', '6큰술'), ('설탕', '3큰술'), ('청주', '3큰술'), ('통마늘', '2개'), ('마른 고추', '1/2개'), ('물', '2/3컵')]",물오징어로 간장조림 해 봤네요. 보통 마른 오징어를 많이 쓰시는데 물오징어가 훨씬 먹기 좋은거 같아요~,"[{'step_number': 1, 'description': '오징어는 껍질을 벗겨 안쪽에 칼집을 넣어 사방 3센티 정도의 크기로 잘라 준비하세요. 몸통만 쓰셔도 좋구요~ 다리까지 모두 쓰셔도 좋아요~ 전 모두 넣었네요. 오징어에 칼집을 넣을 때 파채칼을 이용해 보세요.', 'image_url': 'https://recipe1.ezmember.co.kr/cache/recipe/2015/08/18/a97b10e0b96713902282fa4e4f3b49231.jpg'}, {'step_number': 2, 'description': '오징어를 끓는 물에 소금을 약간 넣어 데쳐 주세요.', 'image_url': 'https://recipe1.ezmember.co.kr/cache/recipe/2015/08/18/7b0662b549401ddbff29b793804a96c61.jpg'}, {'step_number': 3, 'description': '마늘은 저미고 마른 고추는 씨를 털어내 주세요. 고추씨가 매운 맛을 가장 많이 내니 칼칼한 맛을 좋아하시는 분은 고추씨 있는 채로 쓰셔도 좋아요. 냄비에 조림장 재료를 넣고 약불에서 끓이다 오징어를 넣어 색이 배도록 은근히 조리세요.', 'image_url': 'https://recipe1.ezmember.co.kr/cache/recipe/2015/08/18/63e677b4e3130efb4bfa913eb8c981b61.jpg'}]"
