index,종류별,상황별,재료별,방법별,글 제목,레시피이름,조회수,조리시간,난이도,인분,재료,소개글,조리순서
8768,밑반찬,일상,달걀/유제품,찜,달걀찜,달걀찜,"1,055",30분 이내,초급,3인분,"[('달걀', '4개'), ('멸치다시마육수', '180ml'), ('대파', '약간'), ('당근', '약간'), ('소금', '1꼬집'), ('참치액', '1T'), ('참기름', '1T'), ('맛술', '1T')]","육수를 첨가 해서
부드러운 달걀찜 만들기","[{'step_number': 1, 'description': '파와 당근은 작게 다져 주고 뚝배기와 달걀 육수를 준비 합니다', 'image_url': 'https://recipe1.ezmember.co.kr/cache/recipe/2021/02/08/4c68bf06e32b9f927f46ba2494bab5c21.jpg'}, {'step_number': 2, 'description': '달걀 4개 알끈이를 제거하고', 'image_url': 'https://recipe1.ezmember.co.kr/cache/recipe/2021/02/08/89a6085e3f28d1c31f78ab5309d5fccf1.jpg'}, {'step_number': 3, 'description': '맛술 참치액 소금 참기름 당근 파 육수30ml(5T)넣어 섞어 줍니다', 'image_url': 'https://recipe1.ezmember.co.kr/cache/recipe/2021/02/08/a06f618d1ebc0df8606e2020307331af1.jpg'}, {'step_number': 4, 'description': '나머지 육수는 뚝배기에 넣어 끓여 줍니다', 'image_url': 'https://recipe1.ezmember.co.kr/cache/recipe/2021/02/08/f4a096daeba54104eaf118bae009a1181.jpg'}, {'step_number': 5, 'description': '육수가 끓으면 달걀 양념 물을 넣고', 'image_url': 'https://recipe1.ezmember.co.kr/cache/recipe/2021/02/08/21ec35534f672c37c7786fd1eba1bb1b1.jpg'}, {'step_number': 6, 'description': '나무 수저로 바닥이 눌지 않게 계속 저어 줍니다', 'image_url': 'https://recipe1.ezmember.co.kr/cache/recipe/2021/02/08/75ae90e97c08c5ac14ff95701a568e7e1.jpg'}, {'step_number': 7, 'description': '몽글몽글 덩어리가 생길 때 까지 저어 줍니다', 'image_url': 'https://recipe1.ezmember.co.kr/cache/recipe/2021/02/08/748d942df365e280f498064a042fa6921.jpg'}, {'step_number': 8, 'description': '달걀이 뭉쳐저 끓여 지면서 구멍이 2~3개 생기면 불을 끄고\n뚜껑을 덮어 줍니다', 'image_url': 'https://recipe1.ezmember.co.kr/cache/recipe/2021/02/08/3563521c1ed098134bdc9d378142c9771.jpg'}]"
8769,밑반찬,일상,달걀/유제품,찜,추억의 급식 반찬 급식 계란찜 만드는 법,급식계란찜,"2,273",30분 이내,아무나,4인분,"[('계란', '8개'), ('해물육수 팩', '1개'), ('당근', '1/4개'), ('양파', '1/4개'), ('쪽파', '3줄'), ('식용유', '약간'), ('소금', '1/3큰술'), ('맛술', '1큰술')]","예전에 촉촉하고 부드러운 푸딩 계란찜과 식당 단골메뉴인 뚝배기 폭탄 계란찜 만드는 법을 소개해드렸죠!
이번에는 예전 급식에서 종종 나왔던 추억의 급식 반찬 급식 계란찜 만드는 법을 알려드릴게요.
보드라운 식감과 알록달록한 비주얼의 급식 계란찜으로 추억에 한 번 젖어보세용.
역시나 동영상과 함께 만들어 보아요.
Let's Go!","[{'step_number': 1, 'description': '먼저 재료를 준비해주세요.', 'image_url': 'https://recipe1.ezmember.co.kr/cache/recipe/2021/03/02/10a4648987bd636f5c9c98e33a4a188f1.jpg'}, {'step_number': 2, 'description': '냄비에 물을 적당히 넣고 해물육수팩을 넣어 끓여 육수물을 만들어 주세요. \n해물육수는 너무 많은 양은 필요 없고 종이컵으로 1컵 정도가 필요하니 거기에 맞춰 물 양은 정해주세요.물 적당히, 해물육수팩 1개', 'image_url': 'https://recipe1.ezmember.co.kr/cache/recipe/2021/03/02/c43e85125c26352dd53f33efa2dd89c41.jpg'}, {'step_number': 3, 'description': '야채를 손질해 주세요. \n당근과 양파는 잘게 다지고, 쪽파는 잘게 송송 썰어주세요.야채들도마 ,  칼', 'image_url': 'https://recipe1.ezmember.co.kr/cache/recipe/2021/03/02/69aa76358b2471eb62b9e2719bbe90511.jpg'}, {'step_number': 4, 'description': '볼에 계란을 깨 넣고 저어서 잘 풀어주세요.계란 8개', 'image_url': 'https://recipe1.ezmember.co.kr/cache/recipe/2021/03/02/4d19066f65f1e6b5f39ff373a0e16bc11.jpg'}, {'step_number': 5, 'description': '아래 볼을 받치고 고운 채에 계란 물을 부어 알끈이를 걸러내 버리고 아래 고운 계란물만 모아주세요.고운 채', 'image_url': 'https://recipe1.ezmember.co.kr/cache/recipe/2021/03/02/7d1b1cd428c174ac4985653a02cc56821.jpg'}, {'step_number': 6, 'description': '고운 계란물에 맛술 1큰술, 소금 1/3큰술, 식은 해물육수 1컵, 잘게 다져놓은 야채 모두를 넣고 잘 섞어주세요. \n약간 짠 맛이 나게 하려면 소슴은 1/2큰술을 정도로 넣어 주세요. \n그리고 맛술은 계란의 비린 맛을 잡아주며, \n육수물은 금방 끓어내어 뜨거운 상태의 육수물을 부으면 계란이 익어 버려요. \n육수물은 반드시 완전히 식힌 다음에 부어주세요.맛술 1큰술, 소금 1/3큰술, 식은 해물육수 1컵, 잘게 다져놓은 야채 모두', 'image_url': 'https://recipe1.ezmember.co.kr/cache/recipe/2021/03/02/46d898b9cd176e7f34900e85fe0bd8421.jpg'}, {'step_number': 7, 'description': '사각형 내열용기 안쪽에 식용유를 약간 넣고 솔로 펴서 안쪽 옆면까지 골고루 발라 주세요. 기름을 바르는 이유는 나중에 계란을 용기에서 분리를 쉽게 하기 위해서입니다.식용유 약간사각형 내열용기 ,  붓솔', 'image_url': 'https://recipe1.ezmember.co.kr/cache/recipe/2021/03/02/d22fc49d0615f943adb0a912186b42461.jpg'}, {'step_number': 8, 'description': '내열용기 안에 야채와 섞은 계란물을 용기의 80~90% 지점까지 부어주세요. \n저는 남는 양 없이 딱 맞게 들어가네요.', 'image_url': 'https://recipe1.ezmember.co.kr/cache/recipe/2021/03/02/918f0d8991658aaa8adbe284d2cdf1ab1.jpg'}, {'step_number': 9, 'description': '계란 물 표면에 뜬 거품을 숟가락으로 살짝 거둬주세요.숟가락', 'image_url': 'https://recipe1.ezmember.co.kr/cache/recipe/2021/03/02/162a86b9b64418954d48aacedc359dcb1.jpg'}, {'step_number': 10, 'description': '사각용기에 랩을 씌워 밀봉해주세요.랩', 'image_url': 'https://recipe1.ezmember.co.kr/cache/recipe/2021/03/02/2d183a713526c75df8b8152aa22171281.jpg'}, {'step_number': 11, 'description': '사각용기가 들어갈만한 크기의 냄비에 사각용기를 넣고 물을 사각용기가 잠기지 않을 정도로 채워주세요.냄비', 'image_url': 'https://recipe1.ezmember.co.kr/cache/recipe/2021/03/02/f85206e3dfd145722c70e01fd9f441981.jpg'}, {'step_number': 12, 'description': '냄비뚜껑을 닫고 중약불에서 25~30분간 쪄주세요. \n처음 2분 정도는 강불에서 물을 끓여주시고 나머지는 불을 줄여 중약불로 쪄주시면 됩니다. 저는 30분 동안 쪘어요.중.약불', 'image_url': 'https://recipe1.ezmember.co.kr/cache/recipe/2021/03/02/0218d3eff7bfad151e01b96a43f648571.jpg'}, {'step_number': 13, 'description': '도마에 올려 랩을 벗기고 계란찜을 뒤집어서 계란찜을 용기에서 분리해 주세요. \n아마 가스레인지 불 조절이 제 각기 틀리기 때문에 뒤집기 전에 숟가락으로 약간 떠보고 덜 익었으면 전자레인지에 약간 돌려주시면 됩니다. \n뜨거우니 조심하시구요.전자레인지', 'image_url': 'https://recipe1.ezmember.co.kr/cache/recipe/2021/03/02/451c568522079fa97abd8c0fa0f0b4311.jpg'}, {'step_number': 14, 'description': '적당한 크기로 잘라 접시에 내 놓으면 추억의 급식 반찬 급식 계란찜 완성.', 'image_url': 'https://recipe1.ezmember.co.kr/cache/recipe/2021/03/02/9494a95cae8183b89804f85dea5e798a1.jpg'}, {'step_number': 15, 'description': '[연관 레시피]\n촉촉한 식감과 혀 끝에서 사르르 녹는 맛이 일품인 푸딩 계란찜\n@6952373 \n식당에서 즐겨 먹던 뚝배기 폭탄계란찜\n@6953352 \n소스에 밥 비벼먹어도 맛 있는 마약계란 간장조림\n@6948126', 'image_url': 'https://recipe1.ezmember.co.kr/cache/recipe/2021/03/02/ee61b744d45330fe66ee8ef76772c9e91.jpg'}]"
8770,밑반찬,일상,달걀/유제품,찜,일본식계란찜 실패없이 만들기,일본식계란찜,"1,676",30분 이내,아무나,2인분,"[('계란', '2알'), ('다시마육수', ''), ('파', '조금'), ('소금', '')]",누가 그랬죠 실패는 성공의 어머니라고..ㅋㅋ 제가 그 쉽다는 일본식 계란찜을 실패를 했습니다 ..ㅋㅋㅋ 실패해보니 만들때 가장 중요한 부분을 알겠더라구요 그러니 꼭 이 레시피를 참고하시길...ㅠ,"[{'step_number': 1, 'description': '우선 다시육수먼저 만들어볼게요 물은 많이 필요 없고 한컵반정도에 다시마 한조각넣고 5분정도 끓여주세요 그런 후 충분히 식혀줍니다', 'image_url': 'https://recipe1.ezmember.co.kr/cache/recipe/2021/03/05/cc6328c99949abf6749c47670a4c872e1.jpg'}, {'step_number': 2, 'description': '계란 2구는 잘 풀어준 후 소금 1/2작은술 넣고 잘 풀어주세요', 'image_url': 'https://recipe1.ezmember.co.kr/cache/recipe/2021/03/05/1ad6f28df28dfa297b30514ffdebee0a1.jpg'}, {'step_number': 3, 'description': '채를 이용해서 계란을 2번 채에 걸러줍니다 이게 제일 중요한 작업이에요!', 'image_url': 'https://recipe1.ezmember.co.kr/cache/recipe/2021/03/05/2291011908054273e90b81b9b68692101.jpg'}, {'step_number': 4, 'description': '2번 채에 거른 계란에 만들어놓은 다시마 육수를 1:1비율로 부어주고 저는 멸치액젓 1작은술 더 넣어서 간을 더 맞췄어요', 'image_url': 'https://recipe1.ezmember.co.kr/cache/recipe/2021/03/05/2236f7fd27325e4e21c121290a7d4e351.jpg'}, {'step_number': 5, 'description': '이제 찜기에 넣고 10분간 쪄주면 되는데요 여기서 가장 중요한건! 바로 불조절....ㅋㅋ 깜박하고 불세기를 세게 해놨더니..', 'image_url': 'https://recipe1.ezmember.co.kr/cache/recipe/2021/03/05/d46adff6a132992ed822e13949fbb0e41.jpg'}, {'step_number': 6, 'description': '매끈한계란찜을 만드는데 실패했지 뭐에요..ㅜㅜ 그리고 찌기전에 계란물에 있는 거품도 어느정도 제거해줬어야 했는데 그냥 두었더니 ㅋㅋㅋㅋㅋ 요렇게 되어버렸어요 그러니 여러분들은 찌실때 중불 또는 중약불로 서서히 찌시는게 좋을거 같아요..ㅠㅠㅠ 아무튼 10분간 쪄주고 계란찜위에 파나 깨소금등을 올려 5분정도 더 쪄주면 끝이에요', 'image_url': 'https://recipe1.ezmember.co.kr/cache/recipe/2021/03/05/5fb98bf313e8c5d3087ba3be1b9e03651.jpg'}]"
8771,밑반찬,일상,달걀/유제품,찜,"폭신한~ 토마토 계란찜, 토마토요리",토마토계란찜,"3,714",15분 이내,초급,2인분,"[('계란', '4개'), ('소금', '1/2작은술'), ('깻잎', '3장'), ('양파', '1/2개'), ('올리브유', '1/2큰술'), ('다진토마토', '1컵')]",토마토 계란볶음을 보고 토마토를 계란찜에 넣어 봤습니다. 토마토의 붉은 색이 노란색 계란과 잘어울리네요. 물론 맛도 좋아요. 토마토와 계란은 어떻게 조리해도 잘 어울리는 궁합이 맞습니다.,"[{'step_number': 1, 'description': '계란 4개, 소금 1/2작은술, 깻잎 3장을 다져 넣고 고루 잘 섞어 줍니다.', 'image_url': 'https://recipe1.ezmember.co.kr/cache/recipe/2018/06/29/26a6ec7b23759c96f793751e23fee27b1.jpg'}, {'step_number': 2, 'description': '달군 뚝배기에 올리브유 1/2큰술을 두르고 양파 1/2개를 다져넣고 볶아 줍니다.', 'image_url': 'https://recipe1.ezmember.co.kr/cache/recipe/2018/06/29/71703570b44da6f339612a0467e7a8d51.jpg'}, {'step_number': 3, 'description': '그리고 작은 토마토 1개를 다져 ...1컵 을 넣고', 'image_url': 'https://recipe1.ezmember.co.kr/cache/recipe/2018/06/29/d4334ce495ecef031af0a744c8963d741.jpg'}, {'step_number': 4, 'description': '양파와 함께 볶아 전체적으로 한번 자글자글 끓으면...', 'image_url': 'https://recipe1.ezmember.co.kr/cache/recipe/2018/06/29/4b54d246fd6706b224f3a0a252c799a71.jpg'}, {'step_number': 5, 'description': '준비한 계란을 붓고....', 'image_url': 'https://recipe1.ezmember.co.kr/cache/recipe/2018/06/29/810b5659ba3ae3530491070796803f8a1.jpg'}, {'step_number': 6, 'description': '뚝배기 바닥과 안쪽면이 눌러붙지않게 _일자형 주걱으로 긁어주면서 계속 저어 줍니다.', 'image_url': 'https://recipe1.ezmember.co.kr/cache/recipe/2018/06/29/7347c930a817efa169ebd6a55c6d81271.jpg'}, {'step_number': 7, 'description': '계란이 거의 익어 주걱이 저어지지 않으면.....', 'image_url': 'https://recipe1.ezmember.co.kr/cache/recipe/2018/06/29/ab62808866c0ccc009877d047d952dcf1.jpg'}, {'step_number': 8, 'description': '불을 최대한 줄이고 뚜껑을 덮어 1~2분정도 있다가 불을 꺼 줍니다. 그러면 자글자글 끓는 계란찜이 완성입니다.', 'image_url': 'https://recipe1.ezmember.co.kr/cache/recipe/2018/06/29/0653d174943885b47e71b3222e0e30b41.jpg'}]"
8772,밑반찬,일상,달걀/유제품,찜,계란찜 보들보들 부드러운 계란찜,계란찜,"20,446",20분 이내,초급,2인분,"[('계란', '4개'), ('칵테일새우', '2개'), ('민트 잎', '2개'), ('다시마 육수', '1컵'), ('우유', '1T'), ('맛술', '1T'), ('소금', '1꼬집'), ('소금', '1꼬집'), ('청주', '1T'), ('물', '1컵')]","너무 오랜만에 인사 드려요
그동안 오른팔 수술하고 7개월만에 글을 올리게 되었어요~!~
앞으로 잘부탁드립니다
오늘은 부드럽고 고소하고 보들보들 맛있는 계란찜을 만들어 보았어요
그럼 보들보들 부드러운 계란찜 만들어 볼까요
밥 대신 계란찜으로 아침식사를 대신했어요

일본 계란찜 차왕무시라고 하지요
그런데 요즘 일본과의 관계 때문에 일본식 계란찜이라는 제목은 쓰기 싫어서요~!~
보들보들 푸딩을 먹는 것 같아요


​","[{'step_number': 1, 'description': '재료를 준비했어요', 'image_url': 'https://recipe1.ezmember.co.kr/cache/recipe/2019/09/01/df1af927e725f003c8359b63fdfb50841.jpg'}, {'step_number': 2, 'description': '새우는 끓는 물에 10초 정도 데쳐줍니다\n데칠 때 청주를 1T 넣고 데치면 비린내와 잡내를 잡아줍니다\n육수는 전날 미리 담가서 냉장고에 넣었던 것을 사용했어요', 'image_url': 'https://recipe1.ezmember.co.kr/cache/recipe/2019/09/01/0f454a1b5f2a3e76997598e27b7c5f6c1.jpg'}, {'step_number': 3, 'description': '계란을 깨트려서 잘 풀어줍니다', 'image_url': 'https://recipe1.ezmember.co.kr/cache/recipe/2019/09/01/157a4b86172db94734cc8ce7c115ae3d1.jpg'}, {'step_number': 4, 'description': '풀어놓은 계란에 육수와 우유를 넣은 다음 체에 걸러줍니다 \n면포에 걸러주면 더욱 부드럽고 좋지만 전 그냥 체에 두 번 걸러주었었어요\n한번 걸러주는 것보다 두 번 걸러주면 더욱 부드럽지요', 'image_url': 'https://recipe1.ezmember.co.kr/cache/recipe/2019/09/01/b1b9576ccd0c310c5e97fb1ff3c4ed571.jpg'}, {'step_number': 5, 'description': '물을 미리 끓여서 찜기를 올린 다음 면 보를 쒸우고 \n계란 담은 컵을 올려줍니다', 'image_url': 'https://recipe1.ezmember.co.kr/cache/recipe/2019/09/01/e9fbea2fff5913574b70865b223a47b41.jpg'}, {'step_number': 6, 'description': '김이 오른 찜기에 컵을 올린다음 뚜껑을 덮어줍니다\n뚜껑에서 수증기가 떨어질 수 있기에 뚜껑을 면포로 싸준 다음 덮으면\n면포가 수증기를 흡수해줍니다\n뚜껑에서 수증기가 떨어지기에 뚜껑을 면포로 쒸워줍니다', 'image_url': 'https://recipe1.ezmember.co.kr/cache/recipe/2019/09/01/ff52b0ad1fe934fe93e0b9446058e5e61.jpg'}, {'step_number': 7, 'description': '7분 정도 찐 다음 뚜껑을 열어보고 새우를 올려줍니다\n처음부터 새우를 넣으면 새우가 바닥으로 가라앉기 때문에 \n계란이 반쯤 익었을 때 뚜껑을 열고 새우를 올려주어야 합니다\n새우를 올리고 5분 정도 더 쪄주었어요\n계란찜은 총 10~13분 정도 쪄주면 보들보들 부드럽고 맛있는 계란찜이 완성됩니다\n집집마다 불사양이 다르기 때문에\n\n봐가면서 쪄줍니다\n\n\u200b', 'image_url': 'https://recipe1.ezmember.co.kr/cache/recipe/2019/09/01/beef11cbb024ceccf2427e404c3225ef1.jpg'}, {'step_number': 8, 'description': '남녀노소 누구나 좋아하는 푸딩처럼 부드러운 계란찜', 'image_url': 'https://recipe1.ezmember.co.kr/cache/recipe/2019/09/01/9a802d5d983291ae09ae7c57a6bedb751.jpg'}, {'step_number': 9, 'description': '아침식사 대신 드시면 속도 편하고 단백질 보충도 되고 일거양득이겠지요~!~', 'image_url': 'https://recipe1.ezmember.co.kr/cache/recipe/2019/09/01/f1f1799d4323b8a1c2214ab1c78cd5c51.jpg'}]"
8773,밑반찬,일상,달걀/유제품,찜,건강을 위한 마늘 달걀찜,마늘달걀찜,"3,012",30분 이내,초급,2인분,"[('달걀', '2개'), ('멸치 다시물', '1컵'), ('마늘', '1T'), ('청주', '0.5T'), ('청고추', '약간'), ('홍고추', '약간'), ('새우젓 국물', '1T')]",건강을 위한 마늘편을 넣어 부드럽고 담백한 달걀찜입니다.,"[{'step_number': 1, 'description': '마늘을 편썰기를 합니다.', 'image_url': 'https://recipe1.ezmember.co.kr/cache/recipe/2015/08/06/bd9cad8b170c7f3de0b67f31ef427df01.jpg'}, {'step_number': 2, 'description': '달걀을 체에 받혀서 알끈을 풀어줍니다.', 'image_url': 'https://recipe1.ezmember.co.kr/cache/recipe/2015/08/06/ba459de212121d3eb2742eecd11c2b4c1.jpg'}, {'step_number': 3, 'description': '풀어준 달걀물에 멸치다싯물을 붓고 마늘편을 넣습니다. 새우젓 국물로 간을 하고 청주로 비린맛을 잡아줍니다.', 'image_url': 'https://recipe1.ezmember.co.kr/cache/recipe/2015/08/06/d65937bd756c30aec14e20c153f0fe381.jpg'}, {'step_number': 4, 'description': '뚜껑을 덮어 중불에서 익힌 후 거의다 익어가면 청고추와 홍고추를 썰어넣고 불을 끕니다.', 'image_url': 'https://recipe1.ezmember.co.kr/cache/recipe/2015/08/06/58dbdbd6a54ea3559f3071519a5eb7c61.jpg'}]"
8774,밑반찬,일상,달걀/유제품,찜,찰랑이는 명란계란찜 만드는법! 고소한 명란젓 요리~,명란계란찜,"5,513",30분 이내,아무나,6인분 이상,"[('계란', '10개'), ('명란젓', '40g'), ('부추', '40g'), ('당근', '30g'), ('소금', '1작은술'), ('참치액젓', '2큰술'), ('설탕', '0.5작은술'), ('후추', '약간'), ('물', '500ml')]","계란 10개 과감하게 터트려서
어제 사온 명란젓 넣고 부추와 당근 넣어 보들보들 만들어봤어요.
오븐에 만든 계란찜이라 고소함이 좋고요.
명란젓을 넣어서 식감도 좋고 간도 좋아서
밥반찬으로 좋았어요.","[{'step_number': 1, 'description': '명란젓은 껍질에서 알만 살살 벗겨내고요.\n당근과 부추는 다져서 준비하고요.', 'image_url': 'https://recipe1.ezmember.co.kr/cache/recipe/2019/07/14/c3bd2d04d05c1e7a526d37a82c87d6c41.jpg'}, {'step_number': 2, 'description': '계란은 모두 9개? 아니오\n하나 추가해서 열 개 준비했어요.\n아침부터 숫자에 약해서는 냉장고에서 하나 얼른 꺼내왔어요.', 'image_url': 'https://recipe1.ezmember.co.kr/cache/recipe/2019/07/14/84f2a5a4927f530b16b52d3e43bd34091.jpg'}, {'step_number': 3, 'description': '계란은 모두 깨서 볼에 담고요.', 'image_url': 'https://recipe1.ezmember.co.kr/cache/recipe/2019/07/14/7bd880214b9abd0ebd8fc8422064d8061.jpg'}, {'step_number': 4, 'description': '적당히 계란을 풀어준 다음.\n물 500ml 붓고요.\n소금 1작은술 넣고\n참치액젓 2큰술 넣어 양념을 하고요.\n세차게 젓가락으로 저어 계란을 풀어줍니다.', 'image_url': 'https://recipe1.ezmember.co.kr/cache/recipe/2019/07/14/fef2fd62e352886881b9cb3eae6ea1571.jpg'}, {'step_number': 5, 'description': '체에 3번 정도 걸러주면 계란찜이 아주 부드럽게 만들어져요.\n그리고 계란을 잘 풀어줘야 거를 때 잘빠져 나옵니다.', 'image_url': 'https://recipe1.ezmember.co.kr/cache/recipe/2019/07/14/ab2f925dc48005a47172b79505abe3921.jpg'}, {'step_number': 6, 'description': '명란 손질해놓은 것도 볼에 넣고요.\n설탕도 0.5 작은 술 넣고요.\n당근과 부추 다진 것을 넣고 잘 섞어두고요.', 'image_url': 'https://recipe1.ezmember.co.kr/cache/recipe/2019/07/14/0848bd07db239b60019fb819e71114911.jpg'}, {'step_number': 7, 'description': '오븐 예열도 200도에서 10분 해두었고요.\n스텐인리스 찬통에 참기름 1큰술을 바르고요.오븐아차~ 찬통은 오븐 예열하는 중에 넣어 달군 상태라 뜨끈해요.', 'image_url': 'https://recipe1.ezmember.co.kr/cache/recipe/2019/07/14/6f4100a62639f16d8049bb78bcef11061.jpg'}, {'step_number': 8, 'description': '명란계란찜 오븐에 넣어 170도에서 35분 구웠어요.\n(오븐 사양에 따라 차이가 있으니깐 각자 시간이나 온도는 조절하셔야 해요.)', 'image_url': 'https://recipe1.ezmember.co.kr/cache/recipe/2019/07/14/bc6fae2b909ce866e321b24ea30527a21.jpg'}, {'step_number': 9, 'description': '화산처럼 부풀어 오르는 명란계란찜 때문에 웃음이 나서~~', 'image_url': 'https://recipe1.ezmember.co.kr/cache/recipe/2019/07/14/f6ea4a4c9b16411ff3ad179eb89277991.jpg'}, {'step_number': 10, 'description': '근데 또 오븐에서 꺼내면 이렇게 훅 가라앉아버리는 명란계란찜.\n명란계란찜만 그런 것이 아니라 모든 계란찜이 실온에 나오면 이렇게 변한다는요.', 'image_url': 'https://recipe1.ezmember.co.kr/cache/recipe/2019/07/14/f0e5fd2ca95886a2b5aee0f0cf3ebbc31.jpg'}, {'step_number': 11, 'description': '칼로 예쁘게 자르고요.', 'image_url': 'https://recipe1.ezmember.co.kr/cache/recipe/2019/07/14/473717bf06d1d074c63ff6262224249b1.jpg'}]"
8775,밑반찬,일상,달걀/유제품,찜,인삼 애플 계란찜,인삼애플계란찜,524,30분 이내,아무나,1인분,"[('인삼', '1뿌리'), ('사과', '1/4개'), ('버터', '1꼬집'), ('달걀', '1개'), ('설탕', '1t'), ('계피', '1꼬집'), ('소금', '1꼬집'), ('꿀', '1/2큰술')]",평소 즐겨 먹을 수 있는 계란찜에 인삼과 잘 어울리는 사과를 넣어 달달한맛과 인삼의 향과 맛이 베이도록 하여 먹으면 맛있는 계란찜을 만들어 보았는데 어울리지 않을 것 같은 계란과 인삼 사과를 계란찜으로 만들어 보면 생각이 바뀌실 겁니다 씁쓸한 맛을 단맛으로 잡힘으로서 계란찜에 어울리는 맛이니 만들어 드셔보세요.,"[{'step_number': 1, 'description': '인삼과 사과는 알멩이 정도로 썰어준다.', 'image_url': 'https://recipe1.ezmember.co.kr/cache/recipe/2019/06/22/4f28f8e69f388191eafc374d408aeccb1.jpg'}, {'step_number': 2, 'description': '팬에 인삼과 사과를 올려 설탐1t 물3t 꿀1/2t 계피가루1꼬집을 넣어 졸여준다', 'image_url': 'https://recipe1.ezmember.co.kr/cache/recipe/2019/06/22/94de859ae8703446d77a122234e5c7381.jpg'}, {'step_number': 3, 'description': '종이컵에 버터를 살짝 바른 후 계란물을 붇고 속재료를 넣어 잘 섞어준다.(소금 뿌리는건 자유 입니다.)', 'image_url': 'https://recipe1.ezmember.co.kr/cache/recipe/2019/06/22/244a4a5ad4673957d924678bd65a2fc61.jpg'}, {'step_number': 4, 'description': '전자레인지에 1분정도 돌린후 잘저어준다.전자레인지', 'image_url': 'https://recipe1.ezmember.co.kr/cache/recipe/2019/06/22/ab84b9def94c64e2e4934b8e2c9806741.jpg'}, {'step_number': 5, 'description': '넘칠수도 있으니 주의하면서 전자레인지에 돌려준다.', 'image_url': 'https://recipe1.ezmember.co.kr/cache/recipe/2019/06/22/f944cad22a07a449af2e5659e2583f341.jpg'}, {'step_number': 6, 'description': '뜨거우니 접시에 담아 살짝 식힌 후 먹어준다.', 'image_url': 'https://recipe1.ezmember.co.kr/cache/recipe/2019/06/22/73b0ebdef90c1d985991995cd56a42921.jpg'}]"
