index,종류별,상황별,재료별,방법별,글 제목,레시피이름,조회수,조리시간,난이도,인분,재료,소개글,조리순서
8786,밑반찬,일상,달걀/유제품,찜,"연두부같은 계란찜, 새우젖으로 맛내기",계란찜,346,30분 이내,초급,2인분,"[('달걀', '3개'), ('대파', '약간'), ('물', '100ml'), ('새우젖', '1/2T'), ('소금', '약간'), ('참기름', '1T')]","계란찜이 쉬운 음식이라는데, 잘 안되요. 그래서 레시피를 남깁니다. 요대로만 하자 하고서 기록해두려해요. 왜냐? 쉽고도 맛나니까요","[{'step_number': 1, 'description': '사용할 재료입니다. 물은 계란과 같은량입니다. 계란이 하나 30그람 정도라서 물은 100cc 준비했습니다.', 'image_url': 'https://recipe1.ezmember.co.kr/cache/recipe/2023/10/06/44f2f27bea3eebf8ac4f55c24edfd9951.jpg'}, {'step_number': 2, 'description': '계란을 거품기로 잘 풀어주세요. 새우젖이나 소금간을 같이 해서저으셔도 됩니다. 그러면 더욱 부드러워요볼 , 거품기', 'image_url': 'https://recipe1.ezmember.co.kr/cache/recipe/2023/10/06/cd05d96f04da246db90e697ecd1980d41.jpg'}, {'step_number': 3, 'description': '물 100cc도 같이 넣고 거품기로 저어주세요', 'image_url': 'https://recipe1.ezmember.co.kr/cache/recipe/2023/10/06/89e2c59510b4c99df4fa3379f362980f1.jpg'}, {'step_number': 4, 'description': '2번정도 위 계란물을 촘촘한 채반에 걸러줍니다.채반', 'image_url': 'https://recipe1.ezmember.co.kr/cache/recipe/2023/10/06/d8144544f7bd78d2c7bb52c0472ec8cb1.jpg'}, {'step_number': 5, 'description': '찜기로 저는 실리만찜기를 이용해요. 실리콘재질이라 안심이 되요. 두껑도 있구요실리만찜기', 'image_url': 'https://recipe1.ezmember.co.kr/cache/recipe/2023/10/06/01c469a5d157ecfd0fe3703a2cd4334c1.jpg'}, {'step_number': 6, 'description': '찜기에 계란물 담고. 추가 간이 필요하면 소금 약간 사용하세요. 전 추가 간 안했습니다.', 'image_url': 'https://recipe1.ezmember.co.kr/cache/recipe/2023/10/06/7df7ab8b95941cded5c5f52e8e272a7d1.jpg'}, {'step_number': 7, 'description': '대파도 송송 넣어주시고, 참기름도 1T 넣어주세요', 'image_url': 'https://recipe1.ezmember.co.kr/cache/recipe/2023/10/06/9080de75f78d977e002e5e708172c5241.jpg'}, {'step_number': 8, 'description': '찜통에 물을 충분히 넣고 끓으면 채반위에 계란찜을 올려주시고. 뚜껑도 닫아주세요.찜통', 'image_url': 'https://recipe1.ezmember.co.kr/cache/recipe/2023/10/06/f2540a490d5f5c75a52ff6123b5e98211.jpg'}, {'step_number': 9, 'description': '중불에 20분 찝니다. 20분 지나서 수저로 가운데를 찔러보세요. 겉모양만 보면 안익은듯해요. ㅋㅋ 꼭 찔러보셔야해요^^ 덜 익었으면 추가로 약 5분정도 더 쪄주면 됩니다. 부드럽고 연두부 같은 계란찜 완성입니다.', 'image_url': 'https://recipe1.ezmember.co.kr/cache/recipe/2023/10/06/6fe682e5fb384720c6da27201a3b2dc41.jpg'}]"
8787,밑반찬,일상,달걀/유제품,찜,방구코딱지의 요리 #7 [계란찜] [일본식계란찜] [이쁜계란찜],계란찜,"1,761",30분 이내,아무나,2인분,"[('계란', '9개'), ('우유', '5숟갈'), ('국간장', '1숟갈'), ('후추', '약간'), ('깨', '약간')]",안녕하세요. '방구코딱지'입니다. 오늘은 일본식? 계란찜이 있다는 걸 알게된 후 도전해봤습니다. 일본식 계란찜은 일반 우리가 아는 뚝배기(용기)에 열을 직접가해서 조리하는 방법이 아닌 만두나 찐빵찌듯 증기로 하는 방법이더라구요~,"[{'step_number': 1, 'description': '먼저 용기에 계란 9개를 깨뜨려서 넣어주세요.', 'image_url': 'https://recipe1.ezmember.co.kr/cache/recipe/2022/09/20/51a9338b217e9154933cd4447782c3f31.jpg'}, {'step_number': 2, 'description': '거기에 우유 5숟갈, 국간장 1숟갈을 넣어주세요. 일본식 레시피는 간장같은 딴 것이 들어가던데.. 저희 집에는 그 양념이 없어서 국간장 1숟갈로 할까 하다가.. 간장 고추장아찌 담가놓은게 있어서 그거 간장 국물 1숟갈 넣었어요^^ 아 그리고! 우유는 계란토스트(프렌치 토스트)하듯 하면 더 맛있을꺼 같아서 넣어 봤어요. 미리 결과를 스포하자면.. 넣길 잘했다고 생각해서 그냥 레시피에 올려 놨어요^^', 'image_url': 'https://recipe1.ezmember.co.kr/cache/recipe/2022/09/20/f899ec328b01eaa4c3bac4a071178a941.jpg'}, {'step_number': 3, 'description': '우유와 간장을 넣었으면 1차 쉐킷!!', 'image_url': 'https://recipe1.ezmember.co.kr/cache/recipe/2022/09/20/c4df17bfbb981b72d145946a4f70945a1.jpg'}, {'step_number': 4, 'description': '그리고 체에 걸러주세요~ 2번 정도 체에 걸렀을때 뽀얀 달걀 국물이 탄생했어요^^.', 'image_url': 'https://recipe1.ezmember.co.kr/cache/recipe/2022/09/20/5caac4df4c5765a5ed088305d6c9aafe1.jpg'}, {'step_number': 5, 'description': '모양을 낼 용기에 옮겨 담고~', 'image_url': 'https://recipe1.ezmember.co.kr/cache/recipe/2022/09/20/9a00ae9479c0448a1656ae80fc209b161.jpg'}, {'step_number': 6, 'description': '이렇게 찜을 찌듯 준비해주세요^^ 뚜껑을 덮으면 찜기를 사용할 때 뚜껑에 증기가 모여 계란찜으로 떨어지는 것을 방지한다고 해서 이렇게 덮어놓고~ 찌기 시작했어요~^^ 처음에는 뜨거운 불로 물을 데폈다가 물에서 증기가 발생되면 뚜껑을 덮고 약불로 조정해서 5분 간격으로 계속 지켜봤습니다^^ 그결과...', 'image_url': 'https://recipe1.ezmember.co.kr/cache/recipe/2022/09/20/f694aaa1555c4d245d39a3c7644f46e61.jpg'}, {'step_number': 7, 'description': '20분뒤. . 오~ 이쁘게 부풀어 올랐어요^^ 요기서 더 쪄버리면 모찌모찌한 느낌이 안난다고 하니 요기서 건지겠습니다^^ 오.. 확실히 이쁘게 나왔습니다~ 요기에 데코로 후추와 깨를 넣으면 오늘 요리 끝!!!', 'image_url': 'https://recipe1.ezmember.co.kr/cache/recipe/2022/09/20/3c16012b8ee7524901788d775b1415011.jpg'}]"
8788,밑반찬,일상,달걀/유제품,찜,부드러운 계란찜 만들기 급식 계란찜 하는 법 소개해요,계란찜,"2,541",30분 이내,아무나,4인분,"[('유정란', '8알'), ('당근', '1/6개'), ('대파', '1/2뿌리'), ('물', '2/3컵'), ('소금', '2꼬집'), ('참치액', '1큰술'), ('참기름', '1큰술')]",제가 어릴적 먹던 급식 계란찜~ 삼남매도 학교에서 종종 먹었다는 얘기에 추억 요리로 가끔 해주는 아이들 밑반찬입니다.,"[{'step_number': 1, 'description': '당근과 대파는 잘게 다져주세요.', 'image_url': 'https://recipe1.ezmember.co.kr/cache/recipe/2022/11/15/47d0aecfd5e52fff74e49a6c832079b31.jpg'}, {'step_number': 2, 'description': '참치액 1 큰 술, 소금 두꼬집을 넣고\n계란 8알을 풀어 소금이 녹을때까지\n계란을 풀어주세요. \n계란 덩어리가 없도록 풀어주셔야 해요.', 'image_url': 'https://recipe1.ezmember.co.kr/cache/recipe/2022/11/15/b4ccdb5ec6cad6d325b0bfa2515dc94c1.jpg'}, {'step_number': 3, 'description': '잘 풀어진 계란에 물 반컵을 넣어\n섞어주세요.계란의 부드러움은 물의 양에 따라 조절됩니다. \n단단한 계란찜을 원하시면 물을 조금만 넣어주시면 됩니다. (반컵정도)\n물의 양이 많을수록 계란이 부드러워져요.\n대신 물이 많이 생기니 참고하세요.', 'image_url': 'https://recipe1.ezmember.co.kr/cache/recipe/2022/11/15/e997babbe3179045f255436c0dec967b1.jpg'}, {'step_number': 4, 'description': '용기에 참기름 1 큰 술을 골고루 발라주세요', 'image_url': 'https://recipe1.ezmember.co.kr/cache/recipe/2022/11/15/bdaecd268098f0a1f410434b2094e08d1.jpg'}, {'step_number': 5, 'description': '체에 받쳐 용기에 계란물을 한벌 걸러주세요. \n이 과정을 거치셔야 푸딩처럼 부드러운 계란찜을 완성하실 수 있어요.', 'image_url': 'https://recipe1.ezmember.co.kr/cache/recipe/2022/11/15/9f28daeef1439720995ff2664e1df9f01.jpg'}, {'step_number': 6, 'description': '체에 걸러준 계란물에 다진 대파와 당근을 넣어 섞어 주세요.', 'image_url': 'https://recipe1.ezmember.co.kr/cache/recipe/2022/11/15/aa81447ce0bd2bbdcfe4780fb0ad039c1.jpg'}, {'step_number': 7, 'description': '용기를 랩으로 감싼 뒤, 포크로 구멍을 5개정도 뚫어주세요.\n랩을 씌워 찜기에 올려주셔야\n계란찜이 완성될 동안 물이 계란찜 안으로 들어가지 않게 막아줘요.', 'image_url': 'https://recipe1.ezmember.co.kr/cache/recipe/2022/11/15/7112f130ddf0e8ac137a261f132e405d1.jpg'}, {'step_number': 8, 'description': '찜기에 약 10분정도 끓여주세요.\n젓가락으로 찔렀을때에 계란물이 묻어 나오지 않으면 완성입니다.', 'image_url': 'https://recipe1.ezmember.co.kr/cache/recipe/2022/11/15/f9370e038a0f49a35747b9d4f4233c401.jpg'}, {'step_number': 9, 'description': '완성된 계란찜은 2분정도 식혀 준 뒤에\n도마에 뒤집어 꺼내주시면 됩니다.\n깨지지 않도록 조심하세요.', 'image_url': 'https://recipe1.ezmember.co.kr/cache/recipe/2022/11/15/1a1856b550e72e0fa1d5053bd394c2c41.jpg'}, {'step_number': 10, 'description': '계란찜은 먹기 좋은 크기로 잘라주시면 완성이예요.', 'image_url': 'https://recipe1.ezmember.co.kr/cache/recipe/2022/11/15/03a39033a107018dab57fce0b2280cac1.jpg'}]"
8789,밑반찬,일상,달걀/유제품,찜,계란찜 만들기 부드러운 푸딩 계란찜 물비율 찜기달걀찜 만드는 법,푸딩계란찜,"2,420",15분 이내,아무나,2인분,"[('계란', '3개'), ('다시마 육수', '200ml'), ('냉동새우', '2개'), ('맛술', '1큰술'), ('설탕', '1작은술'), ('소금', '0.5작은술')]",오랜만에 부드러운 #계란찜 #계란찜 만들기 했어요 간단하게 냄비에 #달걀찜 #푸딩계란찜 만들어서 한 끼에 순삭 했네요 전자레인지로 만들면 쉽고 간편한데 이번에는 냄비에 실리콘 찜기 올려서 만들어 보았어요 다시 물 넣어 부드럽게 만든 계란찜 찜기에 올려 12분 쪘어요 전자레인지로 만들면 더욱 쉽고 편하게 할 수 있는데 오랜만에 찜기를 이용해 보았어요 ​레시피는 계량스푼 계량컵 사용 1 큰 술=15ml1 작은 술=5ml,"[{'step_number': 1, 'description': '달걀 1개는 50~60ml 정도입니다 #부드러운계란찜 만들기 위해 다시마 육수는 200ml 준비했어요 #물비율 은 달걀:육수=1:2 정도 준비하면 부드러운 계란찜 만들기가 됩니다 계란 비린내를 잡아주기 위해 다시마 육수와 맛술을 추가했어요', 'image_url': 'https://recipe1.ezmember.co.kr/cache/recipe/2023/08/25/22f3e7a31daf3dd5c4ea1a63ab3eebad1.jpg'}, {'step_number': 2, 'description': '다시마는 물 200ml를 부어 다시마 우린 물을 만들어줍니다', 'image_url': 'https://recipe1.ezmember.co.kr/cache/recipe/2023/08/25/f134a5ad40766d634c7a02e3d58dccb01.jpg'}, {'step_number': 3, 'description': '계란은 잘 풀어줍니다', 'image_url': 'https://recipe1.ezmember.co.kr/cache/recipe/2023/08/25/2a3d92b8fedb1be45d79ab67fd29a0901.jpg'}, {'step_number': 4, 'description': '맛술1큰술 설탕0.5큰술 꽃소금0.5작은술을 넣어줍니다', 'image_url': 'https://recipe1.ezmember.co.kr/cache/recipe/2023/08/25/1d1cdd1857b7ecdcde41b4b76f726c891.jpg'}, {'step_number': 5, 'description': '다시마 우린 물 200ml (1컵)을 부어준 다음 체에 걸러 알끈을 제거해 줍니다', 'image_url': 'https://recipe1.ezmember.co.kr/cache/recipe/2023/08/25/611ab3e564774de521026d7383b515f31.jpg'}, {'step_number': 6, 'description': '냄비에 물 300ml를 붓고 찜기를 올린 다음 끓어오르면 계란물을 올려줍니다', 'image_url': 'https://recipe1.ezmember.co.kr/cache/recipe/2023/08/25/4c22dbf54d26debabff595e89f8cc66a1.jpg'}, {'step_number': 7, 'description': '인덕션 불에서 끓이다가 계란이 뭉글뭉글해지면 새우를 올려줍니다', 'image_url': 'https://recipe1.ezmember.co.kr/cache/recipe/2023/08/25/f3abec7a2eafbec316c649be9a72ee591.jpg'}, {'step_number': 8, 'description': '젓가락으로 푹 찍어보니 부드럽게 잘 익었네요 베란다에서 참나물 잎을 따다가 장식으로 올려봅니다 이과정은 생략해도 됩니다', 'image_url': 'https://recipe1.ezmember.co.kr/cache/recipe/2023/08/25/6fd7425b7e93db6b49c1e311744ee1b91.jpg'}, {'step_number': 9, 'description': '꺼내서 사진 찍는다고 조금 시간을 끌었더니 부드럽고 부풀어 오른 계란이 오그라들었네요', 'image_url': 'https://recipe1.ezmember.co.kr/cache/recipe/2023/08/25/63afe82cf1908851ca4898b47e5160ea1.jpg'}, {'step_number': 10, 'description': '간단하게 식사 대용으로 먹을 수 있는 푸딩 계란찜 전자레인지로 만들면 더욱 쉽게 만들 수 있지만 일본 계란찜 자왕무시로 다시 한번 제대로 만들어볼까 합니다 맛있게 만들어 드세요', 'image_url': 'https://recipe1.ezmember.co.kr/cache/recipe/2023/08/25/a2c08cdd4f7dde36cd8b803a206d53761.jpg'}]"
8790,밑반찬,일상,달걀/유제품,찜,두부계란찜 이렇게는 첨보시죠?,두부계란찜,377,20분 이내,아무나,4인분,"[('두부 500g', '1모'), ('계란', '2~3개'), ('소금', '적당히'), ('참기름', '1작은술'), ('진간장', '3큰술'), ('매실액', '1큰술'), ('참기름', '1큰술'), ('들기름', '1/2큰술'), ('설탕', '1/2큰술'), ('다진마늘', '1작은술'), ('다진쪽파', ''), ('통깨', '1큰술')]",저번에 계란물을 만들어 두부에 쏙 넣어준 요리가 아이들에게 인기가 정말 좋았어요! 이번에는 계란을 통째로 넣어 맛있는 양념장과 곁들어 먹으니! 요거 또한 인기만점 반찬이였답니다 ^^ 영양가도 높고 건강한 두부계란요리 이렇게 드셔보세요~!,"[{'step_number': 1, 'description': '두부 500g 소금 3~4꼬집 5~10분 밑간 후 물기를 제거해요 네모 모양으로 칼집을 낸 후 속을 파내주세요도마 , 조리용나이프 , 숟가락', 'image_url': 'https://recipe1.ezmember.co.kr/cache/recipe/2023/11/13/d75bd655040e06433113bca87ea6c4251.jpg'}, {'step_number': 2, 'description': '계란 2~3개를 넣고 (소금 2~3꼬집, 참기름 1작은술) 찜기에 올려 센불에서 중불 10분간 쪄주세요냄비 , 찜기', 'image_url': 'https://recipe1.ezmember.co.kr/cache/recipe/2023/11/13/5fc546169b9509e7d962a3d069a111671.jpg'}, {'step_number': 3, 'description': '총총 썬 쪽파와 다진마늘 1작은술 넣고 분량의 양념장을 모두 섞어주세요(진간장 3큰술, 매실액 1큰술 참기름 1큰술, 들기름 1/2큰술 설탕 1/2큰술, 통깨 1큰술)볼취향에 따라 다진 청양고추, 고춧가루를 1/2큰술 정도 추가해주세요', 'image_url': 'https://recipe1.ezmember.co.kr/cache/recipe/2023/11/13/9daa5505b57665e71f931f67ea55eaf01.jpg'}, {'step_number': 4, 'description': '찜기에서 쪄낸 두부와 계란 위에 양념장을 뿌려서 드시면 완성입니다~!', 'image_url': 'https://recipe1.ezmember.co.kr/cache/recipe/2023/11/13/c12a8afa538a6894887b431716c3023a1.jpg'}]"
8791,밑반찬,일상,달걀/유제품,찜,고깃집 계란찜을 집에서 실패없이 만드는 뚝배기계란찜 만드는 방법,계란찜,"1,756",5분 이내,아무나,2인분,"[('계란', '4개'), ('참기름', '1스푼'), ('참치액', '1스푼'), ('물', '1/2컵'), ('설탕', '1/3스푼')]",포슬포슬 부드러운 계란찜에 꼭 참치액을 넣어서 감칠맛이 있는 맛있는 계란찜을 만들어보세요,"[{'step_number': 1, 'description': '1. 계란찜이 타지 않도록 뚝배기에 참기름이나 식용유를 한번 발라주세요.', 'image_url': None}, {'step_number': 2, 'description': '2. 계란을 넣고 참치액,물 반컵,설탕3/1스푼 넣고 계란물을 만들어주세요.', 'image_url': None}, {'step_number': 3, 'description': '3. 중강불로 계란이 몽글몽글 덩어리가 생겨 80%정도 익을떄까지 잘 저어주세요.', 'image_url': None}, {'step_number': 4, 'description': '4. 참기름,대파 넣고 뚜껑이나 , 다른 그릇을 덮어주고, 약불로 2분정도 끓여주다가 뚜껑이 들썩거리면 불그고 30분정도 뜸들여주면 끝!', 'image_url': None}]"
8792,밑반찬,일상,달걀/유제품,찜,"달걀찜 만들기, 라면속 건더기스프 활용 달걀찜 만드는법",달걀찜,243,30분 이내,초급,4인분,"[('달걀', '5개'), ('라면 건더기스프', '4~5봉지'), ('물', '1컵'), ('참치액젓', '1큰술'), ('맛술', '1큰술'), ('물', '2대접')]",라면 건더기 수프 활용해서 달걀찜 만들기,"[{'step_number': 1, 'description': '라면 건더기 수프 활용한 달걀찜 만들기 건더기 수프 모아서 물 조금 넣고 불려서 준비볼', 'image_url': 'https://recipe1.ezmember.co.kr/cache/recipe/2024/02/12/72b12541cf81494201cb74ccd8b7e95b1.jpg'}, {'step_number': 2, 'description': '달걀 풀고 맛술과 참치액젓 넣고 불려둔 건더기 수프 넣고 절 섞어주기', 'image_url': 'https://recipe1.ezmember.co.kr/cache/recipe/2024/02/12/1af92c5dc1b7c2306e082ae07ccff5831.jpg'}, {'step_number': 3, 'description': '냄비에 물 두대접 넣고 끓여 중탕물 준비하고 만든 달걀찜 넣고 중불에서 5분 끓이기냄비', 'image_url': 'https://recipe1.ezmember.co.kr/cache/recipe/2024/02/12/7b4c77a91062bcab43e553dba3d6dc161.jpg'}, {'step_number': 4, 'description': '수저로 달걀찜 두세번 저어주고 다시 뚜껑 덮어서 중불에서 5분 끓이고 약불에서 10~15분 정도 끓이기', 'image_url': 'https://recipe1.ezmember.co.kr/cache/recipe/2024/02/12/4c241c3de728bb9b662aca83a6028b181.jpg'}, {'step_number': 5, 'description': '중탕으로 달걀찜 완성', 'image_url': 'https://recipe1.ezmember.co.kr/cache/recipe/2024/02/12/eeb46741cbc0b060c7b86921c3ffa7ba1.jpg'}, {'step_number': 6, 'description': '라면 건더기 수프 활용해서 달걀찜 만들어봤습니다', 'image_url': 'https://recipe1.ezmember.co.kr/cache/recipe/2024/02/12/512373dce003d45c93ad111ae6ee91d31.jpg'}]"
8793,밑반찬,일상,달걀/유제품,찜,계란찜 가족들에게 인기폭발 푸딩계란찜 정말 맛있어요,계란찜,299,10분 이내,아무나,4인분,"[('계란', '6~8개'), ('당근', '6장'), ('애호박', '6장'), ('소금', '1/2작은술'), ('계란', '6~8개'), ('소금', '1/2작은술'), ('설탕', '1/2작은술'), ('참기름', '1작은술'), ('참치액', '1/2큰술')]","며칠전 댓글에 급식용 계란찜 만드실때, 참기름 넉넉히 발라도 잘 안떨어진다는 댓글을 주셔서..잘 떨어지는 방법이 없을까? 고민하다가 바닥에 야채를 통째로 깔아봤어요~ 계란물만 부어서 하는것보다 휠씬 더 잘 떨어지네요 ^^ 모양도 예쁘고~! 맛도 정말 좋습니다 예쁜 모양에 온가족에게 인기도 최고였던 야채푸딩계란찜 어떠세요!?","[{'step_number': 1, 'description': '애호박, 당근 길게 슬라이스 해주세요도마 , 조리용나이프 , 주방필러애호박 손질법', 'image_url': 'https://recipe1.ezmember.co.kr/cache/recipe/2024/05/01/edef0f22b480b9bd6d838c6125c319ae1.jpg'}, {'step_number': 2, 'description': '슬라이스한 애호박, 당근 소금 1/2작은술 넣어 조물조물 절여요볼', 'image_url': 'https://recipe1.ezmember.co.kr/cache/recipe/2024/05/01/64289004f7978562caf802d01865a02a1.jpg'}, {'step_number': 3, 'description': '계란 6~8개, 소금 1/2t, 설탕 1/2t, 참기름 1t, 참치액 1/2T 넣어 골고루 섞어요 추가로 다시마우린 물 200ml 넣어 한번 더 섞어줍니다 (물 200ml + 다시마 1조각 넣어 미리 우려주세요)요리젓가락 , 채망약간의 설탕을 넣으면 식감이 휠씬 부드럽고 맛있어요, 체반에 한번 걸려내 주면 식감이 부드럽고 모양이 예뻐져요~!', 'image_url': 'https://recipe1.ezmember.co.kr/cache/recipe/2024/05/01/1f19fecaacb239a20bf2759c87fa90a81.jpg'}, {'step_number': 4, 'description': '내열용기에 물기 짠 애호박, 당근을 겹쳐서 차례대로 깔아주고 계란물을 부어주세요내열용기내열용기에 참기름을 골고루 발라주세요', 'image_url': 'https://recipe1.ezmember.co.kr/cache/recipe/2024/05/01/55dbcf5eba7f9cb5888deee48a4a55961.jpg'}, {'step_number': 5, 'description': '찜기물이 끓기 시작하면 랩이나 호일을 씌운 뒤(계란찜에 물 떨어짐 방지) 중불 20분 익혀요냄비 , 찜기', 'image_url': 'https://recipe1.ezmember.co.kr/cache/recipe/2024/05/01/daeda19a8fb02db9b68db86b9bc27ab51.jpg'}, {'step_number': 6, 'description': '한김 식힌 후 먹기 좋게 잘라주면 완성입니다', 'image_url': 'https://recipe1.ezmember.co.kr/cache/recipe/2024/05/01/f3a617540d2dbd012ff013583e07ae381.jpg'}]"
8794,밑반찬,일상,달걀/유제품,찜,야채계란찜 만들기,야채계란찜,"12,479",15분 이내,아무나,2인분,"[('다진채소', ''), ('계란', '2개'), ('새우젓', '소량'), ('육수(물)', '')]",비리지 않고 부드러운 초간단계란찜만들기 입니다.,"[{'step_number': 1, 'description': '계란을 잘 풀어주세요', 'image_url': 'https://recipe1.ezmember.co.kr/cache/recipe/2016/02/11/4882a45b85575c430423c0e371c27d5b1.jpg'}, {'step_number': 2, 'description': '부드러운 계란찜을 만들기 위해 체에 한번 내려주세요', 'image_url': 'https://recipe1.ezmember.co.kr/cache/recipe/2016/02/11/46d9a09dbca4661bd16b60f362b201851.jpg'}, {'step_number': 3, 'description': '다진 채소와 잘 섞어주세요 육수도 한컵 부어주세요 육수는 다시마육수로했어요 없으면 생수로!! 다진채소는 파프리카, 브로콜리, 양파, 당근 입니다.', 'image_url': 'https://recipe1.ezmember.co.kr/cache/recipe/2016/02/11/34e38daff0afe412f1b3f94a941d76811.jpg'}, {'step_number': 4, 'description': '달걀 비린내를 잡기 위해 청주 반큰술을 넣어주세요 간은 새우젓으로해야 맛있습니다. 새우젓 반큰술을 잘 다져서 넣어주세요 (티스푼기준)', 'image_url': 'https://recipe1.ezmember.co.kr/cache/recipe/2016/02/11/b6d95184596a381de83ac4f44e4812661.jpg'}, {'step_number': 5, 'description': '뚜껑을 덮고 해줘야 계란 윗면이 매끈하게 나와요 찜기가 없을 경우 랩으로 감싼후 전자렌지에 넣고 돌려주시면 됩니다.전자레인지', 'image_url': 'https://recipe1.ezmember.co.kr/cache/recipe/2016/02/11/fa0e18ef756ffcb941a7d6483ba0cc971.jpg'}]"
