index,종류별,상황별,재료별,방법별,글 제목,레시피이름,조회수,조리시간,난이도,인분,재료,소개글,조리순서
27933,메인반찬,일상,해물류,부침,비오는 날~~ 부침개~ 간단한 해물부침개~ 파래관자부침개 맛있게 만드는 방법,해물부침개,"7,070",15분 이내,아무나,5인분,"[('부침가루', '1컵'), ('관자                                                                                중간싸이즈', '7개'), ('파래', '2뭉치'), ('붉은고추', '2개'), ('계란', '2알'), ('물', '적당량'), ('양조 간장', '2큰술'), ('다진파', '1.5큰술'), ('다진마늘', '1큰술'), ('볶음깨', '1큰술'), ('참기름', '1큰술')]","비오는 날 부침개~~ 누가 뭐라고해도 NO.1
칼슘과 식물성 섬유소가 가득한 바다 영양 파래와 세포재생과 피로회복에 좋은 관자는 단백질 만땅에 지방이 적어 다이어트에도 ​좋아요~~
요 완소 식재료를 이용해서 만든 ​파래관자부침개~~맛난 파래전에 관자와 붉은 고추를 넣어 영양과 칼칼한 맛을 더 했어요~~ 양념이 듬뿍 들어간 간장을 만들어 찍어 먹으면 더욱 맛있는 파래관자부침개~~","[{'step_number': 1, 'description': '파래는 비벼가며 씻은 후 물에 헹궈 물기를 꼭 짜서 준비해요', 'image_url': 'https://recipe1.ezmember.co.kr/cache/recipe/2015/11/14/33fa3cfe7c97d186d25d4285bf967b121.jpg'}, {'step_number': 2, 'description': '부침가루를 준비했어요', 'image_url': 'https://recipe1.ezmember.co.kr/cache/recipe/2015/11/14/f660f53052387384ad7dcd99ede6d13c1.jpg'}, {'step_number': 3, 'description': '물을 적당량 넣어 반죽을 만들어 주었어요', 'image_url': 'https://recipe1.ezmember.co.kr/cache/recipe/2015/11/14/e8db054e8578c5533a8d0c0a3bed75a01.jpg'}, {'step_number': 4, 'description': '달걀을 넣었어요', 'image_url': 'https://recipe1.ezmember.co.kr/cache/recipe/2015/11/14/c4c42d049cdbc9cfe5570d9025fae6dc1.jpg'}, {'step_number': 5, 'description': '달걀을 풀어 반죽을 완성합니다.', 'image_url': 'https://recipe1.ezmember.co.kr/cache/recipe/2015/11/14/578c04915296fcaff9e44d96f200dc2f1.jpg'}, {'step_number': 6, 'description': '준비해 둔 파래를 반죽에 넣고 붉은 고추도 잘게 썰어 넣었어요', 'image_url': 'https://recipe1.ezmember.co.kr/cache/recipe/2015/11/14/806fce8c972bd575822692e5f80ea9031.jpg'}, {'step_number': 7, 'description': '깨끗하게 흐르는 물에 여러번 씻어서 \n잘게 자른 관자도 반죽에 넣었어요', 'image_url': 'https://recipe1.ezmember.co.kr/cache/recipe/2015/11/14/9ac2d9ba515b99fa445a34886fceda921.jpg'}, {'step_number': 8, 'description': '열이 오른 팬에 기름을 두르고 관자가 들어간 파래 반죽을 올렸어요', 'image_url': 'https://recipe1.ezmember.co.kr/cache/recipe/2015/11/14/1e6e65952e5b8a2f748312c0e87b81ff1.jpg'}, {'step_number': 9, 'description': '앞 뒤로 노릇노릇하게 부쳐주면 \n맛있고 영양 가득한 파래 관자 부침개를 \n맛볼 수 있어요', 'image_url': 'https://recipe1.ezmember.co.kr/cache/recipe/2015/11/14/35e430dd27652fc147246035b6279ce61.jpg'}]"
27934,메인반찬,일상,해물류,부침,바다 향 가득 겨울의 별미 메밀 파래전,메밀파래전,"3,724",30분 이내,초급,4인분,"[('메밀가루', '1컵'), ('파래', '2덩어리'), ('달걀', '1개'), ('청양고추', '1개'), ('붉은고추', '1개'), ('식물성 기름', '약간'), ('간장', '2큰술'), ('매실청', '1큰술'), ('레몬즙', '1작은술')]","파래에는 칼슘과 철 그리고 인 등의 
무기질이 풍부해서 
뼈와 치아 건강에 도움이 되요 
비타민도 풍부하고 
식이섬유가 많아서 배변활동에도 좋아요

이렇게 몸에 좋은 파래 전 부쳐 먹으면 겨울철 별미로 제격입니다.","[{'step_number': 1, 'description': '깨끗하게 씻어서 물기를 빼 두어요', 'image_url': 'https://recipe1.ezmember.co.kr/cache/recipe/2016/01/15/0039815268047dfd8b13d390613f3a971.jpg'}, {'step_number': 2, 'description': '메밀가루와 계란에 물을 넣어 농도를 맞추어요', 'image_url': 'https://recipe1.ezmember.co.kr/cache/recipe/2016/01/15/c54db15be2f8f6b0be3ae2044349c65e1.jpg'}, {'step_number': 3, 'description': '잘 섞어서 반죽해 주고', 'image_url': 'https://recipe1.ezmember.co.kr/cache/recipe/2016/01/15/0771b00d26a5ef5755bed62c23878da51.jpg'}, {'step_number': 4, 'description': '팬에 기름 둘러 반죽을 올려요\n작게 한 수저씩 떠서 구우면 \n더 예쁘겠지만 이오는 바빠서\n넓게 한 판씩~~ㅋ', 'image_url': 'https://recipe1.ezmember.co.kr/cache/recipe/2016/01/15/c677c1734afed50d06908234b28d03c61.jpg'}, {'step_number': 5, 'description': '바삭하게 구워주면 맛있어요', 'image_url': 'https://recipe1.ezmember.co.kr/cache/recipe/2016/01/15/00d50274b33709535654a4f92f9258661.jpg'}, {'step_number': 6, 'description': '매운 고추 못 먹는 막내용 \n메밀전 한 판 붙이고 난 다음에\n청양고추와 붉은고추를 \n반죽에 섞고', 'image_url': 'https://recipe1.ezmember.co.kr/cache/recipe/2016/01/15/c7b2c71f65004db8e6c9a31a0ddaea3c1.jpg'}, {'step_number': 7, 'description': '역시 열 오른 팬에서 부쳐주면 \n색도 더 예뻐요', 'image_url': 'https://recipe1.ezmember.co.kr/cache/recipe/2016/01/15/0099673a1c748c06e7e249e9b9edaa3c1.jpg'}]"
27935,메인반찬,일상,해물류,부침,오징어 야채전 온 가족이 좋아하는 반찬 만들기~,None,"4,363",None,None,None,"[('오징어', '2마리'), ('당근', ''), ('양파', ''), ('애호박', ''), ('계란', ''), ('부침가루', ''), ('소금', ''), ('후추', '')]",,[]
27936,메인반찬,일상,해물류,부침,쫀득한 꼬막살이 입안가득 퍼지는 '꼬막전',꼬막전,"1,907",15분 이내,아무나,2인분,"[('꼬막살', '200g'), ('홍고추', '1개'), ('청고추', '1개'), ('호박', '50g'), ('달걀', '1개'), ('부침가루', '5큰술'), ('물', '4큰술'), ('식용유', '조금')]","제철꼬막은 먹을수있는 시기가 짧아 기간동안 자주 먹게되는 식재료 중 하나죠.
꼬막은 전으로도 자주 먹는데 쫀득한 살과 매콤한 고추를 넣어서 부치면
끝도 없이 들어가요~","[{'step_number': 1, 'description': '고추는 반으로 잘라 씨를 가르고 0.5cm 다져주세요.', 'image_url': 'https://recipe1.ezmember.co.kr/cache/recipe/2018/12/25/3c81e0d929ee5076d4b316c0b334ee321.jpg'}, {'step_number': 2, 'description': '달큰한 맛을 더해줄 호박은 채를 썰어준비합니다.', 'image_url': 'https://recipe1.ezmember.co.kr/cache/recipe/2018/12/25/ba9f37ecde81416b178e01c007a8b83a1.jpg'}, {'step_number': 3, 'description': '데친꼬막살을 준비하고요.', 'image_url': 'https://recipe1.ezmember.co.kr/cache/recipe/2018/12/25/061dfff4d78fb2634b781139b3808e0e1.jpg'}, {'step_number': 4, 'description': '큰 볼에 재료를 넣고 잘 섞어주세요', 'image_url': 'https://recipe1.ezmember.co.kr/cache/recipe/2018/12/25/45f8ee7a52add222ae7d2ebd52df909d1.jpg'}, {'step_number': 5, 'description': '예열된 팬에 노릇하게 부쳐냅니다.\n지름 8cm 정도로 부쳐주었어요.', 'image_url': 'https://recipe1.ezmember.co.kr/cache/recipe/2018/12/25/07432a3912ed62db1e5b06c2fbf5614c1.jpg'}, {'step_number': 6, 'description': '달래장을 곁들여 먹으니 더 꿀맛~\n달래장은 @6901227  여기 참고하세요!', 'image_url': 'https://recipe1.ezmember.co.kr/cache/recipe/2018/12/25/aeaa1c025ebfaf38f75d7d6cd6270c4d1.jpg'}]"
27937,메인반찬,일상,해물류,부침,꼬막전 고소하고 쫄깃한 꼬막전,꼬막전,"5,780",20분 이내,아무나,2인분,"[('꼬막', '200g'), ('부침가루', '1컵'), ('파프리카(두가지색)', ''), ('미나리', ''), ('자색양파', ''), ('식용유', ''), ('쑥갓', '')]","제철 꼬막으로 만든 꼬막전입니다

누구나 좋아하는 꼬막을 무쳐도 먹고 

꼬막 샐러드 같은 피자도 만들어 먹었어요
냉장고에 있는 야채 어떤 것도 좋아요

전 남아있는 파프리카와 미나리 넣고 꼬막전을 부쳤어요
꼬들꼬들 꼬막과 야채를 다져서 부친 꼬막전

젓가락이 빨라지는 것은 어쩔 수 없지요
꼬막전에 쑥갓 한 개 올렸을 뿐인데 보기도 좋아요

눈으로 먹는맛도 좋지 않나요 ㅎㅎ

​

​","[{'step_number': 1, 'description': '채소는 다지고 꼬막은 손질해 놓았어요꼬막 손질법 레시피', 'image_url': 'https://recipe1.ezmember.co.kr/cache/recipe/2019/01/10/04715fa92ad8ed19bb62fd6454f7a26a1.jpg'}, {'step_number': 2, 'description': '야채 썰은 것과 꼬막을 섞어줍니다~!~', 'image_url': 'https://recipe1.ezmember.co.kr/cache/recipe/2019/01/10/938f79030f04213a4a9082c998814f2b1.jpg'}, {'step_number': 3, 'description': '부침가루와 다져놓은 야채를 섞어주고 꼬막도 넣어주었어요\n반죽 사진이 없네요~!~', 'image_url': 'https://recipe1.ezmember.co.kr/cache/recipe/2019/01/10/1ceb29b8e22357fb98f55aebf613d7bd1.jpg'}, {'step_number': 4, 'description': '팬에 기름을 넉넉히 둘러준 다음 한 스푼씩 떠서 올려줍니다\n쑥갓도 조금씩 잘라서 올려줍니다', 'image_url': 'https://recipe1.ezmember.co.kr/cache/recipe/2019/01/10/7b832fa5858e0e6ebf58e9e4e7d94e481.jpg'}, {'step_number': 5, 'description': '노릇노릇 익어가는 꼬막 전입니다\n부치면서 따끈할 때 먹어야 맛있지요\n부치면서 몇 개나 집어먹었는지요', 'image_url': 'https://recipe1.ezmember.co.kr/cache/recipe/2019/01/10/9945ab0f126641cff36abd1916cdef091.jpg'}, {'step_number': 6, 'description': '아삭한 야채와 꼬막이 어우러진 맛있는 꼬막 전입니다', 'image_url': 'https://recipe1.ezmember.co.kr/cache/recipe/2019/01/10/265989d094e78ef6f5d80b6b7ac92a291.jpg'}, {'step_number': 7, 'description': '간식으로 술안주로 누구나 좋아하는 꼬막 전입니다', 'image_url': 'https://recipe1.ezmember.co.kr/cache/recipe/2019/01/10/68c4d233bb3380ac19b0b331328fa6fd1.jpg'}, {'step_number': 8, 'description': '제철 재료로 만들어 먹어서인지 더 맛있네요\n꼬막이 짭조름해서 양념장이 필요 없네요', 'image_url': 'https://recipe1.ezmember.co.kr/cache/recipe/2019/01/10/17bcbd1000226c6772204d443c75334b1.jpg'}, {'step_number': 9, 'description': '제철 재료로 만들어 먹어서인지 더 맛있네요\n꼬막이 짭조름해서 양념장이 필요 없네요', 'image_url': 'https://recipe1.ezmember.co.kr/cache/recipe/2019/01/10/c5a0e031e6b674110d3ecef32403545f1.jpg'}]"
27938,메인반찬,일상,해물류,부침,부추해물전( 바삭한 해물전은 빵가루로~~),부추해물전,"12,001",30분 이내,초급,4인분,"[('해물믹스', '100g'), ('양파', '1/2개'), ('당근', '1줌'), ('부추', '1줌'), ('계란', '1개'), ('깻잎', '10장'), ('부침가루', '500g'), ('식용유', '넉넉히'), ('소금', '1/2숟가락')]","♡ 해물 전에는 모듬 해물이 딱이더라구요~
 집에 있는 각종 야채를 넣어 맛있는 해물전을 만들어보세요.해물 향이 가득하네요","[{'step_number': 1, 'description': '모듬해물, 당근, 부추, 양파 깻잎, 계란,를 준비해요', 'image_url': 'https://recipe1.ezmember.co.kr/cache/recipe/2019/01/11/c3b9b4ac706bf9c162c4b0eb45c3752d1.jpg'}, {'step_number': 2, 'description': '양파, 당근, 깻잎, 채치고 해물은 작게 썰어요', 'image_url': 'https://recipe1.ezmember.co.kr/cache/recipe/2019/01/11/77f7927b21f276ec9622f15f0128eac71.jpg'}, {'step_number': 3, 'description': '부침가루 500g 물 500g을 넣고 계란 한 개를 넣어요', 'image_url': 'https://recipe1.ezmember.co.kr/cache/recipe/2019/01/11/4faecd49172843822bc0ed258c6760e91.jpg'}, {'step_number': 4, 'description': '풀어 놓은 반죽에 재료를 넣고 잘 저어요\n뻑뻑한 반죽이 좋으면 부침가루를 보충 해요', 'image_url': 'https://recipe1.ezmember.co.kr/cache/recipe/2019/01/11/5bcb388aa48172daceb7f00030351e331.jpg'}, {'step_number': 5, 'description': '달군팬에 식용유를 두르고 반죽을 한 숟가락 얹은 후에\n위에 빵가루를 뿌려요', 'image_url': 'https://recipe1.ezmember.co.kr/cache/recipe/2019/01/11/339ecf2cd4bfc3977b87d8de3ac965901.jpg'}, {'step_number': 6, 'description': '밑면이 70% 정도 익었을때 뒤집어요', 'image_url': 'https://recipe1.ezmember.co.kr/cache/recipe/2019/01/11/d5237a223a4e2d3bf24246932b947c851.jpg'}, {'step_number': 7, 'description': '한번 더 뒤집어요 .양쪽이 모두 노릇하게 구워요', 'image_url': 'https://recipe1.ezmember.co.kr/cache/recipe/2019/01/11/e137dfeb618df454c0170f4b178950491.jpg'}, {'step_number': 8, 'description': '다 됐어요', 'image_url': 'https://recipe1.ezmember.co.kr/cache/recipe/2019/01/11/2a7d2f7ed663d33fb4693e17c4bddfab1.jpg'}]"
27939,메인반찬,일상,해물류,부침,지금 안 먹으면 후회하는 파래전 만드는 법,파래전,"1,645",30분 이내,아무나,2인분,"[('파래', '3컵'), ('밀가루', '2컵'), ('물', '2컵'), ('홍고추', '1개'), ('청양고추', '1개'), ('소금', '약간')]","겨울만 되면 어김없이 찾아오는 파래!
제가 시장에서 식재료 구입하는 것을 좋아해서 시장을 자주 갑니다.
봄, 여름, 가을, 겨울마다 판매하고 있는 식재료가 다른데 겨울 하면 굴, 매생이, 그리고 오늘의 주인공 파래가 있습니다.
""1순위 매생이, 2순위 파래""
개인적으로 파래를 참 좋아하는데 이번 겨울에는 매생이에 밀려 항상 매생이만 구입하고 파래는 뒷전이었습니다.
그래서 이번 겨울에는 매생이를 많이 먹었는데 겨울이 지나가기 전에 파래를 꼭 먹어야겠다 싶어 매생이를 구입하지 않고 파래를 구입했습니다
파래는 매생이와 비슷하게 생겼기 때문에 헷갈리는 경우가 있어 자칫하다 매생이 구입하고 싶었는데 파래를 구입하고 
파래 구입하고 싶었는데 매생이 구입하고 자칫하다 잘못 구입할 수도 있는데 파래와 매생이는 굵기로 구별할 수 있습니다.
파래 옆에 매생이, 매생이 옆에 파래가 있으면 굵은 것이 파래이고 가는 것이 매생이입니다.

구별하기 쉽죠? 구입하기 전에 파래와 매생이 생김새 차이점을 미리 알아가면 헷갈리지 않고 시장 아주머니께 여쭈어보지 않아도 됩니다.
저는 시장에서 구입한 파래로 전을 만들어 먹었습니다.
파래전 만드는 법이 정말 진짜 대박 쉬운데 금방 끝나니 집중해서 보면 됩니다.","[{'step_number': 1, 'description': '청양고추와 홍고추는 반으로 가르고 씨를 제거하고 얇게 썬다.', 'image_url': 'https://recipe1.ezmember.co.kr/cache/recipe/2019/02/06/2d3e695df5f0b2d5fb20eda84d8ce7bb1.jpg'}, {'step_number': 2, 'description': '파래는 흐르는 물에 살살 흔들면서 불순물을 제거하고 손으로 물기를 짠다.', 'image_url': 'https://recipe1.ezmember.co.kr/cache/recipe/2019/02/06/d5c281e2f4991247a225d361f65fd10f1.jpg'}, {'step_number': 3, 'description': '깨끗하게 손질한 파래는 1cm 간격으로 썬다.', 'image_url': 'https://recipe1.ezmember.co.kr/cache/recipe/2019/02/06/3ebb7da15e133b3aa30599af9028f69f1.jpg'}, {'step_number': 4, 'description': '볼에 파래, 밀가루 2컵, 물 2컵, 소금 약간을 넣어 반죽을 만든다.파래의 물기를 완벽하게 제거하지 않았을 상황을 대비해서 물은 한 번에 넣지 말고 조금씩 넣으면서 농도를 맞추는데 농도는 걸쭉한 것보다는 약간 흐르는 것이 좋습니다.', 'image_url': 'https://recipe1.ezmember.co.kr/cache/recipe/2019/02/06/b4e18c9b1b1b48570c1848c1200e8fb51.jpg'}, {'step_number': 5, 'description': '팬에 기름을 두르고 반죽을 얇게 펴고 그 위에 청양고추와 홍고추를 뿌려 앞뒤 노릇노릇하게 익히면 파래전 완성.', 'image_url': 'https://recipe1.ezmember.co.kr/cache/recipe/2019/02/06/ed801533ab861d7fb4ea0c8b3103060b1.jpg'}]"
27940,메인반찬,일상,해물류,부침,굴 치즈 전,굴치즈전,"1,018",15분 이내,초급,3인분,"[('굴', '1컵'), ('튀김가루', '1큰술'), ('계란', '2개'), ('쪽파', '4개'), ('식용유', '넉넉히'), ('모짜렐라치즈', '100g'), ('파슬리가루', '약간'), ('참치액', '1/3작은술')]",계절상 생굴 먹기에는 아직은 꺼림직해서 익혀 먹은 요리를 택했습니다.치즈를 올려서 고소하면서 굴 향이 입안 가득 입니다.,"[{'step_number': 1, 'description': '굴은 체반에 받쳐 물기를 빼 준후 튀김가루를 묻혀주세요.', 'image_url': 'https://recipe1.ezmember.co.kr/cache/recipe/2018/10/31/c3c174734b10d1d810a25b7a6e89a0c71.jpg'}, {'step_number': 2, 'description': '쪽파는 적당한 크기로 썰어주세요', 'image_url': 'https://recipe1.ezmember.co.kr/cache/recipe/2018/10/31/b39fda37f8cff7e0c705b2728afd64251.jpg'}, {'step_number': 3, 'description': '계란은 참치액을 넣고 곱게 풀어주세요', 'image_url': 'https://recipe1.ezmember.co.kr/cache/recipe/2018/10/31/65cd40d2d4714b9e4f3de7f96a3b11e81.jpg'}, {'step_number': 4, 'description': '계란물에 쪽파와 튀김가루을 묻힌 굴을 넣고 버무려 주세요', 'image_url': 'https://recipe1.ezmember.co.kr/cache/recipe/2018/10/31/0bb40200e14d082f88129183fa3e0f2a1.jpg'}, {'step_number': 5, 'description': '팬에 식용유를 두르고 뜨거워 지면 4번을 붓고 고루 펴 주세요.(중약불)', 'image_url': 'https://recipe1.ezmember.co.kr/cache/recipe/2018/10/31/df6241f0cc22c1ffd1b9ba3605c557251.jpg'}, {'step_number': 6, 'description': '노릇하게 익으면 뒤집어 익혀주세요\n다시 뒤집어 주고 (약불)', 'image_url': 'https://recipe1.ezmember.co.kr/cache/recipe/2018/10/31/1e265ad8d8ed96e4d5da02fbb8b489b21.jpg'}, {'step_number': 7, 'description': '그위에 모짜렐라 치즈를 뿌리고 뚜껑을 덮고 치즈를 녹여 주세요.파슬리 가루도 뿌려 주세요.(약불)', 'image_url': 'https://recipe1.ezmember.co.kr/cache/recipe/2018/10/31/015004b5bf1524abc569dd81a36b0d251.jpg'}, {'step_number': 8, 'description': '완성그릇에 담아주세요.', 'image_url': 'https://recipe1.ezmember.co.kr/cache/recipe/2018/10/31/9100cb675834291042564292720a4e411.jpg'}]"
27941,메인반찬,일상,해물류,부침,광어 계란만두,계란만두,254,60분 이내,초급,4인분,"[('광어', '150g'), ('계란', '4개'), ('당면', '30g'), ('양파', '40g'), ('부추', '30g'), ('대파', '20g'), ('생수', '50ml'), ('마늘', '1톨'), ('소금', '1/2t'), ('후추', '2꼬집'), ('맛술', '1t'), ('참기름', '1/2t'), ('포도씨유', '1t')]",간편하게 만드는 계란만두에 영양 가득한 광어를 넣어서 만든 맛있는 요리입니다.,"[{'step_number': 1, 'description': '광어를 잘게 썰어서 준비합니다.', 'image_url': 'https://recipe1.ezmember.co.kr/cache/recipe/2021/10/04/3e78712447cfa6eef8d8bb66acc83d681.jpg'}, {'step_number': 2, 'description': '양파와 대파를 포도씨유로 볶아서 접시에 따로 담아 놓고, 밑간한 광어에 생수 50ml와 맛술 1t와 소금과 후추를 한꼬집씩 넣어서 익힙니다.', 'image_url': 'https://recipe1.ezmember.co.kr/cache/recipe/2021/10/04/1b31d001c7603a7f7e78e52f89a7c7c51.jpg'}, {'step_number': 3, 'description': '큰 볼에 기름에 볶은 대파와 양파 그리고 물에 익힌 광어살을 담고, 당면.마늘.소금.후추.참기름을 넣고 버무려서 계란으로 농도를 맞춰가면서 반죽합니다. \n(계란은 크기에 따라 가감해서 넣으세요.)', 'image_url': 'https://recipe1.ezmember.co.kr/cache/recipe/2021/10/04/1490282e28b54c6f0739331b3f45a3d81.jpg'}, {'step_number': 4, 'description': '큼지막하게 한수저씩 달구어진 팬에 욜려서 바닥이 익으면 반으로 접어서 앞뒤로 익혀주면 완성입니다.', 'image_url': 'https://recipe1.ezmember.co.kr/cache/recipe/2021/10/04/89fea352e07e68d684f3d5f0a1cd13d31.jpg'}, {'step_number': 5, 'description': '영양 가득한 광어계란만두는 케첩과 함께 아이들 반찬으로 주면 아주 좋습니다.', 'image_url': 'https://recipe1.ezmember.co.kr/cache/recipe/2021/10/04/191a8a16a673f374f2c5a79bcab27c2c1.jpg'}, {'step_number': 6, 'description': '간식으로 즐겨도 아주 좋을 것 같고, 간단하게 만드는 아빠 술안주로도 좋을듯 합니다.', 'image_url': 'https://recipe1.ezmember.co.kr/cache/recipe/2021/10/04/9f1315140094e1f09788f93351a5f4a21.jpg'}, {'step_number': 7, 'description': '조리하기가 아주 쉽고 맛도 아주 부드럽고 맛있습니다.', 'image_url': 'https://recipe1.ezmember.co.kr/cache/recipe/2021/10/04/60eca9c9946125291da27028eec75ed31.jpg'}]"
27942,메인반찬,일상,해물류,부침,몸에 좋은 해물로 메밀전 만드는법ㅣ금체질요리(태양인),메밀전,"2,120",30분 이내,초급,1인분,"[('100% 메밀가루', '1컵'), ('쪽파', '10뿌리'), ('모듬해물', '1공기'), ('멸치액젓', '1숟가락'), ('식용유', '')]","영양 풍부한 메밀해물전을 준비했어요.
100% 메밀가루로 만들어 보았어요.
밀가루 대신 메밀이 들어간 전 드시고 환절기 건강 조심하세요~","[{'step_number': 1, 'description': '메밀가루는 한 컵 정도 준비해주세요.', 'image_url': 'https://recipe1.ezmember.co.kr/cache/recipe/2021/02/24/48e1a3b6f548e369be3d274d9d001db01.jpg'}, {'step_number': 2, 'description': '메밀가루와 물의 비율은 1:1이에요.메밀반죽은 2~3시간 정도 숙성시켜주시면 더 부드러워요!', 'image_url': 'https://recipe1.ezmember.co.kr/cache/recipe/2021/02/24/2c344343eb224258f0b46ac38591f3cf1.jpg'}, {'step_number': 3, 'description': '쪽파를 잘 익게하기 위해서, 흰 부분은 칼 손잡이 뒤로 살살 찧어주세요.', 'image_url': 'https://recipe1.ezmember.co.kr/cache/recipe/2021/02/24/933c5def29e28233f37a3f50633957981.jpg'}, {'step_number': 4, 'description': '파 길이를 4cm 정도 길이로 잘라주세요.', 'image_url': 'https://recipe1.ezmember.co.kr/cache/recipe/2021/02/24/dd4aafe717b5344389b82801f33919831.jpg'}, {'step_number': 5, 'description': '모듬해물은 오징어, 조개, 홍합살을 준비했어요.', 'image_url': 'https://recipe1.ezmember.co.kr/cache/recipe/2021/02/24/ba473483df0c3df28b06e5c24117c2741.jpg'}, {'step_number': 6, 'description': '오징어만 잘게 썰어주었어요.', 'image_url': 'https://recipe1.ezmember.co.kr/cache/recipe/2021/02/24/99f6b4325200858ec113bcbb2a0b978c1.jpg'}, {'step_number': 7, 'description': '메밀반죽에 쪽파와 모듬해물을 넣어서 섞어주세요.', 'image_url': 'https://recipe1.ezmember.co.kr/cache/recipe/2021/02/24/3cb28c21bcf21918d452e503c1902b791.jpg'}, {'step_number': 8, 'description': '간을 주기 위해서 액젓 한 숟가락을 넣어주었어요.', 'image_url': 'https://recipe1.ezmember.co.kr/cache/recipe/2021/02/24/8885d73811c8b6822b418bebf3866b631.jpg'}, {'step_number': 9, 'description': '달궈진 팬에 식용유 두르고 불은 중불로 해주세요.중불', 'image_url': 'https://recipe1.ezmember.co.kr/cache/recipe/2021/02/24/5b8eda6fb9d843fe9ddec47942e76bc71.jpg'}, {'step_number': 10, 'description': '반죽을 팬에 두르시고 부쳐주세요.', 'image_url': 'https://recipe1.ezmember.co.kr/cache/recipe/2021/02/24/4c042d50938327bf93d10abe987040bd1.jpg'}, {'step_number': 11, 'description': '한 면이 익은 것 같을 때 뒤집어서 익혀주었어요.\n다 익으면 다시 뒤집어 주었어요.', 'image_url': 'https://recipe1.ezmember.co.kr/cache/recipe/2021/02/24/352d345b3c23285776de64efc4502bab1.jpg'}, {'step_number': 12, 'description': '메밀해물전 완성!\n메밀은 찬 성질이라 금체질인 분들에게는 정말 좋아요.', 'image_url': 'https://recipe1.ezmember.co.kr/cache/recipe/2021/02/24/57599e212eab08f79681bba3369247f51.jpg'}]"
