index,종류별,상황별,재료별,방법별,글 제목,레시피이름,조회수,조리시간,난이도,인분,재료,소개글,조리순서
59998,면/만두,일상,소고기,끓이기,따끈하고 얼큰한 육칼국수,육칼국수,"4,696",120분 이내,중급,4인분,"[('소고기국거리                                                                                한우', '400g'), ('칼국수', '4인분'), ('고사리', '400g'), ('대파잎', '15잎'), ('물', '2L'), ('양파', '1개'), ('무우(대)', '1/5개'), ('고추씨', '1/2컵'), ('고운고춧가루', '4큰술'), ('간장', '3큰술'), ('참치액', '3큰술'), ('집간장', '3큰술'), ('다진마늘', '1큰술'), ('고추기름', '2큰술')]","우리 막내가 병원에 입원 한지 6개월만에 1박2일 허락 받아 집으로 외박 나왔어요.(생각하면 넘~맘 아파요. 그동안 레시피 올리는것도 짬짬이 병실에서 하고 있답니다.)
특별한것 해주고 싶어서 육칼국수를 해봤답니다.
다행히 맛있게 먹어주네요.
아들 고마워, 엄마 곁에 있어줘서^^
그리고, 사랑해♡~","[{'step_number': 1, 'description': '(육수내기)\n물2리터에 소고기는 핏물을 물에 씻어 내서 넣고,고추씨1/2컵,대파잎5잎,무우 1/5개,양파 껍질째 4등분해서 넣고 끓입니다.(1시간정도 )', 'image_url': 'https://recipe1.ezmember.co.kr/cache/recipe/2016/12/04/d2328f819a8cfc6b9826a16f181b32b11.jpg'}, {'step_number': 2, 'description': '대파10 잎은 깨끗히 씻어 3~4cm 잘라놓고,', 'image_url': 'https://recipe1.ezmember.co.kr/cache/recipe/2016/12/04/6c22fe62010248787a1c0c4e8cda4a7e1.jpg'}, {'step_number': 3, 'description': '삶은 고사리도 3~4cm로 썰어 놓습니다.', 'image_url': 'https://recipe1.ezmember.co.kr/cache/recipe/2016/12/04/241eb5cbb624881bcef964bb1a2e8e021.jpg'}, {'step_number': 4, 'description': '육수가 1시간 정도 끓였으면 소고기는 따로 건져내서 손으로 찢어 주거나 가늘게 채썰어 주고,육수만 체로 걸려 놓습니다.', 'image_url': 'https://recipe1.ezmember.co.kr/cache/recipe/2016/12/04/b379a2333d82447dd1c5bfd28234b0441.jpg'}, {'step_number': 5, 'description': '대파와 고사리, 썰은 소고기에 고운고추가루 4큰술,간장3큰술,참치액3큰술,집간장3큰술,다진마늘1큰술,고추기름2큰술을 넣고 버무려놓습니다.', 'image_url': 'https://recipe1.ezmember.co.kr/cache/recipe/2016/12/04/ffd095f4dde68b1210275feca2fb506b1.jpg'}, {'step_number': 6, 'description': '걸려낸 육수(1.5리터정도)는 남비에 넣고 끓입니다.', 'image_url': 'https://recipe1.ezmember.co.kr/cache/recipe/2016/12/04/29ffc7293ae22faf736a776a7caf62151.jpg'}, {'step_number': 7, 'description': '육수가 끓으면 5번을 넣고 끓입니다.', 'image_url': 'https://recipe1.ezmember.co.kr/cache/recipe/2016/12/04/4d081615c996e08668b2f90192efe28c1.jpg'}, {'step_number': 8, 'description': '강불 에서 20분 정도 끓이다가 중불에서 30~40분 은근히 끓여 줍니다.', 'image_url': 'https://recipe1.ezmember.co.kr/cache/recipe/2016/12/04/11ced786a7263990f86f04bd37d31a901.jpg'}, {'step_number': 9, 'description': '육계장이 거의 다 되어 갈때쯤, 다른 남비에 물을 넣고 끓으면, 칼국수에 묻어 있는 가루를 털어내고 끓여서 익혀줍니다.', 'image_url': 'https://recipe1.ezmember.co.kr/cache/recipe/2016/12/04/4a564811bfd7100ce012f2b7c64241041.jpg'}, {'step_number': 10, 'description': '체반에 건져 물기를 빼서 그릇에 담아놓습니다.', 'image_url': 'https://recipe1.ezmember.co.kr/cache/recipe/2016/12/04/396d42f7eafdd8db8a9c4b3d87407d6a1.jpg'}, {'step_number': 11, 'description': '칼국수위에 완성된 육계장을 넉넉히 부어 줍니다.대파도 한쪽 썰어 얹졌습니다.', 'image_url': 'https://recipe1.ezmember.co.kr/cache/recipe/2016/12/04/8050c6a0f7d5f7f9486c53271f46427e1.jpg'}]"
59999,면/만두,일상,소고기,끓이기,쇠고기 야채 칼국수,쇠고기야채칼국수,"5,258",15분 이내,초급,2인분,"[('당근', ''), ('양파', ''), ('호박', ''), ('감자', ''), ('소고기샤브샤브', ''), ('대파', ''), ('칼국수면', ''), ('간장', ''), ('후추', '약간'), ('소금', '약간')]",뜨근한 국물 요리~ 담백한 쇠고기 야채 칼국수입니다.,"[{'step_number': 1, 'description': '당근, 양파, 호박, 감자는 채를 썰어 준비를 합니다.', 'image_url': 'https://recipe1.ezmember.co.kr/cache/recipe/2015/09/30/7b4ee63bf7b2191f4a8399ebbe3d555a1.jpg'}, {'step_number': 2, 'description': '샤브 샤브용 쇠고기는 냄비에 참기름을 약간 두르고 볶다가 \n적당량의 물을 붓고 야채를 함께 넣고 익혀 줍니다. 간장과 후추를 넣고 간을 맞춥니다. 모자란 간은 소금으로 맞춰주세요.', 'image_url': 'https://recipe1.ezmember.co.kr/cache/recipe/2015/09/30/25ee358835c3bde32146258212c7560f1.jpg'}, {'step_number': 3, 'description': '채소와 쇠고기가 익으면 칼국수 면을 넣고 끓입니다. 대파를 넣고 불에서 내립니다.', 'image_url': 'https://recipe1.ezmember.co.kr/cache/recipe/2015/09/30/4a835db885900cc2c25b73fe2b7327d71.jpg'}]"
60000,면/만두,일상,소고기,끓이기,소고기양지쌀국수 (집에서 육수부터 내손으로 모두 만들기),소고기양지쌀국수,"1,838",2시간 이상,중급,6인분 이상,"[('소고기 양지', '300g'), ('소고기 잡뼈', '200g'), ('팔각', '7개'), ('정향', '2T'), ('코리앤더씨드', '1T'), ('시나몬 스틱', '2개'), ('생강', '2개'), ('대파', '2대'), ('양파', '1/2개'), ('설탕', '50ml'), ('소금', '100ml'), ('미원', '100ml'), ('피쉬소스', '400ml'), ('고수', '3뿌리'), ('쌀국수면', '3인분'), ('쪽파', '10대'), ('숙주', '30g'), ('고수', '20g'), ('양파', '1/2개'), ('삶은 소고기 양지', '30g'), ('육수', '1.5L'), ('고수', '1줌')]","가끔 육수를 미리 대용량 만들어 소분냉동했다가 다양한 요리를 해 먹는 데 이날은 소고기잡뼈와 양지를 이용해 소고기육수를 낸겸 쌀국수를 만들어었습니다
진하고 시원한 맛에 정말 좋습니다","[{'step_number': 1, 'description': '양지 300g과 잡뼈 200g은 여러번 찬물에 담궜다가 헹궈 핏물과 불순물을 제거하고 끓는 물에 1시간 정도 푹 끓여준다센불', 'image_url': 'https://recipe1.ezmember.co.kr/cache/recipe/2023/01/01/fd46b99823bce6a2c31b94c40f931c6d1.jpg'}, {'step_number': 2, 'description': '대파와 양파, 생강, 향신료를 준비한다', 'image_url': 'https://recipe1.ezmember.co.kr/cache/recipe/2023/01/01/71ee836754a7d70f054c006d770304e31.jpg'}, {'step_number': 3, 'description': '달군 팬에 오향, 정향, 시나몬스틱, 코리앤더시스를 넣고 볶아준다중불', 'image_url': 'https://recipe1.ezmember.co.kr/cache/recipe/2023/01/01/0177a933cd2d4f3f4c0505c00d1a568a1.jpg'}, {'step_number': 4, 'description': '대파와 양파는 석쇠에 올려 직화로 구워준다중불', 'image_url': 'https://recipe1.ezmember.co.kr/cache/recipe/2023/01/01/fbd47eaf86c4ada749ef16e38bc1c8a31.jpg'}, {'step_number': 5, 'description': '육수망에 생강, 구운 향신료와 양파, 대파를 넣어준다', 'image_url': 'https://recipe1.ezmember.co.kr/cache/recipe/2023/01/01/641b4b6cc106043b6ac52a2c179a23661.jpg'}, {'step_number': 6, 'description': '1시간 정도 끓인 고기에 육수망을 넣고 1시간 더 끓여준다센불', 'image_url': 'https://recipe1.ezmember.co.kr/cache/recipe/2023/01/01/c9b850382c879a35ccb3b080a8ec2edd1.jpg'}, {'step_number': 7, 'description': '피쉬소스 400ml, 소금 100ml, 설탕 50ml, 미원 100ml를 넣고 2시간을 끓여준다센불', 'image_url': 'https://recipe1.ezmember.co.kr/cache/recipe/2023/01/01/190705bb5eb2bfd2bc28b97f1876da311.jpg'}, {'step_number': 8, 'description': '깨끗하게 손질한 고수를 뿌리채 넣고 끓여준다센불', 'image_url': 'https://recipe1.ezmember.co.kr/cache/recipe/2023/01/01/b053e2cff3779c07f104e932a838cb0f1.jpg'}, {'step_number': 9, 'description': '숙주 30g은 깨끗하게 손질해서 준비한다숙주 손질법 레시피', 'image_url': 'https://recipe1.ezmember.co.kr/cache/recipe/2023/01/01/8f59d121e96cac0326468aa961bceed91.jpg'}, {'step_number': 10, 'description': '쪽파 10대는 잘게 송송 썰어준다', 'image_url': 'https://recipe1.ezmember.co.kr/cache/recipe/2023/01/01/f4cc919ed263a20693d273f26f5f9e8a1.jpg'}, {'step_number': 11, 'description': '양지만 건져내어 얇게 슬라이스 해 준다', 'image_url': 'https://recipe1.ezmember.co.kr/cache/recipe/2023/01/01/8109191b9871c96c942e2dc81c7b1b961.jpg'}, {'step_number': 12, 'description': '재료를 준비하는 동안에도 육수는 계속 끓여준다중불', 'image_url': 'https://recipe1.ezmember.co.kr/cache/recipe/2023/01/01/263cf7e846980f627613d9a0d9db2f1a1.jpg'}, {'step_number': 13, 'description': '고수도 깨끗하게 손질한다', 'image_url': 'https://recipe1.ezmember.co.kr/cache/recipe/2023/01/01/7e144703e785af9596f73e8bf1cae1a61.jpg'}, {'step_number': 14, 'description': '끓는 물에 쌀국수면을 넣고 30초간 데쳐준다중불', 'image_url': 'https://recipe1.ezmember.co.kr/cache/recipe/2023/01/01/e4b034a3c0e3dd36f70b54008dacee591.jpg'}, {'step_number': 15, 'description': '찬물에 씻어준다', 'image_url': 'https://recipe1.ezmember.co.kr/cache/recipe/2023/01/01/c3f29b75aaf267f73a78d69718244ce71.jpg'}, {'step_number': 16, 'description': '양지고기는 슬라이스해서 소분해 냉동보관한다', 'image_url': 'https://recipe1.ezmember.co.kr/cache/recipe/2023/01/01/fc0f3fe4fa5cb8e1b6deb6ae36f56f471.jpg'}, {'step_number': 17, 'description': '그릇에 면을 담고 육수를 부은 후 양파와 쪽파를 올리고 양지고기를 올린 후 취향에 따라 고수도 올려 마무리 한다', 'image_url': 'https://recipe1.ezmember.co.kr/cache/recipe/2023/01/01/55a393fb1f8d3dc01b4c9aa085a3632d1.jpg'}]"
60001,면/만두,일상,소고기,끓이기,편스토랑 류수영 장칼국수 만드는 법 소불고깃감 무 소불고기요리 무요리 칼국수요리 면요리 해장용 매운칼국수 해장칼국수,장칼국수,"2,612",20분 이내,아무나,2인분,"[('소고기 불고기용', '200g'), ('대파', '2대'), ('무', '140g'), ('칼국수면', '2인분'), ('소금', '0.5t'), ('설탕', '0.5T'), ('간장', '2T'), ('멸치액젓', '2T'), ('고추장', '3T'), ('통후추', '약간'), ('물', '1.5L'), ('식용유', '적당량')]",소불고깃감을 볶아 육수를 만들고 고추장으로 간을 한 장칼국수!! 해장용으로도 좋아요!!,"[{'step_number': 1, 'description': '대파는 길게 반으로 갈라 4-5cm 길이로 썬다.', 'image_url': 'https://recipe1.ezmember.co.kr/cache/recipe/2023/01/07/cfc5e64af076eab3eb2cee5bb5b8e4ea1.jpg'}, {'step_number': 2, 'description': '무는 채 썰어 한 줌 정도 준비한다.', 'image_url': 'https://recipe1.ezmember.co.kr/cache/recipe/2023/01/07/acb7bb31c17370de9b07ca2b3a0ce7711.jpg'}, {'step_number': 3, 'description': '소고기 불고깃감은 한 입 크기로 찢는다.', 'image_url': 'https://recipe1.ezmember.co.kr/cache/recipe/2023/01/07/7c7c5991c55d5ab4457f94a98667e3191.jpg'}, {'step_number': 4, 'description': '강물로 달군 팬에 식용유 2바퀴를 두르고 소고기 불고깃감을 볶다가 소금 0.5t를 넣어 간한다.', 'image_url': 'https://recipe1.ezmember.co.kr/cache/recipe/2023/01/07/73abf65210f31dd30cc428a27335bba21.jpg'}, {'step_number': 5, 'description': '소고기가 어느 정도 익으면 썰어둔 파 2대, 채 썬 무 한 줌을 넣고 설탕 0.5T, 간장 2T를 넣고 볶는다.', 'image_url': 'https://recipe1.ezmember.co.kr/cache/recipe/2023/01/07/b39094950587062cb0d59e7f5a4326d11.jpg'}, {'step_number': 6, 'description': '멸치 액젓 2T를 5에 넣고 액젓 냄새가 날아갈 때까지 볶는다.', 'image_url': 'https://recipe1.ezmember.co.kr/cache/recipe/2023/01/07/74d19693fa7f846214a6687fbf2742cb1.jpg'}, {'step_number': 7, 'description': '물 1.5L를 6에 붓고 고추장 듬뿍 3T를 풀어 끓기 시작하면 5분 정도 더 끓인다.', 'image_url': 'https://recipe1.ezmember.co.kr/cache/recipe/2023/01/07/1412e078569d7f6f13a0214bf1a8fac91.jpg'}, {'step_number': 8, 'description': '7에 칼국수 면을 넣고 7분 정도 더 끓여 완성된 장칼국수를 그릇에 담는다.\n* 시판 칼국수 면에 있는 밀가루를 너무 많이 털지 말고 사용해야 녹말 물이 나와 국물이 걸쭉해져 육수처럼 된다.', 'image_url': 'https://recipe1.ezmember.co.kr/cache/recipe/2023/01/07/f5cdfd20f01933a97c2de2a80e7629591.jpg'}, {'step_number': 9, 'description': '통후추를 넉넉히 뿌려 마무리한다.', 'image_url': 'https://recipe1.ezmember.co.kr/cache/recipe/2023/01/07/6fbda444803d0bcc6888cdc2f94e772e1.jpg'}]"
60002,면/만두,일상,소고기,끓이기,차돌박이쌀국수 (명절끝에 먹는 시원하고 개운한 쌀국수레시피),차돌박이쌀국수,"1,578",10분 이내,아무나,2인분,"[('쌀국수면', '2인분'), ('숙주', '30g'), ('청경채', '1포기'), ('쌀국수소스', '2인분')]",개운한 맛이 일품인 쌀국수소스를 이용해서 쉽고 간단하게 만들어 먹는 쌀국수레시피입니다,"[{'step_number': 1, 'description': '쌀국수면은 뜨거운 물에 30초 가량 담궈 불려준다', 'image_url': 'https://recipe1.ezmember.co.kr/cache/recipe/2023/01/25/3c9c6a96028f823f4898883c0529cba61.jpg'}, {'step_number': 2, 'description': '숙주와 청경채는 흐르는 물에 깨끗하게 씻어준다', 'image_url': 'https://recipe1.ezmember.co.kr/cache/recipe/2023/01/25/60fa36bdf89e0c708b3db082fb90b7601.jpg'}, {'step_number': 3, 'description': '차돌박이쌀국수소스를 끓여준다\n차돌박이쌀국수탕 :  @6995322 중불', 'image_url': 'https://recipe1.ezmember.co.kr/cache/recipe/2023/01/25/21938999725923b8772a1cf789ca40cb1.jpg'}, {'step_number': 4, 'description': '물에 불린 면을 그릇에 담아준다', 'image_url': 'https://recipe1.ezmember.co.kr/cache/recipe/2023/01/25/e3fdb2fe587a309f41e2c8aae87eb1e81.jpg'}, {'step_number': 5, 'description': '차돌박이쌀국수소스를 붓고 숙주와 청경채를 올려준다', 'image_url': 'https://recipe1.ezmember.co.kr/cache/recipe/2023/01/25/0c4590c163703b00562bba69f886410c1.jpg'}]"
60003,면/만두,일상,소고기,끓이기,차돌 해물 짬뽕 만들기,차돌해물짬뽕,"2,346",30분 이내,초급,3인분,"[('차돌박이', '200g'), ('오징어', '1마리'), ('새우', '12마리'), ('알배추', '7장'), ('양파', '1/2개'), ('청경채                                                                                또는 시금치', '30g'), ('표고버섯', '2개'), ('느타리버섯', '70g'), ('대파', '1대'), ('베트남고추', '5~6개'), ('국수', '3인분'), ('홍고추', '취향껏'), ('청양고추', '취향껏'), ('물                                                                                또는 육수', '700ml'), ('고운고춧가루', '4스푼'), ('\u200b간장', '2스푼'), ('굴소스', '1스푼'), ('큐브 치킨스톡', '1개'), ('맛술', '1스푼'), ('마늘', '1.5스푼'), ('소금', '적당량')]",요즘 저희 집은 설 연휴 이후로 딸들 생일도 계속 겹쳐서 느끼한 음식을 많이 먹게 되어 매운맛이 당기네요 그래서 만들게 된 짬뽕입니다 냉동실을 뒤져보니 해물들과 차돌박이가 보여서 있는 야채들과 일요일 점심으로 만들었어요,"[{'step_number': 1, 'description': '껍질 있는 새우는 3마리만 남아서 두절 새우로 꺼냈어요 청경채는 없어서 시금치로 준비했어요 짬뽕에 넣을 야채는 있는 것으로 준비해도 됩니다', 'image_url': 'https://recipe1.ezmember.co.kr/cache/recipe/2022/10/02/f6a8d139e651de0680663ff7114f1a1e1.jpg'}, {'step_number': 2, 'description': '오징어는 얇게 칼집을 내어 자르고 해물도 씻어서 준비해요 대파도 송송 썰어 놓아요', 'image_url': 'https://recipe1.ezmember.co.kr/cache/recipe/2022/10/02/f45e00b528ee84213a45cbda5d40c9c51.jpg'}, {'step_number': 3, 'description': '알배추는 국수처럼 길게 잘라주세요 길게 자르면 국수와 함께 먹기 편하거든요\n양파도 채 썰고 버섯은 슬라이스 해놓고 느타리버섯은 손으로 찢어 놓아요', 'image_url': 'https://recipe1.ezmember.co.kr/cache/recipe/2022/10/02/7b98b5c1c43197efbb55c729e45d7e6f1.jpg'}, {'step_number': 4, 'description': '식용유 2스푼과 파를 넣고 기름을 내주세요', 'image_url': 'https://recipe1.ezmember.co.kr/cache/recipe/2022/10/02/9fbcc05259b1bd545af9d95a65e682411.jpg'}, {'step_number': 5, 'description': '동남아 고추를 부숴서 넣고 간장 2수저를 팬에 두른 후살짝 볶으면서 불향을 내줍니다 \n*동남아 고추가 없으면 페페론치노나 청양고추를 넣으세요 짬뽕에 빠질 수 없는 매운맛을 내줘야 해요*', 'image_url': 'https://recipe1.ezmember.co.kr/cache/recipe/2022/10/02/5c0b025b0639659ff43832e3101111611.jpg'}, {'step_number': 6, 'description': '파 기름을 낸 후 썰어놓은 양파와 알배추를 넣고 숨이 죽을 때까지 볶아줘요', 'image_url': 'https://recipe1.ezmember.co.kr/cache/recipe/2022/10/02/ad728abef6a49c3474369083efcbfbff1.jpg'}, {'step_number': 7, 'description': '청경채 넣으시면 지금 넣고 같이 볶은 후 고은 고춧가루 3스푼을 넣고 잘 섞이도록 한 번 더 볶아줍니다', 'image_url': 'https://recipe1.ezmember.co.kr/cache/recipe/2022/10/02/7e6a3844cb3db5fe285f83a580c628651.jpg'}, {'step_number': 8, 'description': '야채가 다 볶아졌으면 차돌박이를 넣고 볶다가 표고와 느타리버섯도 같이 넣고 볶아주세요 차돌박이를 넣을 때 맛술도 한 스푼 넣어주세요차돌박이 넣고 맛술이나 청주넣으시면 됩니다', 'image_url': 'https://recipe1.ezmember.co.kr/cache/recipe/2022/10/02/ffa2e79c517ff3ba43540392c169148a1.jpg'}, {'step_number': 9, 'description': '볶아진 재료에 물 700 ml를 넣고 끓여줍니다 저는 킹 새우 데친 물이 있어서 새우 육수 200 ml 와 물 500 ml를 넣었어요', 'image_url': 'https://recipe1.ezmember.co.kr/cache/recipe/2022/10/02/037da89221815065bfa8a9642fccbb801.jpg'}, {'step_number': 10, 'description': '짬뽕이 끓었으면 여기에 굴 소스 1스푼과 치킨스톡 1스푼을 넣어요 마늘도 1.5스푼을 지금 넣으세요', 'image_url': 'https://recipe1.ezmember.co.kr/cache/recipe/2022/10/02/a0349b6b30a76070e1bb90d6c9c5e15e1.jpg'}, {'step_number': 11, 'description': '저는 시금치라서 해물들과 함께 마지막에 넣었어요 물 200ml 더 넣어 물 보충을 하고 끓으면 맛을 보고 취향껏 소금이나 간장 굴 소스 등으로 간을 해도 됩니다 해물은 오래 끓으면 질겨지므로 마지막 끓을 때 새우 오징어를 넣고 끓여주세요', 'image_url': 'https://recipe1.ezmember.co.kr/cache/recipe/2022/10/02/4eaa98c4143bfc18eb00515e8df9faaa1.jpg'}, {'step_number': 12, 'description': '면을 삶은 후 그릇에 담고 뜨거운 국물을 2~3번 부었다 따랐다 하며 토렴을 해주세요\n청양고추와 홍고추는 취향껏 준비해 줍니다', 'image_url': 'https://recipe1.ezmember.co.kr/cache/recipe/2022/10/02/8ca867595004f2605b2cfdc36a2c1aaa1.jpg'}, {'step_number': 13, 'description': '그릇에 담고 취향껏 청양고추와 홍고추도 넣어요 매운 짬뽕에 차돌을 넣으니 잘 어울려요 해물도 많이 넣어 해물맛이 진하고 매운맛을 좋아해 청양고추를 넣고 먹으니 매콤하고 맛있어요알싸한 매운맛을 원하시면 마지막에 마늘을 넣으세요', 'image_url': 'https://recipe1.ezmember.co.kr/cache/recipe/2022/10/02/b80f9154f923af899421ee274ce2161e1.jpg'}]"
60004,면/만두,일상,소고기,끓이기,[살빠지는 레시피] 베트남 쌀국수 스톡으로 쌀국수 만들기/ 소고기 육수 만들기,베트남쌀국수,"5,497",60분 이내,초급,4인분,"[('소고기', '300g'), ('쌀국수', '400g'), ('숙주', '50g'), ('깻잎', '적당히'), ('대파', '적당히'), ('페퍼론치노', '적당히'), ('쌀국수스톡', '50g')]",살빠지는 레시피로 다이어트중인 루나에요. ​요즘 쌀국수로 파스타도 만들어 먹고 쌀국수를 애정 하는 입장에서 한국의 쌀국수는 너무나 비싸요. 집에서 만든 쌀국수지만 베트남 쌀국수 맛집의 맛을 느끼고 싶어서 인터넷으로 베트남 쌀국수 스톡을 주문해서 주말 점심에 식구들이랑 냠냠 먹었어요. 한번 맛보면 잊을 수 없는 내 입맛에 딱 맞게 만드는 법! 고고씽~~~!,"[{'step_number': 1, 'description': '제일 먼저 해야 합니다. 쌀국수는 찬물에 30분 정도 담가주세요! 쌀국수를 불리는 동안 재료 준비를 해야 하거든요.', 'image_url': 'https://recipe1.ezmember.co.kr/cache/recipe/2023/03/26/bc6e2f19f5653d676f3d60e1adba19521.gif'}, {'step_number': 2, 'description': '끓는 물에 소고기를 넣고 핏기가 사라질 때까지 끊이고 찬물에 헹구어 주세요! 핏물은 물론이고 불순물도 제거가 돼요! 냄비에 2리터 물을 붓고 대파랑 고기를 넣고 10분 정도 삶아주세요!', 'image_url': 'https://recipe1.ezmember.co.kr/cache/recipe/2023/03/26/0537befc87c2795e0f9bd31cd4aa6bbe1.jpg'}, {'step_number': 3, 'description': '숙주는 흐르는 물에 세 번 정도 깨끗이 씻어 주고요!\n※ 여기서 루나의 꿀팁!\n숙주를 채밭에 놓은 상태에서 밑에 볼을 놓아주세요!\n그리고 전기포트로 팔팔 끊인 물을 부어주고 1분 후 건져내면 진짜~~~ 간편하게 숙주를 데칠 수 있어요!\n이렇게 데치니 숙주가 더욱 아삭하니 완벽하게 데쳐진 거 같아요!\n너무 쉽죠', 'image_url': 'https://recipe1.ezmember.co.kr/cache/recipe/2023/03/26/f5fd52a479abdd74b7810499d92cb8121.jpg'}, {'step_number': 4, 'description': '거품 걷어 낼 번거로움 없이 육수가 깔끔하죠! 고기를 건져서 뜨거우니 식혀주세요. 성격 급한 루나는 뜨거운 소고기를 잡고 뜨거! 뜨거워! 찬물에 손 담가가면서 썰었어요', 'image_url': 'https://recipe1.ezmember.co.kr/cache/recipe/2023/03/26/6d85d0d9ad8dd490b536e1208bf58cc11.jpg'}, {'step_number': 5, 'description': '육수에 썬 고기를 넣고쌀국수스톡을 넣어주세요! 불린 쌀국수를 넣고 1분 정도 끊이면 완성!', 'image_url': 'https://recipe1.ezmember.co.kr/cache/recipe/2023/03/26/cbc66f8e9ecce14e63556d3bd8853c831.jpg'}, {'step_number': 6, 'description': '데친 숙주 수북히 쌓아주고요. 그 위에 깻잎이랑 페퍼론치노 올려줬어요! 저는 고수를 좋아하는데 식구들은 고수 향을 싫어해요! 그래서 고수 대신 한국의 고수라 부르고 싶은 깻잎을 활용했어요! 매콤한 맛을 위해 저는 페퍼론치노를 활용해 봤어요!', 'image_url': 'https://recipe1.ezmember.co.kr/cache/recipe/2023/03/26/b4433b7f82fb2656af1d7cefa13bab551.jpg'}]"
