index,종류별,상황별,재료별,방법별,글 제목,레시피이름,조회수,조리시간,난이도,인분,재료,소개글,조리순서
25033,메인반찬,일상,채소류,볶음,매콤한 감자채 볶음,감자채볶음,"1,888",30분 이내,초급,4인분,"[('감자', '400g'), ('소금', '1작은술'), ('설탕', '1작은술'), ('양파', '1/4개'), ('청양고추', '1개'), ('홍고추', '1개'), ('다진대파', '1큰술'), ('다진마늘', '1작은술'), ('맛술', '1큰술'), ('참치액', '1작은술'), ('들기름', '1큰술'), ('물', '2큰술')]","오늘은 맛있는 햇감자로 매콤한 감자채 볶음을 해봤습니다
볶은 시간을 조절해서 아삭한 감자채 볶음을 할 수 있습니다.","[{'step_number': 1, 'description': '감자는 채썰어 물에 헹군 후', 'image_url': 'https://recipe1.ezmember.co.kr/cache/recipe/2020/05/16/54790e131728f88f47d7c70015928b831.jpg'}, {'step_number': 2, 'description': '소금과 설탕을 넣고 고루 섞은후 재워 주세요', 'image_url': 'https://recipe1.ezmember.co.kr/cache/recipe/2020/05/16/edc220332c57a0d1cbc108d97f2f03ad1.jpg'}, {'step_number': 3, 'description': '양파는 채썰고 대파,홍고추,청양고추는 송송 다지듯 썰어 주세요', 'image_url': 'https://recipe1.ezmember.co.kr/cache/recipe/2020/05/16/6747c0286b6a635200b492ce53d9cbeb1.jpg'}, {'step_number': 4, 'description': '팬에 식용유를 두르고 다진마늘을 넣고 볶다가', 'image_url': 'https://recipe1.ezmember.co.kr/cache/recipe/2020/05/16/332df2b36292119cbbdd1bb26316027a1.jpg'}, {'step_number': 5, 'description': '재워둔 감자를 건져서 팬에 넣고 볶아 주세요', 'image_url': 'https://recipe1.ezmember.co.kr/cache/recipe/2020/05/16/ee842abf0c37ebc0ef2cb688d761d6291.jpg'}, {'step_number': 6, 'description': '양파,청양고추,홍고추.대파를 넣고', 'image_url': 'https://recipe1.ezmember.co.kr/cache/recipe/2020/05/16/79f370af964dec8806f41700a04092761.jpg'}, {'step_number': 7, 'description': '맛술,참치액을 넣고 볶다가', 'image_url': 'https://recipe1.ezmember.co.kr/cache/recipe/2020/05/16/05e973f562dc212de950ac3a7c6d20b21.jpg'}, {'step_number': 8, 'description': '*물을 약간 넣고 볶아 주세요.\n*기호에 따라 감자을 시식하고 볶은 시간을 정하며 됩니다.', 'image_url': 'https://recipe1.ezmember.co.kr/cache/recipe/2020/05/16/ae2182a81572f16fff47f37fe161e12e1.jpg'}, {'step_number': 9, 'description': '들기름과 깨소금을 넣고 완성 그릇에 담아 주세요.', 'image_url': 'https://recipe1.ezmember.co.kr/cache/recipe/2020/05/16/4a92e6dcc96de3270e036a394580cc111.jpg'}]"
25034,메인반찬,일상,채소류,볶음,"삼시세끼 어촌편, 차승원 간식 소시지 감자채볶음",소시지감자채볶음,"1,492",30분 이내,초급,2인분,"[('감자', '3개'), ('대파', '1/2대'), ('당근', '1/3개'), ('양파', '1/2개'), ('청양초', '2개'), ('간식 소시지', '50g'), ('굴소스', '1숟가락'), ('식용유', ''), ('깨소금', ''), ('허브솔트', ''), ('양념장', '약간')]","삼시세끼 어촌편, 차승원 간식 소시지 감자채볶음 완도의 작은 섬 `죽굴도`에서 유해진, 차승원, 손호준이 오랜만에 2020년 ‘삼시세끼 어촌편5’에 다시 뭉쳤습니다. 아궁이에 불을 지펴 한 끼를 해결하는 게 꼭 어릴 때 우리의 모습 같아 자주 챙겨 보게 됩니다.","[{'step_number': 1, 'description': '감자는 채 썰어 물에 담가 전분기를 빼둔다.\n당근, 감자, 대파는 채 썰고, 간식 소시지는 어슷하게 청양초는 잘게 썰어 준비한다.', 'image_url': 'https://recipe1.ezmember.co.kr/cache/recipe/2020/05/20/0e3d6a8e12f7e6fed62b49103ecadc161.jpg'}, {'step_number': 2, 'description': '프라이팬에 식용유를 두르고 물기 뺀 감자를 넣고 볶아준다.', 'image_url': 'https://recipe1.ezmember.co.kr/cache/recipe/2020/05/20/5c7678a36b3906610006a5b3a33ad57c1.jpg'}, {'step_number': 3, 'description': '감자가 반쯤 익으면 간식 소시지를 넣고 허브솔트(소금)을 넣어준다.', 'image_url': 'https://recipe1.ezmember.co.kr/cache/recipe/2020/05/20/7f67a2243c4a2bdce8fd6623f76da7131.jpg'}, {'step_number': 4, 'description': '썰어둔 채소와 굴 소스를 넣고 볶아준 후 깨소금을 뿌려 완성한다.', 'image_url': 'https://recipe1.ezmember.co.kr/cache/recipe/2020/05/20/f16388ced35a38d1d30cefdd97c2b71a1.jpg'}]"
25035,메인반찬,일상,채소류,볶음,가지볶음 윤기 좌르르 꼬들꼬들 맛있는 가지볶음,가지볶음,"4,499",20분 이내,초급,4인분,"[('가지', '400g'), ('꽈리고추', '10개'), ('홍고추', '1개'), ('들기름', '1숟가락'), ('식용유', '0.5숟가락'), ('천일염', '0.5숟가락'), ('굴 소스', '1숟가락'), ('다진 마늘', '0.5숟가락'), ('올리고당', '1숟가락'), ('통깨', '1숟가락'), ('참기름', '1숟가락')]","가지를 좋아하는데 우리 집 가지가 올해는 제대로 열리질 않아

못난이 가지로 만든 가지볶음입니다
가지에 좋아하는 꽈리고추를 넣어 볶았더니

두 가지 요리를 먹는듯하네요

​

​

​","[{'step_number': 1, 'description': '가지는 필러로 중간중간 껍질을 벗겨줍니다\n껍질이 두툼하고 매끄럽지 않아서 껍질을 벗겨주었어요', 'image_url': 'https://recipe1.ezmember.co.kr/cache/recipe/2020/08/13/62b3a88d5c70fdabf697f79d3997c3451.jpg'}, {'step_number': 2, 'description': '세로로 반을 자른 다음 도톰하게 썰어서 천일염을 뿌려서 10분 정도 절여줍니다', 'image_url': 'https://recipe1.ezmember.co.kr/cache/recipe/2020/08/13/a8a300324b5ef394e77d5e22b2093e4f1.jpg'}, {'step_number': 3, 'description': '절여놓았던 가지를 물에 한번 헹구어 물기를 꼭 짜줍니다\n꽈리고추는 반씩 잘라놓고 홍고추는 어슷 썰어줍니다', 'image_url': 'https://recipe1.ezmember.co.kr/cache/recipe/2020/08/13/3fcc1eb59b8dbcd994f6b526ccdf4c591.jpg'}, {'step_number': 4, 'description': '팬에 들기름(1)+식용유(0.5)를 둘러준 다음 가지를 볶아줍니다\n식용유만 사용하는 것보다 들기름을 섞어서 볶아주면 훨씬 맛있지요\n도톰한 가지를 빨리 익혀주기 위해 잠시 뚜껑을 덮어줍니다', 'image_url': 'https://recipe1.ezmember.co.kr/cache/recipe/2020/08/13/68a63d2fc77615d77d0a8e8facb830ae1.jpg'}, {'step_number': 5, 'description': '굴 소스(1)을 넣고 다진 마늘을 넣어서 볶아줍니다', 'image_url': 'https://recipe1.ezmember.co.kr/cache/recipe/2020/08/13/45e4cefe9123b569c81d8ae91541f4a11.jpg'}, {'step_number': 6, 'description': '가지가 거의 다 익었을 때 꽈리고추를 넣고 홍고추도 넣어서 휘리릭 볶아줍니다', 'image_url': 'https://recipe1.ezmember.co.kr/cache/recipe/2020/08/13/c6791b3eae5129e9a74b323d89c0b3521.jpg'}, {'step_number': 7, 'description': '마지막에 올리고당을 넣어 윤기를 주고 통깨와 참기름을 넣어 마무리해 줍니다', 'image_url': 'https://recipe1.ezmember.co.kr/cache/recipe/2020/08/13/6861ea23321038322a9e101b5a0a083c1.jpg'}, {'step_number': 8, 'description': '꼬들꼬들하고 맛있는 #가지볶음 완성입니다', 'image_url': 'https://recipe1.ezmember.co.kr/cache/recipe/2020/08/13/ca73e71838d5a51177fd8e539b422b781.jpg'}, {'step_number': 9, 'description': '가지의 꼬들꼬들함과 꽈리고추의 아삭함이 어우러진 맛있는 가지볶음\n두 가지 요리를 한 번에 즐길 수 있어요', 'image_url': 'https://recipe1.ezmember.co.kr/cache/recipe/2020/08/13/ff51e10889e980afe5d405a787fd49021.jpg'}, {'step_number': 10, 'description': '가지가 물컹거리는 것이 싫어서 안 드시는 분들도\n이렇게 볶아서 드셔보시면 꼬들꼬들한 식감의 가지볶음 맛에 반할 겁니다', 'image_url': 'https://recipe1.ezmember.co.kr/cache/recipe/2020/08/13/13039d9363fc529a13fa2fb89293a8701.jpg'}, {'step_number': 11, 'description': '노랑 수술에 보랏빛 가지 꽃 제거 보라색을 정말 좋아하기에\n가지 꽃은 어느 꽃 못지않게 예쁘더라고요~!!~\n제가 얼마 전에도 가지 요리 올리면서 가지 꽃의 꽃말을 적은 적이 있지요\n가지 꽃의 꽃말은 진실이랍니다', 'image_url': 'https://recipe1.ezmember.co.kr/cache/recipe/2020/08/13/ca8fe29131b445cb78a4f2750dae1b7d1.jpg'}]"
25036,메인반찬,일상,채소류,볶음,국물감자볶음:밥도 되고 반찬도 되는 초간단레시피,국물감자볶음,434,20분 이내,아무나,1인분,"[('감자', '2개'), ('양파', '1/2개'), ('당근', '1/3개'), ('소금', '1/2작은술'), ('후추', ''), ('참기름', '1/2큰술'), ('물', '50+300ml'), ('쪽파', ''), ('청양고추', ''), ('현미유', '1큰술')]",유투버 준티비님의 레시피. 라면 끓이는 만큼 간단하게 한기를 때울 수 있어서 삼식이 노릇하는 아빠들이 만들어 먹기 좋은 요리라고 한다. 그래서 별칭은 파파스포테이토.,"[{'step_number': 1, 'description': '감자는 굵은채, 양파는 적당히 당근은 가는채 썬다.\n제 감자채는 너무 굵었어요 ㅠㅠ 제것보다는 가늘게 썰어주세요', 'image_url': 'https://recipe1.ezmember.co.kr/cache/recipe/2020/09/05/bc04f822922557bdcab9eb21c3f2db561.jpg'}, {'step_number': 2, 'description': '팬에 현미유+참기름 넣고 볶는다.\n준님은 참기름만 넣었으나 발연점때문에 현미유(식용유) 먼저 넣고 참기름 넣어 볶았어요.', 'image_url': 'https://recipe1.ezmember.co.kr/cache/recipe/2020/09/05/e9154bd632cdeb5d70b66da1dd9a1e581.jpg'}, {'step_number': 3, 'description': '소금,후추 넣고 3분정도 볶다가 물 조금 넣어 충분히 볶는다.\n이때 넣는 물은 타지 않게 볶기위해 넣는 물로 모든 재료를 거의 다 익힌다는 생각으로 볶아주세요.', 'image_url': 'https://recipe1.ezmember.co.kr/cache/recipe/2020/09/05/25788d1b1c51cf57be7131f78958b95c1.jpg'}, {'step_number': 4, 'description': '재료가 푹 잠기게 물을 붓고 물이 1/3정도로 졸아 들때까지 뚜껑덮지 말고 끓인다.', 'image_url': 'https://recipe1.ezmember.co.kr/cache/recipe/2020/09/05/05189cc5ae5992a72e937057e5099e981.jpg'}, {'step_number': 5, 'description': '감자가 뚝뚝 부러질 정도로 익힌다.', 'image_url': 'https://recipe1.ezmember.co.kr/cache/recipe/2020/09/05/9e32f0142178cbc4164ae3e29633e3d31.jpg'}, {'step_number': 6, 'description': '부족한 간은 소금으로 맞추고 파와 청양고추를 넣고 마무리.', 'image_url': 'https://recipe1.ezmember.co.kr/cache/recipe/2020/09/05/02579c3e7b523b9e974a04a57d5fd3331.jpg'}]"
25037,메인반찬,일상,채소류,볶음,깻잎순나물 부드럽고 구수한 깻잎들깨볶음,깻잎들깨볶음,"2,885",15분 이내,초급,2인분,"[('천일염', '0.5숟가락'), ('깻잎순', ''), ('참치액', ''), ('들기름', ''), ('다진마늘', ''), ('들깨가루', ''), ('들기름', '')]","24절기의 하나인 백로는 처서와 추분 사이에 있는 절기로 가을이 본격적으로

시작되는 시기라고 하지요

그래서인지 아침저녁 조석으로 찬바람이 불고 선선하네요
구수하고 부드럽고 맛있는 #들깻잎볶음

들깨가루 넣어 볶아 놓으면 구수하고 부드럽고 맛있네요
양이 많지 않아 한 접시 볶아서 한 끼에 뚝딱 순삭 했답니다
​
​","[{'step_number': 1, 'description': '깻잎을 팔팔 끓는 물에 넣고 데쳐서 찬물에 헹구어 물기를 빼줍니다', 'image_url': 'https://recipe1.ezmember.co.kr/cache/recipe/2020/09/08/e224f81c81a7a3760c25e8e19b50bff51.jpg'}, {'step_number': 2, 'description': '대파도 한 개 썰어줍니다', 'image_url': 'https://recipe1.ezmember.co.kr/cache/recipe/2020/09/08/83ffbb3eb7953af561a7dc2813ae37f11.jpg'}, {'step_number': 3, 'description': '데쳐놓은 깻잎에 모든 양념을 넣어줍니다\n펜에 들기름을 넣고 볶아주다가 대파 썰은 것과 들깨가루를 넣고 휘리릭 볶아줍니다', 'image_url': 'https://recipe1.ezmember.co.kr/cache/recipe/2020/09/08/376826531619a21caa94b0ccbd88b4f11.jpg'}, {'step_number': 4, 'description': '마지막에 들기름이나 참기름 조금 넣고 마무리해 줍니다', 'image_url': 'https://recipe1.ezmember.co.kr/cache/recipe/2020/09/08/e84ab3c7e48798e9dab4d16478e569ea1.jpg'}, {'step_number': 5, 'description': '구수하고 부들부들 맛있는 #깻잎들깨볶음 완성입니다', 'image_url': 'https://recipe1.ezmember.co.kr/cache/recipe/2020/09/08/84e1ed730bf32ee84a702b6fb996bda71.jpg'}, {'step_number': 6, 'description': '엊그제 풀 뽑으면서 들깨 모두 뽑고 조금 나았는데\n마저 뽑아서 단풍 깻잎 훑어서 데쳐서 말려 놓아야겠어요\n깻잎 좋아하는데 다 뽑고 나면 아쉬워서요', 'image_url': 'https://recipe1.ezmember.co.kr/cache/recipe/2020/09/08/2acf8e13f51c422d9995bcb241d22fc11.jpg'}]"
25038,메인반찬,일상,채소류,볶음,열무돼지고기볶음 만드는법 / 맛남의 광장,None,967,None,None,None,"[('열무', '5~8뿌리'), ('식용유', '3큰술'), ('대파', '1/2컵'), ('간장', '1T'), ('황설탕', '1/2T'), ('멸치액젓', '1T'), ('간마늘', '1T'), ('채썬 돼지고기', '200g')]",,[]
25039,메인반찬,일상,채소류,볶음,가지볶음 간단하고 맛있는 가지 굴소스 볶음,가지굴소스볶음,"6,265",10분 이내,초급,4인분,"[('가지 작은 것', '4개'), ('대파', '1/2개'), ('홍고추', '1개'), ('청양고추', '1개'), ('굴 소스', '2숟가락'), ('다진 마늘', '1숟가락'), ('식용유', '1숟가락'), ('올리고당', '1숟가락'), ('통깨', '1숟가락'), ('참기름', '1숟가락')]","오늘은 얼마 전 만들어 먹은 가지볶음입니다

가지가 모양도 안 예쁘고 제대로 열리지 않았는데 그나마 다 뽑아서

이젠 마트표 가지 아니면 가지요리 먹기 어렵게 되었네요
가지의 물컹거림이 싫어하시는 분들을 위해

소금에 절이거나 구워서 무치는 등 만들어 먹던 가지요리

오늘은 그대로 볶아서 만들어 보았어요
부드럽고 쫀득하니 맛있는 #가지볶음 #가지요리 저와 함께 만들어 보실까요~!~

​
​
​","[{'step_number': 1, 'description': '가지가 4개 이지만 제대로 된 마트표 가지 2개쯤인 것 같아요~~!~\n가지는 껍질이 두툼하고 예쁘지 않은 것들은 필러로 깎아줍니다', 'image_url': 'https://recipe1.ezmember.co.kr/cache/recipe/2020/09/16/2be376f998a4c05ebfd1dd4617db017a1.jpg'}, {'step_number': 2, 'description': '가지를 세로로 반을 잘라준 다음 0.5cm 두께로 넓적하게 썰어놓았어요\n청양고추와 홍고추 대파는 송송 썰어줍니다', 'image_url': 'https://recipe1.ezmember.co.kr/cache/recipe/2020/09/16/98ec31bd49208fca947ef26eb6eecaf51.jpg'}, {'step_number': 3, 'description': '팬에 식용유 한 큰 술을 넣고 가지를 재빨리 볶아 줍니다\n가지가 조금씩 색깔이 변하고 부드러워지면 굴 소스 2 큰 술을 넣어줍니다', 'image_url': 'https://recipe1.ezmember.co.kr/cache/recipe/2020/09/16/c619de70d3abe690a6273c26cf733c811.jpg'}, {'step_number': 4, 'description': '다진 마늘 1/2 큰 술을 넣고 다진 파 홍고추 청양고추를 넣어줍니다', 'image_url': 'https://recipe1.ezmember.co.kr/cache/recipe/2020/09/16/c521fa0041b0b1fcd6cdfa35385647561.jpg'}, {'step_number': 5, 'description': '센 불에서 재빨리 볶아줍니다\n마지막에 깨소금과 참기름을 넣고 재빨리 볶아주면 가지볶음 완성입니다\n어때요? 아주 간단하죠\n간단하지만 맛만큼은 간단하지 않고 맛있어요', 'image_url': 'https://recipe1.ezmember.co.kr/cache/recipe/2020/09/16/0ca03f009cd97bfdb9c82a23257d86441.jpg'}, {'step_number': 6, 'description': '가지볶음 한 접시 만들어 놓고 젓가락이 자꾸만 갈 정도로 맛도 있어요\n부드럽고 쫀득하고 맛있는 가지볶음\n빠른 시간에 휘리릭 만들었어요~!~~', 'image_url': 'https://recipe1.ezmember.co.kr/cache/recipe/2020/09/16/b033489c436d9c89edfece192c12ecdb1.jpg'}, {'step_number': 7, 'description': '양념도 너무 간단하지요\n굴 소스 한 가지로 만들었지만 감칠맛도 뿅뿅\n아이들도 좋아할 수 있는 맛이네요', 'image_url': 'https://recipe1.ezmember.co.kr/cache/recipe/2020/09/16/f4b1ee9b52e1ec6c4caf6e120b7f735c1.jpg'}, {'step_number': 8, 'description': '사실은 요리하기 귀찮고 힘들어서 절이지도 않고 따로 굽지도 않고\n굴 소스 한 가지로 휘리릭 만들었는데\n의외로 맛있는 가지볶음이 완성되었다는요', 'image_url': 'https://recipe1.ezmember.co.kr/cache/recipe/2020/09/16/d9a076fe6b8f503104649f731766d3c41.jpg'}, {'step_number': 9, 'description': '가지는 가격도 착하고 맛도 영양도 좋아서 자주 만들어 먹고 싶은 요리 중 한가지인데요\n이제 쉽게 만들어보셔도 좋을 것 같네요~~~', 'image_url': 'https://recipe1.ezmember.co.kr/cache/recipe/2020/09/16/60df05c51fb31797e1f3c2690392f2231.jpg'}]"
25040,메인반찬,일상,채소류,볶음,간단한 요리 두부김치 만들기,두부김치,"1,678",30분 이내,아무나,4인분,"[('두부', '1모'), ('김치', '1포기'), ('삼겹살', '3줄'), ('소금', '조금'), ('후춧가루', '조금'), ('고춧가루', '1큰술'), ('물', '1컵'), ('다시다', '조금'), ('참기름', '1큰술'), ('통깨', '1작은술')]",노브랜드에서 두부 산게 있어 반찬으로 간단하게 만들었어요~,"[{'step_number': 1, 'description': '두부 1모는 먹기 좋은 크기로 썰어서 후라이팬에 구워줍니다.\n이때 소금과 후춧가루 조금 뿌려서 앞뒤로 노릇하게 부쳐주세요~', 'image_url': 'https://recipe1.ezmember.co.kr/cache/recipe/2020/10/22/1a3be2c93b27bcf730abc7553c8a3e391.jpg'}, {'step_number': 2, 'description': '요렇게 노르스름하게 구우면 됩니다.\n두부부침은 완성..', 'image_url': 'https://recipe1.ezmember.co.kr/cache/recipe/2020/10/22/340876b381aa33440c8e67d931ee3e4b1.jpg'}, {'step_number': 3, 'description': '삼겹살은 세로로 조그맣게 썰어서 준비하고..', 'image_url': 'https://recipe1.ezmember.co.kr/cache/recipe/2020/10/22/a0a4d00c18721a93b191a0d99a0dbe081.jpg'}, {'step_number': 4, 'description': '김치 1포기도 썰어서 준비해주세요~', 'image_url': 'https://recipe1.ezmember.co.kr/cache/recipe/2020/10/22/e260a1b0540056d809f08b5b4952139f1.jpg'}, {'step_number': 5, 'description': '웍에 삼겹살을 넣고 먼저 구워줍니다.', 'image_url': 'https://recipe1.ezmember.co.kr/cache/recipe/2020/10/22/caf9fa4f8103b5ebeedeb9f1b0a20ac61.jpg'}, {'step_number': 6, 'description': '그 다음 김치 한포기 넣고 고기랑 같이 볶아줍니다.', 'image_url': 'https://recipe1.ezmember.co.kr/cache/recipe/2020/10/22/c9517294c47b0df35d749bece05a7f7c1.jpg'}, {'step_number': 7, 'description': '여기에 종이컵으로 물 1컵 정도 양을 넣고..', 'image_url': 'https://recipe1.ezmember.co.kr/cache/recipe/2020/10/22/08fc28261f41b6246444884d8ec8521a1.jpg'}, {'step_number': 8, 'description': '고춧가루 1큰술 넣고 같이 볶아주세요~', 'image_url': 'https://recipe1.ezmember.co.kr/cache/recipe/2020/10/22/ebb610e220f348c69f66409797e158811.jpg'}, {'step_number': 9, 'description': '이제 고기랑 김치랑 어우러지게 볶아주세요~\n물기가 자박해질때까지 볶아주면 끝~', 'image_url': 'https://recipe1.ezmember.co.kr/cache/recipe/2020/10/22/e9ca94e03b1bd2bc5be3617866443af81.jpg'}, {'step_number': 10, 'description': '어느 정도 다 볶아졌으면 다시다 살짝만 넣고 간 맞춰 주세요~', 'image_url': 'https://recipe1.ezmember.co.kr/cache/recipe/2020/10/22/5bc8b851bd211c3826b3dc9be4e4019b1.jpg'}, {'step_number': 11, 'description': '다 됐음 참기름 1큰술과 통깨 1작은술 뿌려주면 김치 볶음도 완성..', 'image_url': 'https://recipe1.ezmember.co.kr/cache/recipe/2020/10/22/38f5a468ae3fd833494a6db1dc61c3271.jpg'}, {'step_number': 12, 'description': '이제 접시에 셋팅해서 먹으면 됩니다..', 'image_url': 'https://recipe1.ezmember.co.kr/cache/recipe/2020/10/22/d914c5d083fa9bc1444d1770f3126b971.jpg'}]"
25041,메인반찬,일상,채소류,볶음,그냥 먹어도 맛있지만 스팸과 두부가 함께하여 더 맛있는 스팸 두부김치 만드는 법 볶음김치 황금레시피,스팸두부김치,"3,750",20분 이내,초급,2인분,"[('김치', '1/4포기'), ('두부', '500g'), ('스팸', '1개'), ('양파', '1/4개'), ('파', '15g'), ('고춧가루', '1T'), ('설탕', '1T'), ('참기름', '1T'), ('깨', '약간')]",한국인들의 사랑인 김치를 볶아주어 정말 맛있게 먹어보아요,"[{'step_number': 1, 'description': '끓는 물에 스팸을 30초 정도 데쳐주어 불순물을 제거해주세요', 'image_url': 'https://recipe1.ezmember.co.kr/cache/recipe/2020/10/29/3beae9b254dbb1726352b868d8b6885e1.jpg'}, {'step_number': 2, 'description': '프라이팬에 기름을 둘러주신 다음에 스팸을 앞뒤 노릇노릇 구워주세요중불', 'image_url': 'https://recipe1.ezmember.co.kr/cache/recipe/2020/10/29/d3df4acbf544e8c060a7d493abd9282d1.jpg'}, {'step_number': 3, 'description': '새 프라이팬에 기름을 둘러주신 다음에 두부를 앞뒤 노릇노릇 구워주세요중불', 'image_url': 'https://recipe1.ezmember.co.kr/cache/recipe/2020/10/29/4960777a26a7465482b9c8dc86da8a641.jpg'}, {'step_number': 4, 'description': '볶음김치를 만들 냄비에 기름을 둘러주신 다음에 파를 넣고 파기름을 내주세요볶음김치에서는 파기름이 크게 중요한 부분은 아니기 때문에 파의 향이 올라올 정도로만 파기름을 내주세요', 'image_url': 'https://recipe1.ezmember.co.kr/cache/recipe/2020/10/29/67db68dc10ee7bab65fba3c9c25d0c471.jpg'}, {'step_number': 5, 'description': '파의 향이 올라오기 시작하면 양파를 넣고 볶아주세요', 'image_url': 'https://recipe1.ezmember.co.kr/cache/recipe/2020/10/29/05c4b52a71f84ea7937a0fb134f9d3161.jpg'}, {'step_number': 6, 'description': '양파가 투명 빛으로 변하기 시작하면 김치와 김치 국물, 고춧가루, 설탕을 넣고 볶아주세요고춧가루 같은 경우에는 금방 탈 수도 있기 때문에 주의해주세요', 'image_url': 'https://recipe1.ezmember.co.kr/cache/recipe/2020/10/29/162d8165dcb5d2938e5082849f8b3b2e1.jpg'}, {'step_number': 7, 'description': '김치의 색이 누르스름해지면 참기름을 넣고 30초 정도 추가로 볶아주세요', 'image_url': 'https://recipe1.ezmember.co.kr/cache/recipe/2020/10/29/414ea0e1809706969c10447e00f0168c1.jpg'}, {'step_number': 8, 'description': '완성된 볶음김치는 두부와 스팸을 각자의 취향 맞게 예쁘게 플레이팅 해주시고 깨를 뿌려주어 마무리해주세요', 'image_url': 'https://recipe1.ezmember.co.kr/cache/recipe/2020/10/29/870378380887f1f1efe897034405a4371.jpg'}]"
25042,메인반찬,일상,채소류,볶음,감자채볶음 만들기,감자채볶음,"1,728",15분 이내,아무나,3인분,"[('감자                                                                                약 500g', '3개'), ('당근', '1/4개'), ('청양고추', '3개'), ('홍고추', '3개'), ('식용유', '2큰술'), ('마른고추', '5개'), ('마늘편', '1큰술'), ('대파', '1/2개'), ('간장', '1큰술'), ('굴소스', '1작은술'), ('미원', '1티스푼'), ('산초기름', '1작은술'), ('후추가루', '약간'), ('참기름', '조금')]",감자채 당근채 청양고추를 넣어 매콤하게 볶아서 얼얼한 산초기름을 넣고 만든 맛있는 감자요리 특히 술안주로도 좋습니다,"[{'step_number': 1, 'description': '감자를 0.3센치 두께로 채썰어 찬물에 식초 몇방울 넣고 담그어 줍니다', 'image_url': 'https://recipe1.ezmember.co.kr/cache/recipe/2020/11/03/460f7c79c94c5e415a48c5e754a2dabd1.jpg'}, {'step_number': 2, 'description': '당근도 같은 크기로 채썰고 청양고추 잘게 썰어 준비합니다', 'image_url': 'https://recipe1.ezmember.co.kr/cache/recipe/2020/11/03/e94f3c87f7eff7ed07ea304836b83ffc1.jpg'}, {'step_number': 3, 'description': '펜에 식용유 2큰술 두르고 마른고추 넣고 향을 내고', 'image_url': 'https://recipe1.ezmember.co.kr/cache/recipe/2020/11/03/95f65b7d952d23b50dccd0269fb94fbe1.jpg'}, {'step_number': 4, 'description': '마늘편 대파 어슷하게 썰어 넣고 향을 내고', 'image_url': 'https://recipe1.ezmember.co.kr/cache/recipe/2020/11/03/a07b969dad0913e35f40ce8f310fc75a1.jpg'}, {'step_number': 5, 'description': '감자채 당근채 넣고 볶아줍니다', 'image_url': 'https://recipe1.ezmember.co.kr/cache/recipe/2020/11/03/bb6730d8b1fd1ccce9839513c731fbde1.jpg'}, {'step_number': 6, 'description': '감자채가 살짝 익으면 육수를 반국자 넣고 간장 굴소스 미원 넣고 볶아줍니다', 'image_url': 'https://recipe1.ezmember.co.kr/cache/recipe/2020/11/03/6659ac676d8fe3d4717c01c37e1c67671.jpg'}, {'step_number': 7, 'description': '감자채가 거의 익으면 후추가루', 'image_url': 'https://recipe1.ezmember.co.kr/cache/recipe/2020/11/03/21d817c0c05cfab08ee49251f3faeda31.jpg'}, {'step_number': 8, 'description': '화죠유 산초기름을 넣고', 'image_url': 'https://recipe1.ezmember.co.kr/cache/recipe/2020/11/03/021b0de7b36bc2362e111421b3b5f1e41.jpg'}, {'step_number': 9, 'description': '참기름 약간 돌려주고 물기가 잦아들면', 'image_url': 'https://recipe1.ezmember.co.kr/cache/recipe/2020/11/03/3a44243f6b02fb18f83d11ce5a971bd71.jpg'}, {'step_number': 10, 'description': '감자채를 그릇에 담아냅니다', 'image_url': 'https://recipe1.ezmember.co.kr/cache/recipe/2020/11/03/b6385eddbd04aa0ffdd29171e1b3e6a71.jpg'}]"
