index,종류별,상황별,재료별,방법별,글 제목,레시피이름,조회수,조리시간,난이도,인분,재료,소개글,조리순서
27916,메인반찬,일상,해물류,부침,#개인의취향 #쪽파요리 #해물파전만들기 #새우장을넣은해물파전 #부산동래파전따라하기,해물파전,271,15분 이내,아무나,2인분,"[('쪽파', '4줄기'), ('새우장', '5마리'), ('오징어다이스', '3큰술'), ('부침가루', '3큰술'), ('물                                                                                농도에맞게', ''), ('계란', '2개')]",후다닥 만드는 해물파전. 그냥 집에 있는 재료들로 대충 만드는 해물파전이죠. ​ 부산동래파전처럼 계란도 넣어 주고요. 오징어다이스가 있고 새우장의 새우로 하면 맛있게다라는 생각으로 그냥 에라~~~ 그냥 하자!!! ​ 개인의취향이자...후다닥해물파전입니다. ㅋㅋㅋ,"[{'step_number': 1, 'description': '일단, 밀가루나 부침가루를 물에 풀어 줍니다. 재료들을 반죽에 넣고 섞은 후에 부치는 것이 아니고요. 동래파전스타일로다가 ㅋㅋㅋ볼 , 스푼', 'image_url': 'https://recipe1.ezmember.co.kr/cache/recipe/2024/05/26/24e2f6450f340f988629b4d1807557971.jpg'}, {'step_number': 2, 'description': '새우장 5마리, 오징어다이스를 꺼내 놓았습니다.', 'image_url': 'https://recipe1.ezmember.co.kr/cache/recipe/2024/05/26/96b980ca3660205cea3dcc2e9738ae631.jpg'}, {'step_number': 3, 'description': '쪽파도 다듬어 준 후 씻어서는 2등분을 해 주었습니다. 팬이 크면 그냥 사용해도 되지만서도 무쇠팬이 폭이 크지를 않다보니 2등분을 할 수 밖에는 없었죠.도마 , 조리용나이프쪽파 손질법', 'image_url': 'https://recipe1.ezmember.co.kr/cache/recipe/2024/05/26/dac8bcf3982387ae0a985fd185636e781.jpg'}, {'step_number': 4, 'description': '센불에서 완전 뜨겁게 달군 주물팬에 기름을 두바퀴를 둘러 준 후 가장 먼저 쪽파를 올려 주고요~~ 그 위에 새우장의 새우, 오징어다이스를 골고루 올려 줍니다.프라이팬', 'image_url': 'https://recipe1.ezmember.co.kr/cache/recipe/2024/05/26/7054ae4725a2a51b4d1dd51e482d060f1.jpg'}, {'step_number': 5, 'description': '풀어 놓았던 반죽물을 쭈욱 뿌려 줍니다.', 'image_url': 'https://recipe1.ezmember.co.kr/cache/recipe/2024/05/26/729d8d6f7357211979d21a4a71b849051.jpg'}, {'step_number': 6, 'description': '그리고는 계란을 탁 터트려서 가운데에 뿌려 주고는 노른자를 터트려 줍니다. 이렇게 동래파전을 만드시더라구요. ㅋㅋㅋ 수분이 조금은 많은 편이여서 완전히 밑면이 익을때까지 인내심을 가지고 약불에서 익혀 줍니다. 무거운 주물팬을 이리저리 흔들게 되면 부침개가 움직입니다. 그때에 뒤집어서 마쳐 부쳐 주시면 됩니다. 이노무 팬은 와이리 무겁노~~~~뒤집개', 'image_url': 'https://recipe1.ezmember.co.kr/cache/recipe/2024/05/26/93d7f8f646fc2e6c4b8fac4af4ac794c1.jpg'}, {'step_number': 7, 'description': '지각각 따로 노는 해물파전이 완성되었습니다. 아,,,, 무쇠팬을 다루기는 그렇게 녹녹지 않네요. 또 다시 팬을 잘못 산 것인가... 저노무,,,, 스텐팬도 참으로 거시기하구만..... ㅠㅜ 그래도 2/3는 잘 뒤집어졌습니다.접시', 'image_url': 'https://recipe1.ezmember.co.kr/cache/recipe/2024/05/26/53dacd4f0fb0a0b246ef70079c48ed9f1.jpg'}]"
27917,메인반찬,일상,해물류,부침,해물 부추전 해물믹스 부추 부침개 비오는날 부침개 요리 초간장 양념장,부추부침개,204,30분 이내,초급,2인분,"[('부추                                                                                크게 1줌', '150g'), ('냉동 해물믹스', '300g'), ('미림', '2큰술'), ('부침가루', '150ml'), ('물', '100ml'), ('식용유', '넉넉히'), ('간장', '4t'), ('2배사과식초', '2t'), ('고춧가루', '1.5t'), ('깨', '약간')]",냉동 해물믹스와 부추로 만든 간단하게 만드는 해물부추전! 초간장 양념장과 함께 드셔보세요! 비오는날 강추!!,"[{'step_number': 1, 'description': '재료를 준비해주세요.부추 150g 크게 한 줌, 냉동 해물믹스 300g, 부침가루매콤함을 좋아하시면 청양고추를 넣어주셔도 좋아요.', 'image_url': 'https://recipe1.ezmember.co.kr/cache/recipe/2024/06/20/9950078d84a5526366d0acdcf5a7edb91.jpg'}, {'step_number': 2, 'description': '냉동 해물믹스 300g은 찬물로 해동해 주시고 물기를 제거해 주세요.채반', 'image_url': 'https://recipe1.ezmember.co.kr/cache/recipe/2024/06/20/b6d0a76f4d7a615d021c6f9babfdc1b21.jpg'}, {'step_number': 3, 'description': '해동한 해물믹스는 믹싱 볼에 미림 2를 넣어 잠시 두어 비린 맛을 제거해 주세요. 부침가루 반죽에 넣으실 때에는 미림은 버리고 해물만 넣어주어요. 큼지막한 해물은 잘라주세요.믹싱볼 , 주방가위해물은 익으면서 작아지니 너무 잘게 자르지는 않아요.', 'image_url': 'https://recipe1.ezmember.co.kr/cache/recipe/2024/06/20/4798ed4b43f260a0efae8a6a33035c341.jpg'}, {'step_number': 4, 'description': '부추 크게 한 줌 150g은 대부분의 흙을 살살 비벼 씻어주고 잎 부분은 살랑살랑 씻어주세요.너무 세게 비비시면 풋내가 나니 살살 씻어주세요.부추 손질법', 'image_url': 'https://recipe1.ezmember.co.kr/cache/recipe/2024/06/20/9e6bb9828f564043edc4b73bb014b5881.jpg'}, {'step_number': 5, 'description': '물기를 털어내고 3~5cm 정도로 썰어주세요.도마 , 조리용나이프', 'image_url': 'https://recipe1.ezmember.co.kr/cache/recipe/2024/06/20/e86cf2281fa71db350b9dafd2c80be761.jpg'}, {'step_number': 6, 'description': '넉넉한 믹싱 볼에 부침가루 150ml, 물 100ml 정도 넣고 뭉치지 않게 잘 섞어주세요. 반죽은 조금 재료 비중을 높였어요. 부침가루 반죽이 떨어뜨렸을 때 똑. 똑. 똑. 떨어지는 정도로 하시면 되어요. 해물과 부추에서 수분이 나오니 너무 묽지 않게 반죽해 주어요.요리스푼부침가루마다 다를 수 있으니 처음부터 물을 다 넣지 마시고 조금씩 넣어주시는 게 더 좋아요.', 'image_url': 'https://recipe1.ezmember.co.kr/cache/recipe/2024/06/20/09dbca3b75fea88408e5fd2da8a965941.jpg'}, {'step_number': 7, 'description': '부침가루 반죽 물에 해물을 넣어주시고 한번 섞어준 후에 부추를 넣어 가볍게 섞어주세요.부추는 많이 비벼지면 풋내가 나요.', 'image_url': 'https://recipe1.ezmember.co.kr/cache/recipe/2024/06/20/edbded5b076b358d95f5ec71f4047ba91.jpg'}, {'step_number': 8, 'description': '프라이팬에 식용유를 넉넉하게 둘러주고 중불에 노릇하게 부쳐주시면 완성이에요. 18cm 프라이팬으로 4장 만들었어요.프라이팬 , 뒤집개', 'image_url': 'https://recipe1.ezmember.co.kr/cache/recipe/2024/06/20/2a3da3766b27f565160cf7881f0f523d1.jpg'}, {'step_number': 9, 'description': '초간장 양념장을 만들어 주세요.간장 4, 2배 사과식초 2, 고춧가루 1.5, 깨소스볼', 'image_url': 'https://recipe1.ezmember.co.kr/cache/recipe/2024/06/20/23bbb7fbcda41b9ea6fabcdb341c0e591.jpg'}]"
27918,메인반찬,일상,해물류,부침,어묵 요리 어묵으로 핫바 만드는 법,핫바,125,20분 이내,초급,3인분,"[('어묵', '4장'), ('달걀', '4개'), ('당근', '1/4개'), ('대파', '1/3대'), ('애호박', '1/4개'), ('소금', '2꼬집'), ('케첩', '1스푼')]",휴게소 가면 항상 사 먹는 핫바! 원래는 생선 살 반죽으로 만들어야 하지만 집에서 어묵으로 비슷하게 만들 수 있더라구요.,"[{'step_number': 1, 'description': '어묵과 당근, 애호박, 대파를 잘게 썰어 줍니다.도마 , 조리용나이프', 'image_url': 'https://recipe1.ezmember.co.kr/cache/recipe/2024/07/29/b78644d744624f842e7103cd83b7fda41.jpg'}, {'step_number': 2, 'description': '믹서에 어묵, 채소들을 넣고 갈아 줍니다.믹서기', 'image_url': 'https://recipe1.ezmember.co.kr/cache/recipe/2024/07/29/909107a4c9a6f504e4280e91dbb3a9f01.jpg'}, {'step_number': 3, 'description': '달걀 4개, 소금 두 꼬집 넣고 섞어 줍니다.볼 , 수저', 'image_url': 'https://recipe1.ezmember.co.kr/cache/recipe/2024/07/29/872fb536a7b730a2113047179d8ae3061.jpg'}, {'step_number': 4, 'description': '달걀말이 팬에 오일을 두르고 반죽을 넣고 끝부터 돌돌 말아 줍니다.프라이팬 , 뒤집개', 'image_url': 'https://recipe1.ezmember.co.kr/cache/recipe/2024/07/29/5ad3c1a232011a6b1ba10dd13e5832f71.jpg'}, {'step_number': 5, 'description': '꼬치를 끼워주고 케첩 뿌려주면 완성!\n꼬지 , 접시', 'image_url': 'https://recipe1.ezmember.co.kr/cache/recipe/2024/07/29/0c17f97a1ddb9aff6805292a74e2b67c1.jpg'}]"
27919,메인반찬,일상,해물류,부침,아기 유아식 식단 메뉴 오징어 동그랑땡 아기전 만들기,오징어동그랑땡,75,None,None,None,"[('오징어', '1마리'), ('버섯', '1줌'), ('애호박', '1/2개'), ('두부', '1/2모'), ('양파', '1/2개'), ('부침가루', '3T'), ('달걀', '2개')]",여름 제철인 오징어로 뭘 해줄까 고민하다가.​ 22개월 유아식 식단 메뉴로 맛과 영양을 잡은 동그랑땡 아기 반찬으로 만들어봤어요. ​ 오징어의 풍부한 단백질과 다양한 야채의 영양을 함께 먹을 수 있어 유아의 성장에 좋은 영향을 준답니다. 주재료 갈아서 넣어서 부드러운 식감으로 돌아기가 먹어도 충분한 식단 메뉴인데요. ​ 익으면서 나는 고소한 냄새부터가 아이들을 사로 잡았던 리남매의 사랑을 독차지한 인기 많은 메뉴랍니다.​​ ​,"[{'step_number': 1, 'description': '오징어 1마리, 버섯 한줌, 애호박 1/2개, 두부 1/2모, 양파 1/2개, 부침가루 3T, 달걀 2개, 오징어는 고단백 저지방 식품인데요. 아이의 근육 발달과 성장에 도움이 돼요! 또한 타우린 성분이 풍부해서 두되, 시력 보호에도 좋습니다. 오징어와 계란은 알레르기 일으킬 수 있는 재료이므로 아이가 처음 먹는다면 소량으로 시작해요!오징어 손질법', 'image_url': 'https://recipe1.ezmember.co.kr/cache/recipe/2024/08/29/01299c17ace903ee5922d7d6a49a28ed1.jpg'}, {'step_number': 2, 'description': '먼저 아기 동그랑땡에 들어가는 야채 손질해 주는데요. 볶음밥에 들어가는 야채 마냥 작게 잘라서 준비해 주시면 됩니다.도마 , 조리용나이프 , 스텐트레이 , 유리볼애호박 손질법', 'image_url': 'https://recipe1.ezmember.co.kr/cache/recipe/2024/08/29/84ff98e63bc557bb75af37749befac501.jpg'}, {'step_number': 3, 'description': '두부는 으깨서 넣을 텐데요. 물기를 제거한 후 사용해야 반죽이 풀어지지 않습니다. 전 면포까진 사용하진 않고 손으로 으깨서 물기 제거해 줬어요. 그 정도만 해도 충분하더라고요! (귀찮은 거 싫어요! ㅋ)', 'image_url': 'https://recipe1.ezmember.co.kr/cache/recipe/2024/08/29/7baaab387074de8db1aabcc330b3a1e51.jpg'}, {'step_number': 4, 'description': '주재료 내장을 제거하고 흐르는 깨끗한 물에 벅벅 씻고요. 다리에 있는 빨판도 손으로 비벼가며 쓸어주면 떨어집니다. 그리고 나서 믹서기에 넣고 갈아주기! 껍질을 제거해 주면 식감이 더 좋은데요. 전 그냥 다 넣고 갈아줬답니다.믹서기', 'image_url': 'https://recipe1.ezmember.co.kr/cache/recipe/2024/08/29/e57ad76219476bbcaa583e4b2c60fe261.jpg'}, {'step_number': 5, 'description': '곱게 잘 갈린 거 보이시죠? 껍질이 들어가 갈색빛을 띄네요.^^;믹싱볼', 'image_url': 'https://recipe1.ezmember.co.kr/cache/recipe/2024/08/29/ef8e59e42ad7c62ddb7829b2986c71d11.jpg'}, {'step_number': 6, 'description': '모든 재료 한곳에 모아주고요. 부침가루 3번, 달걀 2알을 넣고 반죽을 만들어 줍니다. 부침가루 대신 밀가루, 전분가루 대체 가능하답니다.', 'image_url': 'https://recipe1.ezmember.co.kr/cache/recipe/2024/08/29/cf7269027b5c59bd5d43ea2383c03d651.jpg'}, {'step_number': 7, 'description': '골고루 잘 섞어주시면 되고요. 계란 덕에 점성이 생겨서 따로 모양을 만들어 주지 않아도 아기전 구우면서 부서지지 않습니다.조리용스푼', 'image_url': 'https://recipe1.ezmember.co.kr/cache/recipe/2024/08/29/536f7a0c071752e580216a5b93cac3fe1.jpg'}, {'step_number': 8, 'description': '숟가락으로 한 수저씩 떠서 프라이팬에 구워주기! 익는 냄새가 참 고소했어요 :) 군침 솔솔~ 여기서 조심해야 할 것은 약불에 서서히 구워야 속까지 익어요! 겉이 노릇노릇해지고 속이 익을 때까지 천천히 익혀 주시면 됩니다.프라이팬', 'image_url': 'https://recipe1.ezmember.co.kr/cache/recipe/2024/08/29/cad83cbf5d35894d85272f9502c733e71.jpg'}, {'step_number': 9, 'description': '맛있는 유아식 식단 메뉴 아기전 만들기 완성했습니다. 재료를 한 번에 넣고 반죽해서 굽기만 하면 될 정도로 정말 간편한데요. 영양까지 챙길 수 있는 유아 반찬이라서 자주 챙겨주고 싶은 메뉴랍니다. 야채가 많이 들어갔음에도 불구하고 오징어 식감 때문에 야채 식감이 많이 느껴지지 않았고요. 곱게 갈아서 들어간 주재료 덕에 고기식감도 나서 리남매 더 좋아했어요. 동그랑땡 덕분에 이날의 식판 싹싹 비울 수 있었어요 :)접시', 'image_url': 'https://recipe1.ezmember.co.kr/cache/recipe/2024/08/29/26908bb44c7ccc6cecb23ad8b44b9afe1.jpg'}, {'step_number': 10, 'description': '22개월 유이식 식단 메뉴 아기 오징어 동그랑땡 아기전 만들기 소개해 드렸는데요. 영양가 높고 손쉽게 하나씩 집어먹을 수 있는 핑거푸드랍니다. 건강한 성장과 발달을 돕는 것뿐만 아니라 맛까지 있는 식단이라서 엄마가 먹으라고 애쓰지 않아도 잘 먹어 주니 더 고맙더라고요. 생물 오징어로 만들어야 냄새나지 않고 식감도 더 좋을 텐데요! 제철 지나기 전에 동그랑땡 한번 만들어 보세요 :)유아식기', 'image_url': 'https://recipe1.ezmember.co.kr/cache/recipe/2024/08/29/1b234c86139fabad4dd499971f21d03d1.jpg'}]"
27920,메인반찬,일상,해물류,부침,동태전,동태전,16,20분 이내,초급,2인분,"[('동태포', '2인분'), ('계란', '2개'), ('밀가루', '3스푼'), ('소금', '약간만'), ('후춧가루', '약간만')]",가족이 모두 좋아하는 동태전 냉동실에 보관해둔 동태포를 해동한후 밑간을 해주고 계란옷을 입혀서 동태전을 맛있게 부쳐주세요.,"[{'step_number': 1, 'description': '동태전을 소개합니다.', 'image_url': 'https://recipe1.ezmember.co.kr/cache/recipe/2024/09/19/a94135512678636ac4df9bccde7844081.jpg'}, {'step_number': 2, 'description': '동태포를 소금과 후춧가루로 밑간을 잠시 해둡니다. 키친타올을 이용해서 물기를 제거해주세요.쟁반 , 키친타올', 'image_url': 'https://recipe1.ezmember.co.kr/cache/recipe/2024/09/19/bbe04d06a5ac6d6d1a1f3c9063b8ac211.jpg'}, {'step_number': 3, 'description': '계란2개와 소금을 약간만 넣어서 젓가락을 이용해서 잘 풀어서 준비합니다. 밑간해둔 동태포를 밀가루를 앞뒤로 살짝만 묻혀주세요.접시 , 볼 , 요리젓가락', 'image_url': 'https://recipe1.ezmember.co.kr/cache/recipe/2024/09/19/a0b449ee713687bd19280800251aa7c91.jpg'}, {'step_number': 4, 'description': '계란옷을 입혀준후 기름을 넉넉하게 두른후 앞뒤로 노릇노릇하게 구워주세요.프라이팬 , 뒤집개', 'image_url': 'https://recipe1.ezmember.co.kr/cache/recipe/2024/09/19/a766c7c25ea47bbb9bc60421c54b91301.jpg'}, {'step_number': 5, 'description': '예쁜사각 접시에 동태전을 살포시 올려주세요.', 'image_url': 'https://recipe1.ezmember.co.kr/cache/recipe/2024/09/19/161a3efb26b1e76a61ba2d0b4ae7bbb01.jpg'}, {'step_number': 6, 'description': '맛있는 동태전이 완성이 되었습니다.', 'image_url': 'https://recipe1.ezmember.co.kr/cache/recipe/2024/09/19/14e5f6450414713ecc1a99062c4ed6941.jpg'}]"
27921,메인반찬,일상,해물류,부침,달래새우전! (봄 제철요리),달래새우전,"2,097",60분 이내,아무나,3인분,"[('달래', '85g'), ('새우살', '20마리'), ('홍고추', '1개'), ('유기농 우리밀', '1컵'), ('튀김가루', '2큰술'), ('물                                                                                가감', '1컵'), ('청주', '1/2작은술'), ('소금', '조금'), ('후춧가루', '조금'), ('오일', '약간')]","시장에 들렀다가 맛난 봄 제철 야채들이 가득이라
장바구니에 한가득 담아서 맛난 봄 야채 요리들을 만들어 먹었었어요.","[{'step_number': 1, 'description': '달래는 불순물을 제거하고 흐르는 물에 씻어 물기를 제거하고,\n홍고추는 반으로 자라 씨를 제거하고 잘게 다져주세요.', 'image_url': 'https://recipe1.ezmember.co.kr/cache/recipe/2017/03/24/8c0f3d05dab96e85e360c41ed159cc0c1.jpg'}, {'step_number': 2, 'description': '물기 뺀 달래는 손가락 두 마디 정도로 잘라주세요.', 'image_url': 'https://recipe1.ezmember.co.kr/cache/recipe/2017/03/24/b3882133dcbe67b89e91a78da638856a1.jpg'}, {'step_number': 3, 'description': '새우살은 다져 청주 1/2작은술을 뿌려준 뒤,\n소금과 후춧가루를 넣고 섞어 밑간해주세요.', 'image_url': 'https://recipe1.ezmember.co.kr/cache/recipe/2017/03/24/f05951d90475c93f7f69e52ea1c629551.jpg'}, {'step_number': 4, 'description': '볼에 밀가루, 튀김가루, 물을 넣고 섞어준 뒤\n달래, 새우, 홍고추를 넣고 섞어주세요.\n소금으로 간도 조금!', 'image_url': 'https://recipe1.ezmember.co.kr/cache/recipe/2017/03/24/f93a6a3a45ef2b34c2fc890641d6f4381.jpg'}, {'step_number': 5, 'description': '달구어진 팬에 오일을 두르고, 달래새우전 반죽을 숟가락으로 떠 넣고,', 'image_url': 'https://recipe1.ezmember.co.kr/cache/recipe/2017/03/24/b0b7dd53de366118f7e6300f8ac5f3d71.jpg'}, {'step_number': 6, 'description': '앞뒤로 맛나게 구워주세요.', 'image_url': 'https://recipe1.ezmember.co.kr/cache/recipe/2017/03/24/bae362eb04cce49b82a105a5a84019951.jpg'}]"
27922,메인반찬,일상,해물류,부침,농심 건강한 쌀 부침가루로 만든 해물 부추전,해물부추전,"3,045",30분 이내,아무나,5인분,"[('쌀부침가루                                                                                450g', '1봉지'), ('식용류', '6스푼'), ('부추', '적당량'), ('오징어', '1마리'), ('새우', '1봉지'), ('붉은고추', '1개'), ('계란', '4개'), ('물', '500ml')]","농심에서 건강한 쌀 부침가루로 해물 부추전을 만들어 볼까 해요.
오징어와 새우와 부추를 넣고 전을 해 먹으면 얼마나 맛있을까 하고
 전을 만들었는데 정말 맛있더라고요. 쫀득한 식감도 좋고 앉은 자리에서 
후딱 먹어 치웠어요. 어떻게 만들었는지 한번 보시겠어요.","[{'step_number': 1, 'description': '일단 오징어 한 마리를 구입했어요. \n전에는 역시 오징어가 들어가야겠죠.', 'image_url': 'https://recipe1.ezmember.co.kr/cache/recipe/2016/07/01/7aa814a5a41103c1e05ef770e7999a521.jpg'}, {'step_number': 2, 'description': '오징어를 깨끗이 손질하여 총총 썰어서 준비했어요.오징어 손질법 레시피', 'image_url': 'https://recipe1.ezmember.co.kr/cache/recipe/2016/07/01/a2273f7b6783be7d679dd41deb5d96031.jpg'}, {'step_number': 3, 'description': '새우도 1봉지 준비했어요.', 'image_url': 'https://recipe1.ezmember.co.kr/cache/recipe/2016/07/01/9f90aaf3940c1948ba9100511542c2a61.jpg'}, {'step_number': 4, 'description': '전에는 부추가 들어가야겠죠. 그래야 맛있거든요.\n쪽파를 넣어도 맛있지만 요즘 좀 비싸요.\n그래서 부추를 듬뿍 넣기로 했답니다.', 'image_url': 'https://recipe1.ezmember.co.kr/cache/recipe/2016/07/01/87a70cd982d82e2631448b2fc33cb0451.jpg'}, {'step_number': 5, 'description': '그리고 농심 건강한 쌀 부침가루 1봉지(450g)를 구입하여 준비했어요,', 'image_url': 'https://recipe1.ezmember.co.kr/cache/recipe/2016/07/01/a515efa8676a5120b74183b77737d7191.jpg'}, {'step_number': 6, 'description': '물은 500ml을 준비해 놓고요.', 'image_url': 'https://recipe1.ezmember.co.kr/cache/recipe/2016/07/01/ece928d0d4105ee1cc5dcf66dc47ae411.jpg'}, {'step_number': 7, 'description': '조금씩 부어가며 반죽을 해주시면 돼요.', 'image_url': 'https://recipe1.ezmember.co.kr/cache/recipe/2016/07/01/9fb1284295e0ac5b94b4e704f1ac778e1.jpg'}, {'step_number': 8, 'description': '반죽에 오징어 썰어 놓은 것과 부추 썰어 놓은 것을 넣어서 섞어주었어요,', 'image_url': 'https://recipe1.ezmember.co.kr/cache/recipe/2016/07/01/dc20ecfc11eacdea23360fc6add0915b1.jpg'}, {'step_number': 9, 'description': '준비해 놓은 새우도 넣어 섞어 주었어요.\n반죽이 완료되었어요. 아무것도 안 넣어도 간이 딱 맞아요.', 'image_url': 'https://recipe1.ezmember.co.kr/cache/recipe/2016/07/01/4ca8e5ce152b6f42b00b59e2e7bff2dc1.jpg'}, {'step_number': 10, 'description': '팬을 준비하고 식용유를 부어주세요.', 'image_url': 'https://recipe1.ezmember.co.kr/cache/recipe/2016/07/01/1874ec260c5492d3ddb6160c2eed8d611.jpg'}, {'step_number': 11, 'description': '밑에 테두리 쪽이 노릇노릇해지면 뒤집어주세요.', 'image_url': 'https://recipe1.ezmember.co.kr/cache/recipe/2016/07/01/8c3b99fb53dbbc1a1e07b2a1aab284091.jpg'}, {'step_number': 12, 'description': '식으면 맛이 없으니까 두꺼운 서빙 팬에 놓아있어요.', 'image_url': 'https://recipe1.ezmember.co.kr/cache/recipe/2016/07/01/2924ad4429448a482c5a67526ca89f4a1.jpg'}, {'step_number': 13, 'description': '그리고 요번엔 계란을 위해 올려 보았어요.\n더 맛있다고 하네요. 그래서 저희 식구 모두가 맛있게 \n해물 부추전을 하나도 남김없이 다 먹어 버려어요.\n한 6쪽 정도 되었어요.~~^^', 'image_url': 'https://recipe1.ezmember.co.kr/cache/recipe/2016/07/01/195a20c21c1ab7e6bec93f53949dc4f31.jpg'}]"
