index,종류별,상황별,재료별,방법별,글 제목,레시피이름,조회수,조리시간,난이도,인분,재료,소개글,조리순서
8795,밑반찬,일상,달걀/유제품,찜,백종원표 폭탄 달걀찜,폭탄달걀찜,"21,726",15분 이내,초급,3인분,"[('달걀', '6알'), ('물', '1/3컵'), ('대파', '약간'), ('소금', '1/2큰술'), ('황설탕', '약간'), ('참기름', '약간'), ('통깨', '약간')]","오늘은 식당에서 많이 볼 수 있는 폭탄 달걀찜입니다. 어떤 식당에서는 서비스 메뉴로 주지만, 돈을 주고 사먹어도 아깝지 않은 메뉴인데요. 집에서 한번 따라 만들어 보았습니다.","[{'step_number': 1, 'description': '계란은 뚝배기에 바로 붓지 말고 따로 깨트리세요. 그래야 달걀 껍질이 들어가도 빼기도 좋구요. 알끈은 제거합니다.', 'image_url': 'https://recipe1.ezmember.co.kr/cache/recipe/2015/08/28/3f9f69ffe8ed45bf0839760f1fc481e11.jpg'}, {'step_number': 2, 'description': '풀어둔 달걀에 물 3분의 1컵을 넣어줍니다.', 'image_url': 'https://recipe1.ezmember.co.kr/cache/recipe/2015/08/28/632ced633d1048bb8f5002d5c12271f41.jpg'}, {'step_number': 3, 'description': '소금 3분의 1큰술과 황설탕 약간을 넣어줍니다. 계란에는 설탕이 맛을 부드럽게 해줘서 약간 넣어주는 것이 좋습니다.', 'image_url': 'https://recipe1.ezmember.co.kr/cache/recipe/2015/08/28/09bf383c50d7d968140a97341cead95c1.jpg'}, {'step_number': 4, 'description': '소금 대신 새우젓을 넣으려면 다져서 넣어주세요.', 'image_url': 'https://recipe1.ezmember.co.kr/cache/recipe/2015/08/28/dbb05854af5d8a5298cd97e42eb9152e1.jpg'}, {'step_number': 5, 'description': '대파도 송송 썰어주시구요.', 'image_url': 'https://recipe1.ezmember.co.kr/cache/recipe/2015/08/28/efaf8819db6b8926ba98d92aeca2aa0d1.jpg'}, {'step_number': 6, 'description': '달걀 양, 불조절, 뚜껑을 언제 닫고 언제 여느냐에 따라 실패없는 폭탄 달걀찜을 만들 수가 있는데요. 먼저 뚝배기에 달걀물이 80 % 채워져야 잘 부풀어 오르는 폭탄 달걀찜이 됩니다. 양이 적으면 잘 부풀어오르지 않는답니다. 저보다 뚝배기 높이가 1cm 정도 더 달걀양이 많으면 더욱 좋겠네요. 아무래도 계란이 조금 작은 사이즈가 아니었나 싶네요. 그럼 더 많이 부풀어올랐을 듯하네요. 그리고 계속 스푼으로 저어줍니다. 그러면 계란이 뽀얗게 익으면서 덩어리가 생긴답니다. 그래서 80-90% 정도 익도록 합니다.', 'image_url': 'https://recipe1.ezmember.co.kr/cache/recipe/2015/08/28/c7791975ff31d18e9cf15a483c1ab78d1.jpg'}, {'step_number': 7, 'description': '그러면 오목한 뚜껑을 만들어서 덮어줍니다. 전 뚝배기 지름이 맞는 국그릇을 사용했습니다. 뚜껑이 평평하면 부풀어 오를 수가 없지요. 불은 약불로 줄여주시구요.', 'image_url': 'https://recipe1.ezmember.co.kr/cache/recipe/2015/08/28/8b4efab5354fbc786efad6f0d0b595721.jpg'}, {'step_number': 8, 'description': '3-6분 정도 기다리시면 되는데, 일단 뚝배기 아래로 요렇게 거품이 나면서 김이 흐르기 시작합니다. 치이하고 소리도 나고요. 그리고 약간의 탄내가 나고요.', 'image_url': 'https://recipe1.ezmember.co.kr/cache/recipe/2015/08/28/d4992a3355e7fccf8b2613ef2a9494ac1.jpg'}, {'step_number': 9, 'description': '계란이 부풀어 올랐지요?', 'image_url': 'https://recipe1.ezmember.co.kr/cache/recipe/2015/08/28/f3b03ada91b168bd80974f43bb12d6cf1.jpg'}, {'step_number': 10, 'description': '완성된 달걀찜에 대파, 통깨, 참기름을 약간 뿌려줍니다.', 'image_url': 'https://recipe1.ezmember.co.kr/cache/recipe/2015/08/28/545442183710c7c921dc50e0678dce081.jpg'}, {'step_number': 11, 'description': '속까지 잘 익었지요? 보들보들한 그 맛이 예술입니다. 집에서도 식당 메뉴가 쉽게 만들어지는 것이 신기하지 않나요?', 'image_url': 'https://recipe1.ezmember.co.kr/cache/recipe/2015/08/28/5123885d4dbe9fbfe86b64fbd28c786e1.jpg'}]"
8796,밑반찬,일상,달걀/유제품,찜,#골뱅이통조림을 넣어 만든 #폭탄달걀찜만들기 #집에서 뚝배기로 만드는 폭탄달걀찜!!!,폭탄달걀찜,"1,726",30분 이내,아무나,2인분,"[('골뱅이통조림', '1캔'), ('달걀', '5개'), ('소금', '1작은술')]",뱅이통조림이 보여서는 오독오독 씹히는 맛이 좋겠다고 생각이 들어 골뱅이 폭탄달걀찜을 만들었습니다. 뚜껑없는 뚝배기에 즉석에서 만든 뚜껑을 덮어서 만드는 폭탄달걀찜이죠,"[{'step_number': 1, 'description': '통조림 골뱅이는 잘게 조사주시고요. 달걀 5개와 소금을 넣어 주시고 잘 풀어 줍니다. 통조림골뱅이의 물은 깨끗하게 버려 주시고요. 골뱅이만 사용하시는 것이 좋아요. 국물은 비린맛도 나기도 하지만 지나치게 조미가 되어 있기 때문에요. 그래서 간은 소금 조금만 넣어 주시면 됩니다. 골뱅이에도 간이 있으니까요.', 'image_url': 'https://recipe1.ezmember.co.kr/cache/recipe/2018/01/26/9314420a2ca7d45871af7642fff5bc6f1.jpg'}, {'step_number': 2, 'description': '이제 가스불을 중불로 하시고는 숟가락을 이용해서 계속해서 눌러 붙지 않도록 저어주세요.', 'image_url': 'https://recipe1.ezmember.co.kr/cache/recipe/2018/01/26/5e6b83d0a9ff5dc395306274a1379cfe1.jpg'}, {'step_number': 3, 'description': '중불에서 계속 저어서 끓여주면 이렇게 몽글몽글해 집니다. 몽글몽글하게 뭉쳐지게 되면 이제 아주 불을 약하게 하시고는 뚜껑을 덮어 주세요.', 'image_url': 'https://recipe1.ezmember.co.kr/cache/recipe/2018/01/26/08bb5db004a79297a34be72424eeb82f1.jpg'}, {'step_number': 4, 'description': '뚝배기에 뚜껑이 없으시면 요런 방법을 사용하셔도 좋아요. 거름망이나 체에 쿠킹호일을 감싸 주면 충분히 뚜껑의 역할을 하지요. 거기에 손잡이도 있어서 열기에도 편하답니다. 저는 달걀찜을 할때에 요 방법을 사용해요.', 'image_url': 'https://recipe1.ezmember.co.kr/cache/recipe/2018/01/26/01e029e979081ff7ce5994de8f6e32bd1.jpg'}, {'step_number': 5, 'description': '호일은 안쪽과 바깥쪽 모두에 감싸주었어요. 그래야 공기와 수증기가 빠져나오지 않고 잘 부풀어 오를 수 있으니까요. 이렇게 아주 약한불에서 끓여주시다가 살짝 흘러넘칠때쯤에 불을 끄시고 뚜껑을 그대로 닫고는 3분정도 뜸을 들여 주시면 폭탄달걀찜을 만드실 수 있지요. 중간에 뚜껑을 열지 않으시는 것이 폭탄달걀찜의 성공확률이 높습니다.', 'image_url': 'https://recipe1.ezmember.co.kr/cache/recipe/2018/01/26/4aefab1b6bad862e21907818a819992c1.jpg'}, {'step_number': 6, 'description': '오독오독 씹히는 골뱅이의 식감이 좋은 골뱅이달걀찜 완성입니다.', 'image_url': 'https://recipe1.ezmember.co.kr/cache/recipe/2018/01/26/4b90d73189be229bee22c0afbfbaf42e1.jpg'}]"
8797,밑반찬,일상,달걀/유제품,찜,초간단 계란찜♡,계란찜,"3,320",30분 이내,아무나,2인분,"[('달걀', '3개'), ('양파', '1/4개'), ('브로콜리', '2송이'), ('연두', '1큰술')]","바쁜아침 초간단 계란찜으로 든든하게 한끼 해결해보세요^^
간혹 아이반찬으로 고민하시는 분들도 초간단 레시피라면 문제없이 뚝딱 만드실 수 있답니다.
브로콜리와 양파가 들어가 색도 곱고 영양만점이예요♡","[{'step_number': 1, 'description': '분량의 양파를 다져주시고, 식촛물에 담구어 깨끗이 씻은 브로콜리 꽃부분을 잘라주시고 달걀 3개를 깨트려 휘휘 저어주세요.\n전자렌지용 그릇을 이용해주세요!!!', 'image_url': 'https://recipe1.ezmember.co.kr/cache/recipe/2019/03/05/0d274f764a4803d582ca8f647c49a32e1.jpg'}, {'step_number': 2, 'description': '연두를 1큰술 넣어주세요.\n연두를 자주 애용하는것은 아니지만, 요 계란찜에 연두로 간을 해주시면 참 맛나더라구요^^\n개인마다 입맛의 차이가 있을수있으니 소금간을 해주셔도 무관 합니다.', 'image_url': 'https://recipe1.ezmember.co.kr/cache/recipe/2019/03/05/ac8c19b04387541e89b879fd970cb87d1.jpg'}, {'step_number': 3, 'description': '계란양과 동량으로 물을 넣어주시고 잘섞어주세요.', 'image_url': 'https://recipe1.ezmember.co.kr/cache/recipe/2019/03/05/313ff242458cb9d942cfb62427e500d91.jpg'}, {'step_number': 4, 'description': '전자렌지에서 8~9분정도 돌려주시면 초간단 계란찜 완성♡\n저는 오븐겸용 레인지를 사용하고있어 시간이 조금 더걸리는것 같아요.\n성능이 좋은 일반전자레인지의 경우 6-7분정도로 요리해보신후~ 적정선을 찾으시는게 좋을것같아용♡전자레인지', 'image_url': 'https://recipe1.ezmember.co.kr/cache/recipe/2019/03/05/992598610c5b6dfa042cd3e53fec078a1.jpg'}]"
8798,밑반찬,일상,달걀/유제품,찜,초간단시금치계란찜♡,시금치계란찜,"2,066",30분 이내,아무나,2인분,"[('계란', '3개'), ('시금치', '1포기'), ('양파', '1/4개'), ('연두', '1큰술')]","브로콜리계란찜과 같은방법으로 만드는 초간단 시금치 계란찜이예요~^^
전 요걸 더 자주해먹는편이예요.
아침에 간단히 만들어 밥에비벼주면 아이 아침밥으로 딱이예요~♡","[{'step_number': 1, 'description': '양파를다져주세요.', 'image_url': 'https://recipe1.ezmember.co.kr/cache/recipe/2019/03/22/81b5eb645993a43a2de6148af11499431.jpg'}, {'step_number': 2, 'description': '시금치를 깨끗이 씻어 썰어주세요.', 'image_url': 'https://recipe1.ezmember.co.kr/cache/recipe/2019/03/22/b866c2afe52a0cb4a4c05298b85982631.jpg'}, {'step_number': 3, 'description': '준비된 그릇에 계란 세개를 깨주세요.', 'image_url': 'https://recipe1.ezmember.co.kr/cache/recipe/2019/03/22/e7e82fdfb1e6491381617178f298be931.jpg'}, {'step_number': 4, 'description': '계란을풀어주시고, 물을 반컵넣어주시고 연두한큰술을 넉넉하게 넣어주세요~^^', 'image_url': 'https://recipe1.ezmember.co.kr/cache/recipe/2019/03/22/e9e69bda945163c3b7f05a3b283d3df41.jpg'}, {'step_number': 5, 'description': '전자렌지에 6~7분 돌려주세요.\n전자렌지 기능이 좋으신분들은 시간을 조금 조절해주시면 좋아요^^전자레인지', 'image_url': 'https://recipe1.ezmember.co.kr/cache/recipe/2019/03/22/1719a476b643a9b6218ecaf8447061cf1.jpg'}]"
8799,밑반찬,일상,달걀/유제품,찜,이탈리아 계란찜,계란찜,"4,598",30분 이내,초급,4인분,"[('달걀', '6개'), ('올리브유', '1큰술'), ('베이컨                                                                                6~7장', '120g'), ('간마늘', '1스푼'), ('대파', '4대'), ('시금치', '120g'), ('버터', '약간'), ('소금', '약간'), ('후추', '약간')]",이탈리아식 계란찜입니다. 냉장고 속 자투리 재료로 만들면 좋지요.,"[{'step_number': 1, 'description': '계란은 볼에 풀어서 소금,후추로 간하여 주세요.', 'image_url': 'https://recipe1.ezmember.co.kr/cache/recipe/2015/08/28/3c37aa1b94ddc985492d14ce86bf61191.jpg'}, {'step_number': 2, 'description': '대파는 반으로 갈라 얇게 송송 썰어주시구요.', 'image_url': 'https://recipe1.ezmember.co.kr/cache/recipe/2015/08/28/b864a5b68404d770999851090c8c48011.jpg'}, {'step_number': 3, 'description': '시금치는 깨끗이 씻어 4cm 정도로 잘라주었습니다. 베이컨은 사방 1cm로 썰어 준비했구요.', 'image_url': 'https://recipe1.ezmember.co.kr/cache/recipe/2015/08/28/5e8f4316ffa3d517a924b4b8b4b82eed1.jpg'}, {'step_number': 4, 'description': '팬에 올리브유를 살짝 두르시고 베이컨을 노릇하게 볶아주다가 대파와 간마늘을 더하여 같이 볶습니다.', 'image_url': 'https://recipe1.ezmember.co.kr/cache/recipe/2015/08/28/4966324d7f6ad7f2695da10be98fcaa81.jpg'}, {'step_number': 5, 'description': '대파가 살짝 숨이 죽으면 시금치도 같이 넣고 소금,후추 살짝하여 복아줍니다. 대략 5분정도면 완성이지요.', 'image_url': 'https://recipe1.ezmember.co.kr/cache/recipe/2015/08/28/10b47a31dd94bc8031e7162968b1507e1.jpg'}, {'step_number': 6, 'description': '오븐을 180도로 예열하고 오븐그릇에 버터를 바르고 볶은 시금치를 부어줍니다. 마지막으로 계란을 부어줍니다. 180도 오븐에서 25분 돌려줍니다.오븐', 'image_url': 'https://recipe1.ezmember.co.kr/cache/recipe/2015/08/28/d89d2457bf2a2455202f45b01946c19b1.jpg'}, {'step_number': 7, 'description': '치즈는 계란에 같이 넣어주셔도 되구요. 저는 완성후에 뿌려먹는걸로~~', 'image_url': 'https://recipe1.ezmember.co.kr/cache/recipe/2015/08/28/1ed026d094f4eab894b4b443edb5fbe01.jpg'}]"
8800,밑반찬,일상,달걀/유제품,찜,계란찜,계란찜,"11,016",15분 이내,아무나,2인분,"[('계란', '4개'), ('양파', '1/4개'), ('대파', '1/2대'), ('마늘', '1알'), ('물', '400cc'), ('새우젓', '1T')]",계란찜은 서비스 술안주로도 많이 나오는 메뉴이기도 하고 밥상에도 자주 오르는 단골메뉴기도 하죠~~ 특히 매운 음식을 먹을때 많이 생각나는것 같아요~~ 전 새우젓을 넣어서 해먹는데요. 그냥 소금으로 간할때보다 훨씬 맛있답니당~~ 꼭 다진 마늘을 넣어주셔야 새우의 비릿한 맛이 제거되어 더욱 맛깔스러운 계란찜을 즐길수 있어요.,"[{'step_number': 1, 'description': '대파는 둥글게 송송 썰어주세요.', 'image_url': 'https://recipe1.ezmember.co.kr/cache/recipe/2015/09/10/de047c362dc4a5226ba8d649d215ea0e1.jpg'}, {'step_number': 2, 'description': '양파는 잘게 썰어주시구요.', 'image_url': 'https://recipe1.ezmember.co.kr/cache/recipe/2015/09/10/7e5b438e5e384ba249dcfcfcb6c9a7a71.jpg'}, {'step_number': 3, 'description': '마늘은 칼등으로 눌러준뒤 칼 뒷부분으로 콩콩 찢어주세요.', 'image_url': 'https://recipe1.ezmember.co.kr/cache/recipe/2015/09/10/8b6f6433803fb6810ea3d8a9d23a03f91.jpg'}, {'step_number': 4, 'description': '계란 4개를 알끈을 제거 하고 풀어준 뒤 물을 넣어주세요.', 'image_url': 'https://recipe1.ezmember.co.kr/cache/recipe/2015/09/10/357c58fd1a52ef43d3370f9e4bb5bb6f1.jpg'}, {'step_number': 5, 'description': '새우젓을 넣어 잘 풀어지게 저어주세요.', 'image_url': 'https://recipe1.ezmember.co.kr/cache/recipe/2015/09/10/5ce17a3cd42622858cd4a3dcb90e739c1.jpg'}, {'step_number': 6, 'description': '양파와 대파, 마늘을 넣어주세요.', 'image_url': 'https://recipe1.ezmember.co.kr/cache/recipe/2015/09/10/dfb407473d27fbff6971104903b000c91.jpg'}, {'step_number': 7, 'description': '새우젓이 아래쪽에 가라않지 않게 잘 저어준뒤 가스불 위에 올려 중불로 끓여주세요. 냄비 밑바닥이 타지않게 중간 중간 저어주면서 끓여주세요. 팔팔 끓기 시작하면 약한불로 낮워서 끓여주세요.', 'image_url': 'https://recipe1.ezmember.co.kr/cache/recipe/2015/09/10/184c6e16b96d0fb66086fbe00daf1d131.jpg'}]"
8801,밑반찬,일상,달걀/유제품,찜,보들보들 일식 달걀찜,None,"16,718",None,None,None,[],,[]
8802,밑반찬,일상,달걀/유제품,찜,달걀찜,None,"4,439",None,None,None,[],,[]
8803,밑반찬,일상,달걀/유제품,찜,보들보들 뚝배기 계란찜,뚝배기계란찜,"16,644",30분 이내,초급,2인분,"[('계란', '2개'), ('다시마 육수                                                                                or 물', '1/3~1/2C'), ('참치액', '1/2t'), ('소금', '1꼬집'), ('설탕', '1꼬집'), ('참기름', '1t'), ('대파', '1/2T')]","보들보들 뚝배기 계란찜 사실 요 계란찜이 잘안되다고들 하세요. 식당에서 나오듯 보글보글, 보들보들한 계란찜 만들어 볼게요.","[{'step_number': 1, 'description': '계란 2개 + 다시마 우린 육수, 없으면 생수 1/3-1/2C 아주 보드라운 계란찜은 계란과 물의 양이 동량으로 거의 물 반컵을 섞어주고 보드라운 계란찜을 원하시면 1/3C 정도 섞어주세요. 제가 자주 사용하는 참치액 1/2t, 소금 한꼬집, 조미료 역화로 설탕 한꼬집 넣어 간해주세요. 뚝배기에 부은 후 불을 킵니다.', 'image_url': 'https://recipe1.ezmember.co.kr/cache/recipe/2015/05/26/ff8c765dad33815ae48159df51e5026c1.jpg'}, {'step_number': 2, 'description': '처음엔 센불에 올려놓고 숟가락으로 구석구석 저어줍니다. 밑이 눌거든요. 뭔가 멍울멍울한게 보이는듯 하면 중불이하로 낮추고 계속 저어줍니다.', 'image_url': 'https://recipe1.ezmember.co.kr/cache/recipe/2015/05/26/3a17f5da49d62e2487f26b8bcc2959281.jpg'}, {'step_number': 3, 'description': '참기름 1t 정도 섞어 휘저은 후, 송송 썬 대파 1/2T 넣은 후 불끄고 뚜껃 닫아 뜸 들여주면 완성입니다.', 'image_url': 'https://recipe1.ezmember.co.kr/cache/recipe/2015/05/26/b3868c8954930da76967fe385014bf8e1.jpg'}]"
8804,밑반찬,일상,달걀/유제품,찜,버섯 달걀찜,버섯달걀찜,"2,379",30분 이내,초급,3인분,"[('달걀', '4개'), ('느타리버섯', '1줌'), ('팽이버섯', '1/2줌'), ('멸치', '10~15마리'), ('물', '200ml'), ('대파', ''), ('당근', ''), ('참기름', '1스푼'), ('참치액젓', '1스푼'), ('소금', '1티스푼')]",버섯을 넣어 영양가를 높인 버섯 달걀찜을 소개해요.,"[{'step_number': 1, 'description': '냄비에 물과 멸치를 넣고 국물을 냅니다. \n국물이 끓는 동안 버섯은 깨끗이 씻어 칼로 3등분 후 자르지 않고 손으로 얇게 찢어내세요.', 'image_url': 'https://recipe1.ezmember.co.kr/cache/recipe/2015/05/08/561cb931d5675c720c7bf65e914334601.jpg'}, {'step_number': 2, 'description': '달걀에 소금을 넣어 풀은 후, 체에 걸러내고 국물이 끓어 오르면 달걀을 넣고 중불로 조절해 주세요.', 'image_url': 'https://recipe1.ezmember.co.kr/cache/recipe/2015/05/08/8b21e05d5dfdd5e5a594856b5830d40e1.jpg'}, {'step_number': 3, 'description': '참치액젓과 참기름을 넣은 후 수저로 3번 정도 저어주세요.\n달걀이 살짝 몽글몽글해지면 버섯을 넣고 기호에 따라 쫑쫑 썬 대파나 잘게 썬 당근을 넣으면 완성된 비주얼이 예쁘고 영양가가 더 높아져요', 'image_url': 'https://recipe1.ezmember.co.kr/cache/recipe/2015/05/08/cf8c5296cd7ea86a0a7b1b9b83497cd31.jpg'}, {'step_number': 4, 'description': '냄비 뚜껑을 닫은 후, 약불로 조절해서 3~4분간 익혀주세요.', 'image_url': 'https://recipe1.ezmember.co.kr/cache/recipe/2015/05/08/a3bf3fe65791186cc949e551ce0ef9e31.jpg'}]"
8805,밑반찬,일상,달걀/유제품,찜,밥도둑~ 명란계란찜 - 딸에게#,None,"26,672",None,None,None,[],,[]
8806,밑반찬,일상,달걀/유제품,찜,계란찜,계란찜,"53,345",15분 이내,초급,4인분,"[('계란', '5개'), ('쪽파', '2개'), ('미림', '2큰술'), ('젓갈', '2큰술'), ('우유', '1컵')]",아이들 반찬으로 안성맞춤인 간단하고 부드러운 계란찜입니다.,"[{'step_number': 1, 'description': '뚝배기에 계란을 넣어주세요. 계란찜을 하는 데 있어서 냄비도 참 중요한 것 같아요. 요 뚝배기 하나면 눌지 않고 맛있는 계란찜을 완성할 수 있지요. 이 뚝배기로 전자렌지에 돌려도 뚝딱 완성할 수 있지만 전 오늘은 가스불에서 완성해 보았답니다.', 'image_url': 'https://recipe1.ezmember.co.kr/cache/recipe/2015/06/04/e9c4383ca3c18916ef6ab49aad8426ab1.jpg'}, {'step_number': 2, 'description': '쪽파를 2개 총총 다져주었어요. 파 대신 당근을 넣어도 참 맛있지요. 전 오늘은 쪽파를 다져서 넣어주고 우유 한컵을 부어주었어요. 부드러운 계란찜을 만들기 위해서였지요.', 'image_url': 'https://recipe1.ezmember.co.kr/cache/recipe/2015/06/04/9308cdb71501986f6275baa64e4f3dc71.jpg'}, {'step_number': 3, 'description': '미림 2스푼에 젓갈 2스푼 넣어주세요. 간이 딱 맞아요. 조금 싱겁다 싶으시면 반스푼더 넣어주세요. 젓갈은 새우젓갈을 넣으면 최고인데 저는 오늘 멸치액젓으로 대신해 줬어요.', 'image_url': 'https://recipe1.ezmember.co.kr/cache/recipe/2015/06/04/36727bd2f03f6f1d04e7a725b9a5411a1.jpg'}, {'step_number': 4, 'description': '이제 잘 저어서 불에 은근하게 올려주었어요. 5분에서 10분 내외로 완성된답니다. 중간에 살짝 칼집처럼 수저를 열십자로 확인해 보세요. 그럼 더 빨리 익는 것 같아요.', 'image_url': 'https://recipe1.ezmember.co.kr/cache/recipe/2015/06/04/e7e5260b8d6a08d35b7de12c118c427e1.jpg'}]"
8807,밑반찬,일상,달걀/유제품,찜,새우계란찜,새우계란찜,"14,635",15분 이내,초급,2인분,"[('순두부', ''), ('새우', '3~4마리'), ('계란', '2개'), ('물', ''), ('양파', ''), ('당근', '')]",영양만점!! 맛있는 새우계란찜. 찌개나 국이 없을 때 밥과 반찬으로는 조금 퍽퍽할 수 있잖아요~ 그럴 때 반찬 겸 국물 대용으로 계란찜을 해주시면 좋습니다. 영양 가득 순두부와 새우를 넣은 보들보들~ 따끈따끈~ 계란찜!,"[{'step_number': 1, 'description': '새우는 머리를 떼고 몸통 부분의 껍질을 벗겨줍니다. 그리고 새우 등쪽과 배쪽에 있는 내장을 제거해주세요. 이쑤시개로 2번째 마디를 찔러 내장을 빼내 주시구요~ 배 쪽에 있는 내장도 빼내주시면 됩니다.', 'image_url': 'https://recipe1.ezmember.co.kr/cache/recipe/2015/06/03/fb6744d297a61e13fa1cb50c39d773641.jpg'}, {'step_number': 2, 'description': '잘 손질된 새우를 다져줍니다. 새우가 들어간 이상 탱글탱글한 새우살이 어느정도 씹혀야 제 맛이니 너무 잘게 다지지는 마세요~', 'image_url': 'https://recipe1.ezmember.co.kr/cache/recipe/2015/06/03/50fe48df055b11519ae3ec63357b1cd41.jpg'}, {'step_number': 3, 'description': '다진 채소와 새우 그리고 순두부를 계란물에 넣어줍니다. 계란물은 계란과 물(또는 육수) 비율 1:1정도로 해주시면 됩니다. 오늘은 초간단 버전이라 저는 그냥 물을 넣었습니다. 새우가 들어가서 따로 간을 하지는 않았어요~', 'image_url': 'https://recipe1.ezmember.co.kr/cache/recipe/2015/06/03/abe90b8f806b02e0d6efe61fe55e333b1.jpg'}, {'step_number': 4, 'description': '전자레인지용 대접에 담아 뚜껑이나 랩을 덮어줍니다. 그래야 윗부분이 딱딱해지지 않아요! 뚜껑일 경우 살짝만 덮어 주시면 되고, 랩을 씌우실 경우엔 포크로 송송 구멍을 내주시면 됩니다. 전자레인지 계란찜 메뉴로 가동을 하니 3분이면 OK!전자레인지', 'image_url': 'https://recipe1.ezmember.co.kr/cache/recipe/2015/06/03/84f22761d09dc0bd011e4896d3fca39a1.jpg'}]"
