index,종류별,상황별,재료별,방법별,글 제목,레시피이름,조회수,조리시간,난이도,인분,재료,소개글,조리순서
53835,찌개,일상,해물류,끓이기,얼큰칼칼한 명란찌개 끓이기 명란젓요리 알탕레시피,알탕,882,15분 이내,초급,4인분,"[('명란젓', '4줄'), ('애호박', '1/3개'), ('양파', '1/4개'), ('나박썬무', '1줌'), ('대파', '1/3개'), ('청량고추', '1개'), ('다진마늘', '1T'), ('고추가루', '1.5T'), ('물', '500ml'), ('코인육수', '1알'), ('새우젓', '0.5T')]",얼큰칼칼한 명란찌개 끓이는 법입니다.,"[{'step_number': 1, 'description': '무는 나박썰고, 애호박과 양파도 깍뚝썰고 대파는 작게 송송 썰어줍니다. 청량고추도 얇게 송송 썰어서 준비해주세요.도마 , 조리용나이프애호박 손질법', 'image_url': 'https://recipe1.ezmember.co.kr/cache/recipe/2024/04/07/bdad98bdf6ea49c869b582625e024be41.jpg'}, {'step_number': 2, 'description': '물 500ml에 코인육수 한알 넣고 육수를 만들어줍니다.냄비', 'image_url': 'https://recipe1.ezmember.co.kr/cache/recipe/2024/04/07/ed3833ee9591c7fe9ef3543a1389c5141.jpg'}, {'step_number': 3, 'description': '명란젓은 4줄을 사용했는데 저처럼 썰어서 넣어도 되고 통으로 넣어도 됩니다. 저는 떠먹기 좋게 처음부터 한입크기로 썰었어요.명란젓 보관법', 'image_url': 'https://recipe1.ezmember.co.kr/cache/recipe/2024/04/07/1446e1f787670575a29613a49f983e671.jpg'}, {'step_number': 4, 'description': '육수가 끓어오르면 대파와 청량고추를 제외한 나머지 재료들을 몽땅 넣어주고', 'image_url': 'https://recipe1.ezmember.co.kr/cache/recipe/2024/04/07/2edf0d70a7ed016ed0fd4213ca43c2e91.jpg'}, {'step_number': 5, 'description': '고추가루 1.5T넣어주고숟가락', 'image_url': 'https://recipe1.ezmember.co.kr/cache/recipe/2024/04/07/62e66ae9d4e51e4a955cb6db4f7147f61.jpg'}, {'step_number': 6, 'description': '다진마늘 1T 넣어준 후 잘 풀어주세요.', 'image_url': 'https://recipe1.ezmember.co.kr/cache/recipe/2024/04/07/7bd2aec5cb6bb993149f75a448b2c4851.jpg'}, {'step_number': 7, 'description': '그리고 야채들이 충분히 익게 끓여주다가 무가 익으면', 'image_url': 'https://recipe1.ezmember.co.kr/cache/recipe/2024/04/07/badd068d3ca6bc8eeaf0563e17c087b41.jpg'}, {'step_number': 8, 'description': '손질한 명란젓을 넣어주고', 'image_url': 'https://recipe1.ezmember.co.kr/cache/recipe/2024/04/07/2659b2b131a8bd3a5373daefc4e185a21.jpg'}, {'step_number': 9, 'description': '이때 대파와 고추도 넣어준 후 명란이 국물에 우러나게 한소끔 끓여줍니다.', 'image_url': 'https://recipe1.ezmember.co.kr/cache/recipe/2024/04/07/05bfca0b27b15bee25ca2f32bf46a0611.jpg'}, {'step_number': 10, 'description': '새우젓 0.5T넣어주고 간을 봐주세요. 간이 맛으면 불을 끄면 됩니다.', 'image_url': 'https://recipe1.ezmember.co.kr/cache/recipe/2024/04/07/9642e3a7a53a9110bcdee7469b07e0281.jpg'}, {'step_number': 11, 'description': '얼큰칼칼한 명란찌개 완성입니다. 맛있게 드세요.', 'image_url': 'https://recipe1.ezmember.co.kr/cache/recipe/2024/04/07/26305422283dbb56d235648fa90a99c11.jpg'}]"
53836,찌개,일상,해물류,끓이기,우렁이된장찌개 (찌개 맛내기 쉬워요~),우렁된장찌개,331,15분 이내,초급,4인분,"[('우렁이', '200g'), ('팽이버섯', '100g'), ('감자', '2개'), ('청양고추', '1개'), ('홍고추', '1개'), ('양파', '1/2개'), ('대파', '1/2대'), ('물', '1L'), ('멸치다시팩', '1팩'), ('된장', '1T'), ('고춧가루', '0.5T'), ('고추장', '0.5T'), ('다진 마늘', '1T'), ('국간장', '1T')]",별다른 재료없이도 우렁이만 있으면 국물맛도 시원하게 구수하게 낼 수 있는 된장찌개를 소개합니다,"[{'step_number': 1, 'description': '냄비에 물 1리터를 붓고 멸치다시팩을 넣은 후 팔팔 끓여준다센불', 'image_url': 'https://recipe1.ezmember.co.kr/cache/recipe/2023/05/24/0efbf4479ce87288906d5b5e4373c0a41.jpg'}, {'step_number': 2, 'description': '양파는 채 썰고 청양고추, 홍고추, 대파는 송송 썰고 감자는 얇게 반달모양으로 썰고 팽이버섯은 대파와 비슷한 크기로 잘게 썰어준다', 'image_url': 'https://recipe1.ezmember.co.kr/cache/recipe/2023/05/24/226f91814bba73c9db182e83e3e49ec31.jpg'}, {'step_number': 3, 'description': '육수가 끓어오르면 멸치다시팩을 건져내고 된장 1T, 고추장 0.5T, 다진 마늘 1T를 넣고 끓여준다중불', 'image_url': 'https://recipe1.ezmember.co.kr/cache/recipe/2023/05/24/451b3de8caba45cb117fc1491d0270521.jpg'}, {'step_number': 4, 'description': '감자와 팽이버섯을 넣고 끓여준다중불', 'image_url': 'https://recipe1.ezmember.co.kr/cache/recipe/2023/05/24/eebb2f48fc32788c1c427e24878d1f0d1.jpg'}, {'step_number': 5, 'description': '감자가 익으면 국간장 1T를 넣고 끓여준다중불', 'image_url': 'https://recipe1.ezmember.co.kr/cache/recipe/2023/05/24/d71a524b6095f897f8702efcc76de1ad1.jpg'}, {'step_number': 6, 'description': '우렁이를 넣고 끓여준다중불', 'image_url': 'https://recipe1.ezmember.co.kr/cache/recipe/2023/05/24/efdb444ee10245d352e736ec252dda661.jpg'}, {'step_number': 7, 'description': '대파와 양파를 넣고 끓여준다', 'image_url': 'https://recipe1.ezmember.co.kr/cache/recipe/2023/05/24/5254b43e06ff8bba990c97e6d4938a301.jpg'}, {'step_number': 8, 'description': '고춧가루 0.5T와 청양고추, 홍고추를 넣고 끓여준다중불', 'image_url': 'https://recipe1.ezmember.co.kr/cache/recipe/2023/05/24/8ae0a238bfb76b172b4aec4ff9e818111.jpg'}]"
53837,찌개,일상,해물류,끓이기,해물 순두부찌개 양념 레시피,해물순두부찌개,"2,042",30분 이내,초급,4인분,"[('순두부', '2개'), ('모듬해물', '1컵'), ('계란', '2개'), ('생수', '300ml'), ('양파', '1개'), ('대파', '10cm'), ('식용유', '3T'), ('고춧가루', '3T'), ('소금', '1/2T'), ('설탕', '1/2t'), ('굴소스', '1T'), ('국간장', '2T')]","가족들이 해산물을 좋아하는 편이라 오징어, 홍합, 조개, 쭈꾸미, 전복 등을 넣고 해물 순두부찌개를 끓이면 정말 맛있게 잘 먹지요^^ 
순두부찌개 양념 맛있게 만드는 법 알려드릴게요!","[{'step_number': 1, 'description': '양파와 대파를 썰어 놓습니다. 냄비에 식용유를 붓고 양파와 대파를 넣습니다.', 'image_url': 'https://recipe1.ezmember.co.kr/cache/recipe/2023/06/01/8f8fc7f22f8a48fb203e312a66ab54d91.jpg'}, {'step_number': 2, 'description': '양파가 투명해질때까지 볶습니다.중불', 'image_url': 'https://recipe1.ezmember.co.kr/cache/recipe/2023/06/01/8b095727c87dd63dcaa91e773756b1101.jpg'}, {'step_number': 3, 'description': '고춧가루 3T를 넣고 볶으며 고추기름을 냅니다.약불', 'image_url': 'https://recipe1.ezmember.co.kr/cache/recipe/2023/06/01/1bedc235361720e83ea3fa5667252c661.jpg'}, {'step_number': 4, 'description': '소금 1/2T를 넣습니다. 설탕 1/2t를 넣습니다.설탕양은 1/2 티스푼입니다.', 'image_url': 'https://recipe1.ezmember.co.kr/cache/recipe/2023/06/01/236e6bc8c0dd6824b14d22ec016572181.jpg'}, {'step_number': 5, 'description': '굴소스 1T를 넣고 섞어 줍니다.', 'image_url': 'https://recipe1.ezmember.co.kr/cache/recipe/2023/06/01/51157f78316ae9364771359a0ed5f31b1.jpg'}, {'step_number': 6, 'description': '모듬해물을 흐르는 물에 헹군 후 냄비에 넣습니다.제가 사용한 모듬해물은 냉동제품인데 한봉지 사서 냉동실에 넣어두면 필요시 마다 꺼내 사용하기 편하네요^^', 'image_url': 'https://recipe1.ezmember.co.kr/cache/recipe/2023/06/01/9a97f34a846161183b3ab1d3da0869081.jpg'}, {'step_number': 7, 'description': '생수 300ml 넣습니다.중불', 'image_url': 'https://recipe1.ezmember.co.kr/cache/recipe/2023/06/01/8313d327004e7c4dd0b590700e9c94d61.jpg'}, {'step_number': 8, 'description': '순두부 2봉을 넣습니다.', 'image_url': 'https://recipe1.ezmember.co.kr/cache/recipe/2023/06/01/093cdeb8cd103c07250639b13f3d5c151.jpg'}, {'step_number': 9, 'description': '계란 2개를 넣습니다.\n국간장을 2T 넣습니다.간을 보고 국간장 양을 조절하세요!', 'image_url': 'https://recipe1.ezmember.co.kr/cache/recipe/2023/06/01/3795b33c0aaeeb8565af67813755dffb1.jpg'}, {'step_number': 10, 'description': '이제 보글 보글 5분 가량 끓이면 해물 순두부찌개 완성입니다.', 'image_url': 'https://recipe1.ezmember.co.kr/cache/recipe/2023/06/01/221fc2e140f892492c6765a41b8324e91.jpg'}]"
53838,찌개,일상,해물류,끓이기,꽃게 냉동꽃게 손질법 꽃게 된장찌개 꽃게탕 끓이는법,꽃게된장찌개,"7,246",60분 이내,중급,4인분,"[('냉동꽃게', '1마리'), ('무', '150~200g'), ('애호박', '1/4개'), ('양파', '1/2개'), ('팽이버섯', '1봉지'), ('두부', '1/2모'), ('멸치코인육수', '1개'), ('된장 크게', '1수저'), ('고춧가루', '1수저'), ('간장', '2수저'), ('참치액', '1수저'), ('간 마늘', '1수저'), ('생강가루', '조금')]","오늘은 냉동꽃게를 이용한 요리를 준비했습니다. 단백질이 풍부하고 아미노산과 칼슘, 철분, 아연 등 무기질 그리고 타우린이 풍부한 저열량 고단백질을 가지고 있는 꽃게! 꽃게 제철은 봄과 가을이며 일반적으로 암게는 봄게가 맛있다고 해요. 꽃게는 부패하는 속도가 빠르기 때문에, 신선도 유지를 위해 팩에 담아서 랩으로 싼 뒤 냉동 보관을 해야 합니다. 저는 시댁이 서산이에요. 제가 처음으로 어머님께 요리 배운 게 바로 꽃게탕인데요. 꽃게 만질 줄도 모르고 난감해 했던 기억이 납니다. ㅎㅎ 대충 씻어서 꽃게탕 끓여서 꽃게탕은 버리게 되었다는 슬픈 사연! 시어머님이 냉동꽃게 손질법과 꽃게탕 끓이는법 까지 자세히 알려주셨는데... 오늘 그 비법 알려드릴게요.​","[{'step_number': 1, 'description': '해동된 꽃게는 조리용 솔로 구석구석 문질러 깨끗이 닦아주세요.냉동꽃게 해동하는법 냉동꽃게는 미리 2~3시간 전 냉장고에 넣어 놓았다가 요리하기 1시간 전에 상온에 놔두세요. \n꽃게는 금방 해동이 돼요! \u200b 냉동꽃게가 완전히 해동시키면 안 되고요. 30%로 정도만 해동을 시켜줘야 꽃게살이 흘러내리지 않고 손질할 때도 편해요.', 'image_url': 'https://recipe1.ezmember.co.kr/cache/recipe/2023/06/15/f178c8c5d92b08ea08854666b7dfeefa1.jpg'}, {'step_number': 2, 'description': '가위로 꽃게 다리 끝을 잘라주세요.', 'image_url': 'https://recipe1.ezmember.co.kr/cache/recipe/2023/06/15/ff1a5e25787e7bf49ba46ba690101e581.jpg'}, {'step_number': 3, 'description': '가장 단단하고 큰 꽃게 다리를 분리해 주세요. 분리한 꽃게 다리는 칼등으로 몇 번 내려쳐서 꽃게 다리를 부셔주세요. 단단한 꽃게 다리를 깨물면서 치아가 손상되는 걸 방지할 수 있어요.', 'image_url': 'https://recipe1.ezmember.co.kr/cache/recipe/2023/06/15/af887795458144a0eec82eea7e136e151.jpg'}, {'step_number': 4, 'description': '배딱지 사이를 엄지손가락으로 벌리면 사진에서처럼 벌어져요. \n배 딱지를 제거해 주세요.', 'image_url': 'https://recipe1.ezmember.co.kr/cache/recipe/2023/06/15/1c1e311c9794e06c786074638a8e3cc51.jpg'}, {'step_number': 5, 'description': '게딱지와 몸통을 분리해 줍니다.', 'image_url': 'https://recipe1.ezmember.co.kr/cache/recipe/2023/06/15/d856a7a2396156993fa4ba4814b5008a1.jpg'}, {'step_number': 6, 'description': '게딱지에 붙어 있는 입, 몸에 있는 아가미를 제거해 주세요.', 'image_url': 'https://recipe1.ezmember.co.kr/cache/recipe/2023/06/15/0e9cdfee7184f6658727e84438be0c7b1.jpg'}, {'step_number': 7, 'description': '가위로 아가미 부분을 살살 들어 올리고 손으로 제거해 주세요.', 'image_url': 'https://recipe1.ezmember.co.kr/cache/recipe/2023/06/15/0cfe0b70cd5ca99d871222473548fa341.jpg'}, {'step_number': 8, 'description': '가위로 먹기 좋은 크기로 잘라주세요. 저는 가위를 사용하였는데요. 도마에 꽃게의 비린한 냄새가 오래 남는 거 같아서 가위를 사용하고 있어요. 식칼로 자르셔도 됩니다.', 'image_url': 'https://recipe1.ezmember.co.kr/cache/recipe/2023/06/15/4fa3efc23af71991a0233323abc0cc241.jpg'}, {'step_number': 9, 'description': '무는 깍둑썰기해주세요. 두껍지 않게 얇게 썰어주세요. 양파 채 썰어 주고, 대파 어슷썰기 애호박은 큼직만 하게 썰어주세요.', 'image_url': 'https://recipe1.ezmember.co.kr/cache/recipe/2023/06/15/4e1745122fbde13ad707bc79746a63ed1.jpg'}, {'step_number': 10, 'description': '팽이버섯은 흐르는 물에 살짝 헹구고 찢어주세요. 두부는 먹기 좋은 크기로 준비해 줍니다.', 'image_url': 'https://recipe1.ezmember.co.kr/cache/recipe/2023/06/15/63b719f6d8adf983277f8dcf1b34919d1.jpg'}, {'step_number': 11, 'description': '냄비에 1리터 정도 물을 붓고 멸치 코인 육수를 1개 넣어주세요. 없다면 다시마, 멸치를 넣고 육수를 만들어주세요.                    \n\n                        \n                            19가지 자연원료로 만든 만개한알 1팩 (30정, 캔디형 개별포장)', 'image_url': 'https://recipe1.ezmember.co.kr/cache/recipe/2023/06/15/79f3550192c1083934da9337b740f64c1.jpg'}, {'step_number': 12, 'description': '물이 끓어오르면 된장 크게 한 수저 퍼서 끓는 육수에 풀어주세요.', 'image_url': 'https://recipe1.ezmember.co.kr/cache/recipe/2023/06/15/8e1fda609bc9ff5586a3923d9961c35e1.jpg'}, {'step_number': 13, 'description': '냉동꽃게를 손질해 놓은 걸 넣고 생강가루 조금 넣어주세요. 꽃게 손질법 레시피', 'image_url': 'https://recipe1.ezmember.co.kr/cache/recipe/2023/06/15/280d0957ef85b181069aba56f49e28d51.jpg'}, {'step_number': 14, 'description': '간 마늘 넣고 고춧가루 넣어주세요; 매운 고춧가루라 저는 1수저 넣었어요. 고춧가루 맵기에 따라 추가로 더 넣으세요. 간장, 참치 액 넣어 줍니다. 양파, 애호박,두부를 넣고 끓어주세요. 꽃게와 무가 익으면 대파, 팽이버섯 넣고 한번 끓여주면 꽃게탕 꽃게 된장찌개 완성!', 'image_url': 'https://recipe1.ezmember.co.kr/cache/recipe/2023/06/15/1ec685635c7d0f9624200e1990a5bff21.jpg'}]"
53839,찌개,일상,해물류,끓이기,바지락순두부찌개 (10분이면 뚝딱 끓이는 찌개요리),바지락순두부찌개,"1,118",10분 이내,초급,4인분,"[('바지락', '2주먹'), ('순두부', '1봉'), ('양파', '1/2개'), ('애호박', '1/3개'), ('표고버섯', '1개'), ('청양고추', '1개'), ('홍고추', '1개'), ('대파', '1대'), ('쌀뜨물', '400ml'), ('식용유', '2T'), ('고춧가루', '2T'), ('참치액', '1T'), ('국간장', '1T'), ('소금', '0.5T'), ('다진 마늘', '1T'), ('맛술', '1T'), ('후춧가루', '톡톡')]",바지락과 감자가 풍년인 요즘입니다 선물로 들어온게 많아도 너무 많아 요즘 자주 해 먹는 재료들입니다 바지락과 순두부찌개로 맛깔스러운 양념 더해 10분이면 뚝딱 끓여내는 레시피입니다,"[{'step_number': 1, 'description': '애호박, 양파, 표고버섯은 바지락과 비슷한 크기로 깍둑썰고 청양고추, 홍고추는 송송 썰고 대파는 어슷 썰어준다', 'image_url': 'https://recipe1.ezmember.co.kr/cache/recipe/2023/07/07/764af6ccfc7512f5d943426a7e8847821.jpg'}, {'step_number': 2, 'description': '냄비에 식용유 2T, 바지락, 고춧가루 2T를 넣고 볶아준다중불고추기름으로 대신해도 좋다', 'image_url': 'https://recipe1.ezmember.co.kr/cache/recipe/2023/07/07/ca19e2dd99aec3e3dd3e9e584eeb373d1.jpg'}, {'step_number': 3, 'description': '바지락이 익어 입이 벌어지면 애호박, 표고버섯, 양파,대파를 넣고 볶아준다중불', 'image_url': 'https://recipe1.ezmember.co.kr/cache/recipe/2023/07/07/99b3193dca0a06d3d539f2f8c706e8be1.jpg'}, {'step_number': 4, 'description': '재료가 볶아지면 쌀뜨물 400ml를 붓고 끓여준다센불', 'image_url': 'https://recipe1.ezmember.co.kr/cache/recipe/2023/07/07/220be51dd17b2becfdcb9c73f38b6d2e1.jpg'}, {'step_number': 5, 'description': '찌개양념장을 모두 넣고 끓여준다센불 - 중불', 'image_url': 'https://recipe1.ezmember.co.kr/cache/recipe/2023/07/07/aa74d324773b894102494938c348128a1.jpg'}, {'step_number': 6, 'description': '청양고추, 홍고추를 넣어준다중불', 'image_url': 'https://recipe1.ezmember.co.kr/cache/recipe/2023/07/07/495b32d7f78d2829113a575a905324761.jpg'}, {'step_number': 7, 'description': '순두부를 적당한 두께로 썰어 넣어준다중불', 'image_url': 'https://recipe1.ezmember.co.kr/cache/recipe/2023/07/07/3d6e5219bc7b9f285589a3f1c66595921.jpg'}, {'step_number': 8, 'description': '개인입맛에 따라 소금이나 국간장으로 간을 맞춰준다중불', 'image_url': 'https://recipe1.ezmember.co.kr/cache/recipe/2023/07/07/4cf93fe8f5fed268cabfac7891d0d2e41.jpg'}]"
53840,찌개,일상,해물류,끓이기,생선찌개 중 최고의 맛! /초간단 코다리찌개 황금레시피 정말 맛있어요.,코다리찌개,780,60분 이내,초급,2인분,"[('코다리', '적당량'), ('무', '적당량'), ('멸치육수', '800ml'), ('국간장', '2T'), ('다진마늘', '1T'), ('고춧가루', '2T'), ('소금', '적당량')]",비가 오거나 뜨끈한 국물이 땡길때! 코다리를 넣어 더욱 탱글한 코다리의 살을 맛볼 수 있고 얼큰함과 시원함이 제대로인 코다리찌개예요. 술안주로도 좋고 해장으로도 좋고 아침에 뜨끈하게 한끼 먹어도 좋아요. 생선찌개 중에서 제가 제일 즐겨 만드는 코다리찌개 만들어볼게요!,"[{'step_number': 1, 'description': '먼저 코다리찌개에 들어갈 재료들을 미리 준비해줍니다. 코다리찌개를 더욱 시원하게 만들어주기위해 무를 먹기 좋게 썰어주세요.무', 'image_url': 'https://recipe1.ezmember.co.kr/cache/recipe/2023/07/15/cc96644ba2c664471a14e0b5518a88f61.jpg'}, {'step_number': 2, 'description': '그리고 코다리를 흐르는 물에 깨끗하게 씻어서 물기를 빼둡니다. 저는 손질되어있는 코다리를 사용했어요.코다리', 'image_url': 'https://recipe1.ezmember.co.kr/cache/recipe/2023/07/15/2a6ef21504c6e7d4c12895353a73672d1.jpg'}, {'step_number': 3, 'description': '코다리찌개를 만들어주기위해 먼저 멸치육수를 만들어줄거예요. 저는 멸치육수팩을 사용했습니다. 물 800ml에 멸치육수팩을 넣고멸치육수', 'image_url': 'https://recipe1.ezmember.co.kr/cache/recipe/2023/07/15/1f15c0f647420d214bb34383ed69e46b1.jpg'}, {'step_number': 4, 'description': '미리 썰어둔 무도 함께 넣어 끓여줍니다.무', 'image_url': 'https://recipe1.ezmember.co.kr/cache/recipe/2023/07/15/dc04da650e9334edd958438d702dd9b31.jpg'}, {'step_number': 5, 'description': '멸치육수가 끓어오르면 멸치육수팩을 건져내줍니다. 그리고 코다리를 넣어주세요.코다리', 'image_url': 'https://recipe1.ezmember.co.kr/cache/recipe/2023/07/15/ed749f8aa4e80a10f7708b79baace7221.jpg'}, {'step_number': 6, 'description': '국간장 2스푼,국간장', 'image_url': 'https://recipe1.ezmember.co.kr/cache/recipe/2023/07/15/1a7ca1dea3aa7ce9f97c1cc2286836b11.jpg'}, {'step_number': 7, 'description': '다진마늘 1스푼다진마늘', 'image_url': 'https://recipe1.ezmember.co.kr/cache/recipe/2023/07/15/d50fe9ec0752a19e726147175f6291281.jpg'}, {'step_number': 8, 'description': '고춧가루 2스푼을 넣어 끓여줍니다.고춧가루', 'image_url': 'https://recipe1.ezmember.co.kr/cache/recipe/2023/07/15/7779ccc0b7c0754f54d08c76f84a99451.jpg'}, {'step_number': 9, 'description': '양념들을 넣고 한소끔 또 끓어오르면 간을 보신 후 부족한 간은 추가해주세요. 심심한 간은 소금으로 해주시면 됩니다.소금', 'image_url': 'https://recipe1.ezmember.co.kr/cache/recipe/2023/07/15/ff516ece229a9ecc20c605b5ba3004051.jpg'}, {'step_number': 10, 'description': '맛있는 코다리찌개 완성입니다. 쉽고 간단하게 만드는 레시피예요. 동태탕처럼 얼큰하고 시원해서 너무 좋아요. 탱탱한 코다리살이 먹기에도 좋아 자주 찾게 되는 메뉴랍니다.', 'image_url': 'https://recipe1.ezmember.co.kr/cache/recipe/2023/07/15/11f0fd1cccc181eb869d1211cf18947b1.jpg'}]"
53841,찌개,일상,해물류,끓이기,#고추장찌개만들기 #해물고추장찌개만들기 #볶음고추장활용요리 #조선고추장 #토장,고추장찌개,654,30분 이내,아무나,4인분,"[('냉동모둠해물', '200g'), ('냉동새우', '200g'), ('미역', '20g'), ('야채                                                                                찌개용', '200g'), ('두부', '400g'), ('다진마늘', '1큰술'), ('썬파', '2큰술'), ('볶음고추장', '2큰술'), ('고추장', '1큰술'), ('토장', '1큰술'), ('코인육수', '2알'), ('물', '1L')]","초간단, 초스피드로 만드는 냉동해물과 냉동찌개용야채를 이용해서 후다닥 후다닥 만드는 해물고추장찌개입니다. ​ 볶음고추장을 활용했고, 조선고추장도 조금 추가해 주고, 진한 맛을 내기 위해서 토장도 추가로 넣어서 바글바글 끓여낸 밥도둑 해물고추장찌개입니다. ​ 자, 육수를 만들었고요, 거기에 1차로 이것을 넣어 주고, 2차로 이것을 넣어 주고. 3차로 이것도 넣어 줍니다. 그냥 한꺼번에 다 넣고는 끓여 드셔도 전혀 무관합니다. ​ 여기에 특별하게 미역을 넣어서 더욱 시원한 맛을 내어 주었습니다.","[{'step_number': 1, 'description': '한알육수 2알과 다진마늘, 썬파에 찌개용냉동야채들을 냄비에 넣어 줍니다. 일사철리로 한꺼번에 재료 넣고 끓여 줄려고 합니다.', 'image_url': 'https://recipe1.ezmember.co.kr/cache/recipe/2023/07/25/d8450a5ddf0cc005abb1ee2322114dfc1.jpg'}, {'step_number': 2, 'description': '냉동생새우, 자숙된 새우가 아닌 생새우입니다. 그리고 냉동모둠해물도 탈탈 털어서 넣어 줍니다.', 'image_url': 'https://recipe1.ezmember.co.kr/cache/recipe/2023/07/25/7ae5ae7c9351d54fcd1bd6cbea10ddf71.jpg'}, {'step_number': 3, 'description': '간은 된장, 조선고추장, 볶음고추장을 넣어 줍니다. 볶음고추장은 지난번에 했던 것이고, 조선고추장은 샘표에서 나온 옛고추장인 듯 싶습니다. 거기에 고추장만 들어가면 텁텁하기 때문에, 토장을 조금 추가해 주었습니다. 볶음고추장 레시피는 아래를 참고하시면 됩니다. https://blog.naver.com/koreastencil/223117491117', 'image_url': 'https://recipe1.ezmember.co.kr/cache/recipe/2023/07/25/cde054c093e06207cdf6dd633e6b3a621.jpg'}, {'step_number': 4, 'description': '물에 불려 놓았던 미역을 불린물과 함께 부어 주고, 센불에서 해물이 익을때까지 팔팔 끓여 줍니다.', 'image_url': 'https://recipe1.ezmember.co.kr/cache/recipe/2023/07/25/c471d5e39df93972e5668f683580b81b1.jpg'}, {'step_number': 5, 'description': '팔팔 끓고 해물이 어느 정도 익었다면 이제 두부를 투하해서는 센불에서 팔팔 끓어오를 때까지 끓여 줍니다. 그리고 올라오는 거품들을 제거합니다. 거품을 제거한 후에는 중불에서 은근하게 끓여 줍니다. 각종 해물과 야채에서 진한 맛이 우러나오게 해 줍니다.', 'image_url': 'https://recipe1.ezmember.co.kr/cache/recipe/2023/07/25/168d66f2e12244a0226070c51eec1ac91.jpg'}, {'step_number': 6, 'description': '끓이면 끓일수록 진해지는 국물맛입니다. 그래서 처음에는 조금은 맑은 느낌의 해물고추장찌개를 먹고, 남은 것을 다음날에 또 끓이게 되면 더욱 진한 맛을 내어 줍니다.', 'image_url': 'https://recipe1.ezmember.co.kr/cache/recipe/2023/07/25/55103ae48a1ffce2258aaa5eff016ad91.jpg'}, {'step_number': 7, 'description': '고추장의 진한 맛과 더불어서 해물의 시원함이 곁들여진 해물고추장찌개 완성입니다. 미역이 들어가서 목넘김이 아주 좋고 시원합니다. 미역을 넣기를 참 잘했다,,,칭찬합니다. ^^ 밥 말아서 먹어도 좋고요. 볶음고추장이 들어가니 국물맛이 시원하면서도 진한 맛을 주네요. 볶음고추장에는 소고기다짐육이 들어갔거든요. ㅋㅋㅋ', 'image_url': 'https://recipe1.ezmember.co.kr/cache/recipe/2023/07/25/155781ecbfdc7bb42a6598eef1b45a9f1.jpg'}]"
