index,종류별,상황별,재료별,방법별,글 제목,레시피이름,조회수,조리시간,난이도,인분,재료,소개글,조리순서
39924,메인반찬,술안주,해물류,부침,#일상먹거리 #청어과메기한상 #홍어전만들기 #홍어요리 #막걸리밥상 #홍어전과청어과메기,홍어전,430,10분 이내,아무나,2인분,"[('홍어 날개살', '150g'), ('계란', '2개'), ('허브소금', '1작은술'), ('과메기', ''), ('고추', ''), ('마늘', ''), ('해초', ''), ('다시마', ''), ('김', ''), ('무생채', ''), ('갓김치', '')]","과메기가 조금은 느끼하니까 과메기를 물리칠 수 있는 강자는 바로 홍어전입니다. ​ 홍어전과 과메기밥상!! 참 상대하기 버거운 대결이고, 쉽게 다가가기도 어려운 밥상이지요.","[{'step_number': 1, 'description': '과메기세트. 고추 썬것과 저민마늘, 그리고 해초, 다시마쌈. 중요한 정어리과메기입니다. 과메기는 두가지의 종류가 있는데, 하나는 꽁치를 말려서 만든 꽁치과메기와 청어를 말려서 만든 청어과메기가 있습니다. 과메기의 원조는 청어입니다. 그런데 청어가 많이 잡혀서 오랫동안 보관하기 위해서 만든 것이 과메기였는데, 청어가 잡히지를 않았습니다. 수온에 따라 시시각각 변하기 때문에요. 과메기를 찾는 사람들은 즉, 수요가 많아서 그것을 충족시키고자 공급책에서 만든 것이 널리고 널린 꽁치를 가지고 과메기를 만들었습니다. 그런데 그것이 현재 반전되었습니다. 그렇게 싸던 꽁치가 잡히지 않는다라는 점이요. 꽁치과메기가 더 귀해진 세상이 되었습니다. 오히려 청어는 엄청나게 잡히고 있어서 저렴한 청어과메기가 다시금 재출연을 하게 된 것이지요. ^^', 'image_url': 'https://recipe1.ezmember.co.kr/cache/recipe/2024/01/15/8717b16d9b1d63269628b415ac00fa011.jpg'}, {'step_number': 2, 'description': '홍어전을 준비합니다. 밀가루나 전분가루를 입히지 않고 그냥 계란물에 부쳐 주려고 합니다. 밀가루나 전분가루를 입히게 되면 맛이 텁텁해지기 때문에 오로지 계란옷만 입혀 줍니다. 잘 풀어 준 계란에 허브소금을 넣어 줍니다. 홍어는 날개살 위주로 부치려고 합니다.볼 , 요리젓가락', 'image_url': 'https://recipe1.ezmember.co.kr/cache/recipe/2024/01/15/bb62e47a7f4bb97b42da977a7dba7e0b1.jpg'}, {'step_number': 3, 'description': '과메기세트에 들어 있었던 파래김에 마끼김을 더해 주었습니다. 그리고 무생채와 갓김치!! 홍어랑 묵은지는 찰떡인데, 묵은지가 없으니 묵은지보다 더 맛있는 갓김치를 준비했습니다.', 'image_url': 'https://recipe1.ezmember.co.kr/cache/recipe/2024/01/15/3fd0e671898a5fb1efc9db8ce6a6dce81.jpg'}, {'step_number': 4, 'description': '과메기쌈을 즐길 재료들을 완성접시에 담아 줍니다. 과메기 자리만 남겨 놓았습니다. 과메기는 해초와 마늘, 고추, 그리고 다시마쌈에 싸서 먹어야 제맛입니다. 아니면 쌈추나 봄동에 싸서 먹는 맛도 좋고요. 과메기가 비리거나 느끼할 수 있어서 마늘과 고추, 쌈추에 싸서 먹는 경우가 있는데 찍어 먹는 소스는 초고추장입니다. 그런데 의외로 해초는 전혀 비린 맛이 없는데 다시마쌈이 비리다할 수도 있겠더군요.접시', 'image_url': 'https://recipe1.ezmember.co.kr/cache/recipe/2024/01/15/609cf05410c6d9286d1a700dc7ded2c21.jpg'}, {'step_number': 5, 'description': '과메기 써는 것은 나중으로 미루고 일단, 홍어전부터 준비합니다. 홍어를 계란옷을 입혀 줍니다.', 'image_url': 'https://recipe1.ezmember.co.kr/cache/recipe/2024/01/15/f55b65d311b4134ed74030e707fa677c1.jpg'}, {'step_number': 6, 'description': '충분히 센불에서 팬을 달군 후에, 기름을 두르고 중불로 옮겨서는 홍어전을 부쳐 줍니다. 노릇노릇하게 부쳐지면 뒤집어서 마저 부쳐 줍니다. 홍어는 생으로 먹을때가 가장 먹기 좋고, 열을 가하게 되면 될수록 더욱더 그 향과 맛이 강해집니다.프라이팬', 'image_url': 'https://recipe1.ezmember.co.kr/cache/recipe/2024/01/15/017574538e191715814b5233d04081051.jpg'}, {'step_number': 7, 'description': '긴 청어과메기를 3등분해 주었습니다. 완성접시에 담아 주고 초고추장도 준비하면 과메기 한상 완성입니다.도마 , 조리용나이프', 'image_url': 'https://recipe1.ezmember.co.kr/cache/recipe/2024/01/15/7f1ff9b938a4234fdd744b6101fd20ae1.jpg'}, {'step_number': 8, 'description': '노릇노릇하게 잘 부쳐진 홍어전입니다. 계란이 남아서 말아서 부쳐 주었습니다. 톡 쏘는 홍어의 향이 진동을 하고 허거걱하게 만드는 홍어전입니다.', 'image_url': 'https://recipe1.ezmember.co.kr/cache/recipe/2024/01/15/deda8843decc014b0bbad80e843621591.jpg'}, {'step_number': 9, 'description': '오늘의 만찬은 과메기한상차림과 홍어전입니다. 이날은 새해 첫날의 밥상이였습니다.', 'image_url': 'https://recipe1.ezmember.co.kr/cache/recipe/2024/01/15/82e4b8ca1c391783a733a0eb672c96281.jpg'}]"
39925,메인반찬,술안주,해물류,부침,#참돔요리 #도미요리 #도미전만들기 #생선전 #도미포떠서만든도미전 #막걸리안주,도미전,646,90분 이내,중급,4인분,"[('도미 포', '17점'), ('소금', '1작은술'), ('후추', '1작은술'), ('부침가루', '6큰술'), ('계란', '2개')]","참돔을 해체한 후에 머리와 뼈를 가지고는 조림을 만들었지요. 몸통에 붙은 상을 떼어낸 후에 포를 떠서 만든 도미전입니다. 두툼하게 포를 떠서는 ​ 씹는 식감이 쫄깃쫄깃하고, 담백하면서도 고소한 맛을 주는 도미전입니다. ​ 전에 만들어 놓았던 밀싹무침과 함께 드시면 좋습니다. 파무침도 좋습니다. 그냥 초간장에 찍어서 드셔도 좋지만, 파무침이나 밀싹무침이 기름진맛을 없애 주니까요. ^^","[{'step_number': 1, 'description': '참돔 한마리입니다. 이제 머리와 꼬리를 썰어 주고, 지느러미 제거. 포를 떠 줍니다. 포를 뜨는 순간에는 사진촬영이 힘들었습니다. 그래서 다 완성된 포뜬 모습만 촬영했습니다.도마 , 요리용나이프', 'image_url': 'https://recipe1.ezmember.co.kr/cache/recipe/2023/10/25/6d88c66d6b975fbc351da060ccfbc24b1.jpg'}, {'step_number': 2, 'description': '비록 두툼하고 울퉁불퉁하지만, 살만은 잘 발라서 참돔의 포를 떴습니다. 이 또한,,,, 개고생이였습니다. ㅠㅜ키친타올', 'image_url': 'https://recipe1.ezmember.co.kr/cache/recipe/2023/10/25/cef63144ffcc8da87afcd7871cab4c0f1.jpg'}, {'step_number': 3, 'description': '소금과 후추로 밑간을 해 주고는 일단, 냉장고에서 자연숙성을 시켜 줍니다. 그럼 살들이 탱글탱글해지고 부셔지지 않게 됩니다.', 'image_url': 'https://recipe1.ezmember.co.kr/cache/recipe/2023/10/25/cf513c97b24f75f77af3a81a2ba536291.jpg'}, {'step_number': 4, 'description': '부침가루나 밀가루 옷을 입혀 줍니다. 너무 덕지덕지 발라주면 밀가루맛이 나기 때문에, 얇게 밀가루옷을 입혀 줍니다.', 'image_url': 'https://recipe1.ezmember.co.kr/cache/recipe/2023/10/25/a2548f7bfb55adc5b7a01b3dd4b8d45c1.jpg'}, {'step_number': 5, 'description': '그런 다음에 계란옷을 입혀서 달궈진 팬에 기름 넉넉하게 두르고는 부쳐 줍니다. 노릇노릇하게 밑면이 익게 되면 뒤집어서 부쳐줍니다. 불은 예열할때에는 강불, 그리고 부칠때에는 중불에서 부쳐 주세요.프라이팬', 'image_url': 'https://recipe1.ezmember.co.kr/cache/recipe/2023/10/25/b8e91769ada5113063e8ff643fe343981.jpg'}, {'step_number': 6, 'description': '잘 부쳐진 도미전이 되었습니다. 이렇게 바로 부쳐서 한입 먹어야 제맛입니다. 부스러기 살들을 뭉쳐서 하나 마지막으로 부쳐 주었는데,, 엄청나게 쫄깃하고 담백한 맛입니다.', 'image_url': 'https://recipe1.ezmember.co.kr/cache/recipe/2023/10/25/92a46ac98c542e143c7262108960be5b1.jpg'}, {'step_number': 7, 'description': '완성접시에 가지런하게 담아 주고는 가운데에는 밀싹쪽파무침을 올려 줍니다. 전과 함께 먹기에 딱 좋은 조합니다. 간장 대신의 역할을 하는 것이 바로 밀싹쪽파무침입니다. 고소하고 쫄깃한 식감이 좋은 도미전 완성입니다.', 'image_url': 'https://recipe1.ezmember.co.kr/cache/recipe/2023/10/25/67a598b7e518bbfb09dbe969840e6cfb1.jpg'}]"
39926,메인반찬,술안주,해물류,부침,남은 회 우럭전 부치기,우럭전,40,30분 이내,초급,2인분,"[('우럭 회', '400g'), ('부침가루', '적당히'), ('계란', '2개'), ('소금', '1꼬집'), ('후추', '적당히')]",주말에 잡은 우럭을 회와 회무침으로 먹고 조금 남았습니다. 2~3일 지나면 회 맛이 떨어져 전으로 부쳐 먹으려구요. 이전에 작성한 광어전에 이어 우럭전도 부쳐 보았습니다.,"[{'step_number': 1, 'description': '먹다 남은 회를 최대한 대각선으로 얇게 포를 떠줍니다. 생선전은 얇을수록 맛있어요.도마 , 조리용나이프 , 볼우럭 손질법', 'image_url': 'https://recipe1.ezmember.co.kr/cache/recipe/2024/08/18/5cc2773a2f1d4878b49e27c54e5a806e1.jpg'}, {'step_number': 2, 'description': '작은 쟁반에 부침가루 뿌려주고 그 위에 후추를 적당히 뿌려줍니다. 계란 2개에 소금 한 꼬집 넣고 휙휙 저어 계란물도 준비해 주세요.쟁반 , 볼 , 거품기부침가루는 처음에 조금 넣고 나중에 부족하면 보충하는 식으로 하면 낭비가 없습니다.', 'image_url': 'https://recipe1.ezmember.co.kr/cache/recipe/2024/08/18/021efa64558556b391c9c0c12fdaabe81.jpg'}, {'step_number': 3, 'description': '앞뒤로 부침가루에 골고루 묻혀주고 계란물에 충분히 적셔줍니다.', 'image_url': 'https://recipe1.ezmember.co.kr/cache/recipe/2024/08/18/d1c400e303ed7ee4a855b96a0a1c55941.jpg'}, {'step_number': 4, 'description': '달궈진 팬에 기름 두루고 계란물 묻힌 우럭회를 한 개씩 넣어줍니다. 앞뒤로 노릇노릇하게 익혀주면 끝~프라이팬 , 뒤집개', 'image_url': 'https://recipe1.ezmember.co.kr/cache/recipe/2024/08/18/3c179f4bdb479fd1167d88d0b436599c1.jpg'}, {'step_number': 5, 'description': '접시에 담아 완성입니다.접시', 'image_url': 'https://recipe1.ezmember.co.kr/cache/recipe/2024/08/18/7a8da4c228cf286cf04513c618df0c521.jpg'}]"
39927,메인반찬,술안주,해물류,부침,"해물파전 만드는법! 요리,레시피",해물파전,"7,155",30분 이내,초급,3인분,"[('쪽파', '15뿌리'), ('부침가루', '1'), ('물', '1'), ('달걀', '1개'), ('홍합', '1줌'), ('새우', '1줌'), ('오징어', '1줌'), ('청고추', '1개'), ('홍고추', '1개')]","Korean pancake 'Pajeon' - yori 해물파전 만드는법! 요리,레시피","[{'step_number': 1, 'description': '재료는 다음과 같이 준비합니다.', 'image_url': 'https://recipe1.ezmember.co.kr/cache/recipe/2016/07/12/06aa09c75bfa693adcf8aa3aa4ae4f811.jpg'}, {'step_number': 2, 'description': '쪽파는 한 뼘 길이로 썰어주세요.쪽파 15뿌리', 'image_url': 'https://recipe1.ezmember.co.kr/cache/recipe/2016/07/12/f82bd98377c332d222cce2db5b2402d51.jpg'}, {'step_number': 3, 'description': '홍고추와 청고추는 어슷썰기해주세요.청고추 1개, 홍고추 1개', 'image_url': 'https://recipe1.ezmember.co.kr/cache/recipe/2016/07/12/c2f87ca224b524fe8909f2e52c5ca97b1.jpg'}, {'step_number': 4, 'description': '프라이팬에 식용유를 넉넉히 두르고', 'image_url': 'https://recipe1.ezmember.co.kr/cache/recipe/2016/07/12/dee0a971ba1744a48b69b9d84e4513691.jpg'}, {'step_number': 5, 'description': '반죽에 버무린 쪽파를 넓게 펴서 올려주세요.', 'image_url': 'https://recipe1.ezmember.co.kr/cache/recipe/2016/07/12/6a8ec82fc73bb4dc19e3bec03ffecd211.jpg'}, {'step_number': 6, 'description': '그 위에 홍합, 오징어, 새우를 듬뿍 올려줍니다홍합 1줌, 새우 1줌, 오징어 1줌', 'image_url': 'https://recipe1.ezmember.co.kr/cache/recipe/2016/07/12/aa4fb74e4110e3bfd1b21107455cf24c1.jpg'}, {'step_number': 7, 'description': '재료들이 잘 붙어있도록 중간중간 반죽을 뿌려주세요.', 'image_url': 'https://recipe1.ezmember.co.kr/cache/recipe/2016/07/12/a863ba0da0b7b016b0a727f8fe13cf4b1.jpg'}, {'step_number': 8, 'description': '홍고추와 청고추를 얹어 색을 내주고 앞뒤로 노릇노릇 익혀줍니다.', 'image_url': 'https://recipe1.ezmember.co.kr/cache/recipe/2016/07/12/d765e18a53935cc408e2e71d849f8bd71.jpg'}, {'step_number': 9, 'description': '파전이 다 익을 때쯤 달걀을 톡 깨서 풀어주세요.달걀 1개', 'image_url': 'https://recipe1.ezmember.co.kr/cache/recipe/2016/07/12/7fe43c7b98131b5cdd42514cd145d2d01.jpg'}]"
39928,메인반찬,술안주,해물류,부침,#파김치로 만드는 해물파김치전만들기 #매콤하고 해물듬뿍 들어간 해물파전이 아닌 해물파김치전이지요~~~,파김치전,"11,905",30분 이내,아무나,3인분,"[('파김치', '2사발'), ('해물믹스', '1컵'), ('부침가루', '3컵'), ('소금', '조금'), ('참기름', '조금')]",#파김치로 만드는 해물파김치전만들기 #매콤하고 해물듬뿍 들어간 해물파전이 아닌 해물파김치전이지요~~~ 해물파전이 아닌 해물파김치전을 만들어 보았습니다. 매콤하니 김치전느낌도 나면서 파가 들어가서 해물파전 같기도 한~~ 해물파김치전입니다. 1. 부침가루에 소금과 참기름을 넣고 물넣고는 반죽물을 만들어 줍니다. 아주 걸쭉하게 만들어 주세요. 왜냐하면 파김치와 더불어서 파김치국물도 들어가니까요.,"[{'step_number': 1, 'description': '1. 부침가루에 소금과 참기름을 넣고 물넣고는 반죽물을 만들어 줍니다. \n아주 걸쭉하게 만들어 주세요. \n왜냐하면 파김치와 더불어서 파김치국물도 들어가니까요.', 'image_url': 'https://recipe1.ezmember.co.kr/cache/recipe/2017/01/26/35f6204e43516fa949be9a838c1695fe1.jpg'}, {'step_number': 2, 'description': '3. 냉동해물은 물에 씻어서 해동을 시켜서 준비해 놓았습니다.', 'image_url': 'https://recipe1.ezmember.co.kr/cache/recipe/2017/01/26/e318854acd83b8e682d93fbbe613ec711.jpg'}, {'step_number': 3, 'description': '4. 팬에 기름을 두르고 달군 후에 파김치를 하나씩 \n해물파전을 하는 것처럼 올려 놓아 줍니다. 그리고 반죽물을 부어 주시고요.', 'image_url': 'https://recipe1.ezmember.co.kr/cache/recipe/2017/01/26/3039ec512838cede3ad82656273ee3491.jpg'}, {'step_number': 4, 'description': '5. 그 위에 모둠해물을 올려 줍니다. \n냉동해물은 잘게 잘게 썰어서 준비했습니다. \n물론 물기를 충분히 빼 주셔야 합니다.', 'image_url': 'https://recipe1.ezmember.co.kr/cache/recipe/2017/01/26/47e53a6c5c97384329f8f0fd789e90ed1.jpg'}, {'step_number': 5, 'description': '6. 그리고 그 위에 다시 반죽물을 올려 줍니다.\n그런 다음에 약불에서 충분히 밑면이 익을때까지 기다렸다가 뒤집어 주세요.', 'image_url': 'https://recipe1.ezmember.co.kr/cache/recipe/2017/01/26/17a7c58805ca6836bc6f49cf0edbf2111.jpg'}, {'step_number': 6, 'description': '7. 충분히 익은 상태가 되면 팬을 흔들었을때에 이리저리 전이 움직이면 충분히 익혀진 것입니다.\n이제 뒤집어 보겠습니다. 뒤집게를 이용해서 뒤집었어요. \n충분히 뒷면이 익었기 때문에 수월하게 뒤집으실 수 있어요.', 'image_url': 'https://recipe1.ezmember.co.kr/cache/recipe/2017/01/26/fc78416f20a34e627e85019cf42802901.jpg'}, {'step_number': 7, 'description': '8. 해물파전처럼 파김치를 그대로 올려서 만든 해물파김치전을 만들었다면\n이번에는 파김치를 가위로 조사서 해물을 한꺼번에 넣고\n섞은 후에 그대로 부쳐내었습니다. \n뒤집는데에 어려움을 느끼신다면 이러한 방법으로 해물파김치전을 만드실 수도 있어요.', 'image_url': 'https://recipe1.ezmember.co.kr/cache/recipe/2017/01/26/a8f1217076fc8f2e8c1d5785df17f1321.jpg'}, {'step_number': 8, 'description': '9. 가볍게 뒤집어서는 앞면도 익혀 줍니다.', 'image_url': 'https://recipe1.ezmember.co.kr/cache/recipe/2017/01/26/32fd4fa4ea9f460c65af755f8157d9d71.jpg'}, {'step_number': 9, 'description': '10. 해물파김치전을 먹기 좋게 썰어서 완성접시에 놓아 줍니다. \n큼지막하게 원형으로 놓아도 좋지만\n먹기 좋게 아예 썰어서 가지런하게 놓아조 좋지요.', 'image_url': 'https://recipe1.ezmember.co.kr/cache/recipe/2017/01/26/3d0b8af6523a8bfd544310979d7ec0a11.jpg'}]"
39929,메인반찬,술안주,해물류,부침,알토란 오징어부추전,오징어부추전,"4,390",10분 이내,아무나,1인분,"[('부추', '300g'), ('오징어                                                                                300g', '2마리'), ('물', '2.5컵'), ('밀가루', '2.5컵'), ('소금', '1꼬집'), ('밀가루', '적당량'), ('기름', '4큰술'), ('홍고추', '1/2개'), ('달걀                                                                                2장기준', '2개')]","안녕하세요? 밥심은 국력입니다. 비오는 날에는 막걸리에 파전이 생각나시죠? 실제로 장마철에는 밀가루 판매가 많아진다고 합니다. 집에서 전을 많이 부쳐 먹기 때문이지요. 이렇게 비오는 날, 전이 생각나는 이유는 빗방울이 떨어지는 소리가 전을 부칠 때 지글대는 소리와 주파수가 같고요. 또한 비오는 날에는 굽는 기름 냄새가 더 멀리 퍼져나가기 때문이라는 설도 있습니다. 막걸리와 전이 잘 어울리는 이유는 밀가루는 찬 성질이 있어서 소화기능을 떨어뜨리는데, 막걸리에 풍부한 식이섬유와 유산 균이 소화기능을 보완해주기 때문이랍니다. 기가 막힌 궁합이지요? ㅋㅋ 오늘은 알토란 오징어부추전을 만들어 보겠습니다.","[{'step_number': 1, 'description': '냄비에 물 2컵반을 넣고 끓으면 자른 오징어를 넣고 20초 정도 살짝 데쳐줍니다. 오징어를 데치면 수분이 덜 나와서 전을 부쳤을 때 오징어가 전에서 떨어지지 않아요. 오징어는 물기를 빼두고요.', 'image_url': 'https://recipe1.ezmember.co.kr/cache/recipe/2018/07/04/caca1049e6fa21b050e86fa72d7495991.jpg'}, {'step_number': 2, 'description': '오징어 데친물은 식혀서 반죽물로 사용할 겁니다. 훨씬 맛있겠죠?', 'image_url': 'https://recipe1.ezmember.co.kr/cache/recipe/2018/07/04/7308fa255afa143fbd7254b0e0fa31e31.jpg'}, {'step_number': 3, 'description': '밀가루와 오징어데친물의 비율은 1:1입니다. 각 2컵반씩이죠. 꽃소금을 한 꼬집 넣어 간을 합니다. 오징어 데친 물이 간이 있어서 소금은 조금만 넣어줍니다.', 'image_url': 'https://recipe1.ezmember.co.kr/cache/recipe/2018/07/04/1425a0eabb519c7dab12ff3e7ef5c6ad1.jpg'}, {'step_number': 4, 'description': '잘 저어놓은 밀가루 반죽입니다.', 'image_url': 'https://recipe1.ezmember.co.kr/cache/recipe/2018/07/04/ec13b013801c85e4bf02545f1785fd181.jpg'}, {'step_number': 5, 'description': '부추는 이등분하여 잘라둔 것인데요. 날밀가루를 묻히고 반죽물에 한번 적신 다음 손으로 반죽물을 쭉 털어주세요. 뿌리부분과 끝부분을 반대로 섞어서 가지런히 해주면 높이가 맞아지지요. 뿌리쪽이 조금 높기 때문이지요.', 'image_url': 'https://recipe1.ezmember.co.kr/cache/recipe/2018/07/04/628249f1e465389c9b95e2d82c2ed40c1.jpg'}, {'step_number': 6, 'description': '데친 오징어도 날밀가루를 묻혀주세요.', 'image_url': 'https://recipe1.ezmember.co.kr/cache/recipe/2018/07/04/634efcee9dae8f7aefe22e76d49493e71.jpg'}, {'step_number': 7, 'description': '밀가루 묻은 오징어를 반죽물에 한번 입혀주고요. 날밀가루를 한번 묻혀줘야 반죽물이 잘 벗겨지지 않지요.', 'image_url': 'https://recipe1.ezmember.co.kr/cache/recipe/2018/07/04/5b3bdffce03b44d513fd2e61217db8781.jpg'}, {'step_number': 8, 'description': '팬을 먼저 달군 다음 기름을 넉넉히 넣어주고 반죽물을 묻힌 부추를 올려줍니다. 어느 정도 부추가 밑면이 노릇하게 익어갈 때쯤 반죽물 입힌 오징어를 올려줍니다. 홍고추도 올려주고요. 날계란을 구멍을 만들어서 올려줍니다.', 'image_url': 'https://recipe1.ezmember.co.kr/cache/recipe/2018/07/04/bc88f06f20cf2e90f9f8e74e386bdfa41.jpg'}, {'step_number': 9, 'description': '뒤집개로 날계란 노른자를 터트려줍니다.', 'image_url': 'https://recipe1.ezmember.co.kr/cache/recipe/2018/07/04/42358f8bffaf65ca1f8e48f5cb79edad1.jpg'}, {'step_number': 10, 'description': '부추 가장자리가 익기 시작하면 뒤집어줍니다. 이 때 기름을 약간 추가해주는 것이 좋구요.', 'image_url': 'https://recipe1.ezmember.co.kr/cache/recipe/2018/07/04/7279f6d264ab02c11b82bb84f5471f221.jpg'}, {'step_number': 11, 'description': '계란이 들어가서 비쥬얼이 너무 고급지죠.', 'image_url': 'https://recipe1.ezmember.co.kr/cache/recipe/2018/07/04/fdb7dd3644eec64786df5589e59dbf531.jpg'}]"
