index,종류별,상황별,재료별,방법별,글 제목,레시피이름,조회수,조리시간,난이도,인분,재료,소개글,조리순서
56980,디저트,간식,채소류,튀김,감자맛탕,감자맛탕,"1,394",30분 이내,중급,3인분,"[('골프공크기 감자 11개', '500g'), ('소금', '1T'), ('식용유', '충분히'), ('설탕', '1T'), ('물엿', '2T'), ('물', '2T'), ('통깨', '취향껏'), ('시나몬파우더                                                                                선택사항', '1t')]",두백감자로 달달한요리 합니다. 전분이 많은감자라 속은 보드랍고 겉은 달달하고~,"[{'step_number': 1, 'description': '감자는 좀 작은감자를 선택했어요.', 'image_url': 'https://recipe1.ezmember.co.kr/cache/recipe/2018/10/19/8547e0ba729a60ddc3df22e0a0e04cee1.jpg'}, {'step_number': 2, 'description': '맛탕했을때 딱 4등분 하면 크기가 맞거든요', 'image_url': 'https://recipe1.ezmember.co.kr/cache/recipe/2018/10/19/1935445de83f2ad9500aec7c17f519d51.jpg'}, {'step_number': 3, 'description': '끓는물에 소금넣고 감자를 약2분간만 데쳐줍니다.소금1큰술센불', 'image_url': 'https://recipe1.ezmember.co.kr/cache/recipe/2018/10/19/45daa2fa68cd632cf44bc54df52d7de91.jpg'}, {'step_number': 4, 'description': '데친 감자는 찬물에 샤워시키고 물기를 닦아줍니다. 기름에 튀길꺼라 물기있으면 안되어요', 'image_url': 'https://recipe1.ezmember.co.kr/cache/recipe/2018/10/19/3571b29dc297edb4aa623766f1f9c6201.jpg'}, {'step_number': 5, 'description': '좁은 소스팬에 튀겼어요. 좁을수록 기름이 덜 필요하니까요~ 튀길온도가 되면 감자 넣고 튀겨줍니다.중불튀길온도는 조각난 감자 하나넣어서 끓어오르면 기름온도가 된거예요', 'image_url': 'https://recipe1.ezmember.co.kr/cache/recipe/2018/10/19/b1efa67f8d8bbe85f03ff57780d3de191.jpg'}, {'step_number': 6, 'description': '하얗던 감자가', 'image_url': 'https://recipe1.ezmember.co.kr/cache/recipe/2018/10/19/de40706553e39bb13088e167b10defc21.jpg'}, {'step_number': 7, 'description': '노르스름하게 바뀔때까지. 한번 튀겨낸후 한번 더 튀겨주면 더 바삭합니다.', 'image_url': 'https://recipe1.ezmember.co.kr/cache/recipe/2018/10/19/ae9ea3fb8ff2a8cf721485d47afb33ac1.jpg'}, {'step_number': 8, 'description': '감자가 튀겨졌으면 건져서', 'image_url': 'https://recipe1.ezmember.co.kr/cache/recipe/2018/10/19/2d0b357ce348e809ed61cbd9748026f71.jpg'}, {'step_number': 9, 'description': '기름을 빼주고요.', 'image_url': 'https://recipe1.ezmember.co.kr/cache/recipe/2018/10/19/7c5e2ebecc61cb2d66581982dee8a4611.jpg'}, {'step_number': 10, 'description': '뜨거운기름은 두꺼운유리병에 따라낸후 그대로 사용합니다. 양념을 넣어 보그르 끓여요물2T, 설탕1T, 물엿2T, 시나몬파우더1t', 'image_url': 'https://recipe1.ezmember.co.kr/cache/recipe/2018/10/19/74a3275fac2db5f136d2d5ea90ad74941.jpg'}, {'step_number': 11, 'description': '양념이 보그르 끓어오른후 삶은감자를 넣어서 버무려줍니다', 'image_url': 'https://recipe1.ezmember.co.kr/cache/recipe/2018/10/19/88e073ba89ce47652ae07c419eb087091.jpg'}, {'step_number': 12, 'description': '바로 불끄고 잔열로 무침해주면 되어요. 통깨 톡 넣어주고요 끝. (반은 그냥했고요)', 'image_url': 'https://recipe1.ezmember.co.kr/cache/recipe/2018/10/19/8a98c4e41c83ec102fc67559028e955b1.jpg'}, {'step_number': 13, 'description': '(반 분량은)시나몬파우더와 견과류 넣어서 졸였더니 향도 좋고, 색깔도 더 진하고 맛있어요.', 'image_url': 'https://recipe1.ezmember.co.kr/cache/recipe/2018/10/19/517add1ff1184da2fe7762b6180827f71.jpg'}]"
56981,디저트,간식,채소류,튀김,고구마 튀김,고구마튀김,"1,934",30분 이내,초급,4인분,"[('왕고구마', '1개'), ('설탕', '5큰술'), ('식용유', '넉넉히')]",왕고구마 한개가 있어서 튀김을 만들어 봤습니다.겉은 바삭 달콤 속은 촉촉하게 튀겨봤습니다.,"[{'step_number': 1, 'description': '고구마는 껍질을 벗기고 사각 모양으로 크지 않게 썰어주세요', 'image_url': 'https://recipe1.ezmember.co.kr/cache/recipe/2018/10/18/98b1ade646d08bdac62c549313cd14781.jpg'}, {'step_number': 2, 'description': '물에 씻어 전분을 씻어내고 체반에 받쳐 물기를 빼주세요.물기를 키친타올로 닦아준후 설탕을 넣고 버무려주세요', 'image_url': 'https://recipe1.ezmember.co.kr/cache/recipe/2018/10/18/f7e25b15b988c46f431dd48f5b17bfcb1.jpg'}, {'step_number': 3, 'description': '팬에 고구마를 넣고 식용유를 넉넉히 붓고 불을 켜주세요', 'image_url': 'https://recipe1.ezmember.co.kr/cache/recipe/2018/10/18/34027485dbb836b9fd6a64c96d2cd44a1.jpg'}, {'step_number': 4, 'description': '고구마가 노릇하게 튀겨지면 뒤집어 밑면도 노릇하게 튀겨주세요(중불)', 'image_url': 'https://recipe1.ezmember.co.kr/cache/recipe/2018/10/18/f517e1be32e2cb917921eee20ef9c20e1.jpg'}, {'step_number': 5, 'description': '서로 붙지않게 하나씩 띄어 주고 식혀주세요', 'image_url': 'https://recipe1.ezmember.co.kr/cache/recipe/2018/10/18/689a01686c438fffcaa45d4bb746d09b1.jpg'}]"
56982,디저트,간식,채소류,튀김,구황 작물. 손에 묻지 않는 고구마 맛탕.(빠스),고구마맛탕,"1,591",30분 이내,아무나,2인분,"[('고구마', '2개'), ('포도씨유', '적당량'), ('설탕', '1T'), ('포도씨유', '1T'), ('올리고당', '1T')]",손에 묻지 않고 달콤하고 바삭하게 고구마 맛탕을 만들었어요.,"[{'step_number': 1, 'description': '고구마는 껍질벗겨 들쑥날쑥 두툼하게 썬뒤 물에 20분정도 담궈 전분기를 뺍니다.', 'image_url': 'https://recipe1.ezmember.co.kr/cache/recipe/2019/10/21/9ead6cc6ffc73120f8c036664b1acf451.jpg'}, {'step_number': 2, 'description': '전분기를 뺀 고구마는 기름에 튈수가 있으니 키친타올로 닦아 주세요.', 'image_url': 'https://recipe1.ezmember.co.kr/cache/recipe/2019/10/21/b1db844a89a56162e19731d59a39ec381.jpg'}, {'step_number': 3, 'description': '닦은 고구마는 기름을 자작하게 부어 노릇하게 앞뒤로 튀겨줍니다.\n젓가락으로 찔러 들어가면 다 익은거에요.\n튀긴 고구마는 채망에 건져 기름기를 뺍니다.', 'image_url': 'https://recipe1.ezmember.co.kr/cache/recipe/2019/10/21/1ce3da16e1a3b4b7cc9879dd7d616c8c1.jpg'}, {'step_number': 4, 'description': '설탕과 식용유,올리고당은 넣고 젓지 말고 갈색빛이 날때 까지 끓여 줍니다.', 'image_url': 'https://recipe1.ezmember.co.kr/cache/recipe/2019/10/21/336cd0a9eda98458c43f42b2ca4748131.jpg'}, {'step_number': 5, 'description': '갈색빛이 나면 고구마와 검은깨,아몬드 넣어 재빨리 뒤적여 꺼냅니다.\n*튀긴 고구마와 견과류를 같이 넣어 버무려야 잘 붙고 식은 후엔 붙지 않습니다.', 'image_url': 'https://recipe1.ezmember.co.kr/cache/recipe/2019/10/21/254491f03addb1935d7a1fecd03a005c1.jpg'}]"
56983,디저트,간식,채소류,튀김,"구황작물, 감자튀김 아이들이 정말 좋아해요.",감자튀김,905,30분 이내,초급,2인분,"[('감자                                                                                주먹만한', '3개'), ('식용유', '적당히'), ('게랑드 소금', '적당히'), ('파슬리가루나 바질가루', '톡톡'), ('전분', '1수저')]","요즘 감자튀김 매력에 쏙 빠졌네요.
초간단 감자튀김 간단한끼로도 좋고, 간식으로도 아주 좋지요.
감자튀김 바삭하게 튀겨 뜨거울때 먹으면 진짜 맛있죠.
저는 딸아이가 치아교정중이라 부드러운 감자튀김을 만들었어요.","[{'step_number': 1, 'description': '감자는 껍질을 벗기고,\n도톰하게 썰어 찬물에 담가 전분을 빼 줍니다.', 'image_url': 'https://recipe1.ezmember.co.kr/cache/recipe/2019/10/28/01a106b07d2bb9e6cddf1e570aae05a71.jpg'}, {'step_number': 2, 'description': '체반에 올려 물기를 쏙 빼 주었어요.', 'image_url': 'https://recipe1.ezmember.co.kr/cache/recipe/2019/10/28/48db810169bf55a04da33b7d9755f8e41.jpg'}, {'step_number': 3, 'description': '전분가루 한수저 넣고 골고루 뒤적여 줍니다.', 'image_url': 'https://recipe1.ezmember.co.kr/cache/recipe/2019/10/28/9eb6ea627870808d90734993f59535f41.jpg'}, {'step_number': 4, 'description': '기름은 넉넉히 준비하고,\n예열을 시킵니다.\n기름온도는 나무젓가락을 넣어서 기포가 생기면 ok\n감자를 넣고 튀겨 줍니다.', 'image_url': 'https://recipe1.ezmember.co.kr/cache/recipe/2019/10/28/cb2f0e5041439b41086949e076df705d1.jpg'}, {'step_number': 5, 'description': '중불로 15분정도 노릇하게 튀겨 줍니다.\n저는 딸아이가 치아교정중이라 \n바삭함보다는 부드러운 감자튀김을 만들었어요.', 'image_url': 'https://recipe1.ezmember.co.kr/cache/recipe/2019/10/28/3013ace2586304caf58b4b8be679f7d91.jpg'}, {'step_number': 6, 'description': '철망에 올려 기름을 빼주고,\n게랑드 소금과 파슬리가루 솔솔 뿌려 줍니다.', 'image_url': 'https://recipe1.ezmember.co.kr/cache/recipe/2019/10/28/138a7912b09b15a306a3004e987cf98a1.jpg'}]"
56984,디저트,간식,채소류,튀김,초간단 휴게소 고구마스틱 Sweet Potato Sticks,고구마스틱,"1,327",20분 이내,초급,2인분,"[('고구마', '2개'), ('식용유', '')]","고구마만 준비되어있다면 
쉽게 할 수 있는 고구마스틱

튀기는게 번거롭지만 튀기는게 맛이 x1000배가 되지않나요?","[{'step_number': 1, 'description': '1.고구마를 깨끗이 닦아 손질해준다.', 'image_url': 'https://recipe1.ezmember.co.kr/cache/recipe/2020/04/09/c680243d15bb8010f529f9b532fe022e1.png'}, {'step_number': 2, 'description': '2.고구마를 적당한 굵기로 채썰어준다.\n어떻게 잘라야 고구마스틱같을까 고민하다가\n면으로 잘라서 길게 채 썰었어요\n그랬더니 감자튀김 ㅎㅇ', 'image_url': 'https://recipe1.ezmember.co.kr/cache/recipe/2020/04/09/68912e16833ff700c8465cabe75493f81.png'}, {'step_number': 3, 'description': '3.고구마를 물에 담궈 전분기를 빼준다.\n반드시 물에 헹궈 전분기를 빼주세요.', 'image_url': 'https://recipe1.ezmember.co.kr/cache/recipe/2020/04/09/d3473a3464ad90f275bf32ec1806da581.png'}, {'step_number': 4, 'description': '기름은 츄러스때 남은 기름 재사용.\n절약왕!!\n(전에 포스팅한 츄러스만들고 남은기름을 사용했어요~)', 'image_url': 'https://recipe1.ezmember.co.kr/cache/recipe/2020/04/09/4c7e375cb7cf4143ea497239dd573b741.png'}, {'step_number': 5, 'description': '4. 물기를 뺀 고구마를 기름에 넣고 튀겨준다.', 'image_url': 'https://recipe1.ezmember.co.kr/cache/recipe/2020/04/09/62cf072a7e6ea5d9a5d1dbaf1810cb811.png'}, {'step_number': 6, 'description': '골고루 익을 수 있게 잘 뒤적이며 \n튀겨주셔야 합니다.', 'image_url': 'https://recipe1.ezmember.co.kr/cache/recipe/2020/04/09/afa06da00bf77b67bdb94f129600549d1.png'}, {'step_number': 7, 'description': '고구마스틱은 튀김색이 적당히 날 때\n꺼내주시면 되어요!\n좀 바싹 익혀주셔야 바삭바삭\n우리가 알던 그 고구마스틱으로 드실 수 있습니다!', 'image_url': 'https://recipe1.ezmember.co.kr/cache/recipe/2020/04/09/9ec4b4161efb89bd2f125cbfbad63d651.png'}, {'step_number': 8, 'description': '굵기가 얇을 수록 JMT', 'image_url': 'https://recipe1.ezmember.co.kr/cache/recipe/2020/04/09/372e6e3130860261f0fdd2fa1df9910b1.png'}, {'step_number': 9, 'description': '그냥 이유없는 휴게소 감성 살리기~~\n고구마랑 식용유만 있으면 만들 수 있는 초간단 고구마스틱\n설탕도, 소금도 필요없어요!\n2천원돈으로 고구마스틱 12000원어치는 먹은 것 같은 핵이득기분. 헤헤', 'image_url': 'https://recipe1.ezmember.co.kr/cache/recipe/2020/04/09/e8188dc7842ed56923d66a598bec61441.png'}]"
56985,디저트,간식,채소류,튀김,겨울간식 고구마맛탕 만들기,고구마맛탕,"1,124",30분 이내,아무나,2인분,"[('고구마', '1~2개'), ('꿀', '조금'), ('오일', '')]",고구마맛탕 만들기를 하려고 준비해 봤네요. 워낙 만들기 간단하기 때문에 레시피라고할것도 없구요~ 내맘대로 뚝딱 만들어 먹으니 꿀맛이 따로 없어요.,"[{'step_number': 1, 'description': '고구마 껍질을 모두 감자깍는 필러로 깔끔하게 벗겨주었어요.', 'image_url': 'https://recipe1.ezmember.co.kr/cache/recipe/2020/12/23/07cbd75d9c4fdd60279db5af4fcf633c1.jpg'}, {'step_number': 2, 'description': '다음은 고구마를 먹기좋은 크기로 깍뚝썰기를 했는데 썰다보니 양이 많은거 같아 1개 반정도만 썰어 주었답니다. 가족수에맞춰 준비하세요~', 'image_url': 'https://recipe1.ezmember.co.kr/cache/recipe/2020/12/23/db28a611305180a4556faf03c584ddd31.jpg'}, {'step_number': 3, 'description': '고구마맛탕하면 기름에 풍덩풍덩 넣어 튀겨야 되지만 집에서는 기름에 튀기기 힘들기 때문에 저는 늘 프라이팬에 기름 조금 넉넉히 넣어주고 계속 뒤집으면서 익혀주고 있는데요~ 요렇게 익혀줘야 기름도 많이 안들고 남은기름 처리할일도 없고 좋더라구요.', 'image_url': 'https://recipe1.ezmember.co.kr/cache/recipe/2020/12/23/2274987e45b905c03a59ca8ed9d338f31.jpg'}, {'step_number': 4, 'description': '대신에 계속 뒤집어 익혀주어야 하지만 생각보다 빠르게 익어준답니다.', 'image_url': 'https://recipe1.ezmember.co.kr/cache/recipe/2020/12/23/40c41078075fb4bc442fd5c908df8c101.jpg'}, {'step_number': 5, 'description': '익은 고구마는 젓가락으로 콕콕 찔러보고 익었으면 키친타월에 올려 잔여기름을 빼주고~', 'image_url': 'https://recipe1.ezmember.co.kr/cache/recipe/2020/12/23/2ec7384198c105a726e069ea3b905fc01.jpg'}, {'step_number': 6, 'description': '후라이팬에 남아있는 기름은 키친타월로 닦아준후 튀겨놓은 고구마를 다시 후라이팬에 넣어주고 저는 꿀을 넣어 후다닥 섞어주고 마무리 했는데요~ 요건 취향껏 꿀이나, 물엿, 요리당, 시럽 등으로 섞어줘도 좋을거 같네요~', 'image_url': 'https://recipe1.ezmember.co.kr/cache/recipe/2020/12/23/71cc38804224cccc0486d0d18878e6a91.jpg'}, {'step_number': 7, 'description': '꿀이 보글보글 끓기시작하면 전기렌지 불을 꺼주고 전기렌지 잔열로 섞어주면 된답니다. 가스렌지를 사용하는 분들은 가스렌지 불을 약하게 하고 골고루 섞어주면 될거 같아요.', 'image_url': 'https://recipe1.ezmember.co.kr/cache/recipe/2020/12/23/64cde87fea3751becc30fbc6a53921821.jpg'}, {'step_number': 8, 'description': '마지막으로 검은깨 솔솔 뿌리고 마무리~ 왠지 검은깨를 뿌리면 더 먹음직 스러운게 기분 좋더라구요.', 'image_url': 'https://recipe1.ezmember.co.kr/cache/recipe/2020/12/23/9100887347ebc859cab9f15579e122261.jpg'}]"
56986,디저트,간식,채소류,튀김,"고구마 맛탕 만들기ㅣ 초간단한 고구마 맛탕 만드는 법, 너무 쉬움 주의",고구마맛탕,"8,426",None,None,None,"[('고구마', '3~4개'), ('올리고당', '5스푼'), ('비정제설탕', '2~3스푼'), ('시나몬 가루', '1스푼'), ('식용유', ''), ('참깨', '')]",,"[{'step_number': 1, 'description': '고구마를 먹기 좋은 크기로 잘라 전자레인지에 4분정도 돌린다.전자레인지', 'image_url': None}, {'step_number': 2, 'description': '그 사이 올리고당 5스푼, 마스코바도 설탕 2~3스푼,시나몬 가루 1스푼 유리그릇에 넣어 섞어준다.', 'image_url': None}, {'step_number': 3, 'description': '팬에 식용유를 충분히 두른 후 익힌 고구마와 소스를 넣어 잘 볶아준다.', 'image_url': None}, {'step_number': 4, 'description': '마지막으로 참깨를 넣어주면 완성!', 'image_url': None}]"
56987,디저트,간식,채소류,튀김,아이들 간식 양파링만들었어요.,양파링,648,15분 이내,아무나,2인분,"[('양파', '2개'), ('빵가루', '1컵'), ('계란', '3개'), ('튀김가루', '1컵'), ('식용유', '약간')]",바삭한 양파링 이제 에어프라이어로 쉽게 만들어 볼께요.,"[{'step_number': 1, 'description': '아이들 이제 양파링 직접 만들어서 먹이자구요', 'image_url': 'https://recipe1.ezmember.co.kr/cache/recipe/2021/01/06/cc5d5e290e93290eb1781f20743bfa451.jpg'}, {'step_number': 2, 'description': '우선 양파의 매운기를 빼기 위해서 물에 담가서 매운기를 빼주세요.', 'image_url': 'https://recipe1.ezmember.co.kr/cache/recipe/2021/01/06/5cb99c2808512e0fa9faa43440b6e4fc1.jpg'}, {'step_number': 3, 'description': '그리고 봉지에 튀김가루를 넣고 매운기 뺀 양파를 넣고 흔들어서 튀김옷을 입혀 주세요.', 'image_url': 'https://recipe1.ezmember.co.kr/cache/recipe/2021/01/06/dece1d290261bdc57502761d925476dd1.jpg'}, {'step_number': 4, 'description': '계란 옷도 입셔 주시구요.', 'image_url': 'https://recipe1.ezmember.co.kr/cache/recipe/2021/01/06/6f33c692ac191aea8ea4917619bcc0e81.jpg'}, {'step_number': 5, 'description': '그다음 빵가루 옷까지 입혀 주세요.', 'image_url': 'https://recipe1.ezmember.co.kr/cache/recipe/2021/01/06/f0fd535c8253773e45db3687195097c31.jpg'}, {'step_number': 6, 'description': '종이 호일을 깔고 양파 준비한 것을 넣고 위에 기름을 약간 둘러 주세요.\n그리고 에어프라이어 180도 10분 돌리고 뒤집어서 180도 3분 더 돌려 주세요.에어프라이어', 'image_url': 'https://recipe1.ezmember.co.kr/cache/recipe/2021/01/06/d79e7c6091eefd018fc03cb164f883e61.jpg'}, {'step_number': 7, 'description': '그럼 맛있는 양파튀김 양파링이 완성이랍니다.', 'image_url': 'https://recipe1.ezmember.co.kr/cache/recipe/2021/01/06/fcada2a8fea67828fae953fcc8f976181.jpg'}]"
