index,종류별,상황별,재료별,방법별,글 제목,레시피이름,조회수,조리시간,난이도,인분,재료,소개글,조리순서
8728,밑반찬,일상,달걀/유제품,찜,푸딩처럼 부드러운 계란찜(달걀찜) 좋아요^^,계란찜,"9,942",30분 이내,초급,2인분,"[('계란', '2개'), ('대파', '1쪽'), ('새우젓', '1수저'), ('다시마 육수', '1컵')]",입맛 없고 속이 불편할 때 부드럽게 먹기 좋은 것 중 계란찜이 있는데요. 부드러운 맛이 그냥 먹어도 편하고 밥이랑도 너무 좋아 어른들이나 아이들 입맛에 참 좋답니다.,"[{'step_number': 1, 'description': '계란 2개와 다시마 우린 육수 1컵\n그리고 국물만 사용할 새우젓과 대파 정도 준비합니다.', 'image_url': 'https://recipe1.ezmember.co.kr/cache/recipe/2018/01/16/b5333fd127f6f6d552fb59701327994d1.jpg'}, {'step_number': 2, 'description': '먼저 계란 2개를 넣고\n육수 1컵을 넣습니다.', 'image_url': 'https://recipe1.ezmember.co.kr/cache/recipe/2018/01/16/8eaf488d638f47afbc731c8131a286a81.jpg'}, {'step_number': 3, 'description': '새우젓을 다져서 국물만 1수저 넣었습니다.', 'image_url': 'https://recipe1.ezmember.co.kr/cache/recipe/2018/01/16/5efdd41ac625f0d9404b6d412929e1661.jpg'}, {'step_number': 4, 'description': '그리고는 잘 젓습니다.', 'image_url': 'https://recipe1.ezmember.co.kr/cache/recipe/2018/01/16/a09cc789b3d1d85eeb5f8a22fab29c2c1.jpg'}, {'step_number': 5, 'description': '부드럽게 만들기 위해 체에 잘 걸려줍니다.', 'image_url': 'https://recipe1.ezmember.co.kr/cache/recipe/2018/01/16/7c5a899f34ae9a7318e2d1e4f5ead45d1.jpg'}, {'step_number': 6, 'description': '체에 걸러준 계란을 그릇에 담습니다.', 'image_url': 'https://recipe1.ezmember.co.kr/cache/recipe/2018/01/16/97846153c10d0f77e0a11a304658cc8e1.jpg'}, {'step_number': 7, 'description': '푸딩처럼 부드럽게 만들기 위해 냄비에 넣어 찌는 동안 수증기가 생겨 찜에 떨어지면 부드럽거나 푸딩처럼 만들 수 없으니 물방울이 떨어지는 것을 막기 위해 랩으로 감싸주면 편합니다.', 'image_url': 'https://recipe1.ezmember.co.kr/cache/recipe/2018/01/16/8c31f4e72a6311d9451db9a9ea45e9a91.jpg'}, {'step_number': 8, 'description': '그리고는 그릇에 반 정도 올라오는 물을 먼저 넣어 살짝 뜨거워지면,계란을 넣은 그릇을 넣고 뚜껑을 덮고 10~12분을 쪄줍니다.\n삶은 계란이나 찜을 오래 끓이면 퍼런 색이 되는데, 오래 끓이지 않아야 색감도 고스란히 살아있어요.', 'image_url': 'https://recipe1.ezmember.co.kr/cache/recipe/2018/01/16/39e6c99e2058828f02139d50a26ccc811.jpg'}]"
8729,밑반찬,일상,달걀/유제품,찜,백종원 폭탄 달걀찜 만들기,폭탄달걀찜,"7,672",10분 이내,아무나,3인분,"[('달걀', '6개'), ('물', '1/3컵'), ('소금', '1/2T'), ('설탕', '1/2T')]","고깃집 가면 꼭 나오는 폭탄달걀찜..
백종원 레시피로 만들어 볼게요","[{'step_number': 1, 'description': '달걀 6개 준비해요\n달걀에 물 1/3컵, 소금 1/2T, 설탕 1/2T를 넣고 잘 섞어 달걀을 풀어 줍니다', 'image_url': 'https://recipe1.ezmember.co.kr/cache/recipe/2018/03/21/29981c08c1180a45cce046cb9034d5841.jpg'}, {'step_number': 2, 'description': '채에 한 번 내리면 더 부드럽게 즐길 수 있어요\n저는 그냥 사용해요', 'image_url': 'https://recipe1.ezmember.co.kr/cache/recipe/2018/03/21/89814aaf4ea6a8ea60c96bccc515f8bc1.jpg'}, {'step_number': 3, 'description': '뚝배기에 내용물이 80% 정도 되도록 부어요\n작은 뚝배기 사용하니 딱 알맞네요', 'image_url': 'https://recipe1.ezmember.co.kr/cache/recipe/2018/03/21/ef67e840e80badda27b740ead21882071.jpg'}, {'step_number': 4, 'description': '중약불로 저으며 익혀 줍니다\n눌러붙지 않도록 모서리쪽을 잘 저어 주며 익혀야 됩니다', 'image_url': 'https://recipe1.ezmember.co.kr/cache/recipe/2018/03/21/dc0f8959d782df6b4e6819e472ddf0ca1.jpg'}, {'step_number': 5, 'description': '몽글몽글 익는게 느껴지면 불 더 줄이고\n높이감이 있는 뚜껑을 덮어 뜸들이기 합니다', 'image_url': 'https://recipe1.ezmember.co.kr/cache/recipe/2018/03/21/4c510728158fe9b6b623f3abd5d299df1.jpg'}, {'step_number': 6, 'description': '덮어둔 뚜껑에서 물방울이 맺히면 완성~~\n불 꺼 줍니다', 'image_url': 'https://recipe1.ezmember.co.kr/cache/recipe/2018/03/21/fa1c5b2423ede627df4ea9e4a483f8401.jpg'}, {'step_number': 7, 'description': '와우~!!\n폭탄달걀찜 완성입니다', 'image_url': 'https://recipe1.ezmember.co.kr/cache/recipe/2018/03/21/fa251d4f68e65851671ce1de6921b19f1.jpg'}]"
8730,밑반찬,일상,달걀/유제품,찜,폭탄계란찜 만드는 법! 이거 먹고 빵빵 터지는 하루 보내기를 기대~ ㅎㅎ,폭탄계란찜,"13,768",15분 이내,초급,3인분,"[('계란', '4개'), ('쪽파', '1줄기'), ('파프리카 빨강', '약간'), ('통후추 간 것', '약간'), ('새우젓', '1작은술'), ('미림', '1큰술'), ('다시마', '1장'), ('물', '1/2컵'), ('밥공기오목한것', '')]","아침엔 뭘 만들까 하다가 듬뿍 보이는 계란을 꺼내들고
무지하게 폭발하는 화산처럼
높게 쏟는 폭탄계란찜을 만들기로 결심했다지요.
몇미터나 올릴까? ㅋㅋ
꿈처럼 야무진 생각을 하고 폭탄계란찜 만드는 법 출발!","[{'step_number': 1, 'description': '계란은 한 개에 70g 정도 중량.\n왕란이라고 보면 됩니다.\n먼저 계량컵에 물 1/2컵 담고\n다시마 한 장 넣어 우립니다.', 'image_url': 'https://recipe1.ezmember.co.kr/cache/recipe/2018/03/24/7616e2cb09893dbde75c2ce5997467991.jpg'}, {'step_number': 2, 'description': '볼에 계란을 깨서 넣고요.\n새우젓은 1작은술 준비했어요.\n국물을 꼭 짜서 볼에 넣고요.', 'image_url': 'https://recipe1.ezmember.co.kr/cache/recipe/2018/03/24/b72b47e63b5c9f14febaa5f930df19471.jpg'}, {'step_number': 3, 'description': '쪽파 한 대새우젓은 다져서 넣어요.\n와 파프리카 빨간색 약간.', 'image_url': 'https://recipe1.ezmember.co.kr/cache/recipe/2018/03/24/a0e21c7a88883d27298e7706efb935211.jpg'}, {'step_number': 4, 'description': '미림 1큰술 넣고', 'image_url': 'https://recipe1.ezmember.co.kr/cache/recipe/2018/03/24/0de7715ab7ae076ede3510f178daa00b1.jpg'}, {'step_number': 5, 'description': '쪽파와 파프리카도 쫑쫑 썰고요.', 'image_url': 'https://recipe1.ezmember.co.kr/cache/recipe/2018/03/24/42e195529fe0fd9d267d0fc2429e266f1.jpg'}, {'step_number': 6, 'description': '다시마 육수를 계란물에 넣고 풀어줍니다.', 'image_url': 'https://recipe1.ezmember.co.kr/cache/recipe/2018/03/24/24b4823063ff2b9987d16a02f91448501.jpg'}, {'step_number': 7, 'description': '노랗게 잘 풀고요.', 'image_url': 'https://recipe1.ezmember.co.kr/cache/recipe/2018/03/24/b31833ec5602d35893e2f42f00034a321.jpg'}, {'step_number': 8, 'description': '계란찜을 뚝배기에 담는데요.\n뚝배기에 담긴 계란물은 80% 이상 담았어요.불은 센불 ~\n그렇다고 이렇게 뚝배기 밖으로 불이 퍼지면\n계란물 저을 때 무지 뜨겁다는 것!\n중간불에서 센불 정도로 불을 맞추고요.', 'image_url': 'https://recipe1.ezmember.co.kr/cache/recipe/2018/03/24/c54be4e986eee86df0b2ed620e867a6c1.jpg'}, {'step_number': 9, 'description': '수저로 게속 저어야 바닥이 눌어붙지 않아요.', 'image_url': 'https://recipe1.ezmember.co.kr/cache/recipe/2018/03/24/d3daed4bf81b561266afd4fc0a9630691.jpg'}, {'step_number': 10, 'description': '몽글몽글 이 정도 상황이면 좋아요.\n시간은 5분 정도 소요되었고요.', 'image_url': 'https://recipe1.ezmember.co.kr/cache/recipe/2018/03/24/6cb05f91bf6fbc0406bf271487bd50171.jpg'}, {'step_number': 11, 'description': '야채 준비한 것 이 단계에서 올려주고요.', 'image_url': 'https://recipe1.ezmember.co.kr/cache/recipe/2018/03/24/af561f5b521e39520be5af7c74d349751.jpg'}, {'step_number': 12, 'description': '불은 훅 줄여서 불이 나오나 안 나오나 하는 정도로 두고요.\n2분 정도 둡니다.\n얘가 땀을 질질 흘리는데요.\n옆구리로 국물이 흘러요.~', 'image_url': 'https://recipe1.ezmember.co.kr/cache/recipe/2018/03/24/e5377feed466fb90e77ddffbe2c92e311.jpg'}, {'step_number': 13, 'description': '불을 끄고요.\n기다립니다.\n허걱 ~ 불을 꺼도 이렇게 그릇을 들어 올릴 만큼 \n계란찜이 폭발하기 시작합니다.\n화산이 터지기 직전이라지요.', 'image_url': 'https://recipe1.ezmember.co.kr/cache/recipe/2018/03/24/38c18903ad6e652be4638d74de41e1f21.jpg'}]"
8731,밑반찬,일상,달걀/유제품,찜,"백 선생 집밥, 폭풍 달걀찜",달걀찜,"6,751",15분 이내,아무나,4인분,"[('달걀', '6개'), ('물', '1/3컵'), ('소금', ''), ('깨소금', ''), ('참기름', '약간'), ('대파', '약간')]","달걀은 어느 집 냉장고에 다 들어있어 국민반찬이라 불립니다. 반찬이 마땅찮을 때 달걀말이, 달걀부침, 달걀찜 등 쉽게 만들어 먹을 수 있는 완전식품이기 때문입니다. 방송한 지 제법 오래되었지만 한 번 따라해 보았습니다.","[{'step_number': 1, 'description': '대파와 양파는 잘게 썰어준다.', 'image_url': 'https://recipe1.ezmember.co.kr/cache/recipe/2016/08/01/e42b3f115259ff62b43624827d3287f41.jpg'}, {'step_number': 2, 'description': '멸치육수 2컵을 넣고', 'image_url': 'https://recipe1.ezmember.co.kr/cache/recipe/2016/08/01/6e2bf8c9878c9265d9e612901cd19dc91.jpg'}, {'step_number': 3, 'description': '달걀은 당근, 소금을 넣고 잘 저어둔다.', 'image_url': 'https://recipe1.ezmember.co.kr/cache/recipe/2016/08/01/582f296c21568150d1bc33579abdb4a61.jpg'}, {'step_number': 4, 'description': '육수가 끓으면 풀어둔 달걀을 붓고', 'image_url': 'https://recipe1.ezmember.co.kr/cache/recipe/2016/08/01/c8a5231e2079a92baa988588e7a4e41b1.jpg'}, {'step_number': 5, 'description': '젓가락으로 살살지어준다.', 'image_url': 'https://recipe1.ezmember.co.kr/cache/recipe/2016/08/01/f38fc8097366b3c8468cb234deb0ca331.jpg'}, {'step_number': 6, 'description': '80% 정도 익으면 뚜껑을 닫고 약불로 줄인다.', 'image_url': 'https://recipe1.ezmember.co.kr/cache/recipe/2016/08/01/2c36d9198ae188fa1c14aa8cdaa529e31.jpg'}, {'step_number': 7, 'description': '뚜껑을 여는 시간은 첫째, 탄 냄새가 난다. 둘째, 끓어오른다.', 'image_url': 'https://recipe1.ezmember.co.kr/cache/recipe/2016/08/01/6c23120b3331dc143bb0b6ca0e0bf65a1.jpg'}, {'step_number': 8, 'description': '뚜껑을 열면 봉긋하게 올라온 달걀찜이 되었습니다.', 'image_url': 'https://recipe1.ezmember.co.kr/cache/recipe/2016/08/01/19676954a1f544d849f8b158a46cca4d1.jpg'}, {'step_number': 9, 'description': '달걀찜이 다 되면 대파, 깨소금, 참기름을 올려 완성한다.', 'image_url': 'https://recipe1.ezmember.co.kr/cache/recipe/2016/08/01/6e47ad2f52a634013b3022fbb8ad13111.jpg'}]"
8732,밑반찬,일상,달걀/유제품,찜,#새우달걀찜만들기 #가스오부시육수로 만드는 새우달걀찜!!,새우달걀찜,"3,181",15분 이내,아무나,2인분,"[('천연조미료육수', ''), ('새우', '6개'), ('달걀', '3개'), ('가스오부시', '1/3컵'), ('소금', '1작은술'), ('쯔유', '1작은술')]","찜통에서 서서히 찌는 일본식 계란찜. 
거기에 새우를 넣고 만들면 더욱 일본레스토랑에서 먹는 계란찜이 되지요. 
그렇게 보슬보슬하고 푸딩같은 계란찜은 아니고요. 
새우와 가스오부시육수로 만든 새우계란찜입니다.","[{'step_number': 1, 'description': '천연조미료를 다시팩에 넣고 우려낸 육수입니다. 그냥 단순하게 다시마를 넣고 육수를 만드셔도 되어요.', 'image_url': 'https://recipe1.ezmember.co.kr/cache/recipe/2018/08/21/752295f8c706af6c39a51d745678e9171.jpg'}, {'step_number': 2, 'description': '끓은 육수 1컵에 가스오부시를 넣어 줍니다. 잠시 이렇게 두면 자연스럽게 우러나오게 됩니다.', 'image_url': 'https://recipe1.ezmember.co.kr/cache/recipe/2018/08/21/d38149a542c8d4e663b11fc8bbfd86cd1.jpg'}, {'step_number': 3, 'description': '가스오부시의 향과 너무 많이 우러나오게 되면 떫을 수 있어서 빼주시는 것이 좋은데 저는 가스오부시의 향을 좋아해서 그냥 넣고 달걀을 넣어 주었어요.', 'image_url': 'https://recipe1.ezmember.co.kr/cache/recipe/2018/08/21/0c84985c4f267700065fd8390bdf88d91.jpg'}, {'step_number': 4, 'description': '그리고 잘 풀어 줍니다. 간은 약간의 소금간으로 해 주었어요. 그리고 일본식의 계란찜을 원하시면 이렇게 푼 달걀물을 거름망에 한번 두번 걸러서 찜통에 넣고 쪄 주시면 고운 달걀찜을 만드실 수 있습니다. 저는 거르지 않고 그냥 사용하려고요.', 'image_url': 'https://recipe1.ezmember.co.kr/cache/recipe/2018/08/21/9bd6e18b9aa8466661b9db88b27204f91.jpg'}, {'step_number': 5, 'description': '새우를 준비합니다. 두개는 밑에 깔아 주시고 하나는 위에 올려 놓을 예정이지요.', 'image_url': 'https://recipe1.ezmember.co.kr/cache/recipe/2018/08/21/3f7f8cf7f65cf09ff3ccfa3c78af23761.jpg'}, {'step_number': 6, 'description': '새우 2개씩 공기 밑에 깔아 준 다음에 그위에 풀어 놓았던 계란물을 넣어 줍니다. 2/3 정도 채워 주세요.', 'image_url': 'https://recipe1.ezmember.co.kr/cache/recipe/2018/08/21/9fca901988fc3c14276309983b32be8a1.jpg'}, {'step_number': 7, 'description': '그리고 찜통의 물이 팔팔 끓어오르면 그때에 넣어 주세요. 일단 위에 새우는 올리지 않았습니다. 반쯤 익었을때에 올려 주지요. 지금 넣어 봤자 가라앉습니다.', 'image_url': 'https://recipe1.ezmember.co.kr/cache/recipe/2018/08/21/f7456fb239e2d42ec096c57aef4f14371.jpg'}, {'step_number': 8, 'description': '포실포실하게 위면이 익었을때에 새우를 위에 올려 주고는 다시 끝까지 뚜껑을 닫고 쪄 줍니다.', 'image_url': 'https://recipe1.ezmember.co.kr/cache/recipe/2018/08/21/2db1f1934cdc9c4c117f6ae0905b8f811.jpg'}, {'step_number': 9, 'description': '다 쪄 준 계란찜. 위에 검정통깨를 솔솔 뿌려 주었어요. 뭐 안 뿌려 주셔도 상관없지요.', 'image_url': 'https://recipe1.ezmember.co.kr/cache/recipe/2018/08/21/37b972a0876a22df33ea48c4d5e0ce4d1.jpg'}, {'step_number': 10, 'description': '참기름 한방울을 톡하고 떨어뜨리셔도 맛있겠죠. 푹하고 퍼 먹으면 밑에 있는 새우도 함께 먹으니 탱탱함을 주는 새우계란찜입니다.', 'image_url': 'https://recipe1.ezmember.co.kr/cache/recipe/2018/08/21/00544bb7524357fb44b158bb7b5cc0b91.jpg'}, {'step_number': 11, 'description': '소금간을 조금 해주었기 때문에 간이 약하다고 생각드시면 쯔유를 1t 정도씩 넣어 주시면 딱 간이 맞으실꺼예요. 참기름은 넣지 않았지만 넣으셔도 됩니다.', 'image_url': 'https://recipe1.ezmember.co.kr/cache/recipe/2018/08/21/ebd4e1d8fde7732f61d6fe6225e2abcf1.jpg'}]"
8733,밑반찬,일상,달걀/유제품,찜,고소하고 부드러운 맛이 일품 ! 두부계란찜♥,두부계란찜,"2,521",30분 이내,초급,2인분,"[('두부', '1모'), ('쪽파', '4대'), ('명란젓', '2숟가락'), ('달걀', '2개'), ('당근', '1/5개')]","두부를 넣어 더욱 고소하고 부드러운 계란찜 레시피!
아이들 반찬으로 딱 좋은 두부계란찜으로
맛과 영양을 모두 챙겨보세요~","[{'step_number': 1, 'description': '쪽파, 당근은 다져서 준비하고 명란은 껍질을 제거하여 준비한다.', 'image_url': 'https://recipe1.ezmember.co.kr/cache/recipe/2018/08/23/fbfe7875e6c3cf5df5ec8649e82d2d321.jpg'}, {'step_number': 2, 'description': '두부는 면보에 넣어 물기를 제거한다.', 'image_url': 'https://recipe1.ezmember.co.kr/cache/recipe/2018/08/23/c73c8183baa6d628628de64cf72f56321.jpg'}, {'step_number': 3, 'description': '볼에 물기를 뺀 두부, 달걀, 쪽파, 당근, 명란을 넣어 섞는다.', 'image_url': 'https://recipe1.ezmember.co.kr/cache/recipe/2018/08/23/02226e57e0dd97e1761045962bed16101.jpg'}, {'step_number': 4, 'description': '전자레인지용 그릇에 두부재료를 담아 평평하게 정리 한다.', 'image_url': 'https://recipe1.ezmember.co.kr/cache/recipe/2018/08/23/8abf43a0cb808ebe4a3100a5fdc6b3291.jpg'}, {'step_number': 5, 'description': '랩을 씌우고 포크로 구멍을 낸 후 전자레인지에 넣어 약 4~5분 익혀낸다.전자레인지', 'image_url': 'https://recipe1.ezmember.co.kr/cache/recipe/2018/08/23/05f4e142e99eaaa72027486e33b12dae1.jpg'}, {'step_number': 6, 'description': '그릇에서 도마에 거꾸로 뒤집어 놓고 꺼낸다.', 'image_url': 'https://recipe1.ezmember.co.kr/cache/recipe/2018/08/23/641ffb73f4f99b95cc773de6d122886a1.jpg'}, {'step_number': 7, 'description': '한입 크기로 잘라 완성한다.', 'image_url': 'https://recipe1.ezmember.co.kr/cache/recipe/2018/08/23/132acbef02f0041bde9989dab5ec7fd61.jpg'}]"
8734,밑반찬,일상,달걀/유제품,찜,달걀찜할때...눌러 붙은 뚝배기 손쉽게 세척하는 tip,None,"4,063",None,None,None,"[('뚝배기', ''), ('참기름', '1T'), ('키친타월', '1장'), ('', ''), ('달걀', '6~7개'), ('끓인 다시마물', '1컵'), ('새우젓', ''), ('흰후추', ''), ('파', ''), ('고춧가루', '')]",,[]
8735,밑반찬,일상,달걀/유제품,찜,푸딩 같은 달걀찜(계란찜) 일식 요리,푸딩달걀찜,"14,695",30분 이내,초급,1인분,"[('달걀', '1개'), ('은행', '3알'), ('밤', '1개'), ('어묵', '1쪽'), ('새우', '1마리'), ('흔 생선살', '1쪽'), ('표고버섯', '1/4쪽'), ('쑥갓', '적당량'), ('가쓰오부시', '5g'), ('물', '1컵'), ('소금', '1꼬집'), ('미림', '1/2수저'), ('청주', '1/2수저')]",일식집에서 먹던 달걀찜 꼭 일식집이 아니어도 집에서도 맛볼 수 있는 부드러운 맛의 달걀찜입니다,"[{'step_number': 1, 'description': '달걀 1개와 어묵 그리고 사진 속에는 없지만 당근과 흰 살 생선 은행 밤 새우\n표고 쑥갓을 준비하였습니다. 일식 요리에서 먹는 달걀찜은 안에 속 재료인 내용물이 많습니다. 집에 있는 해산물이라 야채를 준비하면 좋을 것 같아요~', 'image_url': 'https://recipe1.ezmember.co.kr/cache/recipe/2016/07/12/a10ce588ebccdc016f153edddbc91e8d1.jpg'}, {'step_number': 2, 'description': '그리고 육수를 준비해야 합니다. 육수는 다시마 1장과 가쓰 오부시 그리고\n물 1컵을 준비합니다.', 'image_url': 'https://recipe1.ezmember.co.kr/cache/recipe/2016/07/12/03c4719a80235174d9f96aa8d825f88a1.jpg'}, {'step_number': 3, 'description': '달걀찜을 하기 위해 가장 먼저 해야 할 일은 먼저 가쓰오부시 육수를 만들어 줍니다. 물 1컵에 먼저 다시마를 넣고 끓기 시작하려 하면 불을 끄고 가쓰오부시를 넣어 10분간 우려 면 보를 이용해 맑은 육수를 먼저 만들어 주세요', 'image_url': 'https://recipe1.ezmember.co.kr/cache/recipe/2016/07/12/a14b63e554969c172855307735f6253c1.jpg'}, {'step_number': 4, 'description': '다음으로는 준비한 속 재료를 썰어줍니다. 먹기 좋은 크기로 썰어준 다음 쑥갓을 뺀 나머지는 살짝 한번 끓는 물에 익혀 차가운 물에 행궈 준비합니다.', 'image_url': 'https://recipe1.ezmember.co.kr/cache/recipe/2016/07/12/c8ebe9a08c3f18ed1cb7039bfdf2391f1.jpg'}, {'step_number': 5, 'description': '익힌 속재로는 이렇게 찜을 할 그릇에 먼저 담아놓고~', 'image_url': 'https://recipe1.ezmember.co.kr/cache/recipe/2016/07/12/aa5a8c815c1899fb274ab2734a0620ef1.jpg'}, {'step_number': 6, 'description': '달걀을 풀어줍니다. 달걀은 100이 조금 안되는 80 정도네요.', 'image_url': 'https://recipe1.ezmember.co.kr/cache/recipe/2016/07/12/8a0b82005f00fe5923b3feae739263191.jpg'}, {'step_number': 7, 'description': '미리 만들어 놓은 육수도 달걀의 양만큼 준비합니다. 저는 반컵을 준비하였습니다. 즉 달걀 1개에 육수 반컵을 준비하면 맞아요. 달걀이 2개라면 육수는 1컵이겠죠~', 'image_url': 'https://recipe1.ezmember.co.kr/cache/recipe/2016/07/12/102261709f51ed7844be773d511cd2bc1.jpg'}, {'step_number': 8, 'description': '달걀에 소금 한꼬집과 맛술 1/2 미림 1/2 그리고 육수 1/2컵을 부어주고 잘 저어줍니다 잘 저어 풀어준 다음 체에 걸러 알끈과 달걀을 부드럽게 만들어 주세요.', 'image_url': 'https://recipe1.ezmember.co.kr/cache/recipe/2016/07/12/bc41171ab9c06d4b7d32952c31f087fb1.jpg'}, {'step_number': 9, 'description': '처음과 다르게 거품이 없습니다. 이때 거품이 있다면 가볍게 제거해주세요. 거품이 없어야지만 기포가 생기지 않습니다.', 'image_url': 'https://recipe1.ezmember.co.kr/cache/recipe/2016/07/12/66d05105299022197f917720699038c01.jpg'}, {'step_number': 10, 'description': '잘 풀어 체에 걸러준 달걀은 속 재료를 넣어둔 그릇에 부어주세요.', 'image_url': 'https://recipe1.ezmember.co.kr/cache/recipe/2016/07/12/8fae567e4178cb4b79a8fcbfc11c0dc01.jpg'}, {'step_number': 11, 'description': '잘 부어준 다음 가장 중요한 부분인데요. 찜기에 뚜껑을 덮던지 아님 호일이나 보이는 것처럼 랩으로 뚜껑을 만들어 덥어 줍니다. 뚜껑을 만들어 덮어준 이유는 딱하나 찜을 만들면서 수증기가 생겨 찜기에 들어가면 기포가 생겨 아무리 잘 찜을 만들었어도 절대 푸딩 같은 모양이나 맛이 안 나와요.', 'image_url': 'https://recipe1.ezmember.co.kr/cache/recipe/2016/07/12/fdc9174f277f11ad7a352472dc8aee691.jpg'}, {'step_number': 12, 'description': '이렇게 뚜껑을 만들어 덥어주고 나면 냄비에 달걀의 양만큼 물을 넣어 함께 끓여 줍니다 냄비에 넣고 난 뒤 딱 10분간 끓여 찜을 만듭니다. 끓기 시작하면 불을 줄여 계속 찜을 합니다.', 'image_url': 'https://recipe1.ezmember.co.kr/cache/recipe/2016/07/12/66468bb1b633fb36607ae146fd4bb6541.jpg'}, {'step_number': 13, 'description': '10분 뒤 뚜껑을 열어 남겨놓았던 새우와 당근 쑥갓으로 장식해주었어요. 저처럼 장식은 하지 않으셔도 됩니다 ㅠ 10분 뒤 불을 끄고 딱 3분간 그대로 두고 뜸만 드려주면 됩니다. 만약 안 익었을까 생각이 들면 젓가락으로 찔러보시고 달걀물이 안 묻어 나오면 익은 거랍니다^^', 'image_url': 'https://recipe1.ezmember.co.kr/cache/recipe/2016/07/12/3ff1b69c96acd87364b9b9aa1725d77b1.jpg'}]"
8736,밑반찬,일상,달걀/유제품,찜,오늘뭐먹지 양희은대가의 명란달걀찜 만들기,명란달걀찜,"6,876",10분 이내,아무나,2인분,"[('달걀', '3개'), ('명란젓', '1덩어리'), ('다진파', ''), ('청양고추', ''), ('소금', ''), ('물', '')]",오늘뭐먹지 양희은대가의 5첩반상차리기 중에서 네번째 전자렌즈에 4분이면 완성되는 고소하고 짭쪼름한 맛의 명란을 넣은 명란달걀찜입니다.,"[{'step_number': 1, 'description': '일단 달걀3개 풀어주시고요. 젓가락으로 풀어야 잘 풀리고 노른자부터 풀어주시면 더욱 잘 풀리지요.', 'image_url': 'https://recipe1.ezmember.co.kr/cache/recipe/2015/11/09/49d6133b46e5aa23b5d1fa161e7ebac51.jpg'}, {'step_number': 2, 'description': '그리고 물을 넣는데 물과 달걀의 비율은 물2 : 달걀1 입니다. 깨뜨린 달걀반쪽의 껍질에 물을 받아서 12번 넣으면 2:1의 비율이 나오겠죠. 껍질반개에 물을 붓고는 한번, 두번~~~ 열두번을 넣으시면 됩니다. 그리고 소금간을 약간 해줍니다.', 'image_url': 'https://recipe1.ezmember.co.kr/cache/recipe/2015/11/09/c2a66cd1f2175842fa52ad12e77529161.jpg'}, {'step_number': 3, 'description': '그리고 명란젓 한 덩어리를 가위로 썰어서는 넣어 주세요. 이렇게 명란을 넣고는 조금 시간을 두고 기다리면 됩니다. 명란젓의 염도와 달걀의 염도를 서로 맞추기 위해서요. 한 5분정도면 될 것 같아요.', 'image_url': 'https://recipe1.ezmember.co.kr/cache/recipe/2015/11/09/e45bde0140a6ac73efeaf96b4bf3a81b1.jpg'}, {'step_number': 4, 'description': '마지막으로 파 다진것도 넣어 주고 매콤한 맛을 원하시면 청양고추도 넣어 주시고 잘 섞어 주세요.', 'image_url': 'https://recipe1.ezmember.co.kr/cache/recipe/2015/11/09/bb3e5b1a6817974099bddc60fae6b6601.jpg'}, {'step_number': 5, 'description': '그렇게 넣어둔 명란달걀찜을 전자렌즈에 넣고는 3분30초 돌리고는 상태를 보고 1분더 돌려 주세요. 부풀어 올랐다면 다 완성입니다.전자레인지', 'image_url': 'https://recipe1.ezmember.co.kr/cache/recipe/2015/11/09/c68dce69ecba15730a5df3db202d2de71.jpg'}]"
