index,종류별,상황별,재료별,방법별,글 제목,레시피이름,조회수,조리시간,난이도,인분,재료,소개글,조리순서
28887,메인반찬,일상,해물류,무침,오징어 초무침레시피 미나리오징어초무침 오징어숙회 무침,미나리오징어초무침,"1,512",20분 이내,아무나,2인분,"[('오징어', '3마리'), ('미나리', '1줌'), ('깻잎', '3~4장'), ('상추', '3~4장'), ('초고추장', '2~3숟갈'), ('깨소금', '약간')]",미나리 오징어 초무침으로 집에 있는 야채들 넣어서 간단히 만들었답니다~ ​,"[{'step_number': 1, 'description': '마켓컬리에서 오징어 3마리 구입했는데요, 생각보다 오징어가 작더라구요. 작은 오징어라 3마리 다 사용했구요, 큰 오징어라면 1마리만 해도 2인 먹기 충분해요~', 'image_url': 'https://recipe1.ezmember.co.kr/cache/recipe/2024/03/11/ecc06c10bd39a6ab0f9d6f80de9f47861.jpg'}, {'step_number': 2, 'description': '물에 깨끗이 씻어주고요,\n볼 , 채반', 'image_url': 'https://recipe1.ezmember.co.kr/cache/recipe/2024/03/11/2bba0561faede6b9a057c2517696e28c1.jpg'}, {'step_number': 3, 'description': '끓는 물에 넣어 잠시 데쳐 줍니다.\n냄비 , 요리집게', 'image_url': 'https://recipe1.ezmember.co.kr/cache/recipe/2024/03/11/f982e525aa33098c3218f321dbdbe8001.jpg'}, {'step_number': 4, 'description': '오징어가 어느 정도 익었으면 건져내요. 너무 오래 데치면 질길 수 있으니 익을 정도로만 살짝 데쳤어요~채반', 'image_url': 'https://recipe1.ezmember.co.kr/cache/recipe/2024/03/11/08742c34025ad6ec74ecb8ddd44994711.jpg'}, {'step_number': 5, 'description': '먹기 좋은 크기로 썰어줍니다.\n도마 , 조리용나이프', 'image_url': 'https://recipe1.ezmember.co.kr/cache/recipe/2024/03/11/4e91d8c60d911f337667964ff2697d521.jpg'}, {'step_number': 6, 'description': '미나리, 깻잎, 상추를 작게 썰어서 넣어요. 여기에 당근, 양파, 양배추 등 좋아하는 채소들 넣으면 더 맛있고 색상도 이뻐요~ 간단히 초록 야채만 넣었어요~~ 믹싱볼', 'image_url': 'https://recipe1.ezmember.co.kr/cache/recipe/2024/03/11/9e7a41649bf69647a11233df0d4b07811.jpg'}, {'step_number': 7, 'description': '오징어 썰어둔 것 넣고, 양념장으로 초고추장을 넣어줍니다. 초고추장은 고추장에 식초와 설탕 또는 물엿을 넣고 만들었는데요, 입맛에 맞게 식초와 설탕을 조절해서 넣으면 된답니다~', 'image_url': 'https://recipe1.ezmember.co.kr/cache/recipe/2024/03/11/518144e264ade153fb7087a278e2d4081.jpg'}, {'step_number': 8, 'description': '골고루 잘 버무려주면 미나리 오징어 초무침 완성이에요. 위생장갑', 'image_url': 'https://recipe1.ezmember.co.kr/cache/recipe/2024/03/11/1a3509657bdcf969445dc3cef194edfa1.jpg'}, {'step_number': 9, 'description': '오징어가 약간 붉은 빛이라서 적당히 색이 어울리네요ㅎ 미나리를 더 많이 넣었더니 씹을 때마다 미나리 향이 너무 좋아요~완성접시', 'image_url': 'https://recipe1.ezmember.co.kr/cache/recipe/2024/03/11/be1b1cc54c54de511c3d464dd843eec11.jpg'}, {'step_number': 10, 'description': '아삭한 미나리의 식감에 쫄깃한 오징어, 그리고 새콤매콤한 양념까지~ 질리지 않고 맛있게 먹을 수 있어요:)', 'image_url': 'https://recipe1.ezmember.co.kr/cache/recipe/2024/03/11/ef4fddc7e1e28f3f293c021182100f641.jpg'}, {'step_number': 11, 'description': '은 오징어 3마리 다 넣었는데 양은 그리 많지 않구요, 2인분 양으로 적당한 양인데... 엄청 배고픈 남편이 거의 다 먹었네요ㅎ', 'image_url': 'https://recipe1.ezmember.co.kr/cache/recipe/2024/03/11/969b88b355ae8d0c4eb3ca865918a5781.jpg'}, {'step_number': 12, 'description': '미나리 가득 넣어 아삭함과 향긋함이 좋은 미나리 오징어 초무침인데요, 간단히 만들 수 있는 오징어 초무침 레시피라서 오징어와 야채 몇가지만 넣어도 맛있답니다:) 맛있게 만들어 드세요~~', 'image_url': 'https://recipe1.ezmember.co.kr/cache/recipe/2024/03/11/1866bd078940c1ec3260cc6615cb171d1.jpg'}]"
28888,메인반찬,일상,해물류,무침,새콤달콤상큼 문어미나리초무침,문어미나리초무침,217,10분 이내,아무나,4인분,"[('문어다리                                                                                대', '2개'), ('미나리', '50g'), ('양파', '1/4개'), ('빨강파프리카', '약간'), ('초고추장', '3T'), ('고추냉이', '1t')]",새콤달콤상큼 문어미나리초무침,"[{'step_number': 1, 'description': '자숙문어 사용해요 큼직한 다리 2개 사용 합니다 얇게 슬라이스 할게요', 'image_url': 'https://recipe1.ezmember.co.kr/cache/recipe/2024/05/06/269921bf5ac42773d79263143ae8f89b1.jpg'}, {'step_number': 2, 'description': '미나리는 줄기만 사용해요 5cm정도 길이로 썰고 양파는 슬라이스하고 파프리카도 비슷한 크기로 썰어 합체 했어요미나리 손질법', 'image_url': 'https://recipe1.ezmember.co.kr/cache/recipe/2024/05/06/70a27b0cf6467461ab6666053464367d1.jpg'}, {'step_number': 3, 'description': '시판 초고추장 사용해요 초고추장 넣고 쌀어둔 문어다리도 넣어요', 'image_url': 'https://recipe1.ezmember.co.kr/cache/recipe/2024/05/06/a1db4631eed02363ae3b7c241d6d68071.jpg'}, {'step_number': 4, 'description': '고추냉이넣고 버무려 줄게요 고추냉이는 생략해도 됩니다', 'image_url': 'https://recipe1.ezmember.co.kr/cache/recipe/2024/05/06/d00b1022cc1ce231030c825c19c71a681.jpg'}, {'step_number': 5, 'description': '자숙문어 미나리초무침 완성 입니다', 'image_url': 'https://recipe1.ezmember.co.kr/cache/recipe/2024/05/06/e99dc02c7a9d04bd1f020ba50c1045491.jpg'}]"
28889,메인반찬,일상,해물류,무침,저염 충무김밥 레시피 (ft.냉동두부 활용)/현미꼬마김밥&새송이 계란탕~,충무김밥,141,None,None,None,"[('양조간장', '3T'), ('까나리 액젓', '1.5T'), ('다진 파', '3T'), ('다진 마늘', '2T'), ('양파', '2조각'), ('고춧가루', '3T'), ('참기름', '1/2T'), ('사과 식초', '4T'), ('소금', '1t'), ('큰 오징어                                                                                440g 정도', '1마리'), ('냉동 두부', '1모'), ('무', '450g'), ('현미흑미 김밥', '150g'), ('김', '1장')]",저염 충무김밥 레시피 (ft.냉동두부 활용)/현미꼬마김밥&새송이 계란탕~,"[{'step_number': 1, 'description': '1. 오징어와 무 무침용~ 양념 재료들 7가지 모두 준비하기. ★ 얼린 두부는 냉동실에서 미리 꺼내두고, 해동하기.', 'image_url': 'https://recipe1.ezmember.co.kr/cache/recipe/2024/05/08/a98f58b3a04c2553bea0612c67344e4e1.jpg'}, {'step_number': 2, 'description': '2. 오징어와 무 무침용. 양념 만들기-7가지 재료 넣고잘 섞어서 미리 만들어 두기. ※20~30분이상 숙성 시간을 가지면~ 양념들이 잘 어우러져서 더 깊은 맛의 무침양념~', 'image_url': 'https://recipe1.ezmember.co.kr/cache/recipe/2024/05/08/94003d02b60c9a4a0db240258b1822bf1.jpg'}, {'step_number': 3, 'description': '3. 무 썰기- 세로 방향으로 먼저 3등분 썰기.무 손질법', 'image_url': 'https://recipe1.ezmember.co.kr/cache/recipe/2024/05/08/8f5821e0777994405570e32d785ad2591.jpg'}, {'step_number': 4, 'description': '4. 무썰기-다시 눕혀 세로로~ 3등분후~마지막 가로로 납작 썰기. (5mm 정도 두께) ※최대한 4각형 가깝게~ 되도록 일정한 모양으로 썰어보기.도마 , 조리용나이프', 'image_url': 'https://recipe1.ezmember.co.kr/cache/recipe/2024/05/08/c569a2ea87c1228b17f1c3fd857774111.jpg'}, {'step_number': 5, 'description': '5.무 절이기 -썰어둔 무에 식초 3~4T, 소금 1t 넣고 머무려,1시간 절이기.볼', 'image_url': 'https://recipe1.ezmember.co.kr/cache/recipe/2024/05/08/fb8a6600102e111bced4bb85cd97eb7b1.jpg'}, {'step_number': 6, 'description': '6. 체에 받쳐 무의물기 잘 제거하기... ※물에 다시 헹구지는 않아요~!채반', 'image_url': 'https://recipe1.ezmember.co.kr/cache/recipe/2024/05/08/ff32312025e566b5762d2ef4ea7d96111.jpg'}, {'step_number': 7, 'description': '7. 해동 시켜둔, 두부의 간수 빼기- 두부가 녹으면 깨끗한 물에 30분 담가두기.', 'image_url': 'https://recipe1.ezmember.co.kr/cache/recipe/2024/05/08/066033b291291b314fc2bc5d424a0c261.jpg'}, {'step_number': 8, 'description': '8. 냉동 두부 물기 제거 - 얼린 두부는 질감이 단단해서 어묵대신 사용가능.꾹~누르고, 면포나 키친타월에 싸서 눌러~물기 제거후, 납작하게 썰기. ※냉동두부는 어묵과 달리 탄력이 없고, 많이 누르면 두부가 부서질 수 있어 주의하기, 그러나 냉동 두부는 고단백의 건강한 식재료이고, 담백하고 고소함이 매력~!', 'image_url': 'https://recipe1.ezmember.co.kr/cache/recipe/2024/05/08/fc1f3b60d0dd14899503c70b5d2846ba1.jpg'}, {'step_number': 9, 'description': '9. 두부 굽기 - 오일도 두른 팬에, 두부 넣고소금 살짝 뿌려굽기프라이팬 , 뒤집개', 'image_url': 'https://recipe1.ezmember.co.kr/cache/recipe/2024/05/08/6f973f991f41e4fc279986049b65330d1.jpg'}, {'step_number': 10, 'description': '10. 식혀서 한 입 크기로 자르기 (가로세로 2~3cm. 크기 정도 )', 'image_url': 'https://recipe1.ezmember.co.kr/cache/recipe/2024/05/08/6071e041fbc0b0635f2cae55f47cc8b51.jpg'}, {'step_number': 11, 'description': '11. 씻어 손질해 둔 오징어 준비하기.오징어 손질법', 'image_url': 'https://recipe1.ezmember.co.kr/cache/recipe/2024/05/08/bd1faabd3ac4e6636c1ab7e9a0ace2001.jpg'}, {'step_number': 12, 'description': '12. 끓는 물에 1분 데치기 ※ 적당한 크기로 썰어 데쳐도 되고, 데친 후에 썰어도 O.K냄비', 'image_url': 'https://recipe1.ezmember.co.kr/cache/recipe/2024/05/08/b4df1c82107496a5727f20b1615e077a1.jpg'}, {'step_number': 13, 'description': '13 . 데친 오징어는 체에 받쳐서 물기 제거하고 잠시 식히기.채반', 'image_url': 'https://recipe1.ezmember.co.kr/cache/recipe/2024/05/08/4b4ed623c8d9bd05fe8374b33ee890c81.jpg'}, {'step_number': 14, 'description': '14. 양념과 기본 재료 3가지 (두부, 오징어, 무) 준비하기', 'image_url': 'https://recipe1.ezmember.co.kr/cache/recipe/2024/05/08/5eda490255e3ed2eb415294fb1ba524c1.jpg'}, {'step_number': 15, 'description': '15. 미리 숙성 시켜둔 양념과 오징어, 무 절임, 구운 두부 섞어 살살 무치기. ※ 양념이 넉넉해서 20~30% 남았어요.볼 , 위생장갑', 'image_url': 'https://recipe1.ezmember.co.kr/cache/recipe/2024/05/08/4dda9f75aa9bbd49154ad160467f3de11.jpg'}, {'step_number': 16, 'description': '16. 충무김밥용. 오징어 무 무침. 완성 ★숙성 시키기- 이틀 정도 냉장고에 숙성 시킨 후~ 먹기를 추천 ~', 'image_url': 'https://recipe1.ezmember.co.kr/cache/recipe/2024/05/08/fa728f3c319ace2ff0e84ca63fb56db81.jpg'}, {'step_number': 17, 'description': '17.3등분 한 김을 가로로 길게~놓고 밥 50g씩 올려 똘똘~탄탄하게 말기~ (1인분 김밥)', 'image_url': 'https://recipe1.ezmember.co.kr/cache/recipe/2024/05/08/59eefafc7dfd40f26c5be2f51423184d1.jpg'}, {'step_number': 18, 'description': '18. 가는 김밥 3줄은~ 다시 또 4등분 하기. (한 입 크기로~)', 'image_url': 'https://recipe1.ezmember.co.kr/cache/recipe/2024/05/08/a1121171690705fd15c26e7972e1db201.jpg'}, {'step_number': 19, 'description': '19. 완성- 오징어 무 무침과 함께 꼬마김밥 담아내기 . ※ 약간 매콤한 김밥이니 부드러운 국물, 새송이 계란탕과 함께 곁들이면 더 맛있어요.접시', 'image_url': 'https://recipe1.ezmember.co.kr/cache/recipe/2024/05/08/0144d0d06a5ad74616512c09759488921.jpg'}]"
28890,메인반찬,일상,해물류,무침,어남선생 양념 꽃게장 입맛 살리는 꿀팁 만드는 법 냉동절단 양념꽃게장 집밥의 혁명 요리 레시피 20분이면 충분,양념꽃게장,"1,100",20분 이내,아무나,3인분,"[('냉동 절단 꽃게', '1kg'), ('물                                                                                꽃게 살균시', '150ml'), ('식초                                                                                꽃게 살균시', '4스푼'), ('양조간장                                                                                90ml', '14스푼'), ('고춧가루', '8스푼'), ('설탕                                                                                또는 원당', '6스푼'), ('식초', '2스푼'), ('다진마늘', '2스푼'), ('다진생강', '1스푼'), ('다진대파                                                                                흰부분만', '1/2개')]",요새 꽃게 철이라서 양념 꽃게장을 만들어두면 맛있게 먹을 수 있는 반찬이여서 만들게 되었어요.,"[{'step_number': 1, 'description': '물에 담그지 마시고 흐르는 물에 씻어주세요.쟁반꽃게 손질법', 'image_url': 'https://recipe1.ezmember.co.kr/cache/recipe/2024/05/19/a7104ff1d67ca0e6e44de420233db3f61.jpg'}, {'step_number': 2, 'description': '주방 솔로 배 부분과 다리 사이사이 흐르는 물에 솔질하여 세척해 주세요.주방솔', 'image_url': 'https://recipe1.ezmember.co.kr/cache/recipe/2024/05/19/55d025df8c4ad6027ee05e468a77ab971.jpg'}, {'step_number': 3, 'description': '깨끗이 세척한 냉동 꽃게를 가위로 집게 발은 남겨주고 사진처럼 씹어도 살이 없는 다리 부분은 잘라내 주세요.주방가위', 'image_url': 'https://recipe1.ezmember.co.kr/cache/recipe/2024/05/19/8b374b2046754947053b89217b7d20db1.jpg'}, {'step_number': 4, 'description': '물 150ml에 식초 4스푼을 넣고 섞어 식초물을 만들어 주신 후 식초물을 꽃게에 숟가락으로 적시듯이 골고루 뿌려주시고 5분 정도 재워주세요. 5분이 되었으면 식초물은 다 따라 버리세요. 식초물이 비린내 제거 및 살을 탱글 하게 해주는 감초 역할을 해줘요.볼', 'image_url': 'https://recipe1.ezmember.co.kr/cache/recipe/2024/05/19/49a9a439b16a42413586d585121b58a91.jpg'}, {'step_number': 5, 'description': '양조간장 14스푼(90ml), 고춧가루 8스푼 설탕 또는 원당 6스푼, 식초 2스푼, 다진 마늘 2스푼, 다진 생강 1스푼 다진 대파(흰 대부분만) 1/2개를 넣고 골고루 섞어 놓아 주세요. 여기서 중요한 건 설탕이 잘 녹여지도록 저어주세요. 다 녹았으면 완성이에요.믹싱볼 , 숟가락', 'image_url': 'https://recipe1.ezmember.co.kr/cache/recipe/2024/05/19/cb575efbb242e762244af1f2afdca9801.jpg'}, {'step_number': 6, 'description': '양념장에 무쳐낼 건데요. 여기서 주의사항이 있어요. 게장을 담가둔 식초물을 버렸다 해도 그릇에 그대로 다 부어서 양념하시면 남아있는 식초물이 들어가 양념 맛이 변할 수 있다고 해요. 꽃게는 꼭 하나씩 옮겨서 양념에 버무려주세요.위생장갑', 'image_url': 'https://recipe1.ezmember.co.kr/cache/recipe/2024/05/19/f78a0b7fc909eedd1504973b313419a61.jpg'}, {'step_number': 7, 'description': '그리고 손으로 무침 찔려서 아플 수 있어요. 숟가락이나 큰 주걱으로 안전하게 무쳐주세요.조리주걱 , 요리스푼', 'image_url': 'https://recipe1.ezmember.co.kr/cache/recipe/2024/05/19/3c6c7f25bd1c23f493e0a5a2fdd1d2c11.jpg'}, {'step_number': 8, 'description': '완성이예요. 게장 먹을 때 두 손으로 게살을 꾹 눌러 짜내어 밥 위에 올려먹거나 입안 가득 게를 넣고 쪽쪽 양념까지 빨아 먹음 정말 개운, 깔끔해서 손이 자꾸만 가요.양념게장은 일주일까지도 보관이 가능하다고 하니 넉넉하게 준비하셔서 양껏 드셔보세요.\n\n어남류수영님 양념 꽃게장은 1일, 2일, 3일차 숙성되면 다 맛이 다르다고 해요. 3일차가 젤 맛있다고 하시던데 저도 3일 숙성해서 먹어봤어요. \n3일차 숙성이 1일차, 2일차 보다 훨씬 맛있었어요.', 'image_url': 'https://recipe1.ezmember.co.kr/cache/recipe/2024/05/19/69d053961298b74bf711c04282973a351.jpg'}]"
28891,메인반찬,일상,해물류,무침,맛있는 꼬막무침 레시피 /꼬막비빔밥/ 꼬막무침 양념장/ 꼬막무침 만들기/ 꼬막무침 황금레시피,꼬막무침,510,None,None,None,"[('꼬막', '800g'), ('물', '1L'), ('소금                                                                                15g', '1큰술'), ('식초                                                                                16g', '2스푼'), ('고추가루                                                                                14g', '2스푼'), ('설탕                                                                                30g', '3스푼'), ('진간장                                                                                약100g', '12~13스푼'), ('미림                                                                                16g', '2스푼'), ('식초                                                                                8g', '1스푼'), ('굴소스                                                                                6~7g', '1/2스푼'), ('간마늘                                                                                15g', '2/3스푼'), ('다진대파                                                                                약 40g', '4큰술'), ('통깨                                                                                1~2g', '1/2스푼'), ('물                                                                                32g', '4스푼'), ('청양고추', '1개'), ('찹쌀가루                                                                                20g', '2스푼'), ('참기름                                                                                6g', '1스푼')]",어릴적 껍질반을 깐 상태에서 양념장이 올라앉은 꼬막을 쇽쇽 빼먹으면서 밥을 먹으면 언제 먹었는지도 모르게 밥 1그릇이 사라져 있을 정도로 꼬막은 정말 맛있는 반찬이랍니다. 오늘 만들어볼 꼬막레시피는 무침으로 먹어도 되지만 밥에 슥슥 비벼먹으면 한 2공기씩 먹을수 있는 맛있는 꼬막 양념이랍니다.한번 먹으면 계속 생각되는 마성의 꼬막 양념!! 꼭 한번 만들어보세요.,"[{'step_number': 1, 'description': '꼬막 800g 을 찬물을 넉넉하게 부어서 표면을 마찰시켜가며 물갈아 주면서 부득부득 3~4차례 씻어주세요. 조금더 깔끔하게 드시려면 솔로 표면을 슥슥슥 문질러주세요.믹싱볼 , 주방솔', 'image_url': 'https://recipe1.ezmember.co.kr/cache/recipe/2024/07/24/d1c35bf7c49dfdf55713e4ec25242c1c1.jpg'}, {'step_number': 2, 'description': '물에 소금을 넣고 식초를 넣은 다음', 'image_url': 'https://recipe1.ezmember.co.kr/cache/recipe/2024/07/24/197f958e52deeba4fc9096bf2cc46d621.jpg'}, {'step_number': 3, 'description': '꼬막을 넣고', 'image_url': 'https://recipe1.ezmember.co.kr/cache/recipe/2024/07/24/de355985455808d189515103784be22b1.jpg'}, {'step_number': 4, 'description': '검은 비닐을 덮어 30분 정도 해감을 시켜주세요. 스텐 숟가락을 넣기도 하는데 전 볼이 스텐이라 따로 넣지 않았어요. 그리고 요즘 꼬막은 웬만하면 해감이 다 되어 나오기때문에 해감을 안해도 되고 저 처럼 짧게 해주시면 됩니다. 그런데 혹시 꼬막 산지에서 바로 구매하셨으면 12시간 정도는 해감을 시켜 주셔야 합니다!비닐봉지', 'image_url': 'https://recipe1.ezmember.co.kr/cache/recipe/2024/07/24/7bfd8dc4228730fee211b293ae4589d71.jpg'}, {'step_number': 5, 'description': '양념장에 적힌 재료를 분량껏 볼에 부어주세요. 고춧가루는 중간입자 고춧가루 입니다.설탕을 분량껏 넣어 단맛을 맞출거에요. 설탕이 들어가지 않으면 짠맛만 강해서 양념 밸런스가 안맞으니 꼭 넣어주세요.소스볼', 'image_url': 'https://recipe1.ezmember.co.kr/cache/recipe/2024/07/24/03f9f1e0446d2c069c7b93150a91c2ca1.jpg'}, {'step_number': 6, 'description': '간장은 진간장 대신 양조간장을 사용하셔도 됩니다.', 'image_url': 'https://recipe1.ezmember.co.kr/cache/recipe/2024/07/24/a49c97b3673304826e17159b001397c11.jpg'}, {'step_number': 7, 'description': '미림은 알콜도수 14% 짜리 맛술입니다. 다른 가향된 맛술과는 다른맛을 내니 미림을 사용해주시고 알콜에 민감하거나 아이들을 먹일경우 전자렌지에 10~20초 돌려 알콜을 적당히 날리고 사용하세요.', 'image_url': 'https://recipe1.ezmember.co.kr/cache/recipe/2024/07/24/c78d854bc5da12da26989e1cf7594ca81.jpg'}, {'step_number': 8, 'description': '식초는 양조식초를 사용했습니다. 사과식초를 사용해주셔도 좋습니다.', 'image_url': 'https://recipe1.ezmember.co.kr/cache/recipe/2024/07/24/5fb93ec9741836bb8e5e31fadfeb16061.jpg'}, {'step_number': 9, 'description': '굴소스를 넣어주세요. 굴소스는 가열해서 먹어야 한다는 분도 계신데... 굴소스를 생으로 먹는 레시피는 굴소스 명가 이금기 레시피북에도 있습니다. 변질없이 보관이 잘된 굴소스는 생으로 먹어도 무방합니다.', 'image_url': 'https://recipe1.ezmember.co.kr/cache/recipe/2024/07/24/b1a1c23187e21f47c6ea1fbe911f0ebe1.jpg'}, {'step_number': 10, 'description': '마늘은 꼭 간마늘을 사용해주세요.', 'image_url': 'https://recipe1.ezmember.co.kr/cache/recipe/2024/07/24/e3cef37ffaeee1b96de952e52ce5a45c1.jpg'}, {'step_number': 11, 'description': '대파는 흰대 초록대를 골고루 섞어서 넣어주세요. 대파가 없으면 쪽파 부추를 사용하셔도 되고 대파와 쪽파 부추를 적당히 섞어주시는것도 좋습니다.', 'image_url': 'https://recipe1.ezmember.co.kr/cache/recipe/2024/07/24/11fc4cb91f2aa08c2970a812afe8092c1.jpg'}, {'step_number': 12, 'description': '통깨를 넣고 물 4스푼을 넣어주세요.(청양고추는 기호에 따라 넣거나 생략하시면 됩니다. 저는 애들도 먹을거라 생략했어요.)', 'image_url': 'https://recipe1.ezmember.co.kr/cache/recipe/2024/07/24/a365c7656a2109f9806a949a9b0b21ff1.jpg'}, {'step_number': 13, 'description': '찹쌀가루를 적당히 퍼서 2스푼 넣어주세요. 찹쌀가루가 들어가면 양념에 질감이 생겨 꼬막에 더 잘 달라 붙어 있는 답니다.', 'image_url': 'https://recipe1.ezmember.co.kr/cache/recipe/2024/07/24/8f1ec0de694504bfd7df236a2aa6cb4b1.jpg'}, {'step_number': 14, 'description': '찹쌀가루를 골고루 풀어 준 다음 바로 사용하는게 아니라 전자렌지에 30초를 돌려준 다음 골고루 섞고 또 한차례 30초 돌려준다음 골고루 섞어주세요. 그래야 찹쌀가루가 잘 풀어집니다.', 'image_url': 'https://recipe1.ezmember.co.kr/cache/recipe/2024/07/24/f442bcb59160033cb27a93ac258fddcb1.jpg'}, {'step_number': 15, 'description': '참기름을 넣고 골고루 섞어서 최소 6시간 권장 12시간 냉장숙성을 시켜주세요. 양념양이 꼬막 3~4번 무쳐먹을수 있는 양이고 남은 양념은 맨김에 밥올려 살짝 뿌려먹어도 되고 콩나물밥에 해드셔도 끝내줍니다.', 'image_url': 'https://recipe1.ezmember.co.kr/cache/recipe/2024/07/24/b741a06b633effef63c01304879efd7b1.jpg'}, {'step_number': 16, 'description': '물양이 적으면 물이 식어 버려서 꼬막이 덜 삶길수 있으니 꼬막 무게에 2~3배 되는 물을 펄펄 끓여서 꼬막을 넣어주세요.냄비', 'image_url': 'https://recipe1.ezmember.co.kr/cache/recipe/2024/07/24/dd76e90b70eb832fc12f267d14e69e011.jpg'}, {'step_number': 17, 'description': '일반적으론 꼬막을 넣고 물을 끄고 휘휘 저으며 2분을 섞어주는데 저는 그냥 불을 켠 상태로 2분 정도를 삶아줍니다. 불을 켠 상태로 저어준다고 꼬막이 확 질겨지지나 하지 않으니 꼬막이 덜익는것 보다는 조금더 뜨겁게 해주는게 좋아서 저는 불을 켠 상태로 2분을 담궈준답니다. 여러분들은 기호에 맞게 삶아주시면 됩니다~', 'image_url': 'https://recipe1.ezmember.co.kr/cache/recipe/2024/07/24/4ad28b1ba706bd80ae20444befd333b81.jpg'}, {'step_number': 18, 'description': '삶은 꼬막은 찬물을 부어 재빠르게 식혀주세요. 한번에 다 드실거면 상온에 식혀도 되지만 몇번 나눠드실때는 상온에서 그냥 식히면 상하는 속도가 빨라질수 있으니 찬물에 잽싸게 식혀주세요.채반', 'image_url': 'https://recipe1.ezmember.co.kr/cache/recipe/2024/07/24/ef523f0e31b3cb5284af76fd75e0cc0d1.jpg'}, {'step_number': 19, 'description': '입을 벌이지 않은 꼬막은 뒷부분에 숟가락을 넣고 살짝 제끼면 잘 까진답니다.', 'image_url': 'https://recipe1.ezmember.co.kr/cache/recipe/2024/07/24/66eb5a5f79df1f0e3909bf0ec89819dc1.jpg'}, {'step_number': 20, 'description': '꼬막에 만들어둔 양념을 조금씩 올려서 반찬으로 드셔도 되고살만 발라 밥에 올려서 양념장을 적당히 뿌려서 밥비벼드시면 완전 꿀맛입니다! 맨김 구워서 올려 먹으면 2배로 맛있습니다!접시', 'image_url': 'https://recipe1.ezmember.co.kr/cache/recipe/2024/07/24/2b6bc2da63ee14be97a19372cef4339c1.jpg'}]"
