index,종류별,상황별,재료별,방법별,글 제목,레시피이름,조회수,조리시간,난이도,인분,재료,소개글,조리순서
10890,밑반찬,일상,버섯류,볶음,표고버섯볶음 [영양 듬뿍! 쫄깃함이 매력적인 밥도둑 밑반찬! 백종원 레시피로 더 맛있게 만들기!],표고버섯볶음,"1,809",30분 이내,아무나,2인분,"[('표고버섯', '8개'), ('마늘쫑', '6개'), ('마늘', '4개'), ('소금', '1꼬집'), ('후추', '1꼬집'), ('진간장', '2스푼'), ('굴소스', '2스푼'), ('맛술', '2스푼'), ('설탕', '1/2스푼'), ('깨', '1/2스푼'), ('참기름', '1스푼')]","표고버섯은 다른 요리에 활용하기도 좋지만,

최소한의 양념 넣고 볶아먹는 게

제일 맛있는 것 같아요.

​

싱싱한 표고버섯을 적당한 두께로 잘라서

야들야들 볶아놓으면 

메인 반찬 못지않은

맛을 내죠.","[{'step_number': 1, 'description': '표고버섯 8개를 준비해 주시고요.\n밑동을 빼낸 후\n적당한 굵기로 잘라주세요.', 'image_url': 'https://recipe1.ezmember.co.kr/cache/recipe/2022/02/15/2fd4fc55e84a594496c64975addf8d831.jpg'}, {'step_number': 2, 'description': '마늘 6개, 마늘쫑 4개를\n준비해 주시고요.\n마늘은 편으로 썰고\n마늘쫑은 먹기 좋은 크기로 잘라주세요.\n마늘쫑은 꼭 넣지 않아도 되는데요.\n저는 마늘쫑을 좋아해서\n함께 넣어서 볶아먹어요.', 'image_url': 'https://recipe1.ezmember.co.kr/cache/recipe/2022/02/15/15587a8b7585d0361184684f4a3fec6e1.jpg'}, {'step_number': 3, 'description': '진간장 2스푼, 굴소스 2스푼,\n맛술 2스푼, 설탕 1/2스푼, 깨 1/2스푼\n모두 넣고 골고루 섞어주세요.', 'image_url': 'https://recipe1.ezmember.co.kr/cache/recipe/2022/02/15/cbdcbf803f44cc81a7e96c9156a2cc491.jpg'}, {'step_number': 4, 'description': '기름 두른 팬에 \n마늘과 마늘쫑을 넣어주세요.\n소금 1꼬집, 후추 1꼬집을 넣고\n골고루 섞으며 볶아주세요.\n완전히 다 익히지 말고\n식감이 살아있게 볶으면\n더 맛있어요.', 'image_url': 'https://recipe1.ezmember.co.kr/cache/recipe/2022/02/15/80066550b058e4bebdf5dc03d565b0cc1.jpg'}, {'step_number': 5, 'description': '마늘과 마늘쫑이 어느정도 익으면\n표고버섯도 함께 넣어주세요.\n소금 1꼬집, 후추 1꼬집을 넣고\n골고루 섞으며 볶아주세요.\n표고버섯의 숨이 죽을 때까지\n볶아주시면 돼요.', 'image_url': 'https://recipe1.ezmember.co.kr/cache/recipe/2022/02/15/59982386e418e3a3b716303c813a77bc1.jpg'}, {'step_number': 6, 'description': '표고버섯의 숨이 죽으면\n양념장을 넣어주세요.\n양념장이 골고루 배도록\n섞으며 빠르게 볶아주세요.\n마지막에 참기름 한바퀴 휙\n둘러주면 더 향긋하겠죠?', 'image_url': 'https://recipe1.ezmember.co.kr/cache/recipe/2022/02/15/5dd2a74843a9e99de6483212ddda6cf01.jpg'}, {'step_number': 7, 'description': '싱싱한 표고버섯과 \n마늘, 마늘쫑 넣고\n간장, 굴소스 섞은 양념장에 볶은\n표고버섯볶음이 완성됐어요.\n다진마늘을 넣기보다는 \n편마늘을 넣으면 \n보기에도 깔끔하고\n마늘 씹는 맛도 더해져서 좋아요.\n마늘쫑은 제가 좋아하는 식재료라서\n함께 넣고 볶았는데요.\n마늘과 마늘쫑의 궁합이 좋다보니\n잘 어울리네요.\n표고버섯은 혈관건강에 좋다고 해요.\n혈중 콜레스테롤 수치를 낮춰주고,\n다이어트에도 좋고요.\n원래도 좋아하지만 \n효능을 알고나니 \n더 자주 먹어야겠다는 \n생각이 드네요.ㅎㅎㅎ\n영양 듬뿍 맛도 좋은\n초간단 밑반찬인 표고버섯볶음!\n여러분도 한번 만들어 보시면 좋겠네요.^^', 'image_url': 'https://recipe1.ezmember.co.kr/cache/recipe/2022/02/15/035c36974f5f8d7353afe9a48dc00ddc1.jpg'}]"
10891,밑반찬,일상,버섯류,볶음,"[건강한밥상] 초간단 버섯 볶음, No버섯삶기, No번거로움, 냉장고털기에 안성맞춤~",버섯볶음,634,30분 이내,초급,2인분,"[('버섯', '200g'), ('건목이버섯', '5개'), ('양파', '1/2개'), ('당근', '1/2개'), ('다진마늘', '1T'), ('다진파', '1줌'), ('식용류', '2T'), ('소금', '1/2T'), ('참기름', '1T')]","버섯 몸에 좋은 건 다들 아시죠?! 
짜투리 야채와 남은 버섯까지 처리할 수 있어서 1석2조레시피랍니다~ 
버섯 삶는 과정까지 생략해서 세상 간단해요~ 
요리는 쉬워야죠~ 요리하러 고고~","[{'step_number': 1, 'description': '(중불)느라티버섯과 목이버섯을 후라이팬이 기름 두르지 않고 중불에 볶습니다. 수분이 날아갈 정도로 5분 정도 볶아준 후 접시에 담아둡니다.\n(건목이버섯을 물에 담가 불려놓은것을 사용했어요)', 'image_url': 'https://recipe1.ezmember.co.kr/cache/recipe/2021/10/21/17d5923bff6841ad9f8f5db932e6bee21.jpg'}, {'step_number': 2, 'description': '(중불)버섯볶았던 후라이팬에 식용류를 넉넉하게 두르고 당근과 양파를 볶아줍니다. 양파가 흐물흐물해졌을 때까지 볶아주세요~', 'image_url': 'https://recipe1.ezmember.co.kr/cache/recipe/2021/10/21/f21247d1a590d8676c2f7121439b44581.jpg'}, {'step_number': 3, 'description': '(중불)1번에서 볶았던 버섯을 2번 야채 볶은 후라이팬에 같이 넣고 섞어주며 볶습니다. 이때 다진마늘과 파를 넣어주고 소금으로 간을 맞추며 5분정도 더 볶아줍니다. 마지막에 참기름 넣으면 완성이에요~', 'image_url': 'https://recipe1.ezmember.co.kr/cache/recipe/2021/10/21/998927f06e7a62ccbabd461c64e606b51.jpg'}, {'step_number': 4, 'description': '완성~ ^0^\n(저는 냉장고에 미역줄기가 조그 남아 있어서 같이 볶아주었어요. 남아있는 애호박이나 다른 채소들을 넣어주셔도 맛있어요. 냉장고 털기에 딱 좋은 메뉴랍니다^^)', 'image_url': 'https://recipe1.ezmember.co.kr/cache/recipe/2021/10/21/0a00ca3b7aafe5bdb2bbe9cdb3a1a0bd1.jpg'}]"
10892,밑반찬,일상,버섯류,볶음,표고버섯볶음 만드는 법 들기름으로 고소함을 더해주기,표고버섯볶음,"2,842",15분 이내,초급,2인분,"[('표고버섯', '4~5개'), ('양파', '1/4개'), ('당근', '1/4개'), ('대파', '1/3대'), ('다진 마늘', '1/2수저'), ('굴소스', '1수저'), ('간장', '1/2수저'), ('식용유', '1수저'), ('들기름', '1수저'), ('통깨', '1/2수저')]","표고버섯 고유의 맛을 살려 간단하게 만들어 맛볼 수 있어요.
버섯류를 좋아하는 맘마랜드가 자주 사용하는 식재료 중 하나로 
식이섬유가 풍부한 식재료로 면역력에도 좋은 표고버섯이에요.

자, 그럼 표고버섯을 볶아보러 가볼까요?!","[{'step_number': 1, 'description': '재료를 준비해 주세요.\n- 표고버섯은 흐르는 물에 살살~ 씻어주세요.\n- 양파, 당근은 필수는 아니에요.', 'image_url': 'https://recipe1.ezmember.co.kr/cache/recipe/2021/11/01/595961d4212804b1c220dea423463e131.jpg'}, {'step_number': 2, 'description': '대파는 쫑쫑쫑~ 썰어주세요.대파 1/3대', 'image_url': 'https://recipe1.ezmember.co.kr/cache/recipe/2021/11/01/c73a5f7b815471b50428974a19b9ab601.jpg'}, {'step_number': 3, 'description': '당근은 얇게 채 썰어주세요.당근 1/4개', 'image_url': 'https://recipe1.ezmember.co.kr/cache/recipe/2021/11/01/f0160c1e0487e143046732c4668dc0a61.jpg'}, {'step_number': 4, 'description': '양파도 채 썰어 준비해 주세요.양파 1/4개', 'image_url': 'https://recipe1.ezmember.co.kr/cache/recipe/2021/11/01/898b7948c76cec355033ad870ae17b361.jpg'}, {'step_number': 5, 'description': '표고버섯도 썰어줍니다.표고버섯 4~5개', 'image_url': 'https://recipe1.ezmember.co.kr/cache/recipe/2021/11/01/2a8d119f2a2c973dadfb357df9dabd811.jpg'}, {'step_number': 6, 'description': '팬에 식용유 한 수저 정도 넣어주세요.식용류 1수저', 'image_url': 'https://recipe1.ezmember.co.kr/cache/recipe/2021/11/01/379bc72f986a53ef06542158ba58d3be1.jpg'}, {'step_number': 7, 'description': '고소함을 줄 들기름 한 수저반 정도 넣어주세요.\n- 들기름은 발화점이 낮아서 볶음 할 때 식용유를 좀 섞어 사용하면 좋아요.들기름 1수저', 'image_url': 'https://recipe1.ezmember.co.kr/cache/recipe/2021/11/01/2e1aec8527151aaec9ed14261677fb1b1.jpg'}, {'step_number': 8, 'description': '썰어놓은 파를 넣어주세요.중불', 'image_url': 'https://recipe1.ezmember.co.kr/cache/recipe/2021/11/01/1ea104258570944485a0b41324e7f44e1.jpg'}, {'step_number': 9, 'description': '중약불에 파를 볶아주세요.\n- 불이 세면 파가 금세 타고 기름에 파향이 배어들지 않아요.', 'image_url': 'https://recipe1.ezmember.co.kr/cache/recipe/2021/11/01/474e12b129368220f1f2a405aa1e01ae1.jpg'}, {'step_number': 10, 'description': '채 썰어놓은 당근을 넣어주세요.', 'image_url': 'https://recipe1.ezmember.co.kr/cache/recipe/2021/11/01/80433075c9868efd09f7111b999a005e1.jpg'}, {'step_number': 11, 'description': '양파도 넣어줍니다.', 'image_url': 'https://recipe1.ezmember.co.kr/cache/recipe/2021/11/01/393348694b90f45ba77bf69b5bd405d91.jpg'}, {'step_number': 12, 'description': '표고버섯도 함께 넣어주세요.', 'image_url': 'https://recipe1.ezmember.co.kr/cache/recipe/2021/11/01/7fa0e57a0aa68264a6589636dff151501.jpg'}, {'step_number': 13, 'description': '파 기름에 달달달~ 볶아주세요.', 'image_url': 'https://recipe1.ezmember.co.kr/cache/recipe/2021/11/01/8dab6efcbd2e3f517f1739e2b7d94b751.jpg'}, {'step_number': 14, 'description': '다진 마늘 반 수저를 넣어주세요.', 'image_url': 'https://recipe1.ezmember.co.kr/cache/recipe/2021/11/01/c2049260746691adbd451ce0f027d51d1.jpg'}, {'step_number': 15, 'description': '굴소스 한 수저를 넣어주세요.굴소스 1수저', 'image_url': 'https://recipe1.ezmember.co.kr/cache/recipe/2021/11/01/2de7c7c11c32dd3647671aaedd2c18f81.jpg'}, {'step_number': 16, 'description': '진간장 반 수저를 넣어 볶아주세요.간장 1/2수저', 'image_url': 'https://recipe1.ezmember.co.kr/cache/recipe/2021/11/01/c968f79957ebd0be4cc387f7e580db561.jpg'}, {'step_number': 17, 'description': '표고버섯이 양념과 함께 볶아주세요.', 'image_url': 'https://recipe1.ezmember.co.kr/cache/recipe/2021/11/01/a8c115671b3db03b69d1549da02514801.jpg'}, {'step_number': 18, 'description': '마무리로 통깨를 넣어주시면 표고버섯볶음 완성입니다.\n- 통깨는 빻아서 넣어주면 더 고소해요.통깨 1/2수저', 'image_url': 'https://recipe1.ezmember.co.kr/cache/recipe/2021/11/01/14b5d0689cc3a32fe190482d7ebe5dcf1.jpg'}, {'step_number': 19, 'description': '들기름으로 볶아주아서 고소한 내가 폴폴~ 나는 #표고버섯볶음 이네요.\n표고버섯의 식감을 고기 식감만큼이나 쫄깃쫄깃하며 표고버섯의 향내도 함께 느낄 수 있어요.\n건강한 반찬이 금세 완성되었네요.', 'image_url': 'https://recipe1.ezmember.co.kr/cache/recipe/2021/11/01/bc688bab3349b883a7e40e6bd462481c1.jpg'}]"
10893,밑반찬,일상,버섯류,볶음,:: 목이버섯 요리 :: 야채와 함께 굴소스로 맛을 낸 목이버섯 볶음 만들기,목이버섯볶음,"4,578",60분 이내,초급,2인분,"[('목이버섯', '20g'), ('양파', '1/4개'), ('미니 파프리카', '2개'), ('식용유', '적당히'), ('진간장', '1T'), ('굴소스', '2T'), ('설탕', '0.5T'), ('후춧가루', '조금'), ('참깨', '0.5T'), ('참기름', '0.5T')]",굴소스를 넣고 볶아주면 반찬으로 손색없는 목이버섯 볶음이에요.,"[{'step_number': 1, 'description': '건목이버섯을 찬물에 30분간 불려주세요.', 'image_url': 'https://recipe1.ezmember.co.kr/cache/recipe/2021/10/29/47d09e64e016cdc5bf7a278a96579df31.jpg'}, {'step_number': 2, 'description': '양파 1/4개를 채썰어서 준비해 주세요.', 'image_url': 'https://recipe1.ezmember.co.kr/cache/recipe/2021/10/29/86d91a360a108ec119e8621dd66e3b791.jpg'}, {'step_number': 3, 'description': '미니 파프리카 2개도 양파 크기로 채썰어줍니다. 미니 파프리카가 없다면 큰 파프리카 1개를 사용해주면 됩니다.', 'image_url': 'https://recipe1.ezmember.co.kr/cache/recipe/2021/10/29/a5f69ca07963d3519e320bbf218fce001.jpg'}, {'step_number': 4, 'description': '물에불린 목이버섯 손질을 해주세요. 버섯 가운데에 나무에 붙어있던 흔적(꽁지)을 가위로 잘라주세요. 그리고 먹기 좋은 크기로 목이버섯을 찢어줍니다.버섯 손질법 레시피', 'image_url': 'https://recipe1.ezmember.co.kr/cache/recipe/2021/10/29/e0ea1c8331b1804aa7ccac952b0763fb1.jpg'}, {'step_number': 5, 'description': '손질한 목이버섯은 바락바락 문질러서 3~4차례 정도로 헹구어줍니다.목이버섯은 먼지가 많이 묻어있기 때문에 깨끗하게 씻어주세요.', 'image_url': 'https://recipe1.ezmember.co.kr/cache/recipe/2021/10/29/659426c2404b016162a9694197e69a111.jpg'}, {'step_number': 6, 'description': '팬에 식용유를 적당히 두르고 양파와 파프리카를 넣고 볶아주세요.', 'image_url': 'https://recipe1.ezmember.co.kr/cache/recipe/2021/10/29/3349c598c1ca127b4a31ef08fc6ec65a1.jpg'}, {'step_number': 7, 'description': '여기에 다진마늘 0.5T를 넣고 더 볶아줍니다.', 'image_url': 'https://recipe1.ezmember.co.kr/cache/recipe/2021/10/29/22dc118c40fce01b5fbf996a1f931eb41.jpg'}, {'step_number': 8, 'description': '야채가 적당히 볶아지면 씻어놓은 목이버섯을 넣고 중불로 볶아줍니다.중불', 'image_url': 'https://recipe1.ezmember.co.kr/cache/recipe/2021/10/29/49419d58cd0f37f6a950185b2e84c9751.jpg'}, {'step_number': 9, 'description': '진간장 1T를 팬에 넣고 약 10초간 불향을 내준 후 재료들과 다같이 볶아주세요.', 'image_url': 'https://recipe1.ezmember.co.kr/cache/recipe/2021/10/29/167bfb5f2cb65d332db0b6642d182bb11.jpg'}, {'step_number': 10, 'description': '굴소스 2T를 넣어줍니다.', 'image_url': 'https://recipe1.ezmember.co.kr/cache/recipe/2021/10/29/19a81fbd5d68fc2ca4fea1d5498f5ff51.jpg'}, {'step_number': 11, 'description': '설탕 0.5T를 넣고 목이버섯이 다 익을때까지 볶아주세요.목이버섯이 다 익는데 시간이 오래걸리지는 않아요.', 'image_url': 'https://recipe1.ezmember.co.kr/cache/recipe/2021/10/29/1a1e78275454dc480e537e68243e00b51.jpg'}, {'step_number': 12, 'description': '불을 끈 후 후춧가루를 적당히 뿌려주세요.', 'image_url': 'https://recipe1.ezmember.co.kr/cache/recipe/2021/10/29/2b44f5bd507c83de4d7ba4a56fc797311.jpg'}, {'step_number': 13, 'description': '참깨 0.5T를 넣어주세요.', 'image_url': 'https://recipe1.ezmember.co.kr/cache/recipe/2021/10/29/e59192da85dd78e6aed19dea4e2c837d1.jpg'}, {'step_number': 14, 'description': '마지막으로 참기름 0.5T를 넣고 잘 섞어주세요.', 'image_url': 'https://recipe1.ezmember.co.kr/cache/recipe/2021/10/29/2bb080239a50b1524d1487459cabf1e31.jpg'}, {'step_number': 15, 'description': '꼬들꼬들한 식감이 맛있는 목이버섯 볶음이에요!', 'image_url': 'https://recipe1.ezmember.co.kr/cache/recipe/2021/10/29/5e50ebee2dacee18d95761aa5be3ce861.jpg'}]"
10894,밑반찬,일상,버섯류,볶음,[느타리버섯볶음],느타리버섯볶음,"1,358",15분 이내,아무나,2인분,"[('느타리버섯', '1팩'), ('양파', '1/2'), ('미니파프리카', '1/2'), ('간장', '2큰술'), ('굴소스', '0.5큰술'), ('다진마늘', '0.5큰술'), ('올리고당', '약간'), ('후추', '톡'), ('통깨', ''), ('천연조미료', '조금'), ('카놀라유', '')]",느타리버섯 볶음 만들기,"[{'step_number': 1, 'description': '양파,파프리카 채 썰고 버섯은 밑동을 잘라내고 가볍게 헹군 후 하나씩 뜯어 팬에 담아준다', 'image_url': 'https://recipe1.ezmember.co.kr/cache/recipe/2022/01/22/148cf904b8ece42766569c9a332d4dda1.jpg'}, {'step_number': 2, 'description': '카놀라유 적당히 두르고 버섯에 숨이 죽을동안 볶아준다', 'image_url': 'https://recipe1.ezmember.co.kr/cache/recipe/2022/01/22/779bc3bf1a63fae00004236dc79cd5d41.jpg'}, {'step_number': 3, 'description': '굴소스,간장,다진마늘,후추,올리고당 넣고 양념이 고루 배이게 볶아준다', 'image_url': 'https://recipe1.ezmember.co.kr/cache/recipe/2022/01/22/051d982c62a66291bf1e50d58b220cec1.jpg'}, {'step_number': 4, 'description': '파 어슷 썰어 넣고 볶아준다', 'image_url': 'https://recipe1.ezmember.co.kr/cache/recipe/2022/01/22/383f29574e416c4a0c7976a713579fb31.jpg'}, {'step_number': 5, 'description': '마지막으로 통깨,천연조미료 넣어 휙~볶아주면 완성\n(천연조미료 선택)', 'image_url': 'https://recipe1.ezmember.co.kr/cache/recipe/2022/01/22/2d1058858d1f4c22d7c377179e22585d1.jpg'}]"
10895,밑반찬,일상,버섯류,볶음,표고버섯볶음 만드는법 손질에서 보관까지,표고버섯볶음,"2,014",15분 이내,아무나,2인분,"[('표고버섯', '10개'), ('진간장', '3큰술'), ('다진마늘', '1/2큰술'), ('통깨', '1큰술'), ('참기름', '1큰술'), ('후추', '톡톡'), ('대파', '약간'), ('피망', '1개'), ('당근', '1/4개')]","밥반찬으로 좋은 생표고버섯볶음 만드는법 올려보는데요, 초간단하게 볶을 수 있는 반찬으로 버섯 특유의 향과 함께 쫄깃한 식감이 고기처럼 맛난 표고버섯요리 랍니다.","[{'step_number': 1, 'description': '냉장고에 두고 먹어도 좋은데요, 표고버섯 보관법 간단해요. 표고버섯을 톡톡 털어서 씻지 않고 그대로 키친타월을 펴고 낱개로 돌돌 말아주고', 'image_url': 'https://recipe1.ezmember.co.kr/cache/recipe/2022/02/07/188f1b612475e33b6511aed2e6876cf01.jpg'}, {'step_number': 2, 'description': '지퍼팩에 넣어 냉장고에 두고 보관하시면 좀더 오래 두고 먹을 수가 있어요. 생표고이니 가능한 빠르게 먹는 것이 좋구요, 이렇게 보관해서 몇개씩 꺼내서 사용하심 된답니다.', 'image_url': 'https://recipe1.ezmember.co.kr/cache/recipe/2022/02/07/1399254ff157dffb2a892e0dc681036f1.jpg'}, {'step_number': 3, 'description': '그럼 생표고버섯볶음 만들어 볼께요, 표고버섯손질 할 거 따로 없고, 톡톡 털어 준 다음 밑둥을 잘라줍니다. 표고버섯 손질법 레시피', 'image_url': 'https://recipe1.ezmember.co.kr/cache/recipe/2022/02/07/37aabc9efbf9b34ea6032eeebf2f1b2f1.jpg'}, {'step_number': 4, 'description': '바로 딴 거라 밑둥도 연하긴 해서 납작하게 썰어서 함께 볶아도 되는데요, 싫으시면 잘게 썰어 두었다가 된장찌개에 넣고 끓이시면 좋아요.', 'image_url': 'https://recipe1.ezmember.co.kr/cache/recipe/2022/02/07/26670169cf5b6346b7587351e0bbd4f71.jpg'}, {'step_number': 5, 'description': '표고버섯은 칼을 살짝 눕혀서 어슷하게 썰어 줍니다. 버섯이 크다보니 썰어 놓은 것도 크기가 상당히 커서 더 먹음직스럽더라구요.', 'image_url': 'https://recipe1.ezmember.co.kr/cache/recipe/2022/02/07/508c9bfa451cc7dac3a5a1f0a5020c0c1.jpg'}, {'step_number': 6, 'description': '당근도 길쭉하니 납작하게 썰어 주고, 피망은 반을 갈라서 씨를 제거하고 길쭉하게 썰고 대파는 어슷 썰어 줍니다. 양파를 넣어도 맛이 좋아요.', 'image_url': 'https://recipe1.ezmember.co.kr/cache/recipe/2022/02/07/bcd2873870e10d757f19babefacf965a1.jpg'}, {'step_number': 7, 'description': '기름을 두르고 버섯을 볶아 줍니다.', 'image_url': 'https://recipe1.ezmember.co.kr/cache/recipe/2022/02/07/d27ba9244917ff08e7354a2fbac9e35f1.jpg'}, {'step_number': 8, 'description': '당근과 피망 썬 것도 넣어 함께 볶아 줍니다. 양파 넣어 주면 달큰한 맛이 좋으니 넣은 것을 추천 드립니다. 또 고기 좋아하시면 파기름좀 내어서 소고기나 훈제오리 등을 넣고 함께 볶아 주셔도 좋구요.', 'image_url': 'https://recipe1.ezmember.co.kr/cache/recipe/2022/02/07/1b53b99dc21e19757164236498b9ec831.jpg'}, {'step_number': 9, 'description': '어느 정도 살짝 볶아 주다가 한숨 잦아든거 같으면 진간장 3큰술을 넣어 볶아 줍니다. 굴소스를 넣어 주셔도 좋아요.', 'image_url': 'https://recipe1.ezmember.co.kr/cache/recipe/2022/02/07/16df1f9cf90270907dc1efd5297505171.jpg'}, {'step_number': 10, 'description': '다진마늘도 반큰술을 넣어 빠르게 볶아 줍니다.', 'image_url': 'https://recipe1.ezmember.co.kr/cache/recipe/2022/02/07/72cb29ab4addd27d1066c35bd17dada21.jpg'}, {'step_number': 11, 'description': '다 볶아지면 대파를 넣고 통깨를 넣어 한번 더 볶아 준 후에 불을 꺼 줍니다.', 'image_url': 'https://recipe1.ezmember.co.kr/cache/recipe/2022/02/07/39ccf276314d8eeead7768cb622b9eda1.jpg'}, {'step_number': 12, 'description': '마지막으로 참기름 1큰술을 넣어 골고루 섞어 주면 된답니다.', 'image_url': 'https://recipe1.ezmember.co.kr/cache/recipe/2022/02/07/2eb4a4b073655684ef0c2f9d0bf410901.jpg'}, {'step_number': 13, 'description': '버섯을 데치지 않고 바로 생표고버섯으로 볶으니 시간도 단축되고 빠르게 볶을 수 있어 좋답니다.', 'image_url': 'https://recipe1.ezmember.co.kr/cache/recipe/2022/02/07/569657f537086ac228c6a054c5fa4e6a1.jpg'}, {'step_number': 14, 'description': '야채와 함께 볶아 본 표고버섯볶음 만드는법 으로 초간단하게 만들기 쉬운데요, 간장의 감칠맛도 좋고 버섯의 쫄깃함이 맛나답니다.', 'image_url': 'https://recipe1.ezmember.co.kr/cache/recipe/2022/02/07/c450cea2facdb0fc6dc8eef865b284011.jpg'}]"
10896,밑반찬,일상,버섯류,볶음,새송이버섯애호박볶음!,새송이버섯애호박볶음,"1,423",15분 이내,아무나,4인분,"[('애호박', '1개'), ('새송이버섯', '2~3개'), ('적양파', '1개'), ('대파', '조금'), ('소금', '2작은술'), ('다진마늘', '1티스푼'), ('해바라기유', '2큰술'), ('참기름', '1작은술'), ('통깨', '조금')]","애호박과 새송이버섯,적양파를 넣어서 휘리릭 볶음반찬 만들어봤어요
질척이지않고 애호박의 뭉그러짐 없는 팁이 담겨져 있어요","[{'step_number': 1, 'description': '애호박1개를 너무 얇지않게 채를 썰어주신후 소금을 넣어서 잘 섞어 10분정도 절여주세요\n절여진후 물기를 짜주세요\n*물기를 짠후 살짝 맛본후 너무 짜다 싶으시면 찬물에 살짝 씻어 물기를 짜주신후 조리하세요', 'image_url': 'https://recipe1.ezmember.co.kr/cache/recipe/2022/06/26/870423e15cafc8c60757e2762b2175da1.jpg'}, {'step_number': 2, 'description': '새송이버섯도 애호박채와 비슷하게 채를 썰어 소금을 넣어서 절여주세요\n절여진후 물기를 꼭짜주세요', 'image_url': 'https://recipe1.ezmember.co.kr/cache/recipe/2022/06/26/72d4f8744bb6628fa3e336b979f334f11.jpg'}, {'step_number': 3, 'description': '적색양파를 애호박채와 비슷한 굵기로 채를 썰어주세요', 'image_url': 'https://recipe1.ezmember.co.kr/cache/recipe/2022/06/26/4b59b67fc2506f1a45ea734d068818541.jpg'}, {'step_number': 4, 'description': '대파반개를 쫑쫑썰어서 준비해주세요', 'image_url': 'https://recipe1.ezmember.co.kr/cache/recipe/2022/06/26/e3c440859da94a95d552bb491973366c1.jpg'}, {'step_number': 5, 'description': '팬에 해바라기유를 넣고 썰어준 대파와 다진마늘을 넣어 20~30초간 볶아주시다가', 'image_url': 'https://recipe1.ezmember.co.kr/cache/recipe/2022/06/26/0be04fc853fcce2a70d29a223f1d79341.jpg'}, {'step_number': 6, 'description': '절여서 물기를 짜준 애호박채,새송이버섯채,적색양파를 모두 넣어서 볶아주세요 \n적색양파가 투명해질만큼 휘리릭 센불에서 볶아주시면 되세요', 'image_url': 'https://recipe1.ezmember.co.kr/cache/recipe/2022/06/26/ccd877849e56e2c14c8c60fd7bd230171.jpg'}, {'step_number': 7, 'description': '최종간을 보시고 간이 부족하시면 소금을 추가해주시고 참기름과 통깨를 뿌려서 마무리해주시면 완성이네요', 'image_url': 'https://recipe1.ezmember.co.kr/cache/recipe/2022/06/26/a74a4aaad57adc0e6aa8c6d419fcb9e71.jpg'}]"
