index,종류별,상황별,재료별,방법별,글 제목,레시피이름,조회수,조리시간,난이도,인분,재료,소개글,조리순서
39944,메인반찬,술안주,해물류,부침,한 개씩 집어 먹으면 깔끔하고 맛있는 오징어링전 만드는 법,오징어링전,"2,881",30분 이내,아무나,2인분,"[('오징어', '2마리'), ('부추', '1/2줌'), ('청양고추', '1개'), ('양파', '1/2개'), ('당근', '1/4개'), ('부침가루', '3T'), ('계란', '1개'), ('물', '5T'), ('소금', '약간')]","원래 오늘 아침에 일찍 일어나서 아침 시장에 가려고 했는데 가지 못했습니다.

그 이유는 마당에 길고양이가 찾아와 애교 부리는 너무 귀여워서 길고양이와 놀다가 아침에 시간 가는 줄도 몰랐습니다.

요즘 동네를 떠돌아다니는 길고양이 중 사람의 손길을 잘 따르는 길고양이가 있는데 저희 집 마당에서 혼자 놀고 있는 모습을 봐서 아침 시장 가는 것을 포기했습니다.

그 모습이 어찌나 귀엽던지, 그래서 집에 있는 잔멸치를 뜨거운 물에 살짝 데쳐서 줬습니다.

떠돌아다니면서 이것저것 먹지 못했나 아니면 사람처럼 아침이라서 배고팠나 잘 먹었습니다.

아직 어린 듯한데 떠돌아다니는 것이 안타까운 마음이, 아무튼 귀여운 길고양이 때문에 아침 시장에 가지 못하고 아침 먹고 점심 먹고 뒤늦게 시장에 갔습니다.

싱싱한 오징어를 구입하고 싶어서 아침 시장에 가려고 했었는데 뒤늦게 시장을 찾아 오징어 찾아보는 것은 하늘의 별 따기가 되었습니다.

오징어 구입하고 싶은데 아무리 돌아다녀도 오징어가 보이지 않았습니다.

배를 따고 깨끗하게 손질되어 있는 오징어는 보였는데 손질되지 않고 통째로 있는 오징어는 찾기 힘들었습니다.


문의번호













원래 오늘 아침에 일찍 일어나서 아침 시장에 가려고 했는데 가지 못했습니다.

그 이유는 마당에 길고양이가 찾아와 애교 부리는 너무 귀여워서 길고양이와 놀다가 아침에 시간 가는 줄도 몰랐습니다.










요즘 동네를 떠돌아다니는 길고양이 중 사람의 손길을 잘 따르는 길고양이가 있는데 

저희 집 마당에서 혼자 놀고 있는 모습을 봐서 아침 시장 가는 것을 포기했습니다.










그 모습이 어찌나 귀엽던지, 그래서 집에 있는 잔멸치를 뜨거운 물에 살짝 데쳐서 줬습니다.

떠돌아다니면서 이것저것 먹지 못했나 아니면 사람처럼 아침이라서 배고팠나 잘 먹었습니다.

아직 어린 듯한데 떠돌아다니는 것이 안타까운 마음이, 아무튼 귀여운 길고양이 때문에 아침 시장에 가지 못하고 

아침 먹고 점심 먹고 뒤늦게 시장에 갔습니다.










싱싱한 오징어를 구입하고 싶어서 아침 시장에 가려고 했었는데 뒤늦게 시장을 찾아 오징어 찾아보는 것은 하늘의 별 따기가 되었습니다.

오징어 구입하고 싶은데 아무리 돌아다녀도 오징어가 보이지 않았습니다.

배를 따고 깨끗하게 손질되어 있는 오징어는 보였는데 손질되지 않고 통째로 있는 오징어는 찾기 힘들었습니다.










걷고 걷고 또 걷고 돌고 돌고 또 돌고를 반복해서 드디어 손질되지 않고 통째로 있는 오징어를 발견했습니다.

어찌나 행복하던지, 그 자리에서 바로 구입하고 뒤도 돌아보지 않은 채 바로 집으로 갔습니다.

손질되지 않고 통째로 있는 오징어를 구입한 이유는 바로 오징어링전을 만들기 위해서입니다.

오징어를 집에서 직접 손질해야 되는 다소 불편한 점이 있지만 

오징어링전을 만들어 먹어 보면 오징어 손질하는 것은 아무것도 아니라는 것을 깨닫게 됩니다.","[{'step_number': 1, 'description': '오징어는 몸통과 다리를 분리하면서 몸통 안에 들어 있는 내장과 척수를 제거하고 다리에 붙어 있는 눈과 잎을 제거한다.', 'image_url': 'https://recipe1.ezmember.co.kr/cache/recipe/2019/04/30/5739e0a4118a85c14fc01bb19dd9b7b41.jpg'}, {'step_number': 2, 'description': '손질한 오징어의 몸통은 1.5cm 간격으로 썰고 귀와 다리는 굵직하게 다진다.', 'image_url': 'https://recipe1.ezmember.co.kr/cache/recipe/2019/04/30/ac9e54b8527599bb2f2d9f00fd65bd7b1.jpg'}, {'step_number': 3, 'description': '끓는 물에 소금을 넣고 오징어 몸통 부분만 15초 정도 데친다.', 'image_url': 'https://recipe1.ezmember.co.kr/cache/recipe/2019/04/30/cc976a4d7f0b88bcd1f338f152d62df51.jpg'}, {'step_number': 4, 'description': '그다음 흐르는 물에 씻고 물기를 제거한다.', 'image_url': 'https://recipe1.ezmember.co.kr/cache/recipe/2019/04/30/88edd16df5c45b333428f8c76b1fe80d1.jpg'}, {'step_number': 5, 'description': '부추는 0.5cm 간격으로 썬다.', 'image_url': 'https://recipe1.ezmember.co.kr/cache/recipe/2019/04/30/3875b2714714ed90bd8ec4f68b8dfd721.jpg'}, {'step_number': 6, 'description': '양파, 당근, 청양고추는 굵게 다진다.', 'image_url': 'https://recipe1.ezmember.co.kr/cache/recipe/2019/04/30/f4146b05aa2ed97d15508cc944e59e7f1.jpg'}, {'step_number': 7, 'description': '볼에 다진 오징어, 당근, 양파, 청양고추와 부침가루 3T, 계란 1개, 물 5T, 소금 한 꼬집을 넣어 반죽을 만든다.', 'image_url': 'https://recipe1.ezmember.co.kr/cache/recipe/2019/04/30/e65b1970b1c525225b081c9556619e0c1.jpg'}, {'step_number': 8, 'description': '데친 오징어에 알맞은 양의 반죽을 넣는다.', 'image_url': 'https://recipe1.ezmember.co.kr/cache/recipe/2019/04/30/14b08550354fb5a23205226d63be8d911.jpg'}, {'step_number': 9, 'description': '팬에 기름을 두르고 반죽으로 속을 채운 오징어를 앞뒤 노릇노릇하게 익히면 오징어링전 완성.', 'image_url': 'https://recipe1.ezmember.co.kr/cache/recipe/2019/04/30/164abc3f71484064a7bb7faac98d0f101.jpg'}]"
39945,메인반찬,술안주,해물류,부침,♥[신혼밥상] 입 안 사르르 동태전,동태전,"2,258",20분 이내,초급,2인분,"[('손질 동태', '1팩'), ('달걀', '4개'), ('소금', '0.5스푼'), ('후춧가루', '적당히'), ('옥수수전분가루', '2컵'), ('고춧가루', '1/2스푼'), ('간장', '3큰술'), ('식초', '1큰술'), ('설탕', '1티스푼'), ('청양고추', '1개'), ('양파', '1/4개')]","고소한 냄새 홀릭!
손님초대+명절메뉴
막걸리를 부르는 맛~~
부드러운 동태 속살과 마법간장에 콕!
아이들&어른들 입 맛 모두 사로 잡았어요.","[{'step_number': 1, 'description': '얼린 동태는 녹여서 키친타올로 닦아 물기를 제거해주세요.', 'image_url': 'https://recipe1.ezmember.co.kr/cache/recipe/2020/01/26/8abdf2cd6f0f7c7289fb38be6ef298b01.jpg'}, {'step_number': 2, 'description': '소금 솔솔솔 후춧가루 툭툭툭 밑간을 해주세요.', 'image_url': 'https://recipe1.ezmember.co.kr/cache/recipe/2020/01/26/41f7bfb6a56b318e5710d7dd1d7cdb121.jpg'}, {'step_number': 3, 'description': '달걀 4개를 깨서 부드럽게 풀어주고 옥수수전분을 준비해주세요.밀가루, 부침가루 대체 가능!', 'image_url': 'https://recipe1.ezmember.co.kr/cache/recipe/2020/01/26/452b69a14f10574ad94462c96a01d5fe1.jpg'}, {'step_number': 4, 'description': '밑간한 동태를 전분가루에 앞뒤로 꾹꾹 눌러 옷을 입혀주세요.', 'image_url': 'https://recipe1.ezmember.co.kr/cache/recipe/2020/01/26/e1a2dfabf44e7f4cb1c79d4a457f0bc31.jpg'}, {'step_number': 5, 'description': '달걀물에 충분히 적셔주세요.', 'image_url': 'https://recipe1.ezmember.co.kr/cache/recipe/2020/01/26/5eaa3369d3789bf1566471ba6b09d9951.jpg'}, {'step_number': 6, 'description': '미리 예열된 팬에 약불에서 4번 5번 단계를 반복하며 바로 바로 올려 앞뒤로 노릇노릇', 'image_url': 'https://recipe1.ezmember.co.kr/cache/recipe/2020/01/26/b6dd69e013dfc72a0ec062ebe57026f81.jpg'}]"
39946,메인반찬,술안주,해물류,부침,속살이 부드러운 명태전 만들기,명태전,"6,973",30분 이내,중급,3인분,"[('명태', '1팩'), ('계란', '4개'), ('소금', '조금'), ('밀가루', '2큰술')]",속살이 부드러운 명태전은 아이들도 부담없이 먹을수있어 인기만점인데요 술안주로도 최고인 명태전요리 도전해보세요,"[{'step_number': 1, 'description': '명태포 한팩 자연해동해서 소금을 골고루 뿌려서 간이 베이도록해주세요', 'image_url': 'https://recipe1.ezmember.co.kr/cache/recipe/2019/02/07/c1cb0a7e6e6e0abfd7df543b22d12ecb1.jpg'}, {'step_number': 2, 'description': '명태포는 채에 받혀 물기를 빼주세요', 'image_url': 'https://recipe1.ezmember.co.kr/cache/recipe/2019/02/07/b13f7f65bb6cce37df43f615c749d2961.jpg'}, {'step_number': 3, 'description': '물기가 빠진 명태포는 치킨타올을 여러겹해서 명태포를 놓고 치킨타올로 살짝 눌러 한번더 물기를 제거 해주세요\n물기가 많으면 붙여 낼때 많이 튀어요', 'image_url': 'https://recipe1.ezmember.co.kr/cache/recipe/2019/02/07/0bc1fa14bf742dee324711f0d2e8f3781.jpg'}, {'step_number': 4, 'description': '명태포 물기를 제거할땐 치킨타올이 최고예요', 'image_url': 'https://recipe1.ezmember.co.kr/cache/recipe/2019/02/07/176829089e2b8827322b06a5c70abbe31.jpg'}, {'step_number': 5, 'description': '넓은 그릇에 밀가루를 붓고 명태포를 앞뒤로 밀가루를 묻혀 탈탈 털어서 다른 접시에 담아두세요 밀가루를많이 묻히면 명태포 맛이 사라져요 \n묻힌후 탈탈 털어주세요', 'image_url': 'https://recipe1.ezmember.co.kr/cache/recipe/2019/02/07/15a7c7a277eca13aa194c7ba949df5301.jpg'}, {'step_number': 6, 'description': '명태포에 밀가루를 묻히지 않으면 계란이 잘 안묻어서 옷이 잘안 입혀져요', 'image_url': 'https://recipe1.ezmember.co.kr/cache/recipe/2019/02/07/f07c2fe5c0d82cd8533e2153220b484e1.jpg'}, {'step_number': 7, 'description': '계란 노른자만 준비해서 명태포옷을 입혔어요 노른자로 부침하면 더 고소해요', 'image_url': 'https://recipe1.ezmember.co.kr/cache/recipe/2019/02/07/573f2cec2cfa72b8468515f404f08e771.jpg'}, {'step_number': 8, 'description': '한개씩 계란에 입혀 중불 약불로 붙혀 주세요', 'image_url': 'https://recipe1.ezmember.co.kr/cache/recipe/2019/02/07/d232bef87c82716e660bc4eeea5e11cd1.jpg'}, {'step_number': 9, 'description': '앞뒤로 노릇하게 붙혀주면 끝입니다', 'image_url': 'https://recipe1.ezmember.co.kr/cache/recipe/2019/02/07/c548a3888946567b4fd66372b64f3c541.jpg'}, {'step_number': 10, 'description': '속살이 부드러운 명태전은 술안주로 그만이죠', 'image_url': 'https://recipe1.ezmember.co.kr/cache/recipe/2019/02/07/5ac9f41b1b414e4ded6c677444dd89f81.jpg'}]"
39947,메인반찬,술안주,해물류,부침,"꼬막 부추전, 쫄깃한 꼬막 듬뿍 넣고 맛있는 꼬막 부추전 만들기",꼬막부추전,598,30분 이내,초급,3인분,"[('부추', '2줌'), ('자숙 꼬막살', '3봉'), ('양파', '1개'), ('호박', '1/3개'), ('빨강파프리카', '1/4개'), ('깻잎', '1묶음'), ('청양고추', '1개'), ('밀가루', '1.5컵'), ('부침가루', '0.5컵'), ('물', '1.5~2컵'), ('달걀', '1개'), ('소금', '조금')]","꼬막살 활용해서 고소한 꼬막주추전 만들어봤어요
고소하고 맛있는 부침개레시피","[{'step_number': 1, 'description': '밀가루와 부침가루 섞어서\n물 한컵에서 두컵사이를 넣고 잘 섞어주고\n반죽 농도는 물을 조금씩 추가하며 맞추세요\n달걀 1개 넣고 소금 조금넣어\n부침반죽 완성합니다', 'image_url': 'https://recipe1.ezmember.co.kr/cache/recipe/2023/01/17/0ac69ad6c8b4ef5aa61c0d208b5a11f91.jpg'}, {'step_number': 2, 'description': '부추는 씻어서 4cm정도로 듬성듬성 \n잘라 준비\n호박, 양파, 빨강파프리카, 청양고추\n깻잎은 씻어서 채 썰어 준비\n자숙꼬막 흐르는 물에 한번 헹구어 준비', 'image_url': 'https://recipe1.ezmember.co.kr/cache/recipe/2023/01/17/19d31e497123c659faca95440036ddb51.jpg'}, {'step_number': 3, 'description': '준비해둔 반죽에 재료들 넣어서\n잘 섞어줍니다', 'image_url': 'https://recipe1.ezmember.co.kr/cache/recipe/2023/01/17/c63a755a588c96157ff415435a2bb83b1.jpg'}, {'step_number': 4, 'description': '기름두른 팬에 한국자씩 떠서\n올린 후 잘 펴서 부쳐줍니다', 'image_url': 'https://recipe1.ezmember.co.kr/cache/recipe/2023/01/17/9bfc96788f0b5176334f5beac1d29e0e1.jpg'}, {'step_number': 5, 'description': '중불과 약불로 불 조절하면서\n노릇하게 부쳐주면 꼬막 부추전\n맛있게 부칠수 있어요', 'image_url': 'https://recipe1.ezmember.co.kr/cache/recipe/2023/01/17/b61787043d7417fb773f0506bfed04211.jpg'}, {'step_number': 6, 'description': '바삭하고 꼬숩게 부쳐진\n꼬막 부추전 접시에 담아\n간장과 곁들여 줍니다\n쫄깃한 꼬막살이 듬뿍\n고소한 부추전과 환상의 조합이에요', 'image_url': 'https://recipe1.ezmember.co.kr/cache/recipe/2023/01/17/09058d7b1d6213b0ab4bafd5393075411.jpg'}]"
39948,메인반찬,술안주,해물류,부침,편스토랑 류수영 한판굴전 굴부침개 굴전 겨울 제철요리 겨울철식재료 굴요리 청양고추 듬뿍 밥반찬 술안주 막걸리안주,굴전,"2,074",15분 이내,아무나,4인분,"[('굴', '1봉지'), ('달걀', '4개'), ('대파', '1대'), ('청양고추', '2~3개'), ('참기름', '1T'), ('부침가루', '1T'), ('가는 소금', '2꼬집'), ('식용유', '적당량')]",굴전 이제는 한 판으로 부쳐 보세요!!,"[{'step_number': 1, 'description': '물에 굵은소금 한주먹을 넣고 살짝 녹인 뒤 굴을 넣고 살살 저어가며 씻어준 뒤 마지막에 맹물로 헹군 뒤 체에 밭쳐 물기를 제거한다.\n* 굴 200g 기준 2번 정도 세척', 'image_url': 'https://recipe1.ezmember.co.kr/cache/recipe/2023/02/19/fdb69fb01f96bfb642106200d9c02c0e1.jpg'}, {'step_number': 2, 'description': '대파는 송송 썬다.', 'image_url': 'https://recipe1.ezmember.co.kr/cache/recipe/2023/02/19/4481c26a08e13b9825ded8415637dbf71.jpg'}, {'step_number': 3, 'description': '청양고추는 송송 썬다.', 'image_url': 'https://recipe1.ezmember.co.kr/cache/recipe/2023/02/19/040fe09bb3aaa8dffbec49f89baff8731.jpg'}, {'step_number': 4, 'description': '다른 볼에는 씻은 굴 200g에 부침가루 듬뿍 1T를 넣고 굴이 터지지 않게 얼기설기 살살 섞어준다.', 'image_url': 'https://recipe1.ezmember.co.kr/cache/recipe/2023/02/19/e50b805d64b4408e1a845d4476360d7f1.jpg'}, {'step_number': 5, 'description': '볼 하나에 달걀 4개를 깬 뒤 참기름 1T, 가는 소금 2 꼬집을 넣는다.', 'image_url': 'https://recipe1.ezmember.co.kr/cache/recipe/2023/02/19/b0c3777662f94f4a2c032cee244352731.jpg'}, {'step_number': 6, 'description': '달걀 넣은 볼에 썰어 둔 대파를 섞는다.', 'image_url': 'https://recipe1.ezmember.co.kr/cache/recipe/2023/02/19/bd1f596df16f8329b4dee0a23536b2651.jpg'}, {'step_number': 7, 'description': '4의 굴을 6의 달걀물에 넣고 뭉치지 않을 정도로만 풀어준다.', 'image_url': 'https://recipe1.ezmember.co.kr/cache/recipe/2023/02/19/f0d8d3760cd515c539a7e31ac522b6621.jpg'}, {'step_number': 8, 'description': '7에 썰어둔 청양 고추를 넣은 뒤섞지 않고 피자 토핑처럼 올려준다.', 'image_url': 'https://recipe1.ezmember.co.kr/cache/recipe/2023/02/19/d2f5f0213f809eb49770614e93e6dc8d1.jpg'}, {'step_number': 9, 'description': '예열한 팬에 식용유를 3바퀴 두르고 강불에서 예열한 뒤 팬이 달아오르면 중불로 줄이고 굴전 반죽을 그대로 붓고 뚜껑을 덮어 중약불에서 3~4분간 익힌다.', 'image_url': 'https://recipe1.ezmember.co.kr/cache/recipe/2023/02/19/cd387696ced53f713adb698ea84a5dd51.jpg'}, {'step_number': 10, 'description': '뚜껑을 열고 토치로 굴전의 윗면을 익혀 불 맛을 내주면 완성된다.\n* 기호에 따라 초장에 찍어 먹어도 맛있답니다.', 'image_url': 'https://recipe1.ezmember.co.kr/cache/recipe/2023/02/19/6c7a153fa50e1798809d8387926191651.jpg'}]"
39949,메인반찬,술안주,해물류,부침,김치 오징어전 만드는 법 파전 만들기,김치오징어전,597,30분 이내,초급,3인분,"[('김치', '1/4포기'), ('오징어', '1마리'), ('쪽파', '4뿌리'), ('부침가루', '4국자'), ('물(얼음물)', '3컵'), ('식용유', '충분히')]",비 오는 날 막걸이 안주로 좋은 김치 오징어전,"[{'step_number': 1, 'description': '볼에 다진 김치와 껍질을 벗긴 후 먹기 좋게 썬 오징어를 넣어줍니다.김치 1/4포기, 오징어 1마리', 'image_url': 'https://recipe1.ezmember.co.kr/cache/recipe/2023/08/26/c7ddfa471a77884772a9977ff476d17f1.jpg'}, {'step_number': 2, 'description': '먹기 좋게 썰은 쪽파와 부침가루, 얼음물 3컵을 넣어 잘 섞어줍니다.쪽파 4뿌리, 부침가루 4국자, 얼음물 3컵 얼음물을 넣어주면 김치전이 바삭하게 구워져요', 'image_url': 'https://recipe1.ezmember.co.kr/cache/recipe/2023/08/26/fef05ed620dd37a4c3fb34643943a6631.jpg'}, {'step_number': 3, 'description': '달군 팬에 기름을 두르고 김치전 반죽을 넣어 앞뒤로 노릇노릇 익혀줍니다.식용유 1큰술', 'image_url': 'https://recipe1.ezmember.co.kr/cache/recipe/2023/08/26/1c09831c9600adc0d80945daf3bc9bf31.jpg'}]"
39950,메인반찬,술안주,해물류,부침,김치전 만드는법 바삭하게 김치전 레시피 오징어김치전 김치요리,김치전,"1,127",30분 이내,초급,4인분,"[('김치', '1/4쪽'), ('오징어', '1개'), ('새우', '4~5개'), ('밀가루', '2컵'), ('튀김가루', '1컵'), ('참치액', '0.5스푼'), ('식용유', '0.5컵')]",안녕하세요. 오늘은 바삭바삭한 김치전을 만드는 법에 대해 알려드릴려고 해요.,"[{'step_number': 1, 'description': '재료를 손질해볼게요. 잘익은 김치 1/4쪽을 준비해주세요.해물은 집에 있는 것으로 준비 하는데 오징어랑 새우를 준비 하였어요.', 'image_url': 'https://recipe1.ezmember.co.kr/cache/recipe/2024/01/18/3b483c232fd10cb2baa6a27d3c59040f1.jpg'}, {'step_number': 2, 'description': '김치와 해물들을 작게 다져주세요. 재료가 크면 뒤집을때 자꾸 망가지더라고요. 그래서 저는 재료를 작게 썰어서 뒤집을때 마음 편하게 뒤집는답니다.도마 , 조리용나이프 , 접시', 'image_url': 'https://recipe1.ezmember.co.kr/cache/recipe/2024/01/18/aebc48c822b836d2c314eaa4bb7b6e7d1.jpg'}, {'step_number': 3, 'description': '다 썰어 놓은 김치전 속을 볼에다가 옮겨 놓았어요.저는 튀김가루 한컵, 밀가루 두컵을 넣어주었어요.믹싱볼 , 조리용스푼', 'image_url': 'https://recipe1.ezmember.co.kr/cache/recipe/2024/01/18/e29b459e746f565d88cd6bc708a0bacd1.jpg'}, {'step_number': 4, 'description': '거기에 물 한컵을 넣어주었어요. 차가운물로 넣어주세요. 차가운물일수록 탄산수이면 더욱더 바삭한다고 해요. 하지만 저는 차가운물만 넣어도 바삭하게 잘 되어서 차가운 물만 넣어준답니다.계량컵', 'image_url': 'https://recipe1.ezmember.co.kr/cache/recipe/2024/01/18/69803fcb9c0fc4329b4ff422424da8031.jpg'}, {'step_number': 5, 'description': '재료를 섞어 줄게요. 이미 김치를 넣었기 때문에 고춧가루나 김치국물은 안넣어줬어요. 하지만 조금더 빨간색을 내고 싶으신 분들은 고춧가루를 조금 넣어주셔도 좋아요.여기에 조금 더 욕심을 내서 전에 깊은맛을 추가하고 싶어서 참치액을 한 티스푼 넣어주었어요.', 'image_url': 'https://recipe1.ezmember.co.kr/cache/recipe/2024/01/18/2af0c01476368ee629e76549d000d4f91.jpg'}, {'step_number': 6, 'description': '름을 넉넉하게 넣어준 팬에 반죽을 부쳐봤어요. 여기서 중요한것은 기름을 넉넉하게 넣어줘야 한다는거에요. 튀기듯이 익혀줘야 바삭해지거든요. ^^ 타는지 잘 보시면서 앞뒤로 뒤집어 주면서 익혀주세요. 바삭바삭한 김치전이 완성되었습니다. 김치전 만드는법이 그리 어렵지는 않아요.프라이팬 , 뒤집개 , 플레이팅접시', 'image_url': 'https://recipe1.ezmember.co.kr/cache/recipe/2024/01/18/275d994fa26321079e5a2288977d9cf81.jpg'}]"
39951,메인반찬,술안주,해물류,부침,굴전에 0000을 꼭 넣어 부쳐보세요 식감이 더해져서 정말 맛있습니다.,굴전,477,10분 이내,아무나,2인분,"[('굴', '200g'), ('팽이버섯', '1/2개'), ('부침가루', '4스푼'), ('계란', '2개'), ('청양고추', '1개'), ('홍고추', '1개'), ('대파', '1/2개')]","제철 해산물 생굴 못 드시는 분들도 맛있게 먹을 수 있는 초간단 레시피
고소함 속에 팽이버섯에 식감까지 더해져서 정말 맛있습니다.","[{'step_number': 1, 'description': '1. 팽이버섯, 청양고추, 홍고추, 대파를 썰어서 계란에 넣고 잘 섞어주세요.도마 , 조리용나이프 , 믹싱볼 , 요리스푼', 'image_url': None}, {'step_number': 2, 'description': '2. 소금물에 세척한 굴에 부침가루 부어주고 생굴이 부침가루 잘 입혀지도록 섞어주세요.믹싱볼 , 채반', 'image_url': None}, {'step_number': 3, 'description': '3. 중불에 팬을 달궈주고 기름 두르고 반죽 옷을 입은 생굴을 계란 물에 넣고 한 수저식 떠서 팬 위에 올려 앞뒤 노릇하게 익혀주세요.프라이팬 , 뒤집개', 'image_url': None}, {'step_number': 4, 'description': '4. 따로 간을 안 해도 맛있고 간장 양념장을 찍어드셔서 맛있습니다.', 'image_url': None}]"
39952,메인반찬,술안주,해물류,부침,홍합전 만들기,홍합전,291,30분 이내,초급,4인분,"[('홍합살', '100g'), ('양파', '1/4개'), ('당근', '1/4개'), ('청양고추', '2개'), ('대파 채', '1줌'), ('팽이버섯', '1개'), ('계란', '4개'), ('간장', '1T'), ('식초', '1T'), ('깨', '약간'), ('식용류', '약간'), ('맛소금', '약간')]",홍합탕 끓인후 홍합살 손질해둔게 냉장고에 있어서 만들어봤어요~ 남편 주말점심으로 딱 좋아요!,"[{'step_number': 1, 'description': '데쳐낸 홍합에서 홍합살을 분리해주세요~냄비 , 볼', 'image_url': 'https://recipe1.ezmember.co.kr/cache/recipe/2023/12/16/e7f3d154ff9bc086602d7303f843331a1.jpg'}, {'step_number': 2, 'description': '집에 있는 야채들을 조금씩 다져주세요 저는 정육점에서 무료로 나눠준 파채를 이용했습니다.도마 , 조리용나이프', 'image_url': 'https://recipe1.ezmember.co.kr/cache/recipe/2023/12/16/86b04acacd358f5a2a781f8edd6cfd811.jpg'}, {'step_number': 3, 'description': '홍합살에 부침가루를 살포시 입혀줍니다.', 'image_url': 'https://recipe1.ezmember.co.kr/cache/recipe/2023/12/16/229ac5805c617f20238ea37c3a28cd691.jpg'}, {'step_number': 4, 'description': '야채에 맛소금을 살짝 넣고, 계란을 풀어줍니다.요리스푼', 'image_url': 'https://recipe1.ezmember.co.kr/cache/recipe/2023/12/16/4b91599ea27415333ba323c66746e4a11.jpg'}, {'step_number': 5, 'description': '중불에 한숟가락씩 떠서 부쳐냅니다.프라이팬 , 뒤집개', 'image_url': 'https://recipe1.ezmember.co.kr/cache/recipe/2023/12/16/f0ec525273d3141fdc009e8e84ddd97b1.jpg'}, {'step_number': 6, 'description': '간장, 식초 같은비율로 혼합하고 깨를 뿌려 찍어먹는 소스를 만듭니다. 그릇에 셋팅하여 냅니다.완성접시 , 소스볼', 'image_url': 'https://recipe1.ezmember.co.kr/cache/recipe/2023/12/16/8f0fc6f387ba05a1818cb3037e5619081.jpg'}]"
