index,종류별,상황별,재료별,방법별,글 제목,레시피이름,조회수,조리시간,난이도,인분,재료,소개글,조리순서
10905,밑반찬,일상,버섯류,볶음,참타리버섯요리 들깨가루 느타리버섯볶음 만드는 법,느타리버섯볶음,"1,396",10분 이내,아무나,4인분,"[('참타리버섯', '350g'), ('양파', '1/4개'), ('당근', '24g'), ('대파', '조금'), ('다진마늘', '1큰술'), ('간장', '1큰술'), ('들깨가루', '2큰술'), ('소금', '1작은술')]","들깨가루 넣은 느타리버섯들깨볶음으로 만들었습니다.
너무 고소하고 쫄깃한 식감이 아주 일품입니다.
계속 손이 가는 반찬입니다.
간단한 건강한 반찬 느타리버섯들깨볶음 레시피 알려드립니다.","[{'step_number': 1, 'description': '버섯은 밑동을 잘라먹기 좋게 나눠줍니다.', 'image_url': 'https://recipe1.ezmember.co.kr/cache/recipe/2022/09/27/8f1545de22ed6df3b8cfd0a5b99395771.jpg'}, {'step_number': 2, 'description': '양파랑 당근은 채 썰어 준비합니다.', 'image_url': 'https://recipe1.ezmember.co.kr/cache/recipe/2022/09/27/70e8a33c6b5e8f8218c12752e2d676331.jpg'}, {'step_number': 3, 'description': '예열된 프라이팬에 기름을 살짝 두르고 양파를 먼저 볶아줍니다.\n양파가 투명해지면 당근과 다진마늘을 넣어서 볶습니다.중불', 'image_url': 'https://recipe1.ezmember.co.kr/cache/recipe/2022/09/27/7f16fb9c4cfdcaaae9b509dbdb62928e1.jpg'}, {'step_number': 4, 'description': '이제 버섯을 넣고 볶아주세요.\n살짝 숨이 죽으면 간장을 1큰술과 소금 1작은술을 넣어서 전체적으로 섞어주면서 볶습니다.\n중불', 'image_url': 'https://recipe1.ezmember.co.kr/cache/recipe/2022/09/27/20bb219d3dc61717a0674d06dbc35e681.jpg'}, {'step_number': 5, 'description': '간장이 잘 섞어졌으면 바로 들깨가루 2큰술을 넣어 빠르게 볶습니다.중불', 'image_url': 'https://recipe1.ezmember.co.kr/cache/recipe/2022/09/27/5cc0cdcabb99d120e0547fc900b514281.jpg'}, {'step_number': 6, 'description': '전체적으로 잘 볶아졌으면 대파를 넣어서 한번 섞어주세요.중불', 'image_url': 'https://recipe1.ezmember.co.kr/cache/recipe/2022/09/27/b9e2ce7b082e3baa42e1786edeaa8c5a1.jpg'}, {'step_number': 7, 'description': '물 안 생기고 전체적으로 잘 볶아졌습니다.\n버섯은 오래 볶으면 볶을수록 물이 나오니깐 빠르게 볶는 게 중요합니다.\n\n\u200b', 'image_url': 'https://recipe1.ezmember.co.kr/cache/recipe/2022/09/27/b1bfa3762a6b28e14d9db779514763901.jpg'}]"
10906,밑반찬,일상,버섯류,볶음,새송이버섯볶음 만드는법 굴소스 버섯볶음,새송이버섯볶음,"1,877",10분 이내,아무나,2인분,"[('새송이버섯', '2개'), ('부추', '25g'), ('대파', '15g'), ('참기름', '0.2~0.3큰술'), ('포도씨유', '3큰술'), ('후추', '살짝'), ('통깨', '솔솔'), ('굴소스', '0.8큰술'), ('소금', '적당량')]","버섯 1~2개와 굴소스, 소금만 있으면 빠르게 요리할 수 있는 밑반찬 중 하나에요. 버섯의 쫄깃한 식감이 맛있으니 밑반찬으로 한 번쯤 요리해서 드셔보세요.(평소 싱겁게 요리를 하기 때문에 중간에 맛을 보시고 부족한 간은 추가로 넣어주세요.)","[{'step_number': 1, 'description': '▶새송이버섯은 흐르는 물에 가볍게 헹군은 물기를 닦은 뒤,\n약 4~5mm 정도의 두께로 길게 채를 썰어서 준비합니다.(밑동 손질 후 200g이 나왔어요)새송이버섯 200g버섯 손질법 레시피', 'image_url': 'https://recipe1.ezmember.co.kr/cache/recipe/2023/02/06/8c13cfc3904d58eed038dc6858f2fc3c1.jpg'}, {'step_number': 2, 'description': '▶부추 25g은 새송이버섯 길이와 비슷하게 자르고, 대파 15g은 쫑쫑쫑 썰어서 준비합니다.부추 25g, 대파 15g', 'image_url': 'https://recipe1.ezmember.co.kr/cache/recipe/2023/02/06/aef3d9c974b0a4965298c967273db3cd1.jpg'}, {'step_number': 3, 'description': '▶팬에 포도씨유 3큰술과 쫑쫑쫑 썬 대파를 넣고 중약불에서 파 향이 올때까지 파기름을 만들어줍니다.포도씨유 3큰술, 쫑쫑쫑 썬 대파 15g', 'image_url': 'https://recipe1.ezmember.co.kr/cache/recipe/2023/02/06/b8aae062773360e448ed3c0e7f0ad7d81.jpg'}, {'step_number': 4, 'description': '▶파 향이 올라오면 새송이버섯 200g을 넣고 버섯이 족족하면서 부드럽게 익을 때 까지 중간불에서 3~4분 정도 뒤적이면서 볶아줍니다.(버섯에서 수분이 나오기 때문에 아무것도 넣지 않아도 되세요)새송이버섯 200g', 'image_url': 'https://recipe1.ezmember.co.kr/cache/recipe/2023/02/06/388b10fc102e524f956159fabbde39941.jpg'}, {'step_number': 5, 'description': '▶촉촉하면서 부드럽게 새송이버섯이 볶아졌으면 굴소스 0.8큰술을 넣고 뒤적여줍니다.\n▶맛을 보고 싱겁다고 느껴지면 입맛에 맞게 소금을 추가하여 간을 맞춰줍니다.굴소스 0.8큰술', 'image_url': 'https://recipe1.ezmember.co.kr/cache/recipe/2023/02/06/b31192c71c7619f2d367518826ab212b1.jpg'}, {'step_number': 6, 'description': '▶약불에서 부추 25g을 넣고 부추의 숨이 죽지 않을 정도로 볶아주다가 가스불을 꺼 줍니다.부추 25g', 'image_url': 'https://recipe1.ezmember.co.kr/cache/recipe/2023/02/06/72bffcfab5fcdfb25c16328efc6f7d441.jpg'}, {'step_number': 7, 'description': '▶참기름 0.3큰술, 후추 톡톡톡, 통깨를 솔솔솔 뿌린 후 뒤적여주면 굴소스 새송이버섯볶음 만드는법 완성입니다.^^\n▶후추는 입맛에 맞게 넣어도 되고 넣지 않아도 됩니다.참기름 0.3큰술, 후추, 통깨', 'image_url': 'https://recipe1.ezmember.co.kr/cache/recipe/2023/02/06/35c1075142f75277cd5826a0053ee5021.jpg'}]"
10907,밑반찬,일상,버섯류,볶음,맛있는 버섯 요리! 만가닥버섯볶음 만들기,만가닥버섯볶음,"2,444",20분 이내,초급,2인분,"[('만가닥버섯', '2봉지'), ('대파', '2~3조각'), ('식용유', '2T'), ('다진마늘', '0.5T'), ('양조간장', '2T'), ('굴소스', '1T'), ('깨소금', '0.5T'), ('설탕', '2꼬집'), ('후춧가루', '조금')]",요즘 버섯에 빠져서 버섯요리를 자주 만들어 먹고 있어요. 오늘은 요즘 마트에서 자주 눈에 띄는 만가닥버섯 요리로 만가닥버섯볶음을 만들어 봤어요.,"[{'step_number': 1, 'description': '만가닥버섯 손질은 뒤쪽의 더러운 부분을 칼로 잘라낸 후에 흐르는 물에 살짝 헹궈주세요. 그리고 뭉쳐있는 부분은 손으로 찢어주면 됩니다.버섯 손질법 레시피', 'image_url': 'https://recipe1.ezmember.co.kr/cache/recipe/2022/11/06/f96503c6a2c44da146e596be026a82451.jpg'}, {'step_number': 2, 'description': '만가닥버섯 손질은 뒤쪽의 더러운 부분을 칼로 잘라낸 후에 흐르는 물에 살짝 헹궈주면 되요. 그리고 뭉쳐있는 부분은 손으로 찢어주면 됩니다.', 'image_url': 'https://recipe1.ezmember.co.kr/cache/recipe/2022/11/06/1a2c7b4d9dbb200ea095884d14d485e21.jpg'}, {'step_number': 3, 'description': '여기에 다진마늘 0.5T를 넣은 후 센불에 약 1분 정도 파기름을 내어주세요.', 'image_url': 'https://recipe1.ezmember.co.kr/cache/recipe/2022/11/06/9370fd15e4472345e53900a7465299fd1.jpg'}, {'step_number': 4, 'description': '팬에 씻어 놓은 만가닥버섯을 넣고 양조간장 2T, 굴소스 1T를 넣은 후 센불로 계속 볶아주세요.', 'image_url': 'https://recipe1.ezmember.co.kr/cache/recipe/2022/11/06/006aea3fc093a3e98db5eacffe05e2f81.jpg'}, {'step_number': 5, 'description': '만가닥버섯볶음을 계속 볶다보면 버섯에서 물이 나오는데요, 이 물이 완전히 졸아들때까지 센불로 계속 볶아주세요.', 'image_url': 'https://recipe1.ezmember.co.kr/cache/recipe/2022/11/06/b845aaa940fa1836fa847459b2b3cbc61.jpg'}, {'step_number': 6, 'description': '다 볶아지면 불을 끄고 설탕 두꼬집, 깨소금 0.5T, 후춧가루를 조금 넣고 잘 섞어주세요.', 'image_url': 'https://recipe1.ezmember.co.kr/cache/recipe/2022/11/06/07e423dd980b9c748b7da84e7f11f38f1.jpg'}, {'step_number': 7, 'description': '쫄깃쫄깃 맛있는 만가닥버섯볶음 완성이에요.', 'image_url': 'https://recipe1.ezmember.co.kr/cache/recipe/2022/11/06/292350dfe3f3e65e66e17339717397cf1.jpg'}]"
10908,밑반찬,일상,버섯류,볶음,새송이버섯버터마늘볶음 레시피,새송이버섯버터마늘볶음,541,20분 이내,아무나,2인분,"[('새송이버섯', '300g'), ('버터', '1T'), ('다진마늘', '2T'), ('청양고추', '1T'), ('굴소스', '0.5T'), ('진간장', '0.5T'), ('통깨', '1T'), ('후추', '0.3T')]",새송이버섯버터마늘볶음 레시피 입니다.,"[{'step_number': 1, 'description': '-새송이버섯은 한입 크기로 자르고, 청양고추는 쫑쫑 썰어주세요.', 'image_url': 'https://recipe1.ezmember.co.kr/cache/recipe/2022/11/17/aad28822e775d4bb95153860838831ae1.jpg'}, {'step_number': 2, 'description': '-달군 프라이팬에 버터 넣고, 다진마늘 볶아주세요.', 'image_url': 'https://recipe1.ezmember.co.kr/cache/recipe/2022/11/17/d42a2a6b4e26366da9586f31c63a938b1.jpg'}, {'step_number': 3, 'description': '손질한 새송이버섯과 청양고추 모두 넣어 약 30초 정도 가스레인지 중불에서 볶아주세요.', 'image_url': 'https://recipe1.ezmember.co.kr/cache/recipe/2022/11/17/d252007aa993e6f506d16ded06c5fcf91.jpg'}, {'step_number': 4, 'description': '골소스 0.5T 가량 넣어준다음 한번 뒤적뒤적 해주세요.', 'image_url': 'https://recipe1.ezmember.co.kr/cache/recipe/2022/11/17/9bdbf7370a28910badb4866b3782ee991.jpg'}, {'step_number': 5, 'description': '프라이팬 한쪽으로 버섯을 두고, 나머지 빈 쪽에 진간장 0.5T 가량 넣어주세요. 진간장이 옆 사진처럼 보글보글~하면 함께 버무려 주세요.', 'image_url': 'https://recipe1.ezmember.co.kr/cache/recipe/2022/11/17/25abe7622daa2b6c8408fd7e2a696ab51.jpg'}, {'step_number': 6, 'description': '후추 0.3T 들어갑니다.', 'image_url': 'https://recipe1.ezmember.co.kr/cache/recipe/2022/11/17/424ede8989c373c6596ddeb2bfd2cac71.jpg'}, {'step_number': 7, 'description': '통깨 1T 뿌려 주시면 됩니다.', 'image_url': 'https://recipe1.ezmember.co.kr/cache/recipe/2022/11/17/01b2750a9c129c39dfbb5d02d180c1e21.jpg'}, {'step_number': 8, 'description': '그러면 완성!', 'image_url': 'https://recipe1.ezmember.co.kr/cache/recipe/2022/11/17/f235b50f8b494ba4124a4783387adc891.jpg'}]"
10909,밑반찬,일상,버섯류,볶음,마늘종 느타리버섯 볶음,느타리버섯볶음,"4,113",15분 이내,초급,2인분,"[('느타리버섯', '1팩'), ('당근', '1/3개'), ('마늘쫑', '10줄기'), ('마늘다진것', '1T'), ('참치액', '1T'), ('들기름', '1T')]",3월~5월 제철식재료인 마늘종(신선하고 아삭아삭한 맛을 즐기려면 6월 나온것도 굿~! 누런 빛을 띠고 억센 것은 오래된 것)을 이용해 느타리버섯을 볶아봤어요. 반찬 쉽게 만드는 소스도 하나 소개~,"[{'step_number': 1, 'description': '재료 준비 해주세요.\n양파, 피망도 있으면 넣어주셔도 좋아요.', 'image_url': 'https://recipe1.ezmember.co.kr/cache/recipe/2018/06/18/13aeba041d17e830a826f34145eb98ea1.jpg'}, {'step_number': 2, 'description': '열올린 팬에 들기름 두르고, 마늘다진것 볶다가, 버섯넣고', 'image_url': 'https://recipe1.ezmember.co.kr/cache/recipe/2018/06/18/16cddeade9a1bc1c7ef9f258439c36aa1.jpg'}, {'step_number': 3, 'description': '진참치액 1T만으로 맛내기 끝!', 'image_url': 'https://recipe1.ezmember.co.kr/cache/recipe/2018/06/18/589f332ecdb6fe7d4d1f019538ff5c511.jpg'}, {'step_number': 4, 'description': '잘 섞어주며 중불로 볶아요.', 'image_url': 'https://recipe1.ezmember.co.kr/cache/recipe/2018/06/18/e9dea8dfae60a8f821a7381d7805e1b91.jpg'}, {'step_number': 5, 'description': '국물 자작해지면, 깨소금 뿌리고 끝-', 'image_url': 'https://recipe1.ezmember.co.kr/cache/recipe/2018/06/18/b7d6ce4d67ad5fea4d26d02c269660951.jpg'}]"
10910,밑반찬,일상,버섯류,볶음,송와버섯볶음,송와버섯볶음,986,10분 이내,아무나,4인분,"[('송와버섯', '10개'), ('양파', '1/4개'), ('다진파', '1큰술'), ('다진마늘', '2/3큰술'), ('참기름', '1/2큰술'), ('통깨', '1큰술'), ('식용유', '약간'), ('후춧가루', '약간'), ('굴소스', '1/2큰술')]",표고버섯볶음처럼 송와버섯을 이용해서 만들어봤어요.,"[{'step_number': 1, 'description': '송와버섯은 밑동을 자르고 흐르는 물에 살짝 씻은 뒤 물기를 빼서 채썰어주세요. 양파도 채썰어주세요.홍고추도 채썰어 넣어주면 색감이 예뻐요~', 'image_url': 'https://recipe1.ezmember.co.kr/cache/recipe/2019/04/06/feb887d0a58bc05e767c21cec39cae1d1.jpg'}, {'step_number': 2, 'description': '파는 다져서 준비해주세요.', 'image_url': 'https://recipe1.ezmember.co.kr/cache/recipe/2019/04/06/12f651973b6fdddce843974e3d6ff8301.jpg'}, {'step_number': 3, 'description': '식용유를 두른 팬에 다진마늘을 넣고 볶아 향을 내주세요', 'image_url': 'https://recipe1.ezmember.co.kr/cache/recipe/2019/04/06/643a8c8076be868bfa02f12181af26c61.jpg'}, {'step_number': 4, 'description': '송와버섯을 넣어 노릇하게 볶아주세요.', 'image_url': 'https://recipe1.ezmember.co.kr/cache/recipe/2019/04/06/ae15fe1ef701e2e82a0ddffa0d714df71.jpg'}, {'step_number': 5, 'description': '양파,굴소스를 넣고 재빨리 볶아주세요홍고추를 준비하신분은 이때 같이 볶아주시면되요', 'image_url': 'https://recipe1.ezmember.co.kr/cache/recipe/2019/04/06/a74c41a0cba2e8b5f35277b509e3089c1.jpg'}, {'step_number': 6, 'description': '다진파, 참기름, 후춧가루를 넣고 볶아주세요', 'image_url': 'https://recipe1.ezmember.co.kr/cache/recipe/2019/04/06/ae0b8a898339558fd0d02b786a4323e71.jpg'}, {'step_number': 7, 'description': '마무리로 통깨를 뿌려주면 완성!', 'image_url': 'https://recipe1.ezmember.co.kr/cache/recipe/2019/04/06/8ff81f088295f8c26a9aec68e3dea8fd1.jpg'}]"
10911,밑반찬,일상,버섯류,볶음,보는것만으로도 건강해질것 같은 느타리버섯머위대들깨볶음,느타리버섯머위대들깨볶음,"6,804",30분 이내,아무나,6인분 이상,"[('머위대', '1봉'), ('느타리버섯', '1줌'), ('들기름', '2T'), ('물', '10T'), ('소금                                                                                기호에 맞게 가감', '1T'), ('들깨가루                                                                                기호에 맞게 가감', '6T'), ('조미료                                                                                취향껏', '1/3t'), ('파', '약간')]","몇년만에 재래시장이 아닌 동네 야채가게에서
머위대를 보네요
머위순은 해마다 일시적으로 파는데
머위대는 파는건 못봤었죠
해마다 재래시장은 한무더기로 팔아
양이 너무 많아 안사먹게 되더라고요

머위대를 들깨가루를 넣고 볶으면 
그맛이 얼마나 맛있는지
전 상상만으로도 느낌이 좋은 나물이죠

소분해서 파는 머위대를 보니 손은 자동ㅋㅋ
머위대를 볶을려고 꺼내는데 옆에 같이
사온 느타리버섯이 보이네요
들깨넣고 볶는데 다 어울리는 재료라
같이 넣고 볶아봤어요

맛은 더 업그레이드 되고 
볶으면서 건강해지는 
이느낌은 뭘까요 ㅋㅋ
요즘은 일부러 건강찾아 해먹는 반찬은
아닌데 몸이 말해주듯 건강재료를 
사오는것 같아요

향이 살아있어 더 맛있는 머위대~
좋아하시는분들은 지금만 잠시
맛볼수 있는 시기라는거 기억하세요^^

오늘도 해피한 하루되세요~♡","[{'step_number': 1, 'description': '머위대를 손질해서 씻어놓습니다', 'image_url': None}, {'step_number': 2, 'description': '끓는물에 굵은소금 넣고 머위대를 데집니다', 'image_url': None}, {'step_number': 3, 'description': '머위대 껍질을 벗깁니다', 'image_url': None}, {'step_number': 4, 'description': '느타리버섯을 손질합니다버섯 손질법 레시피', 'image_url': None}, {'step_number': 5, 'description': '웍에 머위대 들기름을 넣고 볶습니다', 'image_url': None}, {'step_number': 6, 'description': '순서에 따라 양념을 합니다', 'image_url': None}]"
10912,밑반찬,일상,버섯류,볶음,꼬마 새송이버섯 볶음. 미니 새송이버섯 밑반찬 만들기.,미니새송이버섯볶음,"36,083",15분 이내,아무나,6인분 이상,"[('꼬마새송이버섯', '2대접'), ('빨간 파프리카', '1/2개'), ('노랑 파프리카', '1/2개'), ('아삭이 고추', '2개'), ('아삭이 고추                                                                                없으면 피망 사용', '1/2개'), ('다진마늘', '1T'), ('올리고당', '1T'), ('물', '1/3종이컵'), ('후춧가루', '약간'), ('깨', '약간')]",귀엽게 한입에 쏙~ 버섯향에 파프리카향까지 더해 더 맛있는 꼬마 새송이버섯 볶음,"[{'step_number': 1, 'description': '마트에서 꼬마 새송이버섯을 사왔어요. 어마어마 하죠. 하나씩 떼어내 손질해주니 큰 볼로 한가득이네요.버섯 손질법 레시피', 'image_url': 'https://recipe1.ezmember.co.kr/cache/recipe/2018/05/25/34b5e9910eb52a2e3b7f19bc0d57e2c41.jpg'}, {'step_number': 2, 'description': '꼬마새송이버섯은 흐르는 물에 헹궈내 주세요. 그리고 큰 꼬마새송이버섯과 작은 새송이 버섯으로 구별해 줍니다. 한입에 먹을 수 있는 새송이와 한입에 먹을 수 없는 새송이로요. 큰것은 잘라서 다른요리에 사용하구요. 오늘 볶음은 한입에 먹을 수 있는 것만 사용해요.', 'image_url': 'https://recipe1.ezmember.co.kr/cache/recipe/2018/05/25/f2065888c694d6095ac50b33b46fe70a1.jpg'}, {'step_number': 3, 'description': '작은 꼬마 새송이 버섯과 파프리카. 파프리카는 2센치 크기정도로 잘라주세요.\n피망이 있다면 피망을 아니면 아삭이 고추를 두개정도 썰어 넣어주구요. 저는 청양고추도 한개 썰어 넣어 주었습니다. 살짝 매콤한 맛이 더 입맛을 돋워 주거든요.', 'image_url': 'https://recipe1.ezmember.co.kr/cache/recipe/2018/05/25/0103e23f21ea5eca4c87975c2692f3ab1.jpg'}, {'step_number': 4, 'description': '재료 준비는 완료!', 'image_url': 'https://recipe1.ezmember.co.kr/cache/recipe/2018/05/25/fc19761a66a52f43817eeffd0a576f2b1.jpg'}, {'step_number': 5, 'description': '프라이팬에 식용유를 살짝 두르고 꼬마새송이 버섯을 넣고 한번 볶아줍니다.\n여기에 다진마늘을 1T 넣어주고 다시한번 볶아주세요.', 'image_url': 'https://recipe1.ezmember.co.kr/cache/recipe/2018/05/25/b852ec113c5de6545e5693f08907ed831.jpg'}, {'step_number': 6, 'description': '여기에 준비해 둔 파프리카와 고추를 넣고 볶아줍니다.', 'image_url': 'https://recipe1.ezmember.co.kr/cache/recipe/2018/05/25/2702b307ddd54c92c0b7bca1b9fc3d061.jpg'}, {'step_number': 7, 'description': '버섯에서 물이 많이 나와 물을 안넣어도 되지만 볶을때 좀 더 쉽게 하려면 종이컵 1/3컵 정도로 아주 적은양의 물을 살짝만 추가해 줍니다.', 'image_url': 'https://recipe1.ezmember.co.kr/cache/recipe/2018/05/25/826c14af40c5c62b3b848a84743e3abd1.jpg'}, {'step_number': 8, 'description': '간장 5T를 넣고, 올리고당 1T를 넣고,', 'image_url': 'https://recipe1.ezmember.co.kr/cache/recipe/2018/05/25/fa650418bfbf952a50f6233e7c49722a1.jpg'}, {'step_number': 9, 'description': '후춧가루도 넣어주세요.', 'image_url': 'https://recipe1.ezmember.co.kr/cache/recipe/2018/05/25/fab14395b580c7b0450815de17a639401.jpg'}, {'step_number': 10, 'description': '볶다보면 물이 많이 나올거에요. 전분가루 1T에 물2T를 넣고 잘 섞어준 후 전분물을 넣어 주세요.', 'image_url': 'https://recipe1.ezmember.co.kr/cache/recipe/2018/05/25/9ecd20b1a7e1a1fadcdfd3b2fab5048f1.jpg'}, {'step_number': 11, 'description': '국물이 살짝 걸죽해진 꼬마 새송이 버섯 볶음 완성입니다. 버섯덮밥으로 먹어도 그만이에요. 참기름을 살짝 넣어주셔도 되요.', 'image_url': 'https://recipe1.ezmember.co.kr/cache/recipe/2018/05/25/1c44233938a83eb64ed6bfbbf66dd7611.jpg'}]"
10913,밑반찬,일상,버섯류,볶음,'생표고버섯 볶음'으로 봄철 밥상에 영양을~,표고버섯볶음,"11,662",10분 이내,아무나,4인분,"[('생표고버섯', '100g'), ('다진 마늘', '1개'), ('간장', '1/2작은술'), ('참기름', '1/2작은술'), ('통깨', '약간'), ('후추', '약간'), ('소금', '약간'), ('파', '1/4대')]","제철을 맞이한 표고버섯!
쫄깃한 식감과 향이 좋은 생표고버섯볶음이에요.","[{'step_number': 1, 'description': '냄비에 버섯 데칠 물을 끓여 두고\n버섯은 가볍게 씻어 두고\n파는 송송 썰어 둔다.', 'image_url': 'https://recipe1.ezmember.co.kr/cache/recipe/2018/05/03/29156767e5cea274fe6588278abf4b0f1.jpg'}, {'step_number': 2, 'description': '물이 끓으면 버섯을 넣어 살짝 데쳐서 찬물에 헹군다.약 10초 정도 담갔다가 건졌다.', 'image_url': None}, {'step_number': 3, 'description': '헹군 버섯을 얇게 썰어 준 후에 물기를 꼭 짠다.', 'image_url': 'https://recipe1.ezmember.co.kr/cache/recipe/2018/05/03/7f6f667509a794b2e39194da4ad5026c1.jpg'}, {'step_number': 4, 'description': '달군 팬에 식용유를 약간 두르고 버섯과 다진 마늘을 넣어 볶다가\n숨이 살짝 죽은 듯 하면 간장을 넣어 계속 볶는다.', 'image_url': None}, {'step_number': 5, 'description': '버섯이 다 볶아지면 맛을 보고 소금으로 마지막 간을 하고\n파, 참기름, 통깨와 후추를 약간씩 넣고 섞은 후 불에서 내린다.', 'image_url': 'https://recipe1.ezmember.co.kr/cache/recipe/2018/05/03/553614c980bf7924717f3741566386a01.jpg'}]"
10914,밑반찬,일상,버섯류,볶음,"[ 목이버섯 볶음 ] 맛있는목이버섯, 고급스러운맛, 맛보장!",목이버섯볶음,"3,516",5분 이내,아무나,2인분,"[('목이버섯', '2주먹'), ('믹스 견과류', '1/2주먹'), ('올리브', '4알'), ('전복', '2미'), ('양조간장', '0.5t'), ('소금', '0.2t'), ('들기름', '3t')]","고급스러운 목이버섯볶음 소개합니다.
믿고 따라오세요.
와인안주로도 좋아요!","[{'step_number': 1, 'description': '목이버섯을 (두주먹 분량) 깨끗하게 씻어 먹기좋게 잘라줍니다.', 'image_url': 'https://recipe1.ezmember.co.kr/cache/recipe/2021/09/01/144feacacabfedb5446392f196e8a50d1.jpg'}, {'step_number': 2, 'description': '전복 2미를 먹기 좋게 썰어줍니다.없으시면 생략하셔도 상관없어요!\n넣으시면,, 더 맛있을뿐...\n(새우도 좋아요)', 'image_url': 'https://recipe1.ezmember.co.kr/cache/recipe/2021/09/01/fac459a9d6670e33a646cdfa1e599cd71.jpg'}, {'step_number': 3, 'description': '올리브 2알을 송송 썰어줍니다.없으시면 생략하셔도 무관합니다.', 'image_url': 'https://recipe1.ezmember.co.kr/cache/recipe/2021/09/01/0d1fda16b49f9100995a0b92cd2fd0001.jpg'}, {'step_number': 4, 'description': '전복을 들기름 2t를 넣고 볶아줍니다.', 'image_url': 'https://recipe1.ezmember.co.kr/cache/recipe/2021/09/01/1348342423613c1461c715bffeeb15f01.jpg'}, {'step_number': 5, 'description': '목이버섯과 들기름 1t를 추가로 넣고 볶아줍니다.\n목이버섯이 튈 수 있으니 불을 약하게 사용하시고 조심하세요!', 'image_url': 'https://recipe1.ezmember.co.kr/cache/recipe/2021/09/01/8133914492fe410492c9f1142c7e2fd81.jpg'}, {'step_number': 6, 'description': '소금 0.2t, 양조간장 0.5t를 넣고 볶아줍니다.', 'image_url': 'https://recipe1.ezmember.co.kr/cache/recipe/2021/09/01/d14ea93cebea358bc5c8c1023cba997c1.jpg'}, {'step_number': 7, 'description': '견과류 반줌을 넣고 볶아줍니다.안넣으셔도 좋아요. 넣으시면 식감이 좋아요.\n이때 트러플 오일을 몇 방울 넣으시면 ... 훨씬 풍미가 좋습니다.\n딱 와인안주!', 'image_url': 'https://recipe1.ezmember.co.kr/cache/recipe/2021/09/01/58fe98d7346e9dc9db043f259bd781c31.jpg'}, {'step_number': 8, 'description': '맛있게 담아서 드세요!', 'image_url': 'https://recipe1.ezmember.co.kr/cache/recipe/2021/09/01/e14fd3beaf1ce2fc4cd1199956168b131.jpg'}]"
