index,종류별,상황별,재료별,방법별,글 제목,레시피이름,조회수,조리시간,난이도,인분,재료,소개글,조리순서
57387,디저트,간식,채소류,굽기,웨지감자만들기,None,"8,058",None,None,None,[],,[]
57388,디저트,간식,채소류,굽기,주말의 간식 웨지감자 후라이드,웨지감자,"5,570",30분 이내,초급,2인분,"[('감자', '3개'), ('튀김가루', '적당량'), ('카레가루', '약간'), ('소금', '약간'), ('후추', '약간')]",카레향이 솔솔 고소한 웨지감자구이입니다.,"[{'step_number': 1, 'description': '깨끗히 씻은 감자를 쐐기 모양으로 잘라 준비합니다.', 'image_url': 'https://recipe1.ezmember.co.kr/cache/recipe/2015/08/31/ed288967b1755d23d2492428c14eff281.jpg'}, {'step_number': 2, 'description': '감자에 소금, 후추 간을 해줍니다.', 'image_url': 'https://recipe1.ezmember.co.kr/cache/recipe/2015/08/31/c2d15755f366509424730b7f1ff2e67e1.jpg'}, {'step_number': 3, 'description': '튀김가루를 넣고 카레가루를 살짝 넣어줍니다.', 'image_url': 'https://recipe1.ezmember.co.kr/cache/recipe/2015/08/31/480b456ac7b4087a04d2c687d9c87c4b1.jpg'}, {'step_number': 4, 'description': '30분 정도 가루가 흡수 되도록 둡니다.', 'image_url': 'https://recipe1.ezmember.co.kr/cache/recipe/2015/08/31/fc6d61c1d9686bc0b634e820f7ceec711.jpg'}, {'step_number': 5, 'description': '달궈진 기름에 튀기거나 팬에 감자를 올리고 식용유를 발라준 뒤 200도로 예열된 오븐에 노릇할 정도로 구워냅니다.오븐', 'image_url': 'https://recipe1.ezmember.co.kr/cache/recipe/2015/08/31/e7baf8b8e58e3e2bb58d96e49d0112a01.jpg'}]"
57389,디저트,간식,채소류,굽기,베이컨치즈 통감자 만들기,베이컨치즈통감자,"5,783",60분 이내,초급,2인분,"[('감자', '4개'), ('베이컨', '5장'), ('체다치즈', '2~3장'), ('올리브유', '조금'), ('소금', '조금')]",아이들도 어른들도 너무나 좋아하는 감자요리!! 베이컨치즈 통감자 만들기입니다.,"[{'step_number': 1, 'description': '우선 감자는 껍질채 구울거라서, 깨끗이 씻어 흙을 전부 제거해 주세요.', 'image_url': 'https://recipe1.ezmember.co.kr/cache/recipe/2016/02/22/3278aea447a6f6d03fdbb31bb6cb42661.jpg'}, {'step_number': 2, 'description': '깨끗이 씻은 감자 양쪽에는 나무젓가락을 놓고 칼을이용해 썰어주는데요.젓가락을 양쪽에 놓는 이유는 감자가 댕강 썰려서 분리되지 않게 하기 위함이에요.', 'image_url': 'https://recipe1.ezmember.co.kr/cache/recipe/2016/02/22/e885b31cdb4dbf27a91bec37dd4811311.jpg'}, {'step_number': 3, 'description': '베이컨 치즈 통감자 만들때는 꼭 아래까지 썰리지 않게 썰어 주시는게 포인트 랍니다.', 'image_url': 'https://recipe1.ezmember.co.kr/cache/recipe/2016/02/22/12a6173233ca7d31ba1898ee2da28baa1.jpg'}, {'step_number': 4, 'description': '그렇게 칼집을 내어 준비해 주세요. 일반 통감자 였으면 얇게 칼집을 냈겠지만, 베이컨과 치즈를 사이사이에 넣어야하기 때문에 적당한 굵기로 칼집을 내주었어요 .', 'image_url': 'https://recipe1.ezmember.co.kr/cache/recipe/2016/02/22/0a243348b153101d3b76a1b6198c47ed1.jpg'}, {'step_number': 5, 'description': '이렇게 썰은 감자는 팬에 종이 호일을 깔고 위에 올려 구워 주세요.', 'image_url': 'https://recipe1.ezmember.co.kr/cache/recipe/2016/02/22/1306050cf21a44e766cd25703062d7bb1.jpg'}, {'step_number': 6, 'description': '200도 온도에 20분 구워주면,', 'image_url': 'https://recipe1.ezmember.co.kr/cache/recipe/2016/02/22/eff2db0af321b59c4ba03f34a017c19d1.jpg'}, {'step_number': 7, 'description': '감자 사이사이가 벌어져요한김 식혀주고', 'image_url': 'https://recipe1.ezmember.co.kr/cache/recipe/2016/02/22/c91e5e8be5696d8a64c485a834a304221.jpg'}, {'step_number': 8, 'description': '베이컨은 감자 사이에 넣기 좋은 사이즈로 썰어 주고,', 'image_url': 'https://recipe1.ezmember.co.kr/cache/recipe/2016/02/22/2dd64a2d66c8ef60f09135187a545f811.jpg'}, {'step_number': 9, 'description': '치즈는 안썰어도 손으로 뜯어서 사용해도 된답니다.', 'image_url': 'https://recipe1.ezmember.co.kr/cache/recipe/2016/02/22/2aea136b098a35eb386518c64e0cd78f1.jpg'}, {'step_number': 10, 'description': '이제 준비한 베이컨과 치즈를 감자 사이사이에 끼워 넣어주세요.', 'image_url': 'https://recipe1.ezmember.co.kr/cache/recipe/2016/02/22/76c57d55badc561aae625780b9fdbf651.jpg'}, {'step_number': 11, 'description': '위에 올리브유 반큰술씩 뿌려주고', 'image_url': 'https://recipe1.ezmember.co.kr/cache/recipe/2016/02/22/1dbc45eed78ceb07d95f8c0773406df61.jpg'}, {'step_number': 12, 'description': '소금 솔솔솔 뿌려주세요.', 'image_url': 'https://recipe1.ezmember.co.kr/cache/recipe/2016/02/22/5fb7445e9c2fa5e78d9113c68bf841ef1.jpg'}, {'step_number': 13, 'description': '이제 오븐에 한번더 200도 온도에서 20분간 구워 주세요.오븐', 'image_url': 'https://recipe1.ezmember.co.kr/cache/recipe/2016/02/22/fc5e1373dbb6726c37c4fdae81acd6131.jpg'}]"
57390,디저트,간식,채소류,굽기,해남 꿀고구마로 맛있는 군고구마를~,꿀고구마,"2,540",60분 이내,아무나,1인분,"[('고구마', '')]","해남에서 밤고구마와 호박고구마의 장점만을 모아서 만든 신품종인 꿀고구마예요. 
이렇게 달수가.. 해서 달수고구마, 첫사랑의 맛이라고 해서 첫사랑 고구마라고도 불리는 꿀고구마는 구워먹는것이 더 맛있다고 해서 구워먹었어요.","[{'step_number': 1, 'description': '해남의 황토밭에서 잘자란 고구마를 흐르는 물에 깨끗하게 씻어주세요.\n깨끗해진 고구마를 찜기나 구이용 직화냄비에 넣고 구워주기만 하면 끝!!!', 'image_url': None}, {'step_number': 2, 'description': '불위에서 직접 올려놓고 굽는 직화냄비의 경우에는 \n자주 고구마를 뒤집어 주어야합니다.\n직화냄비에 물을 조금 넣어주는거 잊지마시구요.\n그렇지 않으면 숯덩이가 된 고구마를 만나게 될거예요.', 'image_url': None}, {'step_number': 3, 'description': '전기로 굽는 적외선 직화냄비같은 경우에는\n물을 넣지 않고 고구마를 철망위에 올려놓은후 고구마 크기에 따라 굽는 시간이 다르긴 하지만\n보통 40분정도 구워주면 꿀이 흐르는 노란 고구마의 속살을 보게되는것 같아요!', 'image_url': None}]"
57391,디저트,간식,채소류,굽기,"허니버터 통감자구이, 휴게소 별미를 간단히 집에서 즐겨보세요~",통감자허니버터구이,"4,399",15분 이내,초급,1인분,"[('감자', ''), ('소금', ''), ('버터', ''), ('꿀', ''), ('파마산치즈가루', ''), ('파슬리가루', '')]",허니버터 통감자구이입니다.,"[{'step_number': 1, 'description': '감자는 껍질을 벗겨 소금 약간 넣은 물에 삶는다.', 'image_url': 'https://recipe1.ezmember.co.kr/cache/recipe/2015/08/31/2f6eb2d9ee394eee1047f45ba4f051ce1.jpg'}, {'step_number': 2, 'description': '90%정도 익은 감자는 건져내 겉면의 물기를 날려준다.', 'image_url': 'https://recipe1.ezmember.co.kr/cache/recipe/2015/08/31/2292492c8f958466254e997c2d6f1e5d1.jpg'}, {'step_number': 3, 'description': '팬에 버터를 녹이고 중약불로 감자를 굴리며 노릇하게 굽는다. 발연점이 낮은 버터는 쉽게 탈 수 있으니 반드시 중약불로 조리하세요.', 'image_url': 'https://recipe1.ezmember.co.kr/cache/recipe/2015/08/31/0601c802ae0cf25e9592b72c6a991c491.jpg'}, {'step_number': 4, 'description': '감자가 노릇하게 구워졌으면 꿀(2스푼)을 넣어 팬을 흔들어가며 감자를 굴려준다. 꿀의 양은 취향껏 조절하시고 꿀은 높은 온도에서는 영양소가 파괴가 되니 불을 끄고 넣어주세요.', 'image_url': 'https://recipe1.ezmember.co.kr/cache/recipe/2015/08/31/3b2562ac18db6238babdfe475a1b9efc1.jpg'}, {'step_number': 5, 'description': '허니버터 통감자구이를 그릇에 담고 파마산 치즈가루와 파슬리가루를 뿌려낸다.', 'image_url': 'https://recipe1.ezmember.co.kr/cache/recipe/2015/08/31/6da480f223dbeb7a711db0020876c0141.jpg'}, {'step_number': 6, 'description': '완성입니다.', 'image_url': 'https://recipe1.ezmember.co.kr/cache/recipe/2015/08/31/308c5faf47ce1aa990c381843bd932201.jpg'}]"
57392,디저트,간식,채소류,굽기,알감자 통조림으로 만드는 1분 버터 알감자 구이 -혼자 먹기 딱 좋아요.,알감자구이,"2,907",5분 이내,아무나,1인분,"[('감자통조림', '1캔'), ('소금', '1꼬집'), ('버터', '1큰술')]","고급진...이라고 해서 귀가 솔깃하고 들어왔는데..속은 것 같을 수 도 있어요. ㅎ
허지만 보는 시각에 따라서는 고개를 끄덕일 수 도 있어요.
암튼 저는 우리나라에도 이런 재료가 있다는 것이 신기해서 얼렁 가져와 봤다는.....^^*","[{'step_number': 1, 'description': '1분이면 뚝딱 만들어지는 일인분의 적당한 양의 감자버터구이. 근데....이거이거 넘 맛있네요. \n아마도 제가 감자킬러라서 그런지도.....', 'image_url': 'https://recipe1.ezmember.co.kr/cache/recipe/2017/04/27/7d4968d1431e628289063d1d0913a3281.jpg'}, {'step_number': 2, 'description': '동원에서 나온 알감자 통조림(1000원)\n저는 뭐든 새로 나온 식재료는 무조건 사고 보는 호기심 있는 성격입니다.\n물론 ...그래서 실패 한 적도 많고 맛없는 재료들도 많아서 버린 적도 더러더러....있다지요.\n기대는 안하고 얘를 가져 왔어요.', 'image_url': 'https://recipe1.ezmember.co.kr/cache/recipe/2017/04/27/c26e53e10b6814b32ac4d5cc0130f2261.jpg'}, {'step_number': 3, 'description': '열어보니 이렇게 8알이 아주 매끄럽게 껍질이 벗겨져 있었어요. 7개라구요?\n물론 하나는 제가 맛을 먼저 보았어요.\n캔 냄새도 없고 .. 파근파근하고......거기다가 자태가 이쁘기까지!', 'image_url': 'https://recipe1.ezmember.co.kr/cache/recipe/2017/04/27/05cae6ec00db927f367df798ecd942461.jpg'}, {'step_number': 4, 'description': '작은 팬에 버터 1큰술 녹이고 감자를 넣고 굴려가면서 볶았어요. 소금 한꼬집 탁탁 뿌리고...쉐키쉐키~~', 'image_url': 'https://recipe1.ezmember.co.kr/cache/recipe/2017/04/27/95254e3a93cea925899156af3ed89a671.jpg'}, {'step_number': 5, 'description': '고속도로 감자랑은 비교가 안 되는 고급진 맛입니다.\n포근포근 ~~~겉은 약간 바삭하고 버터의 향미가 물씬~~\n거기다가 혼자 먹기 딱 좋은 양이라서 맘에 듭니다.', 'image_url': 'https://recipe1.ezmember.co.kr/cache/recipe/2017/04/27/9f0d70283e735f55d61d2c02161a024f1.jpg'}, {'step_number': 6, 'description': '입천장 데도록 뜨거웠지만 꿀꺼덕!\n물론 감자 몇 알에 천원이라니...하면서 놀라는 분들도 있겠지만\n천냥 가치가 있었어요.\n먹고 싶을 때 그냥 후다닥~~~먹을 수 있다는 장점이 넘 좋았어요. 제가 하두 맛나다고 노래를 했더니 남편 왈 "" 넘 조금 줘서 그런 거야!""\n꼬마 감자야~~기둘러라 ~~~ 내일 니들 더 데릴러 가마! ^^*', 'image_url': 'https://recipe1.ezmember.co.kr/cache/recipe/2017/04/27/0983b6c5bfb51d6311898cd7f9f0c02c1.jpg'}]"
57393,디저트,간식,채소류,굽기,맛있는 아이간식 알감자버터구이!,알감자버터구이,"1,073",30분 이내,중급,2인분,"[('알감자', '13개'), ('소금', '1큰술'), ('물', '500ml'), ('버터', '2큰술'), ('황설탕', '1큰술'), ('후추', '톡톡')]",식재료 포인트로 산 알감자로 버터구이를 해서 아이간식을 줬어요^^,"[{'step_number': 1, 'description': '작은냄비에 500ml물을부어 소금1큰술 넣고 10분간 삶아줍니다.', 'image_url': 'https://recipe1.ezmember.co.kr/cache/recipe/2020/07/21/5c588333373336de38a2c8bf3bdfb7781.jpg'}, {'step_number': 2, 'description': '버터1큰술 떠 전자레인지에 30초 돌려 녹여줍니다.전자레인지', 'image_url': 'https://recipe1.ezmember.co.kr/cache/recipe/2020/07/21/b8ba11ece3ee453b62ee00633819c85a1.jpg'}, {'step_number': 3, 'description': '녹인버터에 황설탕1큰술 ,후추톡톡해 섞어줍니다.', 'image_url': 'https://recipe1.ezmember.co.kr/cache/recipe/2020/07/21/7063ff4673035ea82e09c4e8ae31e1c21.jpg'}, {'step_number': 4, 'description': '10분간 어느정도 삶아진 감자를 \n살짝식혀 까줍니다.뜨거우니까요!^^', 'image_url': 'https://recipe1.ezmember.co.kr/cache/recipe/2020/07/21/dc1842d1c8fc7973c3c5469cef0310831.jpg'}, {'step_number': 5, 'description': '섞어둔 버터를 깐감자에 고루 버무려줍니다.', 'image_url': 'https://recipe1.ezmember.co.kr/cache/recipe/2020/07/21/8893748ae63c90af232324e05812146f1.jpg'}, {'step_number': 6, 'description': '에어프라이어에 200도 10분간 중간중간 굴려가며 섞어줍니다.에어프라이어', 'image_url': 'https://recipe1.ezmember.co.kr/cache/recipe/2020/07/21/86fd67d01374634789dc9ec58177b2ba1.jpg'}, {'step_number': 7, 'description': '10분 돌리고 나면 감자에 버터 1큰술 을 감자마다 조금씩 발라줍니다.\n그러고나서 5분정도 굴려가며 돌려줍니다.기기마다 다르니 중간중간 굴릴때 적당하다 싶으면 꺼내어 줍니다.', 'image_url': 'https://recipe1.ezmember.co.kr/cache/recipe/2020/07/21/82a545a2d1e7b5641c7c2d3de3cfa6a11.jpg'}, {'step_number': 8, 'description': '적당한 그릇에 담아 파슬리(생략가능)를 솔솔 뿌려주면 완성!', 'image_url': 'https://recipe1.ezmember.co.kr/cache/recipe/2020/07/21/aea9a4985ac0d5602de37c9a7a929f031.jpg'}]"
57394,디저트,간식,채소류,굽기,휴게소 감자 만들기 이제 집에서도 편안하게 통감자를 즐겨보아요 :),통감자,"2,229",30분 이내,초급,2인분,"[('감자', '6개'), ('버터', '1덩이'), ('설탕', '적당량'), ('소금', '약간'), ('파슬리', '약간')]","여러분들은 휴게소 음식하면 
어떤 음식이 가장 먼저 떠오르시나요? 
저는 휴게소! 하면 단, 1초의 망설임도 없이 
휴게소 감자가 제일 먼저 떠올라요 ^^ 
휴게소에 가면 무조건 통감자를 꼭 먹는답니다~ 
그 휴게소 감자를 집에서도 만들어 먹을 수 있어요! 
달달짭짤한 휴게소 감자 만들기 ♥ 
우리 함께 통으로 편안하게 먹어보아요 :)","[{'step_number': 1, 'description': '휴게소 감자를 만들기 위해 \n필요한 재료들을 먼저 알려드릴게요!감자 6개, 버터 한 덩이, 설탕 적당량, 소금 약간, 파슬리 약간', 'image_url': 'https://recipe1.ezmember.co.kr/cache/recipe/2020/08/07/3d220e98a8e22fc8987d62b119055a3a1.jpg'}, {'step_number': 2, 'description': '그럼 휴게소 감자 만들기~~ \n바로 시작해보도록 할게요!! \n먼저 감자 6개를 준비해주세요.', 'image_url': 'https://recipe1.ezmember.co.kr/cache/recipe/2020/08/07/8e6b8630c06c26df67d15b5e6cf0be681.jpg'}, {'step_number': 3, 'description': '동글동글한 감자 6개는 찬물에 깨끗하게 씻어줍니다.', 'image_url': 'https://recipe1.ezmember.co.kr/cache/recipe/2020/08/07/f1fd2b3e042f749b0d18ee163c7334ef1.jpg'}, {'step_number': 4, 'description': '그리고 채칼을 이용해서 \n감자의 껍질을 깔끔하게 깎아주세요. \n군데군데 감자의 싹이 있는 부분은 \n칼로 깨끗하게 도려내주세요.', 'image_url': 'https://recipe1.ezmember.co.kr/cache/recipe/2020/08/07/40743dfb40a12e3b17714ef997fe14ba1.jpg'}, {'step_number': 5, 'description': '감자의 크기가 꽤 커요~ \n감자 1개당 반씩 잘라 먹기 좋은 크기로 만들어주세요. \n감자를 반으로 자르면 \n먹기도 좋고! 감자를 삶을 때도 금방 삶아진답니다~', 'image_url': 'https://recipe1.ezmember.co.kr/cache/recipe/2020/08/07/3abbdc8d10d878dc6b69850ae8070ed01.jpg'}, {'step_number': 6, 'description': '가스레인지나 인덕션 위에 \n감자를 삶기 좋은 냄비에 물을 담아 올려주세요. \n가스불은 강불로 켜주세요.', 'image_url': 'https://recipe1.ezmember.co.kr/cache/recipe/2020/08/07/05ab9c798963f1584908884f65c011cb1.jpg'}, {'step_number': 7, 'description': '냄비에 담긴 물에 소금을 약간 넣어준 뒤,', 'image_url': 'https://recipe1.ezmember.co.kr/cache/recipe/2020/08/07/08257c6c147dae6cc4275758ae7d48a01.jpg'}, {'step_number': 8, 'description': '냄비의 물을 끓여줍니다.', 'image_url': 'https://recipe1.ezmember.co.kr/cache/recipe/2020/08/07/99f45b8d51e63229fcf63a4e89199f811.jpg'}, {'step_number': 9, 'description': '냄비의 물이 끓기 시작하면 \n반씩 잘라준 감자 6개, 총 12조각의 감자를 \n냄비에 모두 넣어주세요.', 'image_url': 'https://recipe1.ezmember.co.kr/cache/recipe/2020/08/07/ef88e53984cc456d93ddf586d0cbf1d41.jpg'}, {'step_number': 10, 'description': '그리고 10분~15분 정도 감자를 삶아줍니다. \n중간에 젓가락으로 감자를 콕! 찍어서 \n감자가 익었는지 안 익었는지의 유무를 확인해주세용~', 'image_url': 'https://recipe1.ezmember.co.kr/cache/recipe/2020/08/07/8249b88e20dc5312c7f1fa796c8865191.jpg'}, {'step_number': 11, 'description': '잘 삶아진 감자는 체망에 옮겨 담아 \n자연스럽게 물기를 빼주세요. \n그리고 감자를 한 김 식혀줍니다. \n★삶아준 감자를 2차로 프라이팬에 구워줄 거라 \n충분히 한 김 식혀주시는 게 좋아요! \n그래야 프라이팬에 감자를 구울 때 \n부서지지 않는답니다 ^^★', 'image_url': 'https://recipe1.ezmember.co.kr/cache/recipe/2020/08/07/ce9a436f65cd11724a1f3c5ff958a6771.jpg'}, {'step_number': 12, 'description': '이제 삶아준 감자를 프라이팬에 구워줄게요~ \n가스레인지나 인덕션 위에 \n납작한 프라이팬을 올려주세요. \n가스불은 중간불로 켜주세요.', 'image_url': 'https://recipe1.ezmember.co.kr/cache/recipe/2020/08/07/57c2ea4a544371b9d5451f458b21f60c1.jpg'}, {'step_number': 13, 'description': '프라이팬의 열기가 어느 정도 올라오면', 'image_url': 'https://recipe1.ezmember.co.kr/cache/recipe/2020/08/07/a4b3035b1bd9e6ea59a14a841c80d0ae1.jpg'}, {'step_number': 14, 'description': '버터 한 덩이를 프라이팬에 올려 버터를 녹여주세요.', 'image_url': 'https://recipe1.ezmember.co.kr/cache/recipe/2020/08/07/efdbe923fb6bf62fb40710f6e2685ecf1.jpg'}, {'step_number': 15, 'description': '프라이팬에 전체적으로 버터를 녹여준 뒤,', 'image_url': 'https://recipe1.ezmember.co.kr/cache/recipe/2020/08/07/c2d9e786d97434fbdc329692eff323dc1.jpg'}, {'step_number': 16, 'description': '한 김 푹~식혀준 감자 12조각을 \n버터가 둘러진 프라이팬에 모두 올려주세요. \n가스불은 중간불을 유지해주세요.', 'image_url': 'https://recipe1.ezmember.co.kr/cache/recipe/2020/08/07/f9f415966071645f2c75e7b6cdc40ce91.jpg'}, {'step_number': 17, 'description': '감자를 앞뒤로 뒤집어가며 \n감자가 노릇노릇해질 때까지 맛나게 구워줍니당!', 'image_url': 'https://recipe1.ezmember.co.kr/cache/recipe/2020/08/07/7730bfc718400086801097b9c87cb0e51.jpg'}, {'step_number': 18, 'description': '버터의 고소한 냄새가 \n얼른 휴게소 감자를 먹고 싶게 만들어요 ^^', 'image_url': 'https://recipe1.ezmember.co.kr/cache/recipe/2020/08/07/0e8a65716bd70e2ccb1eefd9a17bca161.jpg'}, {'step_number': 19, 'description': '버터에 노릇노릇하게 구워진 감자는 \n먹기 좋은 그릇에 차곡차곡 담아주세요~', 'image_url': 'https://recipe1.ezmember.co.kr/cache/recipe/2020/08/07/db4feeacac807009e93aa95551ef72ea1.jpg'}, {'step_number': 20, 'description': '그리고 감자들에게 달달한 설탕과 짭짤한 소금을 \n취향에 따라서 솔솔 뿌려줍니다.', 'image_url': 'https://recipe1.ezmember.co.kr/cache/recipe/2020/08/07/4e9e5f7b18fd26343cc24f201d4a55351.jpg'}, {'step_number': 21, 'description': '파슬리 가루도 솔솔솔 뿌려주세용~', 'image_url': 'https://recipe1.ezmember.co.kr/cache/recipe/2020/08/07/9ae7dc843b1dc3a4bad21be17c580d841.jpg'}, {'step_number': 22, 'description': '집에서 만들었지만 \n진짜 휴게소에서 파는 감자처럼 먹기 위해 \n길쭉한 이쑤시개도 감자 옆에 콕콕! 꽂아주시면 \n홈메이드 휴게소 감자 완성이예요 ^^', 'image_url': 'https://recipe1.ezmember.co.kr/cache/recipe/2020/08/07/0734b2525e516d86a1d6cfc77a902ed81.jpg'}, {'step_number': 23, 'description': '진짜 휴게소에서 파는 감자랑 맛이 \n똑.같.아.요!!! \n넘나 맛있습니당 ^^ \n먹어도 먹어도 자꾸만 먹고 싶은 \n홈메이드 휴게소 감자예요. \n버터, 설탕, 소금의 조합이 \n황금조합이네요 ㅋ_ㅋ', 'image_url': 'https://recipe1.ezmember.co.kr/cache/recipe/2020/08/07/fea92a16d7c56033e47d3658d44bb6a81.jpg'}]"
57395,디저트,간식,채소류,굽기,종이호일 일반냄비 군고구마만들기 홈메이드,군고구마,"3,867",30분 이내,아무나,3인분,"[('고구마', '5개')]","집에서도 간단하게 군고구마 만들어 먹자구요
겨울 간식으로 빠질 수 없지요","[{'step_number': 1, 'description': '직화냄비에 하면 더 좋겠지만 햇살이 직화 냄비 안샀다는요.\n그래서 이방법 몰랐을 때는 군고구마 완전 버리려고 하는 아주 \n낡은 냄비를 사용했는데요.\n이젠 새냄비로 해도 냄비 탈 염려 없이 \n일반냄비로 군고구마 황금레시피 간단하게 알려 드릴께요.', 'image_url': 'https://recipe1.ezmember.co.kr/cache/recipe/2018/12/28/b275b176f9c2be82d5491e452ea2d9ba1.jpg'}, {'step_number': 2, 'description': '우선 고구마를 아주 굵은 아이들 말고 길고 가는 \n또 약간 작은 아이들로 준비해 주세요.\n그리고 양 끝은 잘라 주시구요\n씻어서 준비해 주시구요.\n일반냄비 \n종이호일\n요것만 있음 되세요.\n혹시 집에 종이쿠킹호일이 없으신 분들은\n신문지 사용하심 되세요.\n전에 신문지로 만들기 올렸었는데요.과정은 같아요.', 'image_url': 'https://recipe1.ezmember.co.kr/cache/recipe/2018/12/28/fb795a7284435dc7adfd52c0b555e48b1.jpg'}, {'step_number': 3, 'description': '우선 냄비를 올려 놓으시구요 종이 호일을 넉넉하게\n잘라 주세요.\n종이쿠킹호일 아래도 깔고 고구마 놓고\n위에도 덥을 꺼니까 넉넉하게 잘라 주세요', 'image_url': 'https://recipe1.ezmember.co.kr/cache/recipe/2018/12/28/f08f1e1b2d8a5062cc27398b938b71841.jpg'}, {'step_number': 4, 'description': '그리고 종이호일에 작은 컵으로 물을 1/3정도 넣어 주세요.\n그리고 고구마를 올려 주세요.\n너무나 간단하지요.', 'image_url': 'https://recipe1.ezmember.co.kr/cache/recipe/2018/12/28/b47e217a0ca7ce8bc2f19f23863906b71.jpg'}, {'step_number': 5, 'description': '그리고 뚜껑을 덮어 주세요.\n그리고 요기 뚜껑의 증기 나오는 증기구멍을 \n종이호일에 물을 적셔서 막아 주세요.\n안에 수증기가 차면서 수분은 마르고 또 증기로 \n고구마 안은 촉촉하게 찌면서 굽는 거랍니다.', 'image_url': 'https://recipe1.ezmember.co.kr/cache/recipe/2018/12/28/b88a494b6abbb2ab0ad3cd70598184e81.jpg'}, {'step_number': 6, 'description': '그리고 어느 정도 익으면서 아랫부분이 조금씩 구워지면서\n군고구마 냄새가 나요.\n중간에 한번 열어서 위.아래를 뒤집어 주시구요.\n다시 포개어 싸놓고 다시 가열\n그러다 거의 다 익어가면 시중에 파는 군고구마 향이 나요.\n그럼 거의 다 된거예요.\n젓가락으로 고구마가 익었는지 한번 찔러 보구요\n탄 정도도 확인하시구요.', 'image_url': 'https://recipe1.ezmember.co.kr/cache/recipe/2018/12/28/4cb48258c1c105d7e094b87fa86d8d6c1.jpg'}, {'step_number': 7, 'description': '냄비 바닥은 종이 호일이 약간 고구마 뒤집다 찢어졌는지\n물이 흐른 자국 정도\n수세미로 닦음 금방 닭이는 물때 정도로만 눌었어요/\n우와 신기 신기', 'image_url': 'https://recipe1.ezmember.co.kr/cache/recipe/2018/12/28/f93e33f59651cf495c0fba372b4659fb1.jpg'}, {'step_number': 8, 'description': '그럼 맛있는 군고구마 만들기 완성이지요\n너무 간단해서 매일도 해먹을 수 있어요', 'image_url': 'https://recipe1.ezmember.co.kr/cache/recipe/2018/12/28/970b57d18953260232d092201aef69261.jpg'}]"
