index,종류별,상황별,재료별,방법별,글 제목,레시피이름,조회수,조리시간,난이도,인분,재료,소개글,조리순서
53804,찌개,일상,해물류,끓이기,"천원의 행복, 시원한 홍합찌개",None,121,None,None,None,"[('홍합', '150g'), ('감자', '1개'), ('호박', '1/4개'), ('양파', '1/4개'), ('당근', '1/5개'), ('대파', '1/2대'), ('육수', '4컵'), ('된장', '1숟가락'), ('마늘', '1숟가락'), ('홍초', '1개'), ('청양초', '2개')]",,[]
53805,찌개,일상,해물류,끓이기,알백이 동태 찌게-,동태찌개,"1,331",30분 이내,초급,2인분,"[('알백이 동태', '1마리'), ('무우 한토막', '250g'), ('고춧가루', '1큰술'), ('된장', '1큰술'), ('고추장', '1/2큰술'), ('다진마늘', '1/2큰술'), ('재 파', '1대'), ('쑥갓', '3줄기')]",마트에서는 동태를 잘라서 팩에 넣고 팔아서 알백이 고르기 쉬워요.,"[{'step_number': 1, 'description': '마트에서 골라 살수있는 알백이 동태 1마리.', 'image_url': 'https://recipe1.ezmember.co.kr/cache/recipe/2020/01/25/35a78283b706cf8e892f16818477a5af1.jpg'}, {'step_number': 2, 'description': '무우 한토막이면 200그람정도 됩니다.', 'image_url': 'https://recipe1.ezmember.co.kr/cache/recipe/2020/01/25/b59a589ce737541108f2b16579aa68d61.jpg'}, {'step_number': 3, 'description': '나박썰기라고 하지요?\n이렇게 써는것을~~', 'image_url': 'https://recipe1.ezmember.co.kr/cache/recipe/2020/01/25/3797e4363f6dbdf2951011c62dfb68831.jpg'}, {'step_number': 4, 'description': '냄비에 물을 2컵반 넣고 무우를 넣고 끓여지는동안 생선 손질시작~', 'image_url': 'https://recipe1.ezmember.co.kr/cache/recipe/2020/01/25/3e9348143f89bd74b4566dc94da59c901.jpg'}, {'step_number': 5, 'description': '냉동 생선은 사오자마자 녹기전에 손질해야 좋은데 저는 하루 두었다 손질하느라 힘 들었어요.\n생선 표면의 검은 물질 없이 박박 씻어야 비린맛이 없는데 이미 녹아서 대충 씻을 수 밖에...\n그리고 사진의 저부분을 넣어야 구수한 맛이 난다고해서 넣기는 하는데...\n보통은 이상한 벌레들이 죽어서 붙어있어요.\n그걸 살살 다 떼어내세요.\n저는 다듬어서 넣을때도 있고 벌레가 넘 많으면 버립니다.ㅎ', 'image_url': 'https://recipe1.ezmember.co.kr/cache/recipe/2020/01/25/1a48db013440fcda70f88e4b0eadb67a1.jpg'}, {'step_number': 6, 'description': '고춧가루 1큰술, 된장 1큰술, 고추장 1/2큰술 넣고 끓여 무우가 투명해지면', 'image_url': 'https://recipe1.ezmember.co.kr/cache/recipe/2020/01/25/37d2bb082d93695da0466ddd95449c721.jpg'}, {'step_number': 7, 'description': '생선투하~\n동태는 해동하지 않고 넣는게 살도 부드럽고 맛있어요.\n저는 부득히 해동된것을 넣었지만....\n해동되면서 생선의 물이 다 빠지게되면 살이 단단해서 맛이 없거든요.', 'image_url': 'https://recipe1.ezmember.co.kr/cache/recipe/2020/01/25/b4e23861b594e53a24a8270822e7ac5d1.jpg'}, {'step_number': 8, 'description': '중불에서 10분정도 끓여 어느정도 생선이 익으면 다진마늘 1/2큰술 넣고.....', 'image_url': 'https://recipe1.ezmember.co.kr/cache/recipe/2020/01/25/c6d1cff8702df377e7ff49f56c53cc181.jpg'}, {'step_number': 9, 'description': '휘시소스로 간을 맞춥니다.\n소금으로 할분들은 소금으로 하세요.\n저는 휘시소스 애정하는 사람이라서...\n이렇게 간이되면 다시 15분정도 끓인 후', 'image_url': 'https://recipe1.ezmember.co.kr/cache/recipe/2020/01/25/ed9de233cdf26ce7d4af2315d22145621.jpg'}, {'step_number': 10, 'description': '미리 대파랑 쑥갓 준비해 두었어요.', 'image_url': 'https://recipe1.ezmember.co.kr/cache/recipe/2020/01/25/1470caad1ddb50916fd9dab0a1dc713c1.jpg'}, {'step_number': 11, 'description': '대파넣고 1분 정도만 끓인 후', 'image_url': 'https://recipe1.ezmember.co.kr/cache/recipe/2020/01/25/21473e6ba99991c0a2306f3695c377671.jpg'}, {'step_number': 12, 'description': '불 끄고 쑥갓 넣고~~', 'image_url': 'https://recipe1.ezmember.co.kr/cache/recipe/2020/01/25/fad43267470f341cbd2b2de359a472181.jpg'}, {'step_number': 13, 'description': '뚜껑 덮었다가 몇초있다가 뚜껑을 열면 쑥갓이 적당히 익고 새파랗게 색도 유지해서 좋아요', 'image_url': 'https://recipe1.ezmember.co.kr/cache/recipe/2020/01/25/34eec138ab473dc647e3da65f3dc03a71.jpg'}, {'step_number': 14, 'description': '알좀 보소~~\n알 먹는 맛에 밥 한그릇 뚝딱!\n이 맛이야~~~', 'image_url': 'https://recipe1.ezmember.co.kr/cache/recipe/2020/01/25/164c3ad114ce60d83dbf496ed988e6b01.jpg'}]"
53806,찌개,일상,해물류,끓이기,도루묵찌개 ~*,도루묵찌개,"2,084",60분 이내,아무나,3인분,"[('도루묵', '10개'), ('무', '적당량'), ('양파', '1/2개'), ('대파', '1대'), ('청양초', '2개'), ('간장', '2큰술'), ('고추장', '1큰술'), ('고춧가루', '1큰술'), ('액젓', '1큰술'), ('다진마늘', '1큰술'), ('올리고당', '1큰술'), ('매실액기스', '1큰술'), ('후추', '톡톡'), ('미림', '2큰술'), ('물', '2종이컵')]",도루묵찌개,"[{'step_number': 1, 'description': '무 먹기좋은 크기로 썰어 냄비에 깔고', 'image_url': 'https://recipe1.ezmember.co.kr/cache/recipe/2020/02/05/5f3af217aefee21adfd8b1b99ab3a69f1.jpg'}, {'step_number': 2, 'description': '손질된 도루묵 무 위 올려 준다', 'image_url': 'https://recipe1.ezmember.co.kr/cache/recipe/2020/02/05/b34d823779ad74a959cace891a543c091.jpg'}, {'step_number': 3, 'description': '양파,대파,청양초 썰어 올려준다', 'image_url': 'https://recipe1.ezmember.co.kr/cache/recipe/2020/02/05/66ffc410ed69896871f78a824d553cf71.jpg'}, {'step_number': 4, 'description': '볼에 분량의 양념을 모두 넣고 썩어준 다음', 'image_url': 'https://recipe1.ezmember.co.kr/cache/recipe/2020/02/05/3e106106b6cbc8f692cb622eaf26bcd51.jpg'}, {'step_number': 5, 'description': '양념을 고루 올려준다', 'image_url': 'https://recipe1.ezmember.co.kr/cache/recipe/2020/02/05/6968cf13cef900abbac8ce0300a600631.jpg'}, {'step_number': 6, 'description': '센불에서 보글 보글 끓으면', 'image_url': 'https://recipe1.ezmember.co.kr/cache/recipe/2020/02/05/b44580874720d5f9b1bdee630816897a1.jpg'}, {'step_number': 7, 'description': '뚜껑을 덮고 중불 약불로 조절해 푹~ 끓여주면 끝', 'image_url': 'https://recipe1.ezmember.co.kr/cache/recipe/2020/02/05/6e1ecaf5ff786fe1d8810274bfe8ffe21.jpg'}]"
53807,찌개,일상,해물류,끓이기,얼큰 바지락순두부,바지락순두부찌개,440,15분 이내,아무나,2인분,"[('순두부', '1봉지'), ('바지락', '1줌'), ('양파', '1/3개'), ('대파', '1/2개'), ('청고추', '1/2개'), ('홍고추', '1/2개'), ('국간장', '1큰술'), ('고추가루', '1.5큰술'), ('소금', '1/3티스푼')]","얼큰한 순두부찌개 좋아하는 신랑을위해
종종 끓여준 개운한 국물의 순두부찌개에요~","[{'step_number': 1, 'description': '해감된 바지락 한 봉지 구매해서 흐르는물에 씻어주세요~', 'image_url': 'https://recipe1.ezmember.co.kr/cache/recipe/2022/06/14/221fd9ac9c2073d144542ff6d7a919531.jpg'}, {'step_number': 2, 'description': '양파 1/3 잘게 다져주세요', 'image_url': 'https://recipe1.ezmember.co.kr/cache/recipe/2022/06/14/2247c762247380e03b7dcdd9dccedd101.jpg'}, {'step_number': 3, 'description': '대파도 1/2 쫑쫑 썰어주세요', 'image_url': 'https://recipe1.ezmember.co.kr/cache/recipe/2022/06/14/05620e6f9b96cd051a1055d05e04d6531.jpg'}, {'step_number': 4, 'description': '식용유 한큰술 냄비에 두르고 파 넣고 볶아줍니다.', 'image_url': 'https://recipe1.ezmember.co.kr/cache/recipe/2022/06/14/7afbd258400db961a5324203c20497ce1.jpg'}, {'step_number': 5, 'description': '양파도 넣고 볶다가 양파 살짝 투명색일때 고추가루 넣어서 볶아주세요.', 'image_url': 'https://recipe1.ezmember.co.kr/cache/recipe/2022/06/14/238c3585354315d893e52aecc20891da1.jpg'}, {'step_number': 6, 'description': '고추가루랑 잘 버무러지면 생수 200미리 낳어주세요', 'image_url': 'https://recipe1.ezmember.co.kr/cache/recipe/2022/06/14/12f4aeac07a62b44a2a3d0f734651a7c1.jpg'}, {'step_number': 7, 'description': '국간장 넣고 팔팔끓여줍니다.', 'image_url': 'https://recipe1.ezmember.co.kr/cache/recipe/2022/06/14/4812c2dd6d64db6a4272850a85d9df231.jpg'}, {'step_number': 8, 'description': '끓기시작하면 순두부 넣어주세요. 이때 간 보면서 짜면 생수 좀더 추가. 싱거우면 소금 살짝넣어주세요', 'image_url': 'https://recipe1.ezmember.co.kr/cache/recipe/2022/06/14/f2d69b69a18a588611f4e7a11d52f7fb1.jpg'}, {'step_number': 9, 'description': '바지락도 넣어 한 번끓이면 조개가 입벌릴꺼에요. 그럼 불끄고 고추 반개씩 썰어서 넣어주면 완성.', 'image_url': 'https://recipe1.ezmember.co.kr/cache/recipe/2022/06/14/06f9ebdebc65e241049ffcefc41057b41.jpg'}]"
53808,찌개,일상,해물류,끓이기,조개된장국 1인분 조개된장찌개 끓이는 법,조개된장국,"1,592",20분 이내,초급,1인분,"[('조개', '200g'), ('양파', '1/4개'), ('감자', '1/2개'), ('청양고추', '조금'), ('홍고추', '조금'), ('된장', '1/2큰술'), ('국간장', '1큰술'), ('다진마늘', '1/2큰술'), ('고춧가루', '1작은술'), ('물', '3컵'), ('멸치다시팩', '1개'), ('두부', '1/4모')]","저희는 고기 구워 먹을 때 조개된장찌개를 끓여서 같이 먹고 해요.
청양고추 넣어서 얼큰하게 만들어 놓으면 고기의 기름기가 싹 씻기면서 너무 맛있더라고요.
물론 그냥 먹어도 조개의 감칠맛이 그대로 전해져서 너무 맛있습니다.

​1~2인분 양입니다.
시원 칼칼한 맛이에요.
너무 맛있습니다.
​조개 감칠맛 느껴지는 된장찌개 맛있게 끓여드세요~ :)","[{'step_number': 1, 'description': '조개 해감할 때는 그릇에 찬물과 소금을 넣고 스테인리스 도구 2~3개씩 넣고 검은 비닐로 싸주세요.\n3시간 정도 냉장고에 넣어 놓으면 조개가 알아서 이물질을 뱉어냅니다.\n마트에서 해감된 조개를 구매해도 이물질이 나오더라고요.\n귀찮아도 이 과정을 한번 하는 게 맘이 편해요.조개는 어두운 곳에 스테인리스를 같이 넣으면 이물질을 더 잘 뱉어냅니다. 스테인리스 그릇 있으면 거기에 넣어서 동봉해주면 더 좋아요.\n저는 밝은 그릇밖에 없어서 스테인리스 도구 넣고 검은 비닐로 꽁꽁 감싸서 넣었습니다.', 'image_url': 'https://recipe1.ezmember.co.kr/cache/recipe/2022/10/25/3eb6d8f4d066d567d43e5e4fa16c7a291.jpg'}, {'step_number': 2, 'description': '감자, 양파, 두부 모두 먹기 좋게 잘라줍니다.\n조개는 동죽 준비했습니다.\n미리 해감해 놓습니다.', 'image_url': 'https://recipe1.ezmember.co.kr/cache/recipe/2022/10/25/bb2f4af571f56879dfa36c8cd2d1e93f1.jpg'}, {'step_number': 3, 'description': '작은 뚝배기에 물 3컵 (600ml)과 멸치다시팩 1개 넣어서 팔팔 끓여주세요.\n물이 끓으면 중불로 내려 10분간 우려냅니다.', 'image_url': 'https://recipe1.ezmember.co.kr/cache/recipe/2022/10/25/3e4539fce60133904eb2c530d0e14d9d1.jpg'}, {'step_number': 4, 'description': '10분 후에 멸치다시팩은 건져내고 된장 1/2큰술을 풀어서 넣어주세요.\n저는 국물을 깔끔하게 먹는 게 좋아서 체에 걸러서 풀었습니다.', 'image_url': 'https://recipe1.ezmember.co.kr/cache/recipe/2022/10/25/ad01f894b211c3d24cce844112aac94c1.jpg'}, {'step_number': 5, 'description': '그리고 감자와 양파를 넣고 다진마늘 1/2큰술과 국간장 1큰술 넣어서 4~5분간 중불로 끓여주세요.', 'image_url': 'https://recipe1.ezmember.co.kr/cache/recipe/2022/10/25/5a807463ca1683e96a8e4be0a0aa38001.jpg'}, {'step_number': 6, 'description': '감자가 익었으면 조개, 청양고추, 홍고추, 두부, 그리고 고춧가루 1작은술을 넣어 한번 보글보글 끓여줍니다.', 'image_url': 'https://recipe1.ezmember.co.kr/cache/recipe/2022/10/25/4d2e1e23d394a2a98773b5071cf0e63d1.jpg'}, {'step_number': 7, 'description': '생기는 거품은 걷어주세요.\n보글보글 끓다가 조개가 입을 벌리면 완성입니다.', 'image_url': 'https://recipe1.ezmember.co.kr/cache/recipe/2022/10/25/aa901886f793e484356af4aa47548b661.jpg'}]"
53809,찌개,일상,해물류,끓이기,"제철 굴, 소고기, 채소를 듬뿍넣고 끓인 영양만점 “굴 전골” 레시피",굴전골,615,60분 이내,아무나,2인분,"[('굴', '300g'), ('소고기', '150g'), ('양파', '1개'), ('대파', '1개'), ('무', '200g'), ('당근', '1/2개'), ('알배추', '3~4장'), ('표고버섯', '3개'), ('청양고추', '적당량'), ('간장', '1.5큰술'), ('설탕', '1/2큰술'), ('다진대파', '1큰술'), ('다진마늘', '1작은술'), ('후추', '조금'), ('참기름', '1/2큰술'), ('물', '500ml'), ('국물용 멸치', '1줌'), ('다시마', '4~5장'), ('간장', '1큰술')]","쌀쌀하게 찬바람이 부는 계절, 따뜻하고 시원하게 속을 채워줄 굴전골 레시피입니다. 지금 제철인 싱싱한 굴과, 각종채소 그리고 소고기도 넣어 시원하고 담백한 굴전골로 영양보충 해보세요~^^","[{'step_number': 1, 'description': '굴은 껍질이나 불순물이 있는 경우도 있으니 깨끗하게 손질 후, 소금물에 살짝 흔들어 씻어주세요.굴300g굴 손질법 레시피', 'image_url': 'https://recipe1.ezmember.co.kr/cache/recipe/2022/11/04/7d6af98d5f5e0afbd417b51d683ec2421.jpg'}, {'step_number': 2, 'description': '소고기는 먹기좋은 크기로 썰어, 양념장과 잘 버무려주세요.\n*고기의 양은 늘리셔도 되는데, 이 전골은 굴이 메인이라 고기를 적게 사용했어요*\n소고기150g,간장 1.5큰술, 설탕 1/2큰술, 다진대파 1큰술, 다진마늘 1작은술, 후추, 참기름 조금', 'image_url': 'https://recipe1.ezmember.co.kr/cache/recipe/2022/11/04/2e402f51579341fdd0fbc7f04207f9451.jpg'}, {'step_number': 3, 'description': '모든 채소도 먹기 좋은 크기로 채 썰어주세요.양파1개,당근 1/2개 ,대파1개,무200g,알배추3~4장,표고버섯 3개 ,청양고추(기호에 따라 준비)', 'image_url': 'https://recipe1.ezmember.co.kr/cache/recipe/2022/11/04/c7682ebbf9d3b71a1cf2909b2ed47ef11.jpg'}, {'step_number': 4, 'description': '물 500ml에 멸치와 다시마를 넣고, 간장 1큰술을 넣어 끓여주세요.\n물이끓어오르기전에 모든재료를 넣고, 물이 끓어오르면 다시마만 먼저 건져주신후 몇분 더 끌여주세요.물500ml,멸치,다시마', 'image_url': 'https://recipe1.ezmember.co.kr/cache/recipe/2022/11/04/7412670f600c9d738dc7ffb1192e8efe1.jpg'}, {'step_number': 5, 'description': '육수를 끓일동안, 전골냄비 가장아래에 양파를 깔아주세요.\n가운데가 오목하게 패인 전골냄비면 더 좋아요.', 'image_url': 'https://recipe1.ezmember.co.kr/cache/recipe/2022/11/04/e11096fc6239e829c01b033ffec438d11.jpg'}, {'step_number': 6, 'description': '채썰어둔 모든채소와 소고기를 차곡차곡 담아주세요.', 'image_url': 'https://recipe1.ezmember.co.kr/cache/recipe/2022/11/04/277aa108390b845f474f3108ad694f001.jpg'}, {'step_number': 7, 'description': '마지막으로 가운데 굴을 듬뿍 올려주면\n전골준비 끝! \n재료만 손질해서 담으면 끝인 전골요리,\n간단하죠?', 'image_url': 'https://recipe1.ezmember.co.kr/cache/recipe/2022/11/04/55fee0d1e1c1072b15c3a9ffce1f550b1.jpg'}, {'step_number': 8, 'description': '냄비 가장자리에 육수를 붓고 끓여주세요.', 'image_url': 'https://recipe1.ezmember.co.kr/cache/recipe/2022/11/04/f3c7b1f42a69e4b41aa4e991a876b58a1.jpg'}, {'step_number': 9, 'description': '청양고추는 기호에맞게 개수는 가감해주세요~청양고추', 'image_url': 'https://recipe1.ezmember.co.kr/cache/recipe/2022/11/04/a3646bcbbebae2ec6db335eec28f70f41.jpg'}, {'step_number': 10, 'description': '굴이 익고 채소의 숨이 적당히 죽었을때, 불을 끄고 참기름1/2큰술을 넣어 마무리해주시면 끝! 국물이 더 고소하고 맛있어져요~~참기름 1/2큰술', 'image_url': 'https://recipe1.ezmember.co.kr/cache/recipe/2022/11/04/dfdbc16f4e052e8dd2f260a7b510937b1.jpg'}, {'step_number': 11, 'description': '오동통한 굴과 채소에서 우러나오는 시원하고 달콤한 국물과 고기육수.. 참 맛있어요~~~^^ 나중에 남은 육수에 칼국수 해먹어도 맛있답니다!', 'image_url': 'https://recipe1.ezmember.co.kr/cache/recipe/2022/11/04/a3a055bcbe4bf216ac256756d7e6c7141.jpg'}]"
53810,찌개,일상,해물류,끓이기,저염명란 백명란젓으로 만드는 명란젓국찌개,명란젓국,838,10분 이내,아무나,2인분,"[('백 명란', '3줄'), ('두부', '1/3모'), ('송화 버섯', '2개'), ('청양고추', '1개'), ('홍고추', '1/3개'), ('다진마늘', '1/2T'), ('다싯물', '1컵')]","저염명란

백명란젓으로 끓이는 

명란젓국찌개 입니다","[{'step_number': 1, 'description': '히카마는 나박썰고\n두부는 깍뚝썰어 준비 합니다\n송화버섯\n청양고추, 홍고추, 다진마늘 준비했어요', 'image_url': 'https://recipe1.ezmember.co.kr/cache/recipe/2022/11/06/90797fa99a2d930420c2e20dd7f0d0971.png'}, {'step_number': 2, 'description': '냄비에 다싯물 붓고\n히카마 넣고 끓여요\n히카마대신 무 사용하면 됩니다\n저는 히카마가 있어서 사용했어요', 'image_url': 'https://recipe1.ezmember.co.kr/cache/recipe/2022/11/06/11dc931fc035b5b16edfc3e71e38e1631.jpg'}, {'step_number': 3, 'description': '끓으면 송화버섯, 두부 넣고\n끓여요', 'image_url': 'https://recipe1.ezmember.co.kr/cache/recipe/2022/11/06/22b65444a52e04deec5b5f53e28565da1.png'}, {'step_number': 4, 'description': '명란은 가위로 절반 잘라서\n사용 합니다', 'image_url': 'https://recipe1.ezmember.co.kr/cache/recipe/2022/11/06/20c0285a8f05b02976d83e50a1f8abd01.jpg'}, {'step_number': 5, 'description': '다진마늘\n청, 홍고추도 넣어 줍니다\n간은 액젓으로 했어요', 'image_url': 'https://recipe1.ezmember.co.kr/cache/recipe/2022/11/06/e0ff209acfb31c91a5db317e0be53e1a1.png'}, {'step_number': 6, 'description': '한 소끔 끓여 마무리~~', 'image_url': 'https://recipe1.ezmember.co.kr/cache/recipe/2022/11/06/6add6a0cc13d018cf3773835e3e1cd321.jpg'}]"
53811,찌개,일상,해물류,끓이기,우리집만의 비법이 담긴 청국장찌개 꼬막청국장,청국장찌개,"1,605",30분 이내,초급,3인분,"[('꼬막', '300g'), ('소금', '1스푼'), ('청국장', '5스푼'), ('된장', '1스푼'), ('두부', '1/2모'), ('꽃게 다리', '5개'), ('무', '80g'), ('파', '30g'), ('양파', '60g'), ('애호박', '60g'), ('삭힌 고추', '3개'), ('고춧가루', '0.5스푼'), ('생강즙', '2티스푼'), ('황설탕', '2티스푼'), ('다진마늘', '0.5스푼'), ('소금', '약간')]","세월의 맛이 고스란히 묻어 있는 우리집만의 비법으로 만든 겨울 별미 청국장요리 꼬막청국장입니다
한국인의 소울푸드 청국장은 시간과 정성이 만들어낸 우리나라 대표적인 슬로우 힐링푸드이지요~
사먹는 청국장도 맛있지만 우리집은 오래전부터 집에서 청국장을 띄워 먹었어요~
이맘때쯤 되면 콩을 삶아 청국장 넉넉히 띄워 지퍼백에 소분해 냉동시켜 두었다 겨울내 먹는데 
집에서 정성들여 만든 청국장이라 파는 청국장과는 맛이 완전 달라요~
어릴적 할머니는 청국장 띄울때 콩을 삶아 짚을 넣고 아랫목에 이불을 겹겹이 덮어 띄우셨는데
요즘은 바쁘기도 하고 거주환경이 옛 전통방식으로 띄우기는 쉽지 않아요~
요즘은 좋은 조리도구가 많이 나와 청국장 띄우는 밥솥에 
띄워 먹는데 꼬릿한 냄새가 전혀 안나 넘 맛있더라구요~
청국장에 주로 신김치나 소고기를 넣고 끓여 먹는데 우리집은 꼬막을 넣고 끓여 먹는답니다
청국장이 조개랑 궁합이 좋은데 바지락이나 백합, 모시조개등 
다양한 조개 넣고 끓여 먹는데 그중에 최고는 바로 꼬막입니다
오래전부터 대대로 끓여 먹어 왔던 우리집 비법이 담긴 청국장입니다
할머니 고향이 순천인데 다양한 요리에 꼬막을 넣어 드셨다고 해요~
청국장에 꼬막이 들어가면 구수하고 시원한 국믈 맛이 일품입니다
탱글탱글 쫄깃한 꼬막도 건져 살 발라 까 먹는 재미도 쏠쏠합니다
우리집 청국장 비법 육수는 꽃게다리로 국물을 내고 삭힌고추가 들어가는게 특징입니다","[{'step_number': 1, 'description': '재료 준비해 주세요~', 'image_url': 'https://recipe1.ezmember.co.kr/cache/recipe/2022/11/18/83aef824735035037eca277766dbebc51.jpg'}, {'step_number': 2, 'description': '꼬막은 굵은소금 1스푼 넣은 소금물에 2시간 정도 담가 해감 시킨 후 \n꼬막을 서로 부딪혀 비벼가며 깨끗이 씻어 주면 주세요~', 'image_url': 'https://recipe1.ezmember.co.kr/cache/recipe/2022/11/18/aee929f1e7f168ee44273d2a8adf93501.jpg'}, {'step_number': 3, 'description': '깨끗이 손질한 꼬막입니다', 'image_url': 'https://recipe1.ezmember.co.kr/cache/recipe/2022/11/18/9bbe291b4a7a8d5d64f5ec0e290809691.jpg'}, {'step_number': 4, 'description': '무는 나박썰기하고 두부, 양파,\n애호박은 먹기 좋은 사이즈로 썰고 \n파는 송송 썰어 주면 재료 준비가 끝납니다', 'image_url': 'https://recipe1.ezmember.co.kr/cache/recipe/2022/11/18/574026cedf761d26c68aff320a2c037c1.jpg'}, {'step_number': 5, 'description': '냄비에 쌀뜬물 700ml 정도 붓고 꽃게다리 넣고 \n15분~20분 정도 끓여 준 후 꽃게다리는 건져 내 주세요~꽃게다리 없으면 다시팩이나 멸치육수 사용하면 됩니다', 'image_url': 'https://recipe1.ezmember.co.kr/cache/recipe/2022/11/18/e215f9af262297307d4d8445776de65f1.jpg'}, {'step_number': 6, 'description': '무 넣고 된장 1스푼 풀어 준 후 \n꼬막 넣고 10분 정도 더 끓여 준 후 \n삭힌고추와 양파, 애호박을 차례대로 넣어 주세요~우리집만의 비법이 삭힌고추인데 삭힌고추가 없다면 청양고추 넣고 만드시면 됩니다', 'image_url': 'https://recipe1.ezmember.co.kr/cache/recipe/2022/11/18/b0d0e9cde920c438e6d87c439e6d9d621.jpg'}, {'step_number': 7, 'description': '애호박과 양파과 익으면 두부와 청국장을 넣고 3분 정도만 더 끓여 주세요~집에서 만든 심심한 청국장이라 5스푼 정도 넣었는데\n집집마다 청국장 간이 다르니 가감해 넣어 주세요~', 'image_url': 'https://recipe1.ezmember.co.kr/cache/recipe/2022/11/18/6ad35bc31a8caff2322dd517bb5cdba11.jpg'}, {'step_number': 8, 'description': '적힌 분량의 황설탕, 생강즙, 다진마늘, 고춧가루를 넣고\n3분 더 끓여 준 후 간 보고 부족한 간은 소금으로 맞춰 주세요~', 'image_url': 'https://recipe1.ezmember.co.kr/cache/recipe/2022/11/18/2ea015f13c9c411bcb26d5c15414442c1.jpg'}, {'step_number': 9, 'description': '마지막에 송송 썰은 파 넣고 한번\n한소끔 후루룩 끓여 주면 꼬막청국장 완성!', 'image_url': 'https://recipe1.ezmember.co.kr/cache/recipe/2022/11/18/187a438a0707e3aed6184b55f6b2b44b1.jpg'}]"
