index,종류별,상황별,재료별,방법별,글 제목,레시피이름,조회수,조리시간,난이도,인분,재료,소개글,조리순서
10915,밑반찬,일상,버섯류,볶음,고기느타리버섯(산타리 품종) 버섯듬뿍잡채!!!,버섯잡채,724,30분 이내,아무나,4인분,"[('고기느타리버섯', '100g'), ('당근', '1/2개'), ('양파', '1개'), ('피망', '1/2개')]",버섯이 있으면 버섯잡채를 만들어보고 싶어서 야채듬뿍 넣어서 만든 잡채 올추석에 먹으면 너무 좋은 요리레시피입니다.,"[{'step_number': 1, 'description': '고기느타리버섯 1팩을 넉넉하게 넣으려고 합니다.', 'image_url': 'https://recipe1.ezmember.co.kr/cache/recipe/2021/09/10/dd1a29742b4026bcf89d0a6f836d10f01.jpg'}, {'step_number': 2, 'description': '고기맛이 나는 버섯으로 유명한 산타리 품종은 고기를 넣지 않고도 고기맛을 낼수 있는게 특징입니다. 버섯듬뿍 넣은 잡채를 만들었습니다.', 'image_url': 'https://recipe1.ezmember.co.kr/cache/recipe/2021/09/10/5fd14bec4c0ba11570d0a557a0b228181.jpg'}, {'step_number': 3, 'description': '고기느타리버섯은 볶음, 무침, 전으로 즐겨도 좋은 다양한 요리를 선보일듯합니다.', 'image_url': 'https://recipe1.ezmember.co.kr/cache/recipe/2021/09/10/3763aa4b88def32686ee8e214be77b641.jpg'}, {'step_number': 4, 'description': '오늘의 주인공은 바로 고기느타리버섯이니 만큼 고기는 따로 준비하지 않고 야채들로만 준비합니다.\n당근, 피망, 양파, 부추약간 채썰어서 준비합니다.', 'image_url': 'https://recipe1.ezmember.co.kr/cache/recipe/2021/09/10/398e31e6858747d262ff83f13a6101e21.jpg'}, {'step_number': 5, 'description': '야채들은 모두 후라이팬에 골고루 볶아주세요.', 'image_url': 'https://recipe1.ezmember.co.kr/cache/recipe/2021/09/10/108ae9ec9501663095983137394872aa1.jpg'}, {'step_number': 6, 'description': '오늘의 주인공 고기느타리버섯도 씻은후 그대로 야채들과 함께 볶아주세요. 버섯의 씹히는 느낌이 좋습니다.(버섯은 삶을 필요없습니다.)', 'image_url': 'https://recipe1.ezmember.co.kr/cache/recipe/2021/09/10/df3fcf9f311fc28f498f2522968e327b1.jpg'}, {'step_number': 7, 'description': '어느정도 볶아지면 부추를 썰어서 함께 살짝 볶아주세요.부추는 야채를 볶는 열기로 볶아주세요.', 'image_url': 'https://recipe1.ezmember.co.kr/cache/recipe/2021/09/10/b9dce87aec427d8e8524e0c452c519c71.jpg'}, {'step_number': 8, 'description': '당면을 삶은후 간장양념을 넣어서 통깨만 함께 먼저 버무려 주세요.', 'image_url': 'https://recipe1.ezmember.co.kr/cache/recipe/2021/09/10/6906f33f1f706ca615c41dce98207ced1.jpg'}, {'step_number': 9, 'description': '양념한 당면과 볶은 야채들을 모두 섞어주세요.', 'image_url': 'https://recipe1.ezmember.co.kr/cache/recipe/2021/09/10/60839d1512eaa13ea7380eb53dd73b461.jpg'}, {'step_number': 10, 'description': '고기없이 고기맛을 정말로 버섯으로 맛을 낼수 있을까? 고민하지 마세요. 고기느타리버섯이면 충분합니다.', 'image_url': 'https://recipe1.ezmember.co.kr/cache/recipe/2021/09/10/0944ea94e1367d6a328534cedae9e32d1.jpg'}, {'step_number': 11, 'description': '완성된 잡채를 예쁜접시에 담아주세요.', 'image_url': 'https://recipe1.ezmember.co.kr/cache/recipe/2021/09/10/41f843d38da3cd136eac487552dacb4b1.jpg'}, {'step_number': 12, 'description': '이번 명절에 딱 어울릴것만 같은 잡채, 느끼함 없이 담백하답니다.', 'image_url': 'https://recipe1.ezmember.co.kr/cache/recipe/2021/09/10/7cde5d5c034d2ff5ad4efc8db55fe9521.jpg'}, {'step_number': 13, 'description': '고기잡채 부럽지 않은 고기느타리버섯 듬뿍 잡채가 완성되었습니다.', 'image_url': 'https://recipe1.ezmember.co.kr/cache/recipe/2021/09/10/f22b6f5e275d76e6287a1233ff3fb3211.jpg'}]"
10916,밑반찬,일상,버섯류,볶음,3색 모둠 느타리 버섯 계란말이 (백선/순정/곤지7호),느타리버섯계란말이,245,15분 이내,초급,2인분,"[('계란', '3개'), ('3색모둠 느타리버섯', '100g'), ('굴소스', '2T'), ('우유', '3T'), ('올리브유', '2T')]",몸에 좋은 버섯을 어떻게 하면 거부감 없이 친숙하게 먹을 수 있을까 생각하다 만들어 보았어요.,"[{'step_number': 1, 'description': '3색모둠 느타리 버섯(백선/순정/곤지7호)을 한입에 먹기 좋은 크기로 잘라 물에 씻어 손질해줍니다.3색모둠 느타리 버섯(백선/순정/곤지7호)버섯 손질법 레시피', 'image_url': 'https://recipe1.ezmember.co.kr/cache/recipe/2021/09/12/6a804960f7d95b26e5b57d2b25d5caea1.jpg'}, {'step_number': 2, 'description': '프라이팬에 올리브유 1T를 둘러 버섯을 넣어 약불로 5분간 볶고 겉부분이 살짝 탔을 때 굴소스 2T를 넣어 볶고 임시그릇에 잠시 담아둡니다.올리브유 1T, 굴소스 2T', 'image_url': 'https://recipe1.ezmember.co.kr/cache/recipe/2021/09/12/95b1696e586b407bb7ef5f6807200dc21.jpg'}, {'step_number': 3, 'description': '계란 3개를 풀어 우유 3T와 함께 잘 저은 뒤, 올리브유를 두른 \n계란말이용 후라이팬에 이를 절반만 붓습니다.올리브유 1T, 계란 3개, 우유 3T불은 약불로 해야 계란말이 색이 예쁘게 나옵니다.', 'image_url': 'https://recipe1.ezmember.co.kr/cache/recipe/2021/09/12/9aeada10e85c4a3d60032b31410fdbcb1.jpg'}, {'step_number': 4, 'description': '계란물 위에 볶은 버섯을 올리고 어느 정도 앞부분이 익었을 즈음 젓가락과 뒤집개를 사용해 계란을 말아줍니다.너무 많은 양의 버섯을 사용하면 계란말이가 쉽게 터질 수 있어요!', 'image_url': 'https://recipe1.ezmember.co.kr/cache/recipe/2021/09/12/529698f4cdf69590a6fde231269cfd841.jpg'}, {'step_number': 5, 'description': '버섯계란말이를 한 번 말은 다음, 절반의 계란물을 추가로 부어 step4와 똑같은 과정을 한번 더 반복합니다.', 'image_url': 'https://recipe1.ezmember.co.kr/cache/recipe/2021/09/12/2dd5fa5acf6a6b6df30021b1243a69b81.jpg'}, {'step_number': 6, 'description': '맛있는 3색 모둠 느타리 버섯 계란말이 완성!!!', 'image_url': 'https://recipe1.ezmember.co.kr/cache/recipe/2021/09/12/b37f43b22cf0bfa9ee99c7068e2c03d91.jpg'}]"
10917,밑반찬,일상,버섯류,볶음,모듬버섯잡채,모듬버섯잡채,"1,588",30분 이내,아무나,4인분,"[('애호박', '1/2개'), ('빨간파프리카', '1/2개'), ('맛타리버섯', '1팩'), ('표고버섯', '5개'), ('팽이버섯', '1개'), ('양파 중간크기', '1개'), ('다진마늘', '1/2큰술'), ('식용유', '2큰술'), ('후추', '조금'), ('소금', '1/2작은술'), ('진간장', '1큰술')]",건강에 좋은 버섯을 맛있게 많이 먹을수 있는 반찬이에요^^,"[{'step_number': 1, 'description': '재료를 준비해요', 'image_url': 'https://recipe1.ezmember.co.kr/cache/recipe/2020/11/19/a8671fdd622cc2512bf5c214c4164a781.jpg'}, {'step_number': 2, 'description': '재료 손질을 해요', 'image_url': 'https://recipe1.ezmember.co.kr/cache/recipe/2020/11/19/cc2a535aa619abe9dee0c16b5f1189ac1.jpg'}, {'step_number': 3, 'description': '팬에 식용유를 두르고채썬 양파와 파프리카,다진마늘을 \n한번에 다 넣고볶다가', 'image_url': 'https://recipe1.ezmember.co.kr/cache/recipe/2020/11/19/7199cc64d120772bf3a93414ca492c601.jpg'}, {'step_number': 4, 'description': '애호박을 넣고 볶다가', 'image_url': 'https://recipe1.ezmember.co.kr/cache/recipe/2020/11/19/449b0b386c0a93f3441ecf5187e8edc31.jpg'}, {'step_number': 5, 'description': '소금을 넣고 볶다가 야채가 숨이 죽으면', 'image_url': 'https://recipe1.ezmember.co.kr/cache/recipe/2020/11/19/c3ebbb88b5d863c4a36df93606b50e9a1.jpg'}, {'step_number': 6, 'description': '버섯을 모두 넣고', 'image_url': 'https://recipe1.ezmember.co.kr/cache/recipe/2020/11/19/ecf59cb841b606f8651bc68fa7d51b4c1.jpg'}, {'step_number': 7, 'description': '진간장을 넣고 볶아 주세요', 'image_url': 'https://recipe1.ezmember.co.kr/cache/recipe/2020/11/19/d342ae2207f73bedd28e3e1d87c0f5de1.jpg'}, {'step_number': 8, 'description': '버섯을 넣고 나면 빠르게 볶아주세요\n버섯에서 물이나니까요', 'image_url': 'https://recipe1.ezmember.co.kr/cache/recipe/2020/11/19/00aa1bf2a8a92744231664d05ac371e71.jpg'}, {'step_number': 9, 'description': '후추도 조금 넣고 마무리', 'image_url': 'https://recipe1.ezmember.co.kr/cache/recipe/2020/11/19/51baf3e8b3238307088310764e368b121.jpg'}]"
10918,밑반찬,일상,버섯류,볶음,샐러리 느타리버섯볶음 만드는 법 다이어트음식으로도 좋겠어요.,느타리버섯볶음,"2,638",10분 이내,초급,4인분,"[('느타리버섯', '350g'), ('샐러리', '70g'), ('당근', '50g'), ('양파', '120g'), ('다진마늘', '1T'), ('마른고추', '2개'), ('진간장', '2T'), ('매실청', '1T'), ('참기름', '1T'), ('참깨', '1T'), ('후추', '톡톡'), ('올리브오일', '1T')]","매일반찬으로 느타리버섯 볶음을 만들었어요.
샐러리 조금 넣었는데 은은한 샐러리 향이 정말 좋네요.
조금 싱겁다 싶게 만들었더니 다이어트음식으로도 좋겠더라구요.","[{'step_number': 1, 'description': '느타리버섯과 냉장고속 짜투리 채소들 준비 했어요.', 'image_url': 'https://recipe1.ezmember.co.kr/cache/recipe/2021/01/04/c13549dfd4a668381cd114ffa7194b4a1.jpg'}, {'step_number': 2, 'description': '샐러리, 당근, 양파는 비슷한 크기로 채썰어 줍니다.', 'image_url': 'https://recipe1.ezmember.co.kr/cache/recipe/2021/01/04/67990a0e966dae337adc6df7cd89c2b51.jpg'}, {'step_number': 3, 'description': '느타리버섯은 끓는 물에 가볍게 데치고\n찬물에 행구어\n물기를 꼭 짜주고, \n가늘게 찢어 줍니다.', 'image_url': 'https://recipe1.ezmember.co.kr/cache/recipe/2021/01/04/dab94e0b27be53a12d4ff17ebf49b4a91.jpg'}, {'step_number': 4, 'description': '팬에 올리브오일 두르고\n다진마늘과 마른고추를 넣고 볶아 줍니다.', 'image_url': 'https://recipe1.ezmember.co.kr/cache/recipe/2021/01/04/dfd1fb29cbd520d8ef6240c54a6b93161.jpg'}, {'step_number': 5, 'description': '마늘향이 올라오면\n양파, 당근을 넣고 가볍게\n휘리릭~~', 'image_url': 'https://recipe1.ezmember.co.kr/cache/recipe/2021/01/04/a5c9aca9276a472fb928d3467a45b0e91.jpg'}, {'step_number': 6, 'description': '샐러리도 넣고 볶아 줍니다.', 'image_url': 'https://recipe1.ezmember.co.kr/cache/recipe/2021/01/04/7d53580cd65cb7587aa7e923f3f4db4f1.jpg'}, {'step_number': 7, 'description': '채소들 숨이 죽으면\n느타리버섯을 넣고 \n진간장, 매실청을 넣고 가볍게 볶아 줍니다.\n간이 부족하면 간장으로 더해 줍니다.\n저는 다이어트음식으로 만들어서 조금 싱겁게 만들었어요.', 'image_url': 'https://recipe1.ezmember.co.kr/cache/recipe/2021/01/04/b6a35ddd0af4666bd919f767b9f668321.jpg'}, {'step_number': 8, 'description': '참기름과 참깨를 넣어 마무리 해주고\n후추도 조금 뿌려 줍니다.', 'image_url': 'https://recipe1.ezmember.co.kr/cache/recipe/2021/01/04/78cac4279326616c1506d84b43a042781.jpg'}]"
10919,밑반찬,일상,버섯류,볶음,초간단 밑반찬- 구수한 들깨 느타리버섯볶음/ 들깨 느타리버섯 브로콜리 볶음 만드는 법,느타리버섯볶음,"1,438",20분 이내,초급,3인분,"[('느타리버섯', '200g'), ('브로콜리', '150g'), ('대파', '0.5대'), ('다진 마늘', '1스푼'), ('들기름', '조금'), ('통깨', '약간'), ('진간장', '1.5T'), ('멸치 액젓', '1T'), ('들깨가루', '2T')]","수분이 많은 느타리버섯은 끓는 물에 한번 데친 후 볶아야 물기가 생기지가 않는데 이번엔 들깨가루를 더할 예정이기에 데치는 과정은 생략했고 브로콜리만 가볍게 데쳐 만들어 보았어요.

​","[{'step_number': 1, 'description': '느타리버섯은 밑동을 제거해 주고 먹기 좋은 크기로 찢어 주세요.\n깨끗하게 세척한 브로콜리는 한 입 크기로 썰어주세요.', 'image_url': 'https://recipe1.ezmember.co.kr/cache/recipe/2023/03/07/12462d4744b54d885f38ba8ffa1a65491.jpg'}, {'step_number': 2, 'description': '냄비에 물을 넣고 소금 0.5스푼을 넣고 끓여주세요.\n끓기 시작하면 브로콜리를 넣고 1분 내로 데쳐주세요.\n한 번 더 볶아 줄 예정이기에 살짝만 데쳐주시면 돼요.\n데친 후 차가운 물에 헹궈주고 물기를 제거해 주세요.', 'image_url': 'https://recipe1.ezmember.co.kr/cache/recipe/2023/03/07/55917434d93a3ad0b6e20a8820df9d141.jpg'}, {'step_number': 3, 'description': '팬에 적당량의 기름을 두르고 다진 마늘 1스푼, 대파를 넣고 볶아주세요.', 'image_url': 'https://recipe1.ezmember.co.kr/cache/recipe/2023/03/07/4ad38f4724e639fbc39f668ebdf852cb1.jpg'}, {'step_number': 4, 'description': '파 기름이 나오기 시작하면 느타리버섯을 넣고 달달 볶아주세요.', 'image_url': 'https://recipe1.ezmember.co.kr/cache/recipe/2023/03/07/c88237d8f0114cb2bed9a6bdb64c02821.jpg'}, {'step_number': 5, 'description': '느타리버섯이 어느 정도 익기 시작하면 브로콜리도 넣고 함께 볶아주세요.', 'image_url': 'https://recipe1.ezmember.co.kr/cache/recipe/2023/03/07/2859161bc698f74d9cea4df9567a9ac71.jpg'}, {'step_number': 6, 'description': '수분이 적당히 배어 나오면 진간장 1.5T, 멸치 액젓 1T를 넣고 가볍게 섞어주면 볶아주세요.\n(입맛에 맞게 간은 조절해 주세요.)', 'image_url': 'https://recipe1.ezmember.co.kr/cache/recipe/2023/03/07/577490e718594abc142b1950be2622ec1.jpg'}, {'step_number': 7, 'description': '다 볶아지면 들깨가루 2T를 넣고 잘 섞어주세요.\n자작하게 생긴 수분들이 금방 사라질 거랍니다.', 'image_url': 'https://recipe1.ezmember.co.kr/cache/recipe/2023/03/07/05caac5286842ec558c71cd892af8ea71.jpg'}, {'step_number': 8, 'description': '마지막으로 들기름을 적당량 둘려주세요.', 'image_url': 'https://recipe1.ezmember.co.kr/cache/recipe/2023/03/07/264222704a77e122b0a2635fb5f87eab1.jpg'}, {'step_number': 9, 'description': '원하는 그릇에 담고 통깨까지 솔솔 뿌려주면 최종 완성이 되는 들깨 느타리버섯 브로콜리 볶음!!', 'image_url': 'https://recipe1.ezmember.co.kr/cache/recipe/2023/03/07/19dfbf5f3c150f921f7c551cc964a46e1.jpg'}]"
10920,밑반찬,일상,버섯류,볶음,간단한 반찬 새우 표고버섯볶음 만드는 법 정말 간단해요.,표고버섯새우볶음,"1,301",30분 이내,아무나,4인분,"[('표고버섯', '6개'), ('새우살', '200g'), ('대파', '1/2개'), ('양파', '1/2개'), ('당근', '1/4개'), ('식용유', '3T'), ('다진마늘', '1T'), ('굴소스', '1T'), ('참기름', '1T'), ('볶은참깨', '1T')]","저는 손이 많이 가는 반찬은 절레절레, 간단하게 뚝딱 만들 수 있으면서도 맛있는 반찬을 선호합니다. 그래서 오늘 만든 반찬은 새우 표고버섯볶음입니다. 반찬 만들기 위해서 시장에서 장 보는 것도 시간 아까워서 집에 있는 재료만 사용해서 반찬 만들려고 하니까 새우 표고버섯볶음이 생각났습니다. 표고버섯, 자투리 채소 등 표고버섯볶음 만들 수 있는 재료는 있고 더불어 냉동실에 얼려 놓은 새우살도 있고! ""근데 집에 표고버섯은 언제부터 있었지!?"" ""어머니께서 언제 사다 놓으셨나?"" 이런들 어떠하리 저런들 어떠하리 먼저 쓰는 사람이 임자! 그럼 지금 바로 새우 표고버섯볶음 만드는 법을 알려드립니다.","[{'step_number': 1, 'description': '대파는 반으로 가르고 0.3cm 간격으로 썰어 준비합니다.도마 , 요리용나이프', 'image_url': 'https://recipe1.ezmember.co.kr/cache/recipe/2023/03/09/8339e08805bf8fe470d714f0bb8d62d91.jpg'}, {'step_number': 2, 'description': '양파, 당근은 0.3cm 간격으로 썰어 준비합니다.', 'image_url': 'https://recipe1.ezmember.co.kr/cache/recipe/2023/03/09/01183d1ab197fde2b709b159f3e708471.jpg'}, {'step_number': 3, 'description': '표고버섯은 밑동을 제거하고 0.5cm 간격으로 썰어 준비합니다.', 'image_url': 'https://recipe1.ezmember.co.kr/cache/recipe/2023/03/09/58826f79c65fa20364da297e272338a21.jpg'}, {'step_number': 4, 'description': '예열된 팬에 식용유 3T를 두르고 대파, 다진마늘 1T를 넣어 볶습니다.요리용스푼 , 프라이팬', 'image_url': 'https://recipe1.ezmember.co.kr/cache/recipe/2023/03/09/201014e54a032aa66128ab3be8fb2a5c1.jpg'}, {'step_number': 5, 'description': '대파, 다진마늘의 은은한 향이 올라올 때 양파, 당근, 표고버섯, 새우살을 넣어 볶습니다.', 'image_url': 'https://recipe1.ezmember.co.kr/cache/recipe/2023/03/09/46676ac5909b7d46e469579ba6cb94bd1.jpg'}, {'step_number': 6, 'description': '파, 당근, 표고버섯, 새우살이 알맞게 익었을 때 굴소스 1T, 참기름 1T를 넣어 볶습니다.', 'image_url': 'https://recipe1.ezmember.co.kr/cache/recipe/2023/03/09/26fa3cf3dc6251f07704bfe50ca50ed71.jpg'}, {'step_number': 7, 'description': '참기름의 고소한 향이 올라올 때 볶은참깨 1T를 뿌리면 새우 표고버섯볶음 완성.', 'image_url': 'https://recipe1.ezmember.co.kr/cache/recipe/2023/03/09/e9d2cb309032199856a2dc2b4da4158a1.jpg'}]"
10921,밑반찬,일상,버섯류,볶음,새송이버섯볶음 만드는 법(굴소스 버섯볶음),새송이버섯볶음,"1,131",15분 이내,아무나,3인분,"[('새송이버섯 2개', '163g'), ('당근', '42g'), ('양파', '31g'), ('부추', '15g'), ('다진 마늘', '0.5큰술'), ('굴소스', '0.4큰술'), ('소금', '3꼬집'), ('통깨', '솔솔')]",버섯종류를 볶을 때 굴소스와 함께 볶아주면 맛의 풍미가 더 해지면서 새송이버섯의 쫄깃한 식감이 맛있으며 밑반찬으로 잘 어울리는거 같아요.(큰술: 밥 숟가락 계량),"[{'step_number': 1, 'description': '▶\ufeff새송이버섯 2개는 밑동을 자른 후, 반으로 자른다음 약 2~3mm 두께로 잘라줍니다.\n\ufeff새송이버섯2개 (손질 후) 163g', 'image_url': 'https://recipe1.ezmember.co.kr/cache/recipe/2023/04/13/16ca314b7cba21e31edec115815699521.png'}, {'step_number': 2, 'description': '▶\ufeff당근과 양파는 약 3mm 정도 두께로 채를 썰고, 부추는3cm 정도 길이로 잘라줍니다.\n▶다진 마늘 0.5큰술을 준비합니다.\n\ufeff당근 42g, 양파 31g, 다진 마늘 0.5큰술', 'image_url': 'https://recipe1.ezmember.co.kr/cache/recipe/2023/04/13/f91eb0f9db415611057dc61fe392b95f1.png'}, {'step_number': 3, 'description': '▶\ufeff볶음팬에 새송이버섯, 당근, 양파를 넣고 포도씨유 3.5큰술을 넣은 후, 중간불 보다 살짝 약한불 상태에서 볶아줍니다.\n\ufeff채썬 양파, 당근, 포도씨유 3.5큰술', 'image_url': 'https://recipe1.ezmember.co.kr/cache/recipe/2023/04/13/70c2d41a8eb35e05d5590870674314df1.png'}, {'step_number': 4, 'description': '▶\ufeff새송이버섯볶음은 볶을 때 버섯이 촉촉해지며서 야채들이 아삭하게 익을정도 까지만 볶아줍니다.(대략 4분 정도 볶아주시면 되세요)\n\ufeff', 'image_url': 'https://recipe1.ezmember.co.kr/cache/recipe/2023/04/13/a6cf486d5d88be530f9213fb2a27d61d1.png'}, {'step_number': 5, 'description': '▶굴소스와 소금을 살짝 넣고 뒤적이면서 볶은 후, 맛을 보고\n부족한 간은 소금으로 입맛에 맞게 맞춰줍니다.굴소스 0.4큰술, 소금 3꼬집 정도', 'image_url': 'https://recipe1.ezmember.co.kr/cache/recipe/2023/04/13/c246e4ed93ee852d672ba3a6501d06961.png'}, {'step_number': 6, 'description': '▶\ufeff부추와 다진 마늘 0.5큰술을 넣고, 약 15~20초 정도 볶은 후 가스불을 꺼 줍니다.(부추는 숨이 금방 죽기 때문에 살짝만 볶아주세요)\n\ufeff부추 15g, 다진 마늘 0.5큰술', 'image_url': 'https://recipe1.ezmember.co.kr/cache/recipe/2023/04/13/9d4603d403818e5f809e2e0702175a2c1.png'}, {'step_number': 7, 'description': '▶\ufeff마지막으로 통개를 솔솔솔 뿌려주면 굴소스 새송이버섯볶음 만드는 법 완성입니다.\n\ufeff통깨', 'image_url': 'https://recipe1.ezmember.co.kr/cache/recipe/2023/04/13/4ba4b0907442c64626b86d3d225f3b3b1.png'}]"
10922,밑반찬,일상,버섯류,볶음,느타리버섯볶음 느타리 볶음 느타리버섯 요리,느타리버섯볶음,"3,591",20분 이내,초급,4인분,"[('느타리버섯', '250g'), ('당근', '조금'), ('양파', '1/4개'), ('피망', '1/4개'), ('대파', '1/2대'), ('소금', '1/3큰술'), ('마늘', '1큰술'), ('굴 소스', '1/2큰술'), ('후춧가루', '조금'), ('참기름', '1/2큰술'), ('통깨', '1/2큰술'), ('식용유', '1큰술')]",느타리버섯을 소금에 살짝 절여 물기없이 볶아봤어요,"[{'step_number': 1, 'description': '느타리버섯 밑동의 이물질을 제거하고 먹기 좋은 크기로 찢어줍니다.', 'image_url': 'https://recipe1.ezmember.co.kr/cache/recipe/2023/08/25/2e1f92e2a3cfa3b9d7fb0db2e9270a871.jpg'}, {'step_number': 2, 'description': '손질한 느타리버섯은 물에 오래 담그진 마시고 가볍게 씻어 건져줍니다.', 'image_url': 'https://recipe1.ezmember.co.kr/cache/recipe/2023/08/25/4775fb010ffba3cd5009da91ea8610821.jpg'}, {'step_number': 3, 'description': '씻은 느타리버섯에 소금 1/3 큰 술을 넣고 살살 무친 다음 10분만 절였다가 씻지 말고 물기를 꼭 짜 줍니다느타리버섯은 수분이 많은 버섯이라 그냥 볶다 보면 물이 많이 나오거든요. 그래서 저는 느타리버섯을 소금으로 절였다가 수분을 빼고 요리합니다.', 'image_url': 'https://recipe1.ezmember.co.kr/cache/recipe/2023/08/25/cb8eb7f31cfadda320d24f822b4467931.jpg'}, {'step_number': 4, 'description': '당근은 색감을 내주기 위해 조금만 채 썰어 줍니다.', 'image_url': 'https://recipe1.ezmember.co.kr/cache/recipe/2023/08/25/8b28a698f2c3c2fd1a6f3776d84ae5d71.jpg'}, {'step_number': 5, 'description': '양파 1/4 개도 채 썰어 줍니다.', 'image_url': 'https://recipe1.ezmember.co.kr/cache/recipe/2023/08/25/83d3b0fdcc435b0842ab55617fad3e501.jpg'}, {'step_number': 6, 'description': '피망이 있어서 피망도 채 썰어 줍니다. 풋고추로 대신해도 되지요.', 'image_url': 'https://recipe1.ezmember.co.kr/cache/recipe/2023/08/25/f5c79548923fa9f1094f0c00719fd6051.jpg'}, {'step_number': 7, 'description': '대파 흰 대 부분은 속에 진이 나는 부분은 빼주시고 4, 5cm 길이로 채 썰어 줍니다. 요렇게 접어서 썰어 주시면 됩니다', 'image_url': 'https://recipe1.ezmember.co.kr/cache/recipe/2023/08/25/687aaba04a574ad4c98bbdbe2a15f80c1.jpg'}, {'step_number': 8, 'description': '팬에 식용유 1 큰 술을 두르고 마늘 1 큰 술 채 썬 대파를 넣고 볶아줍니다.', 'image_url': 'https://recipe1.ezmember.co.kr/cache/recipe/2023/08/25/21d09ad0087647a3082d5264915f98401.jpg'}, {'step_number': 9, 'description': '마늘과 대파 향이 나면 소금에 절여 물기 짜놓은 느타리버섯을 넣고 물기 마르게 볶아줍니다.', 'image_url': 'https://recipe1.ezmember.co.kr/cache/recipe/2023/08/25/ace95d81562e80e71a8f4a09cee6a2ff1.jpg'}, {'step_number': 10, 'description': '느타리버섯이 볶아지고 수분이 마르면 채 썬 당근 양파 피망을 넣고요', 'image_url': 'https://recipe1.ezmember.co.kr/cache/recipe/2023/08/25/ea9846d5da840e170542963ae396a2a21.jpg'}, {'step_number': 11, 'description': '굴 소스 1/2 큰 술을 넣고 볶아 줍니다.소금에 절였다가 씻지 않고 물기만 짰기 때문에 간이 어느 정도 되어있어서 굴 소스도 1/2 큰 술로 충분합니다. 혹시 간을 보시고 식성에 따라 가감합니다.', 'image_url': 'https://recipe1.ezmember.co.kr/cache/recipe/2023/08/25/63ff88a1243a0e32088e931b055225291.jpg'}, {'step_number': 12, 'description': '당근 양파 피망이 어울리게 볶아지면 후춧가루 조금, 참기름 1/2 큰 술을 넣어줍니다.', 'image_url': 'https://recipe1.ezmember.co.kr/cache/recipe/2023/08/25/b040859324ebe5d5515452e7ca16ff351.jpg'}, {'step_number': 13, 'description': '마지막으로 통깨 1/2 큰 술을 넣고 마무리합니다.', 'image_url': 'https://recipe1.ezmember.co.kr/cache/recipe/2023/08/25/5cd225175752309d1efc191706c43bc91.jpg'}, {'step_number': 14, 'description': '느타리버섯 볶음 완성입니다', 'image_url': 'https://recipe1.ezmember.co.kr/cache/recipe/2023/08/25/a605d076a1105409f3971f4dbcd919991.jpg'}]"
