index,종류별,상황별,재료별,방법별,글 제목,레시피이름,조회수,조리시간,난이도,인분,재료,소개글,조리순서
5796,밑반찬,일상,해물류,부침,설 특집 명태전,명태전,"5,882",30분 이내,아무나,4인분,"[('대파', '50g'), ('동태살', '300g'), ('청양고추                                                                                생략가능', '1/2개'), ('홍고추', '1개'), ('부침가루', '1컵'), ('물', '1컵'), ('소금', '1/2작은술'), ('식용유', ''), ('소금', '1꼬집'), ('생강가루', '1꼬집'), ('후춧가루', ''), ('맛술', '1큰술'), ('양파                                                                                다진것', '2큰술'), ('물', '1큰술'), ('진간장', '3큰술'), ('식초', '1큰술'), ('맛술', '1큰술'), ('후춧가루', ''), ('통깨', '1/2큰술')]","오늘은 설 특집 명태전을 소개해 드릴게요~~^^
명태살 그대로 부쳐낸 명태전도 맛있지만 잘게 다진 명태살에 대파와 고추를 넣어 동그랗게 부쳐낸 명태전은 보기에도 좋고 생선을 싫어하는 아이들도 먹기에 좋답니다~ㅎㅎ","[{'step_number': 1, 'description': '동태살은 해동 후 흐르는 물에 살짝 씻은 후 키친타올로 물기를 제거하고, 밑간재료들(소금 한꼬집, 생강가루 한꼬집, 후춧가루 약간, 맛술 1큰술)을 넣어 15분 정도 재운 후 곱게 다져주세요.', 'image_url': 'https://recipe1.ezmember.co.kr/cache/recipe/2016/02/03/bb6fd38c2f63fb7910d4bee709d483b61.jpg'}, {'step_number': 2, 'description': '양념장 재료들(다진 양파 2큰술, 물 1큰술, 진간장 3큰술, 자몽식초 1큰술, 맛술 1큰술, 후추약간, 통깨 1/2 큰술)을 잘섞어 주세요.', 'image_url': 'https://recipe1.ezmember.co.kr/cache/recipe/2016/02/03/926d2b1f43ac7d5173828cc7ba7e18f01.jpg'}, {'step_number': 3, 'description': '대파, 청양고추, 붉은고추는 잘게 다져 준비해주세요.\n볼에 부침가루 1컵, 물 1컵을 넣고 잘섞어 반죽을 만든 후 대파, 동태살, 청양고추, 홍고추를 넣고 잘 섞어주세요.', 'image_url': 'https://recipe1.ezmember.co.kr/cache/recipe/2016/02/03/64556895d0d7c2ca4bb8ba5461c6e60e1.jpg'}, {'step_number': 4, 'description': '중불로 달구어진 팬에 기름을 넉넉히 두르고 먹기좋은 크기로 부쳐내어 완성해주세요.', 'image_url': 'https://recipe1.ezmember.co.kr/cache/recipe/2016/02/03/1ad68dd603ca12a0cfb292c35729ebc11.jpg'}]"
5797,밑반찬,일상,해물류,부침,쫄깃쫄깃 오징어파전,오징어파전,"4,183",15분 이내,아무나,2인분,"[('오징어 다리', '3마리'), ('쪽파', '2줌'), ('팽이버섯', '1줌'), ('청양고추', '1개'), ('부침가루', '1/2컵'), ('튀김가루', '1/2컵'), ('달걀', '1개')]","오징어 델꼬와 부침개도 굽고 오징어 국도 끓이고..
푸짐하게 먹어요 ㅎㅎ","[{'step_number': 1, 'description': '부침가루 튀김가루는 1 : 1로 섞고 달걀, 물 넣고 반죽 만들어요', 'image_url': 'https://recipe1.ezmember.co.kr/cache/recipe/2016/02/26/8113b6c7e3ce9175669d075cce103d2d1.jpg'}, {'step_number': 2, 'description': '팽이버섯, 청양고추, 오징어, 쪽파를 넣고 잘 섞어 줍니다', 'image_url': 'https://recipe1.ezmember.co.kr/cache/recipe/2016/02/26/87506d59b39b2524751f23b2757703b51.jpg'}, {'step_number': 3, 'description': '달군팬에 오일 넉넉히 두르고 앞뒤로 노릇하게 부쳐 냅니다', 'image_url': 'https://recipe1.ezmember.co.kr/cache/recipe/2016/02/26/c9516fb4d9ee67aae2b01b95112cab0e1.jpg'}]"
5798,밑반찬,일상,해물류,부침,부드러운 굴전,굴전,"4,455",30분 이내,초급,3인분,"[('생굴', '200g'), ('홍고추', '1개'), ('쪽파', '2줄기'), ('달걀', '2개'), ('덧밀가루', '1/2컵'), ('부침용 카놀라유', '6-7큰술'), ('소금', '약간'), ('백후추', '약간'), ('간장', ''), ('물', ''), ('식초', '')]",굴향이 좋은 굴전을 만들어 보겠습니다.,"[{'step_number': 1, 'description': '소금 1큰술을 수북히 찬물에 넣고 녹인 다음 굴을 살살 흔들어 씻어 줍니다. 굴껍데기가 간혹 붙어 있기 때문에 잘 떼어내세요. 체에 받쳐서 물기를 제거해주세요.', 'image_url': 'https://recipe1.ezmember.co.kr/cache/recipe/2015/10/19/bd2dba61a961f3a722266199dbe564141.jpg'}, {'step_number': 2, 'description': '굴에 소금과 백후추를 뿌려서 10분간 재워줍니다.', 'image_url': 'https://recipe1.ezmember.co.kr/cache/recipe/2015/10/19/e3cb04b0a9609c98a1d995c8f753f5731.jpg'}, {'step_number': 3, 'description': '고명으로 홍고추를 올려줄 것인데, 동글동글 썰어 찬물에 담그면 씨가 저절로 빠집니다. 물기를 제거해주세요.', 'image_url': 'https://recipe1.ezmember.co.kr/cache/recipe/2015/10/19/5d67918b0a0684c4c9463b16c46df1dc1.jpg'}, {'step_number': 4, 'description': '쪽파도 송송 썰어줍니다. 이것 역시 고명으로 사용할 것입니다.', 'image_url': 'https://recipe1.ezmember.co.kr/cache/recipe/2015/10/19/ebf07e5fb26811417426eb28770f5f551.jpg'}, {'step_number': 5, 'description': '달걀은 풀어주고 소금간은 하지 않습니다. 굴에 발라줄 밀가루도 준비하시구요.', 'image_url': 'https://recipe1.ezmember.co.kr/cache/recipe/2015/10/19/81774c628710add3d693e9455948453a1.jpg'}, {'step_number': 6, 'description': '밑간한 굴을 날밀가루에 묻혀주고 밀가루를 한번 털어줍니다.', 'image_url': 'https://recipe1.ezmember.co.kr/cache/recipe/2015/10/19/f16ea3d5cb1e81930bfc70fa15dacc5f1.jpg'}, {'step_number': 7, 'description': '밀가루옷을 입은 굴은 달걀물을 한번 묻혀줍니다.', 'image_url': 'https://recipe1.ezmember.co.kr/cache/recipe/2015/10/19/e5b3f5525c6eab6f6d7af5a536510ba61.jpg'}, {'step_number': 8, 'description': '달군 팬에 기름을 넉넉히 두르고 굴을 부쳐줍니다. 부침을 할 때는 항상 기름을 넉넉히 넣어주는 것이 좋습니다. 굴 윗면에 홍고추와 쪽파 등을 올려줍니다.', 'image_url': 'https://recipe1.ezmember.co.kr/cache/recipe/2015/10/19/8294a5073fd7e6454df35ecd84418ec81.jpg'}, {'step_number': 9, 'description': '여러 번 뒤집지 말고 노릇해지면 한번씩만 뒤집어 주세요. 그리고 누르지 말고 부쳐주는 것이 좋습니다.', 'image_url': 'https://recipe1.ezmember.co.kr/cache/recipe/2015/10/19/8046fde44c446442a97b9f4dd8b7198f1.jpg'}, {'step_number': 10, 'description': '종이 호일을 깔고 완성한 굴전을 식혀줍니다.', 'image_url': 'https://recipe1.ezmember.co.kr/cache/recipe/2015/10/19/f3ffe731bd69b20002859e4d7410f3de1.jpg'}, {'step_number': 11, 'description': '초간장을 곁들여주었습니다.~~ 간장, 물, 식초 1:1:1로 하시구요. 통깨를 넣어주세요.~~', 'image_url': 'https://recipe1.ezmember.co.kr/cache/recipe/2015/10/19/ecb6794edcc83394ed66b71d1d90bf2e1.jpg'}]"
5799,밑반찬,일상,해물류,부침,쿠키식 파래전,파래전,"1,813",30분 이내,초급,2인분,"[('파래                                                                                1000원어치', '1뭉치'), ('대파', '1뿌리'), ('양파', '1/2개'), ('청량초', '2개'), ('쑥', '2줌'), ('건새우', '3스푼'), ('참기름', '1스푼'), ('계란', '1개'), ('부침가루', ''), ('물', '')]",오늘은 간단하면서도 맛있고 건강식으로도 너무 좋은 파래전입니다. 향긋한 쑥과 청량초를 넣어 냄새도 좋고 고소해요. 식이섬유소가 듬뿍 든 파래로 고소하고 담백하게 먹어보세요.,"[{'step_number': 1, 'description': '먼저 패래를 잘 손질해서 참기름을 둘러 조물조물 잘 버무려줍니다. 가위로 좀 잘라주시면 먹기가 편하답니다.', 'image_url': 'https://recipe1.ezmember.co.kr/cache/recipe/2015/11/11/771ecf63830a18a473d60609bc1f84081.jpg'}, {'step_number': 2, 'description': '그리고 건새우는 핸드믹서에 잘갈아서 넣겠습니다.', 'image_url': 'https://recipe1.ezmember.co.kr/cache/recipe/2015/11/11/8a242bc35fa369d82d8b4fe103686b581.jpg'}, {'step_number': 3, 'description': '파래에 분쇄시킨 건새우를 넣은거랍니다.', 'image_url': 'https://recipe1.ezmember.co.kr/cache/recipe/2015/11/11/27b2ae7c475471520c1d24f130aed5911.jpg'}, {'step_number': 4, 'description': '그리고 쑥과~양파,대파,청량초를 넣었습니다.', 'image_url': 'https://recipe1.ezmember.co.kr/cache/recipe/2015/11/11/486cac356f1a2894e5bdc99667580ecb1.jpg'}, {'step_number': 5, 'description': '계란 1개를 넣고 부침가루를 넣은 후에 물로 농도를 잘 조절합니다.. 부침가루와 물량은 못달았네요.', 'image_url': 'https://recipe1.ezmember.co.kr/cache/recipe/2015/11/11/b539fc35b0938e0973814658dfd8711c1.jpg'}, {'step_number': 6, 'description': '프라이팬에 기름을 넉넉히 두르고 팬을 달궈주세요.', 'image_url': 'https://recipe1.ezmember.co.kr/cache/recipe/2015/11/11/72cacb1e2ffffb669aab82c01ddd40a11.jpg'}, {'step_number': 7, 'description': '팬 가까이 손을 댔을 때 후끈하게 팬이 달아오르면 파래전 반죽을 넣고 잘 펴줍니다. 그리고 중불에서 앞뒤로 노릇노릇 구워주면 됩니다.', 'image_url': 'https://recipe1.ezmember.co.kr/cache/recipe/2015/11/11/69a7d2e9beadd632d6a90e8ea99269631.jpg'}]"
5800,밑반찬,일상,해물류,부침,굴전,굴전,"36,374",30분 이내,초급,2인분,"[('굴', '240g'), ('달걀', '2개'), ('쪽파', '2뿌리'), ('밀가루', '2큰술'), ('식용유', '적당량')]",굴이 제철이라 살도 통통하고 맛이 좋더라고요. 엊그저께 칼슘과 타우린이 풍부한 싱싱한 굴을 이용해 굴 튀김을 만들어서 가족들과 맛있게 먹었었는데요. 싱싱한 굴로 굴전을 만들어서 저녁밥상에 올려 보려고 동네 마트에서 싱싱한 굴을 구입했습니다. 영양이 풍부하고 소화가 잘되는 고소한 굴전 소개합니다.,"[{'step_number': 1, 'description': '굴은 연한 소금물에 으깨어지지 않도록 살살 주물러서 껍질을 제거하고 찬물에 한 두번 정도 헹구어 체에 밭쳐 물기를 제거해줍니다.', 'image_url': 'https://recipe1.ezmember.co.kr/cache/recipe/2015/05/26/d6c5233d71785aa1498be9856393aa031.jpg'}, {'step_number': 2, 'description': '물기를 제거한 굴은 밀가루를 묻혀줍니다.', 'image_url': 'https://recipe1.ezmember.co.kr/cache/recipe/2015/05/26/9ec373525863e52c64ab2977d4b154711.jpg'}, {'step_number': 3, 'description': '쪽파는 다듬어서 씻은 후 송송 썰고 그릇에 달걀을 풀어 달걀 물을 만들어서 썰어 놓은 쪽파를 넣고 잘 섞어줍니다.', 'image_url': 'https://recipe1.ezmember.co.kr/cache/recipe/2015/05/26/3112eaed924c0fad6251b2b6b7601f8b1.jpg'}, {'step_number': 4, 'description': '밀가루를 묻힌 굴은 3의 넣어 옷을 입혀줍니다.', 'image_url': 'https://recipe1.ezmember.co.kr/cache/recipe/2015/05/26/e2088d59aa95469b256c8c806decb8af1.jpg'}, {'step_number': 5, 'description': '달군 프라이팬에 식용유를 두르고 노릇노릇하게 부쳐줍니다.', 'image_url': 'https://recipe1.ezmember.co.kr/cache/recipe/2015/05/26/71a1fd6110c662de5642c7bd474cb7391.jpg'}]"
5801,밑반찬,일상,해물류,부침,달래향으로 만든 동태전,None,"1,764",None,None,None,[],,[]
5802,밑반찬,일상,해물류,부침,담백하고 고소한 우럭전,우럭전,"6,535",None,None,None,"[('우럭', '1마리'), ('달걀', '1개'), ('밀가루', ''), ('식용유', ''), ('소금', '약간'), ('후춧가루', '약간')]","담백, 고소하고 부드러운 식감이 좋은 우럭전","[{'step_number': 1, 'description': '우럭은 먼저 꼬리와 지느러미, 내장, 비늘을 제거하고 흐르는 물에 깨끗하게 씻어주세요. \n1회용 비닐봉지에 담아 냉동실에서 살짝 얼린 후 껍질을 제거하고 포를 떠 준 다음 적당한 크기로 썰어 줍니다.', 'image_url': 'https://recipe1.ezmember.co.kr/cache/recipe/2015/04/22/d473f87127bea58db98d766bc41c2a021.jpg'}, {'step_number': 2, 'description': '우럭포에 소금과 후춧가루를 뿌려 밑간을 해 줍니다.', 'image_url': 'https://recipe1.ezmember.co.kr/cache/recipe/2015/04/22/0e2fa26813fde14660c73f22eac4690c1.jpg'}, {'step_number': 3, 'description': '우럭살에 밀가루를 묻힌 후 탁탁 털어줍니다.', 'image_url': 'https://recipe1.ezmember.co.kr/cache/recipe/2015/04/22/7faba13fa0644845cf5ef296bfee8d3b1.jpg'}, {'step_number': 4, 'description': '풀어 놓은 달걀물에 담갔다가 꺼내줍니다. 동태전과 같은 방법으로 해주면 돼요.', 'image_url': 'https://recipe1.ezmember.co.kr/cache/recipe/2015/04/22/4bc5e1e39ca945ea32add88b0c99ec861.jpg'}, {'step_number': 5, 'description': '달군 프라이팬에 식용유를 두르고 넣어 양면으로 노릇노릇하게 지져 냅니다.', 'image_url': 'https://recipe1.ezmember.co.kr/cache/recipe/2015/04/22/e000491288adcbbccdcba8614213d8991.jpg'}, {'step_number': 6, 'description': '잘 지진 우럭전을 접시에 담아내면 완성~', 'image_url': 'https://recipe1.ezmember.co.kr/cache/recipe/2015/04/22/526f9e64493eba9b9153759e9e2a6bb91.jpg'}]"
