index,종류별,상황별,재료별,방법별,글 제목,레시피이름,조회수,조리시간,난이도,인분,재료,소개글,조리순서
22394,메인반찬,일상,닭고기,볶음,초간단 매운 닭윙볶음탕 만드는법,None,641,30분 이내,중급,2인분,"[('닭윙', '1팩'), ('감자', '2개'), ('당근', '1/4개'), ('양파', '1/2개'), ('마늘', '2-3톨'), ('대파', '1/2대'), ('청양고추', '2개'), ('고추가루', '2스푼'), ('고추장', '2스푼'), ('양조간장', '2스푼'), ('설탕', '1스푼'), ('올리고당', '1스푼'), ('맛술', '1스푼'), ('매실청', '1스푼'), ('물', '3-5스푼')]",우리 도티들이 주기적으로 먹어야 하는 대표적인 요리가 바로 매운 닭볶음탕이예요. 닭요리를 좋아하고 매운 음식도 좋아하니 오랜만에 집에 와서 뭐해줄까? 뭐먹고 싶어? 그러면 닭볶음탕이 거의 3순위 안에 꼭 들어요. 엄마가 해주는 닭볶음탕이 세상 젤 맛있다고 하는데 감자 넣고 조려서 쫄깃한 닭고기 먹다가 포실 포실 매운 감자 먹다가 나중에 뼈만 반짝반짝 남아요. 닭고기 중에서도 닭윙과 닭봉이 지방이 적절히 있고 육질도 쫄깃해서 주로 닭윙과 닭봉으로 만들어요. 도티가 어쩜 이렇게 간도 맛도 환상적으로 잘 맞췄는지 감탄하며 둘이 먹다 둘이 죽어도 모를 맛이라네요~^^ 여러 손질이나 조리과정 복잡하지 않게 만들어도 늘 맛있더라구요. 초간단 레시피 소개할께요. 재료와 양념 한꺼번에 다 넣고 나서 요리시작하면 좋아요. 따로 닭 데치거나 기름에 볶거나 안해도 맛있어요. 그래서 초간단 레시피죠.,"[{'step_number': 1, 'description': '닭고기를 물에 씻어 요리할 후라이팬에 ( 또는 웍) 넣어주고 감자 양파 큼직하게 썰어 넣고 대파 마늘 다 한꺼번에 썰어 넣어주세요.', 'image_url': 'https://recipe1.ezmember.co.kr/cache/recipe/2023/04/17/7ce83e9e84bc5a383bbdb70477c1ec1d1.jpg'}, {'step_number': 2, 'description': '불을 끈 상태에서 양념도 한꺼번에 다 넣어주세요. 20-30분 정도 재워 두세요. 양념이 잘 배어 들어 더 맛있어요.', 'image_url': 'https://recipe1.ezmember.co.kr/cache/recipe/2023/04/17/80d0ccb265ee83ba615cff090e24f2d11.jpg'}, {'step_number': 3, 'description': '물을 3-5스푼 넣어 주고 양념을 잘 섞어준 후 불을 켜주세요. 처음엔 5분정도 센불에서 볶다가 뚜껑덮고 중간불에서 조려주며 익혀주세요. 중간 중간 물이 너무 없으면 한두 스푼씩 넣으며 저어 주고 뚜껑 덮어 익혀 주세요.', 'image_url': 'https://recipe1.ezmember.co.kr/cache/recipe/2023/04/17/f322c1ce650ad7b59cd5cf375eff75e01.jpg'}, {'step_number': 4, 'description': '감자만 익으면 닭고기는 충분히 익으니 감자가 익으면 요리 완성이예요. 약 20분정도 익히면 되요. 마지막으로 청양고추 넣고 끝났네요', 'image_url': 'https://recipe1.ezmember.co.kr/cache/recipe/2023/04/17/9570c437d4bcaa6a2faa25cdcfec6b2c1.jpg'}]"
22395,메인반찬,일상,닭고기,볶음,닭다리살 데리야끼 소스 구이 만드는법,닭다리살데리야끼소스구이,"2,834",30분 이내,중급,2인분,"[('닭다리살', '400g'), ('머쉬마루 버섯', '3-4가닥'), ('감자', '1개'), ('방울 토마토', '3-4개'), ('다진 마늘', '1스푼'), ('참기름', '1스푼'), ('후추', '약간'), ('소금', '1꼬집'), ('후추', '약간'), ('우유', '100ml'), ('스끼야끼 간장', '2스푼'), ('홍게 간장', '4스푼'), ('생강즙', '1스푼')]","도티가 매운 닭볶음탕을 좋아해서 주로 매운 닭볶음을 하곤 했는데, 요즘 허비가 속이 불편해서 자극적인 요리가 안좋은거 같아 담백한 요리로 바뀌게 되네요. 오늘은 닭다리살 정육으로 간장소스 활용해 데리야끼 구이를 만들었어요. 감자랑 버섯 곁들여서 영양 균형도 맞췄어요. 닭고기 데리야끼 인기 만점이었어요. 도티도 허비도 넘 맛있다고~ 감자도 맛있게 조려져서 맛있어요. 버섯도 쫄깃하고 맛있었고요. 맛있게 싹싹 먹고 먹어 없어진 걸 아쉬워하네요^^ 다시 닭고기 사와서 감자도 더 많이 넣고 낼 또 하기로! 앵콜 !닭다리살 데리야끼 !! ​ ​","[{'step_number': 1, 'description': '닭고기를 물에 한번 씻어 껍질을 제거해 주세요.', 'image_url': 'https://recipe1.ezmember.co.kr/cache/recipe/2023/04/17/5df2f7032282d714584100f8dc1cdd961.jpg'}, {'step_number': 2, 'description': '우유에 20분 정도 재워 주세요.', 'image_url': 'https://recipe1.ezmember.co.kr/cache/recipe/2023/04/17/c8b256ad33e4c569d2cbcf44629803641.jpg'}, {'step_number': 3, 'description': '우유에서 건져 깨끗이 씻고 껍질 제거한 부분에 칼집을 내주세요.', 'image_url': 'https://recipe1.ezmember.co.kr/cache/recipe/2023/04/17/59e6ecda54993803b8144dc843d605991.jpg'}, {'step_number': 4, 'description': '닭고기에 소금, 후추 ,맛술 뿌려 10분 정도 재워 주세요.', 'image_url': 'https://recipe1.ezmember.co.kr/cache/recipe/2023/04/17/1428bc766ad940ca6dbc35589f7697361.jpg'}, {'step_number': 5, 'description': '버섯 가닥 찢어 놓고 감자를 2mm정도로 잘라 프라이팬에 5분 정도 볶아 덜어 놓아요. 나중에 소스에서 빨리 익게 준비해요.', 'image_url': 'https://recipe1.ezmember.co.kr/cache/recipe/2023/04/17/6bd2b98407125cea35d78fdaf7278a331.jpg'}, {'step_number': 6, 'description': '후라이팬에 마늘 볶다가 닭고기를 노릇노릇 겉면이 익도록 구워 주세요.', 'image_url': 'https://recipe1.ezmember.co.kr/cache/recipe/2023/04/17/ffe882b906179379ded9b47b416ec3911.jpg'}, {'step_number': 7, 'description': '겉면이 노릇하게 익으면 한쪽으로 밀어놓고 스끼야끼 홍게간장 생강즙 넣고 바글바글 끓여 주세요. 불을 중불로 줄여 닭고기랑 소스를 같이 섞어 구워주세요.', 'image_url': 'https://recipe1.ezmember.co.kr/cache/recipe/2023/04/17/a681f13c6b4514b31849340dde3f0a2d1.jpg'}, {'step_number': 8, 'description': '감자와 버섯 넣고 뚜껑덮고 5분 정도 볶다가 뚜껑 열고 3분 정도 졸여 주세요.', 'image_url': 'https://recipe1.ezmember.co.kr/cache/recipe/2023/04/17/f1dfe4ed54faa2e04c80db97d6eeab001.jpg'}, {'step_number': 9, 'description': '거의 다 완성되었을 때 방울토마토 넣어 살짝만 익혀주고 참기름 후추 넣고 완성이예요.', 'image_url': 'https://recipe1.ezmember.co.kr/cache/recipe/2023/04/17/cf644cf7ea2e4c2e400ccbd77c787c2f1.jpg'}]"
22396,메인반찬,일상,닭고기,볶음,간장 닭볶음탕 간단하게 만드는 법 닭 간장 닭도리탕 유아식 닭볶음탕 레시피,None,"6,411",60분 이내,아무나,3인분,"[('닭', '800g'), ('무', '150g'), ('당근', '135g'), ('파', '69g'), ('양파', '82g'), ('맛술', '2큰술'), ('간장', '7큰술'), ('마늘', '1큰술'), ('올리고당', '1큰술'), ('설탕', '1큰술'), ('후춧가루', '')]",이환 선생네는 이제 화니가 제법 많이 커서(?) 유아식 반찬을 따로 하지 않고 고춧가루가 들어가지 않은 음식을 만들어서 이제 함께 먹고 있어요 그래서 오늘은 수-드래곤과 화니가 함께 먹을 수 있는 간장 닭도리탕을 만들어 볼까 해요,"[{'step_number': 1, 'description': '먼저 흐르는 물에 닭을 2~3번 씻어줄게요 이때 뼈 사이에 있는 이물질이 누린내의 원인이 될 수 있기 때문에 깨끗이 씻어주세요', 'image_url': 'https://recipe1.ezmember.co.kr/cache/recipe/2023/05/24/7a7685d4a81d87f0952435d72a8b487f1.jpg'}, {'step_number': 2, 'description': '체에 밭쳐 물기를 제거해 줍니다 이 과정에서 기름기가 심한 애들을 1차 손질해 줬어요', 'image_url': 'https://recipe1.ezmember.co.kr/cache/recipe/2023/05/24/98279905f058f0e1bc6c64cea45af87b1.jpg'}, {'step_number': 3, 'description': '물이 끓기 시작하면 닭을 넣어줄게요이때 2차로 기름기 제거를 해줬는데요 데치고 나서 제거하시면 좀 더 수월해요', 'image_url': 'https://recipe1.ezmember.co.kr/cache/recipe/2023/05/24/6a9ef1950f1ab4d8078ccea1d9b1fe721.jpg'}, {'step_number': 4, 'description': '불순물이 골고루 잘 빠지도록 섞어가면서 데쳐주세요', 'image_url': 'https://recipe1.ezmember.co.kr/cache/recipe/2023/05/24/0342820f5b119d885297ac12a762f8b91.jpg'}, {'step_number': 5, 'description': '준비하신 야채를 깨끗이 씻어주세요', 'image_url': 'https://recipe1.ezmember.co.kr/cache/recipe/2023/05/24/32937ee6f63ebba8ceafd5fbda8ac1601.jpg'}, {'step_number': 6, 'description': '당근은 먹기 좋은 크기로 잘라줄게요', 'image_url': 'https://recipe1.ezmember.co.kr/cache/recipe/2023/05/24/258fe20a5843de9d48b90fbc50e43f1d1.jpg'}, {'step_number': 7, 'description': '그다음 끝을 둥글게 다듬어 줄 거예요. 끓여도 쉽게 으스러 지지 않는답니다', 'image_url': 'https://recipe1.ezmember.co.kr/cache/recipe/2023/05/24/50b4c58310b8bfb6dc0dcd620d650d181.jpg'}, {'step_number': 8, 'description': '무도 당근과 마찬가지로 끝부분을 둥글게 다듬어 주세요', 'image_url': 'https://recipe1.ezmember.co.kr/cache/recipe/2023/05/24/09f4b9f4b8ec0408bdea7c583974b4c61.jpg'}, {'step_number': 9, 'description': '대파는 손가락 길이만큼 잘라 주시고요 양파는 깍둑썰기로 잘라 주시면 돼요', 'image_url': 'https://recipe1.ezmember.co.kr/cache/recipe/2023/05/24/b5eaff97df078ccc036abb6e621d6b6f1.jpg'}, {'step_number': 10, 'description': '야채 손질 끝~', 'image_url': 'https://recipe1.ezmember.co.kr/cache/recipe/2023/05/24/a0483c02c99c020823e8097b03a5ee4a1.jpg'}, {'step_number': 11, 'description': '준비한 간장. 마늘. 올리고당. 후춧가루를 넣고 잘 섞어주세요 간장 닭볶음탕 양념은 짭조름하면서 단맛이 느껴지도록 만들어 주시면 돼요', 'image_url': 'https://recipe1.ezmember.co.kr/cache/recipe/2023/05/24/2b931c6353623830eb184cebd10d5f9d1.jpg'}, {'step_number': 12, 'description': '어느 정도 닭이 잠길 정도 물을 넣어주세요 ( 저는 물 600ml 정도 넣어 줬어요) 이때 설탕 1큰술과 맛술 2큰술을 넣고 남아 있을 수도 있는 누린내를 잡아볼게요 맛술이 없으신 분들은 소주를 조금 넣어줘도 좋아요설탕을 먼저 넣어주면 단맛도 잘 스며들고 잡내 제거에도 도움이 돼요', 'image_url': 'https://recipe1.ezmember.co.kr/cache/recipe/2023/05/24/227a099e282b7f130283298e2cf2d4681.jpg'}, {'step_number': 13, 'description': '한번 데쳐 사용했는데도 끓이다 보면 또 불순물이 올라와요 이때 올라오는 불순물을 건져주면 좀 더 담백하게 먹을 수 있답니다', 'image_url': 'https://recipe1.ezmember.co.kr/cache/recipe/2023/05/24/a7ea1f6047807c6b8ac88ef0044c10e71.jpg'}, {'step_number': 14, 'description': '중불로 끓여주다가 준비해둔 양념장을 넣어주세요', 'image_url': 'https://recipe1.ezmember.co.kr/cache/recipe/2023/05/24/7322e871fcae720ae55d4fd686fce5fd1.jpg'}, {'step_number': 15, 'description': '색깔이 잘 스며들었을 때쯤 준비해둔 야채를 넣어 중불로 끓이다가 약불로 줄여 졸이듯 끓여주면 되는데 이때 부족한 간은 간장과 설탕으로 맞춰 주세요', 'image_url': 'https://recipe1.ezmember.co.kr/cache/recipe/2023/05/24/dcd57c1f058bc537428ddecd2f253df31.jpg'}, {'step_number': 16, 'description': '국물이 적당히 졸았을 때쯤 준비해둔 대파와 양파를 넣고 잘 섞어주세요 그다음 뚜껑을 덮고 조금만 익히다가 불을 꺼주시면 끄읏!', 'image_url': 'https://recipe1.ezmember.co.kr/cache/recipe/2023/05/24/89c8371b45281f5349aac79429c2196c1.jpg'}]"
22397,메인반찬,일상,닭고기,볶음,먹다 남은 치킨으로 고급진 깐풍치킨 만드는법,깐풍치킨,814,20분 이내,초급,2인분,"[('치킨', '2/3마리'), ('대파', '1대'), ('다진 마늘', '2스푼'), ('청양고추', '2개'), ('오일', '2스푼'), ('고춧가루', '1스푼'), ('양조간장', '4스푼'), ('설탕', '4스푼'), ('식초', '6스푼'), ('소금', '1스푼'), ('맛술', '2스푼'), ('굴소스', '1스푼'), ('후추', '약간')]",시장에서 튀겨주는 치킨을 제법 큰 걸로 한마리를 사고 오징어 튀김까지 샀더니 맛있다고 먹다가 양이 많기도 하고 약간 느끼하기도 해서 많이 남았어요. 냉장고에 놔뒀다 다시 먹으려면 너무 맛없죠. 식어버리고 굳고 눅눅해진 프라이드 치킨을 살리는 요긴한 방법! 이연복 깐풍소스로 한 번 볶아주는 거예요. 고추장 양념이 들어간 양념치킨이나 닭강정을 안좋아하는데 깐풍소스는 고춧가루를 넣어서 텁텁하지 않고 식초가 들어가 느끼한 맛을 산뜻하게 잡아주면서 달콤 새콤 감칠맛이 나요.^^ 치킨도 따뜻하고 부드러워지고 상큼 달콤한 깐풍소스가 느끼한 맛을 잡아줘서 완전 새로운 치킨이 되었어요. 마법의 소스! 마성의 소스! 깐풍소스는 다른 요리에 응용해도 맛있을거 같아요~^^,"[{'step_number': 1, 'description': '깐풍소스를 섞어 놓아요.', 'image_url': 'https://recipe1.ezmember.co.kr/cache/recipe/2023/05/25/1a51df8c7dfccc4092ea0cfda3d22e451.jpg'}, {'step_number': 2, 'description': '후라이팬에 오일을 두르고 다진 대파와 마늘을 볶아 주세요. 고춧가루를 1스푼 정도 넣고 약불에서 같이 볶아 고추기름을 내주세요.', 'image_url': 'https://recipe1.ezmember.co.kr/cache/recipe/2023/05/25/60f523f57fb76bec4f4ad76612a2a5171.jpg'}, {'step_number': 3, 'description': '치킨을 넣고 고추기름에 잘 버무려서 볶아 준 뒤, 다른 그릇에 옮겨 놓거나 프라이팬 한쪽으로 몰아 주세요.', 'image_url': 'https://recipe1.ezmember.co.kr/cache/recipe/2023/05/25/e6cdbcd13ee8052b39b1f2f3c7757de81.jpg'}, {'step_number': 4, 'description': '깐풍소스를 후라이팬에 넣고 바글바글 끓여 준 뒤 , 치킨과 다진 청양고추 넣고 잘 섞어 주세요.', 'image_url': 'https://recipe1.ezmember.co.kr/cache/recipe/2023/05/25/900c535e1614ea8054cb1df806105e3f1.jpg'}]"
22398,메인반찬,일상,닭고기,볶음,간장찜닭 만들기 간장찜닭 레시피,간장찜닭,"3,882",60분 이내,중급,2인분,"[('닭다리살', '500g'), ('감자', '2개'), ('양파', '1개'), ('대파', '1대'), ('참기름', '2T'), ('굴소스', '2T'), ('당면', '100g'), ('표고버섯', '5개'), ('물', '600ml'), ('진간장', '100ml'), ('백설탕', '4T'), ('물엿', '7T'), ('맛술', '2T'), ('다진마늘', '1T'), ('후추', '0.5T')]",찜닭 만들기 간장찜닭 레시피 입니다.,"[{'step_number': 1, 'description': '-위 재료 확인하고 준비해주세요. -닭은 우유나 쌀뜨물에 담궈서 약 30분 정도 재워 주세요.', 'image_url': 'https://recipe1.ezmember.co.kr/cache/recipe/2023/06/01/d4489b3c62f4a2c5459eef03cc12f5301.jpg'}, {'step_number': 2, 'description': '당면 100g은 약 1시간 정도 물에 불려놓습니다.', 'image_url': 'https://recipe1.ezmember.co.kr/cache/recipe/2023/06/01/adf9d85add633fc565a59b3fca9f5a381.jpg'}, {'step_number': 3, 'description': '양파와 감자 손질 해주세요. 큼지막 하게 썰어주시면 됩니다.양파 손질법 레시피\u200b', 'image_url': 'https://recipe1.ezmember.co.kr/cache/recipe/2023/06/01/c394ee5b0097912f13477391a0aca8431.jpg'}, {'step_number': 4, 'description': '대파는 어슷썰기 해주시구요.', 'image_url': 'https://recipe1.ezmember.co.kr/cache/recipe/2023/06/01/5f994133bb6d2307c973f2325fa525891.jpg'}, {'step_number': 5, 'description': '표고버섯 5개는 길쭉 하게 썰어주시면 됩니다.', 'image_url': 'https://recipe1.ezmember.co.kr/cache/recipe/2023/06/01/b98569816f4766e41ce6d5bedca8b1ae1.jpg'}, {'step_number': 6, 'description': '물 600ml, 진간장 100ml, 백설탕 4T, 물엿 7T, 맛술 2T, 다진마늘 1T, 후추 0.5T 이렇게 넣어서 양념장 만들어줍니다.', 'image_url': 'https://recipe1.ezmember.co.kr/cache/recipe/2023/06/01/9ae792b275c9a3cc08abfad062884b3f1.jpg'}, {'step_number': 7, 'description': '달군 프라이팬(웍)에 참기름 2T 정도 둘러주세요.', 'image_url': 'https://recipe1.ezmember.co.kr/cache/recipe/2023/06/01/d42fc6022b42c067c1fe6502208e63151.jpg'}, {'step_number': 8, 'description': '잡내 제거한 닭다리살을 구워 줍니다. 비계 부분이 아랫면을 향하도록 구워주시면 됩니다.', 'image_url': 'https://recipe1.ezmember.co.kr/cache/recipe/2023/06/01/b6fe46e81e378510aa4d1e191ef2cbf21.jpg'}, {'step_number': 9, 'description': '중간 중간 익었다 싶으면 한입 크기로 잘라서 모든 면을 잘 구워 주세요.', 'image_url': 'https://recipe1.ezmember.co.kr/cache/recipe/2023/06/01/4548c16f1c626c9028233b34175309591.jpg'}, {'step_number': 10, 'description': '닭다리살이 잘 구워졌다면 잠시 접시에 담아 대기합니다. \n(닭고기는 약 80% 정도 익히시면 됩니다.)', 'image_url': 'https://recipe1.ezmember.co.kr/cache/recipe/2023/06/01/1427acd0c35a88e2121e206b7ae99b661.jpg'}, {'step_number': 11, 'description': '키친타월로 기름기를 제거해주세요.', 'image_url': 'https://recipe1.ezmember.co.kr/cache/recipe/2023/06/01/11e930d69ed1659a56058de3208282131.jpg'}, {'step_number': 12, 'description': '깨끗해진 프라이팬(웍)엔 미리 만들어둔 양념장 모두 부어주세요.', 'image_url': 'https://recipe1.ezmember.co.kr/cache/recipe/2023/06/01/25d86cd6e1e568396cc23c5b351906f31.jpg'}, {'step_number': 13, 'description': '썰어 놓은 감자 넣어주세요.', 'image_url': 'https://recipe1.ezmember.co.kr/cache/recipe/2023/06/01/7e5474fb144593cb422e628bed91ad751.jpg'}, {'step_number': 14, 'description': '닭고기도 모두 넣어줍니다.', 'image_url': 'https://recipe1.ezmember.co.kr/cache/recipe/2023/06/01/04e45e78accc40789c25aa777b88cb031.jpg'}, {'step_number': 15, 'description': '감자와 닭고기 넣고 나서 약 10분정도 중강불에 끓여줍니다.', 'image_url': 'https://recipe1.ezmember.co.kr/cache/recipe/2023/06/01/50098ff1e502ffbb6a9499a55ed0161c1.jpg'}, {'step_number': 16, 'description': '양파, 대파, 표고버섯 넣어주세요.', 'image_url': 'https://recipe1.ezmember.co.kr/cache/recipe/2023/06/01/0f386d7c41db6f335cc57768d407f4c81.jpg'}, {'step_number': 17, 'description': '굴소스 2T 정도 넣으시면 됩니다.', 'image_url': 'https://recipe1.ezmember.co.kr/cache/recipe/2023/06/01/a02ceef804d04b9243da0795be8d9fed1.jpg'}, {'step_number': 18, 'description': '마지막으로 당면을 넣고 나서 기호에 맞게끔 원하는 정도로 졸여 주시면 완성이 됩니다. (국물의 농도는 기호에 맞게 조절)', 'image_url': 'https://recipe1.ezmember.co.kr/cache/recipe/2023/06/01/9c40cc37c222930409b73d238f9a64e41.jpg'}, {'step_number': 19, 'description': '접시에 담아주세요.', 'image_url': 'https://recipe1.ezmember.co.kr/cache/recipe/2023/06/01/e989393b6317ebd13005731e25fa0c021.jpg'}]"
22399,메인반찬,일상,닭고기,볶음,"저녁메뉴로, 술안주로 최고인 닭갈비 레시피",닭갈비,541,20분 이내,초급,2인분,"[('닭다리', ''), ('양조간장', '4T'), ('설탕', '2T'), ('배 음료수                                                                                또는 사과즙', '1캔'), ('식초', '4T'), ('고추장', '3T'), ('소금', '조금'), ('후추', '조금'), ('카레가루', '1/2스푼'), ('파', '조금'), ('양배추', '조금'), ('고구마', '취향껏'), ('떡볶이 떡', '취향껏'), ('올리브유                                                                                혹은 식용유', ''), ('참기름', '1/2스푼')]","저녁메뉴로, 술안주로 최고인 닭갈비 레시피 (편스토랑 류수영님 레시피를 참고하였습니다.)","[{'step_number': 1, 'description': '닭다리를 손질하여 뼈와 분리한 후, 포크로 칼집(?)을 내주세요.', 'image_url': 'https://recipe1.ezmember.co.kr/cache/recipe/2023/06/04/0374510121befc10082384466f40d4831.jpg'}, {'step_number': 2, 'description': '고기를 재울 그릇에 양념을 만들어요! 카레 반스푼, 후추와 소금 쬠', 'image_url': 'https://recipe1.ezmember.co.kr/cache/recipe/2023/06/04/6c7c2312b49f3df13377de86dbf13b5d1.jpg'}, {'step_number': 3, 'description': '갈아만든 배 음료 200ml, 양조간장 4T, 식초 4T, 고추장 듬뿍 3T, 설탕 2T, 참기름 쬠 넣어줍니다.', 'image_url': 'https://recipe1.ezmember.co.kr/cache/recipe/2023/06/04/b65130afa1284b7789f29ddf8e3d7ed71.jpg'}, {'step_number': 4, 'description': '손질된 닭을 키친타월로 물기를 제거한 후, 이렇게 담아 30분 이상 냉장고에서 재워줍니다.', 'image_url': 'https://recipe1.ezmember.co.kr/cache/recipe/2023/06/04/96ab33507d2854af35a309b1bd6eba3a1.jpg'}, {'step_number': 5, 'description': '프라이팬에 오일을 넉넉히 두르고, 파를 올려주세요.', 'image_url': 'https://recipe1.ezmember.co.kr/cache/recipe/2023/06/04/3d63698f29eb0cba43e756114b9ae8441.jpg'}, {'step_number': 6, 'description': '양배추와 고구마도 같이 볶아요.중강불양배추는 크게 썰면 더 맛있습니다. (집에 다진거 뿐이였다는...)', 'image_url': 'https://recipe1.ezmember.co.kr/cache/recipe/2023/06/04/66b6effaf00c4052152775bba50e56bf1.jpg'}, {'step_number': 7, 'description': '야채가 어느 정도 익으면 닭고기도 넣어주세요. 불은 중불보다는 쎄게, 강불보다는 약하게!', 'image_url': 'https://recipe1.ezmember.co.kr/cache/recipe/2023/06/04/4477741280eb29b37a13ae054111175f1.jpg'}, {'step_number': 8, 'description': '닭이 익기 시작하면 뒤집고, 가위로 잘라가며 볶아주세요. 이때 떡볶이 떡도 넣어주세요.', 'image_url': 'https://recipe1.ezmember.co.kr/cache/recipe/2023/06/04/7e2f6db0f6ec8c2776418397e290efdb1.jpg'}, {'step_number': 9, 'description': '중간 중간 닭고리를 재웠던 양념장을 넣어줍니다.', 'image_url': 'https://recipe1.ezmember.co.kr/cache/recipe/2023/06/04/93a15b59ff03b5704f1fb39757c1a7381.jpg'}, {'step_number': 10, 'description': '13-15분 정도 볶으면 군침도는 닭갈비 완성!', 'image_url': 'https://recipe1.ezmember.co.kr/cache/recipe/2023/06/04/d1850d4647c8307bd84931c7a121c4321.jpg'}, {'step_number': 11, 'description': '통깨 찹찹! 깻잎과 함께 먹으면 더욱 맛있습니다.', 'image_url': 'https://recipe1.ezmember.co.kr/cache/recipe/2023/06/04/e2b19be837c5248f6cb5b8ed3a2141ff1.jpg'}]"
