index,종류별,상황별,재료별,방법별,글 제목,레시피이름,조회수,조리시간,난이도,인분,재료,소개글,조리순서
10061,밑반찬,일상,건어물류,무침,[홍진미채무침] 진심 추천하는 세상 고급진 홍진미채무침,홍진미채무침,328,15분 이내,초급,2인분,"[('홍 진미채', '100g'), ('마요네즈', '2tbsp'), ('크러쉬드 레드페퍼', '1tsp'), ('검정깨', '1/2tsp'), ('레몬즙', '1tsp')]","안녕하세요? 신디입니다. 만만한 밑반찬이 뭐 없나 고민하다 '홍진미채무침' 만들어 봤어요. 남녀노소 다 좋아하고, 다~ 아는 흔한 밑반찬인 진미채지만 컬러와 레시피만 조금 바꾸어도 새로운 요리 같아요. 크러쉬드 레드페퍼의 은은한 매콤함과 레몬향 풍미가 얼마나 좋은지 몰라요... 거기에 딱 어울리는 간단한 양념으로 신디표 진미채를 무쳐보았어요. 한 젓가락 두 젓가락 먹다보니 냉장고로 갈 새도 없이 150g 담겨있던 접시가 바로 비어버렸네요 ^.~ (이 레시피는 진심 추천요..ㅎㅎ)","[{'step_number': 1, 'description': '진미채는 기본 맛이 중요한데요, 특히나 너무 염분을 많이 포함한 경우 씻을 수도 없고 대략난감이죠. 한번은 너무 짜서 씻어본 적이 있는데 오징어의 맛있는 성분까지 다 씻겨내려가 고무를 씹는 것 같았어요. 다행히 이번 홍진미채는 짜지 않아 너무너무 좋네요. 외국산 오징어지만 국내가공 제품이라 그런지 전혀 짜지 않았어요. 일단 이런 맛있는 홍진미채를 준비하여 먹기좋은 크기로 잘라주세요.볼 , 주방가위', 'image_url': 'https://recipe1.ezmember.co.kr/cache/recipe/2024/04/23/b04c85acbe52f3adb62871aead0fbb7b1.jpg'}, {'step_number': 2, 'description': '저는 5cm정도 길이로 해서 한입에 쏙쏙 들어가게 만들었어요.', 'image_url': 'https://recipe1.ezmember.co.kr/cache/recipe/2024/04/23/905c9e2a13530f30fb72b8d364e55c9f1.jpg'}, {'step_number': 3, 'description': '마요네즈 2tbsp을 넣어줍니다. 코팅이 되면서 촉촉하고 부드러운 진미채가 된답니다.계량스푼', 'image_url': 'https://recipe1.ezmember.co.kr/cache/recipe/2024/04/23/95de4317af8e2ebc9b844f99333944ab1.jpg'}, {'step_number': 4, 'description': '레몬즙 1tsp 추가하면 상큼한 레몬향이 먹을 때마다 코를 기분좋게 간지럽히며 진미채에 촉촉함을 더하죠.', 'image_url': 'https://recipe1.ezmember.co.kr/cache/recipe/2024/04/23/21660107b8a368818f995a4f3911fb691.jpg'}, {'step_number': 5, 'description': '★여기에 이 레시피에서 가장 중요한 포인트이자 비밀병기, 크러쉬드 레드페퍼를 꼬~옥 넣어주세요!!! 맛이 한층 업그레이드 됩니다. (없다고 고춧가루 넣지 마시구요 ㅠㅠㅠㅠ) 한국 고춧가루와는 묘하게 다른 느낌으로 매콤한 향이 올라와 풍미를 더합니다.', 'image_url': 'https://recipe1.ezmember.co.kr/cache/recipe/2024/04/23/e2281a5de8cc29fb41be7cfa17f78b8e1.jpg'}, {'step_number': 6, 'description': '검정 통깨 1tsp도 갈아서 넣어주면 너무너무 고소하답니다.', 'image_url': 'https://recipe1.ezmember.co.kr/cache/recipe/2024/04/23/868800be5e8b030d4dbb3f43f46c1f9b1.jpg'}, {'step_number': 7, 'description': '즉석에서 갈아넣은 통깨와 함께 조물조물 잘 무쳐주세요.위생장갑', 'image_url': 'https://recipe1.ezmember.co.kr/cache/recipe/2024/04/23/12503a4af8459ff808f7d322b51e6c2e1.jpg'}, {'step_number': 8, 'description': '이제 마요네즈가 코팅이 되면서 같이 넣어준 양념들도 골고루 섞일 수 있게 조물조물 잘 무치고 최종 간을 한번 봐주세요. 밑반찬으로 조금 싱겁다면 간장을 좀 추가하셔도 좋아요.', 'image_url': 'https://recipe1.ezmember.co.kr/cache/recipe/2024/04/23/ba409ac264a5d31dea85ecd8bf538bdf1.jpg'}]"
10062,밑반찬,일상,건어물류,무침,일미채무침 레시피 진미채 일미고추장무침 밑반찬 만들기,진미채무침,"1,382",15분 이내,초급,4인분,"[('진미채', '150g'), ('마요네즈', '2T'), ('고추장', '2T'), ('진간장', '1T'), ('올리고당', '2T'), ('맛술', '1T'), ('참기름', '1T'), ('통깨', '')]","일미채무침 레시피 진미채 일미고추장무침 일주일 밑반찬 만들기
불을 사용하지 않는 간단요리","[{'step_number': 1, 'description': '일미채 준비합니다. 일미가 길이가 길면 가위로 적당한 길이로 잘라주세요.볼 , 주방가위', 'image_url': 'https://recipe1.ezmember.co.kr/cache/recipe/2024/07/06/8104b8e26b354b224073a5b458070d391.jpg'}, {'step_number': 2, 'description': '볼에 일미채를 담고 마요네즈 2T 넣고', 'image_url': 'https://recipe1.ezmember.co.kr/cache/recipe/2024/07/06/61bcb3cdba2be5d2f8664801c5cf41141.jpg'}, {'step_number': 3, 'description': '진간장 1T 넣어줍니다.스푼', 'image_url': 'https://recipe1.ezmember.co.kr/cache/recipe/2024/07/06/ae03ef178a556961431f272854f8bd4f1.jpg'}, {'step_number': 4, 'description': '올리고당 2T, 맛술1T넣고', 'image_url': 'https://recipe1.ezmember.co.kr/cache/recipe/2024/07/06/4b0c74e7fe4e2ab35213ba9b328aca571.jpg'}, {'step_number': 5, 'description': '고추장 2T 넣어주고', 'image_url': 'https://recipe1.ezmember.co.kr/cache/recipe/2024/07/06/28ce21b8ba0d88c5b9e134e8d31a35031.jpg'}, {'step_number': 6, 'description': '참기름 1T 넣어주세요.', 'image_url': 'https://recipe1.ezmember.co.kr/cache/recipe/2024/07/06/25f3cc9caccc1ad4291a9d50d04238f31.jpg'}, {'step_number': 7, 'description': '마지막으로 통깨 넉넉하게 넣은 후', 'image_url': 'https://recipe1.ezmember.co.kr/cache/recipe/2024/07/06/8b0f02140d32a796db480b6ecc60d9b91.jpg'}, {'step_number': 8, 'description': '조물조물 잘 무쳐주면 일미채무침, 일미고추장무침 완성입니다. 불없이 만들어서 더 편해요.위쟁강갑 , 반찬통', 'image_url': 'https://recipe1.ezmember.co.kr/cache/recipe/2024/07/06/68cf6d516342e393fa3317310f1a34371.jpg'}]"
10063,밑반찬,일상,건어물류,무침,건미역 초무침 간단밑반찬,건미역초무침,513,15분 이내,아무나,4인분,"[('건미역', '50g'), ('양파', '1/2개'), ('맛간장', '3T'), ('소금', '1꼬집'), ('식초', '4T'), ('레몬즙', '1T'), ('생강청', '1/3T'), ('다진마늘', '1/2T')]",간단 밑반찬으로좋은 건미역 초무침 입니다,"[{'step_number': 1, 'description': '건미역은 10분 불려서 사용해요 흐르는 물로 잘 씻고 물기 제거해 둡니다볼 , 채반', 'image_url': 'https://recipe1.ezmember.co.kr/cache/recipe/2024/07/26/365b65d43e06aac9633a6bfbbc5c534d1.jpg'}, {'step_number': 2, 'description': '양파는 슬라이스해요도마 , 조리용나이프', 'image_url': 'https://recipe1.ezmember.co.kr/cache/recipe/2024/07/26/9d854e6e4c5f77be48589286aa99409e1.jpg'}, {'step_number': 3, 'description': '먹기좋게 썬 미역 볼에 담고 양파도 담아요', 'image_url': 'https://recipe1.ezmember.co.kr/cache/recipe/2024/07/26/9e3047306c4b04feadf028eea27e46761.jpg'}, {'step_number': 4, 'description': '맛간장, 식초, 레몬즙, 다진마늘, 생강청, 소금넣고 버물버물~ 수저 2개 사용해 섞어 주어요볼 , 조리용스푼', 'image_url': 'https://recipe1.ezmember.co.kr/cache/recipe/2024/07/26/447340b8ffea41556cb4408d22e4d3561.jpg'}, {'step_number': 5, 'description': '건미역 초무침 완성 입니다', 'image_url': 'https://recipe1.ezmember.co.kr/cache/recipe/2024/07/26/5ed817599fc49c3fce3fdebabc5073b01.jpg'}]"
10064,밑반찬,일상,건어물류,무침,진미채 무침,진미채무침,229,30분 이내,아무나,6인분 이상,"[('진미채                                                                                1봉', '180g'), ('맛술', '2Ts'), ('고추장', '1Ts'), ('고춧가루', '1Ts'), ('다진 마늘', '1Ts'), ('양조간장', '1Ts'), ('설탕', '1Ts'), ('매실청', '1Ts'), ('생강청', '1Ts'), ('조청', '1Ts'), ('참기름', '1/2Ts'), ('통깨', '1/2Ts'), ('물', '50ml')]",누구나 만들 수 있는 질기지도 않고 딱딱하지도 않은 진미채 무침을 만들어 보았어요.,"[{'step_number': 1, 'description': '시판용 진미채 한 봉이에요. 진미채는 백진미채, 홍진미채 어느 것이든 상관없어요. 선호하는 것으로 준비해 주세요.', 'image_url': 'https://recipe1.ezmember.co.kr/cache/recipe/2024/08/24/ac590a53b13be9b1b31193b8ae915ded1.jpg'}, {'step_number': 2, 'description': '씻을 수 있는 넓은 볼에 진미채를 담아주세요.\n믹싱볼', 'image_url': 'https://recipe1.ezmember.co.kr/cache/recipe/2024/08/24/118918b6596db05665a835f2c0258da21.jpg'}, {'step_number': 3, 'description': '진미채를 물로 1~2번 헹구어 주세요. 진미채에 배어 있는 소금기를 조금 제거하기도 하고 딱딱한 상태를 부드럽게 풀어 줄 수 있어요.', 'image_url': 'https://recipe1.ezmember.co.kr/cache/recipe/2024/08/24/16436976af90683fa20a6b061e5a8dc11.jpg'}, {'step_number': 4, 'description': '헹구어 낸 진미채를 체에 밭쳐 물기를 빼 주세요.채반', 'image_url': 'https://recipe1.ezmember.co.kr/cache/recipe/2024/08/24/55c4338c2a6b67e04228498416961f801.jpg'}, {'step_number': 5, 'description': '물기가 어느 정도 빠졌으면 손으로 꼭 짜서 볼에 넣어주세요. 길이가 긴 것은 가위를 이용해 먹기 좋게 잘라주세요. 여기에 분량의 맛술을 넣어 조물조물 무쳐서 잠시 놓아두세요.조리용가위', 'image_url': 'https://recipe1.ezmember.co.kr/cache/recipe/2024/08/24/c37c58a0d78168f9d96d6418537957e11.jpg'}, {'step_number': 6, 'description': '양념장을 만들기 위해 팬에 분량의 고추장, 고춧가루, 설탕을 넣어주세요.프라이팬 , 조리용스푼', 'image_url': 'https://recipe1.ezmember.co.kr/cache/recipe/2024/08/24/9f53595ccdc3ea49d4e246c1a84f49ba1.jpg'}, {'step_number': 7, 'description': '그리고 나머지 양념인 양조간장, 매실청, 생강청, 조청, 다진 마늘을 넣어주세요.생강청이 없으면 생략하고 매실청을 2Ts넣어 주세요.', 'image_url': 'https://recipe1.ezmember.co.kr/cache/recipe/2024/08/24/be61f2a8f34e9e321113682886ddcdd11.jpg'}, {'step_number': 8, 'description': '물 50ml를 부어 양념이 잘 풀어질 수 있도록 해 주세요.', 'image_url': 'https://recipe1.ezmember.co.kr/cache/recipe/2024/08/24/0c442a5c241642d543a3d669a11a948b1.jpg'}, {'step_number': 9, 'description': '잘 풀어진 양념을 끓여주세요.', 'image_url': 'https://recipe1.ezmember.co.kr/cache/recipe/2024/08/24/5e55500b1968ce19b62c90b37375d7691.jpg'}, {'step_number': 10, 'description': '바글바글 끓기 시작하면 조금 있다가 불을 꺼주세요.', 'image_url': 'https://recipe1.ezmember.co.kr/cache/recipe/2024/08/24/ac53ab2ef41efc0115cf42b43ae81aa51.jpg'}, {'step_number': 11, 'description': '끓은 양념장에 진미채를 넣어 주세요.', 'image_url': 'https://recipe1.ezmember.co.kr/cache/recipe/2024/08/24/37d75f4467f026228bd69a4c169b2bd11.jpg'}, {'step_number': 12, 'description': '진미채가 양념을 골고루 입을 수 있도록 잘 풀어가면 양념을 무쳐주세요.', 'image_url': 'https://recipe1.ezmember.co.kr/cache/recipe/2024/08/24/26464070d16214decc787db1a6c958511.jpg'}, {'step_number': 13, 'description': '양념장을 다 입은 진미채에 참기름과 통깨를 뿌려 완성해 주세요.', 'image_url': 'https://recipe1.ezmember.co.kr/cache/recipe/2024/08/24/9d535befdd9f359cef7a611b9c0f99681.jpg'}, {'step_number': 14, 'description': '진미채가 완성되었어요.찬기', 'image_url': 'https://recipe1.ezmember.co.kr/cache/recipe/2024/08/24/f3ca3a60146260ea89cd36bb2f2416a91.jpg'}, {'step_number': 15, 'description': '완성된 진미채는 보관 용기에 담아 냉장 보관하면서 소분해서 먹도록 하세요.', 'image_url': 'https://recipe1.ezmember.co.kr/cache/recipe/2024/08/24/c3558e202e5ba379b46058c8fc2369ec1.jpg'}]"
10065,밑반찬,일상,건어물류,무침,"매일 반찬 한가지...진미채 무말랭이무침,진미채무침, 무말랭이무침",진미채무말랭이무침,"38,056",15분 이내,아무나,4인분,"[('무말랭이', '2컵'), ('진미채', '100g'), ('간장', '1큰술'), ('청주', '2큰술'), ('물엿', '1큰술'), ('멸치액젓', '2큰술'), ('다진마늘', '1큰술'), ('매실청', '1큰술'), ('통깨', '1큰술'), ('고운 고추가루', '2.5큰술')]","식재료 하나는 외로운 듯 그래서 식재료 둘을 함께 무쳐 놓으니 맛도 두배, 식감도 두배가 되었습니다.","[{'step_number': 1, 'description': '무말랭이 2컵을 충분히 잠기도록 물을 부어 30분 이상 불려 줍니다.', 'image_url': 'https://recipe1.ezmember.co.kr/cache/recipe/2016/08/05/b50ec25b35b5aa68ab09942195e2bfb11.jpg'}, {'step_number': 2, 'description': '그리고 빨래 빨듯 빡빡 문질려 씻어 3~4번 흔들어 씻어 체에 건져 줍니다.', 'image_url': 'https://recipe1.ezmember.co.kr/cache/recipe/2016/08/05/b46424d7f81e336eaf283075ee3ef0491.jpg'}, {'step_number': 3, 'description': '진미채 100g을 그릇에 담고 간장 1큰술, 청주 2큰술, 물엿 1큰술 로 버무려 미리 양념에 재워 줍니다. 진미채는 무말랭이 길이에 맞춰 잘라 주시면 먹기 편하답니다.', 'image_url': 'https://recipe1.ezmember.co.kr/cache/recipe/2016/08/05/c5c7c434da8b67e4185148f8dbcfc7a81.jpg'}, {'step_number': 4, 'description': '큰 그릇에 물기를 꼭 짠 무말랭이를 담고 양념에 미리 재운 진미채도 담아 줍니다.', 'image_url': 'https://recipe1.ezmember.co.kr/cache/recipe/2016/08/05/d98d85919091bc59f2bfa205957052341.jpg'}, {'step_number': 5, 'description': '그리고 멸치액젓 2큰술, 다진마늘 1큰술, 매실청 1큰술 을 섞은 양념을 넣고 고루 버무려 줍니다.', 'image_url': 'https://recipe1.ezmember.co.kr/cache/recipe/2016/08/05/1ed5a42c8e8a767a5ce0be9f7e2bcd091.jpg'}, {'step_number': 6, 'description': '그리고 고운 고추가루 2 + 1/2큰술을 넣고 버무린 후', 'image_url': 'https://recipe1.ezmember.co.kr/cache/recipe/2016/08/05/1b941e4a9d238ecb5b1218425f9cc0981.jpg'}, {'step_number': 7, 'description': '통깨 1큰술을 넣고 한번 더 버무려 줍니다.', 'image_url': 'https://recipe1.ezmember.co.kr/cache/recipe/2016/08/05/d25d9d4eff03418f36c6adc42c10f2ed1.jpg'}, {'step_number': 8, 'description': '진미채만 골라 먹어도 맛나고 무말랭이만 골라 먹어도 맛나고 둘을 함께 먹어도 맛있는 식감이 맛난 반찬이랍니다.', 'image_url': 'https://recipe1.ezmember.co.kr/cache/recipe/2016/08/05/c587786bc70f46ac7076d92fd69a18071.jpg'}]"
10066,밑반찬,일상,건어물류,무침,"매일 반찬 한가지..도라지 황태무침, 황태 도라지무침",황태도라지무침,"17,092",30분 이내,초급,4인분,"[('황태채', '1줌'), ('도라지', '1.5줌'), ('초고추장', '4큰술'), ('고추가루', '1큰술'), ('다진마늘', '1/2큰술'), ('매실청', '1큰술'), ('참기름', '1/2큰술'), ('통깨', '1큰술')]",도라지와 황태채를 함께 새콤하니 무쳐 놓으니 입맛 돋구는 반찬 한가지 득템했답니다. 아삭하니 씹히는 도라지와 양념이 쏙 밴 쫀득한 식감의 황태가 은근 서로 잘 어울리네요. 젓가락이 자꾸 갑니다.,"[{'step_number': 1, 'description': '큰 그릇에 도라지를 담고 소금 1큰술정도와 물 1컵 정도를 넣고 손으로 빡빡 문질러 쓴맛을 빼줍니다.', 'image_url': 'https://recipe1.ezmember.co.kr/cache/recipe/2017/08/14/407275b43485e503ee6ba36e647203ac1.jpg'}, {'step_number': 2, 'description': '그리고 흐르는 물에 흔들어 씻어 체에 건져 물기를 최대한 빼 줍니다.', 'image_url': 'https://recipe1.ezmember.co.kr/cache/recipe/2017/08/14/429df78bbf8ad00c3da85e5c1e94439c1.jpg'}, {'step_number': 3, 'description': '황태채는 물에 담궈 불리는것이 절대 아닙니다. 황태채는 물에 담궈 바로 건져 물기를 꼭 짜줍니다. 그래야 양념이 잘 배어 든답니다.', 'image_url': 'https://recipe1.ezmember.co.kr/cache/recipe/2017/08/14/4f83f3e1c2d01715afcd1e1f58d31a2e1.jpg'}, {'step_number': 4, 'description': '그리고 황태채가 굵은 건 길게 찢어 줍니다.', 'image_url': 'https://recipe1.ezmember.co.kr/cache/recipe/2017/08/14/0ab7e3043df818c67fc03fc986e26ace1.jpg'}, {'step_number': 5, 'description': '준비한 황태채 1줌, 도라지 1 + 1/2줌을 큰 그릇에 담고 초고추장 4큰술, 고추가루 1큰술, 다진마늘 1/2큰술, 매실청 1큰술, 참기름 1/2큰술, 통깨 1큰술을 넣고 조물조물 무쳐 줍니다.', 'image_url': 'https://recipe1.ezmember.co.kr/cache/recipe/2017/08/14/9fa6bc4e9dad131d329b70484f9951671.jpg'}]"
10067,밑반찬,일상,건어물류,무침,오징어채무침 쫄깃쫄깃 맛있는 반찬~#,오징어채무침,"6,759",15분 이내,아무나,4인분,"[('오징어채', '150g'), ('고추장', '1큰술'), ('마요네즈', '1큰술'), ('올리고당', '2큰술'), ('고춧가루', '2/3큰술'), ('송송썬파', '약간'), ('참기름', '1큰술'), ('통깨', '1/2큰술')]","멸치볶음과 함께 마른밑반찬계의 양대산맥을 이루는 오징어채무침~ 언제 먹어도 그 쫄깃쫄깃한 맛이 일품이랍니다. 밥반찬 뿐만 아니라 도시락반찬과 아빠들 술안주로도 좋은 밑반찬, 더운 여름 볶지 않고 간단하게 휘리릭 무쳐봅니다.","[{'step_number': 1, 'description': '오징어채를 물에 담궈 한번 씻어 물기를 꼭 짜 줍니다. 길이가 긴것도 있어 먹기 편하게 가위로 몇번 잘라 주었어요.', 'image_url': 'https://recipe1.ezmember.co.kr/cache/recipe/2016/07/25/48d62c0668596f4976387160d36e2d601.jpg'}, {'step_number': 2, 'description': '참기름을 제외한 분량의 양념을 모두 넣고 조물조물 골고루 무쳐 주세요.', 'image_url': 'https://recipe1.ezmember.co.kr/cache/recipe/2016/07/25/4eefe81c797e333e1ca340dd1e76effb1.jpg'}, {'step_number': 3, 'description': '참기름은 맨 나중에 넣어 한번 더 무쳐 주시면 되요.', 'image_url': None}]"
10068,밑반찬,일상,건어물류,무침,빨간 오징어채 무침,오징어채무침,"9,673",30분 이내,아무나,6인분 이상,"[('오징어 채', '400g'), ('고추장', '1큰술'), ('고춧가루', '1큰술'), ('참기름', '1큰술'), ('마늘', '1큰술'), ('통깨', '약간'), ('올리고당', '1.5컵')]",간단하게 만들어 두고 먹는 밑반찬,"[{'step_number': 1, 'description': '진미채라고 불리는 오징어채에요. 요게 한 400그램 정도 되는거 같아요. 그냥 집어 먹어도 짭조름하니 맛나다는....', 'image_url': 'https://recipe1.ezmember.co.kr/cache/recipe/2015/08/06/3b20167fa6384994ac1cd364abc0dd751.jpg'}, {'step_number': 2, 'description': '가위로 먹기 좋은 크기로 잘라줘요. 긴거보다 약간 짧은게 좋아요. 너무 길면 막막 엉키고 그러거든요.', 'image_url': 'https://recipe1.ezmember.co.kr/cache/recipe/2015/08/06/299e802de5906cc8a37378b77b1de2de1.jpg'}, {'step_number': 3, 'description': '양념장을 한번 끓여요. 고추장1술, 마늘1술, 고춧가루 1술, 참기름 1술, 생강가루 약간(요건 없으면 안 넣어도 되요). 그리고 올리고당 왕창. 전 올리고당으로 농도를 맞추거든요. 일반 물엿보다 덜 달아서 요거 하기에 딱 좋아요. 대락 종이컵으로 1컵반 정도 넣은거 같아요. 소금은 따로 넣지 않아요. 고추장도 들어가고 오징어채 자체에 간이 있어서리.', 'image_url': 'https://recipe1.ezmember.co.kr/cache/recipe/2015/08/06/ea6e20f42bdc0d7e6020aeff3ac05e401.jpg'}, {'step_number': 4, 'description': '양념을 보글보글 끓이여요. 고품이 전체적으로 쑤욱 올라오면 불을 꺼요.', 'image_url': 'https://recipe1.ezmember.co.kr/cache/recipe/2015/08/06/bc87d35cc73cf1509ebcb23a2f6ce44a1.jpg'}, {'step_number': 5, 'description': '거기에 잘라놓은 오징어채를 넣고 뒤적뒤적하면서 골고루 버무려줘요. 절대 불켜고 볶아주면 앙대요. 딱딱해지거든요.', 'image_url': 'https://recipe1.ezmember.co.kr/cache/recipe/2015/08/06/72a7d47fea2fa5272f14557d06ff5a8a1.jpg'}, {'step_number': 6, 'description': '마지막으로 통깨 솔솔 뿌려서 골고루 섞이게 뒤적이구요.', 'image_url': 'https://recipe1.ezmember.co.kr/cache/recipe/2015/08/06/0bbb119fd36082f4d5bcf742a8395ff91.jpg'}, {'step_number': 7, 'description': '빛깔도 빨갛게 되고 간도 자지 않고 물 말아 먹기 딱 좋다는. 물론 맥주 좋아하시는 분들의 안주로도 괜찮아요.', 'image_url': 'https://recipe1.ezmember.co.kr/cache/recipe/2015/08/06/83d2c1e950569d086c5151980031e3dc1.jpg'}]"
10069,밑반찬,일상,건어물류,무침,고추장오징어채,고추장오징어채,"6,876",30분 이내,초급,2인분,"[('오징어채', '160g'), ('고추장', '1큰술'), ('간장', '1.5큰술'), ('설탕', '1큰술'), ('다진마늘', '0.5큰술'), ('마요네즈', '1큰술'), ('참기름', '1큰술'), ('올리고당', '1큰술')]",그냥 먹어도 맛있지만 매콤달콤한 양념을 만들어 휘리릭 섞어주면 더욱 맛있는 고추장오징어채입니다. 쫄깃쫄깃하면서도 부드럽고 매콤하면서도 달콤고소한 반찬! 도시락 반찬 베스트 메뉴랍니다.,"[{'step_number': 1, 'description': '오징어채는 먹기 좋게 가위로 잘라주세요.', 'image_url': 'https://recipe1.ezmember.co.kr/cache/recipe/2016/01/21/66a607242747bf6dfbf3c73fb4ee7f2c1.jpg'}, {'step_number': 2, 'description': '물에 한번 깨끗하게 씻어주세요.', 'image_url': 'https://recipe1.ezmember.co.kr/cache/recipe/2016/01/21/7a034a16029732629478959a415b24901.jpg'}, {'step_number': 3, 'description': '진미채소스 전 위 레시피에서 청양고추가루 반큰술 추가했어요. 맵지 않은듯해서요.', 'image_url': 'https://recipe1.ezmember.co.kr/cache/recipe/2016/01/21/e2e07bb5a2a0d5d5f897a1e25ebd86251.jpg'}, {'step_number': 4, 'description': '물기를 제거한 진미채에 마요네즈 1큰술을 넣고 잘 무쳐주세요.', 'image_url': 'https://recipe1.ezmember.co.kr/cache/recipe/2016/01/21/3fa1d81e64ade9d07226e08a5807c8431.jpg'}, {'step_number': 5, 'description': '양념을 넣고 조물조물~ 무쳐주고 마무리고 참기름을 넣으면되요.', 'image_url': 'https://recipe1.ezmember.co.kr/cache/recipe/2016/01/21/78e77aee1cf7ddc8442cb2b8c027893e1.jpg'}, {'step_number': 6, 'description': '초 간단 밑반찬 고추장진미채 완성 완전 부드러워요. 근데 팬에 넣고 한번 볶으면 좀 더 맛있을거같아요.', 'image_url': 'https://recipe1.ezmember.co.kr/cache/recipe/2016/01/21/fbcbe5bdfa7c8f68892c3950c678c6341.jpg'}]"
10070,밑반찬,일상,건어물류,무침,매콤달콤 고소하고 부드러운 북어채 무침,북어채무침,"13,835",5분 이내,초급,5인분,"[('마른 북어채', '200g'), ('고추장', '3.5T'), ('설탕', '3T'), ('마요네즈', '3T'), ('간장', '2/3T'), ('다진마늘', '1/2T'), ('참깨                                                                                생략가능', '1T')]","보송보송하고 부드러운 북어채에 
매콤하고 달콤 고소한 소스가 함께 ~ 
따뜻한 밥에 북어채 무침 하나 딱 얹혀서 먹으면 캬 ~ 맛있습니다. ^_^","[{'step_number': 1, 'description': '북어는 먹기 좋게 가위로 쑥떡쑥떡 잘라주세요. 그리고 찬물에 30 초 정도 담궈놨다가 물을 빼주시고 , 손으로 물을 꼭 짜주세요. \n물에 담궈놓는 시간은 더 짧게 혹은 더 길게 놔두셔도 돼요. 북어채의 부드러움의 정도를 조절해줍니다.\n저는 딱딱한거 안좋아해서 부드럽게~', 'image_url': 'https://recipe1.ezmember.co.kr/cache/recipe/2015/11/13/2add4622e9052445318376ec110824d11.jpg'}, {'step_number': 2, 'description': '적당한 크기의 그릇에 물기를 꼭 짠 북어채를 넣어주세요. 그리고 모든 양념을 다 넣어주세요.', 'image_url': 'https://recipe1.ezmember.co.kr/cache/recipe/2015/11/13/7db5209c2ccb1c16abbfb58bfbbb5a691.jpg'}, {'step_number': 3, 'description': '손이나 수저.. 등을 이용해서 조물조물 잘 섞어주세요.', 'image_url': 'https://recipe1.ezmember.co.kr/cache/recipe/2015/11/13/efebbf35283fb3bd95c0e03b2dbf457f1.jpg'}]"
10071,밑반찬,일상,건어물류,무침,태국산 오징어포 무침,오징어포무침,"6,565",15분 이내,초급,2인분,"[('태국 오징어포                                                                                 5줌', '1봉지'), ('고추장', '2.5큰술'), ('간장', '1큰술'), ('올리고당', '1.5큰술'), ('참기름', '1큰술'), ('통깨', '1/2큰술')]",진미채무침처럼 같은 양념으로 태국산 오징어포 무침을 만들어 보겠습니다.,"[{'step_number': 1, 'description': '큰 볼에 손질한 오징어포를 넣어주고요.', 'image_url': 'https://recipe1.ezmember.co.kr/cache/recipe/2015/05/15/7cba5361ef9b7be17ae445eca5e7391d1.jpg'}, {'step_number': 2, 'description': '양념은 우리나라 진미채 무침과 동일합니다. 고추장 2큰술반, 간장 1큰술, 올리고당 1큰술반, 참기름 1큰술, 통깨 반큰술 등입니다. 올리고당 대신 물엿도 좋구요. 설탕을 반반씩 섞어도 좋답니다.', 'image_url': 'https://recipe1.ezmember.co.kr/cache/recipe/2015/05/15/5d1a92df45d0f253e4a818267a7c476a1.jpg'}, {'step_number': 3, 'description': '고루 섞어주시면 되구요. 만약 설탕을 넣을 때에는 설탕을 특히 잘 녹도록 하는 것이 포인트입니다.', 'image_url': 'https://recipe1.ezmember.co.kr/cache/recipe/2015/05/15/e04f5fbdc2f03c35adf4cc7bc52b21ac1.jpg'}, {'step_number': 4, 'description': '양념을 넣고 조물조물 무쳐주면 됩니다.', 'image_url': 'https://recipe1.ezmember.co.kr/cache/recipe/2015/05/15/ba63d2907e1107e1ad7cf73ee5584b571.jpg'}]"
