index,종류별,상황별,재료별,방법별,글 제목,레시피이름,조회수,조리시간,난이도,인분,재료,소개글,조리순서
39930,메인반찬,술안주,해물류,부침,비오면 생각나는 음식 해물파전 만드는법 (동래파전st) 고소하고 맛있어요,해물파전,"3,616",20분 이내,중급,2인분,"[('해물믹스', '3줌'), ('쪽파', '1주먹'), ('부침가루', '1컵'), ('튀김가루', '1컵'), ('계란', '3알'), ('물', ''), ('간장', '2T'), ('식초', '1T'), ('물', '1T'), ('통깨', '1T')]","비오는 날 생각나는 음식으로
고소하고 맛있는 해물파전!!
​
오늘의 레시피는 부산의 유명한
동래파전스타일의 해물파전입니다.","[{'step_number': 1, 'description': '전 해물믹스를 사용했어요.\n해물믹스는 냉동상태이기 때문에 미리 꺼내서 해동시켜 혹시 모를 이물질을 제거하기 위해 물에 깨끗하게 헹궈주신 후 체에 받쳐 물기를 제거해주세요.', 'image_url': 'https://recipe1.ezmember.co.kr/cache/recipe/2022/01/04/5dc9feff279a32b57eb3d19bb8d12c231.jpg'}, {'step_number': 2, 'description': '파전 반죽을 만들게요.\n부침가루 1컵+튀김가루1컵을 볼에 담고 물을 조금씩 부어가며 반죽 농도를 맞춰주세요.', 'image_url': 'https://recipe1.ezmember.co.kr/cache/recipe/2022/01/04/9c6a44e961eae7b16daf43110e0bad6e1.jpg'}, {'step_number': 3, 'description': '저는 동래파전스타일로 만들거라서 반죽을 묽게 했어요.', 'image_url': 'https://recipe1.ezmember.co.kr/cache/recipe/2022/01/04/c7ee2c25d552dbbb5dfda231e2a218b31.jpg'}, {'step_number': 4, 'description': '쪽파를 손질해주세요.\n쪽파를 비닐봉다리에 묶어서 보관했더니\n파들이 꼬부러졌더라구요ㅠㅠ쪽파 손질법 레시피', 'image_url': 'https://recipe1.ezmember.co.kr/cache/recipe/2022/01/04/8a904dfb1865d5c7cdd6a798044c1efd1.jpg'}, {'step_number': 5, 'description': '쫙쫙 펴져있어야 하는데...\n그래서 먹기좋게 쪽파를 잘라주었습니다.', 'image_url': 'https://recipe1.ezmember.co.kr/cache/recipe/2022/01/04/a7a5cf3b3927da487cdf037baeedd5611.jpg'}, {'step_number': 6, 'description': '계란 3개를 풀어주세요.', 'image_url': 'https://recipe1.ezmember.co.kr/cache/recipe/2022/01/04/29102dbf0974b10bd9f16b777867b8fe1.jpg'}, {'step_number': 7, 'description': '그리고 초간장 미리 만들어두기\n(사진이 없어요)\n(간장 2T, 식초1T, 물1T, 통깨1T)', 'image_url': None}, {'step_number': 8, 'description': '기름을 넉넉하게 부은 팬에 반죽을 펼쳐주세요', 'image_url': 'https://recipe1.ezmember.co.kr/cache/recipe/2022/01/04/6484e836b4abb208676287cffc3e10fe1.jpg'}, {'step_number': 9, 'description': '쪽파를 올려주세요.', 'image_url': 'https://recipe1.ezmember.co.kr/cache/recipe/2022/01/04/c93871896ab50e18f04826eaed1d25ad1.jpg'}, {'step_number': 10, 'description': '해물도 올려주세요.', 'image_url': 'https://recipe1.ezmember.co.kr/cache/recipe/2022/01/04/a74f98900a5433a90c2b39fbcec288791.jpg'}, {'step_number': 11, 'description': '해물 위에 반죽을 조금만 흐트리듯 올려준 후 계란물을 뿌려주세요.', 'image_url': 'https://recipe1.ezmember.co.kr/cache/recipe/2022/01/04/8f1fa44274101491a9e60b998874d5f41.jpg'}, {'step_number': 12, 'description': '불은 중약불을 유지해주셔야합니다.\n노릇노릇 맛있게 익어가고 있어욧~\n기다리는거 너무 힘들어요 ㅠㅠ중약불 유지하기', 'image_url': 'https://recipe1.ezmember.co.kr/cache/recipe/2022/01/04/b0255503aac97d5351eb9f4109e21f111.jpg'}, {'step_number': 13, 'description': '전부치기의 핵심은 뒤집기잖아요??\n처음엔 잘 뒤집었죠?? 그런데 요기서 한번더 뒤집어서 구워주는데 그 타이밍이 진짜 중요하답니다.\n뒤집은 후에도 기름을 추가해서 충분히 익혀야 흐트러지지 않고 모양이 이쁘게 나와요.처음 뒤집은 후 기름을 추가해서 충분히 익혀주세요.', 'image_url': 'https://recipe1.ezmember.co.kr/cache/recipe/2022/01/04/a52577c20b8bf8badfd0bed576eebdc21.jpg'}, {'step_number': 14, 'description': '아주 고소하고 맛있는 해물파전이 완성되었어요~', 'image_url': 'https://recipe1.ezmember.co.kr/cache/recipe/2022/01/04/881766a71afc42001e6c64340ed6e4bf1.jpg'}, {'step_number': 15, 'description': '해물파전 한 젓가락 하실래요??\n전 초간장에 콕콕 찍어먹을거라 전에는 별다른 간을 안했어요.\n부침가루자체에도 약간의 간이 되어있어서 파전자체로는 담백고소한 맛이 느껴져요!!', 'image_url': 'https://recipe1.ezmember.co.kr/cache/recipe/2022/01/04/1afd48fb4e9ae4256dd36f8b10d9edf61.jpg'}, {'step_number': 16, 'description': '저는 동래파전스타일로 하고 싶어서 반죽따로 쪽파따로 해물따로 다 올렸지만\n그냥 반죽물에 해물이랑 쪽파 다 같이 섞어서 일반 전처럼 부쳐도 맛에는크게 차이가 없으면서 쉽게 부칠수 있으니 그렇게 만드셔도 괜찮을것 같아요.\n막걸리안주로 해물파전 맛있게 만들어드셔보는건 어떨까요??', 'image_url': 'https://recipe1.ezmember.co.kr/cache/recipe/2022/01/04/4437d9a7cf59fc2842a847edf3a1b9ac1.jpg'}]"
39931,메인반찬,술안주,해물류,부침,바삭바삭 노릇한! 마라 해물부추전 레시피,해물부추전,895,20분 이내,초급,2인분,"[('오징어', '100g'), ('새우', '100g'), ('조개살', '80g'), ('부추', '130g'), ('부침가루', '200g'), ('탄산수', '350g'), ('마라소스', '50g'), ('당근', '조금'), ('청고추', ''), ('홍고추', '')]","막걸리, 소주, 맥주와 찰떡궁합인 맛있는 부추전-!
전을 좋아하시는 분들이라면
이색적인 마라 맛 부추전의 매력에 홀딱 빠지실텐데요~

술안주 뿐 아니라 식사 대용으로도
출출할 때 간식으로도 제격인 부추해물전 레시피입니다.","[{'step_number': 1, 'description': '당근은 채썰고,\n부추는 3cm 길이로 잘라주세요.\n손질된 새우 1/2은 반으로 가르고\n1/2은 잘게 잘라주세요.당근 손질법 레시피\u200b', 'image_url': 'https://recipe1.ezmember.co.kr/cache/recipe/2022/01/05/a7da00fd0fff54f955d88bbc09ef55a11.jpg'}, {'step_number': 2, 'description': '부침가루에 탄산수를 넣고 잘 섞어주세요.나중에 야채와 마라소스가 들어가므로\n약간 되직하게 반죽을 해주는게 포인트!\n\n\u200b탄산수는 처음부터 많이 넣지 말고\n반죽을 섞어가며 양을 봐주시면 좋아요 :-)', 'image_url': 'https://recipe1.ezmember.co.kr/cache/recipe/2022/01/05/471624cf2716560a881423945960b85b1.jpg'}, {'step_number': 3, 'description': '부추와 당근을 넣고 잘 섞어준 후\n마라소스를 넣어주세요.', 'image_url': 'https://recipe1.ezmember.co.kr/cache/recipe/2022/01/05/38f1fcf6e7c9e2c1664067b80d7530b81.jpg'}, {'step_number': 4, 'description': '기름을 넉넉히 두른 팬에\n반죽을 고르게 펴고\n조개살, 오징어, 새우 등\n여러가지 해물을 토핑해주세요.빠알간 청홍고추를 얹어주면 더 예쁘겠죠?', 'image_url': 'https://recipe1.ezmember.co.kr/cache/recipe/2022/01/05/fc1d402e41b68ba788626d55d23ea6831.jpg'}, {'step_number': 5, 'description': '전의 바삭함은 뒤집기가 생명!\n앞뒤로 노릇노릇 구워주세요 :-)', 'image_url': 'https://recipe1.ezmember.co.kr/cache/recipe/2022/01/05/f962f877fe5c49355e1a18f1a371fa691.jpg'}, {'step_number': 6, 'description': '노릇노릇 바삭바삭\n너무 먹음직스러워 보이는\n마라 해물부추전 완성!', 'image_url': 'https://recipe1.ezmember.co.kr/cache/recipe/2022/01/05/588a5a8264333f821357e291452fbfbd1.jpg'}]"
39932,메인반찬,술안주,해물류,부침,해물 대파전 만들기,해물대파전,"1,176",30분 이내,아무나,1인분,"[('부침가루', '1컵'), ('밀가루', '1컵'), ('다진마늘', '1큰술'), ('당근', '소량'), ('대파', '1대'), ('해물믹스', '2줌')]",캠핑을 다녀온 후에 파가 너무 많이 남아버려서 대파를 어떻게 해야하나 고민하다가 빠르게 소진하기 위해 밀가루 반죽에 대파를 넣어 대파전을 만들었어요 역시 대파전은 진리인 것 같아요!,"[{'step_number': 1, 'description': '부침개나 전을 부칠때 해물을 넣게되면 가능한 한번 데친 후에 반죽에 섞어주세요! 한번 데쳐준 후에 반죽에 섞으면 부침개나 전을 구울 때 해물이 분리되지 않아 깨끗하게 굽고 먹을 수 있어요!', 'image_url': 'https://recipe1.ezmember.co.kr/cache/recipe/2022/02/14/36b77e5e20cb8f9d7fe6cae961a69bde1.jpg'}, {'step_number': 2, 'description': '부침가루 1컵에 밀가루 1컵 그리고 물 1컵을 넣어 반죽을 만들어 주세요 반죽이 만들어지면 다진마늘 1큰술과', 'image_url': 'https://recipe1.ezmember.co.kr/cache/recipe/2022/02/14/c0d47400c8f88295b528a618667c20251.jpg'}, {'step_number': 3, 'description': '당근 소량을 채썰어 넣어주고 대파도 적당한 크기로 썰어서 반죽에 넣어 섞어주세요', 'image_url': 'https://recipe1.ezmember.co.kr/cache/recipe/2022/02/14/1e798d367f16e926407ff117d6265f441.jpg'}, {'step_number': 4, 'description': '미리 데쳐놓았던 해물믹스도 넣어서 잘 섞어주면 반죽이 완성됩니다! 너무 간단하지요?', 'image_url': 'https://recipe1.ezmember.co.kr/cache/recipe/2022/02/14/1eefc9ba8bdd6dd138403bef404cc9211.jpg'}, {'step_number': 5, 'description': '전을 만들때에는 팬에 식용유를 넉넉히 둘러주어야 바삭바삭하고 맛있는 전이 완성이 돼요', 'image_url': 'https://recipe1.ezmember.co.kr/cache/recipe/2022/02/14/8b3e2e5da6b31268d1d39131767843bc1.jpg'}, {'step_number': 6, 'description': '식용유를 두른팬에 반죽을 올려주고 적당한 크기로 쳐서 앞뒤를 골고루 부쳐 주세요 앞뒷면이 노릇하게 구워질때까지 잘 부쳐줍니다', 'image_url': 'https://recipe1.ezmember.co.kr/cache/recipe/2022/02/14/5cb78632c9ed7f8052345653d53124531.jpg'}, {'step_number': 7, 'description': '그렇게 완성된 대파전이에요! 재료가 번거롭지도 않고 복잡하게 들어가지 않아서 맛있게 먹을 수 있어요', 'image_url': 'https://recipe1.ezmember.co.kr/cache/recipe/2022/02/14/ce6a67ca4e5eb53002000184244ace4b1.jpg'}]"
39933,메인반찬,술안주,해물류,부침,동래파전 만들기 해물파전 레시피,해물파전,"4,152",15분 이내,초급,3인분,"[('쪽파', '1줌'), ('홍고추', '2개'), ('청양고추', '2개'), ('홍합살', '적당량'), ('냉동새우', '적당량'), ('부침가루', '3T'), ('튀김가루', '2T'), ('밀가루', '1T'), ('달걀', '2개'), ('멸치액젓', '1T'), ('건새우가루', '0.8T'), ('식용유', '적당량'), ('간장', '5T'), ('식초', '3T'), ('고추가루', '1/2스푼'), ('깨소금', '1/2스푼'), ('양파', '약간'), ('청양고추', '2개')]","시장에 갔다가 쪽파를 보니
예전에 부산 동래에서 먹은 동래파전이 생각이 나서
만들어봤어요^^","[{'step_number': 1, 'description': '쪽파는 깨끗히 씻어서 기름 두른 팬에 가지런히 놓아주세요', 'image_url': 'https://recipe1.ezmember.co.kr/cache/recipe/2022/05/24/ca5e17394c89399852e512d403e8c0621.jpg'}, {'step_number': 2, 'description': '홍합은 살짝 데쳐서 채에 받쳐 물기를 제거 해줍니다', 'image_url': 'https://recipe1.ezmember.co.kr/cache/recipe/2022/05/24/8bec9db95ce96b65196996e32320dda51.jpg'}, {'step_number': 3, 'description': '밀가루물을 만들때 부침가루,튀김가루,밀가루를 3:2:1로 넣고\n멸치액젓 1스푼 넣어주세요', 'image_url': 'https://recipe1.ezmember.co.kr/cache/recipe/2022/05/24/d56b6318f80ac262100b6f83349c96e71.jpg'}, {'step_number': 4, 'description': '건새우를 갈아 넣으면 풍미가 훨씬 좋은데 건새우 대신 건새우가루를 사용하면 편해요~~ 한스푼이 조금 안되게 넣어주세요', 'image_url': 'https://recipe1.ezmember.co.kr/cache/recipe/2022/05/24/6b12b9d675522e725d35a6047a4c57621.jpg'}, {'step_number': 5, 'description': '양념장도 만들어 둘께요 \n양파와 청양고추 (홍고추 섞어주면 색감이 예뻐요^^)를 잘라서 담아두고', 'image_url': 'https://recipe1.ezmember.co.kr/cache/recipe/2022/05/24/339102c9f0cfeff504fa87838e6eacf01.jpg'}, {'step_number': 6, 'description': '간장5,식초3,깨소금1 넣고 양념장도 완성해줘요 ^^', 'image_url': 'https://recipe1.ezmember.co.kr/cache/recipe/2022/05/24/41d563bfa69b067e98cc04affe804fff1.jpg'}, {'step_number': 7, 'description': '쪽파위에 밀가루 물을 지그재그로\n부어주고 데쳐둔 홍합과 새우도 골고루 놓아줍니다', 'image_url': 'https://recipe1.ezmember.co.kr/cache/recipe/2022/05/24/c6ed1cc60030f7ba37fc2feb40564ad21.jpg'}, {'step_number': 8, 'description': '청양고추와 홍고추도 골고루 놓아줘요', 'image_url': 'https://recipe1.ezmember.co.kr/cache/recipe/2022/05/24/f458bb53e1d4c670048c2ff8b33bf1291.jpg'}, {'step_number': 9, 'description': '달걀 2개를 톡 깨트린 뒤\n숟가락으로 펴줘요^^', 'image_url': 'https://recipe1.ezmember.co.kr/cache/recipe/2022/05/24/3645fa52ab0be9dfc98b02c889ca5d141.jpg'}, {'step_number': 10, 'description': '약불로 잘 익혀주세요', 'image_url': 'https://recipe1.ezmember.co.kr/cache/recipe/2022/05/24/7efe010bcf01ef0821052d1a1c96edae1.jpg'}, {'step_number': 11, 'description': '뒤집어서 조금만 더 익혀주면 완성', 'image_url': 'https://recipe1.ezmember.co.kr/cache/recipe/2022/05/24/9e23cb749badf95018b8b2d7dbc27e681.jpg'}, {'step_number': 12, 'description': '파와 홍합과 새우 삼합에 \n만들어 둔 간장양념에 콕 찍어 먹으면\n정말 맛있어요^^', 'image_url': 'https://recipe1.ezmember.co.kr/cache/recipe/2022/05/24/44f20a195394b2d9129a3e09b50758401.jpg'}]"
39934,메인반찬,술안주,해물류,부침,바삭바삭한 부추전 만들기,부추전,"1,157",30분 이내,초급,2인분,"[('양파', '1/2개'), ('당근', '1/4개'), ('새우', '4마리'), ('부추', '1줌'), ('식용유', '적당량'), ('간장', '2T'), ('참기름', '1/2T'), ('고추가루', '1/2T'), ('식초', '1/2T'), ('깨', '약간')]","비오는날에 빼놓을 수 없는 전요리에요. 
간단한 야채들로 바삭바삭 맛있는 부추전을 만들어 보세요.","[{'step_number': 1, 'description': '재료들을 준비해 주세요. \n부추 한줌은 먹기좋은 크기로 잘라주세요. \n양파 반개는 가늘게 썰어 준비해주세요. \n당근은 1/4개 가늘게 채 썰어 준비해 주세요. \n새우는 4마리를 잘게 썰어 준비했어요.새우는 홍합, 오징어 등으로 대체가 가능해요. \n준비된 해물이 없다면 해물을 생략해도 좋아요.', 'image_url': 'https://recipe1.ezmember.co.kr/cache/recipe/2022/06/19/f4bb1556d90728d8d5b1a6df66483f9b1.jpg'}, {'step_number': 2, 'description': '준비한 재료들을 믹싱볼에 넣어주세요.', 'image_url': 'https://recipe1.ezmember.co.kr/cache/recipe/2022/06/19/1bf7e36d2bdfb4f43bb672a183d17ef31.jpg'}, {'step_number': 3, 'description': '종이컵으로 한컵 분량의 부침가루를 넣어주세요.', 'image_url': 'https://recipe1.ezmember.co.kr/cache/recipe/2022/06/19/7b821ff4f84afd26f209f50fdb19ece21.jpg'}, {'step_number': 4, 'description': '물은 종이컵의 2/3 만큼만 넣어주세요.부드러운 반죽을 원하면 물과 부침가루의 비율은 1:1이 좋아요. \n하지만 바삭바삭한 전을 원한다면 물을 부침가루보다 살짝 적게 넣어주는 것이 좋아요.', 'image_url': 'https://recipe1.ezmember.co.kr/cache/recipe/2022/06/19/f45c2e2d402cee3139244c44d5b2fc4a1.jpg'}, {'step_number': 5, 'description': '준비된 반죽은 기름을 듬뿍두른 팬에 올리고 \n예쁘게 모양을 잡아주세요.강불 팬에 기름을 넉넉하게 둘러주세요. 튀기듯이 구워야 바삭바삭 맛있어요.', 'image_url': 'https://recipe1.ezmember.co.kr/cache/recipe/2022/06/19/99f2d6234ab4bd7d0f42caa900ba8a871.jpg'}, {'step_number': 6, 'description': '한쪽면이 잘 익으면 잘 뒤집어서 \n반대쪽도 노릇노릇하게 익혀주세요.이때 기름이 줄어들었다면 한번 더 기름을 둘러주면 좋아요.', 'image_url': 'https://recipe1.ezmember.co.kr/cache/recipe/2022/06/19/419ed8e586d6cfd54bc70bac46eaeaeb1.jpg'}, {'step_number': 7, 'description': '다음으로 찍어먹을 간장소스를 만들어주세요. \n먼저 간장 2T을 넣어주세요.', 'image_url': 'https://recipe1.ezmember.co.kr/cache/recipe/2022/06/19/14dc4b019415b8a2b8a56bc1e6d855f81.jpg'}, {'step_number': 8, 'description': '참기름은 1/2T을 넣어줍니다.', 'image_url': 'https://recipe1.ezmember.co.kr/cache/recipe/2022/06/19/42e6d85b092bedb9748034d624eb26ad1.jpg'}, {'step_number': 9, 'description': '식초도 1/2T을 넣어주세요.식초는 생략하셔도 좋아요.', 'image_url': 'https://recipe1.ezmember.co.kr/cache/recipe/2022/06/19/e17b0ad4da309126291d031700f297811.jpg'}, {'step_number': 10, 'description': '고춧가루를 1/2T 넣어주세요.', 'image_url': 'https://recipe1.ezmember.co.kr/cache/recipe/2022/06/19/23586a530b6bc46fa7acb1cd849d086f1.jpg'}, {'step_number': 11, 'description': '마지막으로 참깨도 솔솔뿌려주면 완성입니다.', 'image_url': 'https://recipe1.ezmember.co.kr/cache/recipe/2022/06/19/94a41a4a5bc7fb61dd1e4a632232bd961.jpg'}]"
39935,메인반찬,술안주,해물류,부침,바삭바삭 맛있는 새우 부추부침개 만드는 법 안주로 최고.,부추부침개,"1,105",30분 이내,아무나,2인분,"[('부추', '250g'), ('새우살', '200g'), ('부침가루', '1컵'), ('튀김가루', '1컵'), ('물', '2컵'), ('청양고추', '1개'), ('홍고추', '1개'), ('식용유', '적당량')]","어머니께서 부침개가 드시고 싶다고 하셨습니다.

그렇다면 만들어 드려야죠.

부침개 만드는 것은 일도 아니니까.

(설거지는 어머니께서 해주셨어요.)

무슨 부침개 드시고 싶냐고 물어봤는데 그냥 부침개가 드시고 싶다고 하셨습니다.

그래서 부침개하면 생각나는 것이 부추부침개(?)를 만들었습니다.

냉동실에 새우살 얼려 놓은 것이 있어서 새우살도 넣었습니다.

바지락살도 있었는데 오늘의 선택은 새우살.

둘 다 넣으면 더 맛있겠지만 아껴 먹어야죠.

그럼 지금 바로 새우 부추부침개 만드는 법을 알려드립니다.","[{'step_number': 1, 'description': '청양고추, 홍고추는 0.3cm 간격으로 썰어 준비합니다.', 'image_url': 'https://recipe1.ezmember.co.kr/cache/recipe/2022/09/14/be6ff6140d3a68967b72cbdb001ff6a61.jpg'}, {'step_number': 2, 'description': '부추는 3cm 간격으로 썰어 준비합니다.', 'image_url': 'https://recipe1.ezmember.co.kr/cache/recipe/2022/09/14/cf1b3979981b413707d58e7bf09df1be1.jpg'}, {'step_number': 3, 'description': '볼에 부침가루 1컵, 튀김가루 1컵, 물 2컵을 넣어 날가루가 보이지 않도록 섞은 다음', 'image_url': 'https://recipe1.ezmember.co.kr/cache/recipe/2022/09/14/d281642204e348ae75e38384371096691.jpg'}, {'step_number': 4, 'description': '부추, 청양고추, 홍고추, 새우살을 넣어 골고루 섞습니다.', 'image_url': 'https://recipe1.ezmember.co.kr/cache/recipe/2022/09/14/67a23fdd92f8c74b69dfe4e5561cd2981.jpg'}, {'step_number': 5, 'description': '예열된 팬에 식용유를 넉넉히 두르고 반죽을 얇게 펼쳐 앞뒤 노릇노릇하게 익힙니다.센불에서 익히면 빠른 시간 내에 탈 수 있기 때문에 중불에서 익히는 것이 좋습니다.', 'image_url': 'https://recipe1.ezmember.co.kr/cache/recipe/2022/09/14/1a52db6d4522f6dbd6494cda728cd9a41.jpg'}, {'step_number': 6, 'description': '앞뒤 노릇노릇한 상태가 되었으면 새우 부추부침개 완성.', 'image_url': 'https://recipe1.ezmember.co.kr/cache/recipe/2022/09/14/a163cfe1f6aabd9fc0686f6cedad0a3e1.jpg'}]"
39936,메인반찬,술안주,해물류,부침,비오는날 음식 쪽파요리 해물파전 만드는 법,해물파전,"4,110",30분 이내,초급,2인분,"[('쪽파', '150~200g'), ('양파', '1/2개'), ('새우', '8마리'), ('전복', '4마리'), ('부침가루', '200g'), ('물', '50ml'), ('계란', '1개'), ('소금', '1작은술'), ('간장', '2큰술'), ('식초', '1큰술'), ('고춧가루', '1/2작은술')]","우리 한국인들은 비 오는 날 생각나는 음식 하면 파전이 가장 생각나죠.
주말에 비가 계속 내리길래 파전을 해먹었어요.
오랜만에 쪽파 길게 해서 먹으니 파향도 더 나고 파향의 달달함과 양파의 달달함이 어우러져서 너무 맛있어요.
오징어 없어서 전복을 넣었는데 신의 한 수였어요.
새우의 탱글함과 전복의 쫄깃함이 너무 좋네요.
전복을 넣으니 고급진 파전 같아요.
추적추적 비 오는 날에는 역시 해산물 듬뿍 넣은 해물파전 만들어보세요. :)","[{'step_number': 1, 'description': '쪽파를 손질해서 깨끗이 세척한 후 반으로 잘라줍니다.쪽파 손질법 레시피', 'image_url': 'https://recipe1.ezmember.co.kr/cache/recipe/2022/10/04/bc4f2378e245a920ff73f4aa9215409d1.jpg'}, {'step_number': 2, 'description': '해산물은 좋아하는 식재료로 준비합니다.\n저는 집에 오징어가 없어서 새우랑 전복을 준비했습니다.\n깨끗이 손질해서 먹기 좋게 자른 후 물기를 빼놓습니다.\n새우 손질법 레시피', 'image_url': 'https://recipe1.ezmember.co.kr/cache/recipe/2022/10/04/7855b11acd7c308d2df0dc8aa9d95eb91.jpg'}, {'step_number': 3, 'description': '양파는 잘게 잘라서 물 50ml를 넣고 믹서기나 핸드믹서로 갈아줍니다.\n반죽에 넣어주면 고소하고 맛있어요!', 'image_url': 'https://recipe1.ezmember.co.kr/cache/recipe/2022/10/04/6ed30890edb713e1be476d55921aba721.jpg'}, {'step_number': 4, 'description': '볼에 간 양파와 부침가루 200g, 계란 1개, 소금 1작은술 넣어서 거품기로 잘 섞어줍니다.', 'image_url': 'https://recipe1.ezmember.co.kr/cache/recipe/2022/10/04/9286a4c97ce7e4199cb53ed7913d0ef01.jpg'}, {'step_number': 5, 'description': '반죽 농도는 이 정도면 됩니다.\n너무 묽지도 너무 질척하지도 않게 준비해 줍니다.', 'image_url': 'https://recipe1.ezmember.co.kr/cache/recipe/2022/10/04/8371e38ad49c478336ee5ae8c2ebd0b41.jpg'}, {'step_number': 6, 'description': '예열된 프라이팬에 기름을 넉넉하게 부어주세요.\n튀기듯이 구워야 더 바삭해집니다.\n반죽을 가운데에 파전이 붙을 수 있을 정도만 조금 넣어줍니다.', 'image_url': 'https://recipe1.ezmember.co.kr/cache/recipe/2022/10/04/2874459e125a95c92ca67e61140cf6a71.jpg'}, {'step_number': 7, 'description': '그리고 바로 쪽파를 넣어줍니다.\n그 위에 물기를 제거한 해산물을 올려주세요.', 'image_url': 'https://recipe1.ezmember.co.kr/cache/recipe/2022/10/04/5cb3f3b9c270451674a6947d64228d311.jpg'}, {'step_number': 8, 'description': '반죽을 파전 가장자리 위주로 부어 구워줍니다.', 'image_url': 'https://recipe1.ezmember.co.kr/cache/recipe/2022/10/04/5052225ff85d0687cdbeee295fc4b54e1.jpg'}, {'step_number': 9, 'description': '바닥이 노릇해지면 조심히 뒤집어 줍니다.', 'image_url': 'https://recipe1.ezmember.co.kr/cache/recipe/2022/10/04/058b97b26621219df740f2ad50c6a7951.jpg'}, {'step_number': 10, 'description': '이쁘게 담고 싶을 때는 접시를 파전 바로 올려서 프라이팬을 뒤집으면 찢어지지 않고 담을 수 있어요.단, 프라이팬에 남은 기름이 있다면 데일 수 있으니 기름을 닦고 접시에 옮겨주세요.\u200b', 'image_url': 'https://recipe1.ezmember.co.kr/cache/recipe/2022/10/04/09c0f6cff2b444d8798ec379622fd8001.jpg'}, {'step_number': 11, 'description': '간장 2큰술, 식초 1큰술, 고춧가루 1/2작은술 넣고 섞어줍니다.', 'image_url': 'https://recipe1.ezmember.co.kr/cache/recipe/2022/10/04/fa23390623f41161254ec0f20835ba581.jpg'}, {'step_number': 12, 'description': '완성입니다.\n반죽에 양파를 갈아서 넣었더니 구울 때 파향과 양파향이 고소하게 나더라고요.\n냄새부터가 이미 맛있었어요.', 'image_url': 'https://recipe1.ezmember.co.kr/cache/recipe/2022/10/04/9ee92b5848d3dcf2853761f3e6164f341.jpg'}]"
