index,종류별,상황별,재료별,방법별,글 제목,레시피이름,조회수,조리시간,난이도,인분,재료,소개글,조리순서
21921,메인반찬,일상,돼지고기,굽기,치쿠와 돼지고기말이,돼지고기말이,"5,799",30분 이내,초급,2인분,"[('얇은 돼지고기(대패삼겹살)', '16장'), ('치쿠와                                                                                어묵 어묵 4개를 반으로 잘라 사용', '8개'), ('애호박', '1/4개'), ('당근', '1/2개'), ('녹말가루', '적당량'), ('양파', '1/2개'), ('간장', '2큰술'), ('다진생강', '2작은술'), ('술', '1큰술'), ('우스터소스', '1큰술'), ('꿀', '1큰술'), ('설탕', '2작은술'), ('미림', '2큰술')]",고기만 먹기엔 너무 식상해서 어느 사이트에서 봤던 어묵 요리가 생각나서 이참에 만들어봤어요. 메인 반찬으로 만든 건데 도시락 반찬으로도 좋을 것 같아요^^ 냉장고에 있는 재료로 맛난 한끼 만들어 봐요~*,"[{'step_number': 1, 'description': '소스 먼저 만들어 둘게요. 다진 양파에 간장, 생강, 꿀, 우스터소스, 설탕, 미림, 술을 섞어줍니다.', 'image_url': 'https://recipe1.ezmember.co.kr/cache/recipe/2016/07/14/4e20c77266f4e339f7dd6abe20cb16411.jpg'}, {'step_number': 2, 'description': '당근 1/2개와 애호박 1/4개를 잘게 썰어주세요.', 'image_url': 'https://recipe1.ezmember.co.kr/cache/recipe/2016/07/14/59480a8e6d308d7d76451b719724dd391.jpg'}, {'step_number': 3, 'description': '어묵 안에 썰어둔 당근과 애호박을 넣어줍니다. (전 당근과 애호박을 넘 짧게 잘랐어요 ㅠ 길이에 꼭 맞출 필요없이 짧다면 양쪽으로 다 넣어주세요.)', 'image_url': 'https://recipe1.ezmember.co.kr/cache/recipe/2016/07/14/8fbe9b75b99da0e377c1087204ba34761.jpg'}, {'step_number': 4, 'description': '돼지고기를 두 장씩 깔아주세요. (돼지고기 한장과 한장 사이를 약간 포개어 준비)', 'image_url': 'https://recipe1.ezmember.co.kr/cache/recipe/2016/07/14/fe49668254f35e9a1115113aedeb985b1.jpg'}, {'step_number': 5, 'description': '두 장씩 깔아둔 고기 위에 어묵을 올려 (어묵 길이에 맞춰 고기를 준비해요. 어묵 길이가 좀 더 길면 고기를 세 장씩 깔아주셔도 돼요.)', 'image_url': 'https://recipe1.ezmember.co.kr/cache/recipe/2016/07/14/6354c1f843c912b4ec0cc266b7c8aa701.jpg'}, {'step_number': 6, 'description': '돌돌 말아줍니다.', 'image_url': 'https://recipe1.ezmember.co.kr/cache/recipe/2016/07/14/5e9b5e84c9fbf89ea25de65ad8c9f5651.jpg'}, {'step_number': 7, 'description': '고기에 녹말가루를 묻혀주세요. (고기를 녹말가루에 굴리기보다 일단 손으로 묻혀 골고루 발라주는 게 좋은 것 같아요)', 'image_url': 'https://recipe1.ezmember.co.kr/cache/recipe/2016/07/14/000d4a977f2f5c6dbf915a9b7a043d5d1.jpg'}, {'step_number': 8, 'description': '달군 팬에 기름 1큰술을 두르고 ⑦번의 고기를 올려 중약불에 구워주세요.', 'image_url': 'https://recipe1.ezmember.co.kr/cache/recipe/2016/07/14/fbc45850c4ddd6548ee9fcfd04afe45a1.jpg'}, {'step_number': 9, 'description': '고기가 잘 익을 수 있도록 골고루 뒤집어주세요. 노릇노릇해질 때까지 굽습니다. (전 너무 구웠어요 ㅠ 타지 않게 주의!)', 'image_url': 'https://recipe1.ezmember.co.kr/cache/recipe/2016/07/14/72615239cddb6ddac67fc427269597be1.jpg'}, {'step_number': 10, 'description': '⑨번의 고기가 익었으면 준비해뒀던 소스를 부워주세요. 고기에 골고루 소스 묻혀주면서 조금만 조려주세요. 소스가 없어질 때까지 조릴 필요없어요^^', 'image_url': 'https://recipe1.ezmember.co.kr/cache/recipe/2016/07/14/06d5be55b10ad9209f7557ce4e3189cd1.jpg'}, {'step_number': 11, 'description': '접시에 고기 올려주고 남은 소스를 위에 부워주면 완성.', 'image_url': 'https://recipe1.ezmember.co.kr/cache/recipe/2016/07/14/25d9f05fe964c4b6ef7cf1817d38f7111.jpg'}]"
21922,메인반찬,일상,돼지고기,굽기,돼지 불백..,돼지불백,"6,403",60분 이내,아무나,5인분,"[('돼지고기앞다리살', '2근'), ('상추', ''), ('쌈장', ''), ('돼지갈비양념', '7큰술'), ('생강술', '1큰술'), ('참치액', '2큰술'), ('다진마늘', '1큰술'), ('참기름', '1큰술'), ('후춧가루', '조금')]",세일해서 사온 앞다리살로 찌개 해먹을려다가 돼지불백으로 재탄생됐어요..ㅎ,"[{'step_number': 1, 'description': '우선 앞다리살이 통이라 저는 먹기 좋게 썰었구요. 사오실때 불고기한다고 하시고 썰어달라고 하시면 됩니다.앞다리살이 없다면 뒷다리살이나 목살로 해도 맛있어요~', 'image_url': 'https://recipe1.ezmember.co.kr/cache/recipe/2018/12/28/a28542b66aa037b4a09a01335c634bf91.jpg'}, {'step_number': 2, 'description': '2근을 다 썰으니 양은 이만큼 나오네요.', 'image_url': 'https://recipe1.ezmember.co.kr/cache/recipe/2018/12/28/f71f3fe196f69d744307eb26f7786fe71.jpg'}, {'step_number': 3, 'description': '분량의 양념장을 넣고 조물조물 무쳐서 잠시 간이 베라고 30분 정도 놔둡니다.', 'image_url': 'https://recipe1.ezmember.co.kr/cache/recipe/2018/12/28/b9bd9fc628246412902a00e1aa3a2c1f1.jpg'}, {'step_number': 4, 'description': '30분 후 앞뒤로 노릇 노릇 구워내면 돼지불백완성 입니다.', 'image_url': 'https://recipe1.ezmember.co.kr/cache/recipe/2018/12/28/3bae429977a87d386f62e28f589270231.jpg'}]"
21923,메인반찬,일상,돼지고기,굽기,[삼겹살데이]에어프라이어 삼겹살 달래 구이 만들기,삼겹살달래구이,"3,622",20분 이내,아무나,4인분,"[('삼겹살', '300g'), ('달래', '1줌'), ('간장', '2수저'), ('미림', '1수저'), ('마늘가루', '1수저'), ('후춧가루', ''), ('물', '1컵'), ('올리고당', '1수저'), ('다진 달래', '2수저')]","안녕하세요 김미푸드 김미입니다.
오늘은 삼겹살데이에요
에어프라이어로 삼겹살 맛있게 먹기 소개할게요
달래 간장으로 구워서 맛있고, 향이 너무 좋아요.","[{'step_number': 1, 'description': '삼겹살은 생삼겹살로 준비했어요.\n두툼한 걸로 해줘야 씹는 맛이 좋아요.', 'image_url': 'https://recipe1.ezmember.co.kr/cache/recipe/2019/03/03/f651e14f77ff899d2b2c07c49d1d3ef61.jpg'}, {'step_number': 2, 'description': '달래는 씻을 때 뿌리 부분에 흙이 많으니깐 그 부분을 집중적으로 씻어주세요.', 'image_url': 'https://recipe1.ezmember.co.kr/cache/recipe/2019/03/03/858105a1fdc7d1e07d124ee3b72d02181.jpg'}, {'step_number': 3, 'description': '손가락 한마디 정도로 잘라주시는데요. 중간중간에 이물질이 있나 잘 확인해주세요.', 'image_url': 'https://recipe1.ezmember.co.kr/cache/recipe/2019/03/03/31f37f5697b63eee652d308ec7f1afc11.jpg'}, {'step_number': 4, 'description': '움푹하면서 약간 넓적한 그릇에\n물 1컵을 넣고, 미림 2수저, 간장 2수저, 올리고당 1수저, 마늘가루 1수저, 후춧가루 조금 이랑 달래를 넣어주세요.', 'image_url': 'https://recipe1.ezmember.co.kr/cache/recipe/2019/03/03/25d104bb7119805f274a73b10ab0eccb1.jpg'}, {'step_number': 5, 'description': '달래 향기 정말 좋아요.\n봄이 왔다는 게 달래 향을 맡으니 실감이 나네요.', 'image_url': 'https://recipe1.ezmember.co.kr/cache/recipe/2019/03/03/c91217e090eeb17569107e71df78c2bc1.jpg'}, {'step_number': 6, 'description': '달래 간 장물에 삼겹살을 푹 담가주세요. 손으로 조물조물 만져서 양념이 골고루 베이게 해주세요.', 'image_url': 'https://recipe1.ezmember.co.kr/cache/recipe/2019/03/03/1180f840d5e1738c66682f9ba33814c51.jpg'}, {'step_number': 7, 'description': '달래 간장에 5분 정도 담갔다가\n에어프라이어에 제일 센 온도로\n15분에서 10분 정도 구워주세요.에어프라이어', 'image_url': 'https://recipe1.ezmember.co.kr/cache/recipe/2019/03/03/67a077b6ca47960b33afb5d657a0f0231.jpg'}, {'step_number': 8, 'description': '에어프라이어에 고기를 한꺼번에 너무 많이 넣지 마시고,서로 떨어지게 놓아야삼겹살이 바삭하게 구워져요.', 'image_url': 'https://recipe1.ezmember.co.kr/cache/recipe/2019/03/03/d53d9c2f3828ceb729e38e6b387132b11.jpg'}, {'step_number': 9, 'description': '중간에 어느 정도 익었을 때 삼겹살을 한번 뒤집어 주세요.\n에어프라이어는 뒷면이 바삭하게 안돼서뒤집어서 구워줘야 골고루 바삭하게 드실 수 있어요.', 'image_url': 'https://recipe1.ezmember.co.kr/cache/recipe/2019/03/03/eede6d3a62cbe7f30877caf96f120bbf1.jpg'}, {'step_number': 10, 'description': '에어프라이어로 삼겹살을 구우면 냄새도 안 나고,너무 편해요.\n그런데 금방 딱딱해져서, \n먹을 때 맛이 떨어지는 건 어쩔 수가 없어요.\n달래 넣어서 간장으로 구워주면\n시간이 지나도 향긋해서 먹기 너무 좋아요.', 'image_url': 'https://recipe1.ezmember.co.kr/cache/recipe/2019/03/03/7b468dd7618618d6f98e5f42a2a85cb31.jpg'}]"
21924,메인반찬,일상,돼지고기,굽기,겉은 바삭 속은 촉촉 통삼겹 스테이크 만들기,삼겹살스테이크,"5,870",60분 이내,아무나,2인분,"[('통삼겹살', '1kg'), ('대파', '2대'), ('양파', '1개'), ('통마늘', '5-6개'), ('통후추', '약간'), ('부추', '적당량'), ('고춧가루', '1T'), ('참기름', '1T'), ('소금', '1t'), ('깨', '약간')]","그 어느날의 먹방 이야기. 매일이 먹방이니 뭐 특별할 것도 없지만 맛난 저녁을 먹는 순간이 제일 행복한 뇨자.

하루의 힘든시간을 싹~~~ 잊게 해 주는 만병통치약 같은 존재.....ㅎㅎ 오늘은 통삼겹을 이용해서 스테이크를 구워 봤어요. 굽는 과정을 하나 추가했을뿐 보쌈이나 마찬가지 랍니다. 보쌈으로 드셔도 되고 스테이크처럼 즐기셔도 되요.
겉은 바삭하고 속은 촉촉~~~ 한 통삼겹 스테이크. 스테이크 소스를 얹어 드셔도 되지만 오늘은 보쌈 처럼 부추겉절이와 쌈채소를 곁들여 같이 먹었어요. 이거 탄거 아니야? 라는 생각이 들정도로 바삭하게 구운 통삼겹 스테이크. 절대 탄거 아니에요 노노!! 이래야 꼬소~~~~함이 더 배가 되어 맛나걸랑요..ㅎ","[{'step_number': 1, 'description': '통삼겹살을 원하는 크기로 잘라주세요. 저는 5센치정도 두께로 잘라 주었어요.', 'image_url': 'https://recipe1.ezmember.co.kr/cache/recipe/2019/03/07/4e707442c217e5ee9ab6d8da3633f42e1.jpg'}, {'step_number': 2, 'description': '두꺼운 고기를 그냥 구울 경우 겉만 타고 속이 익지 않게 되거든요. 그래서 한번 쪄서 사용할 거에요. 굽는 과정을 뺀다면 그냥 보쌈이 되는 거에요. \n냄비에 마늘과 대파 2대, 양파 한개를 썰어서 깔아주세요. 여기에 통후추를 넣어주시면 더 좋아요. 돼지고기 잡내를 잡기 위함이지요.', 'image_url': 'https://recipe1.ezmember.co.kr/cache/recipe/2019/03/07/3b9cde34fe6a8b2c2d10235bce9ec2401.jpg'}, {'step_number': 3, 'description': '보쌈으로 드실 경우에는 맛술과 된장을 섞어서 통삼겹살에 바른 후에 물 없이 약불에서 1시간정도 쪄 주면 잡내 없는 맛있는 보쌈고기가 되구요. \n오늘 저는 한번 구워서 먹을 고기라 속까지 익히기만 할거에요. 그래서 물을 종이컵 두컵 정도 넣고 중불에서 40분 삶아 주었어요.', 'image_url': 'https://recipe1.ezmember.co.kr/cache/recipe/2019/03/07/df12ce39446ed84138af2217722320f11.jpg'}, {'step_number': 4, 'description': '삶아진 고기를 바로 구울 경우 물기때문에 기름이 튈 수 있으니까 잠시 체에 받쳐 물기와 기름기를 제거해 주시구요.', 'image_url': 'https://recipe1.ezmember.co.kr/cache/recipe/2019/03/07/9d61b4576ce98c6622816867d31906051.jpg'}, {'step_number': 5, 'description': '프라이팬에 기름을 넉넉히 두르고 잘익은 통삼겹살을 구워 줍니다. 통삼겹살에 후춧가루를 뿌려 준 후에 4면이 골고루 바삭하게 익을정도로 약불에서 구워주세요. 그럼 끝. 오겹살의 경우 껍데기 때문에 기름이 뻥뻥 튈 수 있으니 뚜껑을 덮고 구워주세요.', 'image_url': 'https://recipe1.ezmember.co.kr/cache/recipe/2019/03/07/bc517c0bd020662d46d1bce5dd906c5c1.jpg'}, {'step_number': 6, 'description': '고기와 함께 먹을 부추 무침도 준비 할게요.\n잘 씻어 잘라놓은 부추에 고춧가루 1T, 소금 1/2t, 참기름 1T, 깨, 간장 1t를 넣고 잘 섞어주세요. 기호에 따라 식초를 살짝 가미하셔도 됩니다.', 'image_url': 'https://recipe1.ezmember.co.kr/cache/recipe/2019/03/07/f6583efd7032bd30c405835440e007481.jpg'}, {'step_number': 7, 'description': '스테이크 접시에 올려 나이프로 잘라서 먹으면 통삼겹 스테이크가 되는거죠.\n저는 보쌈처럼 잘라서 쌈싸 먹었는데요. 겉은 바삭하고 속은 촉촉하고 노릇하게 구워 고소~~함이 있는 그런 고기 맛이 납니다.', 'image_url': 'https://recipe1.ezmember.co.kr/cache/recipe/2019/03/07/b3bb84a5621f7d4ed09eba1b367c1e2f1.jpg'}, {'step_number': 8, 'description': '삼겹스테이크 굽는 동안 우리 강아지도 주방에 와서 엎드려서 기다리더라구요.\n맛있는 냄새가 나면 꼭 자기도 한입 달라고 와서 기다리곤 해요. 너두 통삼겹스테이크 먹고 싶니? 미안~~~ 이건 누나꺼~~~~~\n보쌈으로 삶기만 할 경우에는 부들부들 부드러운 맛이 좋구요. 저는 이렇게 한번 구워주니 더 맛있는 것 같아요.\n이번엔 쌈채소에 싸서 김치와 같이 먹었지만 다음엔 스테이크 소스를 만들어서 정식으로 스테이크처럼 먹어봐야겠어요.', 'image_url': 'https://recipe1.ezmember.co.kr/cache/recipe/2019/03/07/857fb80349077e656198f8e1ff9fcca51.jpg'}]"
21925,메인반찬,일상,돼지고기,굽기,삼겹살 미세먼지 없이 굽는 법/삼겹살구이,삼겹살구이,"4,399",10분 이내,초급,2인분,"[('삼겹살', '')]","안녕하세요? 밥심은 국력입니다. 요즘 미세먼지가 화두일 정도로 미세먼지에 대해 관심들이 많으시죠? 미세먼지는 바깥 외부는 말할 것도 없고, 집안 내에서도 요리할 때 많이 생기는데요. 특히 생선이나 고기를 구울 때 미세먼지가 많이 생긴답니다. 삼겹살을 좋아하는 가정에서는 꼭 알아두시면 좋겠습니다. 그러면 삼겹살을 미세먼지 없이 굽는 법을 알려드릴게요.","[{'step_number': 1, 'description': '삼겹살을 준비하세요. 삼겹살은 프라이팬 크기에 맞게 크게 썰어서 구우면 굽기도 편하고 하나하나 뒤집지 않아서 좋아요.', 'image_url': 'https://recipe1.ezmember.co.kr/cache/recipe/2019/03/25/fc11f8ae01a23b745abbf47469ddf47a1.jpg'}, {'step_number': 2, 'description': '팬을 먼저 달군 다음 팬 크기에 맞게 종이호일을 잘라 넣어줍니다. 첫번째 종이호일을 사용하면 미세먼지를 줄일 수 있는 방법이구요.', 'image_url': 'https://recipe1.ezmember.co.kr/cache/recipe/2019/03/25/b0d46315488c8c830842ac9acb94b4111.jpg'}, {'step_number': 3, 'description': '냉동삼겹살은 냉장실에서 해동시켜서 사용하세요.', 'image_url': 'https://recipe1.ezmember.co.kr/cache/recipe/2019/03/25/0590598773d5d2862f99038b784dc6751.jpg'}, {'step_number': 4, 'description': '두번째 뚜껑을 닫아주는 것이 기름도 튀지 않고 미세먼지를 줄일 수 있는 방법입니다.', 'image_url': 'https://recipe1.ezmember.co.kr/cache/recipe/2019/03/25/cb6f311cd8644e6fef8b16c7fa2874ae1.jpg'}, {'step_number': 5, 'description': '뚜껑을 닫아서 익혀주면 처음에는 스팀의 효과로 인해서 약간 삼겹살찜 같은 느낌이 들지요.', 'image_url': 'https://recipe1.ezmember.co.kr/cache/recipe/2019/03/25/05736db19afed0772703b4213335461d1.jpg'}, {'step_number': 6, 'description': '노릇해지면 앞뒤로 뒤집어주고 마지막에 뚜껑을 열어서 바삭하게 한번 더 구워줍니다. 다 굽고 나서 잘라주면 훨씬 편해요.', 'image_url': 'https://recipe1.ezmember.co.kr/cache/recipe/2019/03/25/bfd9defdc2355066a2cafad387c2c6be1.jpg'}]"
21926,메인반찬,일상,돼지고기,굽기,"생생정보통, 고기 맛있게 즐기는 요령",고기,"1,722",30분 이내,아무나,4인분,"[('돼지고기 등심', '300g'), ('감자', '2개'), ('양파', '1개'), ('팽이버섯', '1팩'), ('막장', ''), ('깻잎', '약간')]","생생정보통, 고기 맛있게 즐기는 요령 외식을 싫어하는 남편, 아이 둘 떠나고 나니 식탁에는 채소뿐일 때가 많습니다. 며칠 전, 고기가 먹고 싶다며 등심을 사 왔습니다. 집에 있는 감자, 양파, 버섯과 함께 맛있게 구워 먹었습니다.","[{'step_number': 1, 'description': '식탁에서 바로 구워 먹을 수 있는 전기 인덕션에 물 1컵을 부어준다.', 'image_url': 'https://recipe1.ezmember.co.kr/cache/recipe/2017/11/08/a39ed3ba63d709110fc0b46aedfd45b11.jpg'}, {'step_number': 2, 'description': '먼저 감자, 양파, 등심을 올려 구워준다.', 'image_url': 'https://recipe1.ezmember.co.kr/cache/recipe/2017/11/08/eaeb70334b93787eeec791f065e627301.jpg'}, {'step_number': 3, 'description': '버섯도 올려 구워준다.', 'image_url': 'https://recipe1.ezmember.co.kr/cache/recipe/2017/11/08/6b8bfa699f6fa11644313897820e5a7d1.jpg'}]"
21927,메인반찬,일상,돼지고기,굽기,생강간장소스 목살구이,목살구이,"8,351",60분 이내,초급,4인분,"[('돼지고기 목살', '600g'), ('애호박', ''), ('가지', ''), ('표고버섯', ''), ('토마토등', ''), ('생강즙', '6큰술'), ('가다랑어포', '1컵'), ('간장', '1컵'), ('설탕', '3큰술'), ('청주', '3큰술'), ('물엿', '2큰술'), ('물', '2컵')]","주말 가족들과 함께 맛있게 드실 요리 한가지 올립니다.
향긋한 생강소스에 재워 구운 목살구이는 남녀노소 할것없이 모두 좋아할거예요.
가족들이 좋아하는 채소를 구워 곁들이시면 더욱 맛있답니다.","[{'step_number': 1, 'description': '못살로 준비\n생강은 강판에 갈아 즙을 짜 준비한다.', 'image_url': 'https://recipe1.ezmember.co.kr/cache/recipe/2017/12/10/9b7267ef6f0ae91b037b0bdf968cb57f1.jpg'}, {'step_number': 2, 'description': '냄비에 물 2컵을 넣고 끓이다 청주를 넣어주고', 'image_url': 'https://recipe1.ezmember.co.kr/cache/recipe/2017/12/10/45c13f60f93ffc55ebbb90f321d311091.jpg'}, {'step_number': 3, 'description': '가다랑어포를 넣어 1분정도 끓인 후 가다랑어포는 채로 건져낸다.', 'image_url': 'https://recipe1.ezmember.co.kr/cache/recipe/2017/12/10/e72d0a93b192ca9f221f8e0edc5d3fe21.jpg'}, {'step_number': 4, 'description': '간장을 부어 주고', 'image_url': 'https://recipe1.ezmember.co.kr/cache/recipe/2017/12/10/66d50d70d9bceb78c06ce21cb429ac251.jpg'}, {'step_number': 5, 'description': '생강즙', 'image_url': 'https://recipe1.ezmember.co.kr/cache/recipe/2017/12/10/28b0980dcbd091019c26c9613f925d5c1.jpg'}, {'step_number': 6, 'description': '설탕', 'image_url': 'https://recipe1.ezmember.co.kr/cache/recipe/2017/12/10/a58d3c6bb75560fb77ea0489ad78f4091.jpg'}, {'step_number': 7, 'description': '물엿을 넣고 끓인다.', 'image_url': 'https://recipe1.ezmember.co.kr/cache/recipe/2017/12/10/6d124ad0013706c9741b2d750ead175f1.jpg'}, {'step_number': 8, 'description': '끓어 오르면 불을 약불로 줄여 간장소스양이 반으로 줄때까지 조린다.', 'image_url': 'https://recipe1.ezmember.co.kr/cache/recipe/2017/12/10/23dc2665dd8cc69dfc1b2c38d5499f801.jpg'}, {'step_number': 9, 'description': '가지,애호박,표고등 곁들임 채소를 준비한다.', 'image_url': 'https://recipe1.ezmember.co.kr/cache/recipe/2017/12/10/574d82edae9a793923b541965779cc4e1.jpg'}, {'step_number': 10, 'description': '그릴이나 팬에 올리브오일을 살짝 두르고 구워낸다.', 'image_url': 'https://recipe1.ezmember.co.kr/cache/recipe/2017/12/10/e289ddea32b232c5780a5aa3b431eb171.jpg'}, {'step_number': 11, 'description': '조린 소스를 고기에 발라 30분정도 재운다.', 'image_url': 'https://recipe1.ezmember.co.kr/cache/recipe/2017/12/10/8fa86fca5271ec91ba6b1deec43fa6b81.jpg'}, {'step_number': 12, 'description': '팬에 기름을 조금만 두르고 고기를 굽는다.', 'image_url': 'https://recipe1.ezmember.co.kr/cache/recipe/2017/12/10/87622e4929992f25af6d19571798fa1e1.jpg'}, {'step_number': 13, 'description': '앞뒤로 노릇하게 구우면서 먹기좋은 크기로 자른다.', 'image_url': 'https://recipe1.ezmember.co.kr/cache/recipe/2017/12/10/39ebeddf6c850b3492d282ab584615de1.jpg'}, {'step_number': 14, 'description': '접시에 가니쉬 채소와 고기를 담아낸다.', 'image_url': 'https://recipe1.ezmember.co.kr/cache/recipe/2017/12/10/cc96d927e4d06614c3a3896f6bdcce321.jpg'}]"
