index,종류별,상황별,재료별,방법별,글 제목,레시피이름,조회수,조리시간,난이도,인분,재료,소개글,조리순서
10053,밑반찬,일상,건어물류,무침,묵은 김 요리 쪽파 김 무침 쪽파 요리 도시락 반찬,쪽파김무침,"1,430",15분 이내,초급,4인분,"[('쪽파', '200g'), ('구운김', '10장'), ('청양고추', '1개'), ('천일염', '1T'), ('진간장', '3T'), ('맛술', '2T'), ('올리고당', '2T'), ('참기름', '1T'), ('깨소금', '1T')]","어린시절 도시락반찬으로 파래무침 인기였지요.
그 시절에는 파래 무침 먹기 싫었는데...요즘은 없어서 못 먹는 밑반찬이 되었네요. 오늘은 냉동실 묵은 김으로 쪽파도 넣어 조물조물 무쳐봤어요. 어린 시절 파래 무침보다 훨씬 더 맛있는 밑반찬입니다.","[{'step_number': 1, 'description': '묵은 김은 마른 팬에 바삭하게 구워주고\n비닐 팩에 넣어 부셔 줍니다.\n청양 고추 한 개는 다져서 준비 하고,\n생략하셔도 됩니다.\n저는 마른 청양 고추를 부셔 넣었어요.', 'image_url': 'https://recipe1.ezmember.co.kr/cache/recipe/2022/05/19/ce4d685b0f8b015ee2007cb17c62f0411.jpg'}, {'step_number': 2, 'description': '쪽파는 끓는 물에 천일염 한 수저 넣어 뿌리 부분 먼저 넣고, 초록 부분을 넣어\n1분 정도만 데쳐주고', 'image_url': 'https://recipe1.ezmember.co.kr/cache/recipe/2022/05/19/18e0033b254ff1bf1f4e49824408ee101.jpg'}, {'step_number': 3, 'description': '찬물에 헹구어 물기를 꼭 짜 적당하게 썰어 준비 합니다.', 'image_url': 'https://recipe1.ezmember.co.kr/cache/recipe/2022/05/19/6738761406a3cd301bfffa55b03ce5811.jpg'}, {'step_number': 4, 'description': '볼에 분량의 재료를 넣어 양념장을 만들어 줍니다.', 'image_url': 'https://recipe1.ezmember.co.kr/cache/recipe/2022/05/19/9c3b21f53bfe8328849fe2c7ee66fd961.jpg'}, {'step_number': 5, 'description': '부셔 놓은 김을 먼저 조물조물 무쳐 줍니다.', 'image_url': 'https://recipe1.ezmember.co.kr/cache/recipe/2022/05/19/cb623a6b619579cf07731ce42a9812341.jpg'}, {'step_number': 6, 'description': '썰어 놓은 쪽파를 놓오 무쳐주고', 'image_url': 'https://recipe1.ezmember.co.kr/cache/recipe/2022/05/19/5bd69541aec68f0f4674d86c38a6c6691.jpg'}, {'step_number': 7, 'description': '깨소금 뿌려 마무리 해 줍니다.', 'image_url': 'https://recipe1.ezmember.co.kr/cache/recipe/2022/05/19/af4819e88b29cf2e6854913b8f5846771.jpg'}]"
10054,밑반찬,일상,건어물류,무침,"북어채, 황태채 무침.",황태채무침,"3,462",10분 이내,아무나,2인분,"[('북어채', '1줌'), ('마요네즈', '1/2큰술'), ('참기름', '1작은술'), ('고추장', '1작은술'), ('진간장', '1큰술'), ('물엿', '1큰술'), ('고춧가루', '1/2큰술'), ('깨', '1/2큰술')]",집에 북어채가 있으면 국을 주로 끓이는데 이번엔 북어 보푸라기를 응용해서 무침으로 만들어 봤어요.,"[{'step_number': 1, 'description': '북어채에 가시는 제거한다.', 'image_url': 'https://recipe1.ezmember.co.kr/cache/recipe/2022/05/13/c7f40bb67f9263462a526cd2f525c1aa1.jpg'}, {'step_number': 2, 'description': '믹서기에 북어를 넣는다.', 'image_url': 'https://recipe1.ezmember.co.kr/cache/recipe/2022/05/13/9e7890c3cf2b17521c7cc6e4a47313f31.jpg'}, {'step_number': 3, 'description': '믹서기에 갈아서 입자는 크든 적든 취향대로 갈아준다.', 'image_url': 'https://recipe1.ezmember.co.kr/cache/recipe/2022/05/13/0d0c41035f3dadadbc59c273a556131b1.jpg'}, {'step_number': 4, 'description': '갈아놓은 북어에 마요네즈를 넣고 버무려준다.', 'image_url': 'https://recipe1.ezmember.co.kr/cache/recipe/2022/05/13/c195baa1f531d47f8e6cc1666765bc951.jpg'}, {'step_number': 5, 'description': '잠시 두면 마요네즈가 스며들어 부드러워진다.', 'image_url': 'https://recipe1.ezmember.co.kr/cache/recipe/2022/05/13/b631641f286bf2659cd675df3e1341f21.jpg'}, {'step_number': 6, 'description': '그릇에 양념재료를 모두 섞어준다.', 'image_url': 'https://recipe1.ezmember.co.kr/cache/recipe/2022/05/13/bdf208aeebf6c277ff2930b0ec0dc0581.jpg'}, {'step_number': 7, 'description': '북어에 양념을 넣는다.', 'image_url': 'https://recipe1.ezmember.co.kr/cache/recipe/2022/05/13/00f952af96363daa9331adb2292e9c141.jpg'}, {'step_number': 8, 'description': '조물조물 무치고 마지막에 참기름을 넣어 마무리 짓는다.', 'image_url': 'https://recipe1.ezmember.co.kr/cache/recipe/2022/05/13/82e74c88c7f2b665dd1912273dd9448e1.jpg'}]"
10055,밑반찬,일상,건어물류,무침,미역오이초무침 / 아삭한 오이와 미역으로 입맛 살리는 새콤달콤 초무침 밑반찬,미역오이초무침,"4,172",15분 이내,아무나,3인분,"[('건미역', '20g'), ('백오이', '1개'), ('양파', '1/4개'), ('청양고추', '1개'), ('홍고추', '1개'), ('간마늘', '1스푼'), ('국간장', '2스푼'), ('식초', '3스푼'), ('설탕', '3스푼'), ('고춧가루', '1스푼'), ('깨', '1스푼')]","더울 땐 뜨거운 미역국보단 차가운 미역냉국을 찾곤 하죠. 냉국 말고 초무침도 자주 해 먹게 됩니다. 오늘은 미역과 제철 달큼한 오이로 입맛 잡는 초무침 만들어봤습니다.
물미역 아니라 건미역 불려서 목넘김 좋은 질감으로 무쳐내는 미역오이초무침 레시피 소개합니다.
맛나게 만들어서 입맛 도는 밥 상에 밑반찬 하나 추가해 보세요.","[{'step_number': 1, 'description': '건미역을 물에 푹 담가 불려 주세요.', 'image_url': 'https://recipe1.ezmember.co.kr/cache/recipe/2022/05/23/136042d6bb7596ac5e254f34ca8678261.jpg'}, {'step_number': 2, 'description': '미역이 넓게 완전히 다 퍼질 때까지 불려 줍니다.계절, 찬물, 미온수의 상태에 따라 불리는 시간이 달라집니다.\n지금 같은 여름엔 더 빨리 잘 불어 편합니다.', 'image_url': 'https://recipe1.ezmember.co.kr/cache/recipe/2022/05/23/ee5afa9f7c508c15d8e268470e7de1241.jpg'}, {'step_number': 3, 'description': '양파 1/4개 채 썰고 청양고추, 홍고추 1개씩 송송 썰어 주세요.', 'image_url': 'https://recipe1.ezmember.co.kr/cache/recipe/2022/05/23/f4352d4c7ec82ffbc4549618043cf4591.jpg'}, {'step_number': 4, 'description': '오이는 칼로 돌기를 살살 긁어내고 물로 박박 문지르며 세척해 주세요.더 깨끗한 세척을 위해 굵은소금으로 문지른 다음 세척해 주시면 됩니다.', 'image_url': 'https://recipe1.ezmember.co.kr/cache/recipe/2022/05/23/280075eacf2d8a8d30f373b8b046e4b11.jpg'}, {'step_number': 5, 'description': '오이를 반 가른 다음 어슷하게 채를 썹니다.', 'image_url': 'https://recipe1.ezmember.co.kr/cache/recipe/2022/05/23/14c48a0a51e9dfe8763f3938687cb13d1.jpg'}, {'step_number': 6, 'description': '냄비에 물을 넣고 팔팔 끓어 오르면강불', 'image_url': 'https://recipe1.ezmember.co.kr/cache/recipe/2022/05/23/c7330e65263890d514edb24a32abbe691.jpg'}, {'step_number': 7, 'description': '불린 미역을 넣고 1분간 뒤적이며 데쳐줍니다.미역 식감을 살리려면 30초간, 호록호록 부드러운 질감은 1분간 데쳐 줍니다.', 'image_url': 'https://recipe1.ezmember.co.kr/cache/recipe/2022/05/23/ca62e2deae8a79dee4c06951b882c8fc1.jpg'}, {'step_number': 8, 'description': '데친 미역은 찬물로 헹군 후 물기를 짜줍니다.\n물기 짠 미역은 먹기 좋게 잘라 주세요.', 'image_url': 'https://recipe1.ezmember.co.kr/cache/recipe/2022/05/23/9b12d72cb30efbb6bfd6e49551347e631.jpg'}, {'step_number': 9, 'description': '볼에 미역을 넣고 국간장 2스푼 넣고', 'image_url': 'https://recipe1.ezmember.co.kr/cache/recipe/2022/05/23/043f3ee6fe7715e83b9d1bf8569629b11.jpg'}, {'step_number': 10, 'description': '설탕 3스푼 넣고', 'image_url': 'https://recipe1.ezmember.co.kr/cache/recipe/2022/05/23/3dc4565d5831562f576ab9393c3908ea1.jpg'}, {'step_number': 11, 'description': '식초 3스푼 넣어서 간을 해 줍니다.미역에 간을 먼저 해주고 다른 야채는 섞어주기만 합니다.\n간은 입맛에 맞게 추가로 더 넣어 맞춰주세요. 좀 세다 싶게 간을 해 주시는 게 좋습니다.', 'image_url': 'https://recipe1.ezmember.co.kr/cache/recipe/2022/05/23/bfc33539eceb4af32aa37236892c10dc1.jpg'}, {'step_number': 12, 'description': '간을 맞춘 후 오이, 양파, 고추, 간마늘을 넣고 조물조물 버무려 줍니다.', 'image_url': 'https://recipe1.ezmember.co.kr/cache/recipe/2022/05/23/a37a1cc61aa3da70b99415bf14d3a27e1.jpg'}, {'step_number': 13, 'description': '고춧가루 1스푼, 깨 1스푼 넣어서 버무리면 완성입니다.', 'image_url': 'https://recipe1.ezmember.co.kr/cache/recipe/2022/05/23/404346e68ede80bd43238e76a3a577171.jpg'}, {'step_number': 14, 'description': '입맛 자극을 주기 위해 매콤함과 새콤달콤이 있는 초무침입니다. 간단히 만들어 먹기 좋은 조합이라 입맛 없을 때 만들어 먹기 좋은 여름반찬으로 좋습니다.\n맛있게 만들어 한 끼 식사로 즐겨 보세요.', 'image_url': 'https://recipe1.ezmember.co.kr/cache/recipe/2022/05/23/bcb04962868be0bbe3c70fb0b2047c021.jpg'}]"
10056,밑반찬,일상,건어물류,무침,[간장진미채무침] 매콤짭쪼름한 중독성 간장진미채,간장진미채,351,20분 이내,초급,4인분,"[('진미채', '200g'), ('마요네즈', '1tbsp'), ('맛술', '1tbsp'), ('간장', '1tsp'), ('참치액', '1tsp'), ('설탕', '1tsp'), ('간 마늘', '1tsp'), ('간 검정깨', '1tsp')]","밑반찬의 기본 진미채무침, 맵게 무칠까 간장으로 무칠까 고민하다... 이번엔 마늘을 넣어 매콤 짭쪼름한 간장진미채로 갑니다! :)","[{'step_number': 1, 'description': ""여기저기 복잡하게 엉켜붙은 진미채는 먹기 좋은 크기로 손질해 줍니다. 물론 '먹기좋은' 크기는 각자의 취향. 저는 5cm 정도로 했어요. 그래야 한입에 쏘~옥 들어가면서 입가에 묻지 않으니까 ㅎㅎ믹싱볼 , 조리용가위"", 'image_url': 'https://recipe1.ezmember.co.kr/cache/recipe/2024/05/25/440f61009dab0ca38e3fc56cacc67f7b1.jpg'}, {'step_number': 2, 'description': '마요네즈로 1tbsp으로 잘 버무려 코팅해주면 윤기도 흐릅니다.계량스푼 , 니트릴장갑', 'image_url': 'https://recipe1.ezmember.co.kr/cache/recipe/2024/05/25/cb907f197a737cbc967fa2fce4b149f11.jpg'}, {'step_number': 3, 'description': '레서피에 1tbsp으로 적어 놓았는데 조금 부족하다 싶으면 더 넣어주셔도 됩니다.프라이팬 , 주방용스패츌라', 'image_url': 'https://recipe1.ezmember.co.kr/cache/recipe/2024/05/25/61c4f0956d74a826dd57a75054ba7ef61.jpg'}, {'step_number': 4, 'description': '양념용 유리볼에 마늘 2~3개를 프레셔도 으깨 1tsp(5ml)을 넣어줍니다.', 'image_url': 'https://recipe1.ezmember.co.kr/cache/recipe/2024/05/25/23faaed55879fac2a1764ffc061a54641.jpg'}, {'step_number': 5, 'description': '거기에 맛술 2tsp+간장 1tsp+참치액 1tsp+설탕 1tsp을 넣어 잘 섞어 간장 양념을 만들어줍니다.', 'image_url': 'https://recipe1.ezmember.co.kr/cache/recipe/2024/05/25/3b14039c48dc72015500454567ee96a31.jpg'}, {'step_number': 6, 'description': '이제 진미채에 부어 양념들이 잘 섞이도록 조물조물 섞어주는데요,약불', 'image_url': 'https://recipe1.ezmember.co.kr/cache/recipe/2024/05/25/42906bbc0992d355af04d9c82e1422a81.jpg'}, {'step_number': 7, 'description': '이때, 진미채는 제품마다 염도가 다르기 때문에 간장 양념을 한번에 다 넣지 말고 맛을 보고 싱거우면 추가해 주시는 게 좋아요.쪽파는 먹기 전에 뿌려주는 게 좋아요', 'image_url': 'https://recipe1.ezmember.co.kr/cache/recipe/2024/05/25/63f7d7621acaf0cb55d9c4d89af5b5c51.jpg'}, {'step_number': 8, 'description': '완성되면 마지막에 곱게 간 통깨 1tsp을 넣고', 'image_url': 'https://recipe1.ezmember.co.kr/cache/recipe/2024/05/25/3d52b16ef0b4e9b8e96e3aaf962ed0231.jpg'}, {'step_number': 9, 'description': '잘 버무려줍니다.', 'image_url': 'https://recipe1.ezmember.co.kr/cache/recipe/2024/05/25/bb4a5b40d3e980aa7c52e8223fb23a491.jpg'}, {'step_number': 10, 'description': '예쁜 접시에 올리면 완성! 맛있게 드세요~', 'image_url': 'https://recipe1.ezmember.co.kr/cache/recipe/2024/05/25/cc37aed9a798ab7da88001b1c249053a1.jpg'}]"
10057,밑반찬,일상,건어물류,무침,간단하고 맛있는 진미채무침 레시피와 훙구몬 먹팁까지 배워보세요,진미채무침,"2,252",10분 이내,아무나,3인분,"[('진미채', '300g'), ('땡초', '10개'), ('다시마간장', '5T'), ('올리고당', '2T'), ('고추장', '3T'), ('참기름', '1T'), ('고춧가루', '1T'), ('후추', '톡톡'), ('깨소금', '1T')]",오늘은 엄마표 요리 중 어렸을 적 좋아했던 반찬인 진미채무침을 배워서 소개해드릴까 해요 엄마 지인분들께도 맛보라고 드렸는데 맛있다고 레시피를 공유해달라고 했던 진미채무침 황금레시피 시작해볼게요!,"[{'step_number': 1, 'description': '소스를 넣을 용기에 다시마 간장 5스푼을 넣어주세요다시마간장 5T볼 다시마 간장은 일반 진간장보다 농도가 연해서 짠맛이 덜하답니다\n일반 진간장을 사용하실 분들은 3스푼만 사용하시는 걸 추천드려요', 'image_url': 'https://recipe1.ezmember.co.kr/cache/recipe/2024/03/18/c75fce735c0c441deeeadc2b4f2ac60b1.jpg'}, {'step_number': 2, 'description': '올리고당 2스푼을 넣어주고 올리고당과 다시마 간장을 잘 섞어주세요올리고당 2T올리고당을 넣는 이유는 단맛과 완성 시 요리의 윤기를 내기 위함이에요', 'image_url': 'https://recipe1.ezmember.co.kr/cache/recipe/2024/03/18/e92f8528fcf2c1c3dca0c16b67847f7a1.jpg'}, {'step_number': 3, 'description': '참기름 1스푼을 넣어주세요참기름 1T', 'image_url': 'https://recipe1.ezmember.co.kr/cache/recipe/2024/03/18/2299e312099aed6316061cd10e322f0f1.jpg'}, {'step_number': 4, 'description': '고춧가루 1스푼을 넣어주세요고춧가루 1T', 'image_url': 'https://recipe1.ezmember.co.kr/cache/recipe/2024/03/18/082c3981f5cd2a586c1cb048991eaae11.jpg'}, {'step_number': 5, 'description': '고추장은 크게 3스푼을 넣고 소스가 잘 어우러지도록 섞어주세요불 사용 X', 'image_url': 'https://recipe1.ezmember.co.kr/cache/recipe/2024/03/18/f485a744ffd02c8409f21725f18994891.jpg'}, {'step_number': 6, 'description': '오늘의 주인공인 진미채는 먹기 좋은 크기로 잘라서 넣어주세요주방가위진미채의 길이가 길면 나중에 먹기 불편하므로 적당한 크기로 잘라주는 게 좋답니다', 'image_url': 'https://recipe1.ezmember.co.kr/cache/recipe/2024/03/18/ac3157a7e1bb16468511090b504d569f1.jpg'}, {'step_number': 7, 'description': '땡초 10개를 어슷썰기 해주세요땡초 10개도마 , 조리용나이프 땡초는 칼칼한 맛을 위해 넣는답니다\n저희 집은 매콤하게 먹는 걸 좋아해서 10개를 넣는 거니 참고 부탁드려요', 'image_url': 'https://recipe1.ezmember.co.kr/cache/recipe/2024/03/18/9b3f4fb43e113dfff9a157c485e7ffaa1.jpg'}, {'step_number': 8, 'description': '소스에 진미채와 썰어둔 땡초를 집어넣어주세요', 'image_url': 'https://recipe1.ezmember.co.kr/cache/recipe/2024/03/18/5f21d4368cd3c11953616ad2673ea90f1.jpg'}, {'step_number': 9, 'description': '후추는 톡톡톡~후추 톡톡톡', 'image_url': 'https://recipe1.ezmember.co.kr/cache/recipe/2024/03/18/badcc40348d568e1e520cfb14918c1761.jpg'}, {'step_number': 10, 'description': '깨소금은 밥숟가락으로 한 스푼을 넣어주세요깨소금 1T', 'image_url': 'https://recipe1.ezmember.co.kr/cache/recipe/2024/03/18/dab7db172d74c6032a7b014f13ce18331.jpg'}, {'step_number': 11, 'description': '재료들을 잘 버무려주면 간단하지만 맛있는 진미채무침 완성!위생장갑', 'image_url': 'https://recipe1.ezmember.co.kr/cache/recipe/2024/03/18/128798f0a4d2b76e55cf5289711b5a331.jpg'}]"
10058,밑반찬,일상,건어물류,무침,진미채무침 오징어채무침 오이 넣고 새콤달콤 여름밑반찬,진미채무침,"1,146",10분 이내,아무나,3인분,"[('오징어채', '200g'), ('오이', '1개'), ('양파', '1개'), ('미림', '2스푼'), ('고춧가루', '2스푼'), ('진간장', '2스푼'), ('식초', '3스푼'), ('올리고당', '2스푼'), ('매실청', '2스푼'), ('고추장', '1스푼'), ('초고추장', '2스푼'), ('마늘', '1스푼')]",여름하면 이거 만한거 없는것 같아요 오징어채무침 꼭 한번해보세요,"[{'step_number': 1, 'description': '오징어채에 맛술 2스푼을 넣어서 연하고 부드럽게 만들어줍니다.', 'image_url': 'https://recipe1.ezmember.co.kr/cache/recipe/2023/05/25/865826c9640e8f5a337c4bb667fbe6c61.jpg'}, {'step_number': 2, 'description': '여기서 먹기 좋은 크기로 가위로 잘라주셔도 좋습니다.', 'image_url': 'https://recipe1.ezmember.co.kr/cache/recipe/2023/05/25/e6530c2d0a3fa03dd3b4f98fca4d555f1.jpg'}, {'step_number': 3, 'description': '오이는 가운데 씨를 없앤 후 얇게 썰어주세요', 'image_url': 'https://recipe1.ezmember.co.kr/cache/recipe/2023/05/25/527aebd1dc25f8a5cb62c1e643fe3fe51.jpg'}, {'step_number': 4, 'description': '양파도 얇게 썰어줍니다.', 'image_url': 'https://recipe1.ezmember.co.kr/cache/recipe/2023/05/25/1ce2d49c6812e6ca10375e14507404fa1.jpg'}, {'step_number': 5, 'description': '림에 버무린 오징어채를 준비합니다. 고춧가루 2스푼 넣어서 먼저 버무려줍니다.', 'image_url': 'https://recipe1.ezmember.co.kr/cache/recipe/2023/05/25/e8f71fd991774923c7314a4fd7946a0e1.jpg'}, {'step_number': 6, 'description': '양념장을 넣어보겠습니다. 진간장 2스푼, 식초 3스푼 올리고 당 2스푼, 매실청 2스푼, 고추장 1스푼, 초고추장 1스푼, 마늘 1스푼', 'image_url': 'https://recipe1.ezmember.co.kr/cache/recipe/2023/05/25/bd585fed4d474f1cf6c51224cf0864a31.jpg'}, {'step_number': 7, 'description': '간을 보고 개인 입맛에 맞추어 조절하시면 됩니다. 양파와 오이를 넣고 버무려주세요', 'image_url': 'https://recipe1.ezmember.co.kr/cache/recipe/2023/05/25/d0ca0b09c6df23eb65a5f785ba7ac6a61.jpg'}, {'step_number': 8, 'description': '마무리로 참기름 1스푼 깨를 넣고 한 번 더 버무려주세요', 'image_url': 'https://recipe1.ezmember.co.kr/cache/recipe/2023/05/25/094a0dee161166a0b5d187b239ad83291.jpg'}, {'step_number': 9, 'description': '여름 밑반찬 진미채무침 완성입니다.', 'image_url': 'https://recipe1.ezmember.co.kr/cache/recipe/2023/05/25/508963227c1bd9242463941ac98188051.jpg'}]"
10059,밑반찬,일상,건어물류,무침,건어물 진미채요리 집반찬 진미채고추장무침/진미오징어채무침,진미채고추장무침,"1,983",15분 이내,초급,5인분,"[('진미채', '300g'), ('맛술', '2스푼'), ('간장', '1.5스푼'), ('고추장', '1스푼'), ('땅콩버터', '0.5스푼'), ('황설탕', '0.5스푼'), ('알룰로스', '1스푼'), ('후추', '1꼬집'), ('마요네즈', '1스푼'), ('깨소금', '약간')]","고소하고 매콤하게 무친 국민 밥도둑반찬 진미채무침입니다

​","[{'step_number': 1, 'description': '백진미채를 준비했어요~', 'image_url': 'https://recipe1.ezmember.co.kr/cache/recipe/2023/08/09/95eb07d43974556abdec462602f965401.jpg'}, {'step_number': 2, 'description': '진미채는 찜기에 담고 맛술 2스푼 뿌려 3~5분 정도 쪄 주세요~진미채 부드럽게 먹는 방법인데 찌는게 번거로울때는 전자레인지에 돌려 사용해도 좋습니다', 'image_url': 'https://recipe1.ezmember.co.kr/cache/recipe/2023/08/09/2bca740ee6598369211c9d9f2dc058121.jpg'}, {'step_number': 3, 'description': '찐 진미채는 너무 길면 먹기 불편하니 가위로 3~4번 잘라 주세요~', 'image_url': 'https://recipe1.ezmember.co.kr/cache/recipe/2023/08/09/9a935f8aa64a6a81b2fbddff33227d171.jpg'}, {'step_number': 4, 'description': '적힌 분량의 간장, 고추장, 땅콩버터, 황설탕, 알룰로스, 후추를 넣어 주세요~알룰로스 없을때는 물엿 넣으면 되고 취향에 따라 양념은 가감해 넣어 주세요!', 'image_url': 'https://recipe1.ezmember.co.kr/cache/recipe/2023/08/09/70aecc39c730b4586fc6f8552e76063b1.jpg'}, {'step_number': 5, 'description': '설탕이 녹고 땅콩버터와 고추장이 잘 풀어 지도록 저어가며 풀어 주면 무침 양념장이 완성됩니다', 'image_url': 'https://recipe1.ezmember.co.kr/cache/recipe/2023/08/09/767856e5ce89c5eeb7eef6989b518bb61.jpg'}, {'step_number': 6, 'description': '양념장에 진미채 넣고 한번 버무려 준 다음 마요네즈 한스푼과 깨소금 약간 넣어 주세요~', 'image_url': 'https://recipe1.ezmember.co.kr/cache/recipe/2023/08/09/5a65eb24a58c3bbca3228e4907ad55981.jpg'}, {'step_number': 7, 'description': '한번 더 버물 버물해 주면 진미오징어채무침이 간단하게 완성!', 'image_url': 'https://recipe1.ezmember.co.kr/cache/recipe/2023/08/09/31b8f1eaa6b175b7b0f87f42473c1f761.jpg'}]"
10060,밑반찬,일상,건어물류,무침,"진미채무침:마요네즈 없이도 부드럽게, 당근 넣은 고추장 양념장",진미채무침,177,30분 이내,중급,5인분,"[('진미채', '350g'), ('당근채', '200g'), ('고추장', '5큰술'), ('고춧가루', '1큰술'), ('쌀조청', '5큰술'), ('다진마늘', '1큰술'), ('매실액', '2큰술'), ('참기름', ''), ('검정깨', ''), ('참깨', '')]",냉장고 들락날락해도 절대 딱딱해 지지 않는 부드러운 진미채 만드는 방법,"[{'step_number': 1, 'description': '진미채를 끓는 물에 넣어 데친다 첨가물을 제거하고 진미채를 부드럽게 해줘요냄비 , 요리젓가락 , 채반', 'image_url': 'https://recipe1.ezmember.co.kr/cache/recipe/2024/04/09/06e2ac9f1b40b3b1b19d1e571e4c9ed41.jpg'}, {'step_number': 2, 'description': '물에 헹군 후 물기를 빼둔다 따뜻한 물에 헹구고 먹기 좋은 길이로 잘라주었어요 주방가위', 'image_url': 'https://recipe1.ezmember.co.kr/cache/recipe/2024/04/09/d8ada91105fe6f9b255b25f1259f82a41.jpg'}, {'step_number': 3, 'description': '당근을 짧고 가늘게 채썬다.주방필러 , 볼당근 손질법', 'image_url': 'https://recipe1.ezmember.co.kr/cache/recipe/2024/04/09/a04e2c9fe3e710a3c2621d04bfb28c6e1.jpg'}, {'step_number': 4, 'description': '웍에 당근채와 고추장, 조청,다진마늘을 넣고 끓인다웍 , 요리스푼', 'image_url': 'https://recipe1.ezmember.co.kr/cache/recipe/2024/04/09/c0b1f91195ae255ee0cd9d869fd0aeaf1.jpg'}, {'step_number': 5, 'description': '고춧가루 넣고 참기름 둘러주면 당근양념장 완성양념장이 묽은 편이라 고춧가루로 농도를 맞췄어요', 'image_url': 'https://recipe1.ezmember.co.kr/cache/recipe/2024/04/09/3594620ff99d7fbc4f4ace45f35bfc9a1.jpg'}, {'step_number': 6, 'description': '불을 끄고 양념장의 한 김이 나간 후 완성된 양념장에 전처리한 진미채를 넣어 무친다.요리스푼 , 조리주걱', 'image_url': 'https://recipe1.ezmember.co.kr/cache/recipe/2024/04/09/a545790a004542270f69475ab95a923b1.jpg'}, {'step_number': 7, 'description': '통깨를 넉넉히 뿌린다', 'image_url': 'https://recipe1.ezmember.co.kr/cache/recipe/2024/04/09/2c218b1a5b727a24c56cccf069b649e91.jpg'}]"
