index,종류별,상황별,재료별,방법별,글 제목,레시피이름,조회수,조리시간,난이도,인분,재료,소개글,조리순서
46003,국/탕,일상,닭고기,끓이기,류수영 닭볶음탕 쌈장 넣은 국물 닭도리탕,None,877,60분 이내,아무나,4인분,"[('닭 볶음탕용', '1kg'), ('감자', '2개'), ('양파', '1개'), ('대파', '1대'), ('청양고추', '4개'), ('소금', '3꼬집'), ('물', '1L'), ('다진마늘', '1큰술'), ('설탕', '3큰술'), ('고춧가루', '4큰술'), ('진간장', '8큰술'), ('쌈장', '1큰술')]","닭을 한 번 구워낸 후 만드는 어남선생표 닭볶음탕 레시피, 쌈장이 들어 묵직한 맛의 닭도리탕! 맛있게 만들어 드세요 :)","[{'step_number': 1, 'description': '닭을 흐르는 물에 씻어가며 뼈에 붙어있는 내장들을 제거해 주세요. 닭껍질은 떼지 않고 그대로 사용합니다', 'image_url': 'https://recipe1.ezmember.co.kr/cache/recipe/2024/07/12/b36cac8482272a693bfd382748a4405f1.jpg'}, {'step_number': 2, 'description': '감자 2개를 큼직하게 자르고, 대파 1대, 양파 1개를 먹기 좋게 잘라주세요도마 , 조리용나이프감자 손질법', 'image_url': 'https://recipe1.ezmember.co.kr/cache/recipe/2024/07/12/c5a0cb814771d7ec20593954ba1bbbc31.jpg'}, {'step_number': 3, 'description': '강불로 달군 팬에 닭의 껍질이 바닥으로 가게 놓고 구워주세요. 이 때 소금 3꼬집을 뿌려주세요웍 , 요리집게', 'image_url': 'https://recipe1.ezmember.co.kr/cache/recipe/2024/07/12/9632098c847ace4c20d3c96c4cff1dcf1.jpg'}, {'step_number': 4, 'description': '닭의 껍질에서 기름이 나오면 3~4분가량 앞뒤로 노릇하게 구워주세요', 'image_url': 'https://recipe1.ezmember.co.kr/cache/recipe/2024/07/12/5f4236916eba119bfaa1d3c42447cdf21.jpg'}, {'step_number': 5, 'description': '닭이 노릇하게 구워지면 다진마늘 1큰술 듬뿍, 대파를 함께 넣고 휘리릭 볶아주세요대파 손질법', 'image_url': 'https://recipe1.ezmember.co.kr/cache/recipe/2024/07/12/68ea0dcd287e24b2a9adc0b2fd0bed761.jpg'}, {'step_number': 6, 'description': '간장 8큰술을 팬의 가장자리에 넣고 바글바글 끓여 닭과 섞어주세요요리스푼', 'image_url': 'https://recipe1.ezmember.co.kr/cache/recipe/2024/07/12/81f13b78d38e3f157f1006abe573a0271.jpg'}, {'step_number': 7, 'description': '중불로 줄인 후 고춧가루 4큰술을 넣고 볶아가며 고추기름을 만들어 주세요', 'image_url': 'https://recipe1.ezmember.co.kr/cache/recipe/2024/07/12/aa070183f428120a4caff2fd4a9771e21.jpg'}, {'step_number': 8, 'description': '설탕 3큰술을 넣고 함께 볶아주세요', 'image_url': 'https://recipe1.ezmember.co.kr/cache/recipe/2024/07/12/14041f9f05032d863cfa793a32a5d3331.jpg'}, {'step_number': 9, 'description': '물 1L를 붓고 강불로 끓여주세요', 'image_url': 'https://recipe1.ezmember.co.kr/cache/recipe/2024/07/12/c7b0db98000207c99a2ba686a9b59f411.jpg'}, {'step_number': 10, 'description': '국물이 끓기 시작하면 쌈장 1큰술을 넣어 강불로 10분 끓여주세요', 'image_url': 'https://recipe1.ezmember.co.kr/cache/recipe/2024/07/12/ee6e5ce59f81269bdcca64691f5b954c1.jpg'}, {'step_number': 11, 'description': '10분 후 중불로 줄이고 양파와 당근, 청양고추를 넣고 15분 더 끓여주세요. 좋아하는 사리도 취향껏 추가해주세요', 'image_url': 'https://recipe1.ezmember.co.kr/cache/recipe/2024/07/12/d164eab7514d21c2a9c9a61166e600511.jpg'}, {'step_number': 12, 'description': '간이 알맞게 졸여지면 마무리해 주세요', 'image_url': 'https://recipe1.ezmember.co.kr/cache/recipe/2024/07/12/1d43b27c2c4df7b39d54530ede8a6e3d1.jpg'}, {'step_number': 13, 'description': '든든한 닭볶음탕 완성입니다 :)국자 , 완성그릇', 'image_url': 'https://recipe1.ezmember.co.kr/cache/recipe/2024/07/12/5cd04f21514fe0d1fb787847ea83d7571.jpg'}]"
46004,국/탕,일상,닭고기,끓이기,닭가슴살 방아잎 된장국,닭가슴살방아잎된장국,507,None,None,None,"[('닭가슴살', '150g'), ('감자', '1/2개'), ('양파', '1/4개'), ('된장', '1숟가락'), ('육수', '4컵'), ('단호박', ''), ('당근', ''), ('대파', ''), ('마늘', ''), ('방아잎', '약간')]",국물요리가 없으면 섭섭한 우리의 식탁 닭가슴살과 텃밭에서 따 온 방아잎으로 된장국을 끓여 보았습니다.,"[{'step_number': 1, 'description': '준비한 재료는 모두 먹기 좋은 크기로 썰어준다.', 'image_url': 'https://recipe1.ezmember.co.kr/cache/recipe/2021/09/30/9a1ef6074c98b1a07c8a7e9b443c0d5a1.jpg'}, {'step_number': 2, 'description': '멸치와 다시마로 육수를 낸 후 감자, 당근, 단호박을 먼저 넣고 끓여준다.', 'image_url': 'https://recipe1.ezmember.co.kr/cache/recipe/2021/09/30/cd9b0f265db39d62468bd9bcd5c5f22e1.jpg'}, {'step_number': 3, 'description': '닭고기, 양파, 고추, 대파, 된장, 마늘을 넣어 한소끔 끓여 마무리한다.', 'image_url': 'https://recipe1.ezmember.co.kr/cache/recipe/2021/09/30/bcae73e38452596ec24cdf1d09bbdba11.jpg'}, {'step_number': 4, 'description': '방아잎은 먹기 직전에 올려준다.', 'image_url': 'https://recipe1.ezmember.co.kr/cache/recipe/2021/09/30/595e03777d05f2b1724afbc112e6e0931.jpg'}]"
46005,국/탕,일상,닭고기,끓이기,먹으면 살빠지는 미역국이 있다❓❗ 닭가슴살두부미역국 만들기,닭가슴살미역국,928,20분 이내,아무나,4인분,"[('미역', '50g'), ('닭가슴살', '3덩이'), ('두부', '1모'), ('다진마늘', '1-2큰술'), ('맛술', '2큰술'), ('국간장', '3큰술'), ('참치액젓', '2큰술'), ('소금', '1/2큰술')]","안녕하세요, 슬비입니다. 
제가 미역국을 진짜 가장 좋아하는데 항상 닭가슴살을 넣어 만들어먹다가 두부를 더 넣어봤어요. 간단하지만 맛있으면서 담백한 미역국 끓이러 가볼까욤~?","[{'step_number': 1, 'description': '오늘의 재료는 미역, 닭가슴살, 국간장, 액젓, 두부, 다진마늘, 소금입니다. \n저는 2인 신혼부부 가족이지만 한솥 끓일거라서 미역, 닭가슴살 양을 저렇게 잡았고 조금만 끓이실 분들은 다 조금씩 줄여서 사용하시면 됩니다.참치액젓이 없다면 다른 액젓으로 사용하셔도 됩니다.', 'image_url': 'https://recipe1.ezmember.co.kr/cache/recipe/2022/03/04/826c719a1eb698e09c3ccf1a9d64a80f1.png'}, {'step_number': 2, 'description': '우선 미역을 불려주세요. 미역은 자른미역기준으로 한숟갈에 3-5g 1인분정도로 보더라고요.', 'image_url': 'https://recipe1.ezmember.co.kr/cache/recipe/2022/03/04/103201e08979757d14c0a7611da72baf1.png'}, {'step_number': 3, 'description': '물을 끓여서 닭가슴살을 익혀줄거에요. 혹시 냉동 닭가슴살을 사용하시는 분이라면 잡내제거를 위해 맛술 2큰술을 넣어주세요. 혹시 맛술이 없으신 분들은 패스하셔도 됩니다.', 'image_url': 'https://recipe1.ezmember.co.kr/cache/recipe/2022/03/04/d4c905530fc638e1878ae2b4024ce4e41.png'}, {'step_number': 4, 'description': '끓는 물에 닭가슴살을 넣고 익혀주세요.\n칼집을 내거나 잘라서 익혀주시면 더 빨리 익힐 수 있어요.', 'image_url': 'https://recipe1.ezmember.co.kr/cache/recipe/2022/03/04/65ee74b7a2522480e09be38bc4ba7d4d1.png'}, {'step_number': 5, 'description': '생각보다 오래 걸려요. 익을때까지 끓여주세요.', 'image_url': 'https://recipe1.ezmember.co.kr/cache/recipe/2022/03/04/1b7367eaf180a160c43f1022e9452a661.png'}, {'step_number': 6, 'description': '닭가슴살이 익는 동안 두부를 반으로 잘라서 칼등으로 으깨주세요.', 'image_url': 'https://recipe1.ezmember.co.kr/cache/recipe/2022/03/04/0c16b6170d4b69cd184c4f99f4212b2e1.png'}, {'step_number': 7, 'description': '혹시 칼등으로 으깨기 귀찮다 하시는 분들은 주먹으로 으깨주세요.', 'image_url': 'https://recipe1.ezmember.co.kr/cache/recipe/2022/03/04/8a85168cb4dfb243896519c4c7004ff11.png'}, {'step_number': 8, 'description': '닭가슴살이 다 익어서 결대로 잘게 찢어줬어요.', 'image_url': 'https://recipe1.ezmember.co.kr/cache/recipe/2022/03/04/031f30f0e9c2ab82fec0d4731ee428c21.png'}, {'step_number': 9, 'description': '미역도 다 살아났네요.', 'image_url': 'https://recipe1.ezmember.co.kr/cache/recipe/2022/03/04/7679f5da416f889eb193c5286d3ae70b1.png'}, {'step_number': 10, 'description': '참기름을 두르고 미역을 볶아요.', 'image_url': 'https://recipe1.ezmember.co.kr/cache/recipe/2022/03/04/123f80d21b8d1c3e55a663a3c66376921.png'}, {'step_number': 11, 'description': '국간장 1큰술을 넣고 같이 볶아요.', 'image_url': 'https://recipe1.ezmember.co.kr/cache/recipe/2022/03/04/4ee80407b3932cc0adb14f06f43110b01.png'}, {'step_number': 12, 'description': '다진마늘 1-2큰술 넣어요.', 'image_url': 'https://recipe1.ezmember.co.kr/cache/recipe/2022/03/04/c51415e6f99f4d6443b07022560f45761.png'}, {'step_number': 13, 'description': '닭가슴살 삶았던 물을 넣고', 'image_url': 'https://recipe1.ezmember.co.kr/cache/recipe/2022/03/04/00555350baae1ff44e2ebc772088acce1.png'}, {'step_number': 14, 'description': '생수를 더 보충해줘요.', 'image_url': 'https://recipe1.ezmember.co.kr/cache/recipe/2022/03/04/0bf8895829e86025460652b9ef4bfee11.png'}, {'step_number': 15, 'description': '닭가슴살도 넣어요.', 'image_url': 'https://recipe1.ezmember.co.kr/cache/recipe/2022/03/04/79e0769d5f70f8feb9da8dd1d8120deb1.png'}, {'step_number': 16, 'description': '푸우욱 끓일거라서 물을 더더 보충해줬어요.', 'image_url': 'https://recipe1.ezmember.co.kr/cache/recipe/2022/03/04/7ad2611f99c678259c4ee66a2729dcbd1.png'}, {'step_number': 17, 'description': '10분이상 끓여주면서 이제 간을 해줄게요.', 'image_url': 'https://recipe1.ezmember.co.kr/cache/recipe/2022/03/04/6a0ad228d7c772faf4f9945e2cfcea0a1.png'}, {'step_number': 18, 'description': '참치액젓 2큰술을 넣어요. 없으시면 다른 액젓도 사용가능해요.', 'image_url': 'https://recipe1.ezmember.co.kr/cache/recipe/2022/03/04/cd1b2e233377f94e2b5b8c33e9d480c31.png'}, {'step_number': 19, 'description': '국간장 2큰술 넣어요.', 'image_url': 'https://recipe1.ezmember.co.kr/cache/recipe/2022/03/04/f3ed3c6d8c7b4de220e311dca53e6b211.png'}, {'step_number': 20, 'description': '아까 으깨두었던 두부도 넣어요.', 'image_url': 'https://recipe1.ezmember.co.kr/cache/recipe/2022/03/04/6359353f5cc7baf2e6c746a68ee37fa31.png'}, {'step_number': 21, 'description': '모자란 간은 소금으로 맞춰주세요.', 'image_url': 'https://recipe1.ezmember.co.kr/cache/recipe/2022/03/04/51a17743179e6d68263169e2021b07861.png'}, {'step_number': 22, 'description': '치킨스톡도 1개 넣어줬어요. 제거는 10g이에요.', 'image_url': 'https://recipe1.ezmember.co.kr/cache/recipe/2022/03/04/d5969666ee5c7e8079676ef2c8ab0dca1.png'}, {'step_number': 23, 'description': '간이 약간 부족해서 소금을 반큰술 넣었어요.\n여러분들은 미역이나 닭가슴살의 양이 적다면 모든 간의 양을 다 줄여주세요.', 'image_url': 'https://recipe1.ezmember.co.kr/cache/recipe/2022/03/04/949ae59e0314accdaea2c3e0db9050b71.png'}, {'step_number': 24, 'description': '다 끓였으면 불을 끄고 맛있게 드시면 끝! 입니다 .\n미역국이 이렇게 완성됐어요. 복잡해보이지만 진짜 간단하고 맛있어요! 한번 오늘 저녁 미역국 GO?', 'image_url': 'https://recipe1.ezmember.co.kr/cache/recipe/2022/03/04/76066bfe5b3d64b7787662422ba2e6f41.png'}]"
46006,국/탕,일상,닭고기,끓이기,누룽지 삼계탕 만들기 냄비 닭백숙 끓이는법,누룽지삼계탕,"1,794",90분 이내,중급,2인분,"[('닭                                                                                영계 1kg', '2마리'), ('물                                                                                닭이 잠길 정도', ''), ('백숙용 한약재', '1팩'), ('누룽지', '약간'), ('대추', '7~10개'), ('통마늘', '7~10개'), ('대파', '1대'), ('조각 다시마', '2조각'), ('소금                                                                                간 맞추기', '약간'), ('통후추', '약간'), ('월계수잎', '약간')]","요 며칠 온가족이 여름 감기로 병원을 들락날락했어요. 겨울 감기보다 훨씬 더 지독한 여름 감기라더니 정말 말 그대로 독하긴 독하더라고요


고열에 기침에 가래에... 입맛도 하나도 없어서 밥을 1/3공기도 겨우 먹었어요 ​ ​ 


몸이 조금 회복되자마자 삼계탕부터 끓였어요. 여름 보양식에는 닭백숙만 한 것이 없겠다 싶어서요 ​ ​ 


오랜만에 끓인 영계백숙이라 온 가족이 아주 맛있게 즐겼어요. 잡내 없이 감칠맛 좋은 국물과 쫄깃쫄깃한 닭고기가 잃었던 입맛을 되살리기에 충분했어요


 지친 몸으로 겨우겨우 끓였거든요. 그냥 사 먹을까 생각도 들었지만 직접 끓여먹기 정말 잘했다 싶을 정도로 잘 먹어주는 가족들을 보니 못내 뿌듯했어요^^ ​ ​ 


시간이 좀 걸리긴 해도 만들기 어렵지 않은 누룽지백숙 레시피 정리해볼께요~~꼭 한번 따라 만들어보세요~~ ​ ​","[{'step_number': 1, 'description': '부재료는 아래와 같이 준비했어요 백숙용 한약재 요즘은 깔끔하게 한 팩으로 담겨 나오죠. 누룽지는 선택사항으로 저는 함께 넣어먹고 싶어서 준비했어요 그리고 대파 1대와 통후추, 통마늘도 기호에 맞게 7~10개 정도 준비해 주세요 *사진에는 없지만 조각 다시마 도 1~2조각 넣어줬어요', 'image_url': 'https://recipe1.ezmember.co.kr/cache/recipe/2024/06/26/5f68a79341068a2b16d36f4fce879f031.jpg'}, {'step_number': 2, 'description': '영계 두 마리 준비했어요. 한 마리당 500g 정도예요 손질이 잘 되어 있는 닭이지만 삶기 전 제거해 줘야 할 부분들이 있어요. 그래야 백숙을 끓였을 때 잡내를 줄여주거든요스텐트레이닭고기 손질법', 'image_url': 'https://recipe1.ezmember.co.kr/cache/recipe/2024/06/26/98df08ae27d9714c5148790f4e51cd891.jpg'}, {'step_number': 3, 'description': '우선 양쪽 날개 끝부분을 가위로 잘라주고요주방가위', 'image_url': 'https://recipe1.ezmember.co.kr/cache/recipe/2024/06/26/32aad7ef8541da56406fb7e186fb08321.jpg'}, {'step_number': 4, 'description': '꽁지 부분도 잘라내주세요', 'image_url': 'https://recipe1.ezmember.co.kr/cache/recipe/2024/06/26/62d9f2e6441fbc1aee222fa4b48dfa271.jpg'}, {'step_number': 5, 'description': '그리고 꽁지 주변과 목 쪽 기름들도 잘라내주는 것이 좋아요 그다음 흐르는 물에 깨끗하게 씻어주세요. 안쪽에는 남아있는 핏덩어리나 내장 등이 남아 있을 수 있으니 뼈 사이사이 움푹 파인 곳에 손을 넣어 꼼꼼하게 문질러요. 이런 것들을 흐르는 물에 깔끔하게 제거해 주셔야 냄새 없이 맛있게 끓이실 수 있어요 *삶기 전 이렇게 몇 가지 손질만 잘 해줘도 잡내 제거에 도움이 많이 되니까 생략치 마시고 꼭 손질부터 해주세요', 'image_url': 'https://recipe1.ezmember.co.kr/cache/recipe/2024/06/26/a862eab2d02183b74d901506559446551.jpg'}, {'step_number': 6, 'description': '잡내 제거에 도움이 되는 것 중에 하나가 바로 삶기 전 데치는 과정을 거치는 건데요. 냄비에 닭이 충분히 잠길 정도의 물을 붓고 통후추와 월계수잎을 적당량 넣어주세요 물이 끓으면 손질 및 세척을 완료한 닭을 넣고 가볍게 1분 정도만 데쳐주세요 데친 닭은 흐르는 물에 한번 헹궈서 준비합니다냄비 , 요리집게', 'image_url': 'https://recipe1.ezmember.co.kr/cache/recipe/2024/06/26/492b4f81c85a8cd011c0a53fca621ed31.jpg'}, {'step_number': 7, 'description': '이제 닭이 잠길 정도의 물에 닭과 부재료를 넣어 삶아주기만 하면 됩니다. 밥솥, 압력솥 등 다양하게 활용하시는데 저는 이번에는 냄비 백숙 끓여봤어요 삶는데 시간이 좀 오래 걸려서 그렇지 냄비 닭백숙 끓이기는 정말 쉬워요 큼지막한 냄비에 닭이 충분히 잠길 정도의 물을 붓고 준비한 부재료를 한편에 꼼꼼히 넣어주세요', 'image_url': 'https://recipe1.ezmember.co.kr/cache/recipe/2024/06/26/4a9c94678d153b0f8160fe9bebe6950f1.jpg'}, {'step_number': 8, 'description': '넣고 보니 벌써 삼계탕이 완성이라도 된 듯 모양이 꽤나 그럴듯하죠? 요즘 밖에서 삼계탕 한 그릇 사 먹으려면 가격이 후들후들한데 집에서 이렇게 직접 끓여 온 가족이 다 함께 즐기면 가성비 최고랍니다', 'image_url': 'https://recipe1.ezmember.co.kr/cache/recipe/2024/06/26/c32b58491f4b5a9c00ffdf86885ec7a41.jpg'}, {'step_number': 9, 'description': '이제 약 40분간 푹 끓여주면 되는데요', 'image_url': 'https://recipe1.ezmember.co.kr/cache/recipe/2024/06/26/2cdad9cc007534ec4c1c9eea909d9fee1.jpg'}, {'step_number': 10, 'description': '국물이 뽀얗게 우러나오면 중간에 한약재와 대파 등은 건져내시면 됩니다', 'image_url': 'https://recipe1.ezmember.co.kr/cache/recipe/2024/06/26/a64b447d4c47b92af4368da59843e9901.jpg'}, {'step_number': 11, 'description': '30분 정도 끓였을 때 누룽지를 모두 넣고 10~15분 정도 더 끓여주면 됩니다 누룽지를 좀 더 부드럽게 푹 익혀 먹고 싶다면 처음부터 넣고 끓여도 되고요 저처럼 누룽지의 식감을 함께 느끼고 싶다면 이렇게 마무리하기 10~15분 전에 넣어주시면 됩니다', 'image_url': 'https://recipe1.ezmember.co.kr/cache/recipe/2024/06/26/b19513dd7c76a5427c7c5e213b097e4f1.jpg'}, {'step_number': 12, 'description': '끓이는 사이 고명으로 올릴 대파는 쏭쏭 썰어두고 간을 맞출 소금과 후추도 준비해 주세요\n도마 , 조리용나이프대파 손질법', 'image_url': 'https://recipe1.ezmember.co.kr/cache/recipe/2024/06/26/5287d24d573cbae43f33d0a935d045961.jpg'}, {'step_number': 13, 'description': '마무리에 소금을 약간 넣어 적당히 간을 맞춰줬어요 너무 짜지 않게 맞춰두면 먹기 전 입맛에 따라 소금을 더 넣어 최종 간을 맞춰셔 드시면 된답니다', 'image_url': 'https://recipe1.ezmember.co.kr/cache/recipe/2024/06/26/0db5b80445c5d58b5a1ee7a9a7709b291.jpg'}]"
46007,국/탕,일상,닭고기,끓이기,닭백숙,닭백숙,85,20분 이내,초급,4인분,"[('생닭', '1마리'), ('대파', '넉넉히'), ('통마늘', '20알'), ('부추', '넉넉히'), ('소금', '약간만')]",더운여름이지만 며칠후면 말복이 돌아오기에 미리미리 건강을 챙기고 싶어서 우리집만의 비법으로 닭백숙을 끊였습니다.,"[{'step_number': 1, 'description': '닭백숙을 소개합니다.', 'image_url': 'https://recipe1.ezmember.co.kr/cache/recipe/2024/08/12/ac4952cdf7d4ffc08226a562248d3e441.jpg'}, {'step_number': 2, 'description': '생닭을 손질한후 깨끗하게 씻어서 준비합니다.위생장갑 , 주방가위 , 냄비닭고기 손질법', 'image_url': 'https://recipe1.ezmember.co.kr/cache/recipe/2024/08/12/91750a8a12bd928f673b1bcf04da74221.jpg'}, {'step_number': 3, 'description': '대파,통마늘을 넉넉하게 넣어주세요.도마 , 조리용나이프', 'image_url': 'https://recipe1.ezmember.co.kr/cache/recipe/2024/08/12/c9047c1180369dd522ed69ab3b4cc9471.jpg'}, {'step_number': 4, 'description': '물을 넉넉하게 넣어준후 보글보글 오래도록 끊여주세요. 중간에 숟가락을 이용해서 거품을 걷어주면 국물이 더 깔끔해진답니다.숟가락', 'image_url': 'https://recipe1.ezmember.co.kr/cache/recipe/2024/08/12/c39696144645c12db54ac341c0d8694f1.jpg'}, {'step_number': 5, 'description': '부추를 준비해주세요.부추 손질법', 'image_url': 'https://recipe1.ezmember.co.kr/cache/recipe/2024/08/12/6a3148e1a05b88f0db42bc756449f4711.jpg'}, {'step_number': 6, 'description': '부추를 닭국물에 잠시 담궈준후 닭백숙 위에 살포시 올려주세요.', 'image_url': 'https://recipe1.ezmember.co.kr/cache/recipe/2024/08/12/3d94e4d7f2557cc527b5d9bfb7653c091.jpg'}, {'step_number': 7, 'description': '닭백숙이 다 삶아지면 볼에 담아주세요.국자 , 완성그릇', 'image_url': 'https://recipe1.ezmember.co.kr/cache/recipe/2024/08/12/28349c5a85db004b40b93685e7f49a5e1.jpg'}, {'step_number': 8, 'description': '닭백숙이 완성이 되었습니다.', 'image_url': 'https://recipe1.ezmember.co.kr/cache/recipe/2024/08/12/11adecf34759157cbe280a6d8b448d481.jpg'}]"
46008,국/탕,일상,닭고기,끓이기,끓이면서 먹는 닭볶음탕,닭도리탕,179,60분 이내,중급,3인분,"[('닭 볶음탕용', '2팩'), ('감자', '2개'), ('당근', '1개'), ('양파', '2개'), ('맛술', '약간'), ('고추장', '2T'), ('일반 고추가루', '2T'), ('매운고추가루', '0.5T'), ('다진마늘', '2T'), ('설탕', '1T'), ('간장', '3T'), ('복숭아 즙', '5T'), ('후추', '적당히'), ('소금                                                                                마지막 간 맞춤용', ''), ('생강가루', '적당히')]","마트에 닭볶음탕용 2팩에 6,500원 가격이 너무 좋아 안 살수가 없었고, 오늘은 오랜만에 얼큰한 닭도리탕으로 결정~~ 식당에서 끓이면서 맛있게 먹었던 닭도리탕이 기억나서 그 스타일로 만들어 먹기로 했습니다.","[{'step_number': 1, 'description': '마트에서 구입한 닭도리탕용 닭 2팩~', 'image_url': 'https://recipe1.ezmember.co.kr/cache/recipe/2024/08/18/74cf10a2ab5819bbd9baaa3b656f6ee61.jpg'}, {'step_number': 2, 'description': '끓는 물에 맛술 조금 부어주고 닭을 데쳐 줍니다. 맛술 대신 소주 or 정종 등 술 종류면 상관 없어요.냄비닭고기 손질법', 'image_url': 'https://recipe1.ezmember.co.kr/cache/recipe/2024/08/18/977c6939f5f3ec75bb63fa50b8f6db521.jpg'}, {'step_number': 3, 'description': '데치는 동안 양념장을 준비합니다. 우선, 양념볼에 고추장1.5T, 일반고추가루1.5T, 매운고추가루0.5T 다진마늘2T, 설탕1T 넣습니다.소스볼 , 숟가락', 'image_url': 'https://recipe1.ezmember.co.kr/cache/recipe/2024/08/18/dce65ddc83851e29c21cad9e0aa215be1.jpg'}, {'step_number': 4, 'description': '간장3T, 후추/생강가루 적당히 뿌리고, 복숭아즙 넣고 골고루 섞어 양념장을 준비합니다. 복숭아즙이 없다면, 달콤한 다른 과일즙도 상관 없어요.', 'image_url': 'https://recipe1.ezmember.co.kr/cache/recipe/2024/08/18/1b453ffa002a06cf9f1c699fe38ee81d1.jpg'}, {'step_number': 5, 'description': '감자, 당근, 양파를 한입 크기로 썰어 준비해 주세요.도마 , 조리용나이프감자 손질법', 'image_url': 'https://recipe1.ezmember.co.kr/cache/recipe/2024/08/18/8d0a45ffceb005fb5e575b0ebc2fbaf01.jpg'}, {'step_number': 6, 'description': '데친 닭의 일부 껍질과 기름기 많은 부분은 제거한 후, 찬물에 한번 행궈 줍니다. 고기에 양념이 잘 베이도록 칼집도 내어 주세요. 끓일 냄비에 닭을 넣고 물 양은 재료가 잠길 정도 높이에 맞춰 부어주세요.채반', 'image_url': 'https://recipe1.ezmember.co.kr/cache/recipe/2024/08/18/4e98e76072528177e12ddf431bd5678b1.jpg'}, {'step_number': 7, 'description': '물이 끓기 시작하면, 준비한 야채와 양념장을 모두 넣고 뚜껑을 닫은 후 중불에 끓여 줍니다.', 'image_url': 'https://recipe1.ezmember.co.kr/cache/recipe/2024/08/18/8007af99184f17929e6218b7975ce34b1.jpg'}, {'step_number': 8, 'description': '감자가 익을때까지 끓여 줍니다. 여기서 살짝 간을 보고 필요하면 약간 싱거울 정도로 소금간을 맞춰주시면 됩니다. 나중 불스타에 끓이면서 국물이 쫄으면서 간이 더 세지기 때문이에요.요리스푼', 'image_url': 'https://recipe1.ezmember.co.kr/cache/recipe/2024/08/18/73977d8c43ae2af78b685c8f79a0cab81.gif'}, {'step_number': 9, 'description': '감자가 익으면 식탁에 불스타를 놓고 옮겨 약불에 끓이면서 먹으면 됩니다.', 'image_url': 'https://recipe1.ezmember.co.kr/cache/recipe/2024/08/18/483c66346568a179b584c4092a4bda4e1.jpg'}, {'step_number': 10, 'description': '끓이면서 먹는 닭도리탕 완성입니다.', 'image_url': 'https://recipe1.ezmember.co.kr/cache/recipe/2024/08/18/af3fa4ff79efc61a75406686d5f29e7a1.jpg'}]"
