index,종류별,상황별,재료별,방법별,글 제목,레시피이름,조회수,조리시간,난이도,인분,재료,소개글,조리순서
26444,메인반찬,일상,채소류,무침,묵 미나리무침레시피 도토리묵 양념,묵미나리무침,180,30분 이내,아무나,4인분,"[('미나리', '1줌'), ('도토리묵', '1모'), ('양파', '1/2개'), ('홍고추', '1개'), ('진간장', '3'), ('고춧가루', '2'), ('설탕', '0.5'), ('다진 마늘', '0.5'), ('깨소금', '1'), ('참기름', '2')]",더운 여름 입맛을 돋워줄 수 있는 간단한 요리 알려드릴게요. 바로 미나리 무침과 도토리무침인데요. 아삭한 식감 자랑하는 미라리에 탱글탱글한 도토리묵 더해졌어요. 도토리묵 양념으로 간을 맞춰줬더니 매콤하면서 감칠맛 나고 고소한 참기름이랑 참깨 뿌려주었더니 고소함이 넘쳐나요. ​짭조름하면서도 매콤한 도토리묵 양념 재료가 풍성하여 간이 딱 맞았어요. ​ 한번 만들면 손쉽고 맛있어서 계속 만들어 먹게 되는 마성의 묵 미나리 무침이에요.,"[{'step_number': 1, 'description': '미나리는 물에 담가 불순물을 제거하고 시든 잎이 있다면 떼어내어주세요.믹싱볼 \n\n                        \n                            향긋하고 부드러운 불미나리 500g', 'image_url': 'https://recipe1.ezmember.co.kr/cache/recipe/2024/07/21/898d195041325e207956bd4771eb05dd1.jpg'}, {'step_number': 2, 'description': '지저분한 끝부분은 제거하고 미나리를 먹기 좋은 길이로 잘라주세요도마 , 조리용나이프미나리 손질법', 'image_url': 'https://recipe1.ezmember.co.kr/cache/recipe/2024/07/21/6c6d3b0ec53b1c30f6f83981df578f191.jpg'}, {'step_number': 3, 'description': '양파는 채 썰어 주고 홍고추는 반으로 갈라 씨를 제거한 후 채 썰어 놓아요.양파 손질법', 'image_url': 'https://recipe1.ezmember.co.kr/cache/recipe/2024/07/21/8b8929a19a1e0fb1c96176db2e73940f1.jpg'}, {'step_number': 4, 'description': '먼저 냄비에 묵이 잠길 정도로 물을 부어 끓여주세요. 도토리묵을 흐르는 물에 씻어 불순물을 제거하고 물이 끓기 시작하면 묵을 통째로 넣어요. 약 1~2분 정도 데쳐주세요. 냄비', 'image_url': 'https://recipe1.ezmember.co.kr/cache/recipe/2024/07/21/d9bbfe8ac382117ffa4413e86588a6871.jpg'}, {'step_number': 5, 'description': '데친 묵은 찬물을 가볍게 헹군 후 체에 밭쳐 물기를 제거해 주세요.채반', 'image_url': 'https://recipe1.ezmember.co.kr/cache/recipe/2024/07/21/a43d5bafe268aceb7ff057ba5dce7b9c1.jpg'}, {'step_number': 6, 'description': '묵은 미리 자르는 것보다 요리하기 직전에 자르는 것이 좋아요. 반으로 나눈 후 적당한 두께로 썰어주세요. 너무 얇게 자르면 묵이 쉽게 부서져요.도토리묵 손질법', 'image_url': 'https://recipe1.ezmember.co.kr/cache/recipe/2024/07/21/6a22cc218fd1b48fa7914ec33e8051d41.jpg'}, {'step_number': 7, 'description': '간장 3스푼 넣고 고춧가루, 참기름 2스푼 넣어줬어요.여기에 깨소금 1스푼 팍팍 넣고 다진 마늘, 설탕 0.5스푼 약간 첨가하면 더 맛있어요. 도토리묵 양념을 잘 섞어 놓아요.소스볼 , 수저달달한 맛을 더 내고 싶다면 설탕량을 늘려주세요', 'image_url': 'https://recipe1.ezmember.co.kr/cache/recipe/2024/07/21/d7684cf9e9525bce8a8a161ee5a7f0711.jpg'}, {'step_number': 8, 'description': '미나리를 볼에 넣고 손질한 양파와 홍고추도 투하!볼', 'image_url': 'https://recipe1.ezmember.co.kr/cache/recipe/2024/07/21/1ae7637f3a0d87fcc23b9d31a6b621b81.jpg'}, {'step_number': 9, 'description': '묵과 도토리묵 양념을 넣고 묵이 뭉개지거나 부서지지 않게 손끝에 힘을 빼고 손으로 살살 무쳐주세요.', 'image_url': 'https://recipe1.ezmember.co.kr/cache/recipe/2024/07/21/a259d485fb4de58ae9eaa00f2b53a2f21.jpg'}]"
26445,메인반찬,일상,채소류,무침,오이소박이 담그는법 간단한 오이소박이 레시피,오이소박이,"2,982",60분 이내,아무나,3인분,"[('오이', '4개'), ('양파', '1/2개'), ('부추', '130g'), ('굵은소금                                                                                오이세척용', '2T'), ('찬 물                                                                                생수', '700ml'), ('굵은 소금                                                                                 듬뿍 4~5T', '50g'), ('설탕', '1T'), ('다진마늘', '2T'), ('까나리액젓', '6T'), ('새우젓', '1T'), ('매실청', '3T'), ('설탕', '1T'), ('고춧가루', '6T'), ('통깨', '2T')]",초보자도 쉽게 할수 있는 오이소박이 풀쑤지않고 믹서기 사용안해도 맛있는 오이소박이에요.,"[{'step_number': 1, 'description': '오이의 오돌톨한 부분을 씻기 위해 굵은소금 2T를 준비해주세요.천일염으로 오이의 오돌톨한 부분에 문질러 주세요오이세척용 굵은소금 2T 오이 4개 볼', 'image_url': 'https://recipe1.ezmember.co.kr/cache/recipe/2024/08/05/a6227f844be067f19d52e4cc66ac90fb1.jpg'}, {'step_number': 2, 'description': '흐르는 물에 문지른 오이를 씻어 준비 해주세요.', 'image_url': 'https://recipe1.ezmember.co.kr/cache/recipe/2024/08/05/19eb3981c72876d19ef2f486a332cf101.jpg'}, {'step_number': 3, 'description': '쓴맛이 나는 오이의 양쪽 끝부분을 잘라주세요.도마 , 조리용나이프', 'image_url': 'https://recipe1.ezmember.co.kr/cache/recipe/2024/08/05/59cd7f595d6cf5d81d96bca054e291771.jpg'}, {'step_number': 4, 'description': '오이를 5~6cmm 길이로 잘라주세요.오이를 4등분하여 잘라줘도 돼요.오이 손질법', 'image_url': 'https://recipe1.ezmember.co.kr/cache/recipe/2024/08/05/347f41ef8090f88177005f872e78751c1.jpg'}, {'step_number': 5, 'description': '쨈 뚜껑위에 오이를 올려 놓고 십자 모양을 내주세요. 십자모양에 오이소박이 소(양념을)을 넣어주기 위해 꼭 해야 하는 과정으로 잼뚜껑이나 젓가락위에 오이를 올려 놓고 자르면아래까지 다 잘리지 않아 오이소박이 만들때 편리해요.', 'image_url': 'https://recipe1.ezmember.co.kr/cache/recipe/2024/08/05/90f0ac292de31512d025bdd8e0d338051.jpg'}, {'step_number': 6, 'description': '큰볼에 십자 모양을 낸 오이를 절일 찬물(생수) 700ml를 부어 주세요.추가로 굵은 소금 50g( 숟가락 듬뿍 4~5T) 설탕1T를 넣어 준후 알갱이가 보이지 않을때 까지 잘 저어주세요.알갱이가 보이지 않으면 십자 모양을 낸 오이를 넣어 준후 약 30분간 오이를 절여주세요.찬물(생수)700ml / 굵은 소금 50g( 듬뿍 4~5T / 설탕1T', 'image_url': 'https://recipe1.ezmember.co.kr/cache/recipe/2024/08/05/a6a9a889e14ae9bc3afedf8ff6c9053c1.jpg'}, {'step_number': 7, 'description': '30분이 지나면 오이를 절인 물만 버린 후 오이를 건저내주세요. (씻지 않고 그대로 사용 )', 'image_url': 'https://recipe1.ezmember.co.kr/cache/recipe/2024/08/05/6e659c050bf27e16cbacd0a76a9522601.jpg'}, {'step_number': 8, 'description': '오이 소박이 소(양념) 부재료 양파는 잘게 잘라주고 부추는 1~2cm 로 잘라 준비해주세요.양파 1/2 / 부추 130g양파 손질법', 'image_url': 'https://recipe1.ezmember.co.kr/cache/recipe/2024/08/05/21ddc1e4a6f1a39fef20c99fa15c55221.jpg'}, {'step_number': 9, 'description': '큰볼에 양파와 부추를 넣어주세요.', 'image_url': 'https://recipe1.ezmember.co.kr/cache/recipe/2024/08/05/ab64457de5b167141b9fed58615d83fb1.jpg'}, {'step_number': 10, 'description': '양파와 부추가 담긴 볼에 오이소박이 소 (양념) 재료를 넣어 주세요. 다진마늘2T / 까나리액젓 6T / 새우젓1T/ 매실청3T / 설탕1T / 고운고춧가루3, 매운고춧가루 3 총 6T /통깨2T 재료가 골고루 잘 섞이게 버무려 주세요.다진마늘2T / 까나리액젓 6T / 새우젓1T 매실청3T / 설탕1T / 고춧가루6T 통깨2T위생장갑', 'image_url': 'https://recipe1.ezmember.co.kr/cache/recipe/2024/08/05/ec93d93f4ee69dfa2fc0699e640e40641.jpg'}, {'step_number': 11, 'description': '절인 오이와, 오이소박이 소가 준비 다 되었으면절인 오이안에 소를 넣어 주고, 오이 겉면에도 양념을 소량 발라주세요.', 'image_url': 'https://recipe1.ezmember.co.kr/cache/recipe/2024/08/05/83db40452f32dd1ee1f3f08f1948036b1.jpg'}, {'step_number': 12, 'description': '하나씩 반찬통으로 옮겨 주세요. 남은 오이소박이 소도 오이 위에 꾹꾹 눌러 담아주세요.반찬통 , 접시', 'image_url': 'https://recipe1.ezmember.co.kr/cache/recipe/2024/08/05/2f71c17d0ae7dcac514b66551037a2ce1.jpg'}]"
26446,메인반찬,일상,채소류,무침,당귀사과초무침~ 웰빙,당귀사과초무침,"2,130",30분 이내,초급,2인분,"[('고추장', '1큰술'), ('고춧가루', '1큰술'), ('매실', '1큰술'), ('설탕', '1작은술'), ('식초', '3큰술'), ('맛술', '1큰술'), ('들기름', '1작은술'), ('깨', '1작은술'), ('당귀', '50g'), ('사과', '1/2개')]",건강반찬~ 당귀와 사과 아주 잘 어울리네요..,"[{'step_number': 1, 'description': '양념재료중 들기름,깨를 제외하고 모든재료를 섞어 준비해주세', 'image_url': 'https://recipe1.ezmember.co.kr/cache/recipe/2016/04/20/b65ffbac1c15b1452f2cfb087b1324fb1.jpg'}, {'step_number': 2, 'description': '사과는 껍질을 벗겨 슬라이스해서 준비해주시구요', 'image_url': 'https://recipe1.ezmember.co.kr/cache/recipe/2016/04/20/02a34ab88a48c9e27664fa3aac2d6ed31.jpg'}, {'step_number': 3, 'description': '당귀잎이랍니다..\n깨끗이 씻어 물기제거해 준비해주세요', 'image_url': 'https://recipe1.ezmember.co.kr/cache/recipe/2016/04/20/6ebf5ef17360e6143946864f363f941b1.jpg'}, {'step_number': 4, 'description': '양념볼에 사과,당귀잎을 넣어 무쳐주시고 마지막에 들기름,깨를 넣어주시면 완성입니다', 'image_url': 'https://recipe1.ezmember.co.kr/cache/recipe/2016/04/20/b2647be527113876e2ad9e7d2010e9b51.jpg'}]"
26447,메인반찬,일상,채소류,무침,아삭한 숙주무침! (채소요리),숙주나물무침,"2,089",60분 이내,아무나,3인분,"[('숙주', '300g'), ('양파                                                                                작', '1/2개'), ('노랑 파프리카', '1/2개'), ('청양고추', '1개'), ('홍고추', '1개'), ('대파흰부분', '약간'), ('통깨', '조금'), ('소금', '약간'), ('양조간장', '3큰술'), ('설탕', '2큰술'), ('다진마늘', '1작은술'), ('식초', '2.5큰술'), ('미림', '1작은술')]","아이스크림을 사기 위해 동네 슈퍼로 간다는 작은 녀석에게 콩나물 1팩을 사달라고 했더니
들고 온 숙주!
그냥 콩나물이 보이길래 집어왔다는데, 그게 숙주더라고요.
저희 집이 콩나물만큼이나 숙주를 자주 먹긴 하지만 아귀찜에 숙주를 넣을 순 없는지라
그냥 아삭하게 무침을 만들었어요.
아삭하게~","[{'step_number': 1, 'description': '숙주는 체에 밭쳐 흐르는 물에 씻어 물기를 빼주세요.', 'image_url': 'https://recipe1.ezmember.co.kr/cache/recipe/2017/07/18/a70cdc61d044486b1f908509ee773a081.jpg'}, {'step_number': 2, 'description': '노랑 파프리카와 양파 채 썰고\n대파, 홍고추, 청양고추는 송송 썰어주세요.', 'image_url': 'https://recipe1.ezmember.co.kr/cache/recipe/2017/07/18/05afafa9d02c03f6a945508a243ab12c1.jpg'}, {'step_number': 3, 'description': '숙주나물이 충분히 잠길 정도의 물에 소금을 넣고 끓여\n숙주를 넣고 2~3분 이내로 데쳐주세요.\n저는 처음부터 뚜껑을 덮지 않았어요.', 'image_url': 'https://recipe1.ezmember.co.kr/cache/recipe/2017/07/18/4222d6a2cf395f36f8bfc2ccc9093c871.jpg'}, {'step_number': 4, 'description': '얼음이 있는 찬물에 넣고 헹궈 물기를 빼주세요.', 'image_url': 'https://recipe1.ezmember.co.kr/cache/recipe/2017/07/18/fef94e7522aa63f87576caeff5f2be7e1.jpg'}, {'step_number': 5, 'description': '분량의 재료대로 무침 간장 양념을 만들어주세요.\n전 아삭 숙주 무침을 만들 땐 늘 간장 양념을 넉넉하게 만들어요\n숙주무침의 남은 양념에 달걀프라이 하나를 더해 밥 비벼 먹는 걸 좋아하는\n작은 녀석을 위해서라지요~ ^ ^', 'image_url': 'https://recipe1.ezmember.co.kr/cache/recipe/2017/07/18/846d48109a8961e29a4538a8674a034f1.jpg'}, {'step_number': 6, 'description': '물기 뺀 숙주와 양파, 노랑 파프리카를 볼에 담고,', 'image_url': None}, {'step_number': 7, 'description': '간장 양념 1/3을 넣고 살살 섞어주세요.', 'image_url': 'https://recipe1.ezmember.co.kr/cache/recipe/2017/07/18/8c3e23fa557fc975a767140525034fba1.jpg'}, {'step_number': 8, 'description': '접시에 간장 양념에 버무린 숙주 무침을 담고\n그 위에 송송 썰어두었던 청양고추, 홍고추, 대파 흰 부분을 올리고 \n통깨도 솔~솔~', 'image_url': 'https://recipe1.ezmember.co.kr/cache/recipe/2017/07/18/ea08cfee843a2b58ef30b0936a64a6921.jpg'}]"
26448,메인반찬,일상,채소류,무침,다이어트에 좋은 도토리쑥갓무침,도토리쑥갓무침,"1,770",15분 이내,아무나,2인분,"[('도토리묵', '1모'), ('당근', '1/4모'), ('쑥갓', '1줌'), ('김', '1장'), ('대파', '1/2대'), ('양파', '1/2개'), ('청고추', '1개'), ('홍고추', '1개'), ('고춧가루', '2큰술'), ('참기름', '2큰술'), ('깨소금', '1큰술'), ('간장', '4큰술'), ('미림', '1큰술'), ('물', '4큰술'), ('설탕', '1/2큰술')]",칼로리 DOWN 영양 UP 새콤달콤 도토리쑥갓무침,"[{'step_number': 1, 'description': '묵은 1.5cm 두께로 예쁘게 자른다.\n당근과 양파, 파는 채썰고 쑥갓은 4cm길이로 자른다.', 'image_url': 'https://recipe1.ezmember.co.kr/cache/recipe/2018/06/18/f32a22cf4b8cc2144b0c37cbd7b5f08b1.jpg'}, {'step_number': 2, 'description': '양념재료를 다 섞어 양념장을 만든다.', 'image_url': 'https://recipe1.ezmember.co.kr/cache/recipe/2018/06/18/4b1906598fa787aefa6f15e1f1681f7e1.jpg'}, {'step_number': 3, 'description': '볼에 도토리묵, 당근, 쑥갓, 부순 김, 파를 모두 담는다.', 'image_url': 'https://recipe1.ezmember.co.kr/cache/recipe/2018/06/18/7883185503c170e8f2b905e2748916421.jpg'}, {'step_number': 4, 'description': '❸에 양념장을 넣고 버무린다.', 'image_url': 'https://recipe1.ezmember.co.kr/cache/recipe/2018/06/18/9a0070862af2d9618f0aced254c2ef401.jpg'}, {'step_number': 5, 'description': '그릇에 예쁘게 담는다.', 'image_url': 'https://recipe1.ezmember.co.kr/cache/recipe/2018/06/18/6c814ca0bd30496d2670c53af280ce361.jpg'}]"
26449,메인반찬,일상,채소류,무침,머위된장무침,머위된장무침,"3,784",30분 이내,초급,4인분,"[('머위', '1근'), ('대파', '적당히'), ('된장', '2T'), ('고추장', '1T'), ('다진마늘', '적당히'), ('매실청', '1T'), ('스테비아', '1작은술'), ('참기름', '2T'), ('깨소금', '1T'), ('식초', '1T')]","어릴때 먹어던 음식이라
봄되면 자주 무쳐 먹습니다ㅎㅎ","[{'step_number': 1, 'description': '머위대는 껍질을 벗겨주시고 물에 깨끗히 씻어주시고 식초물에 잠시 담궈주세요', 'image_url': 'https://recipe1.ezmember.co.kr/cache/recipe/2018/03/22/0daf7cba2c1cddc77095d1c2d1964dbd1.jpg'}, {'step_number': 2, 'description': '모든 야채 · 해물 · 생선 ·\n담궈놓으시면 흙이며 미세한 먼지가 제거되요', 'image_url': 'https://recipe1.ezmember.co.kr/cache/recipe/2018/03/22/ae7d8490370e47dcc84f4e81d237d01a1.jpg'}, {'step_number': 3, 'description': '소쿠리에 담아주시구여', 'image_url': 'https://recipe1.ezmember.co.kr/cache/recipe/2018/03/22/ac7235af2f12e9f80c876276e1a9d1b41.jpg'}, {'step_number': 4, 'description': '냄비에 물을 넣고 팔팔끓으면 굵은소금넣고\n머위를 데쳐 주세요', 'image_url': 'https://recipe1.ezmember.co.kr/cache/recipe/2018/03/22/59275a59c3f05940eafeea435010452e1.jpg'}, {'step_number': 5, 'description': '그리고\n전 또 한번 식초물에 담궈줘요^^', 'image_url': 'https://recipe1.ezmember.co.kr/cache/recipe/2018/03/22/3ea800d096deb5dc9af983ed60dfa0641.jpg'}, {'step_number': 6, 'description': '대파는 흰부분 파란부분 반갈라 다져주시구여~^^', 'image_url': 'https://recipe1.ezmember.co.kr/cache/recipe/2018/03/22/4dfe0d3584662ec272044a75749e226b1.jpg'}, {'step_number': 7, 'description': '저희집 된장이며 고추장이 안짠거라\n전 된장2큰술넣고 고추장 1큰술 다진마늘 반 큰술 \n매실청 1큰술 스테비아 조금 넣구여 조물조물 무치니 쓴맛이 강해\n참기름 2큰술 넣어더니 강한쓴맛이 사라지네요^^\n(저희 신랑입맛이 초딩이라 쓴걸 싫어하거든요ㅋ)', 'image_url': 'https://recipe1.ezmember.co.kr/cache/recipe/2018/03/22/efba15acc9a894285bc2d4b68bef3ca01.jpg'}, {'step_number': 8, 'description': '(7)번에 깨소금빻아서 무치면 머위된장무침 완성이예요^^*', 'image_url': 'https://recipe1.ezmember.co.kr/cache/recipe/2018/03/22/d34442bad9a916056c934569f98362a51.jpg'}]"
26450,메인반찬,일상,채소류,무침,담백하게 즐기는 색감이 예쁜 봄동잡채,봄동잡채,"13,015",30분 이내,초급,3인분,"[('봄동', ''), ('당면', ''), ('파프리카', ''), ('느타리버섯', ''), ('당근', ''), ('양파', ''), ('대파', ''), ('마늘', ''), ('들기름', ''), ('참기름', ''), ('양조간장', ''), ('후춧가루', ''), ('통깨', ''), ('소금', '')]",담백하게 즐기는 색감이 예쁜 봄동잡채를 소개합니다.,"[{'step_number': 1, 'description': '봄동은 다듬어서 흐르는 물에 씻은 후 끓는 물에 소금을 조금 넣고 데친 다음 찬물에 헹구어 물기를 빼서 먹기 좋은 크기로 썰어주세요.', 'image_url': 'https://recipe1.ezmember.co.kr/cache/recipe/2015/05/26/93552384b1964e60c49b769c582aabd01.jpg'}, {'step_number': 2, 'description': '파프리카는 흐르는 물에 씻은 후 씨를 제거하고 채 썰어주세요. 양파, 대파, 마늘은 껍질을 벗겨 씻은 후 양파는 채 썰고 대파는 어슷 썰고 마늘은 다져주세요. 당근은 흐르는 물에 씻은 후 껍질을 제거하고 채 썰어주세요. 느타리버섯은 끓는 물에 데친 후 찬물에 헹구어 먹기 좋은 크기로 찢어주세요.', 'image_url': 'https://recipe1.ezmember.co.kr/cache/recipe/2015/05/26/ff43d73c680d0cf72273226aa4e3226d1.jpg'}, {'step_number': 3, 'description': '달군 프라이팬에 들기름을 두르고 느타리버섯, 양파, 대파, 당근, 파프리카, 봄동 순으로 따로따로 볶으면서 소금으로 간을 맞춰주세요. 채소는 흰색부터 볶아내면 깔끔하게 볶을 수 있습니다.', 'image_url': 'https://recipe1.ezmember.co.kr/cache/recipe/2015/05/26/c2b5b31197abcf59ddd7470422a3536f1.jpg'}, {'step_number': 4, 'description': '끓는 물에 당면을 넣고 삶아서 찬물에 헹구어 물기를 빼주세요.', 'image_url': 'https://recipe1.ezmember.co.kr/cache/recipe/2015/05/26/ecb437fadd538f8768550d5ba35f2aae1.jpg'}, {'step_number': 5, 'description': '볶아낸 느타리버섯, 양파, 대파, 당근, 파프리카, 봄동을 볼에 담아 식혀주세요. 물기를 뺀 삶은 당면도 넣어주세요.', 'image_url': 'https://recipe1.ezmember.co.kr/cache/recipe/2015/05/26/c46fb4922d7b3dcb1f2672371ca11f271.jpg'}, {'step_number': 6, 'description': '양조간장, 다진 마늘, 통깨, 참기름, 후춧가루를 뿌려 간이 골고루 배도록 조물조물 버무려주세요.', 'image_url': 'https://recipe1.ezmember.co.kr/cache/recipe/2015/05/26/9e67a9810e1e19e953cfafd465a145e01.jpg'}, {'step_number': 7, 'description': '상에 올리기 직전에 달군 프라이팬에 들기름을 두르고 봄동잡채를 볶아주세요. 잡채를 볶아내면 부드러운 식감이 좋답니다.', 'image_url': 'https://recipe1.ezmember.co.kr/cache/recipe/2015/05/26/72133d474acdfc5ba87823880a1c4a541.jpg'}, {'step_number': 8, 'description': '봄동잡채를 접시에 담고 통깨를 뿌려냅니다.', 'image_url': 'https://recipe1.ezmember.co.kr/cache/recipe/2015/05/26/4ed335d8ea6ab265067df7f364f17d951.jpg'}]"
26451,메인반찬,일상,채소류,무침,참나물잡채,참나물잡채,"10,360",60분 이내,중급,4인분,"[('당면', '350g'), ('참나물', '180g'), ('느타리버섯', '100g'), ('당근', '약간'), ('대파', '1/2뿌리'), ('듬기름', ''), ('소금', ''), ('진간장', ''), ('검은 통깨', '1큰술'), ('다진 마늘', '1큰술'), ('설탕', '약간'), ('참기름', '1큰술'), ('후춧가루', '약간')]","잡채를 만들 때에는 다양한 종류의 채소와 고기, 양념이 들어가는데요. 재료도 간단하고 깔끔하면서도 담백한 잡채를 만들어 보려고 해요. 봄 입맛 돋아주는 향긋한 참나물잡채 소개합니다.","[{'step_number': 1, 'description': '참나물은 다듬어서 끓는 물에 넣어 살짝 데친 후 찬물에 헹구어 물기를 제거해 줍니다. \n참나물의 길이가 길다고 생각되면 한 번쯤 썰어 주어도 좋고요.', 'image_url': 'https://recipe1.ezmember.co.kr/cache/recipe/2015/05/28/84b994f43365ee594de867798f7a43d21.jpg'}, {'step_number': 2, 'description': '느타리버섯도 끓는 물에 넣어 살짝 데친 후 찬물에 헹구어 물기를 제거하고 먹기 좋은 크기로 찢어 줍니다.\n대파와 마늘은 껍질을 벗겨 씻은 후 대파는 어슷 썰고 마늘은 다져 줍니다.', 'image_url': 'https://recipe1.ezmember.co.kr/cache/recipe/2015/05/28/b68e3a89a04a01536bb1817f53378f171.jpg'}, {'step_number': 3, 'description': '당근은 흐르는 물에 씻은 후 껍질을 벗겨 채 썰어 줍니다.', 'image_url': 'https://recipe1.ezmember.co.kr/cache/recipe/2015/05/28/e2f5df55e9691929500a05958e4568491.jpg'}, {'step_number': 4, 'description': '달군 프라이팬에 들기름을 두르고 느타리버섯, 대파, 참나물, 당근 순으로 따로따로 볶으면서 소금으로 간을 맞춰 줍니다.', 'image_url': 'https://recipe1.ezmember.co.kr/cache/recipe/2015/05/28/13a5c52210c19551f070055b7bbdd4981.jpg'}, {'step_number': 5, 'description': '당면은 끓는 물에 넣어 삶은 다음 체에 밭쳐 흐르는 물에 헹구어 물기를 제거해 줍니다.', 'image_url': 'https://recipe1.ezmember.co.kr/cache/recipe/2015/05/28/2dd1bbc9caae9dbe115bb06803cd87ed1.jpg'}, {'step_number': 6, 'description': '볼에 볶아 낸 참나물, 느타리버섯, 당근, 대파를 넣고 물기를 제거한 당면을 넣어 진간장, 다진 마늘, 검은 통깨, 참기름, 설탕, 후춧가루를 넣어 간이 고루 배도록 조물조물 버무려 줍니다.', 'image_url': 'https://recipe1.ezmember.co.kr/cache/recipe/2015/05/28/938317c59176a4939079fecc2b2da1301.jpg'}, {'step_number': 7, 'description': '달군 프라이팬에 들기름을 살짝 두르고 버무린 잡채를 넣어 볶아 줍니다.', 'image_url': 'https://recipe1.ezmember.co.kr/cache/recipe/2015/05/28/84a32774d87891d6b35c585ea02dbf8e1.jpg'}]"
26452,메인반찬,일상,채소류,무침,"천기누설, 내장지방 쏙 빼준 미역초무침",미역초무침,"5,022",30분 이내,초급,4인분,"[('자른 미역', '1/2컵'), ('간장', '2숟가락'), ('고춧가루', '2숟가락'), ('마늘', '1숟가락'), ('식초', '3숟가락'), ('배', '1/4개'), ('오이', '1/2개'), ('소금', '약간')]","천기누설, 내장지방 쏙 빼준 미역초무침 아이 둘을 낳고 보니 내장지방 빼기가 쉽지 않은 것 같습니다. 얼마 전, 천기누설 방송에서 미역초무침을 먹고 체중을 많이 뺀 요리라 따라 해 보았습니다.","[{'step_number': 1, 'description': '자른 미역은 5분간 물에 불렸다가 씻어 물기를 빼주고, 오이는 채 썰어 준비한다.', 'image_url': 'https://recipe1.ezmember.co.kr/cache/recipe/2019/11/06/9367773e7d16d0fd9147a1a3c44e250d1.jpg'}, {'step_number': 2, 'description': '간장, 고춧가루, 식초, 깨소금, 마늘, 배즙을 준비한다.', 'image_url': 'https://recipe1.ezmember.co.kr/cache/recipe/2019/11/06/61ab32fa37741fccc3af5ca1e117048a1.jpg'}, {'step_number': 3, 'description': '간장, 식초, 고춧가루, 깨소금, 마늘, 배즙을 넣고 조물조물 무쳐준다.', 'image_url': 'https://recipe1.ezmember.co.kr/cache/recipe/2019/11/06/b99812a7f55b96d8ae0882833b5d3a711.jpg'}, {'step_number': 4, 'description': '모자란 간은 소금으로 해 주고 완성한다.', 'image_url': 'https://recipe1.ezmember.co.kr/cache/recipe/2019/11/06/03e9c774c7ba83faab8d6c0d6d1b24db1.jpg'}]"
