index,종류별,상황별,재료별,방법별,글 제목,레시피이름,조회수,조리시간,난이도,인분,재료,소개글,조리순서
38784,메인반찬,술안주,닭고기,튀김,"안성탕면 프라이드 치킨, 튀김요리에 라면스프로 마법을 걸어보세요",프라이드치킨,"4,540",30분 이내,초급,1인분,"[('닭 안심살                                                                                1팩', '350g'), ('안성탕면 분말스프', '적당량'), ('안성탕면 면', '1개'), ('튀김용 식용유', '적당량'), ('물', '115g'), ('튀김가루', '100g'), ('안성탕면 분말스프', '3g')]","'안성탕면'의 면과 분말스프를 활용해서 이색적이고 재미있는 치킨을 만드실 수 있습니다. 
더 매콤한 맛을 원하시면 '신라면', 더 강렬한 매운 맛을 원하시면 '진짜진짜'를 활용해보세요.","[{'step_number': 1, 'description': '닭 안심살은 물에 헹궈 물기를 제거하고, 우유에 담가주세요.', 'image_url': 'https://recipe1.ezmember.co.kr/cache/recipe/2016/09/07/f2bd54bb7e5292147e80e42588f4ccba1.jpg'}, {'step_number': 2, 'description': '안성탕면 면은 믹서기에 살짝 갈아주세요.', 'image_url': 'https://recipe1.ezmember.co.kr/cache/recipe/2016/09/07/8eb899c22ba654b22d4d7cc95cd860051.jpg'}, {'step_number': 3, 'description': '튀김가루, 안성탕면 분말스프, 물을 넣고 골고루 잘 섞어주세요.', 'image_url': 'https://recipe1.ezmember.co.kr/cache/recipe/2016/09/07/f7330224c27bd1ee50aaf7fa02fb96401.jpg'}, {'step_number': 4, 'description': '닭 안심살을 2의 튀김가루 반죽을 1차로 묻혀주세요.', 'image_url': 'https://recipe1.ezmember.co.kr/cache/recipe/2016/09/07/7faeab19eef6da4545ffb1850e0c481d1.jpg'}, {'step_number': 5, 'description': '2차로 2의 갈아둔 안성탕면 면을 묻혀주세요.', 'image_url': 'https://recipe1.ezmember.co.kr/cache/recipe/2016/09/07/b09021b330142265836db1ee9b810d921.jpg'}, {'step_number': 6, 'description': '예열된 기름에 튀겨주세요.', 'image_url': 'https://recipe1.ezmember.co.kr/cache/recipe/2016/09/07/9b1c89b4660a116ad50d1a159051b7831.jpg'}, {'step_number': 7, 'description': '바삭하게 익으면 건져서 그릇에 담아주세요', 'image_url': 'https://recipe1.ezmember.co.kr/cache/recipe/2016/09/07/aec2c67bafd65e5371da3ed987f074601.jpg'}, {'step_number': 8, 'description': '안성탕면 분말스프를 골고루 뿌려주면 완성입니다.', 'image_url': 'https://recipe1.ezmember.co.kr/cache/recipe/2016/09/07/13f6af61ccb430f3bfac977a3c8f80ee1.jpg'}]"
38785,메인반찬,술안주,닭고기,튀김,(에어프라이어 요리) 닭껍질 튀김 만들기 - 간장 양념,닭껍질튀김,"9,823",90분 이내,초급,2인분,"[('닭껍질', ''), ('밀가루', ''), ('우유+물', ''), ('소주', '1/2컵'), ('닭껍질', '1kg'), ('진간장', '3큰술'), ('설탕', '0.5큰술'), ('올리고당', '1큰술'), ('후춧가루', '약간')]","맥주 안주로 좋은 바삭바삭한 

 에어프라이어 닭껍질 튀김 레시피 가져왔습니다 :D","[{'step_number': 1, 'description': '전에 올린 카레양념에 이어 간장양념 닭껍질 레시피 가져왔습니다 :D\n카레양념 레시피는 제일 하단에 레시피ID남겨놓을께요 :)', 'image_url': 'https://recipe1.ezmember.co.kr/cache/recipe/2019/01/25/e9384cefc5ed257ca468f294c32d22581.jpg'}, {'step_number': 2, 'description': '· 물로 한 번 깨끗이 씻어주고', 'image_url': 'https://recipe1.ezmember.co.kr/cache/recipe/2019/01/25/f1aa2087a618c13914e88848c59c4b011.jpg'}, {'step_number': 3, 'description': '· 밀가루 넣고 빠닥빠닥 주물러준 뒤', 'image_url': 'https://recipe1.ezmember.co.kr/cache/recipe/2019/01/25/463d5b830a1374a49eac5a2eaea6fb5e1.jpg'}, {'step_number': 4, 'description': '깨끗한 물에 씻어줍니다', 'image_url': 'https://recipe1.ezmember.co.kr/cache/recipe/2019/01/25/aaf2d25310f90eb9201d0824920ca8221.jpg'}, {'step_number': 5, 'description': '· 껍질이 잠길 만큼 우유 + 물을 넣어주고 약 30분~1시간 재워놨다가(저는 우유가 아까워서 물을 섞어줬는데 우유로만 재워주시면 더 좋습니다 ^^)', 'image_url': 'https://recipe1.ezmember.co.kr/cache/recipe/2019/01/25/a975d4c06be77c7324fb1564f78cf65c1.jpg'}, {'step_number': 6, 'description': '또 한 번 깨끗한 물에 씻어줍니다※ 물로 씻을 때 지방이 많이 붙어 있는 부위를 떼주면서 손질해주세요 :)', 'image_url': 'https://recipe1.ezmember.co.kr/cache/recipe/2019/01/25/dc7e7b450976153f366c89896cef967e1.jpg'}, {'step_number': 7, 'description': '· 소주 1/2컵 넣은 끓는 물에 넣고 \n한 번 팔팔 끓여 데쳐낸 뒤', 'image_url': 'https://recipe1.ezmember.co.kr/cache/recipe/2019/01/25/19a593f60e025603dd2a76fcfb67937f1.jpg'}, {'step_number': 8, 'description': '찬물에 씻어서 \n체에 밭쳐 물기를 빼 줍니다', 'image_url': 'https://recipe1.ezmember.co.kr/cache/recipe/2019/01/25/b929733a56dcca677b09bfd157ca16a81.jpg'}, {'step_number': 9, 'description': '※간장 양념\n【 닭 껍질 2줌, 진간장 3 큰 술, 설탕 0.5 큰 술, 올리고당 1 큰 술, 후춧가루 약간 】', 'image_url': 'https://recipe1.ezmember.co.kr/cache/recipe/2019/01/25/38045e27f1fa6634a0d5ec2f7ad8fa5a1.jpg'}, {'step_number': 10, 'description': '· 양념에 조물조물 버무려준 뒤 1시간가량 재워줍니다먹을만큼만 소분해서 냉동실 보관하고 먹고 싶을때마다 꺼내서 먹고 있어요!!', 'image_url': 'https://recipe1.ezmember.co.kr/cache/recipe/2019/01/25/c226ac3f7193369247c8800655a671c11.jpg'}, {'step_number': 11, 'description': '· 에어프라이어기에 넣고 \n(180도 5분 + 뒤집어서 180도 5분) + 취향 따라 180도 3분~5분\n돌려줍니다에어프라이어- 에어프라이어 200도 3분 돌려서 예열해준 뒤 넣어주세요 :) \n\n\n- 에어프라이어 없이 팬에 구우실 분들은\n중약불에서 기름 없이 충분히 볶아주세요 (약 20분)\n(팬에서 굽게 되면 닭 껍질에서 기름이 나오는데 그 기름으로 튀기다시피 볶아주시면 됩니다)', 'image_url': 'https://recipe1.ezmember.co.kr/cache/recipe/2019/01/25/6effe767966ca6e17558f2690ccc33a81.jpg'}, {'step_number': 12, 'description': '바로 먹지 마시고 \n한 김 식힌 뒤 먹어야 더욱 바삭바삭하니 맛있습니다 :)★치킨 양념이나 칠리소스에 찍어 먹으면 더욱 맛있습니다', 'image_url': 'https://recipe1.ezmember.co.kr/cache/recipe/2019/01/25/c7156d37c6cfa346d0f58acfa1dbad091.jpg'}, {'step_number': 13, 'description': '바삭바삭 술안주로 좋은\n에어프라이어 닭껍질 튀김\n간장양념버전!!', 'image_url': 'https://recipe1.ezmember.co.kr/cache/recipe/2019/01/25/c74c956859514d0902673980ae61ea4e1.jpg'}, {'step_number': 14, 'description': '카레양념버전이 궁금하시다면 \n아래 링크를눌러주세요 :) \n@6904851', 'image_url': 'https://recipe1.ezmember.co.kr/cache/recipe/2019/01/25/4924af840840464087f743d3f6f99aed1.jpg'}]"
38786,메인반찬,술안주,닭고기,튀김,"닭똥집튀김, 레몬그라스와 통후추를 곁들인 이색적인 닭똥집 요리!",닭똥집튀김,"1,393",60분 이내,아무나,2인분,"[('닭똥집', '350g'), ('굵은소금', ''), ('옥수수전분', '8T'), ('생강', '10g'), ('통마늘', '4~5개'), ('레몬그라스', '1대'), ('청고추', '10개'), ('홍고추', '10개'), ('통후추', '20알'), ('밀가루', '4T'), ('계란', '1개'), ('기름', ''), ('설탕', '2T'), ('간장', '2T'), ('물', '4T'), ('매실원액', '2T'), ('굴소스', '1T')]","레몬그라스와 통후추를 곁들인 이색적인 닭똥집 요리~! 바삭쫄깃함에 한잔 더~를 외칠수있는 안주 메뉴이니, 맛있게 만들어 보시고~오늘은 튀겨 드셔도 되고, 조금 색다르게 튀김을 한번 더 감칠맛과 풍미있게 살짝 볶아 맛있게 드실수 있는 레시피 가져왔으니~ 좋아하시는분들이람 놓치지 말아주세요~!","[{'step_number': 1, 'description': '옥수수 전분과 물을 볼에 넣어 잘 저어 2시간정도 놔두세요, 하지만 너무 오래걸리니 전분과 물이 분리가 되면 사용하셔도 됩니다!저는 집에 옥수수 전분이 있어 사용했구요,감자 전분을 사용하시면 더욱 바삭하게 튀길수 있어요.\n\n전분은 시간이 지나면 가라앉게 되어있고, 두시간\u200b에서 하루정도까지 놔두시고 사용하시는게 좋지만, 너무 장시간 놔두면 요리하시는데 힘드니, 전분과 물이 분리가 되면 반죽을 시작하셔도 됩니다.', 'image_url': 'https://recipe1.ezmember.co.kr/cache/recipe/2021/01/13/28d0aef2a03c75869fc03c1fee4345bb1.jpg'}, {'step_number': 2, 'description': '생강은 껍질을 벗긴후, 적당한 크기로 자른후 칼로 한번 눌러주세요. \n칼로 누르기 힘든경우 3~4등분으로 잘라주세요. \n\n전분을 담가둘 동안 다른 재료준비를 해주세요!', 'image_url': 'https://recipe1.ezmember.co.kr/cache/recipe/2021/01/13/58688d1db6089bdb23cc3f3a3f2160421.jpg'}, {'step_number': 3, 'description': '통마늘은 얇게 슬라이스해주세요.마늘과 양은 본인 취향에 맞게 준비하여주세요.', 'image_url': 'https://recipe1.ezmember.co.kr/cache/recipe/2021/01/13/43d3c118625e663ddfd8cead968f33b61.jpg'}, {'step_number': 4, 'description': '레몬그라스는 처음과 끝부분을 조금 자른뒤, 전체적으로 껍질을 한번 벗겨냅니다.', 'image_url': 'https://recipe1.ezmember.co.kr/cache/recipe/2021/01/13/94c63dbd593dbbd050723e6e6ff6d4641.jpg'}, {'step_number': 5, 'description': '크기는 약 5cm 정도씩 잘라주고, 다시 반으로 잘라주세요', 'image_url': 'https://recipe1.ezmember.co.kr/cache/recipe/2021/01/13/880d7d87f90116a4b32c43daf19ac6181.jpg'}, {'step_number': 6, 'description': '청양고추와 작은 홍고추는 깨끗이 씻어 꼭지를 잘라준뒤, 적당한 크기로 잘라주세요저는 작은 크기라 10개정도씩 사용했으며, 작은고추 대신 건고추를 사용하셔도 좋습니다.\n\n또한 고추는 매콤한 \u200b맛을 내기 위하여 넣기도 하지만, 색감을 내기 위해서도 사용합니다!', 'image_url': 'https://recipe1.ezmember.co.kr/cache/recipe/2021/01/13/6d59b0c0621d7e75e6113f1a48c2f2561.jpg'}, {'step_number': 7, 'description': '설탕 2T, 간장 2T, 물 4T, 매실원액 2T, 굴소스 1T 를 넣어 잘 섞어주세요매실원액와 굴소스를 넣음으로써, 맛의 풍미와 감칠맛을 한층 업그레드 시켜줍니다!', 'image_url': 'https://recipe1.ezmember.co.kr/cache/recipe/2021/01/13/c2d1988ea07ba2cc3049b4760bdeab021.jpg'}, {'step_number': 8, 'description': '닭똥집의 불순물 제거를 위해 먼저 한번 헹궈준후, 굵은 소금으로 좀 강도있게 문질러주세요.', 'image_url': 'https://recipe1.ezmember.co.kr/cache/recipe/2021/01/13/5b39f721823564887d92769f621c13941.jpg'}, {'step_number': 9, 'description': '물이 맑아질때까지 여러번 헹궈준후,', 'image_url': 'https://recipe1.ezmember.co.kr/cache/recipe/2021/01/13/8d04e5a3f5797c3f6ad65871f33e34891.jpg'}, {'step_number': 10, 'description': '닭똥집의 하얀 지방,실끈등 이물질 등을 깨끗이 제거해주세요', 'image_url': 'https://recipe1.ezmember.co.kr/cache/recipe/2021/01/13/7d3a68f0db5330b29d81a39c3648d12a1.jpg'}, {'step_number': 11, 'description': '잘 손질된 닭똥집은 물기를 제거한뒤, 간편하게 가위를 사용하여 적당한 크기로 잘라주세요.', 'image_url': 'https://recipe1.ezmember.co.kr/cache/recipe/2021/01/13/641f982035de7a45ce2120b53d9aed171.jpg'}, {'step_number': 12, 'description': '물을 버리면 전분이 가라앉아 단단해져 있을거예요', 'image_url': 'https://recipe1.ezmember.co.kr/cache/recipe/2021/01/13/1f830cf4bccf7dae13cc5ab221dc02851.jpg'}, {'step_number': 13, 'description': '전분이 단단해져 있으니 계란을 넣고 잘 주물러준후, 밀가루 4T를 넣어 반죽을 만들어주세요반죽의 농도는 너무 되직하지 않고 묽지도 않게 해주셔야하며,약간 스무디처럼 주루룩~흐를정도입니다.', 'image_url': 'https://recipe1.ezmember.co.kr/cache/recipe/2021/01/13/6d450d5a0d3e4d459df80f27b1a80f951.jpg'}, {'step_number': 14, 'description': '반죽이 잘 되었음 닭똥집을 넣어 반죽물을 잘 입혀주며,', 'image_url': 'https://recipe1.ezmember.co.kr/cache/recipe/2021/01/13/4824a90aa2b3e045a8b82f161aa120321.jpg'}, {'step_number': 15, 'description': '튀김할 팬에 기름을 넣어 160~170도까지 예열하여주고, 바삭함을 위해 총 두번에 걸려 튀겨주세요.\n초벌로 약 6분정도 튀겨주며, 튀긴후 5분정도 식혀주세요.\n\n수분기가 있어 기름이 잘 튀길수 있으니 조심하시고 주의하시기 바랍니다!', 'image_url': 'https://recipe1.ezmember.co.kr/cache/recipe/2021/01/13/2e71136daf824880c764fa5dde410a841.jpg'}, {'step_number': 16, 'description': '2차 튀김은 이렇게 노릇노릇할때까지 튀겨주면 완성! 닭똥집을 한층더 맛있게 드실수 있게 매콤하게 볶아볼 차례입니다~가정에서 튀김이 힘들경우, 기성품으로 닭똥집 튀김용,소금구이,양념구이등등이 나와있으니 구매하여 간단히 해보셔도 좋습니다!', 'image_url': 'https://recipe1.ezmember.co.kr/cache/recipe/2021/01/13/aa54e59a271c92ba8ae65949ce8ce6311.jpg'}, {'step_number': 17, 'description': '팬에 기름을 두룬후, 생강, 마늘,청홍고추와 레몬그라스, 통후추를 넣어 살짝 볶아주세요중약불', 'image_url': 'https://recipe1.ezmember.co.kr/cache/recipe/2021/01/13/7bedf7b48303d5f80db8e9c749f2fb261.jpg'}, {'step_number': 18, 'description': '소스를 부어 2~3분 중약불에서 조려주세요.중약불', 'image_url': 'https://recipe1.ezmember.co.kr/cache/recipe/2021/01/13/7c5aa2d8a758541974b4484c41e2ee3f1.jpg'}, {'step_number': 19, 'description': '요렇게 어느정도 국물이 자작해지면 바삭하게 튀겨놓은 닭똥집을 넣어 양념이 골고루 베이게 섞어주세요.중약불모든분들의 입맛이 각각 다르기 때문에, 닭똥집을 넣기전 양념의 간을 보고 소스 조절을 해주세요! 양념이 강하면 덜어서 볶은뒤, 나중에 추가하여 드셔도 됩니다!', 'image_url': 'https://recipe1.ezmember.co.kr/cache/recipe/2021/01/13/ee458c7fab46b3e11a04cf472e5a83161.jpg'}, {'step_number': 20, 'description': '요렇게 매콤한 양념에 살짝 버무려주면 완성입니다!', 'image_url': 'https://recipe1.ezmember.co.kr/cache/recipe/2021/01/13/cfdd7f76a5d9cab78610c14376edb6881.jpg'}]"
38787,메인반찬,술안주,닭고기,튀김,땅콩소보로치킨,땅콩소보로치킨,"1,019",60분 이내,초급,2인분,"[('닭다리살', '3조각'), ('닭가슴살', '1조각'), ('다진마늘', '1큰술'), ('다진생강', '1작은술'), ('미림', '약간'), ('간장', '2큰술'), ('후춧가루', '약간'), ('황설탕', '1큰술'), ('고춧가루', '1작은술'), ('감자 큰것', '1개'), ('튀김가루', '1/2컵'), ('전분', '1/2컵'), ('볶은땅콩', '넉넉히'), ('빵가루 볶음땅콩과', '동량'), ('차가운물', '적당량'), ('식용유', ''), ('칠리소스', ''), ('머스터드소스', '')]",땅콩을 가득 묻혀 튀겨낸 고소한 치킨요리!,"[{'step_number': 1, 'description': '닭다리살은 큼직하게 썰어 줍니다\n닭가슴살도 두툼하게 썰어 줍니다\n감자는 껍질을 벗기고 씻어서 길게 썰어 줍니다', 'image_url': 'https://recipe1.ezmember.co.kr/cache/recipe/2020/02/05/fbbe1615fd0929d9be959a99fe451bbf1.jpg'}, {'step_number': 2, 'description': '볼에 닭고기와 감자를 담고 양념재료를 넣어 고루 버무려 잠시 재워둡니다', 'image_url': 'https://recipe1.ezmember.co.kr/cache/recipe/2020/02/05/f07d1e5d6b57e19b9abfb4a7c8d246681.jpg'}, {'step_number': 3, 'description': '재워둔 닭고기와 감자는 마른 튀김가루를 고루 묻혀 줍니다', 'image_url': 'https://recipe1.ezmember.co.kr/cache/recipe/2020/02/05/7050eaaac57b70a1fabb837c5a9b16461.jpg'}, {'step_number': 4, 'description': '볼에 튀김가루와 전분을 동량으로 넣고 차가운 물을 부어가며 되직하게 반죽해 줍니다\n튀김가루 묻힌 닭고기를 넣고 살살 반죽을 섞어 줍니다', 'image_url': 'https://recipe1.ezmember.co.kr/cache/recipe/2020/02/05/73ed2f39bcc7b1baa78339123147a5c61.jpg'}, {'step_number': 5, 'description': '볶은 땅콩은 칼로 굵게 다져 주고 빵가루를 준비합니다 (저는 식빵으로 직접 빵가루를 만들었어요)\n(견과류는 종류가 많은데 다른 견과류를 사용해도 좋지만, \n땅콩 특성상 가장 바삭하면서 향이 진하고 가격도 견과류중에서는 저렴한편이니\n땅콩을 넉넉히 준비하여 사용하면 좋을것 같아요. 다시 튀기면 더욱 고소하고 식감이 참 좋아요)\n빵가루와 땅콩을 섞고 반죽을 묻힌 닭고기에 고루 묻혀 줍니다 \n(너무 많이 묻히지 말고 자연스레 묻혀지도록 꾹꾹 누르지 마세요)', 'image_url': 'https://recipe1.ezmember.co.kr/cache/recipe/2020/02/05/fce423895858848c0ab775545a36e6fd1.jpg'}, {'step_number': 6, 'description': '튀김팬에 기름을 넉넉히 붓고 온도가 오르면 튀겨 줍니다\n닭고기를 다 튀기면 감자도 반죽을 살짝 묻혀 그대로 튀겨 줍니다\n아주 바삭하면서 노릇하게 잘 튀겨졌어요\n(이렇게 빵가루를 묻힌 튀김은 두번 튀기면 빵가루가 탈수 있으니 한번만 튀기시고\n두번 튀기지 않아도 식감은 충분히 바삭하답니다)', 'image_url': 'https://recipe1.ezmember.co.kr/cache/recipe/2020/02/05/36c57503f447825bcc9a0be1396242241.jpg'}, {'step_number': 7, 'description': '닭다리살과 닭가슴살이 완전 촉촉하고 부드러워요', 'image_url': 'https://recipe1.ezmember.co.kr/cache/recipe/2020/02/05/6eda754f061168b31b90dea1671cf51c1.jpg'}, {'step_number': 8, 'description': '겉은 땅콩과 빵가루로 아주 바삭하고 고소하구요', 'image_url': 'https://recipe1.ezmember.co.kr/cache/recipe/2020/02/05/0129993e6e48d6aeee31921af9fe28de1.jpg'}, {'step_number': 9, 'description': '그냥 먹어도 맛있고, 소스에 콕 찍어 먹으면 정말 맛있답니다', 'image_url': 'https://recipe1.ezmember.co.kr/cache/recipe/2020/02/05/40bb8130a0632a20c266bb3e899b7c741.jpg'}, {'step_number': 10, 'description': '닭고기의 뼈가 없어서 정말 잘 익고, 두번 튀기지 않아서\n닭고기 자체의 육즙이 그대로 있어서 정말 맛있어요^^', 'image_url': 'https://recipe1.ezmember.co.kr/cache/recipe/2020/02/05/ee3636ed340181bc6dbeaccadd7401b11.jpg'}]"
38788,메인반찬,술안주,닭고기,튀김,#에어프라이어요리 #닭껍질튀김만들기 #에어프라이어로 튀겨낸 바삭바삭한 닭껍질,닭껍질튀김,"8,185",20분 이내,아무나,2인분,"[('닭껍질', '500g'), ('소금', '1큰술'), ('후추', '1작은술'), ('바질가루', '1작은술'), ('파기름', '2큰술'), ('올리브오일', '1큰술')]","닭껍질꼬치를 주문해서 꼬치를 다 빼주고는

한번 씻어서 에어프라이어로 튀겨낸 초간단한 술안주이지요.

​

물론 우유에 재워 놓기는 했지요. 잡내를 제거하기 위해서요 ㅎㅎ

닭껍질튀김을 할까하다가는 아...튀김기를 사용하기 싫어서

그냥 에어프라이어로 바삭바삭하게 굽듯이 튀겨 준

맥주안주로 좋은 닭껍질튀김입니다.","[{'step_number': 1, 'description': '닭껍질은 우유에 2시간 정도 재워 놓았습니다. 그래야 잡내를 제거할 수 있으니까요. 재워 놓았던 닭껍질을 깨끗하게 찬물로 씻어 준 후에 물기를 빼 줍니다. 그런 후에 양념을 시작합니다. 양념은 아주아주 간단합니다. 소금양념으로 하려고 합니다. 소금, 후추, 바질가루를 넣고 조물조물 밑간을 해 줍니다.', 'image_url': 'https://recipe1.ezmember.co.kr/cache/recipe/2019/09/04/e0321c3180dd2944921cb77b35231a4b1.jpg'}, {'step_number': 2, 'description': '밑간을 해 준 닭껍질을 10분정도 재워 놓고 10분이 지난 후에 파기름, 올리브오일을 넣고는 잘 섞어 줍니다.', 'image_url': 'https://recipe1.ezmember.co.kr/cache/recipe/2019/09/04/181d4e2aa2e6d4596baf63680081db761.jpg'}, {'step_number': 3, 'description': '그리고는 에어프라이어에 넣고는 튀겨 줍니다. 160도 온도에서 앞뒤로 12분씩 총 24분 정도 튀겨 주었습니다. 만약 야들야들한 식감을 원하시면 시간을 줄여서 튀겨 주세요. 전 바삭바삭한 식감을 좋아해서 좀더 시간을 두고 튀겨 주었습니다.에어프라이어', 'image_url': 'https://recipe1.ezmember.co.kr/cache/recipe/2019/09/04/87450d31b328c8b852b3eda43c9760561.jpg'}, {'step_number': 4, 'description': '바삭바삭하게 튀겨진 닭껍질입니다. 윗부분이 조금 탄 부분도 있지요. 그런데 전 이렇게 탄듯하게 바삭한 식감이 좋더라구요. 흐물흐물한 식감의 닭껍질은 좋아하지 않아서요 ㅋㅋ', 'image_url': 'https://recipe1.ezmember.co.kr/cache/recipe/2019/09/04/0bf2ae85aab3816f354c18ec858521521.jpg'}, {'step_number': 5, 'description': '초간단으로 만든 닭껍질튀김 완성입니다. 맥주안주로 딱 제격이기도 하지요. 옛날통닭하고 함께 먹기에도 좋고요. 무엇보다 부담이 없어서 좋아요.', 'image_url': 'https://recipe1.ezmember.co.kr/cache/recipe/2019/09/04/52e365b01351d30aca3c5332d9031ac71.jpg'}]"
38789,메인반찬,술안주,닭고기,튀김,실제 이자카야에서 치킨 가라아게 만드는 법/감자전분 구슬 튀김 옷!!,치킨가라아게,"10,281",60분 이내,중급,2인분,"[('닭다리살', '400g'), ('간마늘', '15g'), ('굴소스', '30g'), ('정종', '20g'), ('후추', '30g'), ('감자전분', '40g'), ('계란', '1/2개'), ('양배추', '적당량'), ('감자전분', ''), ('물', '')]","닭은 튀겨야 제맛이죠. 
저는 닭다리살만 사서 치킨 가라아게 만들어 튀겨 먹기도 하는데 치킨 가라아게는 
밑간을 해서 튀기는 거라서 짭조름하니 맛있기 때문에 아이들도 좋아하는 간식이고 
어른들에게는 시원한 맥주와 함께 즐길 수 있는 안주가 되기도 합니다. 

이 레시피는 일본의 유명 이자까야에서 치킨 가라아게를 만들 때 쓰는 감자전분 구슬 튀김 옷을 만들어 튀기기 때문에 더욱 바삭하고 아삭한 일본 전통 치킨 가라아게를 맛 보시실 수 있습니다.","[{'step_number': 1, 'description': '닭다리살은 한입 크기로 자릅니다.', 'image_url': 'https://recipe1.ezmember.co.kr/cache/recipe/2019/11/11/a15b73144e76cb01fb9403ca175ea6c61.png'}, {'step_number': 2, 'description': '갈은 마늘, 진간장, 굴소스, 정종, 후추로 간을 하고 30분 이상 마리네이드 합니다.이 과정을 좀 소홀히 하게 되면 잡내 제거도 미흡하고 먹었을 때 짭조롬한 맛이 좀 덜합니다.\n\n\u200b', 'image_url': 'https://recipe1.ezmember.co.kr/cache/recipe/2019/11/11/f58db732b96955fa2021e2f8136a7bb41.png'}, {'step_number': 3, 'description': '물을 감자전분에 4~5회 나누어 부으면서 전분을 비비면서 구슬 모양으로 만듭니다.이 과정은 동영상을 보시편이 좋습니다.', 'image_url': 'https://recipe1.ezmember.co.kr/cache/recipe/2019/11/11/9fd8d01fd8dea494d465dfe2b7f7ed761.png'}, {'step_number': 4, 'description': '양배추는 얇게 슬라이스 해서 얼음물에 담가 두었다가 가니쉬로 준비합니다.', 'image_url': 'https://recipe1.ezmember.co.kr/cache/recipe/2019/11/11/15b370d4ee1f9258e73297d5dae823f11.png'}, {'step_number': 5, 'description': '계란을 풀어서 반을 2의 마리네이드 한 닭다리살에 넣고계란 한 개를 다 넣으면 너무 질게 되어 구슬 튀김 옷이 풀어 집니다.', 'image_url': 'https://recipe1.ezmember.co.kr/cache/recipe/2019/11/11/35050c72f8c5923576fb810eb430cea61.png'}, {'step_number': 6, 'description': '감자전분을 섞어 반죽합니다.농도가 묽으면 안되니 좀 되게 전분의 량을 조절합니다.', 'image_url': 'https://recipe1.ezmember.co.kr/cache/recipe/2019/11/11/ea59cbb363eedcf4be39d49e4ee097a31.png'}, {'step_number': 7, 'description': '마리내네이드 했 두었던 닭다리살을 감자전분 구술 튀김옷에 묻혀 튀깁니다.', 'image_url': 'https://recipe1.ezmember.co.kr/cache/recipe/2019/11/11/9b2c32bd8f9057188527b155873b47ce1.png'}, {'step_number': 8, 'description': '튀긴 후 건졌다가 3~5분 후 한번 더 튀겨줍니다.다시 튀겨 지면서 더욱 바삭하게 튀겨집니다.', 'image_url': 'https://recipe1.ezmember.co.kr/cache/recipe/2019/11/11/2c87993632ed36687c2a53b15cf20bd51.png'}]"
