index,종류별,상황별,재료별,방법별,글 제목,레시피이름,조회수,조리시간,난이도,인분,재료,소개글,조리순서
8737,밑반찬,일상,달걀/유제품,찜,시금치 달걀찜,시금치달걀찜,"4,866",30분 이내,중급,2인분,"[('달걀', '3개'), ('우유', '150ml'), ('양배추', ''), ('양파', ''), ('시금치', ''), ('소금', ''), ('후추', '약간')]","시금치를 넣어 건강에 더 좋고 부드러운 달갈찜입니다. 시금치,양파,당근,계란까지 색도 다채러워서 보기에도 좋아요.","[{'step_number': 1, 'description': '당근, 양배추는 곱게 채를 썰어주고 시금치는 씻어 손질해 둔다.당근 손질법 레시피', 'image_url': 'https://recipe1.ezmember.co.kr/cache/recipe/2015/11/26/d795da2e2b48dbc2cf257471099a1c871.jpg'}, {'step_number': 2, 'description': '달걀과 우유는 동량으로 준비한다.', 'image_url': 'https://recipe1.ezmember.co.kr/cache/recipe/2015/11/26/455bd017a479d2bfc13e75463ac780061.jpg'}, {'step_number': 3, 'description': '달걀은 노른자 부터 터뜨려 준다.', 'image_url': 'https://recipe1.ezmember.co.kr/cache/recipe/2015/11/26/f11a207db100eb6b50e26d5a6914b8701.jpg'}, {'step_number': 4, 'description': '달걀과 우유를 넣고 잘 섞어준다.', 'image_url': 'https://recipe1.ezmember.co.kr/cache/recipe/2015/11/26/9b13b7ea16d99ec924d9a45f181380191.jpg'}, {'step_number': 5, 'description': '프라이팬에 썰어둔 채소를 넣고 소금으로 간하여 볶아준 후', 'image_url': 'https://recipe1.ezmember.co.kr/cache/recipe/2015/11/26/5b655de39c6a14974cd19e82e7a7a6541.jpg'}, {'step_number': 6, 'description': '달걀을 부어준다.', 'image_url': 'https://recipe1.ezmember.co.kr/cache/recipe/2015/11/26/58a3477f03cd702b07feb39a349ce6d31.jpg'}, {'step_number': 7, 'description': '달걀이 익도록 살살 저어준다.', 'image_url': 'https://recipe1.ezmember.co.kr/cache/recipe/2015/11/26/3fe56c0a0b1ae2aceb43eed1c505fd021.jpg'}, {'step_number': 8, 'description': '달걀이 반쯤 익으면 준비해 둔 시금치를 넣고 섞어준다.', 'image_url': 'https://recipe1.ezmember.co.kr/cache/recipe/2015/11/26/c53c8d87e6d38702b64c83742e9cf3f51.jpg'}, {'step_number': 9, 'description': '후추를 뿌려 완성한다.', 'image_url': 'https://recipe1.ezmember.co.kr/cache/recipe/2015/11/26/2b239562f08387878ce5d5dc16c7bda51.jpg'}, {'step_number': 10, 'description': '완성입니다.', 'image_url': 'https://recipe1.ezmember.co.kr/cache/recipe/2015/11/26/90504d11575e060c43e7a08da4e4fa631.jpg'}]"
8738,밑반찬,일상,달걀/유제품,찜,짭조름 부들부들 명란젓 계란찜,명란젓계란찜,"6,485",15분 이내,아무나,3인분,"[('달걀', '4개'), ('다진야채', ''), ('청주', '1수저'), ('명란젓', '1~2덩이')]","하이~하이~불량엄마 소자매마미예요~! 세택 메가쇼에 갔다가 사온 명란젓~! 명란젓에 청양고추 하나 잘게 썰어 넣고, 참기름 한수 저, 통깨 넣어 비벼만 줘도 밥 한 그릇 비워내는 게 일도 아니죠^^ 저녁밥상에 뭔가 올릴게 없나 고민하다가 명란젓 계란찜을 올리기로 결정. 뚝배기 계란찜을 좋아하지만 오늘은 전자레인지를 이용해보기로 해요~!","[{'step_number': 1, 'description': '계란은 그릇에 넣어 풀어주기 전 알끈을 제거해주세요. 잘 풀어준 계란을 체에 한번 걸러주면 훨씬 부드러운 계란찜을 만들 수 있어요. 하지만 불! 량! 엄! 마! 귀차니즘의 선두주자로서 과감히 패스~! 골고루 풀어준 계란물에 다진 야채와 청주를 넣어주세요 불량엄마 소자매마미는 매주 야채 다짐을 만들어두어 음식 할 때 요긴하게 사용 중이죠~!', 'image_url': 'https://recipe1.ezmember.co.kr/cache/recipe/2016/09/21/fc39c47c8e247cbf4afae9394b2ad02c1.jpg'}, {'step_number': 2, 'description': '명란젓 손질방법은 칼집을 내어주고 칼등으로 살살 살~긁어주면 껍질을 깔끔하게 제거할 수 있어요.명란젓 손질법 레시피', 'image_url': 'https://recipe1.ezmember.co.kr/cache/recipe/2016/09/21/c20d9ade3873c91a495a8cde5755f9341.jpg'}, {'step_number': 3, 'description': '명란젓도 계란물에 퐁당~! 명란젓에 간이 되어있어 따로 간은 안 해요.', 'image_url': 'https://recipe1.ezmember.co.kr/cache/recipe/2016/09/21/3b600ebeb1b81e7f9971e2f6b17828041.jpg'}, {'step_number': 4, 'description': '계란찜할 그릇에 참기름을 미리 둘러 코팅을 해주면 계란찜이 들러붙지 않아 깔끔해요! 뚝배기로 계란찜을 할 때도 동일해요^^', 'image_url': 'https://recipe1.ezmember.co.kr/cache/recipe/2016/09/21/11423f077186f2bea33df54f85bb61991.jpg'}, {'step_number': 5, 'description': '계란물을 부어주고~랩을 씌워 전자레인지에 돌려주면 끝~! 불량엄마 아니랄까 봐 랩이 똑~떨어져서 급한 대로 비닐팩 씌우고 구멍 뽕뽕 내주었어요. 집집마다 전자레인지의 온도는 다르므로 전 6분을 돌려주었고요~! 5분 정도 돌리시고 젓가락으로 찔러보시고 계란 물이 안 묻어 나오면 완성~!전자레인지', 'image_url': 'https://recipe1.ezmember.co.kr/cache/recipe/2016/09/21/da0d733b35ff540aa728ce798a55cdf61.jpg'}]"
8739,밑반찬,일상,달걀/유제품,찜,일본식 계란찜 만들기,계란찜,"64,338",30분 이내,아무나,2인분,"[('계란', '4개'), ('가스오부시', ''), ('소금', ''), ('간장', '')]",부들부들~~~계란찜을 만들어 보았어요. 냉장고 안에...늘 있는 계란...오랜만에 일본식으루 보들하게 찜을 했는데..아이들 잘 먹네요. 보통 다시마 육수를 내서 찜을 하는데..저는 가스오부시를 걸러 넣어 주었어요.,"[{'step_number': 1, 'description': '먼저, 볼에 계란 4개 풀어 알끈 제거하고..소금 약간 넣고 풀어줍니다.', 'image_url': 'https://recipe1.ezmember.co.kr/cache/recipe/2015/06/08/80e01a4a0f3f2fcb45923bdbfdce97731.jpg'}, {'step_number': 2, 'description': '물 2컵에 가다랭이+간장약간 넣어서 끓여 주세요.', 'image_url': 'https://recipe1.ezmember.co.kr/cache/recipe/2015/06/08/2b150e604e8a988d0d4a5cb15de371961.jpg'}, {'step_number': 3, 'description': '가다랭이 육수를 계란과 믹서해서 한번만 걸러 주었답니다. 냄비에 물 팔팔 끓여서, 그릇째로 넣어 주세요. (사실 계란위에 랲을 씌워주면 계란에 수증기로 인해 모양도 예쁘긴 하지만 일단 환경호르몬때문에 저는 그냥 뚜껑 덮어 주었답니다)', 'image_url': 'https://recipe1.ezmember.co.kr/cache/recipe/2015/06/08/3e2aa32e8e9e6a020f693c1e1aca698c1.jpg'}, {'step_number': 4, 'description': '한 15분여정도 쪄주면 계란찜 완성입니다. 마지막에 쪽파 올려 주셔도 좋구요. 중간에 새우 올려 주셔도 좋아요.', 'image_url': 'https://recipe1.ezmember.co.kr/cache/recipe/2015/06/08/156367e576284194741abbb9e5293f341.jpg'}]"
8740,밑반찬,일상,달걀/유제품,찜,뚝배기 계란찜,뚝배기계란찜,"26,925",15분 이내,초급,3인분,"[('달걀', '5알'), ('가쓰오부시육수', ''), ('파', ''), ('고추', ''), ('깨소금', '약간')]",수분을 가득담은 촉촉한 달걀찜입니다.,"[{'step_number': 1, 'description': '달걀에 미리 간을 하여 둡니다. 취향에 따라 육수에도 간을 합니다.', 'image_url': 'https://recipe1.ezmember.co.kr/cache/recipe/2015/06/04/44fdb748a6a90d846477df94c4210e8c1.jpg'}, {'step_number': 2, 'description': '뚝배기에 육수를 넣고 끓기 시작하면 준비한 계란 물을 3~4번에 나누어 넣어 가며 젓어 줍니다. \n육수가 끓을 때 달걀물을 넣으면 달걀이 익으면서 육수의 온도가 내려 가면 저어 주다 보면 다시 육수가 뜨거워 질 때 계란물을 더 넣어주는 형식으로 3~4번 반복하여 계란물을 넣어 주고, 저어 주면서 달걀찜을 만듭니다.', 'image_url': 'https://recipe1.ezmember.co.kr/cache/recipe/2015/06/04/0314b909fdd97317e094630cac4962101.jpg'}, {'step_number': 3, 'description': '뚜껑을 덮고 뜸을들여 계란을 완전히 익혀줍니다. 고추와 파를 위에 얹어 장식합니다.', 'image_url': 'https://recipe1.ezmember.co.kr/cache/recipe/2015/06/04/c2cbc67e46f4faebaa3199faaf70b36b1.jpg'}]"
8741,밑반찬,일상,달걀/유제품,찜,계란찜 만드는법 ~,계란찜,"28,265",None,None,None,"[('계란', ''), ('대파', ''), ('다시마', ''), ('당근', ''), ('맛술', ''), ('소금', ''), ('새우젓', '')]",연두부처럼 부드러운 계란찜 만들어봤어요,"[{'step_number': 1, 'description': '재료: 계란 ,다시마 물 계란 4개와 다시마 물 동량으로 준비했어요. 계량하기 어렵다 할 때는 컵이나 밥공기 사용하셔도 좋아요.', 'image_url': 'https://recipe1.ezmember.co.kr/cache/recipe/2015/04/09/e925bf257db7c90cff85b3e1709469da1.jpg'}, {'step_number': 2, 'description': '계란 4개 풀어서 준비했고요. 생생정보통 황금레시피 계란찜 보니까 계란 대 물 동량으로 넣어주면 된다고 해요.', 'image_url': 'https://recipe1.ezmember.co.kr/cache/recipe/2015/04/09/7ec5131463c1be4c4cdac8a736dd91291.jpg'}, {'step_number': 3, 'description': '다시마는 찬물에 15분 이상 담아두면 다시마 물이 된답니다. 다시마 없으면 생략 가능해요~', 'image_url': 'https://recipe1.ezmember.co.kr/cache/recipe/2015/04/09/71d94c72593257ab19e5b9335bf4f2de1.jpg'}, {'step_number': 4, 'description': '계란 4개와 다시마 물 동량으로 넣어줬고요. 맛술 한수 저와 새우젓 넣어줬어요. 새우젓 없으면 소금 간해주셔도 좋고 연두 한 스푼 넣어주셔도 좋아요!', 'image_url': 'https://recipe1.ezmember.co.kr/cache/recipe/2015/04/09/0eea5d70aee57b804fbafe491e89b9171.jpg'}, {'step_number': 5, 'description': '연두부처럼 부드러운 계란찜 만들려면 알끈을 제거해주는 게 좋다고 해요. 생생정보통 황금레시피보니까150회 이상 저어주면 된다고 하네요. 150회 이상 젓가락으로 저어줬어요~', 'image_url': 'https://recipe1.ezmember.co.kr/cache/recipe/2015/04/09/e42dee19cb0cfc7f332fafd4079218081.jpg'}, {'step_number': 6, 'description': '계란찜 할 때 뚝배기에 계란 물 붙어서 잘 안 떨어지는 경우 많잖아요. 그럴 때 계란 물 넣기 전에 참기름 한 방울 넣어보세요. 계란 잘 떨어진답니다~ 계란찜은 중불에서 계란 물 넣어서 끓여주세요.', 'image_url': 'https://recipe1.ezmember.co.kr/cache/recipe/2015/04/09/0a1dd31b671d102496333d1800c325ef1.jpg'}, {'step_number': 7, 'description': '테두리에 계란이 익기 시작하면 약한 불로 낮추고 수저로 뚝배기 중앙 쪽으로 떠주면 몽글몽글하게 부풀어 오르는 계란찜이 된다고 해요.', 'image_url': 'https://recipe1.ezmember.co.kr/cache/recipe/2015/04/09/2925741a78661ad94424a6600a8e2e001.jpg'}, {'step_number': 8, 'description': '혹은 젓가락으로 저어줘도 좋아요.', 'image_url': 'https://recipe1.ezmember.co.kr/cache/recipe/2015/04/09/de61bae15c36354e85718f2365c039461.jpg'}, {'step_number': 9, 'description': '뚜껑 닫고 약한 불에서 끓여주세요.', 'image_url': 'https://recipe1.ezmember.co.kr/cache/recipe/2015/04/09/37585cab184839cb141317a7dc82aa441.jpg'}, {'step_number': 10, 'description': '계란찜이 거의 다 되어갈 때 당근과 대파 중앙에 올려주세요. 야채는 처음부터 계란 물에 넣고 하셔도 상관없어요.', 'image_url': 'https://recipe1.ezmember.co.kr/cache/recipe/2015/04/09/283dfc05605ae2629d732ce27b4738e41.jpg'}, {'step_number': 11, 'description': '1~2분만 더 끓여주면 맛있는 계란찜이 된답니다.', 'image_url': 'https://recipe1.ezmember.co.kr/cache/recipe/2015/04/09/a121863b494cb77319975aac8c1fa71b1.jpg'}, {'step_number': 12, 'description': '연두부처럼 부드러운 계란찜 완성~ 뚝배기에 해서 먹는 내내 따뜻하게 드실 수 있어서 좋죠!', 'image_url': 'https://recipe1.ezmember.co.kr/cache/recipe/2015/04/09/ac54c478da92cd0e1e49c5d5e9edb51c1.jpg'}, {'step_number': 13, 'description': '계란 4개로 했더니 푸짐하네요~', 'image_url': 'https://recipe1.ezmember.co.kr/cache/recipe/2015/04/09/78c6e52bcb81dd0916763935d94258af1.jpg'}, {'step_number': 14, 'description': '계란찜 만드는법 어렵지 않죠~ 반찬 없을 때 후다닥 만들 수 있는 메뉴랍니다.', 'image_url': 'https://recipe1.ezmember.co.kr/cache/recipe/2015/04/09/f624e474f9dc2c179468b079de13ae301.jpg'}]"
8742,밑반찬,일상,달걀/유제품,찜,계란찜,계란찜,"28,261",15분 이내,초급,1인분,"[('계란', '2개'), ('잔파', ''), ('소금', '1작은술'), ('새우젓', '1작은술'), ('쪽파', '4개'), ('고추가루', '1작은술'), ('참기름', '1방울'), ('통깨', '약간')]",바쁠 때 뚝딱 해먹는 계란찜입니다.,"[{'step_number': 1, 'description': '뚝배기에 계란 두개를 잘 풀어주십니다. 소금넣고 물천천히 넣어가며 잘 끓여주세요. 고추가루 넣고 이제 불에 바로 올려 줄게요. 뚜껑 꼭 닫아주세요 처음엔 쎈불에 끓이시다가 2분있다가 한번 반드시 저어주세요 그래야 부드럽습니다. 바로 최고 약한 불로 줄여주세요 부드럽게익어가는 모습이 보여집니다.', 'image_url': 'https://recipe1.ezmember.co.kr/cache/recipe/2016/01/26/9781a538e1422c68f4554ecb921bd1751.jpg'}, {'step_number': 2, 'description': '약한불로 줄임과 동시에 쪽파와 참기름 한방울 새우젓 깨소금을 뿌려주세요~ 약한불로 5분정도 뚜껑닫고 익히시다가 불끄고 뜸을 2분정도 들입니다. 집의 화력이나 뚝배기 상태에 따라 다르니 절대 끓어 오르지 않게만 잘 봐주시면 되요.', 'image_url': None}, {'step_number': 3, 'description': '새우젓과 고추가루도 넣어서 밥에 올려 슥슥 비벼먹기도 좋아요.', 'image_url': None}]"
8743,밑반찬,일상,달걀/유제품,찜,명란달걀찜,명란달걀찜,283,15분 이내,아무나,2인분,"[('물', '2컵'), ('달걀', '4개'), ('명란젓', '100g'), ('당근', '조금'), ('대파', '1/4대')]",예전에 어머니가 밥 뜸들 때에 같이 올려 해주시던 달걀찜.,"[{'step_number': 1, 'description': '냄비에 물을 붓고 끓이기 시작해요. 초보자들은 약한불을 켜놓아요약불', 'image_url': 'https://recipe1.ezmember.co.kr/cache/recipe/2021/12/30/05d6a852d983bb9449c2a74fa45078d41.jpg'}, {'step_number': 2, 'description': '믹서에 명란, 달걀을 넣고', 'image_url': 'https://recipe1.ezmember.co.kr/cache/recipe/2021/12/30/a54860bdee8d526d570250674113f1701.jpg'}, {'step_number': 3, 'description': '돌려요', 'image_url': 'https://recipe1.ezmember.co.kr/cache/recipe/2021/12/30/f6fc5ffb9606dac4b526f0420024feb51.jpg'}, {'step_number': 4, 'description': '물이 끓을 때 달걀을 부어주고 뚜껑 닫아요약불', 'image_url': 'https://recipe1.ezmember.co.kr/cache/recipe/2021/12/30/8e3bccf6fba90a406ddf3ac63d2811061.jpg'}, {'step_number': 5, 'description': '당근 다져 넣고약불', 'image_url': 'https://recipe1.ezmember.co.kr/cache/recipe/2021/12/30/6dea61a567500295e87b6bdf97ff462f1.jpg'}, {'step_number': 6, 'description': '대파 총총 썰어 달걀 위에 뿌려요 가라앉는 다면 아직 달걀이 많이 안익었기 때문입니다 괜찮아요약불', 'image_url': 'https://recipe1.ezmember.co.kr/cache/recipe/2021/12/30/6f5b60eb2857182fe82a62b0bd1f87421.jpg'}, {'step_number': 7, 'description': '뚜껑 닫고 5분 정도 더 익혀줍니다약한불', 'image_url': 'https://recipe1.ezmember.co.kr/cache/recipe/2021/12/30/7c619486c0a38fc598ecef7e0677aaf11.jpg'}]"
8744,밑반찬,일상,달걀/유제품,찜,초간단 달걀찜 만들기,달걀찜,619,60분 이내,아무나,1인분,"[('달걀', '2개'), ('설탕', '1티스푼'), ('소금', '1티스푼'), ('다시마', ''), ('물', '170ml')]","오늘은 달걍찜을 만들어 볼거에요!
달걀만 있으면 끝!!","[{'step_number': 1, 'description': '계란 2개, 소금1티스푼, 설탕 1티스푼을 그릇에 넣고 잘 풀어주세요.', 'image_url': 'https://recipe1.ezmember.co.kr/cache/recipe/2022/01/03/466d0d8ce0feeb4ed831dcbe912c13c21.jpg'}, {'step_number': 2, 'description': '다른 그릇에 물 170ml와 다시마 5~6개 정도를 20분 정도 기다려서 다시마 육수를 만들어요.', 'image_url': 'https://recipe1.ezmember.co.kr/cache/recipe/2022/01/03/e4b2b3d6a85d18652fd1fbc65103ce5d1.jpg'}, {'step_number': 3, 'description': '그다음에 1번과 2번을 그릇에 넣고 잘 섞어주세요.', 'image_url': 'https://recipe1.ezmember.co.kr/cache/recipe/2022/01/03/13f95efdcac5f0fa8e40049954f2b81f1.jpg'}, {'step_number': 4, 'description': '그리고 찜기에 넣을 수 있는 그릇에 기름을 둘러요.', 'image_url': 'https://recipe1.ezmember.co.kr/cache/recipe/2022/01/03/c902fb61ffaa9377570a8140a02f23d21.jpg'}, {'step_number': 5, 'description': '그리고 3번을 4번에 넣어주세요.', 'image_url': 'https://recipe1.ezmember.co.kr/cache/recipe/2022/01/03/95ceb9f0484259fefcd56e960158eab11.jpg'}, {'step_number': 6, 'description': '그다음 5번 그릇에 랲을 씌워주세요.', 'image_url': 'https://recipe1.ezmember.co.kr/cache/recipe/2022/01/03/24c8bca9eca50f6131e27a86d382aa921.jpg'}, {'step_number': 7, 'description': '그다음 찜기에 20분 정도 쪄 주세요', 'image_url': 'https://recipe1.ezmember.co.kr/cache/recipe/2022/01/03/7eb0071f12e0c8079a3e2ef12a1be3391.jpg'}, {'step_number': 8, 'description': '그럼 완성~~!', 'image_url': 'https://recipe1.ezmember.co.kr/cache/recipe/2022/01/03/f03dff5342b98f4c275f47528ff6e4e61.jpg'}]"
8745,밑반찬,일상,달걀/유제품,찜,전자렌지계란찜.간단레시피계란찜.절대실패없는계란찜레시피.계란찜황금비율레시피.다이어트음식,계란찜,"12,035",20분 이내,아무나,1인분,"[('계란', '6개'), ('물', '400ml'), ('혼다시', '1.5T')]","계란은 단백질과 수분이 많은 음식으로 #다이어트 식재료로 절대 빠질수 없는 귀한 분이죠:)
오늘은 다이어트음식 중 하나인 계란찜 만들건데요.

가스불을 사용하지 않고 조리도구로 전자렌지 사용할거예요.

이레시피를 따라서 계란찜 만드신다면,간도 딱 맞고 적당히 촉촉하면서 절대 실패없는계란찜 만들수 있을거예요:)

그럼, 3가지재료만 사용해 완성해내는 전자렌지계란찜레시피 공유해볼께요.","[{'step_number': 1, 'description': '렌지사용가능한 찜용 용기에 물붓고,', 'image_url': 'https://recipe1.ezmember.co.kr/cache/recipe/2022/05/21/55cb641ed006430f1e114bc103b5ec251.jpg'}, {'step_number': 2, 'description': '혼다시 넣고,', 'image_url': 'https://recipe1.ezmember.co.kr/cache/recipe/2022/05/21/d95199055324d02e356e2e7694bda6a01.jpg'}, {'step_number': 3, 'description': '혼다시가 녹을때까지 잘 저어주세요.', 'image_url': 'https://recipe1.ezmember.co.kr/cache/recipe/2022/05/21/bfdb15b83f107cd9af43bc406eaea4d31.jpg'}, {'step_number': 4, 'description': '혼다시가 다 녹으면,', 'image_url': 'https://recipe1.ezmember.co.kr/cache/recipe/2022/05/21/2bd410d300a6ccceb0f9303ea200dc021.jpg'}, {'step_number': 5, 'description': '계란 깨줍니다.', 'image_url': 'https://recipe1.ezmember.co.kr/cache/recipe/2022/05/21/6490c207a329675886923868953794a71.jpg'}, {'step_number': 6, 'description': '계란과 물이 잘 섞이도록 저어줍니다.', 'image_url': 'https://recipe1.ezmember.co.kr/cache/recipe/2022/05/21/d5349d2a5a0cc62f52ac53428a6b70fd1.jpg'}, {'step_number': 7, 'description': '용기 뚜껑을 덮고,', 'image_url': 'https://recipe1.ezmember.co.kr/cache/recipe/2022/05/21/f4afd55d14dfc42a3f36a769c16a887b1.jpg'}, {'step_number': 8, 'description': '전자렌지에서 7분돌려줍니다.전자레인지', 'image_url': 'https://recipe1.ezmember.co.kr/cache/recipe/2022/05/21/d73540b3ad76f7314057d95bd9c946b21.jpg'}, {'step_number': 9, 'description': '그리고 뚜껑을 열고 가쪽에 익은 계란과 중간에 계란물을 잘섞어준뒤,다시 7분 더 돌려줍니다.*주의할사항은 렌지의 W(소비전력)의 세기에따라 결과물이 달라질수 있으니,중간부분을 젓가락으로 찔러가면서 익음정도를 확인후 드시면 됩니다.', 'image_url': 'https://recipe1.ezmember.co.kr/cache/recipe/2022/05/21/5dd61c553f76b24e2fd44886dbaa82c01.jpg'}, {'step_number': 10, 'description': '촉촉하면서 감칠맛나는계란찜 완성입니다.', 'image_url': 'https://recipe1.ezmember.co.kr/cache/recipe/2022/05/21/f65616e6c397c0278658dcc7405204761.jpg'}]"
8746,밑반찬,일상,달걀/유제품,찜,"유아,어린이반찬 계란찜!",계란찜,"2,521",30분 이내,아무나,4인분,"[('계란', '10개'), ('물', '2컵'), ('맛소금', '1티스푼')]",간단한듯 쉽지않은 계란찜~알끈제거해줄수록 더욱 부드러운 계란찜이 되네요,"[{'step_number': 1, 'description': '계란을 깨어 맛소금(가는소금)을 넣어서 잘풀어주세요', 'image_url': 'https://recipe1.ezmember.co.kr/cache/recipe/2021/12/04/65f21f435a5b3e7bffe7fbead2f025221.jpg'}, {'step_number': 2, 'description': '고운체에 2~3번 걸러내서 알끈을 제거해주세요', 'image_url': 'https://recipe1.ezmember.co.kr/cache/recipe/2021/12/04/6c8042ef1bdf4610803f72d91830d8d51.jpg'}, {'step_number': 3, 'description': '걸러낸 계란물에 물(생수)2컵을 부어 살살 섞어주세요\n최대한 기포가 생기지않게 해주세요', 'image_url': 'https://recipe1.ezmember.co.kr/cache/recipe/2021/12/04/0a7073cedc053bb40b3613667cb832cc1.jpg'}, {'step_number': 4, 'description': '찜솥에 물을 절반정도 붓고 섞어놓은 계란물을 용기 2/3만큼 부어주신후 쪄주세요\n*찜솥에 미리 물을 넣어 펄펄 끓여주시다가 넣고 뚜껑을 덮어 중약불에서 찜을 하시면 되세요\n센불에서 만들면 부드러운것보다 부풀어오리기만 한답니다\n찜솥이 작아 2군데로 나누어서 조리했네요', 'image_url': 'https://recipe1.ezmember.co.kr/cache/recipe/2021/12/04/0741faf7c43cc6d1e5c3b7020d16d29c1.jpg'}, {'step_number': 5, 'description': '약 7~10분정도 찜을 하시고 젓가락으로 가운데부분을 찔러봤을때 젓가락에 계란물이 안묻어나오면 완성이네요\n저는 일부러 넉넉하게 만들어 식혀서 용기에 담아 냉장보관해서 나누어서 먹었답니다ㅎ', 'image_url': 'https://recipe1.ezmember.co.kr/cache/recipe/2021/12/04/94939b765033f4b91c50af7260ca857f1.jpg'}]"
8747,밑반찬,일상,달걀/유제품,찜,폭탄달걀찜 시금치 계란찜 달걀찜 달걀요리 계란요리,폭탄달걀찜,"4,429",10분 이내,초급,2인분,"[('달걀', '4개'), ('시금치', '1/2줌'), ('물', '1/4컵'), ('소금', '1티스푼'), ('설탕', '1/2티스푼'), ('베이킹파우더', '1/3티스푼'), ('참기름', '1티스푼'), ('깨', '1티스푼'), ('다진파', '1큰술')]",시금치는 반줌정도만 넣으면 색도 예쁘고 특별한 달걀찜이 됩니다. 폭신함도 딱 적당하고 간도 적당해요. 정말 맛있습니다.,"[{'step_number': 1, 'description': '시금치 반줌과 물1/4컵을 넣고 믹서기에 갈아줍니다.', 'image_url': 'https://recipe1.ezmember.co.kr/cache/recipe/2021/12/05/a95f58fa91b16920e66729b88f5054041.jpg'}, {'step_number': 2, 'description': '달걀4개에 시금치물을 부어줍니다.', 'image_url': 'https://recipe1.ezmember.co.kr/cache/recipe/2021/12/05/6fd5f887bd1d667837df38b894a61ea51.jpg'}, {'step_number': 3, 'description': '소금1ts, 설탕0.5ts, 베이킹파우더 0.3ts를 넣고 섞어줍니다.', 'image_url': 'https://recipe1.ezmember.co.kr/cache/recipe/2021/12/05/1c422aa58069a1b15f335a4d81e9b42f1.jpg'}, {'step_number': 4, 'description': '중약정도의 불에 반정도 익을때까지 바닥을 긁어가며 계속 저어줍니다.', 'image_url': 'https://recipe1.ezmember.co.kr/cache/recipe/2021/12/05/af8c4834e384c24d8343ddc81a7f8f231.jpg'}, {'step_number': 5, 'description': '위가 볼록한 뚜껑이나 냄비등으로 덮습니다. 저는 한칫수 큰 뚝배기로 덮었습니다. (뚜껑을 덮고 2분전후로 완성)', 'image_url': 'https://recipe1.ezmember.co.kr/cache/recipe/2021/12/05/d51d14fcf700df6da56030c14ada46281.jpg'}, {'step_number': 6, 'description': '참기름, 깨, 다진파를 뿌려 완성합니다.', 'image_url': 'https://recipe1.ezmember.co.kr/cache/recipe/2021/12/05/3804dddda029debcaad380749927980b1.jpg'}]"
