index,종류별,상황별,재료별,방법별,글 제목,레시피이름,조회수,조리시간,난이도,인분,재료,소개글,조리순서
39916,메인반찬,술안주,해물류,부침,바삭한 오징어 부추전,오징어부추전,746,30분 이내,아무나,2인분,"[('오징어', '1마리'), ('부추', '1줌'), ('양파', '1/4개'), ('청양고추', '1개'), ('홍고추', '1개'), ('다진마늘', '1/2스푼'), ('튀김가루', '2종이컵'), ('찬물', '1.5종이컵'), ('액젓', '1/2스푼'), ('후추', '약간'), ('식용유', '적당량')]",부추무침을 만들고 남은 부추로 오징어부추전을 부쳤어요^6 막걸이 안주로도 좋아요ㅋ,"[{'step_number': 1, 'description': '손질 오징어는 흐르는 물에 여러 번 헹궈서 씻어준 다음 먹기 좋은 크기로 썰어줍니다.', 'image_url': 'https://recipe1.ezmember.co.kr/cache/recipe/2022/07/10/b988355ac0a3ea0b712131e2fa1407cd1.jpg'}, {'step_number': 2, 'description': '부추도 시들은 잎을 다듬고 물에 헹궈서 씻어준 뒤 도마 위에 가지런히 놓고 4~5센티 정도의 길이로 썰어주세요.', 'image_url': 'https://recipe1.ezmember.co.kr/cache/recipe/2022/07/10/8290ec475a8b83c8fa2327a7a747c90f1.jpg'}, {'step_number': 3, 'description': '양파는 채 썰고 청양고추와 홍고추는 어슷 썰어 주세요.', 'image_url': 'https://recipe1.ezmember.co.kr/cache/recipe/2022/07/10/3f535c31015731cadc8ccbe461c040951.jpg'}, {'step_number': 4, 'description': '볼에 썰어둔 부추와 오징어를 넣고 다진 마늘 1/2스푼, 액젓 1/2스푼,후추를 넣어주세요.액젓 대신 건새우 가루를 넣어주어도 좋아요.', 'image_url': 'https://recipe1.ezmember.co.kr/cache/recipe/2022/07/10/486d680d9a524565e84b6ead587208211.jpg'}, {'step_number': 5, 'description': '튀김가루 또는 부침가루 종이컵 2컵, 찬물 1컵 반을 넣어주세요.', 'image_url': 'https://recipe1.ezmember.co.kr/cache/recipe/2022/07/10/583af00d6b27546b94b0bb31d193d6a11.jpg'}, {'step_number': 6, 'description': '반죽을 골고루 잘 섞어주세요.', 'image_url': 'https://recipe1.ezmember.co.kr/cache/recipe/2022/07/10/958f966822e8469f124875eb9348454e1.jpg'}, {'step_number': 7, 'description': '달군 프라이팬에 식용유를 넉넉히 두르고 반죽을 국자로 떠서 프라이팬에 평평하게 펼쳐줍니다.', 'image_url': 'https://recipe1.ezmember.co.kr/cache/recipe/2022/07/10/003a1460d67b0932a4ead77f117de3701.jpg'}, {'step_number': 8, 'description': '중불보다는 조금 약한 불에 노릇노릇하게 부쳐주세요.뒤집개로 반죽을 평평하게 눌러가며 부쳐줍니다.', 'image_url': 'https://recipe1.ezmember.co.kr/cache/recipe/2022/07/10/b958aa456a00e210c286db8948b49b241.jpg'}, {'step_number': 9, 'description': '프라이팬을 살짝 흔들어봐서 전이 흔들리면 바닥이 익은 거니 살짝 들어봐서 노릇노릇해졌으면 전을 뒤집어 줍니다.프라이팬 가장자리로 식용유를 빙 둘러서 보충해가며 부쳐주세요.\n\n\u200b', 'image_url': 'https://recipe1.ezmember.co.kr/cache/recipe/2022/07/10/385289e71af56ba56d080b5a51be20241.jpg'}, {'step_number': 10, 'description': '마찬가지로 반대쪽도 뒤집개로 눌러가며 노릇노릇하게 부쳐줍니다.', 'image_url': 'https://recipe1.ezmember.co.kr/cache/recipe/2022/07/10/40e5291ce75ad4b55f3ff2867bc3f6c81.jpg'}, {'step_number': 11, 'description': '완성입니다.', 'image_url': 'https://recipe1.ezmember.co.kr/cache/recipe/2022/07/10/4a5120e881432f198665b9b6fbb653791.jpg'}]"
39917,메인반찬,술안주,해물류,부침,#새우요리 #냉동새우 #새우완자전만들기 #매콤한새우완자전 #막걸리안주 #영양간식,새우완자전,"1,758",30분 이내,아무나,4인분,"[('냉동 새우', '400g'), ('홍고추', '1개'), ('청양고추', '2개'), ('마늘허브소금', '1작은술'), ('계란', '1개'), ('전분가루', '4큰술'), ('식용유', '적당량')]","냉동실에 있었던 새우. 칵테일 생새우인데,

그걸 해동해서 홍고추랑 청양고추 넣어서 완자전을 만들었습니다.

​

매콤한 향이 나는 알록달록한 새우완자전.

새우가 탱글탱글하게 씹히는 맛이 좋고 고소한

새우완자전입니다.

​

냉동실이 텅텅 비어가네요. ㅎㅎㅎ

냉동해물이며 새우 등등을 사 놓아야겠습니다.

그럼 4개월 정도는 먹겠죠. ^^","[{'step_number': 1, 'description': '냉동 칵테일 생새우는 찬물에 해동시켜 줍니다. 그리고 꼬리 껍질는 까 주시고요. 꼬리껍질이 없는 냉동칵테일생새우도 있으니 껍질까기 싫으신 분들은 껍질없는 새우를 선택하시면 됩니다.', 'image_url': 'https://recipe1.ezmember.co.kr/cache/recipe/2022/07/15/e13c0d03e2f144b8d9f3d7ec368728e41.jpg'}, {'step_number': 2, 'description': '새우살을 다져 줍니다. 너무 곱게 다지지 마시고 칼을 이용해서 큼지막하게 다져 줍니다.', 'image_url': 'https://recipe1.ezmember.co.kr/cache/recipe/2022/07/15/204429626c95a2692eaab07847588ca41.jpg'}, {'step_number': 3, 'description': '홍고추랑 청양고추를 다져 줍니다.', 'image_url': 'https://recipe1.ezmember.co.kr/cache/recipe/2022/07/15/b39ec0edbc87118cfef981b6a37da7b01.jpg'}, {'step_number': 4, 'description': '다진 생새우를 투하합니다.', 'image_url': 'https://recipe1.ezmember.co.kr/cache/recipe/2022/07/15/652b579ac824d65426e5455805dec2511.jpg'}, {'step_number': 5, 'description': '여기에 마늘허브소금으로 간을 해주고, 전분가루와 계란을 넣어서 한쪽 방향으로 치대면서 잘 섞어 줍니다. 치대면 치댈수록 새우에서 점성이 나와 굳이 물을 넣지 않아도 끈적거리면서 잘 붙게 됩니다.', 'image_url': 'https://recipe1.ezmember.co.kr/cache/recipe/2022/07/15/1d93538e66369551bfc01650866cdd7e1.jpg'}, {'step_number': 6, 'description': '이렇게 새우완자전의 반죽이 다 완성되었습니다.', 'image_url': 'https://recipe1.ezmember.co.kr/cache/recipe/2022/07/15/e0992bedce01e3e592aaebb659cbaf6f1.jpg'}, {'step_number': 7, 'description': '충분히 달궈진 팬에 기름을 넉넉하게 두르고 한큰술씩 퍼서는 동그랗게 완자전을 부쳐 줍니다. 노릇노릇하게 밑면이 익으면 뒤집엇 ㅓ마져 부쳐 주세요.', 'image_url': 'https://recipe1.ezmember.co.kr/cache/recipe/2022/07/15/bed6d8039f88203d431f3c972cd1d8ef1.jpg'}, {'step_number': 8, 'description': '부쳐낸 새우완자전은 일단, 기름을 빼 줍니다.', 'image_url': 'https://recipe1.ezmember.co.kr/cache/recipe/2022/07/15/f2d462d02712d0f5bfead8d7ed5c29531.jpg'}, {'step_number': 9, 'description': '알록달록한 코추색이 예쁜\n고소하고 탱글탱글한 새우완자전 완성입니다.\n고추를 빼고 깻잎을 다져서 넣어 준 후에\n부치셔도 좋고요. 파프리카를 다져서 넣어 주셔도 좋습니다.\n그럼 아이들한테도 줄 수 있는 간식이 되겠지요.\n간식으로도 술안주로도 좋은 새우완자전입니다.', 'image_url': 'https://recipe1.ezmember.co.kr/cache/recipe/2022/07/15/d48c0192dd479b928b891ac09a5a3e751.jpg'}]"
39918,메인반찬,술안주,해물류,부침,백종원의 홍콩식 굴전 겉바속촉 굴전 만들기,굴전,"2,116",10분 이내,아무나,2인분,"[('생굴', '400g'), ('튀김가루', '70g'), ('대파', '1뿌리'), ('달걀', '2개'), ('물', '60ml'), ('스리라차소스', '적당량'), ('올리브유', '약간')]","제철음식만한 보약이 없죠
굴이 제철이라서 초장에 찍어 먹어도 넘 맛있더라구요
야밤에 살짝 출출하기도 하고 다이어트에도 도움되는 게 뭐가 있을지 생각하다 굴전을 만들었어요.
믿고 보는 백종원 유투브를 보고 살짝 바꾼것도 있어요. 
믿고 보는 백종원 요리 홍콩식 굴전 만들어 볼께요","[{'step_number': 1, 'description': '굴을 깨끗히 세척해 주세요.', 'image_url': 'https://recipe1.ezmember.co.kr/cache/recipe/2022/12/22/9e38c3b382b5c187ea2d8b7b6e985cfd1.jpg'}, {'step_number': 2, 'description': '세척한 굴은 체에 받쳐 물기를 빼줍니다.', 'image_url': 'https://recipe1.ezmember.co.kr/cache/recipe/2022/12/22/4c2608eeceaa8c86b75a80e76f352ec91.jpg'}, {'step_number': 3, 'description': '대파는 작게 송송 썰어주세요대파가 없으면 쪽파도 좋고, 부추도 좋아요', 'image_url': 'https://recipe1.ezmember.co.kr/cache/recipe/2022/12/22/424ca4f465b5404f8e1a7d2ad953633e1.jpg'}, {'step_number': 4, 'description': '볼에 굴, 대파, 달걀, 튀김가루, 물을 넣고 가볍게 굴이 다치지 않게 골고루 섞어주세요달걀은 미리 풀어 넣어주세요. 풀어 넣어주는걸 깜빡해서 그냥 넣었다가 푸는데 조금 고생했어요.', 'image_url': 'https://recipe1.ezmember.co.kr/cache/recipe/2022/12/22/31753710e4017a41301fa66709b3cbc91.jpg'}, {'step_number': 5, 'description': '달군 팬에 올리브유를 넉넉히 둘러 주세요 강불에 튀기듯이 굽는게 포인트!!', 'image_url': 'https://recipe1.ezmember.co.kr/cache/recipe/2022/12/22/a3a5b19ba16e3f08d71a17bdb788dc981.jpg'}]"
39919,메인반찬,술안주,해물류,부침,<술안주>탱글탱글한 새우꼬치전!,새우꼬치전,257,30분 이내,아무나,4인분,"[('냉동튀김용깐 새우', '60마리'), ('부침가루', '2컵'), ('계란', '3~4개'), ('후추가루', '조금'), ('생강술', '2~3큰술'), ('포도씨유', '')]",튀김용으로 길게 껍질이 벗겨진 새우를 꼬치에 꽂아서 전으로 부쳐보세요 새우를 좋아하는 아이들에게도 어른들에게는 술안주로 명절에는 색다른전으로 드시에 딱 좋답니다,"[{'step_number': 1, 'description': '튀김용냉동깐새우를 준비해서 자연해동시켜주세요', 'image_url': 'https://recipe1.ezmember.co.kr/cache/recipe/2024/02/11/a0229c625013802082580da9213630331.jpg'}, {'step_number': 2, 'description': '이쑤시개(대나무)에 다섯개를 꼬리쪽남은껍질부분에 나란히 꽂아주세요이쑤시개', 'image_url': 'https://recipe1.ezmember.co.kr/cache/recipe/2024/02/11/fe2d19905f9a3244f0d1e4852e74bde81.jpg'}, {'step_number': 3, 'description': '큰쟁반에 겹쳐지지않게 잘놓아주신후 후추가루를 고루 뿌려주세요 *소금간은 하지마세요 새우가 짭자롬합니다쟁반', 'image_url': 'https://recipe1.ezmember.co.kr/cache/recipe/2024/02/11/4264889b32d7376c4ed1d9920c25a9751.jpg'}, {'step_number': 4, 'description': '저는 생강술을 위에 조금씩 뿌려주신후 10분정도를 재워두세요\n*비린내,잡냄새를 없애줍니다', 'image_url': 'https://recipe1.ezmember.co.kr/cache/recipe/2024/02/11/c5841efb05bc52047dbd167280749a171.jpg'}, {'step_number': 5, 'description': '부침가루나 밀가루를 앞뒤로 고루 묻혀주세요', 'image_url': 'https://recipe1.ezmember.co.kr/cache/recipe/2024/02/11/36b640228491854a8029ea14c6c6f1791.jpg'}, {'step_number': 6, 'description': '계란을 풀어주신후 5번을 계란물을 앞뒤로 고루 묻혀주신후 \n*계란에 간을 하지마세요 새우가 짭자롬합니다볼 , 요리스푼', 'image_url': 'https://recipe1.ezmember.co.kr/cache/recipe/2024/02/11/a3b81174b0d9beaf3b7ab4bb136c667e1.jpg'}, {'step_number': 7, 'description': '중약불에 팬을 올려주신후 포도씨유를 두르고 올려주세요프라이팬', 'image_url': 'https://recipe1.ezmember.co.kr/cache/recipe/2024/02/11/429e8be277711b4a559ed0316646b09f1.jpg'}, {'step_number': 8, 'description': '뒤집개로 눌러주시면서 앞뒤로 노릇하게 부쳐주시면 완성이네요\n*꼬리쪽부분이 전부 붉을색으로 변하면 다익은겁니다뒤집개', 'image_url': 'https://recipe1.ezmember.co.kr/cache/recipe/2024/02/11/46c82ae9079436224cad5bef55f95f681.jpg'}, {'step_number': 9, 'description': '부드러우면서도 새우살이 탱글탱글한 새우꼬치전이 완성이 되었네요', 'image_url': 'https://recipe1.ezmember.co.kr/cache/recipe/2024/02/11/006fef4bcd8ed06790c457e0ebef80fd1.jpg'}]"
39920,메인반찬,술안주,해물류,부침,오꼬노미야끼 만들기 오징어 오꼬노미야끼 양배추전 오코노미야끼 레시피,오꼬노미야끼,"2,025",20분 이내,아무나,2인분,"[('양배추', '100g'), ('오징어', '1마리'), ('양파', '1/4개'), ('계란', '1개'), ('부침가루', '6~7스푼'), ('물', '40ml'), ('마요네즈', '조금'), ('돈까스소스                                                                                또는 데리야끼소스', ''), ('가쓰오부시', '약간'), ('맛술', '1스푼'), ('후추', '조금')]",쫄깃한 오징어가 듬뿍 들어간 양배추전 오꼬노미야끼입니다. 갓 부친 오꼬노미야끼 위에 가쓰오부시 올리면 춤추는 듯 움직이는 모습이 재미있어 아이들도 좋아해요 ^^ 간식으로 술 안주로 맛있는 오꼬노미야끼 만들어 드세요 :),"[{'step_number': 1, 'description': '오징어는 부드러운 식감을 위해 껍질을 벗긴 뒤 0.4cm 정도로 가늘게 썰어 주세요.도마 , 칼', 'image_url': 'https://recipe1.ezmember.co.kr/cache/recipe/2024/03/06/f3b33ce2784c7145cb210922e985ec101.jpg'}, {'step_number': 2, 'description': '자른 오징어에 맛술 1스푼과 후추를 넣어 잘 섞어 줍니다.믹싱볼', 'image_url': 'https://recipe1.ezmember.co.kr/cache/recipe/2024/03/06/ddcd3b98e509680f1dd7c968455920e91.jpg'}, {'step_number': 3, 'description': '양배추는 칼이나 채칼로 얇게 채 썬뒤 식초 1스푼 넣은 물에 5분 담구었다 깨끗이 세척한 뒤 체에 받쳐 물기를 제거해 주세요.채반', 'image_url': 'https://recipe1.ezmember.co.kr/cache/recipe/2024/03/06/ab3dcdecfb4c216406fe7b6d48ec625b1.jpg'}, {'step_number': 4, 'description': '양파도 가늘게 채 썰어 줍니다.', 'image_url': 'https://recipe1.ezmember.co.kr/cache/recipe/2024/03/06/1ffebd344805e8df61f6c95e1cf08ea51.jpg'}, {'step_number': 5, 'description': '채 썬 양배추와 양파, 오징어를 볼에 담고 계란 1개 , 부침가루 6스푼 , 물 40ml 를 넣어 잘 섞어 줍니다.\n요리스푼농도를 보고 조금 묽다면 부침가루 1스푼을 추가 해 주세요.', 'image_url': 'https://recipe1.ezmember.co.kr/cache/recipe/2024/03/06/932d144ecf176b467f2847f7768a52e21.jpg'}, {'step_number': 6, 'description': '약불로 달군 팬에 기름을 넉넉히 두르고 반죽을 떠서 올려 줍니다. 가장자리를 다듬어 동그랗게 모양을 잡은 뒤 속까지 잘 익도록 뚜껑을 덮고 1분간 구워 줍니다. 프라이팬 , 뒤집개약불', 'image_url': 'https://recipe1.ezmember.co.kr/cache/recipe/2024/03/06/44549f50a8a2a889e3603faecf3dfb791.jpg'}, {'step_number': 7, 'description': '1분 뒤 뒤집어 반대쪽도 뚜껑을 덮고 구워 주세요.', 'image_url': 'https://recipe1.ezmember.co.kr/cache/recipe/2024/03/06/fcbf8e81c5d7afe8758c6c68324812f61.jpg'}, {'step_number': 8, 'description': '뚜껑을 열고 앞 , 뒤로 한번씩 더 뒤집어가며 노릇노릇하게 구워 줍니다.', 'image_url': 'https://recipe1.ezmember.co.kr/cache/recipe/2024/03/06/38d85aad1521d2dec9fe5e32bc493b1e1.jpg'}, {'step_number': 9, 'description': '잘 구워진 오징어양배추전을 접시에 올리고 데리야끼 소스나 돈까스 소스 , 마요네즈를 뿌린 뒤 가쓰오부시를 올려 주면 오꼬노미야끼 완성입니다.접시', 'image_url': 'https://recipe1.ezmember.co.kr/cache/recipe/2024/03/06/53d0554db83c0a88affd4e21396263b31.jpg'}]"
39921,메인반찬,술안주,해물류,부침,바삭하고 매콤한 참치전 만들기 :~),참치전,110,30분 이내,아무나,3인분,"[('참치 작은거', '2캔'), ('양파', '1/2개'), ('당근', '1/4개'), ('애호박', '1/4개'), ('청양고추', '2개'), ('밀가루', '2T'), ('계란', '1개'), ('물', '100g'), ('소금', '0.5t')]",어렸을 때 친정엄마가 가끔 해주던 요리였어요 :-) 커서 해먹으니 입맛없거나 안주로 해먹기 좋더라구요. 간단하면서 느끼하지않고 야식으로 최고에요 ㅎ.ㅎ,"[{'step_number': 1, 'description': '참치전은 너무 간단해요. 양파, 당근, 애호박, 청양고추, 밀가루,참치, 물을 넣고 아이스크림 정도의 느낌으로 반죽을 해주세요 :)도마 , 조리용나이프 , 볼 , 숟가락양파 손질법', 'image_url': 'https://recipe1.ezmember.co.kr/cache/recipe/2024/04/23/861e21129a36376767ae30932edadf2f1.jpg'}, {'step_number': 2, 'description': '그리고 소금으로 간을하고 잘 섞어줍니다 ㅎ.ㅎ', 'image_url': 'https://recipe1.ezmember.co.kr/cache/recipe/2024/04/23/603854d368bc8adb8eee5b702b5751ba1.jpg'}, {'step_number': 3, 'description': '아이스크림 느낌으로 반죽이 되었으면 프라이팬에 구워줍니다 ㅎ.ㅎ프라이팬 , 뒤집개', 'image_url': 'https://recipe1.ezmember.co.kr/cache/recipe/2024/04/23/107ffad7c638a97631d794f0f1cb6a351.jpg'}, {'step_number': 4, 'description': '맛있는 참치전 완성 :-)접시', 'image_url': 'https://recipe1.ezmember.co.kr/cache/recipe/2024/04/23/e4cedb1dc9ef0b75d78715471d1ba9531.jpg'}]"
39922,메인반찬,술안주,해물류,부침,#고추요리 #새우요리 #고추새우전만들기 #탱탱하게씹히는새우고추전 #새우전,고추새우전,464,60분 이내,아무나,4인분,"[('홍고추', '3개'), ('풋고추', '7개'), ('칵테일 생새우', '200g'), ('허브솔트', '1작은술'), ('통후추', '2바퀴'), ('계란', '3개'), ('부침가루', '3큰술')]","지난번에 각종 전들을 했었을때에 고추전은 오이맛고추에 돼지고기소를 넣어서 만들었는데, 이번에는 새우를 넣어서 만들어 보았습니다. ​ 새우가 탱탱하게 씹히는 식감도 나게 큼지막하게 넣어 주고, 홍고추와 풋고추를 사용했습니다. ​ 고추의 매콤한 맛을 내기 위해서... 고추씨를 빼고는 계속해서 손이 아리더군요. 맵다라는 것이겠죠. ​ 그런데 막상 부쳐 놓으니 그리 맵지는 않았습니다. 속재료에 고추를 넣어서 만들어야 맵겠죠. 담백하면서도 새우맛이 살아 있는 새우전입니다.","[{'step_number': 1, 'description': '홍고추와 풋고추를 반으로 갈라 주고는 씨를 완전히 빼 줍니다. 그리고 위생비닐에 넣어 줍니다. 정말 매운 맛의 고추새우전을 드시고 싶으시다면 청양고추를 사용하시면 되겠죠. ^^도마 , 조리용나이프 , 스푼', 'image_url': 'https://recipe1.ezmember.co.kr/cache/recipe/2024/05/24/17d345d2f63b9a20916e94fc12e2326d1.jpg'}, {'step_number': 2, 'description': '냉동칵테일 생새우를 해동시킨 후 물기를 빼줍니다. 그리고는 너무 잘지 않게 썰어 줍니다.믹싱볼새우 손질법', 'image_url': 'https://recipe1.ezmember.co.kr/cache/recipe/2024/05/24/f33111900b6388213e85e427626a53ad1.jpg'}, {'step_number': 3, 'description': '새우에 허브솔트, 후추, 계란, 부침가루 반큰술을 넣어 줍니다. 부침가루말고, 밀가루나 전분가루도 됩니다. 고구마전분, 옥수수전분도 되고요.', 'image_url': 'https://recipe1.ezmember.co.kr/cache/recipe/2024/05/24/d3384470502fbdd2743785b3a4a274841.jpg'}, {'step_number': 4, 'description': '계속해서 한쪽 방향으로 치대면서 새우반죽을 만들어 줍니다. 그럼 계란과 새우에서 점성이 나오면서 끈적끈적해집니다. 이렇게 해야만 고추안에 넣을때에 고추따로 새우따로가 되지 않게 잘 부쳐낼 수 있습니다.위생장갑', 'image_url': 'https://recipe1.ezmember.co.kr/cache/recipe/2024/05/24/db29724d852e1afcc823787b34d9e0341.jpg'}, {'step_number': 5, 'description': '위생비닐에 넣어 두었던 고추에 부침가루 1큰술을 넣어서 입구를 잡고는 흔들어서 골고루 부침가루가 고추에 입혀지도록 해 줍니다.위생비닐', 'image_url': 'https://recipe1.ezmember.co.kr/cache/recipe/2024/05/24/50db34d85a66069ff81e43433c7ee1461.jpg'}, {'step_number': 6, 'description': '고추 안에 만들어 놓았던 새우반죽을 채워 넣어 줍니다. 몇개는 고추를 접어 주고, 남은 고추는 두개를 겹쳐 주었습니다. 혹시나, 새우가 빠져 나올까봐서요. 하지만, 전혀 나오지 않더라구요. ㅎㅎㅎㅎ쟁반', 'image_url': 'https://recipe1.ezmember.co.kr/cache/recipe/2024/05/24/17d51365263554d8fa488a342c75b9b71.jpg'}, {'step_number': 7, 'description': '그런 후에 부침가루 1큰술반을 위에 발라 줍니다. 골고루 반죽이 떨어지지 않도록!! 그런 후에 푼 계란옷을 입혀서 부쳐 주시면 됩니다.', 'image_url': 'https://recipe1.ezmember.co.kr/cache/recipe/2024/05/24/4c54d3dece71f44500e0dd5911b672921.jpg'}, {'step_number': 8, 'description': '달궈진 팬에 기름 넉넉하게 두르고는 새우가 들어간 앞쪽이 위로 가게 먼저 부쳐 줍니다. 그래야 서서히 밑면이 익으면서 자연스럽게 계란이 굳어지게 됩니다. 밑면이 다 익었다면 뒤집어 주시면 전혀 새우가 떨어져나가는 일은 없습니다. 단, 한개도 새우가 나가지 않았네요. ㅎㅎㅎ프라이팬 , 뒤집개', 'image_url': 'https://recipe1.ezmember.co.kr/cache/recipe/2024/05/24/e307741b72ba3da0d78936616a27295f1.jpg'}, {'step_number': 9, 'description': '잘 부쳐진 고추새우전입니다. 너무 길기 때문에 먹기 위애서는 잘라 주어야겠습니다.유산지', 'image_url': 'https://recipe1.ezmember.co.kr/cache/recipe/2024/05/24/c87734bbb8ae7dbd3aa93183194dd7571.jpg'}, {'step_number': 10, 'description': '긴 고추새우전을 반으로 잘라 주고 완성접시에 담아 줍니다. 고소한 전의 맛과 더불어 씹으면 씹을수록 새우가 터지는 맛이 좋습니다. 다음에는 아예 긴새우를 한마리 통으로 넣어서 부치면 더 맛있을 듯 싶었습니다. 튀기면 더 맛있겠죠. ^^ 초간장에 찍어서 드시면 좋습니다. 고추새우전 완성입니다.접시', 'image_url': 'https://recipe1.ezmember.co.kr/cache/recipe/2024/05/24/297ca2e41db8587bece0c9ed1392360a1.jpg'}, {'step_number': 11, 'description': '남은 새우반죽에 남은 계란 다 털어 넣어서 부쳐낸 새우전도 내 놓았습니다. 다진고추를 넣었다면 색감이 좋았겠죠. 하지만~~ 이건 남은 것의 처리이니까 ^^', 'image_url': 'https://recipe1.ezmember.co.kr/cache/recipe/2024/05/24/862887b01478407b7d97593c7967d9261.jpg'}]"
39923,메인반찬,술안주,해물류,부침,해물파전 (쪽파요리 해물요리 파전만들기),해물파전,257,15분 이내,중급,4인분,"[('쪽파', '30대'), ('오징어', '1마리'), ('새우', '10마리'), ('홍합', '600ml'), ('계란', '5개'), ('식용유                                                                                넉넉히', ''), ('부침가루', '200ml'), ('튀김가루', '300ml'), ('물', '400ml'), ('진간장', '3스푼'), ('식초', '0.5스푼'), ('설탕', '0.5스푼'), ('통깨', '0.5스푼')]","싱싱한 쪽파 한단에 천원 하길래 냉큼 집어 오징어와 새우, 홍합만 사서 만든 파전레시피입니다 집에서 만들어 쪽파와 해산물 듬뿍넣어 고소하니 정말 맛있습니다","[{'step_number': 1, 'description': '쪽파는 깨끗하게 다듬어 씻은 후 3등분으로 썰어준다도마 , 조리용나이프쪽파 손질법', 'image_url': 'https://recipe1.ezmember.co.kr/cache/recipe/2024/05/29/922ea5fd100afcedf5f5261ec97e3a4e1.jpg'}, {'step_number': 2, 'description': '해산물은 손질해서 새우는 등쪽으로 2등분을 해 주고 오징어는 새우와 비슷한 크기로 썰어준다오징어 손질법', 'image_url': 'https://recipe1.ezmember.co.kr/cache/recipe/2024/05/29/93b8f3fe15f9e50bb8bcd2886d96e9e91.jpg'}, {'step_number': 3, 'description': '볼에 손질한 해산물을 담고 계란 2개를 풀어 고루 섞어준다믹싱볼 , 요리젓가락', 'image_url': 'https://recipe1.ezmember.co.kr/cache/recipe/2024/05/29/778902a2b08d7abc09fea98ce6ec46481.jpg'}, {'step_number': 4, 'description': '전반죽 재료를 고루고루 섞어준다거품기', 'image_url': 'https://recipe1.ezmember.co.kr/cache/recipe/2024/05/29/c4435cd12e22ef408136dc5368e542251.jpg'}, {'step_number': 5, 'description': '중불과 센불 사이에서 팬에 식용유를 넉넉히 두르고 쪽파를 가지런히 올린 후 전반죽을 부어준다프라이팬센불 - 중불', 'image_url': 'https://recipe1.ezmember.co.kr/cache/recipe/2024/05/29/9811f86a5c0d0dace37f2d033cc8a7fe1.jpg'}, {'step_number': 6, 'description': '쪽파위에 계란에 섞어놓은 해산물을 듬뿍 올리고 계란 1개를 터트려 고루 펴 준다센불 - 중불', 'image_url': 'https://recipe1.ezmember.co.kr/cache/recipe/2024/05/29/2623a1a206b52e75165b4acbcdb4caac1.jpg'}, {'step_number': 7, 'description': '한쪽면이 모두 익은 후 뒤집어준다뒤집개센불 - 중불', 'image_url': 'https://recipe1.ezmember.co.kr/cache/recipe/2024/05/29/438e88f5848c208fc398b5b1d43a92351.jpg'}, {'step_number': 8, 'description': '앞뒤로 노릇하게 부쳐준다', 'image_url': 'https://recipe1.ezmember.co.kr/cache/recipe/2024/05/29/d8f5d50aeb63c92a2dd66be76d82c4f91.jpg'}, {'step_number': 9, 'description': '간장소스를 만들어 곁들여준다접시 , 종지', 'image_url': 'https://recipe1.ezmember.co.kr/cache/recipe/2024/05/29/ab916efd984818aae0943773f84e938b1.jpg'}]"
