index,종류별,상황별,재료별,방법별,글 제목,레시피이름,조회수,조리시간,난이도,인분,재료,소개글,조리순서
27874,메인반찬,일상,해물류,부침,달래굴전 수미네반찬 굴달래전 (달래/굴 손질법),굴달래전,999,10분 이내,아무나,2인분,"[('굴', '10개'), ('달래', '4~50뿌리'), ('밀가루', '2T'), ('달걀', '1개'), ('소금', '1꼬집'), ('들기름', '1T')]","오늘은 봄을 알리는 달래와 굴이 만난

달래굴전 입니다

​

예전에 수미네반찬에서 소개한 레시피인데요

갑자기 생각이나서

따라쟁이 했어요 ㅎㅎ","[{'step_number': 1, 'description': '굴 손질법부터 알려 드려요\n굵은소금 1T넣고\n휘휘 저어주면 이물질들이 떨어져요\n굴 손질법\n어렵지 않쥬? ㅎ\n두어 번 헹궈주고\n키친타올로 물기 제거해요\n굴 손질법 레시피', 'image_url': 'https://recipe1.ezmember.co.kr/cache/recipe/2022/03/12/62510d96b05a78e86971669f4fb840391.jpg'}, {'step_number': 2, 'description': '찬 물에 5분쯤 담궈주면\n이물질들이 떨어지는데요\n겉 껍질 부분은 벗겨주고\n뿌리쪽에 보면 딱딱한 것이 보이쥬\n이건 손톱으로 제거해요\n흐르는 물로 서너번 헹궈주면\n달래손질 끝!!\n은근 손이 많이가는.. ㅎㅎ달래 손질법 레시피', 'image_url': 'https://recipe1.ezmember.co.kr/cache/recipe/2022/03/12/3f54e43b803219aa7a0453c582108b981.jpg'}, {'step_number': 3, 'description': '달래손질 끝났으니\n달래굴전 만들 준비해야쥬\n달래 3~4뿌리를 둥글게 말아\n원 모양을 만들어 줍니다\n잔뿌리 등을 이용해 말아주니\n풀어지지 않고 잘 버텨 줍니다 ㅎ\n10개 만들었어요', 'image_url': 'https://recipe1.ezmember.co.kr/cache/recipe/2022/03/12/a0681e73efa7d4e26cdf942b17aa74291.jpg'}, {'step_number': 4, 'description': '홍고추는 1개 잘게 썰었어요\n링 썰기또는 어슷썰어서\n전 위에 올려도 됩니다', 'image_url': 'https://recipe1.ezmember.co.kr/cache/recipe/2022/03/12/ce61cc3a3a3f80108e6412a91ad7140e1.jpg'}, {'step_number': 5, 'description': '둥글게 만든 달래를\n밀가루, 달걀옷 묻혀 줍니다\n튀김가루 사용하면 달걀에 소금 안 넣어도 되는데요\n저는 밀가루를 사용해\n달걀에 소금 한 꼬집 넣었어요', 'image_url': 'https://recipe1.ezmember.co.kr/cache/recipe/2022/03/12/bff563bbeb356a29f225a5ed746c2d6a1.jpg'}, {'step_number': 6, 'description': '굴도 같은 방법으로\n옷 입혀요', 'image_url': 'https://recipe1.ezmember.co.kr/cache/recipe/2022/03/12/95183a4e6819c949d85bf49c2a15f2dc1.jpg'}, {'step_number': 7, 'description': '들기름 둘러주고\n달래부터 놓고 굴을 올려주면 됩니다\n고추도 올렸어요(사진이 없음요 ㅠ)\n약불로 구워요', 'image_url': 'https://recipe1.ezmember.co.kr/cache/recipe/2022/03/12/479eada53934264f59ff036a5652a21d1.jpg'}, {'step_number': 8, 'description': '달래도 굴도\n생으로 먹을 수 있는 것이니\n오래 굽지않아도 됩니다\n수자 두 개 사용해\n뒤집어주면 흐트러짐 없이\n깔끔하게 뒤집을 수 있어요', 'image_url': 'https://recipe1.ezmember.co.kr/cache/recipe/2022/03/12/c46246a4dc038ddaef3ad4c1132687ca1.jpg'}]"
27875,메인반찬,일상,해물류,부침,비오는 날 더 맛있는 쫀득 고소한 오징어 김치전,오징어김치전,988,30분 이내,초급,3인분,"[('신김치', '1/4포기'), ('오징어', '1개'), ('청양고추', '2개'), ('부침가루', '3컵'), ('설탕', '1티스푼'), ('맛소금', '1꼬집')]","오징어 김치전
김치 오징어전
김치부침개","[{'step_number': 1, 'description': '재료 준비', 'image_url': 'https://recipe1.ezmember.co.kr/cache/recipe/2022/03/18/01817a763b4ecf10e999577f622c52401.jpg'}, {'step_number': 2, 'description': '김치를 가위로 잘게 잘라 줍니다', 'image_url': 'https://recipe1.ezmember.co.kr/cache/recipe/2022/03/18/48510b982224985fec49ab7386c79d3a1.jpg'}, {'step_number': 3, 'description': '청양고추도 다져 넣고 오징어도 먹기 좋게 썰어 주세요', 'image_url': 'https://recipe1.ezmember.co.kr/cache/recipe/2022/03/18/a212d6ea5d67234beb93e26c43d2b1ad1.jpg'}, {'step_number': 4, 'description': '설탕 1티스푼과 소금 한 꼬집, 부침가루 3컵 물을 2.5컵을 붓고 반죽을 만들어 줍니다', 'image_url': 'https://recipe1.ezmember.co.kr/cache/recipe/2022/03/18/e9de74fd7fc88038ce1b02a0757a77d21.jpg'}, {'step_number': 5, 'description': '이제 기름을 넉넉하게 두르고 반죽을 넓게 잘 펴서~~', 'image_url': 'https://recipe1.ezmember.co.kr/cache/recipe/2022/03/18/9ab24a301869f0067327f7ec189bf58a1.jpg'}, {'step_number': 6, 'description': '앞뒤로 노릇하게 부치면 완성!!', 'image_url': 'https://recipe1.ezmember.co.kr/cache/recipe/2022/03/18/44cb61b5e9fd67f658055658bafb34231.jpg'}]"
27876,메인반찬,일상,해물류,부침,오징어 미나리전,오징어미나리전,543,30분 이내,아무나,1인분,"[('미나리', '10줄기'), ('오징어', '1마리'), ('양파', '1/2개'), ('당근', '1줌'), ('풋고추', '1큰술'), ('홍고추', '1큰술'), ('\u200b물', '1컵'), ('부침가루', '1컵'), ('멸치액젓', '2/3큰술'), ('식용유', '적당량'), ('진간장', '1큰술'), ('물', '1큰술'), ('식초', '1/2큰술'), ('레몬슬라이스', '약간'), ('미나리 줄기', '약간')]",안녕하세요? 밥심은 국력입니다. 무쇠 후라이팬은 일정한 온도를 ​ 유지시켜 주어서 ​전을 부치면 ​ 맛있는데요. ​ 제철인 미나리를 이용하여 오징어 ​ 미나리전을 만들어 볼게요. ​ 미나리는 피를 맑게 하는 청혈작용이 있답니다.,"[{'step_number': 1, 'description': '미나리는 찬물에 식초 2큰술을 넣고 10분간 담궜다가 물에 헹궈 물기를 제거헤요.', 'image_url': 'https://recipe1.ezmember.co.kr/cache/recipe/2022/03/25/ccf8974e787f2c8ab5cf9adf31b456a51.jpg'}, {'step_number': 2, 'description': '미나리는 3~4cm 길이로 썰어요.', 'image_url': 'https://recipe1.ezmember.co.kr/cache/recipe/2022/03/25/3780da84e316eef16f6691a8f4b10abc1.jpg'}, {'step_number': 3, 'description': '오징어도 3~4cm 길이로 미나리와 길이를 맞춰요.', 'image_url': 'https://recipe1.ezmember.co.kr/cache/recipe/2022/03/25/f99d9c4865391121c6fd016091d033a21.jpg'}, {'step_number': 4, 'description': '양파와 당근, 고추들도 미나리 길이로 맞춰서 썰어요.', 'image_url': 'https://recipe1.ezmember.co.kr/cache/recipe/2022/03/25/713026985b80cab21a64cb799d4626f21.jpg'}, {'step_number': 5, 'description': '볼에 자른 오징어를 넣고 끓는 물 1컵 을 부어서 오징어를 살짝 데쳐요. 이렇게 하면 오징어에서 자체수분이 나와서 전부칠 때 질어지지 않아요.', 'image_url': 'https://recipe1.ezmember.co.kr/cache/recipe/2022/03/25/fd562dd89dbb02549fc28a9dadc82dcf1.jpg'}, {'step_number': 6, 'description': '살짝 데친 오징어입니다. 냄비에 끓이지 않아서 편해요.', 'image_url': 'https://recipe1.ezmember.co.kr/cache/recipe/2022/03/25/d1e19fe2ade6746a17789f261206143a1.jpg'}, {'step_number': 7, 'description': '오징어 데친 물 1컵을 그대로 식혀요. 맹물보다는 오징어 데친 물이 훨씬 깊은 맛이 나고요. 여기에 부침가루 1컵을 동량의 비율로 넣고 거품기로 뭉침없이 풀어주세요. 멸치액젓으로 간을 해요.', 'image_url': 'https://recipe1.ezmember.co.kr/cache/recipe/2022/03/25/416d77a6d78236a3afdbafc877758cd51.jpg'}, {'step_number': 8, 'description': '야채들과 오징어를 넣고 미나리를 넣어요. 미나리가 연하기 때문에 가장 나중에 넣어주는 것이 좋지요.', 'image_url': 'https://recipe1.ezmember.co.kr/cache/recipe/2022/03/25/2fead66cb23b7bbf51af4646e74bbc4c1.jpg'}, {'step_number': 9, 'description': '반죽은 항상 물과 가루가 1:1 비율인데요. 약간 묽은 듯한 농도가 전을 얇게 부쳐주지요.', 'image_url': 'https://recipe1.ezmember.co.kr/cache/recipe/2022/03/25/0ebe8bfe92aa89eb86a8f82825db79571.jpg'}, {'step_number': 10, 'description': '주물팬을 달군 뒤 기름을 넉넉히 넣어줍니다. 전은 기름이 넉넉해야 맛있죠.', 'image_url': 'https://recipe1.ezmember.co.kr/cache/recipe/2022/03/25/1e61bbb15e5b9031171110ccb4ca74f31.jpg'}, {'step_number': 11, 'description': '노릇할 때 뒤집어 주고요. 전은 노릇해야 제맛이지요.', 'image_url': 'https://recipe1.ezmember.co.kr/cache/recipe/2022/03/25/2eb3bb26d31ec3d287e00bda5cc669ba1.jpg'}]"
27877,메인반찬,일상,해물류,부침,"오징어 부추전/ 깻잎, 미나리와 환상 조합/ 밀가루 최소한으로 바삭하게 굽기",오징어부추전,"1,003",30분 이내,초급,4인분,"[('오징어', '1마리'), ('부추', '150g'), ('깻잎', '5장'), ('미나리', '1줌'), ('양파', '1개'), ('당근', '1/4개'), ('청고추', '2개'), ('튀김가루', '240ml'), ('부침가루', '240ml'), ('물', '240ml'), ('맛술', '1T'), ('다진마늘', '1T'), ('소금', '1/3~1/2T'), ('식용유', '적당량'), ('간장', '1.5T'), ('매실청', '1T'), ('식초', '2/3T'), ('고춧가루', '1T')]","밀가루를 최대한 줄이고 튀김가루가 들어가 아주 바삭하면서도 깻잎, 미나리의 향긋함과 오징어의 조합이 너무 맛있어 손이 자꾸 가는 부침개에요.","[{'step_number': 1, 'description': '부추는 지저분한 부분 잘 정리하고 깨끗이 씻은후 4~5cm길이로 잘라 주세요.', 'image_url': 'https://recipe1.ezmember.co.kr/cache/recipe/2022/04/13/84db869711b369f49cfd649e57497f091.jpg'}, {'step_number': 2, 'description': '깻잎도 5장 겹친 후 반을 자르고 적당한 크기로 잘라요~', 'image_url': 'https://recipe1.ezmember.co.kr/cache/recipe/2022/04/13/7fdcabbde97b2aec5d196aa62ff5cd441.jpg'}, {'step_number': 3, 'description': '미나리 한줌은 3~4cm길이로 자르고', 'image_url': 'https://recipe1.ezmember.co.kr/cache/recipe/2022/04/13/1f42651c5164c9a5e233c9901c8bd3a31.jpg'}, {'step_number': 4, 'description': '양파, 당근은 각각 1cm, 0.5cm 정도의 적당한 두께로 채썰어 주시고요.', 'image_url': 'https://recipe1.ezmember.co.kr/cache/recipe/2022/04/13/8ef3c7dc146c9c6016fc8d672d5884601.jpg'}, {'step_number': 5, 'description': '청고추는 쫑쫑 썰어요. 홍고추를 넣으면 더욱 예쁜 색감이 나오겠죠~', 'image_url': 'https://recipe1.ezmember.co.kr/cache/recipe/2022/04/13/f96c569e9144077f7ef19f2ebe104a181.jpg'}, {'step_number': 6, 'description': '오징어는 내장과 뼈를 제거하여 깨끗이 손질한 후 적당한 크기로 썰어 주세요.\n오징어 손질법 레시피', 'image_url': 'https://recipe1.ezmember.co.kr/cache/recipe/2022/04/13/4d82daf5b99568fdb3f21f8a342883e11.jpg'}, {'step_number': 7, 'description': '손질해둔 야채들을 담아 놓은 큰 볼에 튀김가루, 부침가루, 물을 각각 240ml씩 넣어요~\n작은컵의 3/4컵으로 두번씩 넣으니 대략 240ml정도였네요.', 'image_url': 'https://recipe1.ezmember.co.kr/cache/recipe/2022/04/13/3dfb93914cffa1b917ca7857335532f11.jpg'}, {'step_number': 8, 'description': '맛술 1T\n다진마늘 1T\n소금 1/3~1/2T 을 넣어요.', 'image_url': 'https://recipe1.ezmember.co.kr/cache/recipe/2022/04/13/6c7edbb43e21892021ba3e5dc740d1181.jpg'}, {'step_number': 9, 'description': '양념과 재료들을 뒤적이며 잘 섞어주세요~\n부침가루가 거의 재료들을 살짝만 덧입혀 줄 정도로만 반죽되면 좋아요.', 'image_url': 'https://recipe1.ezmember.co.kr/cache/recipe/2022/04/13/3323d383773472d24fc027be7ae96eee1.jpg'}, {'step_number': 10, 'description': '팬에 기름이 흥건할 정도로 기름을 몇바퀴 돌려 주시고 중강불에서 예열한 후 반죽을 올려 주세요.\n흥건한 기름에 튀김가루가 들어가 튀기듯이 구워내면 바삭하게 구워진답니다.\n너무 두껍지도, 너무 얇지도 않게 빈공간이 보이지 않도록 해주면 좋아요.\n밀가루 반죽이 별로 없기 때문에 너무 얇게 하면 뒤집을때 찢어지기 쉬워요~\n뒤집은 후에 좀 더 얇게 펴주면 돼요.', 'image_url': 'https://recipe1.ezmember.co.kr/cache/recipe/2022/04/13/2c0bfa48cbef6d8c0679f7e61f56b9801.jpg'}, {'step_number': 11, 'description': '중불이나 중약불로 줄여가면서 익힌후 뒤집어서 뒤집개로 살짝씩 눌러주며 익혀 주세요.\n중간중간 기름은 추가해 주시고 노릇노릇하게 구워내면 돼요.', 'image_url': 'https://recipe1.ezmember.co.kr/cache/recipe/2022/04/13/a495568c8de7c53d6cb9bb674465c5171.jpg'}, {'step_number': 12, 'description': '간장소스는 간장 1.5T, 매실청 1T, 식초 2/3T, 고춧가루 1T를 넣어 만들어 주시고요.\n너무 바삭하고 맛있어요~\n특히 부추, 미나리, 깻잎, 양파의 향긋함과 달큰함이 쫄깃한 오징어와 너무 잘 어울려서 좋았어요. 향긋한 야채들 듬뿍 넣고 밀가루는 최대한 줄여서 바삭하고 맛있는 부침개 만들어 보세요^^', 'image_url': 'https://recipe1.ezmember.co.kr/cache/recipe/2022/04/13/829278210005efc0c611e0eb5264e6031.jpg'}]"
27878,메인반찬,일상,해물류,부침,"부추전 만들기 !! 홍합부추전 , 해물전~ 고소하고 맛있는 부추전",홍합부추전,320,30분 이내,초급,2인분,"[('부추', '300g'), ('홍합', '200g'), ('양파', '1/2개'), ('청량고추', '5개'), ('부침가루', '2컵'), ('물', '2.5컵'), ('소금', '조금')]",홍합 넣고 만드는 고소한 부추전!!! 비 오는 날 막걸리와 먹으면 최고의 궁합이예요~^,"[{'step_number': 1, 'description': '양파, 부추, 당근, 청양고추는 깨끗이 씻어 적당한 크기로 썰어 주세요.도마 , 조리용나이프 , 볼부추 손질법', 'image_url': 'https://recipe1.ezmember.co.kr/cache/recipe/2024/05/28/efb2e46e8c10e54ca3413e128d3e04281.jpg'}, {'step_number': 2, 'description': '깨끗이 씻은 홍합도 넣어 주세요홍합 손질법', 'image_url': 'https://recipe1.ezmember.co.kr/cache/recipe/2024/05/28/85d3d57e9e01d76b72f13011c5b8ba4b1.jpg'}, {'step_number': 3, 'description': '준비된 재료에 물 2.5컵과 부침가루 2컵, 맛소금을 조금 넣어 주세요', 'image_url': 'https://recipe1.ezmember.co.kr/cache/recipe/2024/05/28/572830a1f15eada5931f282af88f462b1.jpg'}, {'step_number': 4, 'description': '반죽을 만들어 주세요. 농도조절은 기호에 맞춰 물과 부침가루로 해 주세요요리스푼', 'image_url': 'https://recipe1.ezmember.co.kr/cache/recipe/2024/05/28/859e6e63e426bab06e26baddefd351f81.jpg'}, {'step_number': 5, 'description': '팬에 기름을 두르고 반죽해 놓은 부추전을 얇게 펴서 구워 주세요프라이팬', 'image_url': 'https://recipe1.ezmember.co.kr/cache/recipe/2024/05/28/fe97385088813437b576c84b6705be2c1.jpg'}, {'step_number': 6, 'description': '반죽을 올린 후 겉이 살짝 익으면 뒤집어 뒤집개로 눌러 얇게 펴 주세요.뒤집개', 'image_url': 'https://recipe1.ezmember.co.kr/cache/recipe/2024/05/28/610c88477a0182ba9f0cc49ae41570b21.jpg'}, {'step_number': 7, 'description': '앞뒤로 노릇노릇해지면 완성. 맛있게 드세요접시', 'image_url': 'https://recipe1.ezmember.co.kr/cache/recipe/2024/05/28/dcddcf7ba29c22d96546d1aab3a71b271.jpg'}]"
27879,메인반찬,일상,해물류,부침,동태전 만들기,동태전,102,20분 이내,아무나,4인분,"[('냉동 동태포', '1팩'), ('후추', ''), ('소금', ''), ('계란', ''), ('밀가루', ''), ('식용유', '')]",노릇노릇 맛있는 동태전!! 밥 반찬으로 정말 좋아요!!,"[{'step_number': 1, 'description': '냉동 동태포 준비해서 해동시켜요. 동태포를 찢어지지 않게 떼고 후추, 소금 솔솔 뿌려 밑간해요.쟁반', 'image_url': 'https://recipe1.ezmember.co.kr/cache/recipe/2024/06/09/222624674daaef82306b4f8438b4b4b11.jpg'}, {'step_number': 2, 'description': '계란 물과 밀가루를 준비해요. 동태포에 밀가루 골고루 묻혀요.', 'image_url': 'https://recipe1.ezmember.co.kr/cache/recipe/2024/06/09/8f898f8490eae359e263dd4163b37c721.jpg'}, {'step_number': 3, 'description': '계란 물에 담근 후 달 프라이팬에 식용유 두르고 노릇노릇 구워요.볼 , 요리젓가락', 'image_url': 'https://recipe1.ezmember.co.kr/cache/recipe/2024/06/09/75325fe88f043955f3a276a8469a84c91.jpg'}, {'step_number': 4, 'description': '강불보다는 중약불에서 노릇노릇 구워야 계란물이 타지 않고 노릇노릇 맛있게 구워져요프라이팬 , 뒤집개 , 종이호일 , 접시', 'image_url': 'https://recipe1.ezmember.co.kr/cache/recipe/2024/06/09/21964b0201238944f87d2f4ca44159821.jpg'}, {'step_number': 5, 'description': '노릇노릇 맛있는 동태전 완성!!', 'image_url': 'https://recipe1.ezmember.co.kr/cache/recipe/2024/06/09/fd684d8507d2f09273cec8154d924db21.jpg'}]"
27880,메인반찬,일상,해물류,부침,간단하고 맛있는 새우전 만들기 냉동 새우 활용 요리,새우전,774,20분 이내,아무나,1인분,"[('냉동새우', '7~8마리'), ('계란', '1개'), ('밀가루', ''), ('후추', ''), ('맛술', ''), ('쪽파', ''), ('식용유', '')]",새우를 좋아하는 제가 가장 좋아하는 새우 요리입니다.,"[{'step_number': 1, 'description': '새우 7~8마리를 해동한 후 흐르는 물에 한번 씻어 주세요. 후추 약간, 맛술 약간을 넣고 10분 정도 재워 둡니다. 밀가루나 부침가루를 살짝 묻혀 주세요.볼새우 손질법', 'image_url': 'https://recipe1.ezmember.co.kr/cache/recipe/2024/06/11/b82d7839908b9bc7c3aeb6c957c3d3361.jpg'}, {'step_number': 2, 'description': '계란 1개를 잘 풀어준 후 밀가루 묻힌 새우를 넣고 쪽파를 약간 썰어 넣어 주세요. 부추나 당근 등 알록달록하게 만들어 주셔도 좋아요.도마 , 조리용나이프 , 요리스푼', 'image_url': 'https://recipe1.ezmember.co.kr/cache/recipe/2024/06/11/8f2feeef7c8df1114853d78f7c2c4a5d1.jpg'}, {'step_number': 3, 'description': '달군 팬에 기름 두르고 새우와 계란물을 한 수저씩 떠서 올려 주세요. 약불에서 천천히 구워 주세요.프라이팬', 'image_url': 'https://recipe1.ezmember.co.kr/cache/recipe/2024/06/11/bb7fd31ea509e6e8d804922644d00ce81.jpg'}, {'step_number': 4, 'description': '뒤집어서 반대쪽도 약불에서 천천히 구워 줍니다.', 'image_url': 'https://recipe1.ezmember.co.kr/cache/recipe/2024/06/11/0be5bc3982b8b26814c909f4613d2ec51.jpg'}]"
27881,메인반찬,일상,해물류,부침,오징어요리...데쳐서 먹거나 혹은 오징어김치전으로 먹기.,None,"3,637",None,None,None,"[('새끼 오징어', '3마리'), ('수염 대파', '3개'), ('다시마', '1장'), ('무', '1공기'), ('초고추장', '적당량'), ('신김치', '1컵'), ('부침가루', '1컵'), ('달걀', '1개'), ('김치국물', '1/2컵'), ('물', '적당량'), ('오징어다리', '1.5개'), ('꼬막', '5개')]",,[]
27882,메인반찬,일상,해물류,부침,베트남 반쎄오 먹어본적은 없지만 레시피대로 흉내냈어요~,반세오,"6,536",30분 이내,아무나,2인분,"[('계란', '2개'), ('쌀가루', '1컵'), ('강황가루', '1/2큰술'), ('칵테일새우', '130g'), ('닭가슴살', '100g'), ('숙주', '100g'), ('빨강 파프리카', '조금'), ('노랑 파프리카', '조금'), ('청양고추', '1개'), ('물', '1컵'), ('올리브유', '1큰술'), ('간장', '1/2큰술'), ('생강술', '1큰술'), ('다진마늘', '1큰술'), ('참기름', '1작은술'), ('후추', '조금'), ('피쉬소스', '1큰술'), ('청양고추', '1개')]","안녕하세요~~~
오늘은 베트남 요리를 올려봅니다~~~
사실은 저도 먹어본 적은 없지만 네이버에서 찾아보고 흉내 내 보았답니다~~~
​먹어본 적이 없어서 제대로 만든 베트남 반쎄오는 어떤 맛일까?
궁금하기도 하네요~~
제가 만들어본 짝퉁 반쎄오의맛은 그런대로 맛있었답니다~~
반쎄오는 베트남식 오믈렛이라고 불리며 채소. 고기, 해산물 등 
각종 재료를 넣고 반달 모양으로 부쳐낸 음식이랍니다~~
베트남 길거리 노점에서 쉽게 맛볼 수 있는 음식이라고 하지요~~~
얼마 전에 제가 만든 계란 만두와도 비슷한 것 같네요~~~
계란 만두는 당면을 넣어서 계란으로 만든 요리인 반면에
베트남의 반쎄오는 쌀가루를 부쳐서 채소와 고기 해물 좋아하는 것을 넣어
 만들면 되는 것 같아요~~
쌀가루에 강황가루와 계란을 넣어 묽게 반죽해서 만들었는데
꼭 우리나라의 파전과 비슷한 것 같아요~~~
전 그냥 집에 있는 재료들로 만들었어요~~~
돼지고기도 넣지 않고 새우와 숙주나물 등 야채만 넣어서 만들어보았어요~~~","[{'step_number': 1, 'description': '파프리카는 채 썰어 준비했어요~~\n칵테일 새우는 살짝 데쳐서 냉동실에 두었던 것을 사용했어요~~~', 'image_url': 'https://recipe1.ezmember.co.kr/cache/recipe/2016/08/18/dfded7ce29565de917a1e477f49b19ab1.jpg'}, {'step_number': 2, 'description': '쌀가루에 물을 조금씩 부어가면서 풀어준 다음 강황가루를 넣고 \n계란 2개를 넣어 잘 섞어 놓았어요~~~', 'image_url': 'https://recipe1.ezmember.co.kr/cache/recipe/2016/08/18/ddf342c103d840e36b58d446088c18591.jpg'}, {'step_number': 3, 'description': '팬에 올리브유를 조금 둘러주고 다진 마늘을 볶다가\n데쳐놓은 칵테일새우와 닭 가슴살을 넣고 숙주와 모든 야채를 넣은 다음 \n간장을 조금 넣어 맛과 간을 해주었어요~~~\n마지막에 참기름 조금과 후추를 넣어 잘 섞어 놓았어요~~~', 'image_url': 'https://recipe1.ezmember.co.kr/cache/recipe/2016/08/18/0c477d316a42a117cc4ef1aaa768272b1.jpg'}, {'step_number': 4, 'description': '팬에 쌀가루 반죽을 넣어 노릇하게 부쳐주면서 반쯤 익었을 때 \n볶아놓은 재료를 올리고 반을 접어주었어요~~~', 'image_url': 'https://recipe1.ezmember.co.kr/cache/recipe/2016/08/18/a741c65dff7338cb5d0c8a096ef984341.jpg'}, {'step_number': 5, 'description': '반달 모양으로 한 개 만들고 한 수저씩 떠서 조그맣게 부쳐주면서 \n볶아놓은 재료들을 올려주었어요~~~', 'image_url': 'https://recipe1.ezmember.co.kr/cache/recipe/2016/08/18/0ffd0ad3a5128bfab476201341baf3741.jpg'}, {'step_number': 6, 'description': '반으로 자른 반쎄오를 나이프로 잘라준 다음 소스를 찍어 먹어도 맛있지만\n안 찍어도 간이 맞는 것 같아서 전 그냥 먹었어요~~~~', 'image_url': 'https://recipe1.ezmember.co.kr/cache/recipe/2016/08/18/7b5490d5322cab4550c5ab19ee20e10b1.jpg'}, {'step_number': 7, 'description': '아침 대용으로 한 조각만 먹어도 시장 끼는 면할 것 같아요~~\n아니 제가 많이 먹는 편이라 그렇지 양이 적은 사람은 \n아침식사 대용으로 충분할 것 같네요~~~', 'image_url': 'https://recipe1.ezmember.co.kr/cache/recipe/2016/08/18/fad454eb52ee4a9eac6ba9b30ff27d811.jpg'}, {'step_number': 8, 'description': '숙주나물의 아삭함과 닭 가슴살과 새우의 고소함이 함께 어우러져서 아주 맛있게 먹었답니다~~~\n제가 베트남 요리를 먹어본 적이 없어서 어떤 맛이 맛있는 맛인지는 모르겠으나\n그냥 요거 자체만으로 제 입엔 잘 맞는 맛이랍니다~~~', 'image_url': 'https://recipe1.ezmember.co.kr/cache/recipe/2016/08/18/89e9eda8c8ff00eb7277c8581c1295ed1.jpg'}, {'step_number': 9, 'description': '보이시지요~~숙주가 탱글탱글 아삭하네요~~~\n저 숙주를 좋아해서 조금 넉넉히 넣어주었어요~~~', 'image_url': 'https://recipe1.ezmember.co.kr/cache/recipe/2016/08/18/232a9f1a151b75284a3993e9e1fc038b1.jpg'}, {'step_number': 10, 'description': '청양고추를 넣어서 가끔 씹히는 알싸한 맛이 좋은 것 같아요~~\n다음에 만들어 먹을 때는 청양고추를 조금 더 넉넉히 넣어서 만들어봐야겠어요~~~', 'image_url': 'https://recipe1.ezmember.co.kr/cache/recipe/2016/08/18/c2717f407c2e8e1561ef0391bdc18bd31.jpg'}, {'step_number': 11, 'description': '요거 만들어 먹는다고 피시소스도 구입했답니다~~~\n피시소스의 맛을 느껴보고 싶어서 다른 어떤 것도 첨가하지 않고 청양고추만 조금 넣었어요~~~', 'image_url': 'https://recipe1.ezmember.co.kr/cache/recipe/2016/08/18/6943b9f0ff554ec2e3e05172138f65f21.jpg'}, {'step_number': 12, 'description': '아이들도 잘 먹을 수 있을 것 같아요~~\n아이들 간식으로 남편 술안주로 맛있게 먹을 수 있는 베트남의 반쎄오\n한 번도 본적도 먹은 적도 없는데 레시피 찾아서 만들어 보았기에 \n어떤 맛이 진짜인지는 잘 모르겠네요~~~', 'image_url': 'https://recipe1.ezmember.co.kr/cache/recipe/2016/08/18/0832d25760578bc82bfc7f718e7c75681.jpg'}, {'step_number': 13, 'description': '저는 집에 있는 칵테일새우를 사용했지만\n제대로 큼직한 새우를 넣으면 훨씬 고급스럽고 맛있겠더라고요~~~', 'image_url': 'https://recipe1.ezmember.co.kr/cache/recipe/2016/08/18/95a45c9be84e042991e2b7ac97f23d511.jpg'}, {'step_number': 14, 'description': '파프리카도 다른 여러 가지 채소들도 넉넉히 넣으면 씹는 식감도 좋은\n아주 맛있는 간식 겸 식사 대용이 될 것 같아요~~~\n처음 만들어본 베트남 요리\n네이버에서 찾아 따라쟁이 해보았어요~~~~\n기회 되면 베트남 반쎄오 먹으러 외식 한번 해야될것 같아요~~~\n저는 계란을 2개나 넣어서 만들었기에 더욱 고소한 맛으로 즐길 수 있었답니다~~~', 'image_url': 'https://recipe1.ezmember.co.kr/cache/recipe/2016/08/18/a01e110021b9d4248ab331432c507b7a1.jpg'}]"
