index,종류별,상황별,재료별,방법별,글 제목,레시피이름,조회수,조리시간,난이도,인분,재료,소개글,조리순서
46009,국/탕,일상,닭고기,끓이기,국물 닭볶음탕 압력솥닭볶음탕 닭도리탕 만드는법,None,154,60분 이내,초급,4인분,"[('닭볶음탕용', '1마리'), ('감자', '2개'), ('양파', '1개'), ('당근', '1/4개'), ('대파', '1대'), ('물', '2컵'), ('진간장', '2'), ('참치액', '1'), ('고추장', '2'), ('고춧가루', '1'), ('설탕', '2'), ('다진 마늘', '2'), ('다진 생강', '약간'), ('후춧가루', '약간')]",압력솥으로 조리 시 시간 단축도 되고 닭고기 살이 부드럽고 촉촉해져서 입에서 살살 녹아요. 물을 적게 넣어도 국물이 많이 줄지 않아 국물 닭볶음탕 쉽게 만들 수 있답니다. 닭볶음탕 맛도 맛이지만 저렴한 가격으로 푸짐하게 즐길 수 있다는 점도 좋아요. 국물이 있는 닭볶음탕은 소주를 좋아하시는 분들께 인기 있는 메뉴에요. 맵단짠 삼박자가 조화로워 끊임없이 술이 들어가거든요. 칼칼한 국물이랑 쫄깃한 닭고기같이 먹어주면 정말 맛있어요.,"[{'step_number': 1, 'description': '닭은 먼저 씻어주세요. 지방 함량이 높은 닭 껍질을 제거하면 칼로리(kcal)를 낮출 수 있어요. 가위나 칼을 이용하여 닭 껍질을 제거해 주세요.주방가위', 'image_url': 'https://recipe1.ezmember.co.kr/cache/recipe/2024/09/04/ff50b711d1a33a92bae889d6fe5b0b9b1.jpg'}, {'step_number': 2, 'description': '우선 냄비에 닭이 잠길 정도로 넉넉하게 물을 붓고 생강가루나 맛술 넣고 저는 초록 잎 대파를 넣었어요. 물이 끓기 시작하면 닭을 넣은 후 물이 끓을 때까지 데친 후 물에 씻어 불순물을 없애주세요.냄비', 'image_url': 'https://recipe1.ezmember.co.kr/cache/recipe/2024/09/04/e32ef806444de2bbaff83b67d5a404641.jpg'}, {'step_number': 3, 'description': '양파 감자 당근 대파 모든 재료를 알맞은 크기로 썰어주세요. 닭볶음탕에 들어가는 재료는 커야 먹음직스럽더라고요.도마 , 조리용나이프감자 손질법', 'image_url': 'https://recipe1.ezmember.co.kr/cache/recipe/2024/09/04/f34903c45fbecd1e8a974a307e1ae0bb1.jpg'}, {'step_number': 4, 'description': '국물 닭볶음탕 양념 재료인 고추장, 고춧가루 설탕, 다진 마늘, 후춧가루, 다진 생강을 모두 넣고 섞어 양념장을 만들어요.계량컵 , 스푼', 'image_url': 'https://recipe1.ezmember.co.kr/cache/recipe/2024/09/04/5aee869a99551cad99b14366fb73c4fd1.jpg'}, {'step_number': 5, 'description': '압력솥에 모든 재료를 다 넣어요. 양념이 모든 재료에 골고루 묻히게 뒤적뒤적해주세요.압력솥', 'image_url': 'https://recipe1.ezmember.co.kr/cache/recipe/2024/09/04/131b0b98397f1ba4b1f77cd1e50b038c1.jpg'}, {'step_number': 6, 'description': '물 2컵을 부어 준 후 압력솥 뚜껑을 닫고 센 불에서 끓여줍니다. 압력솥의 추가 움직이면 중불로 줄여 15분 정도 더 가열해 줍니다. 불을 끄고 20분 뜸을 들여주세요. 20분 후 추를 젖혀 김을 완전히 다 빼준 후 뚜껑을 열어요.', 'image_url': 'https://recipe1.ezmember.co.kr/cache/recipe/2024/09/04/d3a50ac120ee9f33cf2659f2758433f91.jpg'}, {'step_number': 7, 'description': '압력솥닭볶음탕 양념이 쏙쏙 배어들었어요. 닭도리탕 만드는법 완성~! 밥이랑 함께 즐겨요.', 'image_url': 'https://recipe1.ezmember.co.kr/cache/recipe/2024/09/04/6740b3ca03f294ec5ffdd05c506022a81.jpg'}]"
46010,국/탕,일상,닭고기,끓이기,None,None,None,None,None,None,[],,[]
46011,국/탕,일상,닭고기,끓이기,새콤 달콤 고소한 국물맛에 톡! 쏘는 시원한 '초계탕',초계탕,"4,330",60분 이내,아무나,3인분,"[('닭가슴살', '2쪽'), ('오이', '1개'), ('계란', '1개'), ('빨간 파프리카', '1/2개'), ('주황 파프리카', '1/2개'), ('노란 파프리카', '1/2개'), ('식초', '1작은술'), ('설탕', '1/2작은술'), ('겨자', '1/2작은술'), ('소금', '약간'), ('식초', '1작은술'), ('설탕', '1작은술'), ('소금', '약간'), ('식초', '2큰술'), ('설탕', '2큰술'), ('겨자', '1작은술'), ('소금', '1작은술')]","더운 여름에

건강도 챙기고 
맛도 챙길 수 있는 

시원한것이,
새콤 달콤 고소한~맛에
톡! 쏘는 겨자맛이 일품인

'초계탕'
만들어 볼께요.","[{'step_number': 1, 'description': '닭가슴살을 끓는 물에 넣고 삶아 건져 식힌 다음먹기 좋게 찢어 밑간에 조물조물~냉장고에 넣어둡니다.', 'image_url': 'https://recipe1.ezmember.co.kr/cache/recipe/2016/07/25/8c5a0a7b932fb72ca225119f1d1b23621.jpg'}, {'step_number': 2, 'description': '오이는 가늘게 채 썰어서 식초1작은술, 설탕1작은술 ,소금 약간에 20분 정도 절여 물기를 꼭 짜서 준비합니다. 계란지단을 가늘게 채썰어 준비합니다. 색색파프리카를 가늘게 채썰어 준비합니다. 준비된 재료들을 냉장고에 넣어 시원하게 유지합니다.', 'image_url': 'https://recipe1.ezmember.co.kr/cache/recipe/2016/07/25/b634ade5d37fa6f7e2fa7cdff05610f31.jpg'}, {'step_number': 3, 'description': '[2가지 육수만들기]닭가슴살 삶은 물을 식혀 냉장고에 넣은 후기름이 위에 굳혀지면 걷어내고면보에 걸러 맑은 육수를 받습니다. 맑은 육수 2컵에 견과류 10큰술을 넣어 고소한 육수를 만들어 냉장고에 넣고나머지 맑은 육수는 냉동실에 넣어 살얼음을 얼립니다.', 'image_url': 'https://recipe1.ezmember.co.kr/cache/recipe/2016/07/25/e4be2fe0eb0c76b65344059dd9ecbab41.jpg'}, {'step_number': 4, 'description': '[육수에 넣어 먹는 소스]식초2큰술,설탕2큰술,겨자1작은술,소금1작은술\n신맛과 단맛,짠맛등은 입맛에 맞게재료를 가감합니다.', 'image_url': None}, {'step_number': 5, 'description': '찢어놓은 닭가슴살과 채썬 색깔파프리카를 잘 섞어 그릇에 담고견과류갈은 고소한 육수과 살얼음 얼린 맑은 육수를 부어줍니다.고명으로 절궈 물기를 꽉 짠 오이채와 계란지단을 올립니다.', 'image_url': 'https://recipe1.ezmember.co.kr/cache/recipe/2016/07/25/6c6a44643c2b9c750d75f83999e2a74e1.jpg'}, {'step_number': 6, 'description': '육수에 만들어 놓은 육수 소스를 부어 간을 맞추고채썬 재료들을 함께 떠 먹습니다.', 'image_url': 'https://recipe1.ezmember.co.kr/cache/recipe/2016/07/25/b1e946d5b9eb97a8257bfebe3abfc7bd1.jpg'}]"
46012,국/탕,일상,닭고기,끓이기,무더운 여름 중복 시원한 초계탕으로 선선하게....,초계탕,"3,513",2시간 이상,초급,4인분,"[('삶아 찢은 닭고기', '330g'), ('데친 빨간 파프리카', '33g'), ('데친 노랑 파프리카', '32g'), ('데친 청피망', '30g'), ('데친친 브로콜리 대', '46g'), ('데친 무', '70g'), ('데친 얼갈이배추', '300g'), ('얼음', '400g'), ('시판용 삼계탕 재료', '1세트'), ('생닭', '1마리'), ('맛간장', '1/2국자'), ('물', '2.3L'), ('후추', '약간'), ('통깨', '1T'), ('맛간장', '1T'), ('맛술', '1T'), ('설탕', '1T'), ('양념가루', '1/2T'), ('올리고당', '1/2T'), ('땅콩버터', '2T'), ('식초', '60ml'), ('꿀', '60ml'), ('물', '80ml'), ('굵은소금', '1꼬집'), ('연겨자', '적당히')]","옛부터 초복은 물고기로 중복은 육고기로 말복은 땅에서 나는 먹거리로 보내면서 바다와 육지 모두 풍요와 풍년을 기원했다지요^^
저는 초복엔 뜨거운 추어탕을 먹었으니 중복에는 시원한 초계탕을로 열을좀 식혀야겠어요^^","[{'step_number': 1, 'description': '우선 닭고기를 위해 닭을 삼아 육수도 만들께요^^\n먼저 사만용 삼계탕 재료 1봉지를 물 2.3L에 넣고 15분정도 일단 먼저 긇여주세요^^\n물이 팔팔 끓기 시작하면 깨끗히 손질한 생닭을 넣고', 'image_url': 'https://recipe1.ezmember.co.kr/cache/recipe/2016/07/28/5f08a8ec609f8da14cae93b53cf069d11.jpg'}, {'step_number': 2, 'description': '푹~ 끓이는데요^^\n이때 발생하는거품은 최대한 깨끗히 걷어내주세요^^\n그래야 맑은 국물을 만들수 있어요^^', 'image_url': 'https://recipe1.ezmember.co.kr/cache/recipe/2016/07/28/0f7874da3a8eca98e8643556acec89861.jpg'}, {'step_number': 3, 'description': '생닭을 넣고 난후 45분을 더 삶았어요^^\n익은 닭은 건져 내고 맛간장 1/2국자를 넣고 산소끔 끓여 사진처럼 이상태에서 식혀주세요^^\n식으면 팩을 건져내고', 'image_url': 'https://recipe1.ezmember.co.kr/cache/recipe/2016/07/28/7dd63b74783bd9d790e0ffea100cfdc21.jpg'}, {'step_number': 4, 'description': '냉장고에서 장장 6시간동안 있었내요^^\n시원한 육수는 이렇게 완성이되었어요^^\n저녁에 가족이 다모이면 먹을꺼라 저는 오전에 닭을 미리 삶아 육수를 준비했어요^^', 'image_url': 'https://recipe1.ezmember.co.kr/cache/recipe/2016/07/28/0bd2d9cd02115a7f8962ae0dd22087991.jpg'}, {'step_number': 5, 'description': '사람아 찢은 닭고기 재썬 가가종 야체들 을 준비해주시구요^^...이때 무는 좀 많은듯 준비해 최대한 얇게 체처주세요^^\n무는 장을 보호하고 몸에 열을 내려주는 음식이라지요^^\n그레서 여름에 덥다고 시원한것만 찾게될때 무를 많이 먹어주면 장이 보호되서 배알이를 줄일수 있구요^^\n그리고 멈에 열이 내려 찬것을 덜 먹게 된다네요^^', 'image_url': 'https://recipe1.ezmember.co.kr/cache/recipe/2016/07/28/0f33d9a78a4180d0f864a257ca0b77931.jpg'}, {'step_number': 6, 'description': '무랑 데처 채썬 브로콜리만 빼고 나머지는\n물볶음 할꺼예요^^\n초계탕은 시원하게 깔끔히 먹는 음식이라 기름은 사용하지 않아요^^....물볶음 할때 소금을 쬐끔 넣어 복을꺼예요^^', 'image_url': 'https://recipe1.ezmember.co.kr/cache/recipe/2016/07/28/a9b2a6114659356a32e026e60e6d09b91.jpg'}, {'step_number': 7, 'description': '그리고 쌘불에서 수분만 뽀송히 날라가게 볶으시는데요^^이때 뽀인뚜 너무 익히지마세요^^\n아주 살짝 숨만 죽을정도로 볶어주시면되요^^', 'image_url': 'https://recipe1.ezmember.co.kr/cache/recipe/2016/07/28/fbdf25e0c701e147c6caf31f120c0de01.jpg'}, {'step_number': 8, 'description': '볼에 야체들과 찢어놓은 닭고기를 넣고', 'image_url': 'https://recipe1.ezmember.co.kr/cache/recipe/2016/07/28/cbef556a4c08955d044af0677fc4b8ef1.jpg'}, {'step_number': 9, 'description': '후추 통깨 맛간장 맛술 설탕 천연가루 올리고당을 넣고 \n조물 조물 무쳐주세요^^\n오로케만 해서 세러드랑 겨뜨려 먹어도 아주 땡큐예요^^', 'image_url': 'https://recipe1.ezmember.co.kr/cache/recipe/2016/07/28/1008270e43900591550130e6c5e0366c1.jpg'}, {'step_number': 10, 'description': '이제 땅콩 소스를 만들어볼게요^^\n저는 땅콩 버터를 사용했는데요^^\n땅콩 알갱이가 없는 땅콩버터라면 그냥 하셔도 좋은데요^^\n저는 알갱이가 있는 땅콩버터라 체로 알갱이를 걸러냈어요^^\n거기에 물과 식초 그리고 꿀을 레시피양만큼 넣으시고 소금 한꼬집 해서 잘 섞어주세요^^땅콩소스 완성했어요^^', 'image_url': 'https://recipe1.ezmember.co.kr/cache/recipe/2016/07/28/13ced4d2daa4cb2dfaa01ef42e205bb21.jpg'}, {'step_number': 11, 'description': '청경체를 사용하셔도 좋은데요^^\n저는 살짤 단맛이 나는 얼갈이 베추를 데처 300g 사용했어요^^\n얼갈이배추가 데쳐 졌으면 물끼를 꼭자고', 'image_url': 'https://recipe1.ezmember.co.kr/cache/recipe/2016/07/28/28552c40eb9fbbb18f347fac211e3eb21.jpg'}, {'step_number': 12, 'description': '데친 얼가리배추를 담음그릇에 돌려깔고 가운데 무친 닭고기를 놓아요^^\n그리고 얼음 400g믹서에 살아 는처럼 만들려 했지만 ㅎ.ㅎ;;\n곱게 갈리진 않더라구요^^\n그레도 눈꽃얼음이라 박박 우기면서 얼음도 돌려 담아주시구요^^', 'image_url': 'https://recipe1.ezmember.co.kr/cache/recipe/2016/07/28/97bbe71c8d316100b9cef4024fd2ad7c1.jpg'}, {'step_number': 13, 'description': '시원하게 식혀놓은 국물을 부어 완성해주시면되요^^\n어때요^^...비주얼이 아주 시원하시지요^^', 'image_url': 'https://recipe1.ezmember.co.kr/cache/recipe/2016/07/28/8bb5628d9f2dc38cf15f6ff455c048701.jpg'}, {'step_number': 14, 'description': '완성된 땅콩소스에 그냥 찍어드셔도되고 \n식성에 따라 겨자를 석얻시면 톡쏘는게 아주 좋아요^^\n저는 져자를 넣어도 먹고 그냥 도 먹었는데 전 겨자를 넣은 땅콩 소스가 더 좋네요^6', 'image_url': 'https://recipe1.ezmember.co.kr/cache/recipe/2016/07/28/39b531aa0482fdce923aa9fc83189aaa1.jpg'}, {'step_number': 15, 'description': '얼갈이배추에 달고기를 싸서 땅콩소스에 푹 찍어 한입먹고 시원한 국물을 죽~ 마시니 와후 일주일째 무더위와 열대아로 지친 제몸에 세포들이 깨어나는 느낌이더라구요^^', 'image_url': 'https://recipe1.ezmember.co.kr/cache/recipe/2016/07/28/ddb5f1ea376c1de1a060f162161f05c81.jpg'}, {'step_number': 16, 'description': '치킨은 먹어도 백숙이나 삼계탕은 안드시는 울 랑낭님은\nhttp://www.10000recipe.com/recipe/6852958\n초복때 먹고 남은 얼려놓은 추어탕을 펄펄 똑배기에 끓여 혼자 드셨다지요^^', 'image_url': 'https://recipe1.ezmember.co.kr/cache/recipe/2016/07/28/76498b80b7398914293cbedbf7d925d71.jpg'}]"
46013,국/탕,일상,닭고기,끓이기,여름 보양식 닭개장 만드는법~,None,"4,588",None,None,None,"[('닭 백숙', '1/2마리'), ('고사리', '1줌'), ('토란대', '1줌'), ('대파 흰부분', '2뿌리'), ('양파', '2개'), ('고춧가루', ''), ('국간장', ''), ('굵은소금', ''), ('들기름', ''), ('다진 마늘', '1큰술'), ('물', '')]",,[]
46014,국/탕,일상,닭고기,끓이기,#올리브쇼 오세득셰프의 닭장떡국 만들기 #소고기양지육수로 더욱 진하고 담백한 별미 떡국!!!,닭장떡국,"5,500",30분 이내,아무나,2인분,"[('닭고기장조림간장(진간장)', '1국자'), ('소고기육수', ''), ('떡국떡', ''), ('다진마늘', '1/2큰술'), ('파', ''), ('양지수육', ''), ('부추', ''), ('달걀', '1개'), ('후추', '조금')]",평양냉면을 만들고 남은 양지수육도 있고 닭고기장조림을 하고 남은 간장도 있으니 그 간장으로 만드는 떡국을 만들어 보죠!!! 아주 그럼 간단하죠. 금방되고요. 잠시만 불을 키고 끓어 오르면 후다닥 떡넣고 끓이면 끝!!,"[{'step_number': 1, 'description': '평양냉면을 만들고 남은 소고기양지 육수를 넣고 거기에 간은 올리브쇼 오세득셰프의 닭장의 간장으로 맞춰 주었습니다.그리고 양지수육도 썰어서 넣어 주고 대파도 넣어 준 후에 끓여 주세요. 양지수육이 없으시면 마트에서 파는 사골곰탕을 사용하셔도 좋아요. 그리고 닭장의 간장이 없으시면 진간장으로 대용하시면 됩니다.', 'image_url': 'https://recipe1.ezmember.co.kr/cache/recipe/2016/08/09/eb4ac4497033c738aa89b02b1f0f0a461.jpg'}, {'step_number': 2, 'description': '여기에 후추랑 다진마늘도 넣고 같이 끓여 줍니다.', 'image_url': 'https://recipe1.ezmember.co.kr/cache/recipe/2016/08/09/527687aad2f6f5cea575968ab7a400921.jpg'}, {'step_number': 3, 'description': '이제 떡국떡을 넣고 한번더 끓여 주시면 되죠!!!', 'image_url': 'https://recipe1.ezmember.co.kr/cache/recipe/2016/08/09/715b498961cc8498ae9782f6e7452aa11.jpg'}, {'step_number': 4, 'description': '기호에 따라 부추나 버섯을 넣어서 끓이셔도 좋습니다. 저는 부추가 남아 있어서 넣어주었습니다. 마지막으로~~~', 'image_url': 'https://recipe1.ezmember.co.kr/cache/recipe/2016/08/09/994c840689f963b18f3ec3f281f4f0141.jpg'}, {'step_number': 5, 'description': '부추가 살짝만 익으면 완성입니다.', 'image_url': 'https://recipe1.ezmember.co.kr/cache/recipe/2016/08/09/a67eb5a099e0ab061e2e974e2e53f6f91.jpg'}, {'step_number': 6, 'description': '불을 끄기 전에 마지막으로 달걀을 풀어서 원을 그리면서 넣어주세요. 한꺼번에 넣으면 뭉쳐질 수 있으니 조금씩 천천히 원을 그리면서 둘러가면서 넣어 주시면 됩니다. 그리고 잘 저어 주시면 닭장떡국 완성이지요!!!', 'image_url': 'https://recipe1.ezmember.co.kr/cache/recipe/2016/08/09/f58af91d30fb372dc2cc5d60a32d59271.jpg'}]"
46015,국/탕,일상,닭고기,끓이기,느끼한 속을 달래주는 매콤한~ '닭볶음탕',None,"4,901",60분 이내,아무나,3인분,"[('닭고기', '1.5kg'), ('감자', '4개'), ('양파', '1개'), ('당근', '1개'), ('파', '2대'), ('매운고추', '약간'), ('다진마늘', '1큰술'), ('설탕', '2~3큰술'), ('간장', '1국자'), ('고추가루', '2/3국자'), ('후춧가루', '약간')]","백종원 닭볶음탕 레시피는 간단하면서도 그 맛은 어찌나 맛난지요.
집집마다 입맛이 다르니 응용해서 만들면 참 맛나게 먹을 수 있는 것 같아요.
저는 설탕양과 고추가루양을 내 입맛에 맞게 조절해서 만드니 맛나게 먹을 수 있었어요.
느끼느끼한 속을 한번에 확~~ 잡아주는 매콤한 ""닭볶음탕"" 함께 만들어 볼아요^^","[{'step_number': 1, 'description': '닭은 등뼈속에 있는 이물질을 깨끗히 제거하고 씻어 냄비에 담고 물을 자박하게 넣어줍니다 (1kg 닭에 물3컵 정도)', 'image_url': 'https://recipe1.ezmember.co.kr/cache/recipe/2016/09/15/afa9a235ff355ecc637e202d314b7fad1.jpg'}, {'step_number': 2, 'description': '제일 먼저 설탕을 2~3큰술 넣어 고기에 간을 합니다.\n(백주부 레시피의 양은 3큰술인데 좀 달것 같아서 2큰술만)', 'image_url': 'https://recipe1.ezmember.co.kr/cache/recipe/2016/09/15/4053dbc6af772e1fcff42c697cea88031.jpg'}, {'step_number': 3, 'description': '닭이 어느정도 하얗게 익으면 준비한 채소들을 넣어줍니다.\n(양파,감자,당근)', 'image_url': 'https://recipe1.ezmember.co.kr/cache/recipe/2016/09/15/69f449f126764e9f3b54ae616eb38e131.jpg'}, {'step_number': 4, 'description': '한 소끔 끓으면 중불로 줄이고 \n다진마늘 한큰술을 듬뿍~ 넣어줍니다.', 'image_url': 'https://recipe1.ezmember.co.kr/cache/recipe/2016/09/15/1924c91baab616702a011bb5343b0eea1.jpg'}, {'step_number': 5, 'description': '간장 1국자를 넣습니다.\n(짜면 물을 더 넣고,싱거우면 소금으로 간을 하면 됩니다)', 'image_url': 'https://recipe1.ezmember.co.kr/cache/recipe/2016/09/15/7594e0d3c22fabc89523645f10aa57c61.jpg'}, {'step_number': 6, 'description': '고춧가루도 2/3국자 넣어줍니다.\n(매운맛은 개인의 입맛에 맞게 조절해 주세요)', 'image_url': 'https://recipe1.ezmember.co.kr/cache/recipe/2016/09/15/42164590038796256b93d4c6432f4e891.jpg'}, {'step_number': 7, 'description': '한번 더 끓으면 매운고추와 어슷썬 파를 넣고,\n후춧가루 톡톡!!!\n불을 끄고 한번 휘리릭 섞어 줍니다.', 'image_url': 'https://recipe1.ezmember.co.kr/cache/recipe/2016/09/15/e7d8e85e589d6ac4b3ad7552a9e96cf81.jpg'}, {'step_number': 8, 'description': '그릇에 담고 상에 올립니다.', 'image_url': 'https://recipe1.ezmember.co.kr/cache/recipe/2016/09/15/ebed24a8d6efdbd2b5c3b3755ca699b61.jpg'}]"
46016,국/탕,일상,닭고기,끓이기,닭개장 전골 만들기,닭개장전골,"5,704",60분 이내,초급,4인분,"[('버섯', ''), ('양파', ''), ('닭고기살', ''), ('숙주나물', ''), ('소세지', ''), ('다시마', ''), ('멸치', '적당량'), ('무우', ''), ('소금', '약간'), ('간장', '')]",냉장고를 정리할때도 되고해서 이름하여 남은음식 활용기!! 냉장고를 습격해 닭고기 전골을 만들어 먹었답니다!!,"[{'step_number': 1, 'description': '우선 다시마와 멸치로 육수 우려내주세요.', 'image_url': 'https://recipe1.ezmember.co.kr/cache/recipe/2015/09/07/39a7b0de34360c0b3f242b9f0b69b0341.jpg'}, {'step_number': 2, 'description': '육수국물에 무우를 넣어주세요.', 'image_url': 'https://recipe1.ezmember.co.kr/cache/recipe/2015/09/07/d73fa3c5b1ad4c1674c7e250e43a38051.jpg'}, {'step_number': 3, 'description': '버섯과 양파, 닭고기살, 숙주나물 그리고 닭개장 만들고 남은 고사리, 토란, 숙주 무친것을 올려줬어요. (없으시면 숙주나물까지만 올리시면 됩니다.)', 'image_url': 'https://recipe1.ezmember.co.kr/cache/recipe/2015/09/07/ab6ba64d21e4dc556b88a29dea9f56d71.jpg'}, {'step_number': 4, 'description': '그리고 소시지를 잘라 위에 얹어주세요.', 'image_url': 'https://recipe1.ezmember.co.kr/cache/recipe/2015/09/07/b3d493126269fecc18dbe4a000c2977f1.jpg'}, {'step_number': 5, 'description': '간보고 살짝 싱거우면 소금이나 간장으로 간해주시면 됩니다.', 'image_url': 'https://recipe1.ezmember.co.kr/cache/recipe/2015/09/07/8f4faa493c33db0145699f95b268df831.jpg'}]"
46017,국/탕,일상,닭고기,끓이기,쫄깃한 떡을 넣은 닭볶음탕,None,"11,024",2시간 이상,초급,4인분,"[('닭', '1마리'), ('감자', '2개'), ('당근', '1/2개'), ('양파', '1개'), ('대파', '1개'), ('고추', '2개'), ('떡', '조금'), ('고추장', '3숟가락'), ('간장', '2숟가락'), ('고추가루', '조금'), ('후추', '조금'), ('마늘', ''), ('생강가루', ''), ('요리애(물엿)', ''), ('맛술', '')]",간만에 닭도리탕을 만들어 먹었답니다 매콤한게 생각나서 정말 오랜만에 만들었더니 아이들까지 너무 잘 먹어주더라구요.,"[{'step_number': 1, 'description': '우선 전 고기에 껍질을 홀라다 다 벗겨버렸어요. 기름기 싫어해서 그냥 싹 모조리 벗기고, 깨끗하게 싯어서 뜨거운 물에 한번 행궈냈답니다. 한번 삶을까 하다가 껍질을 다 벗겨내서 그냥 뜨거운 물로 샤워만 시켜줬어요.', 'image_url': 'https://recipe1.ezmember.co.kr/cache/recipe/2015/08/11/7495360fa3be48157165a9b5e1b663351.jpg'}, {'step_number': 2, 'description': '그리고 양념장에 재워놓았어요 그러면 고기에 양념이 배여서 속까지 맛있답니다.', 'image_url': 'https://recipe1.ezmember.co.kr/cache/recipe/2015/08/11/490d683cd2d14cf185c0a5f27b8989321.jpg'}, {'step_number': 3, 'description': '그리고 야채는 먹기좋은 크기로 잘라서 준비해둔답니다.', 'image_url': 'https://recipe1.ezmember.co.kr/cache/recipe/2015/08/11/ed6947a33010b661e4cdad7eda6544f71.jpg'}, {'step_number': 4, 'description': '전 고기를 1시간정도 재워놓았답니다 냉장고에 넣어두고 2시간정도 재워두어도 좋을것같아요.', 'image_url': 'https://recipe1.ezmember.co.kr/cache/recipe/2015/08/11/151e6e5a1a177c93b63390cf6eb0343b1.jpg'}, {'step_number': 5, 'description': '이렇게 우선 닭 한마리와, 당근, 감자를 넣고 뚜껑을 닫고 보글보글 끓여준답니다. 이때 전 물을 조금 넣어주었어요. 떡을 나중에 넣으려고 물을 조금더 넣었어요.', 'image_url': 'https://recipe1.ezmember.co.kr/cache/recipe/2015/08/11/ea7e90e210a3e84a2a44abf37b50fc751.jpg'}, {'step_number': 6, 'description': '이렇게 감자와 고기가 익어가면 남은 양파와 대파와 떡을넣고 한번더 끓여준답니다.', 'image_url': 'https://recipe1.ezmember.co.kr/cache/recipe/2015/08/11/d0bddcbaffcd5ac714fd695b0aee21691.jpg'}, {'step_number': 7, 'description': '이렇게 적당하고 맛있게 익으면 간을봐서 간장이나 물엿을 더 넣어서 조리하면 된답니다.', 'image_url': 'https://recipe1.ezmember.co.kr/cache/recipe/2015/08/11/8a80f3292b906ad863ed105562f8779d1.jpg'}]"
