index,종류별,상황별,재료별,방법별,글 제목,레시피이름,조회수,조리시간,난이도,인분,재료,소개글,조리순서
26436,메인반찬,일상,채소류,무침,오가피순 오가피 나물 무침 된장양념으로 맛있게 만드는 방법 데치는법 먹는법 효능 영양성분,오가피나물무침,"1,370",None,None,None,"[('오가피순                                                                                데친', '250g'), ('쌈장', '2Ts'), ('고추장', '1Ts'), ('올리고당', '1/2Ts'), ('들기름', '2Ts'), ('마늘', '1/2Ts'), ('깨소금', '1Ts')]",오가피순 오가피 나물 무침. 된장양념으로 맛있게 만드는 방법 데치는법. 먹는법. 효능 영양성분,"[{'step_number': 1, 'description': '천일염을 좀 넣고 파랗게 살짝 7-8분 정도 데쳐서는냄비 , 조리주걱 ,', 'image_url': 'https://recipe1.ezmember.co.kr/cache/recipe/2024/04/16/ce7d842df041e11449986b62a433ff941.jpg'}, {'step_number': 2, 'description': '찬물에 물을 갈아가며 1시간 정도 담궈서 쓴물을 빼야합니다.볼', 'image_url': 'https://recipe1.ezmember.co.kr/cache/recipe/2024/04/16/4e86086c2aed18b40f188aabd8d143931.jpg'}, {'step_number': 3, 'description': '물 2번 갈고 1시간 정도 우렸어요.', 'image_url': 'https://recipe1.ezmember.co.kr/cache/recipe/2024/04/16/22030b0a165075a79beb204ef26714af1.jpg'}, {'step_number': 4, 'description': '데친 오가피순 250g, 쌈장 2Ts, 고추장 1Ts, 올리고당 1/2Ts, 들기름 ,2Ts 마늘 1/2Ts, 깨소금 1Ts', 'image_url': 'https://recipe1.ezmember.co.kr/cache/recipe/2024/04/16/378d95f4112a87e72763461e055279c41.jpg'}, {'step_number': 5, 'description': '전 먹다 남은 쌈장이 있어서 고추장과 섞어서양념했어요. 워낙에 씁쓸한 나물이라 좀 달달하게 무쳤더니 맛있네요. 쌈장이 없어서 된장으로 하실경우에는 올리고당을 좀 넣으시면 될거같애요.', 'image_url': 'https://recipe1.ezmember.co.kr/cache/recipe/2024/04/16/78bed08ffc99aa2a9df837385687994f1.jpg'}, {'step_number': 6, 'description': '나물 그닥 안좋아하는 남편이랑 한접시 후루룩 다 먹어치웠네요. 쓴맛이 오히려 입맛을 돌게 하는거 아시죠? 몸에 좋은 봄나물로 식탁을 향긋하게 만들어보세요. 그럼 여러분 저녁식사 맛있게 하시고 즐거운 주말 되세요.위생장갑 , 접시', 'image_url': 'https://recipe1.ezmember.co.kr/cache/recipe/2024/04/16/abdf9fd25b2dd05282aacb820a13e1921.jpg'}]"
26437,메인반찬,일상,채소류,무침,"환절기 호흡기에도 좋은 방풍나물 된장무침.영양성분, 보관법,음식궁합,효능",방풍나물된장무침,220,None,None,None,"[('방풍나물', '300g'), ('된장', '1Ts'), ('참치액젓', '1/2Ts'), ('들기름', '2Ts'), ('설탕', '1Ts'), ('다진파', '1Ts'), ('다진 마늘', '1Ts'), ('통깨', '')]","환절기 호흡기에도 좋은 방풍나물 된장무침.영양성분, 보관법,음식궁합,효능","[{'step_number': 1, 'description': '굵고 억센 줄기를 잘라 줍니다.볼', 'image_url': 'https://recipe1.ezmember.co.kr/cache/recipe/2024/04/16/2504ecd91c6a215ec8e1173c96455dd61.jpg'}, {'step_number': 2, 'description': '끓는 물에 소금을 넣고 3분정도 데친후 찬물로 헹궈주세요.냄비 , 요리스푼', 'image_url': 'https://recipe1.ezmember.co.kr/cache/recipe/2024/04/16/67eb6819b22805aaac12a2be28a739dc1.jpg'}, {'step_number': 3, 'description': '한줌밖에 안되네요. ㅠ채반', 'image_url': 'https://recipe1.ezmember.co.kr/cache/recipe/2024/04/16/423a113d931c08175103c1321de106f11.jpg'}, {'step_number': 4, 'description': '된장 1Ts 참치액젓 1/2 Ts 들기름 2Ts 설탕 1Ts 다진파 1Ts 다진 마늘 1Ts 통깨 약간 쌉쌀한 맛이 있어서 설탕도 약간 넣었어요. 물론 이대로 무쳐서 삭감을 살려 드셔도 되지만 전 좀 더 익힐려구요.', 'image_url': 'https://recipe1.ezmember.co.kr/cache/recipe/2024/04/16/1dd1a40ab0cc31907b480d1209f6caae1.jpg'}, {'step_number': 5, 'description': '통째를 제외한 양념을 넣고 조물조물해준 다음', 'image_url': 'https://recipe1.ezmember.co.kr/cache/recipe/2024/04/16/47e357a53b16ceca7bc44bfabecd09bd1.jpg'}, {'step_number': 6, 'description': '팬에 물 2Ts 과 함께 뚜껑 덮은채로 약한불에 익해줍니다.볶음팬 , 요리스푼', 'image_url': 'https://recipe1.ezmember.co.kr/cache/recipe/2024/04/16/7434cc82f82a14b08eee43017cf89aae1.jpg'}, {'step_number': 7, 'description': '색은 안예쁘지만 한결 부드러워졌어요. 제철은 4월이라지만 요즘 마트에 나가보면 쉽게 볼수 있고 가격도 저렴하니 환절기 호흡기에도 좋고 미세먼지 배출에도 도움이 된다는 방풍나물 된장무침 꼭 한번 드셔보세요.접시', 'image_url': 'https://recipe1.ezmember.co.kr/cache/recipe/2024/04/16/216f0e37cb38eac326d5282fe3c745ac1.jpg'}]"
26438,메인반찬,일상,채소류,무침,"브로콜리 들깨소스무침 맛있는 레시피~ 양념,영양,효능,보관법,궁합",브로콜리들깨소스무침,235,None,None,None,"[('브로콜리', '1개'), ('들기름', '2Ts'), ('참치액젓', '2Ts'), ('진간장', '1Ts'), ('올리고당', '1Ts'), ('들깨가루', '3Ts'), ('간마늘', '1Ts'), ('통깨', '')]","브로콜리 들깨소스무침 맛있는 레시피~ 양념,영양,효능,보관법,궁합","[{'step_number': 1, 'description': '길게 쪼갠후 소금 넣고 끓는 물에 데쳐서 찬물에 헹군다. 취향껏 데치는데 난 살캉할정도로만 데친다.도마 , 조리용나이프 , 냄비 , 조리주걱 , 채반브로콜리 손질법', 'image_url': 'https://recipe1.ezmember.co.kr/cache/recipe/2024/04/16/571e5e6c1976f0c867080e8c45893ae81.jpg'}, {'step_number': 2, 'description': '브로콜리 1개 들기름 2Ts 참치액젓 2Ts 진간장 1Ts 올리고당 1Ts 들깨가루 3Ts 간마늘 1Ts 통깨볼', 'image_url': 'https://recipe1.ezmember.co.kr/cache/recipe/2024/04/16/e79b1f6d744a3934ff54d3b5668b8f851.jpg'}, {'step_number': 3, 'description': '고소하고 아삭아삭 간도 딱 알맞다. 비타민 C 풍부한 브로콜리로 건강밥상~접시', 'image_url': 'https://recipe1.ezmember.co.kr/cache/recipe/2024/04/16/3b7e473360bad49e677b52a544389e5a1.jpg'}]"
26439,메인반찬,일상,채소류,무침,비타민과 칼슘이 풍부한 머위나물 고추장 무침 레시피와 다듬는 방법,머위나물고추장무침,81,30분 이내,초급,2인분,"[('머위', '133g'), ('물                                                                                데침용', '1냉면기'), ('굵은소금                                                                                데침용', '1숟가락'), ('고추장', '1숟가락'), ('다진마늘', '1티스푼'), ('참기름', '1숟가락'), ('볶은통깨', '1숟가락')]","지인에게 얻은 머위뿌리와 잎. 잎과 줄기는 봄나물반찬으로하고 뿌리는 텃밭에 옮겨 심어요. 한번 심어 두면 평생 먹을 수 있는 나물. 잎에는 비타민A, 줄기엔 칼슘이 풍부해요. 향긋하고 쌉싸름한 맛이 일품이죠.","[{'step_number': 1, 'description': '[머위 다듬는 방법] 아주 어린 순은 이물질과 시든잎을 제거 \n줄기가 큰 것은 끝부분을 잡아서 벗겨요. 안그러면 질겨요. 맨손으로 하면 까만물이 드는데 이건 시나브로 없어짐.니트릴장갑', 'image_url': 'https://recipe1.ezmember.co.kr/cache/recipe/2024/04/20/2c49f8c2146b59550831c889d7a9eb8e1.jpg'}, {'step_number': 2, 'description': '깨끗이 씻어서 소쿠리에 건져두기믹싱볼 , 채반', 'image_url': 'https://recipe1.ezmember.co.kr/cache/recipe/2024/04/20/9be207510d43f98b4c22a6f29f43a9981.jpg'}, {'step_number': 3, 'description': '[데치기] (양이 적어서 약 10~15초이지만 양이 많으면 좀 더 데쳐줍니다) 다듬을 때 미리 데칠 냄비에 물1 냉면기 부어서 끓이면 시간단축에 굿. 끓기 시작하면 굵은소금 1숟가락을 넣어 데쳐줍니다.냄비 , 조리용스푼 , 면기', 'image_url': 'https://recipe1.ezmember.co.kr/cache/recipe/2024/04/20/2206771add7cfd4ae7360de758b7014e1.jpg'}, {'step_number': 4, 'description': '찬물에 헹구기(2~3번)', 'image_url': 'https://recipe1.ezmember.co.kr/cache/recipe/2024/04/20/d31a3e02d8d99c3db61531809fac2f081.jpg'}, {'step_number': 5, 'description': '물기를 손으로 짠 후 먹기 좋은 크기로 썰어요.', 'image_url': 'https://recipe1.ezmember.co.kr/cache/recipe/2024/04/20/222d369bb30fcd2578420adcdb43ebdb1.jpg'}, {'step_number': 6, 'description': '양념 넣어 조물조물 무친 후 간 보기 순서는 상관없어요. 다진마늘 1커피용숟가락, 고추장 1숟가락, 참기름 1숟가락을 넣어 조물조물 무친 후 간을 봅니다. 된장을 넣고 싶으면 고추장과 된장 비율 1 : 1로 하시면 됨.볼 , 조리용스푼', 'image_url': 'https://recipe1.ezmember.co.kr/cache/recipe/2024/04/20/cb3425d7f69c3eaf03ff91247206d68b1.jpg'}, {'step_number': 7, 'description': '입맛에 맞으면 접시에 담아 볶은통깨 1숟가락을 뿌려서 완성.찬기', 'image_url': 'https://recipe1.ezmember.co.kr/cache/recipe/2024/04/20/439adb6f9d15fe26c4d2e1e2ab6ed2a21.jpg'}]"
26440,메인반찬,일상,채소류,무침,새콤달콤 옻순나물 레시피,옻순나물,388,30분 이내,초급,4인분,"[('옻순', '240g'), ('물                                                                                데침용', '2냉면기'), ('굵은소금                                                                                데침용', '1숟가락'), ('고추장', '2숟가락'), ('설탕', '2숟가락'), ('식초', '2숟가락'), ('다진마늘', '1숟가락'), ('통깨', '1숟가락'), ('고춧가루', '2숟가락')]",일년에 한번 맛 볼 수 있는 옻나무의 새순인 옻순으로 새콤달콤하게 나물을 했어요. 집나간 입맛을 살려주는 반찬으로 딱 좋아요. 옻의 진액에는 우루시올 성분이 있는데 이것이 알레르기를 일으키므로 알레르기 있으신분은 드시지 마세요.,"[{'step_number': 1, 'description': '다듬어 씻기 다듬는 방법 반드시 장갑을 끼고 칼로 꽁지를 싹뚝 자르면 됨. 이 때 하얀 진액이 나오며 시간이 지나면 까맣게 물이 들며, 옻 탈 수 있어요. 이것이 우루시올입니다.위생장갑 , 조리용나이프', 'image_url': 'https://recipe1.ezmember.co.kr/cache/recipe/2024/04/22/0d2917d92de59e6e3140e31f52b06ef81.jpg'}, {'step_number': 2, 'description': '깨끗이 씻어서 소쿠리에 건져두기볼 , 채반', 'image_url': 'https://recipe1.ezmember.co.kr/cache/recipe/2024/04/22/a9c8adb1c23337cb378dde407887caa51.jpg'}, {'step_number': 3, 'description': '물 2 냉면기 양을 데칠 냄비에 넣어 끓으면 굵은소금 1숟가락 투하. 다듬을 때나 씻을 때 미리 끓이면 시간단축.냄비', 'image_url': 'https://recipe1.ezmember.co.kr/cache/recipe/2024/04/22/702beade8bd2f8b2d2a10e6f1ed60d5f1.jpg'}, {'step_number': 4, 'description': '살살 뒤집어가면서 데쳐줍니다. (약 15~20초)요리스푼', 'image_url': 'https://recipe1.ezmember.co.kr/cache/recipe/2024/04/22/7ea576bb5b37c616997f822e5e774b2a1.jpg'}, {'step_number': 5, 'description': '찬물에 헹궈요(2~3번)', 'image_url': 'https://recipe1.ezmember.co.kr/cache/recipe/2024/04/22/e0bfad414ebeb4c477c74edb994b69431.jpg'}, {'step_number': 6, 'description': '물기를 손으로 짜도 되고, 야채탈수기를 이용하면 편함.야채탈수기', 'image_url': 'https://recipe1.ezmember.co.kr/cache/recipe/2024/04/22/c23654fbaa00e7217f08465ad732fe401.jpg'}, {'step_number': 7, 'description': '양념하여 무쳐서 간 보기 순서는 상관없어요. 맛의 포인트는 새콤달콤하게 (개량은 숟가락) 다진마늘 1, 고추장 2, 식초 2, 설탕 2, 고춧가루 2를 넣어 조물조물 무침. 간을 본 후 입맛에 맞게', 'image_url': 'https://recipe1.ezmember.co.kr/cache/recipe/2024/04/22/d4a100cfc9a00a45bd6b94504b0f076b1.jpg'}, {'step_number': 8, 'description': '접시나 반찬 통에 담아 통깨 뿌려 완성접시', 'image_url': 'https://recipe1.ezmember.co.kr/cache/recipe/2024/04/22/a362edf3fed68faafc54f2ed621239c31.jpg'}]"
26441,메인반찬,일상,채소류,무침,산삼 잎과 비슷한 오가피순 나물 레시피,오가피순나물,274,2시간 이상,초급,4인분,"[('오가피순                                                                                데친 후 무게', '240g'), ('물                                                                                데침용', '2냉면기'), ('굵은소금                                                                                데침용', '1숟가락'), ('다진마늘', '1숟가락'), ('맛소금', '1/2숟가락'), ('참기름', '1숟가락'), ('통깨', '1숟가락')]","지인 어머니 산에 있는 오가피 나무 가지치기 해주면서 오가피순을 얻어와서 맛소금과 다진마늘, 참기름으로 나물반찬을 했어요. 생잎 맛은 엄청 쓰고, 떫고, 약간 매운맛이 납니다. 데쳐도 다른 산나물에 비해 쓴맛이 강함. 쓴맛과 떫은 맛을 덜하기 위해 끓은 소금물에 데친 후 이틀 찬물에 우렸다 나물반찬을 했어요. 맛소금과 다진마늘, 참기름으로 맛을 내면 주식재료의 본연의 맛을 거의 느낄 수 있답니다.","[{'step_number': 1, 'description': '산삼잎과 비슷하게 생겼죠. 다듬을 때 꼭지를 칼로 자르면서 시든 잎과 이물질을 제거합니다.', 'image_url': 'https://recipe1.ezmember.co.kr/cache/recipe/2024/04/25/58687ef66d2cae46874decb4a654884d1.jpg'}, {'step_number': 2, 'description': '찬물에 이물질과 흙물이 빠지게 살살 흔들어가면서 씻어요. 소쿠리에 건져둡니다.볼 , 채반', 'image_url': 'https://recipe1.ezmember.co.kr/cache/recipe/2024/04/25/303b0848caebc641b42deed4f200a3861.jpg'}, {'step_number': 3, 'description': '큰 냄비에 물 2냉면기 부어 끓으면 굵은소금 1숟가락 넣어요.냄비', 'image_url': 'https://recipe1.ezmember.co.kr/cache/recipe/2024/04/25/784ab569da0d59420ed3eec7ad3e023b1.jpg'}, {'step_number': 4, 'description': '뒤집어 가면서 데쳐줍니다. 양에 따라 어린 순에 따라 다르지만 (약 20~30초) 데쳤어요.조리주걱', 'image_url': 'https://recipe1.ezmember.co.kr/cache/recipe/2024/04/25/f11381c8c655c2909f7deac216aec26d1.jpg'}, {'step_number': 5, 'description': '찬물에 헹궈요. 이대로 나물하면 엄청 쓰고, 떫어요.', 'image_url': 'https://recipe1.ezmember.co.kr/cache/recipe/2024/04/25/0cb51318ac11e87fdb2f93c11c6d73b01.jpg'}, {'step_number': 6, 'description': '이틀동안 전 시원한 곳에서 찬물에 우렸어요. 중간에 물을 교체해주면 쓴맛이 빨리 빠지겠죠. 전 농사일로 바빠서 시원한 곳 (뒷베란다)에 방치.', 'image_url': 'https://recipe1.ezmember.co.kr/cache/recipe/2024/04/25/16471fd8ab2b5c18a354d8e245b9d57e1.jpg'}, {'step_number': 7, 'description': '우린 것을 다시 찬물에 2번 정도 헹궈서 물기를 꼭 짬. 먹기 좋은 크기로 잘라주세요.', 'image_url': 'https://recipe1.ezmember.co.kr/cache/recipe/2024/04/25/a0dfe215db5032b89ee79135131ececf1.jpg'}, {'step_number': 8, 'description': '양념하여 무친 후 간 보기 (개량은 숟가락, 순서는 상관없어요) 다진마늘 1, 맛소금 1/2, 참기름 1을 넣어 조물조물 무친 후 간을 봅니다.위생장갑', 'image_url': 'https://recipe1.ezmember.co.kr/cache/recipe/2024/04/25/afc686eb6060590f43c101005674a0091.jpg'}, {'step_number': 9, 'description': '입맛에 맞으면 접시나 반찬통에 담아요.접시 , 반찬통', 'image_url': 'https://recipe1.ezmember.co.kr/cache/recipe/2024/04/25/f4b410ffd94d0477ecf99f30fe0c9f7c1.jpg'}, {'step_number': 10, 'description': '볶은통깨 1숟가락을 뿌려 완성.', 'image_url': 'https://recipe1.ezmember.co.kr/cache/recipe/2024/04/25/3f115ff78f39dcb40d1ebf299fdf63a91.jpg'}]"
26442,메인반찬,일상,채소류,무침,도토리묵무침 양념장 묵무침 만드는 법,도토리묵무침,"1,100",30분 이내,아무나,4인분,"[('도토리묵', '300g'), ('오이', '1/2개'), ('상추', '7~8장'), ('양파', '1개'), ('당근', '30g'), ('홍고추', '1개'), ('진간장', '3'), ('고춧가루', '2'), ('참기름', '2'), ('통깨', '1'), ('설탕', '0.5'), ('다진마늘', '0.5')]",인터넷 쇼핑몰 장보기 하던 중 도토리묵 발견! 바로 장바구니에 담았어요. 날씨가 더워지니 도토리묵 무침 해먹어야죠. 도토리의 떫은맛의 주원인인 타닌이라는 성분은 장의 경련을 진정시켜 설사를 멎게 할 뿐 아니라 니코틴과 유해성 중금속 침전물 등을 체외로 배출하고 병원균을 죽인다고 해요. 장이 약해 설사를 자주 하는 사람이라면 가끔씩 도토리묵을 먹어주면 좋을 듯해요. ​도토리묵을 맛있게 먹는 법 묵무침 만드는 법 알려드려요.,"[{'step_number': 1, 'description': '상추와 오이 홍고추는 물에 담가 놓은 후 씻어주세요.믹싱볼', 'image_url': 'https://recipe1.ezmember.co.kr/cache/recipe/2024/06/07/d52c9f1ce530316f97f15c6d40abadc01.jpg'}, {'step_number': 2, 'description': '양파랑 상추는 채 썰고 홍고추는 반으로 갈라 씨를 제거한 후 채 썰어 줍니다. 오이는 세로로 반 가르고 어슷 썰어주세요. 당근은 반달 모양으로 자르세요.도마 , 조리용나이프상추 손질법', 'image_url': 'https://recipe1.ezmember.co.kr/cache/recipe/2024/06/07/dcb417f0d4c91a83caa97b166d8ab5741.jpg'}, {'step_number': 3, 'description': '냄비에 도토리묵이 잠길 정도로 물을 충분히 넣고 끓어주세요. 물이 끓으면 도토리묵을 넣고 3~4분 정도 데쳐주세요. 냄비도토리묵을 너무 오래 데치면 도토리묵이 부서질 수 있어요. 데친 도토리묵은 찬물에 헹궈주세요.', 'image_url': 'https://recipe1.ezmember.co.kr/cache/recipe/2024/06/07/2211a94345fa9130e811b8590db990471.jpg'}, {'step_number': 4, 'description': '묵을 썰 때 칼에 물을 묻히면 묵이 칼에 달라붙지 않아 쉽게 썰 수 있어요. 일정한 모양과 두께로 묵을 썰어 줍니다.도토리묵 손질법', 'image_url': 'https://recipe1.ezmember.co.kr/cache/recipe/2024/06/07/0008fccbd1a8d22a92f1f36eeee730161.jpg'}, {'step_number': 5, 'description': '깊은 볼에 미리 준비한 야채들 상추, 양파, 당근, 오이를 넣고 한 입 크기로 썬 도토리묵도 넣어주세요. 볼 , 조리용스푼', 'image_url': 'https://recipe1.ezmember.co.kr/cache/recipe/2024/06/07/bb3db04751d71de261e4bc8462fcbf751.jpg'}, {'step_number': 6, 'description': '진간장 3스푼, 고춧가루, 참기름 2스푼씩, 통깨 1스푼, 설탕, 마늘 0.5스푼씩 그릇에 넣어요. 묵을 무칠 때는 묵이 쉽게 부서질 수 있으니 손가락 끝에 힘을 빼고 조심스럽게 뒤적이면서 무쳐주세요.', 'image_url': 'https://recipe1.ezmember.co.kr/cache/recipe/2024/06/07/3ca316d76a823487780e6a5f530b33ed1.jpg'}]"
26443,메인반찬,일상,채소류,무침,먹다보면 기분까지 좋아지는 오이품은 상추겉절이,상추겉절이,107,None,None,None,"[('상추                                                                                150g', '2줌'), ('오이', '1개'), ('홍고추', '1개'), ('대파 흰부분', '1/3대'), ('다진마늘', '1/2수저'), ('고추가루', '1/2수저'), ('참치액젓', '1수저'), ('설탕', '1/2수저'), ('참기름', '1/2수저'), ('깨소금', '1/2수저')]",먹다보면 기분까지 좋아지는 오이품은 상추겉절이,"[{'step_number': 1, 'description': '직접 재배한걸 보내다보니 연하면서 쫄깃거리는 마치 고기를 씹는것처럼 귀하디 귀한 생각이 드네요.믹싱볼상추 손질법', 'image_url': 'https://recipe1.ezmember.co.kr/cache/recipe/2024/07/01/7aca5de05bb8382b68ada44760c276201.jpg'}, {'step_number': 2, 'description': '오이 상추 겉절이 재료 상추 두줌 (150g) 오이 1개 홍고추 1개 대파 흰부분 1/3대도마 , 조리용나이프오이 손질법', 'image_url': 'https://recipe1.ezmember.co.kr/cache/recipe/2024/07/01/a594d9339ed6bf7b90f30d7807e4e8aa1.jpg'}, {'step_number': 3, 'description': '오이는 반을 갈라 속을 제거해주고요. 숟가락으로 걷어내면 쉽습니다.', 'image_url': 'https://recipe1.ezmember.co.kr/cache/recipe/2024/07/01/fc944f5da0e696036d96f807606200061.jpg'}, {'step_number': 4, 'description': '반달모양으로 얇게 썰어 주세요.', 'image_url': 'https://recipe1.ezmember.co.kr/cache/recipe/2024/07/01/6fa5b50d991a657c1c9b06e9a38ae3d11.jpg'}, {'step_number': 5, 'description': '씻어놓은 상추에 오이를 투하~~ 홍고추와 대파 썰어놓은것도 넣어줍니다.', 'image_url': 'https://recipe1.ezmember.co.kr/cache/recipe/2024/07/01/d1b13c8d23bec087cce96accd5473e061.jpg'}, {'step_number': 6, 'description': '다진마늘을 넣고 양념을 해 주는데요. 고소함이 최상이라 간 은 아주 최소만..', 'image_url': 'https://recipe1.ezmember.co.kr/cache/recipe/2024/07/01/b6a018d925dbd591908ac08811d751af1.jpg'}, {'step_number': 7, 'description': '오이 상추겉절이 양념 다진마늘 반수저 고추가루 반수저 참치액젓 1수저 설탕 반수저 참기름 반수저 깨소금 반수저 상추같이 연한재료 버무릴땐 최대한 힘을빼고 사알살~~', 'image_url': 'https://recipe1.ezmember.co.kr/cache/recipe/2024/07/01/1c93a8c3b1cc8a41c89b877063a55d111.jpg'}, {'step_number': 8, 'description': '재료가 부서지지않고 아주 잘 버무려졌네요. 일단 한점 맛보고 부족한 간 을 소금으로 합니다.', 'image_url': 'https://recipe1.ezmember.co.kr/cache/recipe/2024/07/01/f89fa72b699721931f63bae7834d33ce1.jpg'}, {'step_number': 9, 'description': '무쳐놓고 1~2분 기다리면 촉촉함이 올라오지요.', 'image_url': 'https://recipe1.ezmember.co.kr/cache/recipe/2024/07/01/a53ab07101d9f04d5c5eeebf4208d2681.jpg'}, {'step_number': 10, 'description': '이럴때 잡아와 넓다란 그릇에 담아주세요.접시', 'image_url': 'https://recipe1.ezmember.co.kr/cache/recipe/2024/07/01/24676e6d93b0e94b9cd7533328b3ac431.jpg'}, {'step_number': 11, 'description': '오늘은 고기 필요없이 걷절이 만으로도 배부르게 만들어 드릴께요.', 'image_url': 'https://recipe1.ezmember.co.kr/cache/recipe/2024/07/01/5ad93bfa3de1f0b032c4fbf21559c4271.jpg'}, {'step_number': 12, 'description': '아삭~ 아삭~~ 씹을때마다 들리는 먹음직스러운 소리가 귀를 자극하고 마음까지 사로잡아 밥 한공기 어디로 들어갔는지 간의 기별도 안가 한공기 다시퍼서 새롭게 시작하네요.', 'image_url': 'https://recipe1.ezmember.co.kr/cache/recipe/2024/07/01/2f274a4bd7329e50acbe32c6938d4aee1.jpg'}]"
